date,round,category,comment,value,clue,response,link
2001-10-16,J,PROVINCES,(Alex: You have to identify the country.),100,New Brunswick & Prince Edward Island,Canada,NA
2001-10-16,J,POCKET BILLIARDS,,100,"(Sarah of the Clue Crew kicks things off.)  As the loser of the previous game, I'm doing this to prepare for the break",racking the balls,http://www.j-archive.com/media/2001-10-16_J_16.wmv
2001-10-16,J,"SEE THE ""Z""","(Alex: Or the ""zed"".)",100,"In Britain, this edible is known as a courgette",zucchini,http://www.j-archive.com/media/2001-10-16_J_01.jpg
2001-10-16,J,FRANCIS FORD COPPOLA,,100,Francis won his first Oscar for co-writing this 1970 film biography starring George C. Scott,Patton,NA
2001-10-16,J,THE GODFATHER,,100,"For him, it was ""Goodbye Yellow Brick Road"" & hello, godfatherhood to John Lennon's son Sean",Elton John,NA
2001-10-16,J,RHINOCEROS NOW,,100,This object that projects from a rhino's nose is made from a protein called keratin,horn,NA
2001-10-16,J,PROVINCES,(Alex: You have to identify the country.),200,Krakow & Gdansk,Poland,NA
2001-10-16,J,POCKET BILLIARDS,,200,"(Sofia of the Clue Crew takes her turn.)  In this game named for a black sphere, players aim to sink either the stripes or the solids",8-ball,http://www.j-archive.com/media/2001-10-16_J_17.wmv
2001-10-16,J,"SEE THE ""Z""","(Alex: Or the ""zed"".)",200,People considered this type of ship reliable until the 1930s,Zeppelin,http://www.j-archive.com/media/2001-10-16_J_02.jpg
2001-10-16,J,FRANCIS FORD COPPOLA,,200,"This star had a heart attack & was even given last rites while making the 1979 Coppola film ""Apocalypse Now""",Martin Sheen,NA
2001-10-16,J,THE GODFATHER,,200,"Michael Jackson can leave his son, Prince Michael, ""Home Alone"" with this godfather",Macaulay Culkin,NA
2001-10-16,J,RHINOCEROS NOW,,200,"Like many health-conscious humans, rhinos have this type of diet",vegetarian,NA
2001-10-16,J,PROVINCES,(Alex: You have to identify the country.),300,Parwan & Kabul,Afghanistan,NA
2001-10-16,J,POCKET BILLIARDS,,300,(Cheryl of the Clue Crew takes her turn.)  The term for the error I just made has come to refer to any type of mistake,miscue,http://www.j-archive.com/media/2001-10-16_J_18.wmv
2001-10-16,J,"SEE THE ""Z""","(Alex: Or the ""zed"".)",300,Strummable stringed instrument seen here,zither,http://www.j-archive.com/media/2001-10-16_J_03.jpg
2001-10-16,J,FRANCIS FORD COPPOLA,,300,"Leonard Maltin said the work of this relative of Francis' was ""annoying"" in ""Peggy Sue Got Married""",Nicolas Cage,NA
2001-10-16,J,THE GODFATHER,,300,"The godfather of Madonna's son Rocco is this Police man, who left that musical force in 1984",Sting,NA
2001-10-16,J,RHINOCEROS NOW,,300,"The rhino is closely related to this animal, though we won't hear ""My kingdom for a rhino"" anytime soon",horse,NA
2001-10-16,J,PROVINCES,(Alex: You have to identify the country.),NA,Punjab & Baluchistan,Pakistan,NA
2001-10-16,J,POCKET BILLIARDS,,400,"(Jimmy of the Clue Crew takes his turn.)  John Carr, a British man, developed this spin technique in the 19th century",putting english on the ball,http://www.j-archive.com/media/2001-10-16_J_19.wmv
2001-10-16,J,"SEE THE ""Z""","(Alex: Or the ""zed"".)",400,There are about 20 species of this popular garden favorite seen here,zinnia,http://www.j-archive.com/media/2001-10-16_J_04.jpg
2001-10-16,J,FRANCIS FORD COPPOLA,,400,"If you don't know the name of this Coppola-directed 1996 Robin Williams film, then you don't know this title",Jack,NA
2001-10-16,J,THE GODFATHER,,400,"In 2001 Barry Bonds joined his godfather, this ""Say Hey Kid"" & fellow S.F. Giant, in the 500-HR club",Willie Mays,NA
2001-10-16,J,RHINOCEROS NOW,,400,"Except for the Sumatran type, rhinos don't have much of this, except at tail tips or the fringe on the ears",hair,NA
2001-10-16,J,PROVINCES,(Alex: You have to identify the country.),500,Chaco & La Pampa,Argentina,NA
2001-10-16,J,POCKET BILLIARDS,,500,"(Sarah of the Clue Crew wraps things up.)  It's the term for my supporting hand, or for a stick I could use to support the cue",bridge,http://www.j-archive.com/media/2001-10-16_J_20.wmv
2001-10-16,J,"SEE THE ""Z""","(Alex: Or the ""zed"".)",500,Married name of the 1932 multi-Olympic medal winner seen here,(Babe Didrikson) Zaharias,http://www.j-archive.com/media/2001-10-16_J_05.jpg
2001-10-16,J,FRANCIS FORD COPPOLA,,500,"In 1999 Francis produced ""The Virgin Suicides"", which marked the directorial debut of this woman, his daughter",Sofia Coppola,NA
2001-10-16,J,THE GODFATHER,,500,"Winona Ryder could've learned to ""turn on, tune in, drop out"" from him",Timothy Leary,NA
2001-10-16,J,RHINOCEROS NOW,,500,People turn into savage rhinos in this Romanian-born author's 1959 play,Eugène Ionesco,NA
2001-10-16,DJ,LITERARY TRANSLATIONS,(Alex: We want the English translation here.),200,"The haunting ""La Casa de los Espiritus""","""The House of the Spirits""",NA
2001-10-16,DJ,ARCHITECTURAL STYLES,,200,"This vertical, pointy-arched style of 12th-15th century Europe  was revived in the late 18th century",Gothic,NA
2001-10-16,DJ,A DATE WITH DISASTER,,200,"One of these costly disasters hit Northridge, California on January 17, 1994",earthquake,NA
2001-10-16,DJ,"OH, HENRY!",,200,"He's the fictional character who tutors ""My Fair Lady""",Henry Higgins,NA
2001-10-16,DJ,TV PAST & PRESENT,,200,County General Hospital provides the setting for this current NBC drama series,ER,NA
2001-10-16,DJ,PEOPLE WHO BECAME WORDS,,200,The name of this cigarette ingredient comes from the ambassador who sent tobacco to Pairs,nicotine,NA
2001-10-16,DJ,LITERARY TRANSLATIONS,(Alex: We want the English translation here.),400,"Dostoyevsky's murderous ""Prestupleniye i Nakazaniye""","""Crime and Punishment""",NA
2001-10-16,DJ,ARCHITECTURAL STYLES,,400,"The simple 18th century British style named for this queen features red brick, not her lace",Queen Anne,NA
2001-10-16,DJ,A DATE WITH DISASTER,,400,"Seen here, he shot a man in Texas, November 24, 1963",Jack Ruby,http://www.j-archive.com/media/2001-10-16_DJ_05.jpg
2001-10-16,DJ,"OH, HENRY!",,400,The father of England's King Edward VI,Henry VIII,NA
2001-10-16,DJ,TV PAST & PRESENT,,400,"(Sarah & Sofia of the Clue Crew are at an ""assembly line"".)  We're recreating a classic TV sitcom scene from 1952 featuring these 2 characters",Lucy Ricardo & Ethel Mertz,http://www.j-archive.com/media/2001-10-16_DJ_12.wmv
2001-10-16,DJ,PEOPLE WHO BECAME WORDS,,400,"This word for ""actor"" comes from the father of Greek tragedy",thespian,NA
2001-10-16,DJ,LITERARY TRANSLATIONS,(Alex: We want the English translation here.),600,"An instrument of Gunter Grass' success, ""Die Blechtrommel""","""The Tin Drum""",NA
2001-10-16,DJ,ARCHITECTURAL STYLES,,NA,"A little house in this early 20th century American ""school"" has a low-pitched roof & long horizontal lines",Prairie school,NA
2001-10-16,DJ,A DATE WITH DISASTER,,600,"Pictured here in happier times, this pair was sentenced to death on April 5, 1951",Julius & Ethel Rosenberg,http://www.j-archive.com/media/2001-10-16_DJ_06.jpg
2001-10-16,DJ,"OH, HENRY!",,600,"Trying to reconcile free & slave states in the 1800s, he was the architect of the Missouri Compromise",Henry Clay,NA
2001-10-16,DJ,TV PAST & PRESENT,,600,"Until his 1979 death, Jack Soo played Det. Nick Yemana, who made coffee for the 12th Precinct on this sitcom",Barney Miller,NA
2001-10-16,DJ,PEOPLE WHO BECAME WORDS,,600,This mat used on a plate beneath sandwiches & cakes comes from a drapery shop owner,doily,NA
2001-10-16,DJ,LITERARY TRANSLATIONS,(Alex: We want the English translation here.),800,"Camus' gripping ""La Peste""","""The Plague""",NA
2001-10-16,DJ,ARCHITECTURAL STYLES,,800,"The Byzantine style, mixing east & west, featured domes & these tall towers attached to mosques",minarets,NA
2001-10-16,DJ,A DATE WITH DISASTER,,800,"During World War II this country surrendered to Allied forces on September 8, 1943",Italy,NA
2001-10-16,DJ,"OH, HENRY!",,NA,"In 1854 this naturalist observed that much of winter is ""suggestive of an inexpressable tenderness""",Henry David Thoreau,NA
2001-10-16,DJ,TV PAST & PRESENT,,800,"In the fall of 2000, Tim Daly hit the road on an updated version of this series last seen in 1967",The Fugitive,NA
2001-10-16,DJ,PEOPLE WHO BECAME WORDS,,800,An Austrian novelist's name lives on in this tendency in which a person finds pleasure in receiving abuse,masochism,NA
2001-10-16,DJ,LITERARY TRANSLATIONS,(Alex: We want the English translation here.),1000,"The chilling tale ""Froken Smillas Fornemmelse For Sne""","""Smilla\'s Sense of Snow""",NA
2001-10-16,DJ,ARCHITECTURAL STYLES,,1000,Colonial was the American version of this style named for 4 British kings,Georgian,NA
2001-10-16,DJ,A DATE WITH DISASTER,,1000,"It was not a merry Christmas for this man on December 25, 1989; his own security forces killed him",Nicolae Ceausescu,NA
2001-10-16,DJ,"OH, HENRY!",,1000,"At the time of the Japanese attack on Pearl Harbor, this man was vice president of the U.S.",Henry Wallace,NA
2001-10-16,DJ,TV PAST & PRESENT,,1000,"Old Ebony, ridden by Chuck Connors in this western, was the grandson of Kentucky Derby winner Flying Ebony",The Rifleman,NA
2001-10-16,DJ,PEOPLE WHO BECAME WORDS,,1000,"This synonym for ""severe"" comes from a harsh Athenian lawmaker",draconian,NA
2001-10-16,FJ,USA,,NA,"Now part of a national recreation area, it was once referred to as ""Uncle Sam's Devil's Island""",Alcatraz Island,NA
