date,round,category,comment,value,clue,response,link
1999-01-29,J,ART & ARTISTS,,100,"Canaletto was noted for his vedute, or views, of this canal city, his birthplace",Venice,NA
1999-01-29,J,COLLEGE SPORTS,,100,"In 1998 the Yankees won the big league; Toms River East, N.J. the Little League; & USC the college version of this",World Series,NA
1999-01-29,J,CHOCOLATEY QUOTES,(Alex: There's something!),100,"This song begins ""Who can take a sunrise, sprinkle it with dew, cover it in chocolate and a miracle or two?""",The Candy Man,NA
1999-01-29,J,PLAYGROUND PUNCHLINES,(Alex: You'll love that one!),100,"In the original version, it's why the chicken crossed the road",To get to the other side,NA
1999-01-29,J,COUNTRIES IN FRENCH,,100,Nouvelle-Zelande,New Zealand,NA
1999-01-29,J,KELSEY GRAMMER,,100,Last name of the TV character Grammer's been playing since 1984,Crane,NA
1999-01-29,J,ART & ARTISTS,,NA,"(VIDEO DAILY DOUBLE): Sir John Everett Millais painted an 1852 portrait of this Shakespearean heroine, seen here",Ophelia,NA
1999-01-29,J,COLLEGE SPORTS,,200,Between 1975 & 1996 this midwestern school's Hawkeyes won 16 NCAA wrestling titles,Iowa,NA
1999-01-29,J,CHOCOLATEY QUOTES,(Alex: There's something!),200,Sonny the breakfast cereal spokes-bird is associated with this crazy chocolatey slogan,"""I\'m Cuckoo for Cocoa Puffs""",NA
1999-01-29,J,PLAYGROUND PUNCHLINES,(Alex: You'll love that one!),200,It's how you stop an elephant from charging,Take away his charge/credit card!,NA
1999-01-29,J,COUNTRIES IN FRENCH,,200,Les Etats-Unis,The United States,NA
1999-01-29,J,KELSEY GRAMMER,,200,"Though raised in New Jersey & Florida, Kelsey was born in this U.S. island group in the Caribbean",U.S. Virgin Islands,NA
1999-01-29,J,ART & ARTISTS,,300,"On a Saturday evening you might want to read his 1960 autobiography ""My Adventures As An Illustrator""",Norman Rockwell,NA
1999-01-29,J,COLLEGE SPORTS,,300,This Penn State legend is the only coach to win all 4 traditional bowl games,Joe Paterno,NA
1999-01-29,J,CHOCOLATEY QUOTES,(Alex: There's something!),300,"Langston Hughes described this area of NYC as a melting pot ""of honey and chocolate and caramel and rum""",Harlem,NA
1999-01-29,J,PLAYGROUND PUNCHLINES,(Alex: You'll love that one!),300,"It's what you call a 5,000 pound gorilla",Whatever he wants,NA
1999-01-29,J,COUNTRIES IN FRENCH,,300,Suede,Sweden,NA
1999-01-29,J,KELSEY GRAMMER,,300,"In 1995 Grammer hosted a TV tribute to one of his heroes, this violin-playing comedian",Jack Benny,NA
1999-01-29,J,ART & ARTISTS,,400,Gustav Klimt was a founding member & first president of this Austrian city's Sezession movement,Vienna,NA
1999-01-29,J,COLLEGE SPORTS,,400,This Duke & Detroit Pistons star won 1995's Espy Award from ESPN as Best College Hoops Performer,Grant Hill,NA
1999-01-29,J,CHOCOLATEY QUOTES,(Alex: There's something!),400,"Teddy Roosevelt served as this man's VP & said that he had ""No more backbone than a chocolate eclair""",William McKinley,NA
1999-01-29,J,PLAYGROUND PUNCHLINES,(Alex: You'll love that one!),400,It's why cows have bells,It\'s because their horns don\'t work!,NA
1999-01-29,J,COUNTRIES IN FRENCH,,400,Afrique du Sud,South Africa,NA
1999-01-29,J,KELSEY GRAMMER,,400,"On Broadway in 1982, Grammer as Cassio supported James Earl Jones in this Shakespeare play",Othello,NA
1999-01-29,J,ART & ARTISTS,,500,"The Prado boasts a fine portrait of 18th century artist Francisco Bayeu by this Spaniard, his brother-in-law",Francisco Goya,NA
1999-01-29,J,COLLEGE SPORTS,,500,"John McEnroe, Janet Evans & Tiger Woods all competed for & then left this California school",Stanford,NA
1999-01-29,J,CHOCOLATEY QUOTES,(Alex: There's something!),500,"His play ""Arms And The Man"" includes the line ""Oh, you are a very poor soldier:  a chocolate cream soldier!""",George Bernard Shaw,NA
1999-01-29,J,PLAYGROUND PUNCHLINES,(Alex: You'll love that one!),500,It's why the skeleton didn't cross the road,Because he didn\'t have the guts!,NA
1999-01-29,J,COUNTRIES IN FRENCH,,500,Allemagne,Germany,NA
1999-01-29,J,KELSEY GRAMMER,,500,"The male lead in ""Yentl"", he gave without taking when he recommended Kelsey for a part on ""Cheers""",Mandy Patinkin,NA
1999-01-29,DJ,THE FIRST CENTURY,(Alex: Remember that one?),200,"Maybe ""dynasty"" is the wrong word for this country's Hsin, which lasted about 15 years & 1 emperor",China,NA
1999-01-29,DJ,"""D""SERT",,200,"The ""holes"" from these items have been sold separately at least since the 1960s",Doughnuts,NA
1999-01-29,DJ,BOOKS & AUTHORS,,200,"""Wake Me When It's Funny"" is the autobiography of this ""Pretty Woman"" director, Penny's brother",Garry Marshall,NA
1999-01-29,DJ,HE WAS IN THAT?,,200,This 1968 thriller featured Charles Grodin as a doctor consulted by a pregnant Mia Farrow,Rosemary\'s Baby,NA
1999-01-29,DJ,CLASSICAL MUSIC,,200,You can dance with this composer,Tchaikovsky,NA
1999-01-29,DJ,ENGLISH GRAMMAR,,200,"Nouns & prepositions are called parts of this -- the tongue & lips could be, too",Speech,NA
1999-01-29,DJ,THE FIRST CENTURY,(Alex: Remember that one?),400,It's believed that this disbelieving apostle went to India & was martyred in Madras,Thomas,NA
1999-01-29,DJ,"""D""SERT",,400,A baker who put the butter in the dough instead of the dry flour created this Scandinavian pastry,Danish,NA
1999-01-29,DJ,BOOKS & AUTHORS,,400,In 1971 this Herman Wouk novel breezed up the bestseller lists,<I>The Winds Of War,NA
1999-01-29,DJ,HE WAS IN THAT?,,400,"This young hunk wasn't a star yet when he was cast in the 1955 talking mule classic ""Francis In The Navy"": ""Yeah, what the well-dressed boatswain mate wears when he impersonates an Army officer""",Clint Eastwood,NA
1999-01-29,DJ,CLASSICAL MUSIC,,400,"Famous waltz played here with ""icy"" composure",The Skater\'s Waltz,NA
1999-01-29,DJ,ENGLISH GRAMMAR,,400,"The ""main"" type of these can stand alone as a sentence; the ""subordinate"" type can't",Clause,NA
1999-01-29,DJ,THE FIRST CENTURY,(Alex: Remember that one?),600,"Mathematician Heron took flight with his formula for the area of this shape, once studied by Pythagoreans",Triangle,NA
1999-01-29,DJ,"""D""SERT",,600,This Procter & Gamble line of desserts bears the name of a restaurant critic who died in 1959,Duncan Hines,NA
1999-01-29,DJ,BOOKS & AUTHORS,,600,"1985 bestsellers had short titles; Michener's ""Texas"", Sagan's ""Contact"" & her ""Lucky"" are examples",Jackie Collins,NA
1999-01-29,DJ,HE WAS IN THAT?,,600,Daniel Day-Lewis played a young hoodlum who accosts Ben Kingsley in this 1982 epic,Gandhi,NA
1999-01-29,DJ,CLASSICAL MUSIC,,600,"""Dance"" heard here",Sabre Dance,NA
1999-01-29,DJ,ENGLISH GRAMMAR,,600,"Straightforward term for the type of ""object"" that follows a transitive verb",Direct,NA
1999-01-29,DJ,THE FIRST CENTURY,(Alex: Remember that one?),NA,"As a philosopher of this movement, Seneca met forced suicide with great calm & fortitude",Stoicism,NA
1999-01-29,DJ,"""D""SERT",,800,"The thick cream named for this English region is spread on bread or, for the health-minded, strawberries",Devonshire (for Devon),NA
1999-01-29,NA,NA,NA,NA,NA,NA,NA
1999-01-29,DJ,HE WAS IN THAT?,,800,"In one of his more ex""Zorba""tant roles, he cracked a whip at Dorothy Lamour in ""Road To Singapore""",Anthony Quinn,NA
1999-01-29,DJ,CLASSICAL MUSIC,,800,This funereal work is one of Mozart's last,Requiem,NA
1999-01-29,DJ,ENGLISH GRAMMAR,,800,"""Went"" for the verb ""go"", ""had"" for ""have"", or what we did walking through a campground",Past tense,NA
1999-01-29,DJ,THE FIRST CENTURY,(Alex: Remember that one?),1000,"In 60 A.D. this queen led her British tribe, the Iceni, in revolt against Rome",Boudicea,NA
1999-01-29,DJ,"""D""SERT",,1000,"If you want more of this curranty Scottish pudding, get off yours & take it",Duff,NA
1999-01-29,NA,NA,NA,NA,NA,NA,NA
1999-01-29,DJ,HE WAS IN THAT?,,NA,"In the 1955 hit ""Blackboard Jungle"", this future sitcom actor was billed under his real name, Jameel Farah",Jamie Farr,NA
1999-01-29,DJ,CLASSICAL MUSIC,,1000,"Saint-Saens ""Danse"" heard here",Danse Macabre,NA
1999-01-29,DJ,ENGLISH GRAMMAR,,1000,"Absolutes shouldn't be used in comparative forms, so the Constitution's ""A More"" this kind of ""Union"" is wrong",Perfect,NA
1999-01-29,FJ,ANIMALS,,NA,"This animal's name is from Bantu for ""mock man""",Chimpanzee,NA
