date,round,category,comment,value,clue,response,link
2005-01-17,J,HISTORIC WOMEN,,200,"As one of these in ancient Egypt, Peseshet was maybe the world's first woman to say, ""Turn your head & Khufu""",physician (or doctor),NA
2005-01-17,J,WORKING WITHOUT ANNETTE,,200,"Before teaming with Annette Funicello, Frankie Avalon appeared in this 1960 John Wayne western (not as Davy)",The Alamo,NA
2005-01-17,J,A PIECE OF THE FRACTION,,200,"If you give a tithe to your church, you are giving this fraction of your income",one tenth,NA
2005-01-17,J,IT HAPPENED IN THE '70s,,200,L'eggs debuted as a brand of panythose & Homestyle Eggos as a brand of these,waffles,NA
2005-01-17,J,A CATEGORY FOR THE BIRDS,,200,"Cayo Coco, a resort island off the northern coast of Cuba, is known for its flocks of these pink birds",flamingos,NA
2005-01-17,J,MISSING VOWELS,"(Alex: We will give you a clue and all of the consonants, you supply the response with the missing vowels.)",200,Cold nation: RSS,Russia,NA
2005-01-17,J,HISTORIC WOMEN,,400,"Agrippina & Nero were among those who hired Locusta, a lady professional assassain who used this method",poison,NA
2005-01-17,J,WORKING WITHOUT ANNETTE,,400,"With no help from Annette, Frankie Avalon was born in this year in which Germany invaded Poland",1939,NA
2005-01-17,J,A PIECE OF THE FRACTION,,400,"According to the Constitution, all U.S. treaties must be approved by this fraction of U.S. senators voting",two-thirds,NA
2005-01-17,J,IT HAPPENED IN THE '70s,,400,"On August 18, 1977, this sad event took place in the living room at Graceland",Elvis Presley\'s funeral service,NA
2005-01-17,J,A CATEGORY FOR THE BIRDS,,400,"Reasearchers have found brown thrashers may know 2,000 different ones of these, & marsh wrens, 200",songs (calls accepted),NA
2005-01-17,J,MISSING VOWELS,"(Alex: We will give you a clue and all of the consonants, you supply the response with the missing vowels.)",400,Arm bone: LN,ulna,NA
2005-01-17,J,HISTORIC WOMEN,,600,Former nun Catherine von Bora bore him 6 kids; at least he didn't demand 95,(Martin) Luther,NA
2005-01-17,J,WORKING WITHOUT ANNETTE,,600,"With Annette nowhere in sight, Frankie Avalon played a 39-year-old Teen Angel in this 1978 musical film",Grease,NA
2005-01-17,J,A PIECE OF THE FRACTION,,600,It's the smallest fractional increment for men's hat sizes,one-eighth,NA
2005-01-17,J,IT HAPPENED IN THE '70s,,NA,His brief 34-day reign as pope in 1978 was a week longer than a predecessor's in 1605,John Paul I,NA
2005-01-17,J,A CATEGORY FOR THE BIRDS,,600,"These creatures are broadly divided into Saurischia, ""lizard hips"", & Ornithischia, ""bird hips""",dinosaurs,NA
2005-01-17,J,MISSING VOWELS,"(Alex: We will give you a clue and all of the consonants, you supply the response with the missing vowels.)",600,Bookmarked website: MZN,Amazon,NA
2005-01-17,J,HISTORIC WOMEN,,800,"Mary McElroy, this widower's sister, acted as official White House hostess; he didn't keep Mrs. Garfield on",Chester Arthur,NA
2005-01-17,J,WORKING WITHOUT ANNETTE,,800,Annette Funicello did not do backing vocals on this 1959 Frankie Avalon hit song about a Roman goddess,"""Venus""",NA
2005-01-17,J,A PIECE OF THE FRACTION,,800,A navigator's sextant takes its name from the fact that it measures this fraction of a circle,one-sixth,NA
2005-01-17,J,IT HAPPENED IN THE '70s,,800,"When the fast food ""meal"" now called this debuted nationally in '79, it came in a circus wagon box",a Happy Meal,NA
2005-01-17,J,A CATEGORY FOR THE BIRDS,,800,Kittiwakes are a species of birds of the family Laridae that nest on the ledges of beachside cliffs,seagulls,NA
2005-01-17,J,MISSING VOWELS,"(Alex: We will give you a clue and all of the consonants, you supply the response with the missing vowels.)",800,U. S. island territory: MRCN SM,American Samoa,NA
2005-01-17,J,HISTORIC WOMEN,,1000,Katharine Hepburn won an Oscar for playing this mom of Richard the Lion-Hearted,Eleanor of Aquitaine,NA
2005-01-17,J,WORKING WITHOUT ANNETTE,,1000,"Annette Funicello was not on board when Frankie starred in this 1961 sci-fi ""voyage"" directed by Irwin Allen",Voyage to the Bottom of the Sea,NA
2005-01-17,NA,NA,NA,NA,NA,NA,NA
2005-01-17,J,IT HAPPENED IN THE '70s,,1000,(Hi.  I'm LeVar Burton.)  I starred in this 1977 landmark miniseries that inspired millions of people to research their own family trees,Roots,http://www.j-archive.com/media/2005-01-17_J_12.jpg
2005-01-17,J,A CATEGORY FOR THE BIRDS,,1000,"The last of these ""great"" birds was killed in 1844 on an island off Iceland",a great auk,NA
2005-01-17,J,MISSING VOWELS,"(Alex: We will give you a clue and all of the consonants, you supply the response with the missing vowels.)",1000,Old Testament book: MS,Amos,NA
2005-01-17,DJ,BULGARIA,,400,"Reasonably enough, the bulgur type of this is popular in Bulgaria's Eastern-influenced cuisine",wheat,NA
2005-01-17,DJ,OLD-TIME RADIO,,400,"Howard Duff became a star in ""The Adventures of"" this Dashiell Hammett ""Detective""",Sam Spade,NA
2005-01-17,DJ,"""WE"" THE PEOPLE",,400,Nightgown-clad nursery rhyme runner,Wee Willie Winkie,NA
2005-01-17,DJ,ANTONYMS,,400,"""Hither & thither"" are equivalent to this pair of antonyms that are only a ""T"" different",here & there,NA
2005-01-17,DJ,AUTHORS,,400,"Charles Dickens was laid to rest in a private ceremony on June 14, 1870 in the Poet's Corner of this church",Westminster Abbey,NA
2005-01-17,NA,NA,NA,NA,NA,NA,NA
2005-01-17,DJ,BULGARIA,,800,City that's home to the Bulgarian Academy of Sciences & the Bulgarian State Conservatory,Sofia,NA
2005-01-17,DJ,OLD-TIME RADIO,,800,"In the 1930s this city had the USA's first official radio broadcast orchestra, heard on the Ford Symphony Hour",Detroit,NA
2005-01-17,DJ,"""WE"" THE PEOPLE",,800,"This Aussie directed ""Witness"" & ""Master and Commander""",(Peter) Weir,NA
2005-01-17,DJ,ANTONYMS,,800,"This opposite of ""defy"" has fallen out of favor in many marriage vows",obey,NA
2005-01-17,DJ,AUTHORS,,800,"This ""Oz"" author was urged to write his stories by his mother-in-law, noted suffragette Matilda Gage",(L. Frank) Baum,NA
2005-01-17,NA,NA,NA,NA,NA,NA,NA
2005-01-17,DJ,BULGARIA,,1200,A party representing this political view won historic free elections in 1990; guess the people weren't tired of it,communism,NA
2005-01-17,DJ,OLD-TIME RADIO,,1200,Sgt. Preston worked for the Northwest Mounted Police; Inspector Renfrew worked for this later version,Royal Canadian Mounted Police,NA
2005-01-17,DJ,"""WE"" THE PEOPLE",,1200,"Brecht collaborator who composed ""The Threepenny Opera""",(Kurt) Weill,NA
2005-01-17,DJ,ANTONYMS,,NA,Hairdressing process that's an antonym of ephemeral,permanent,NA
2005-01-17,DJ,AUTHORS,,1200,"The Yiddish greeting for ""peace be with you"" gave Solomon Rabinowitz this pen name",Sholom Aleichem,NA
2005-01-17,NA,NA,NA,NA,NA,NA,NA
2005-01-17,DJ,BULGARIA,,1600,"Tourists flock to this sea that, unfortunately, also has a lot of pollution from industry",the Black Sea,NA
2005-01-17,DJ,OLD-TIME RADIO,,1600,"""As a bullet seeks its target, shining rails in every part of our great nation are aimed at..."" this landmark",Grand Central Station,NA
2005-01-17,DJ,"""WE"" THE PEOPLE",,1600,Clergyman biographer of our first president,Parson Weems,NA
2005-01-17,DJ,ANTONYMS,,1600,"This hearty opposite of ""frail"" also rhymes with it",hale,NA
2005-01-17,DJ,AUTHORS,,1600,"His story ""I Sing the Body Electric!"" was adapted as an episode of ""The Twilight Zone""",Ray Bradbury,NA
2005-01-17,DJ,NATIONAL SPELLING BEE WORDS,(Alex: And you must spell the word in the response.),1600,"Bury yourself (& an ancient Egyptian) in this 1981 winner from the greek for ""flesh-eating""",S-A-R-C-O-P-H-A-G-U-S,NA
2005-01-17,DJ,BULGARIA,,NA,"The first important Bulgarian novel was Ivan Vazov's ""Under the Yoke""--this empire's yoke",the Ottoman Empire,NA
2005-01-17,NA,NA,NA,NA,NA,NA,NA
2005-01-17,DJ,"""WE"" THE PEOPLE",,2000,"Familial name for the 3 witches in ""Macbeth""",the Weird Sisters,NA
2005-01-17,DJ,ANTONYMS,,2000,"It's found in a list of antonyms of ""beneficial"", & in medical texts before ""anemia""",pernicious,NA
2005-01-17,DJ,AUTHORS,,2000,"In 2004 the wreck of this author's plane was located off Marseille, near where his ""Saint-Ex"" bracelet had been found",(Antoine de) Saint-Exupéry,NA
2005-01-17,DJ,NATIONAL SPELLING BEE WORDS,(Alex: And you must spell the word in the response.),2000,This Athenian school founded by Aristotle in 335 B.C. was the last word of the 1992 competition,L-Y-C-E-U-M,NA
2005-01-17,FJ,WORLD MONARCHS,,NA,"On the throne since 1946, the king of this Asian country is the world's longest-serving living monarch",Thailand (Rama IX or King Bhumbibol Adulyadej),NA
