date,round,category,comment,value,clue,response,link
1999-02-01,J,BLACK HISTORY,(Alex: In honor of Black History Month.),100,Harry Truman ended it in the Army in 1948; the Supreme Court ended it in public schools in 1954,Segregation,NA
1999-02-01,J,MAKING A LIST,,100,"In 1995 he published a ""Book Of Top Ten Lists And Zesty Lo-Cal Chicken Recipes""",David Letterman,NA
1999-02-01,J,SCARY AUTHORS,"(Alex: I will give you titles of some of the works, you have to identify the scary author)",100,"""The Dead Zone"",""The Dark Half"",""It""",Stephen King,NA
1999-02-01,J,TELEVISION,,100,"Michael Richards won 3 Emmys for playing this ""Seinfeld"" character",Cosmo Kramer,NA
1999-02-01,J,SAINT PAUL,,100,"Born to Jewish parents in Tarsus, Saint Paul is called ""The Apostle To"" these non-Jews",Gentiles,NA
1999-02-01,J,THE QUEEN'S ENGLISH,,100,We shorten this to ad; the British shorten it to advert,Advertisement,NA
1999-02-01,J,BLACK HISTORY,(Alex: In honor of Black History Month.),200,"The black population of these U.S. areas, the destination of ""white flight"", doubled in the '70s & '80s",Suburbs,NA
1999-02-01,J,MAKING A LIST,,200,"In 1981 this duo topped the charts with ""Kiss On My List""",Hall And Oates,NA
1999-02-01,J,SCARY AUTHORS,"(Alex: I will give you titles of some of the works, you have to identify the scary author)",200,"""The Lady Of The Shroud"",""The Mystery Of The Sea"",""Dracula""",Bram Stoker,NA
1999-02-01,J,TELEVISION,,200,The producers found the name of this first mate of the S.S. Minnow in a telephone book,Gilligan,NA
1999-02-01,J,SAINT PAUL,,200,"As Saul, Saint Paul heard the voice of Jesus while on the road to this city",Damascus,NA
1999-02-01,J,THE QUEEN'S ENGLISH,,200,"A dustman doesn't put you to sleep, he collects this",Garbage,NA
1999-02-01,J,BLACK HISTORY,(Alex: In honor of Black History Month.),300,In 1829 journalist John Russwurm gave up on abolitionism & left the U.S. for this independent African nation,Liberia,NA
1999-02-01,J,MAKING A LIST,,300,"A line from this 1993 movie is ""The list is life""",Schindler\'s List,NA
1999-02-01,J,SCARY AUTHORS,"(Alex: I will give you titles of some of the works, you have to identify the scary author)",300,"""Memnoch The Devil"",""The Queen Of The Damned"",""Interview With The Vampire""",Anne Rice,NA
1999-02-01,J,TELEVISION,,300,"On an April 10, 1957 episode of his parents' sitcom, he sang ""I'm Walkin'"", his first record",Ricky Nelson,NA
1999-02-01,J,SAINT PAUL,,300,"From the Greek for ""message"", it's the name given Saint Paul's letters to Christian churches & groups",Epistles,NA
1999-02-01,J,THE QUEEN'S ENGLISH,,300,"By the British term, this would be Fun Fair Cruise Lines",Carnival Cruise Lines,NA
1999-02-01,J,BLACK HISTORY,(Alex: In honor of Black History Month.),400,"This ""conductor"" usually carried a gun, not a whistle",Harriet Tubman,NA
1999-02-01,J,MAKING A LIST,,400,"Nos. 1,3 & 77 on the Modern Library's list of the 100 best 20th c. English-language novels are this Dubliner's works",James Joyce,NA
1999-02-01,J,SCARY AUTHORS,"(Alex: I will give you titles of some of the works, you have to identify the scary author)",400,"""The Hellbound Heart"",""Rawhead Rex"",""The Books Of Blood""",Clive Barker,NA
1999-02-01,J,TELEVISION,,NA,"(VIDEO DAILY DOUBLE):""(Hi, I'm Regis Philbin)  On February 26, 1998, I was accused of killing Kathie Lee Gifford in an episode of this Dick Van Dyke series""",Diagnosis Murder,NA
1999-02-01,J,SAINT PAUL,,400,"Following his conversion, Saint Paul spent a period of reflection on this peninsula",Arabian Peninsula,NA
1999-02-01,J,THE QUEEN'S ENGLISH,,400,"In the past in London, this device has been called an ether or wireless",Radio,NA
1999-02-01,J,BLACK HISTORY,(Alex: In honor of Black History Month.),500,An Alabama city gave its name to this group of 9 youths falsely accused of rape in 1931,The Scottsboro Boys,NA
1999-02-01,J,MAKING A LIST,,500,This 1941 film topped the AFI's much-debated 1998 list of the 100 greatest American films,Citizen Kane,NA
1999-02-01,J,SCARY AUTHORS,"(Alex: I will give you titles of some of the works, you have to identify the scary author)",500,"""The Dunwich Horror"",""At The Mountain Of Madness"",""The Lurking Fear""",H.P. Lovecraft,NA
1999-02-01,J,TELEVISION,,500,"In 1992 Paul Sorvino, who played detective Phil Cerreta, left this series to sing opera",Law & Order,NA
1999-02-01,J,SAINT PAUL,,500,Saint Paul was a supportive witness to the stoning of this first Christian martyr,Saint Stephen,NA
1999-02-01,J,THE QUEEN'S ENGLISH,,500,"A chucker-out isn't a polo player, it's this job in a bar",Bouncer,NA
1999-02-01,DJ,42nd STREET,,200,"Around this organization's HQ on the East River from 42nd to 48th, watch out for double-parked diplomats",United Nations,NA
1999-02-01,DJ,SHOW BOAT,,200,"This type of ship can hold over 5,000 sailors",Aircraft carrier,NA
1999-02-01,DJ,1776,,200,This famous Moscow ballet company's roots go back to 1776,Bolshoi,NA
1999-02-01,DJ,CATS,,200,He's 9-Lives' finicky spokescat,Morris,NA
1999-02-01,DJ,BIG RIVER,,200,"You'll pass Chelsea, London & Westminster Bridges as you travel down this river",Thames,NA
1999-02-01,DJ,"""GUY""s & ""DOLL""s",,200,She was the wife of our fourth chief of state,Dolley Madison,NA
1999-02-01,DJ,42nd STREET,,400,G.K. Chesterton said that this site ablaze with ads would be paradise if only one could not read,Times Square,NA
1999-02-01,DJ,SHOW BOAT,,400,It's the specific kind of cargo ship seen here,Tanker,NA
1999-02-01,DJ,1776,,400,"Gathering at a Virginia tavern for conviviality, 5 young men formed this Greek letter fraternity, the USA's oldest",Phi Beta Kappa,NA
1999-02-01,DJ,CATS,,400,"This fun-loving feline of the funny pages shares his name with a ""Wuthering Heights"" character",Heathcliff,NA
1999-02-01,DJ,BIG RIVER,,400,"In one theory, the name of this Pennsylvania river comes from Suckahanee, ""water""",Susquehanna,NA
1999-02-01,DJ,"""GUY""s & ""DOLL""s",,400,A lump or blob of a semiliquid substance -- ice cream for example,Dollop,NA
1999-02-01,DJ,42nd STREET,,600,Park Ave. & 42nd Street has a branch of this 75th Street art museum known for its biennial,Whitney,NA
1999-02-01,DJ,SHOW BOAT,,600,This type of boat earns its name from the specific aid it gives larger ships,Tugboat,NA
1999-02-01,DJ,1776,,NA,"This Scottish economist theorized that labor, not land, is the main source of wealth",Adam Smith,NA
1999-02-01,DJ,CATS,,600,"On 1960s TV, he was the ""Wonderful, Wonderful"" cat",Felix the Cat,NA
1999-02-01,DJ,BIG RIVER,,NA,"As Germany has the Rhineland, you'd expect this country to have the ""Po-Land""",Italy,NA
1999-02-01,DJ,"""GUY""s & ""DOLL""s",,600,Cult leader Jim Jones died in this nation in 1978,Guyana,NA
1999-02-01,DJ,42nd STREET,,800,The sculpture seen here is from the 42nd Street facade of this building,Grand Central Station,NA
1999-02-01,DJ,SHOW BOAT,,800,The John A. Macdonald is this kind of ship that's useful in the most challenging climes,Icebreaker,NA
1999-02-01,DJ,1776,,800,The German title of this 1776 Von Klinger play lent its name to a literary movement headed by Goethe und Schiller,Sturm und Drang,NA
1999-02-01,DJ,CATS,,800,This freewheeling hippie-cat of underground comics was created by R. Crumb,Fritz the Cat,NA
1999-02-01,DJ,BIG RIVER,,800,"A real Crimea river, the Chernaya, runs just east of this city that was besieged in 1854 & 1855",Sevastopol,NA
1999-02-01,DJ,"""GUY""s & ""DOLL""s",,800,"It's the type of ""natural"" currency seen here",Sand dollar,NA
1999-02-01,DJ,42nd STREET,,1000,"Disney spent about $35 million refurbishing the New Amsterdam Theatre, once home to these ""follies""",Ziegfeld Follies,NA
1999-02-01,DJ,SHOW BOAT,,1000,The Princess Anne is one of these unusual water vehicles,Hovercraft,NA
1999-02-01,DJ,1776,,1000,"""First In Freedom"", this U.S. colony was first to authorize its delegates to vote for independence",North Carolina,NA
1999-02-01,DJ,CATS,,1000,archy's feline friend,mehitabel,NA
1999-02-01,DJ,BIG RIVER,,1000,The Yellow River winds across China; this one with a similar name forms most of the China-N. Korea border,Yalu,NA
1999-02-01,DJ,"""GUY""s & ""DOLL""s",,1000,"This holiday commemorates an unsuccessful attempt to blow up James I on November 5, 1605",Guy Fawkes Day,NA
1999-02-01,FJ,SPORTS,,NA,"On Jan. 15, 1892 the first rules for this sport were published in the Triangle, the Springfield, Mass. YMCA newspaper",Basketball,NA
