date,round,category,comment,value,clue,response,link
2002-05-17,J,NEW ENGLAND,,200,Hartford & Bridgeport are important cities in this state,Connecticut,NA
2002-05-17,J,MY PERSONAL DIGITAL ASSISTANT,,200,"To do list... oh yeah, pick up my clothes from this establishment that uses perchloroethylene",dry cleaner,NA
2002-05-17,J,LANGUAGES,,200,"""Hauoli makahiki hou"" means ""happy new year"" in this language of the Pacific",Hawaiian,NA
2002-05-17,J,RELIGION,,200,One who has memorized the complete text of this Muslim holy book is known as a hafiz,Koran,NA
2002-05-17,J,JOE-PARDY!,,200,"In 1975's ""Thrilla in Manila"" Muhammad Ali defeated him",Joe Frazier,NA
2002-05-17,J,"""EEL"" OF FORTUNE",,200,Fruit skin,peel,NA
2002-05-17,J,NEW ENGLAND,,400,In 1670 Dorothy Jones received the first license to sell coffee in this current state capital,Boston,NA
2002-05-17,J,MY PERSONAL DIGITAL ASSISTANT,,400,"The calculator shows that with interest rates down, I ought to do this to lower my monthly mortgage payments",refinance,NA
2002-05-17,J,LANGUAGES,,400,(Sarah of the Clue Crew demonstrates with her ring finger and middle finger bent down to her palm.)  It's the three-word phrase expressed here in American Sign Language,I love you,http://www.j-archive.com/media/2002-05-17_J_07a.jpg
2002-05-17,J,RELIGION,,400,"Traditional marriages in this religion occur under a huppa, a canopy that symbolizes union of bride & groom",Judaism,NA
2002-05-17,J,JOE-PARDY!,,400,"Seen here, he first hit the trenches in 1964",G.I. Joe,http://www.j-archive.com/media/2002-05-17_J_22.jpg
2002-05-17,J,"""EEL"" OF FORTUNE",,400,Bread end,heel,NA
2002-05-17,J,NEW ENGLAND,,600,"The official name of this state includes the phrase ""and Providence Plantations""",Rhode Island,NA
2002-05-17,J,MY PERSONAL DIGITAL ASSISTANT,,600,"Let's check the date book--got a 10:30 game of this, developed around 1950 as a cross between squash & handball",racquetball,NA
2002-05-17,J,LANGUAGES,,600,"Languages from this country include Assamese, Gujurati & Punjabi",India,NA
2002-05-17,J,RELIGION,,600,"From 1512 to 1546, this leader of the Reformation taught theology at Wittenberg University",Martin Luther,NA
2002-05-17,J,JOE-PARDY!,,600,Legendary Joe Paterno has coached this school's football team for 36 years,Penn State,NA
2002-05-17,J,"""EEL"" OF FORTUNE",,600,Boat bottom,keel,NA
2002-05-17,J,NEW ENGLAND,,800,"Nicknamed ""The Pine Tree State"", it became the 23rd state in 1820 after separating from Massachusetts",Maine,NA
2002-05-17,J,MY PERSONAL DIGITAL ASSISTANT,,800,I'll use my 3-hour stopover to email my travel agent not to route me through this busiest NYC airport,JFK,NA
2002-05-17,J,LANGUAGES,,800,"""Obrigado"" means thank you in this Iberian language spoken by about 190 million people worldwide",Portuguese,NA
2002-05-17,J,RELIGION,,800,"According to Buddhist belief, people who attain this, literally ""extinction"", have perfect peace & blessedness",nirvana,NA
2002-05-17,J,JOE-PARDY!,,800,"He teamed with William Hanna to produce ""The Flintsones""",Joe Barbera,NA
2002-05-17,J,"""EEL"" OF FORTUNE",,800,Fishing line holder,reel,NA
2002-05-17,J,NEW ENGLAND,,1000,"These ""colorful"" mountains in New Hampshire are named for their snow-capped peaks",White Mountains,NA
2002-05-17,J,MY PERSONAL DIGITAL ASSISTANT,,1000,"The world clock reads noon in L.A., so I can catch Geoff at 8 a.m. tomorrow in this New Zealand capital",Wellington,NA
2002-05-17,J,LANGUAGES,,NA,It's the only Central American country with English as an official language,Belize,NA
2002-05-17,J,RELIGION,,1000,"We know this Chinese philosopher by his Latinized name, which means ""great master Kong""",Confucius,NA
2002-05-17,J,JOE-PARDY!,,1000,"In a 1979 film Meryl Streep seduces fallen politician Alan Alda in ""The Seduction of"" this man",Joe Tynan,NA
2002-05-17,J,"""EEL"" OF FORTUNE",,1000,Iron alloy,steel,NA
2002-05-17,DJ,THE 20th CENTURY,,400,"In 1947 George Raft starred in ""Intrigue"" & Thor Heyerdahl intrigued the world with this raft",Kon-Tiki,NA
2002-05-17,DJ,THE TV VAULT,,400,This show that featured a dingbat debuted in 1971,All in the Family,NA
2002-05-17,DJ,CAPITAL CITY BIRTHPLACES,,400,Hideki Tojo,Tokyo,NA
2002-05-17,DJ,JUST TO THE RIGHT,,400,"During a Carnac sketch, he was usually on Carnac's right",Ed McMahon,NA
2002-05-17,DJ,EUROPEAN ART,,400,"Seen here, Dieric Bouts' version of this event was painted about 30 years before Leonardo's",the Last Supper,http://www.j-archive.com/media/2002-05-17_DJ_05.jpg
2002-05-17,DJ,"TELL ME ""Y""",,400,In 2001 this university celebrated its 300th anniversary,Yale,NA
2002-05-17,DJ,THE 20th CENTURY,,800,At the start of the 20th century Indonesia was under this country's rule,the Netherlands,NA
2002-05-17,DJ,THE TV VAULT,,800,"It's the TV show that gave the world the classic catchphrase ""Da plane! Da plane!""",Fantasy Island,NA
2002-05-17,DJ,CAPITAL CITY BIRTHPLACES,,800,"Albert Gore, Jr.","Washington, D.C.",NA
2002-05-17,DJ,JUST TO THE RIGHT,,800,In the zodiac look to the right of the weapon-wielding Sagittarius to find this creature,Scorpio,NA
2002-05-17,DJ,EUROPEAN ART,,800,"In the 1400s this cloth surface became popular with painters in Venice, where the dampness peeled paint off walls",canvas,NA
2002-05-17,DJ,"TELL ME ""Y""",,800,It contains 2 types of bacteria: Streptococcus thermophilus & Lactobacillus bulgaricus; & we acutally eat it!,yogurt,NA
2002-05-17,DJ,THE 20th CENTURY,,1200,Nickname given the quintet of senators associated with the 1980s saving & loan scandal,Keating Five,NA
2002-05-17,DJ,THE TV VAULT,,1200,Heather Locklear played police captain's daughter Stacy Sheridan on this series,T.J. Hooker,NA
2002-05-17,DJ,CAPITAL CITY BIRTHPLACES,,1200,Juan Gris,Madrid,NA
2002-05-17,DJ,JUST TO THE RIGHT,,1200,"At the start of a chess game, it's your piece just to the right of the white king",bishop,NA
2002-05-17,DJ,EUROPEAN ART,,1200,A main cause of the early 20th c. Dadaist movement was artists being bummed out about this 4-year-long event,World War I,NA
2002-05-17,DJ,"TELL ME ""Y""",,1200,"In China it's also known as the Chang Jiang or ""long river""",Yangtze,NA
2002-05-17,DJ,THE 20th CENTURY,,1600,Sacco & Vanzetti got the chair when found guilty of robbing & killing 2 workmen at one of these factories,shoe factory,NA
2002-05-17,DJ,THE TV VAULT,,1600,A sleestack could tell you that 2 kids & a forest ranger went back to pre-historic times on this TV show,Land of the Lost,NA
2002-05-17,DJ,CAPITAL CITY BIRTHPLACES,,NA,Trygve Lie,Oslo,NA
2002-05-17,DJ,JUST TO THE RIGHT,,1600,"On a QWERTY typewriter keyboard, it's the key just to the right of the ""Y""",U,NA
2002-05-17,DJ,EUROPEAN ART,,NA,An 1898 exhibition in Amsterdam devoted to this old master has been called the first blockbuster art show,Rembrandt,NA
2002-05-17,DJ,"TELL ME ""Y""",,1600,This peninsula separates the Gulf of Mexico from the Caribbean Sea,Yucatan,NA
2002-05-17,DJ,THE 20th CENTURY,,2000,"After FDR dumped him as Vice President, he was made Secretary of Commerce",Henry Wallace,NA
2002-05-17,DJ,THE TV VAULT,,2000,Ken Howard played inner city high school basketball coach Ken Reeves on this late '70s TV series,The White Shadow,NA
2002-05-17,DJ,CAPITAL CITY BIRTHPLACES,,2000,Raoul Wallenberg,Stockholm,NA
2002-05-17,DJ,JUST TO THE RIGHT,,2000,"On the periodic table, this gas is just to the right of nitrogen",oxygen,NA
2002-05-17,DJ,EUROPEAN ART,,2000,"The artist whose work you can make out here was known in Italy as Gherardo della Notte, Gerrit of this",of the night,http://www.j-archive.com/media/2002-05-17_DJ_13.jpg
2002-05-17,DJ,"TELL ME ""Y""",,2000,"Hebrew for ""act of sitting"", it's a school or college for the study of the Talmud",yeshiva,NA
2002-05-17,FJ,FICTIONAL CHARACTERS,,NA,"In a popular '90s bestseller, this hero replaces Roger Durling as President of the United States",Jack Ryan,NA
