date,round,category,comment,value,clue,response,link
1999-02-12,J,HISTORY OF PASSION,,100,"Paris just had to have this beautiful daughter of Zeus, & the rest is history",Helen of Troy,NA
1999-02-12,J,COUPLES,,100,These two rock as the most famous Stone Age couple we know,Fred & Wilma Flintstone,NA
1999-02-12,J,FLOWERS,,100,"In July 1998 an ivory & pink blush rose was unveiled to honor this woman, ""England's Rose""",Princess Diana,NA
1999-02-12,J,CHOCOLATE,,100,He's credited with introducing chocolate to Spain after consuming it at the court of Montezuma,Hernando Cortez,NA
1999-02-12,J,"""LOVE"" SONGS",,100,"In a Sinatra classic, these 2 things ""go together like a horse and carriage""",love & marriage,NA
1999-02-12,J,WORDS FOR TWO,,100,It's a musical composition for 2 voices or 2 instruments,Duet,NA
1999-02-12,J,HISTORY OF PASSION,,200,"In 1946, this Indian leader revealed he'd taken many women to bed with him over the years to test his celibacy",Mahatma Gandhi,NA
1999-02-12,J,COUPLES,,200,"In 1998, this ""Yentl"" & this AAMCO spokesman were married exactly 2 years after their first date",Barbra Streisand & James Brolin,NA
1999-02-12,J,FLOWERS,,200,"This special flower for March lies at one end of the spectrum, so to speak",Violet,NA
1999-02-12,J,CHOCOLATE,,200,"This leading British chocolate-maker introduced its ""Dairy Milk"" chocolate bar in 1905",Cadbury,NA
1999-02-12,J,"""LOVE"" SONGS",,200,"In this title song from Elvis' first movie, The King declares ""You have made my life complete, and I love you so""","""Love Me Tender""",NA
1999-02-12,J,WORDS FOR TWO,,200,Word for 2 cards of the same value in a poker game,Pair,NA
1999-02-12,J,HISTORY OF PASSION,,300,This 12th century French theologian lost more than his head over the niece of a vengeful cleric,Peter Abelard,NA
1999-02-12,J,COUPLES,,300,"Their time is taken up in part by 4 children, 6 grandchildren, & at least one large home in the country",Queen Elizabeth II & Prince Philip,NA
1999-02-12,J,FLOWERS,,NA,There's a streaked variety of this bulb flower named for Rembrandt,Tulip,NA
1999-02-12,J,CHOCOLATE,,300,"This 72-year-old maker of fine Belgian-style chocolates produces over 150 varieties, & that's the naked truth",Godiva,NA
1999-02-12,J,"""LOVE"" SONGS",,300,"""When I kissed a cop down on 34th & Vine, he broke my little bottle of"" this","""Love Potion No. 9""",NA
1999-02-12,J,WORDS FOR TWO,,300,They can be fraternal or identical,Twins,NA
1999-02-12,J,HISTORY OF PASSION,,400,This British Secretary of War resigned in 1963 due to a sex scandal,John Profumo,NA
1999-02-12,J,COUPLES,,400,"Between this actress & this cable news pioneer, they've got 2 Oscars, a baseball team & a basketball team",Jane Fonda & Ted Turner,NA
1999-02-12,J,FLOWERS,,400,"You might ask ""What's Up"" with this flower seen here",Tiger Lily,NA
1999-02-12,J,CHOCOLATE,,400,These ball-shaped candies may be dipped in nuts or sprinkles but cocoa powder is the classic coating,Chocolate truffles,NA
1999-02-12,J,"""LOVE"" SONGS",,400,"In a 1964 Beatles hit, ""She says"" this, ""and you know that can't be bad""","""She Loves You""",NA
1999-02-12,J,WORDS FOR TWO,,400,"In other words, ""Similar as 2 legume fruits in a seed holder""","""Like two peas in a pod""",NA
1999-02-12,J,HISTORY OF PASSION,,500,"Depicted here, they're the victims being abducted by the Romans",Sabine women,NA
1999-02-12,J,COUPLES,,500,George Murphy introduced Bob Hope to her; she & Bob celebrated 60 years of marriage in 1994,Dolores (Reade) Hope,NA
1999-02-12,J,FLOWERS,,500,"The name of this imperial emblem of Japan is Greek for ""golden flower""",the chrysanthemum,NA
1999-02-12,J,CHOCOLATE,,500,"""Whenever you're near, I hear"" this Hershey's bar with almonds & toffee chips",Symphony,NA
1999-02-12,J,"""LOVE"" SONGS",,500,"Jack Jones sang that this vehicle ""soon will be making another run""","the ""Love Boat""",NA
1999-02-12,J,WORDS FOR TWO,,500,"On a riverboat, it's how you would ""Mark"" water that's 2 fathoms deep",Twain,NA
1999-02-12,DJ,BIOCHEMISTRY,(Alex: Oh boy!),200,An oncogene is defined as a sequence of genetic material that can induce this disease,Cancer,NA
1999-02-12,DJ,1989 FILMS,,200,Production designer Anton Furst won an Oscar for this film's atmospheric Gotham City,Batman,NA
1999-02-12,DJ,CORPORATE HISTORIES,,200,Need refills for your Swingline?  Head to this chain founded by Thomas Stemberg in 1985,Staples,NA
1999-02-12,DJ,JOIN THE CLUB,,200,"Some credit this bacon, turkey & lettuce creation to the Saratoga Club of New York state",Club sandwich,NA
1999-02-12,DJ,VALUES,,200,13 loaves or buns,Baker\'s dozen,NA
1999-02-12,DJ,12-LETTER WORDS,,200,It's a break period between play acts when you can stretch your legs,Intermission,NA
1999-02-12,DJ,BIOCHEMISTRY,(Alex: Oh boy!),400,"A substance called ""heme"" is the most ""ironic"" portion of this blood pigment",Hemoglobin,NA
1999-02-12,DJ,1989 FILMS,,400,The third element in the title of this Andie MacDowell film is captured on Sony equipment,"sex, lies, and videotape",NA
1999-02-12,DJ,CORPORATE HISTORIES,,400,"This pair has been selling books in stores ""Since 1873"" & on the internet since 1997",Barnes & Noble,NA
1999-02-12,DJ,JOIN THE CLUB,,400,"A cogwheel is the symbol of the ""International"" association of these clubs",Rotary Clubs,NA
1999-02-12,DJ,VALUES,,400,For 8 it's 2;for 27 it's 3,Cube root,NA
1999-02-12,DJ,12-LETTER WORDS,,400,Books consulted by an author in preparing his own book often appear on this list at the back of the book,Bibliography,NA
1999-02-12,DJ,BIOCHEMISTRY,(Alex: Oh boy!),600,"These compounds may have ""simple"" molecules, like sugars, or ""complex"" ones, like cellulose",Carbohydrates,NA
1999-02-12,DJ,1989 FILMS,,600,"Before ""Titanic"", James Cameron took us to the bottom of the ocean in this film",The Abyss,NA
1999-02-12,DJ,CORPORATE HISTORIES,,600,"The company at 610 Gateway Street in North Sioux City, South Dakota has sold these since 1985",Computers,NA
1999-02-12,DJ,JOIN THE CLUB,,NA,(VIDEO DAILY DOUBLE):This founder of the famous Literary Club was painted by fellow founder Joshua Reynolds,Samuel Johnson,NA
1999-02-12,NA,NA,NA,NA,NA,NA,NA
1999-02-12,DJ,12-LETTER WORDS,,600,It's the use of essences & fragrances to alter mood & soothe the body,Aromatherapy,NA
1999-02-12,DJ,BIOCHEMISTRY,(Alex: Oh boy!),800,"Pauling found an ""alpha"" type of this spiral in proteins; Watson & Crick found a ""double"" one in DNA",Helix,NA
1999-02-12,DJ,1989 FILMS,,800,"This 1989 film was based on an actual event:  ""Think about me as your priest.  You can tell me anything.  I'm listening.""",Casualties Of War,NA
1999-02-12,DJ,CORPORATE HISTORIES,,800,"In the 1880s William & James, these brothers, started their soap business",Lever Brothers,NA
1999-02-12,DJ,JOIN THE CLUB,,800,"As you might expect, lower Manhattan is the site of this club that awards the Heisman Trophy",Downtown Athletic Club,NA
1999-02-12,DJ,VALUES,,800,"In printing, 12 points",Pica,NA
1999-02-12,DJ,12-LETTER WORDS,,800,Popular term for a company employee who works at home & transmits his data & documents by modem,Telecommuter,NA
1999-02-12,DJ,BIOCHEMISTRY,(Alex: Oh boy!),NA,"Its 2 phases are anabolism, which combines molecules, & catabolism, which breaks them down",Metabolism,NA
1999-02-12,DJ,1989 FILMS,,1000,"This film was the 1989 version of the story told in 1989's ""Dangerous Liaisons""",Valmont,NA
1999-02-12,DJ,CORPORATE HISTORIES,,1000,"This comic book company emerged from bankruptcy in 1998 as part of Toy Biz, Inc.",Marvel,NA
1999-02-12,DJ,JOIN THE CLUB,,1000,"Founded at Newmarket, England, it publishes the ""General Stud Book""",The Jockey Club,NA
1999-02-12,DJ,VALUES,,1000,A millionth of a meter,Micron/micrometer,NA
1999-02-12,DJ,12-LETTER WORDS,,1000,"I must profess, it was the profession of Thomas Chippendale & Duncan Phyfe",Cabinetmaker,NA
1999-02-12,FJ,LITERATURE,,NA,In 1998 Jose Saramago became the first writer in this language to win a Nobel Prize for Literature,Portuguese,NA
