date,round,category,comment,value,clue,response,link
1998-02-06,J,AFRICAN AMERICANS,,100,"About 200,000 black soldiers served in the Civil War on this side",Union,NA
1998-02-06,J,ANNUAL EVENTS,,100,"The people of Columbia, Tenn. persuade these stubborn farm animals to parade through town each spring",Mules,NA
1998-02-06,J,CELEBRITY QUOTES,,100,"Over 30 movies have been made from my works, including ""Maximum Overdrive""",Stephen King,NA
1998-02-06,J,TRAVEL & TOURISM,,100,"Grumari has been called ""The Most Beautiful"" of these in Rio, & Ipanema, ""The Most Chic""",Beaches,NA
1998-02-06,J,PETS,,100,"The smallest of the hounds, this popular pet is active & inquisitive, you might even say snoopy",a beagle,NA
1998-02-06,J,3-LETTER WORDS,,100,Tongues & tails do it,Wag,NA
1998-02-06,J,AFRICAN AMERICANS,,200,"This Harlem-born singer-dancer-actor was a member of the 1960s ""Rat Pack"" with Frank & Dino","Sammy Davis, Jr.",NA
1998-02-06,J,ANNUAL EVENTS,,200,A Christmas Eve festival in Provence celebrates these workers who visited Jesus in the manger,Shepherds,NA
1998-02-06,J,CELEBRITY QUOTES,,200,"The bass player on ""The Partridge Family"", I went on to be voted the most dangerous former child star",Danny Bonaduce,NA
1998-02-06,J,TRAVEL & TOURISM,,200,You'll find this famous statue just a few hundred feet southeast of the Great Pyramid,The Sphinx,NA
1998-02-06,J,PETS,,200,"If your fish gets spots of this color on his skin, he's probably suffering from a disease called ich",White,NA
1998-02-06,J,3-LETTER WORDS,,200,"Next in sequence:One, two, six,...",ten,NA
1998-02-06,J,AFRICAN AMERICANS,,NA,"(Hi, I'm Jesse Jackson, Jr.)  About 2/3 of the people that I represent in Congress live in this city",Chicago,http://www.j-archive.com/media/1998-02-06_J_01.jpg
1998-02-06,J,ANNUAL EVENTS,,300,"The Welsh Eisteddfod originally honored these medieval poets, but not Shakespeare",Bards,NA
1998-02-06,J,CELEBRITY QUOTES,,300,"I've been referred to as ""America's Home Improvement Guru"" & ""America's Handyman""",Bob Vila,NA
1998-02-06,J,TRAVEL & TOURISM,,300,The Charles Darwin Research Station on Santa Cruz is a good start for a tour of these South American islands,Galapagos Islands,NA
1998-02-06,J,PETS,,300,Provide shallow water that your snake can soak in to aid this process,Molting,NA
1998-02-06,J,3-LETTER WORDS,,300,"When it precedes ""off"", it means to fall asleep",Nod,NA
1998-02-06,J,AFRICAN AMERICANS,,400,In the 1950s this man sued the Topeka Board of Education over which school his daughter might attend,Oliver Brown,NA
1998-02-06,J,ANNUAL EVENTS,,400,"Culbertson, Montana holds a bee each September for this activity of separating grain",Threshing,NA
1998-02-06,J,CELEBRITY QUOTES,,400,"I never drew my gun during my 6 years as Ponch on ""CHiPs""",Erik Estrada,NA
1998-02-06,J,TRAVEL & TOURISM,,400,Watch your head when entering the Blue Grotto on this Italian island; the opening is about 3 feet high,Capri,NA
1998-02-06,J,PETS,,400,The Waltham Center for Pet Nutrition reports humans who own pets have lower systolic levels of this,Blood pressure,NA
1998-02-06,J,3-LETTER WORDS,,400,It describes a bomb that falls down & doesn't go boom,Dud,NA
1998-02-06,J,AFRICAN AMERICANS,,500,"""Goodbye Pork Pie Hat"" is a famous work by this jazz bassist & bandleader",Charlie Mingus,NA
1998-02-06,J,ANNUAL EVENTS,,500,Eje is a west African festival giving thanks for this potato-like staple food,Yam,NA
1998-02-06,J,CELEBRITY QUOTES,,500,"Tallest of the Nerds, I'm now operating on ""ER""",Anthony Edwards,NA
1998-02-06,J,TRAVEL & TOURISM,,500,Zebras & leopards are among the wildlife found at Kruger National Park in this country,South Africa,NA
1998-02-06,J,PETS,,500,These rodents from Mongolia are slightly smaller & newer to the U.S. than hamsters,Gerbils,NA
1998-02-06,J,3-LETTER WORDS,,500,It's the only zodiac sign that fits the category,Leo,NA
1998-02-06,DJ,THE 18th CENTURY,,200,"After the Burmans sacked Ayutthaya, Siam's government was moved to this city",Bangkok,NA
1998-02-06,DJ,OUT TO SEA,,200,Central America's east coast forms this sea's western boundary,Caribbean Sea,NA
1998-02-06,DJ,DIRECTORS,,200,"Biographer Donald Spoto says that as a schoolboy, this ""Vertigo"" director was nicknamed ""Cocky""",Alfred Hitchcock,NA
1998-02-06,DJ,AROUND THE CASTLE WITH LANCE,,200,"Once Lance sees from the gatehouse that you're not hostile, he might lower this method of entry",Drawbridge,NA
1998-02-06,DJ,FICTION,,200,"This ""Rising Sun"" author took to the skies with ""Airframe"", a suspense novel",Michael Crichton,NA
1998-02-06,DJ,"ENDS IN ""FF""",,200,"The ""Quick & Easy"" one sponsored by Pillsbury offers a $1,000,000 grand prize",Bake-off,NA
1998-02-06,DJ,THE 18th CENTURY,,400,"This ""Great"" Prussian, king from 1740 to 1786, hated German & spoke French at court",Frederick the Great,NA
1998-02-06,DJ,OUT TO SEA,,400,"This sea formed millions of years ago when the Arabian Peninsula & Africa ""parted""",Red Sea,NA
1998-02-06,DJ,DIRECTORS,,400,"In his late teens this director, seen here, taught English in Saigon",Oliver Stone,NA
1998-02-06,DJ,AROUND THE CASTLE WITH LANCE,,400,"Since Lance's castle dates from before the Gothic period, it lacks the ""flying"" type of these supports",Buttresses,NA
1998-02-06,DJ,FICTION,,400,"""Caesar"", published in 1997, is the fifth volume in this Aussie author's Masters Of Rome series",Colleen McCullough,NA
1998-02-06,DJ,"ENDS IN ""FF""",,400,He guards the jurors & maintains order in a courtroom,Bailiff,NA
1998-02-06,DJ,THE 18th CENTURY,,600,In 1789 General Nguyen Hue led an attack on Chinese forces during this holiday,Tet,NA
1998-02-06,DJ,OUT TO SEA,,600,"If you row the entire length of the Po, eventually you'll flow into this sea",Adriatic Sea,NA
1998-02-06,DJ,DIRECTORS,,600,"Elia Kazan directed both this 1947 play, that made Marlon Brando a star, & the 1951 film",A Streetcar Named Desire,NA
1998-02-06,DJ,AROUND THE CASTLE WITH LANCE,,600,"The ever-cautious Lance might refuse to raise this iron grating, named from French for ""sliding door""",a portcullis,NA
1998-02-06,DJ,FICTION,,600,"""The Third Twin"" is a 1996 thriller by this ""Eye Of The Needle"" author",Ken Follett,NA
1998-02-06,DJ,"ENDS IN ""FF""",,600,"This Welsh capital was once the world's greatest coal-exporting port, a veritable ""giant""",Cardiff,NA
1998-02-06,DJ,THE 18th CENTURY,,800,The French encyclopedists inspired this publication which first appeared across the Channel in 1768,Encyclopaedia Britannica,NA
1998-02-06,DJ,OUT TO SEA,,800,The Strait of Dover & the rest of the English Channel connect it with the Atlantic Ocean,North Sea,NA
1998-02-06,DJ,DIRECTORS,,800,"The 1985 action film ""Runaway Train"" was based on a screenplay by this great Japanese director",Akira Kurosawa,NA
1998-02-06,DJ,AROUND THE CASTLE WITH LANCE,,800,"Lance uses this structure, named from Old Norse for ""small hut"", for the castle's domesticated pigeons",Dovecote,NA
1998-02-06,DJ,FICTION,,800,"In this author's ""Deadlock"", V.I. Warshawski investigates the death of her cousin, a former hockey star",Sara Paretsky,NA
1998-02-06,DJ,"ENDS IN ""FF""",,NA,Title of the man seen here that fits the category: (Pope John Paul II),(Supreme) Pontiff,NA
1998-02-06,DJ,THE 18th CENTURY,,1000,"As a navigator, this future Pacific explorer helped capture Quebec in 1759",Captain James Cook,NA
1998-02-06,DJ,OUT TO SEA,,1000,St. Lawrence Island & the Pribilof Islands lie in this sea,Bering Sea,NA
1998-02-06,DJ,DIRECTORS,,NA,"This Englishman won a 1957 Oscar for directing the epic film seen here: (""The Bridge On The River Kwai"")",David Lean,NA
1998-02-06,DJ,AROUND THE CASTLE WITH LANCE,,1000,"With taxes rising, Lance hopes he'll be able to ""hold onto"" this central tower, his real home",Keep,NA
1998-02-06,DJ,FICTION,,1000,"Det. Alex Cross is featured in this author's ""Kiss The Girls"", ""Jack & Jill"" & ""Cat & Mouse""",James Patterson,NA
1998-02-06,DJ,"ENDS IN ""FF""",,1000,It's a tax placed by a government on exports or imports,Tariff,NA
1998-02-06,FJ,U.S. CITIES,,NA,This historic city was named for the Bishop of Hippo on whose feast day the area was first sighted,"St. Augustine, Florida",NA
