date,round,category,comment,value,clue,response,link
2001-06-05,J,PRICELINE,,100,"John Heywood's 16th century book of proverbs mentioned this price ""for your thoughts"" (What a cheapskate!)",A penny,NA
2001-06-05,J,AMAZON,,100,"Beginning in Peru, the Amazon flows over 4,000 miles to this ocean",Atlantic Ocean,NA
2001-06-05,J,REAL AUDIO,,100,"His ""Rock & Roll Music"" includes ""Maybellene"" & ""Roll Over Beethoven""",Chuck Berry,NA
2001-06-05,J,I WON,,100,One of the few victories the Romans ever won against this Carthaginian general was at Zuma in 202 B.C.,Hannibal,NA
2001-06-05,J,THE ONION,,100,Sulfuric compounds in onions induce these in humans who are slicing them,Tears,NA
2001-06-05,J,"""E"" BAY",,100,An upright frame for displaying or supporting an artist's canvas,Easel,NA
2001-06-05,J,PRICELINE,,200,"In the 1960s this famous structure really was ""falling down"", so Robert McCulloch paid $2,460,000 & moved it to Arizona",London Bridge,NA
2001-06-05,J,AMAZON,,200,"Abundant in the Amazon River, this feared fish is also known as a caribe",Piranha,NA
2001-06-05,J,REAL AUDIO,,200,"""People"" & ""Back To Broadway"" are No. 1 albums by this woman",Barbra Streisand,NA
2001-06-05,J,I WON,,200,"As the Dixiecrat nominee, this South Carolina senator, then governor, won 39 electoral votes in 1948",Strom Thurmond,NA
2001-06-05,J,THE ONION,,200,These small onions often used in cream sauces bear the name of a gem,Pearl onions,NA
2001-06-05,J,"""E"" BAY",,200,A crude figure or dummy representing a disliked person,Effigy,NA
2001-06-05,J,PRICELINE,,300,These early movie theatres were so named because they charged only 5 cents admission,Nickelodeons,NA
2001-06-05,J,AMAZON,,300,The upper Amazon is known as the Solimoes River until it reaches this nation's city of Manaus,Brazil,NA
2001-06-05,J,REAL AUDIO,,300,"Moby's version of ""South Side"" features Gwen Stefani, the lead singer of this group",No Doubt,NA
2001-06-05,J,I WON,,300,"The author of ""A Beggar In Jerusalem"", this concentration camp survivor won the Nobel Peace Prize in 1986",Elie Wiesel,NA
2001-06-05,J,THE ONION,,300,"""I will not move my army without onions!"" once declared this 18th U.S. president",Ulysses S. Grant,NA
2001-06-05,J,"""E"" BAY",,300,1981 Wimbledon winner seen here:,Chris Evert,NA
2001-06-05,J,PRICELINE,,400,"At a 1996 auction Jimmy Buffett paid $43,700 for a Jamie Wyeth lithograph of this president in a sailboat",John F. Kennedy,NA
2001-06-05,J,AMAZON,,400,A 1542 attack by female warriors against explorers from this country led to the Amazon receiving its name,Spain,NA
2001-06-05,J,REAL AUDIO,,400,It's the instrument in the title of the following:[audio clue],Saxophone,NA
2001-06-05,J,I WON,,NA,"Pitted against Clarence Darrow, this man won his case on July 21, 1925 & then died 5 days later",William Jennings Bryan,NA
2001-06-05,J,THE ONION,,400,This onion relative is a national emblem of Wales,Leek,NA
2001-06-05,J,"""E"" BAY",,400,"From the Latin for ""inlaid design"", it's an object or representation that functions as a symbol",Emblem,NA
2001-06-05,J,PRICELINE,,500,"Famous price of ""Stella Delorme"" & many other lurid novels by Ned Buntline",A dime,NA
2001-06-05,J,AMAZON,,500,These water boas of the Amazon region can grow to over 200 pounds & over 20 feet,Anacondas,NA
2001-06-05,J,REAL AUDIO,,500,"""Summer Nights"" helped this soundtrack dominate the No. 1 spot during the summer of 1978",Grease,NA
2001-06-05,J,I WON,,500,"This ""hazardous"" naval officer won the decisive 1813 Battle of Lake Erie over the British",Oliver Hazard Perry,NA
2001-06-05,J,THE ONION,,500,"Grown on the slopes of Haleakala, this Hawaiian island's onions are among the world's tastiest",Maui onions,NA
2001-06-05,J,"""E"" BAY",,500,This nation west of Russia borders the Baltic,Estonia,NA
2001-06-05,DJ,ARTISTS & THEIR WORKS,,200,"Graham Sutherland's 1949 portrait of this ""Of Human Bondage"" author is in the Tate Gallery",Somerset Maugham,NA
2001-06-05,DJ,THE FILM VAULT,,200,"Cecil B. De Mille directed 2 versions of this Biblical epic, one in 1923 & one in 1956",The Ten Commandments,NA
2001-06-05,DJ,DEAR JOHN,,200,He was actress Drew's famous grandfather,John Barrymore,NA
2001-06-05,DJ,AUTHOR! AUTHOR!,,200,"""The Book of Daniel"",""Ragtime""",E.L. Doctorow,NA
2001-06-05,DJ,GREASY SPOON PHRASE BOOK,,200,"Whether Arabica or robusta, order a cup of this & you'll hear ""Draw One!""",Coffee,NA
2001-06-05,DJ,FILL 'ER UP?,,200,"""You can trust your car to the man who wears the star"", the big, bright one of this station",Texaco,NA
2001-06-05,DJ,ARTISTS & THEIR WORKS,,400,"The Uffizi is home to Nicolas Froment's triptych ""The Raising of"" this Biblical man",Lazarus,NA
2001-06-05,DJ,THE FILM VAULT,,400,In 1963 Richard Burton played this Roman on the big screen,Mark Antony,NA
2001-06-05,DJ,DEAR JOHN,,400,"Though gold was found at his mill in 1848, by 1852 he was bankrupt",John Sutter,NA
2001-06-05,DJ,AUTHOR! AUTHOR!,,400,"""Marjorie Morningstar"",""The Caine Mutiny""",Herman Wouk,NA
2001-06-05,DJ,GREASY SPOON PHRASE BOOK,,400,"Calling out ""BLT, hold the mayo"" gets you this kind of sandwich",Bacon. Lettuce & Tomato (without the mayonnaise),NA
2001-06-05,DJ,FILL 'ER UP?,,400,"Esso stood for S.O., which stood for this",Standard Oil,NA
2001-06-05,DJ,ARTISTS & THEIR WORKS,,NA,This artist famed for his mobiles created a miniature circus that's in the Whitney Museum of American Art,Alexander Calder,NA
2001-06-05,DJ,THE FILM VAULT,,600,"This 1955 James Dean classic was advertised with the tagline ""Teenage Terror Torn from Today's Headlines""",Rebel Without A Cause,NA
2001-06-05,DJ,DEAR JOHN,,600,He & Priscilla Mullens were among the first Pilgrim couples to marry in America,John Alden,NA
2001-06-05,DJ,AUTHOR! AUTHOR!,,600,"""Amelie"",""Tom Jones""",Henry Fielding,NA
2001-06-05,DJ,GREASY SPOON PHRASE BOOK,,600,"Order ""Adam & Eve on a Raft"" & you'll get poached eggs on this",Toast,NA
2001-06-05,DJ,FILL 'ER UP?,,NA,Gulf Oil goes back to the famous oil find at Spindletop in this state in 1901,Texas,NA
2001-06-05,DJ,ARTISTS & THEIR WORKS,,800,"""The Disasters of War"" is a grim series of etchings that this Spaniard began in 1810",Francisco Goya,NA
2001-06-05,DJ,THE FILM VAULT,,800,"This Swedish actress made her breakthrough film in 1936, then later came to the U.S. to star in a 1939 English remake",Ingrid Bergman,NA
2001-06-05,DJ,DEAR JOHN,,800,"While in prison, this ""Pilgrim's Progress"" author supported his family by making shoelaces",John Bunyan,NA
2001-06-05,DJ,AUTHOR! AUTHOR!,,800,"""Of Love and Shadows"",""The House of the Spirits""",Isabel Allende,NA
2001-06-05,DJ,GREASY SPOON PHRASE BOOK,,800,"In a greasy spoon these paired seasonings are ""Mike & Ike""",Salt & pepper,NA
2001-06-05,DJ,FILL 'ER UP?,,800,East coast brand whose logo is seen here:,Sunoco,NA
2001-06-05,DJ,ARTISTS & THEIR WORKS,,1000,"""The Laughing Cavalier"", seen here, may be the most famous portrait by this Antwerp-born artist",Frans Hals,NA
2001-06-05,DJ,THE FILM VAULT,,1000,"Frank Sinatra is ""The Man"" who fights to break his drug addiction in this screen version of an Algren novel",The Man With the Golden Arm,NA
2001-06-05,DJ,DEAR JOHN,,1000,"In 1821 the remains of this major, who conspired with Benedict Arnold, were moved to Westminster Abbey",John Andre,NA
2001-06-05,DJ,AUTHOR! AUTHOR!,,1000,"""The House of Mirth"",""Ethan Frome""",Edith Wharton,NA
2001-06-05,DJ,GREASY SPOON PHRASE BOOK,,1000,"A request for this style of cooked eggs makes the waitress yell out ""Wreck 'em!""",Scrambled eggs,NA
2001-06-05,DJ,FILL 'ER UP?,,1000,"In the '40s this gas company used the slogan ""Best in the long run""  (Get it? Long run)",Marathon Oil,NA
2001-06-05,FJ,TELEVISION,,NA,Show inspired by an article saying about 30% of the people who married in 1965 had kids from a previous marriage,The Brady Bunch,NA
