date,round,category,comment,value,clue,response,link
2006-10-12,J,A LITERARY TOUR,,200,"Head to Odense, Denmark to see his childhood home & sculptures inspired by his fairy tales",(Hans Christian) Andersen,NA
2006-10-12,J,COLORFUL GROUPS,,200,"They ""Wish You Were Here"":____ Floyd",Pink,NA
2006-10-12,J,UNFORESEEN FINDS,,200,In 1879 this was discovered when a scientist's food was found to be sweet from the residue of a coal tar experiment,saccharin,NA
2006-10-12,J,THE TITANIC,,200,The only country outside the British Isles where the Titanic ever anchored,France,NA
2006-10-12,J,WHAT'S THAT SOUND?,,200,"Ports lying on the banks of this sound include Bremerton, Everett & Tacoma",Puget Sound,NA
2006-10-12,J,"""B"" PREPARED",,200,A non-rigid flexible dirigible,blimp,NA
2006-10-12,J,A LITERARY TOUR,,400,"To see the Great Bed of Ware mentioned in ""Twelfth Night"", go to this museum named for a royal couple",the Victoria and Albert Museum (Victoria & Albert accepted),NA
2006-10-12,J,COLORFUL GROUPS,,400,"They'd like you to ""Shake Your Money Maker"":The ____ Crowes",Black,NA
2006-10-12,J,UNFORESEEN FINDS,,400,G.E. scientists looking for synthetic rubber during WWII discovered this toy that lifts images off a page,Silly Putty,NA
2006-10-12,J,THE TITANIC,,400,2 of these towered over the deck & were used as flagpoles & to string the wireless aerial,masts,NA
2006-10-12,J,WHAT'S THAT SOUND?,,400,Block Island Sound separates Block Island from this tiny state's mainland,Rhode Island,NA
2006-10-12,J,"""B"" PREPARED",,400,"""I'll Go Home With Bonnie Jean"" is one of many lively songs in this Lerner & Loewe musical",Brigadoon,NA
2006-10-12,J,A LITERARY TOUR,,600,"Have a homey lunch at this author's Salinas, California birthplace; it's now a restaurant",John Steinbeck,NA
2006-10-12,J,COLORFUL GROUPS,,600,"Leaders of a ""Seven Nation Army"":The ____ Stripes",White,NA
2006-10-12,J,UNFORESEEN FINDS,,600,"To spite a customer who complained the tubers were too thick, chef George Crum created what became this treat",potato chips,NA
2006-10-12,J,THE TITANIC,,600,"This happened between the third & fourth funnel, a fact no one knew until the Titanic was found in 1985",it broke in half,NA
2006-10-12,J,WHAT'S THAT SOUND?,,600,"This state's outer banks create Pamlico Sound, the largest lagoon on the East Coast of the United States",North Carolina,NA
2006-10-12,J,"""B"" PREPARED",,600,This period lasted from about 3500 to 1500 B.C.,the Bronze Age,NA
2006-10-12,J,A LITERARY TOUR,,800,Chat about Lady Chatterley at this author's birthplace museum in Nottinghamshire,D.H. Lawrence,NA
2006-10-12,J,COLORFUL GROUPS,,800,"They're ""Under The Bridge"":____ ____ Chili Peppers",Red Hot,NA
2006-10-12,J,UNFORESEEN FINDS,,800,This product was born when a new 3M jet-fuel hose material spilled on shoes & made them waterproof & stain-resistant,Scotchgard,NA
2006-10-12,J,THE TITANIC,,800,"The first warning of the iceberg came at 11:40 P.M. from Fred Fleet, the lookout in this platform high above the deck",the crow\'s nest,NA
2006-10-12,J,WHAT'S THAT SOUND?,,800,"The islands in Australia's Yampi Sound are rich in hematite, an ore of this metal",iron,NA
2006-10-12,J,"""B"" PREPARED",,800,This U.S. government department is abbreviated B.I.A.,the Bureau of Indian Affairs,NA
2006-10-12,J,A LITERARY TOUR,,1000,"Perhaps you'll draft your Nobel Prize acceptance speech at NYC's Algonquin Hotel, as this Mississippi man did in 1950",Faulkner,NA
2006-10-12,J,COLORFUL GROUPS,,1000,"Hard rockers ""Burnin' For You"":____ ____ Cult",Blue Öyster,NA
2006-10-12,J,UNFORESEEN FINDS,,NA,The idea for this device occurred when a magnetron melted a candy bar in Raytheon engineer Percy Spencer's pocket,the microwave,NA
2006-10-12,J,THE TITANIC,,1000,"Gates prevented 700 of these passengers from getting up to the main deck, though they didn't stop Leo in the movie",third class,NA
2006-10-12,J,WHAT'S THAT SOUND?,,1000,Antarctica's McMurdo Sound was discovered in 1841 by this Brit who has a nearby sea & ice shelf named for him,(Sir James Clark) Ross,NA
2006-10-12,J,"""B"" PREPARED",,1000,"Meaning a noisy commotion, it may derive from ""baruch habba"", a loud traditional greeting at a synagogue",brouhaha,NA
2006-10-12,DJ,CAESAR,,400,"The Arch of the Emperor Titus in Rome heralds his conquest of this city in 70 A.D., ending the Jewish revolt",Jerusalem,NA
2006-10-12,DJ,NEWMAN'S OWN,,400,"1969 film in which Paul Newman tells Robert Redford, ""Boy, I got vision, and the rest of the world wears bifocals""",Butch Cassidy and the Sundance Kid,NA
2006-10-12,DJ,CATALINA,,400,"(Cheryl of the Clue Crew reads from near a fountain on Catalina Island, CA.)  In 1919 this chewing gum magnate bought Catalina & built it into a world-class resort",(William) Wrigley,http://www.j-archive.com/media/2006-10-12_DJ_26.jpg
2006-10-12,DJ,CRAFT,,400,Saddler's pliers were created for gripping this material,leather,NA
2006-10-12,DJ,ITALIAN,,400,"""Parla come mangi"", literally ""speak the way you"" do this, means to speak simply & clearly",eat,NA
2006-10-12,DJ,DRESSING,,400,"Traditional Highland dress includes a wide belt, presumably holding up this",a kilt,NA
2006-10-12,DJ,CAESAR,,800,He was caesar & emperor when Jesus was born,Augustus,NA
2006-10-12,DJ,NEWMAN'S OWN,,800,Newman played Brick opposite Liz Taylor's Maggie in this film adaptation of a play,Cat on a Hot Tin Roof,NA
2006-10-12,DJ,CATALINA,,800,Movies shot on Catalina include this 1935 Oscar winner starring Clark Gable & Charles Laughton,Mutiny on the Bounty,http://www.j-archive.com/media/2006-10-12_DJ_27.jpg
2006-10-12,DJ,CRAFT,,800,"This word for a step in sewing a garment is also found paired with ""hawing""",hemming,NA
2006-10-12,DJ,ITALIAN,,800,"Literally ""good day"", it's the basic Italian hello",buon giorno,NA
2006-10-12,DJ,DRESSING,,800,"The hour for mixed drinks, or the type of short evening dress appropriate then",cocktail,NA
2006-10-12,DJ,CAESAR,,NA,"AKA the Flavian Amphitheatre, this ancient structure was begun by the Roman emperor Vespasian around 72 A.D.",the Colosseum,NA
2006-10-12,DJ,NEWMAN'S OWN,,1200,"Paul Newman played ""Fast"" Eddie Felson in these 2 movies",The Hustler & The Color of Money,NA
2006-10-12,DJ,CATALINA,,1200,"(Sarah of the Clue Crew reports from a hillside on Catalina Island, CA.)  One of Catalina's most famous residents was this author of ""Riders of the Purple Sage"", who built a home here in 1926",(Zane) Grey,http://www.j-archive.com/media/2006-10-12_DJ_28a.jpg
2006-10-12,DJ,CRAFT,,1200,"If you apply pieces of one material to another, you're practicing this craft, from the French for ""apply""",appliqué,NA
2006-10-12,DJ,ITALIAN,,1200,"The divine ""Don Giovanni"" duet ""La ci darem la mano"" means ""There, you'll give me"" this",your hand,NA
2006-10-12,DJ,DRESSING,,NA,In 1953 the Witty Brothers promoted the first suit made of this by having a model wear it for 67 straight days,polyester,NA
2006-10-12,DJ,CAESAR,,1600,"According to legend, this unhinged Roman emperor made his horse a priest & a consul",Caligula,NA
2006-10-12,DJ,NEWMAN'S OWN,,1600,Film in which washed-up lawyer Newman redeems himself by taking a medical malpractice case to trial,The Verdict,NA
2006-10-12,DJ,CATALINA,,1600,Catalina had Southern Calif.'s first golf course; from 1931 to 1955 it hosted a tournament named for this Ga. great,Bobby Jones,NA
2006-10-12,DJ,CRAFT,,1600,"With drying, drilling & maybe decorating, a gourd can be made into one of these, perhaps for a purple martin",a birdhouse,NA
2006-10-12,DJ,ITALIAN,,1600,"From an Italian word for ""grape stalk"", it's brandy distilled from the remains of grapes after pressing",grappa,NA
2006-10-12,DJ,DRESSING,,1600,"2-word, somewhat contradictory-sounding term for the NBA's player dress code that allows dress slacks or khakis",business casual,NA
2006-10-12,DJ,CAESAR,,2000,"The chief figure in 2 books by Robert Graves, this emperor may have been poisoned by his fourth wife",Claudius,NA
2006-10-12,DJ,NEWMAN'S OWN,,2000,Newman played Irish mob boss John Rooney in Depression-era Chicago in this 2002 film,Road to Perdition,NA
2006-10-12,DJ,CATALINA,,2000,"(Cheryl of the Clue Crew reports from on high on Catalina Island, CA.)  Catalina's only city shares its name with this island of the King Arthur legends",Avalon,http://www.j-archive.com/media/2006-10-12_DJ_25.jpg
2006-10-12,DJ,CRAFT,,2000,The tole type of this decorative activity was originally done on tin utensils but now uses lots of surfaces,painting,NA
2006-10-12,DJ,ITALIAN,,2000,"If you're not going sinistra or destra, you're going sempre diritto, meaning this",always straight,NA
2006-10-12,DJ,DRESSING,,2000,"Scarlett O'Hara is introduced wearing a ""tightly fitting basque"", this upper part of a dress",the bodice,NA
2006-10-12,FJ,WORLD CAPITALS,,NA,"Started in 1988 for this city's 75th anniversary, a Springtime Flower Festival in September shows off its Commonwealth Park","Canberra, Australia",NA
