date,round,category,comment,value,clue,response,link
1997-03-21,J,OPTICS,,100,During World War II this company invented an infrared filter; the instant cameras came later,Polaroid,NA
1997-03-21,J,AMERICAN MUSEUMS,,100,Scitrek is the science and technology museum of this Georgia capital,Atlanta,NA
1997-03-21,J,POP CULTURE,,100,"This ""Kickboxer"" star was a champion in the European Professional Karate Association",Jean-Claude Van Damme,NA
1997-03-21,J,U.S. HISTORY,,100,This 1803 territorial acquisition gave the U.S. free navigation of the Mississippi River,Louisiana Purchase,NA
1997-03-21,J,SMALL JOBS,,100,This little Roman love god performs his matchmaking job with a bow & arrow,Cupid,NA
1997-03-21,J,"ON ""Q""",,100,"Made with eggs, cheese & other fillings in a pastry shell, it's what real men don't eat",Quiche,NA
1997-03-21,J,OPTICS,,200,"Made of bronze in Biblical times, today they're often glass with a backing of a silver solution",Mirrors,NA
1997-03-21,J,AMERICAN MUSEUMS,,200,You can ride a real trolley at the Seashore Trolley Museum in Kennebunkport in this state,Maine,NA
1997-03-21,J,POP CULTURE,,200,"His ""Streets of Philadelphia"" won him 4 1994 Grammys, including Song of the Year & Best Male Rock Vocal",Bruce Springsteen,NA
1997-03-21,J,U.S. HISTORY,,200,At age 26 Jonathan Dayton of New Jersey was the youngest signer of this 1787 document,The Constitution,NA
1997-03-21,J,SMALL JOBS,,200,The Munchkins toiled as slaves for this woman until a house fell on her,The Wicked Witch of the East,NA
1997-03-21,J,"ON ""Q""",,200,"Five of a kind siblings, like the Dionnes",Quintuplets,NA
1997-03-21,J,OPTICS,,300,"At the bottom of the Encarta article on this device are links to ""optics"" & ""submarine""",Periscope,NA
1997-03-21,J,AMERICAN MUSEUMS,,300,Bill Clinton may know there's an oil and brine museum in Smackover in this state,Arkansas,NA
1997-03-21,J,POP CULTURE,,300,In 1996 this strikeout king became the first player to have his uniform number retired by 3 teams,Nolan Ryan,NA
1997-03-21,J,U.S. HISTORY,,300,"On December 6, 1976 this congressman was chosen to replace Carl Albert as Speaker of the House",Tip O\'Neill,NA
1997-03-21,J,SMALL JOBS,,300,"To find a leprechaun, follow the tapping of his hammer as he busies himself making these",Shoes,NA
1997-03-21,J,"ON ""Q""",,300,It's the term for the result when you divide one number by another,Quotient,NA
1997-03-21,J,OPTICS,,400,"Segments for reading, intermediate & distance make up this type of eyeglass lens",Trifocals,NA
1997-03-21,J,AMERICAN MUSEUMS,,400,"Naples in this state is home to Frannie's Teddy Bear Museum, which boasts more than 1,500 bears",Florida,NA
1997-03-21,J,POP CULTURE,,400,"Guitarist Richie Sambora of this group co-wrote Cher's hit ""We All Sleep Alone""",Bon Jovi,NA
1997-03-21,J,U.S. HISTORY,,400,In 1973 L. Patrick Gray resigned as head of this agency because he destroyed Watergate records,FBI,NA
1997-03-21,J,SMALL JOBS,,400,"In the ""Dilbert"" comic strip, he's the evil director of human resources",Catbert,NA
1997-03-21,J,"ON ""Q""",,400,He wanted to ring Esmeralda's bells,Quasimodo,NA
1997-03-21,J,OPTICS,,500,"Fujitsu, NTT & Bell Labs have sent data down a strand of this at a rate of 1 trillion bits per second",Optic fiber,NA
1997-03-21,J,AMERICAN MUSEUMS,,500,"If you're crazy about quilts, you'll enjoy the New England Quilt Museum in Lowell in this state",Massachusetts,NA
1997-03-21,J,POP CULTURE,,500,"Pharaoh, Levi & Reuben are characters in this 1973 Andrew Lloyd Webber-Tim Rice musical",Joseph And The Amazing Technicolor Dreamcoat,NA
1997-03-21,J,U.S. HISTORY,,500,"Successor to the Manhattan Project, this agency, the AEC, was established in 1946",Atomic Energy Commission,NA
1997-03-21,J,SMALL JOBS,,NA,"Describing his job, this Shakespearean sprite says, ""I jest to Oberon and make him smile""",Puck,NA
1997-03-21,J,"ON ""Q""",,500,"Legally speaking, this Latin phrase means ""something for something""",Quid pro quo,NA
1997-03-21,DJ,MILITARY GOVERNORS,,200,"Benjamin Franklin ""Beast"" Butler was dismissed in 1862 as military governor of this Louisiana city",New Orleans,NA
1997-03-21,DJ,OPERA,,200,"This ""Messiah"" composer's 1735 opera ""Alcina"" was based on the epic poem ""Orlando Furioso""",G.F. Handel,NA
1997-03-21,DJ,BIRDS,,200,These birds are called homers for short,homing pigeons,NA
1997-03-21,DJ,FAMOUS PAIRS,,200,"""Edelweiss"" from ""The Sound Of Music"" was the last song they wrote together",Rodgers & Hammerstein,NA
1997-03-21,DJ,SOUTH AMERICAN CAPITALS,,200,An airport in the coastal city of Callao serves this Peruvian capital,Lima,NA
1997-03-21,DJ,NOVEL TITLES,(Alex: We want you to give as your response the title of a novel),200,Buck has unfamiliar yearnings & stirrings when he hears it,The Call of the Wild,NA
1997-03-21,DJ,MILITARY GOVERNORS,,400,"During Leonard Wood's 1899-1902 term as military governor of Cuba, this disease was brought under control",Yellow fever,NA
1997-03-21,DJ,OPERA,,400,"Pietro Mascagni wrote his 1935 opera ""Nerone"" to glorify this dictator",Benito Mussolini,NA
1997-03-21,DJ,BIRDS,,400,The African gray species of this talkative bird is a popular pet,Parrot,NA
1997-03-21,DJ,FAMOUS PAIRS,,NA,"In early 1996 they celebrated their 15,000th live performance: [video clue]",Siegfried & Roy,NA
1997-03-21,DJ,SOUTH AMERICAN CAPITALS,,400,Avenida 18 de Julio runs through the main business district of this Uruguayan capital,Montevideo,NA
1997-03-21,DJ,NOVEL TITLES,(Alex: We want you to give as your response the title of a novel),400,It's a bloody head wound from being struck with a rifle butt,The Red Badge of Courage,NA
1997-03-21,DJ,MILITARY GOVERNORS,,600,Term for the military governor of Japan; the last one resigned in 1867,Shogun,NA
1997-03-21,DJ,OPERA,,600,"Act I of this composer's ""Don Giovanni"" features the famous ""Champagne Aria""",W.A. Mozart,NA
1997-03-21,DJ,BIRDS,,600,These birds that return to San Juan Capistrano in March are of the cliff variety,Swallows,NA
1997-03-21,DJ,FAMOUS PAIRS,,600,"Born of Chinese parents in 1811, they died in 1874, having literally lived their whole lives together",Chang & Eng Bunker (Siamese twins),NA
1997-03-21,DJ,SOUTH AMERICAN CAPITALS,,600,This city just south of the Equator is the oldest of all South American capitals,"Quito, Ecuador",NA
1997-03-21,DJ,NOVEL TITLES,(Alex: We want you to give as your response the title of a novel),600,"Kill an old lady pawnbroker, get sent to Siberia",Crime And Punishment,NA
1997-03-21,DJ,MILITARY GOVERNORS,,800,He was military governor of Judea 26-36 A.D.,Pontius Pilate,NA
1997-03-21,DJ,OPERA,,800,"This Leoncavallo opera ends with the words ""La commedia e finita"" -- ""The comedy is ended""",Pagliacci,NA
1997-03-21,DJ,BIRDS,,800,"You win the ""prize"" if you know this seabird was named for its stupidity in being easily caught",Booby,NA
1997-03-21,DJ,FAMOUS PAIRS,,800,This British pair won 4 consecutive ice dancing world championships 1981-84,Torvill & Dean,NA
1997-03-21,DJ,SOUTH AMERICAN CAPITALS,,800,Juscelino Kubitschek de Oliveira was the leader of the 1950s movement to build this capital,Brasilia,NA
1997-03-21,DJ,NOVEL TITLES,(Alex: We want you to give as your response the title of a novel),800,Al Manheim wonders this about an eager kid named Glick,What Makes Sammy Run?,NA
1997-03-21,DJ,MILITARY GOVERNORS,,1000,"Appointed military governor of this Canadian city in 1760, Thomas Gage was made a major general in 1761",Montreal,NA
1997-03-21,DJ,OPERA,,1000,"Like ""Carmen"", Prokofiev's opera ""The Duenna"" takes place in this Spanish city",Seville,NA
1997-03-21,NA,NA,NA,NA,NA,NA,NA
1997-03-21,DJ,FAMOUS PAIRS,,1000,This standard encyclopedia first issued in 1912 was named for a pair of Lutheran ministers,Funk & Wagnalls,NA
1997-03-21,DJ,SOUTH AMERICAN CAPITALS,,1000,"Fueled by the oil industry, this capital has sprawled into the state of Miranda","Caracas, Venezuela",NA
1997-03-21,DJ,NOVEL TITLES,(Alex: We want you to give as your response the title of a novel),NA,Philip Marlowe isn't ready to say it to his friend Terry Lennox,The Long Goodbye,NA
1997-03-21,FJ,INVENTORS,,NA,"Before the Monitor, John Ericsson designed a screw-driven steamboat & named it for this ancient Greek",Archimedes,NA
