date,round,category,comment,value,clue,response,link
1997-04-11,J,NOTABLE NAMES,,100,"On his return to England in 1836, he began setting down his theory of evolution",Charles Darwin,NA
1997-04-11,J,ROCK MUSIC GEOGRAPHY,,100,"You can get down under to the music of this country's Hoodoo Gurus, Midnight Oil & INXS",Australia,NA
1997-04-11,J,AGRICULTURE,,100,This country usually produces almost one-third of the world's coffee crop,Brazil,NA
1997-04-11,J,LITERATURE,,100,"This Dickens novel about a foundling is subtitled ""The Parish Boy's Progress""",Oliver Twist,NA
1997-04-11,J,ODDS & ENDS,,100,This company's New York Stock Exchange symbol is HNZ,Heinz,NA
1997-04-11,J,"CROSSWORD CLUES ""A""",,100,Biblical boat            (3),Ark,NA
1997-04-11,J,NOTABLE NAMES,,200,"This czar died in the Russian city he named for his patron saint February 8, 1725",Peter the Great,NA
1997-04-11,J,ROCK MUSIC GEOGRAPHY,,200,"Punk precursors The MC5 were named for this ""Motor City"", their home base",Detroit,NA
1997-04-11,J,AGRICULTURE,,200,Nitrogen fertilizers are produced primarily from this gas,Ammonia,NA
1997-04-11,J,LITERATURE,,200,"His ""Anna Karenina"" was originally published in installments between 1875 & 1877",Leo Tolstoy,NA
1997-04-11,J,ODDS & ENDS,,200,"With almost 3 million, this country leads the world in the number of active duty troops",China,NA
1997-04-11,J,"CROSSWORD CLUES ""A""",,200,Wonderland waif            (5),Alice,NA
1997-04-11,J,NOTABLE NAMES,,300,"At Moscow's American National Exhibition in 1959, they engaged in an impromptu ""kitchen debate""",Richard Nixon & Nikita Khrushchev,NA
1997-04-11,J,ROCK MUSIC GEOGRAPHY,,300,"The songs of Jefferson Airplane were in the air during this city's 1967 ""Summer Of Love""",San Francisco,NA
1997-04-11,J,AGRICULTURE,,300,It's the main labor union for migrant workers,UFW (United Farm Workers),NA
1997-04-11,J,LITERATURE,,300,"It's the English title of Isabel Allende's novel ""La Casa de los Espiritus""",The House of the Spirits,NA
1997-04-11,J,ODDS & ENDS,,300,"This 7-letter word can mean a transparent coating on a wood surface, or to apply the coating",Varnish,NA
1997-04-11,J,"CROSSWORD CLUES ""A""",,300,"""Baked"" state          (6)",Alaska,NA
1997-04-11,J,NOTABLE NAMES,,400,"5 Hawaiian kings assumed this name meaning ""The Very Lonely One"" or ""The One Set Apart""",Kamehameha,NA
1997-04-11,J,ROCK MUSIC GEOGRAPHY,,400,Georgia college town that gave us R.E.M. & the B-52's,Athens (home of the Univ. of Georgia),NA
1997-04-11,J,AGRICULTURE,,400,The Department of Agriculture's official seal features corn & this farm implement,Plow,NA
1997-04-11,J,LITERATURE,,400,"William Dean Howells wrote of Silas Lapham & she wrote of ""Silas Marner""",George Eliot,NA
1997-04-11,J,ODDS & ENDS,,400,"The ""Phoenix"" was the first newspaper to appear in the language of this Native American tribe",Cherokee,NA
1997-04-11,J,"CROSSWORD CLUES ""A""",,400,Letter-perfect soup            (8),Alphabet,NA
1997-04-11,J,NOTABLE NAMES,,500,A clinic at Johns Hopkins hospital is named for this financier who had a penchant for sparkling jewelry,"James ""Diamond Jim"" Brady",NA
1997-04-11,J,ROCK MUSIC GEOGRAPHY,,500,"Prince, a native of this city, pioneered the smooth, funky ""sound"" named for it",Minneapolis,NA
1997-04-11,J,AGRICULTURE,,500,More of the Earth's surface is covered by this grain than by any other food crop,Wheat,NA
1997-04-11,J,LITERATURE,,500,In this 1979 book Norman Mailer told the story of convicted killer Gary Gilmore,The Executioner\'s Song,NA
1997-04-11,J,ODDS & ENDS,,500,"In the presidential oath of office, this word can be substituted for ""swear""",Affirm,NA
1997-04-11,J,"CROSSWORD CLUES ""A""",,NA,It's close to Curacao           (5),Aruba,NA
1997-04-11,DJ,HISTORY,,200,In 1978 this European country created a new canton for French-speaking Catholics,Switzerland,NA
1997-04-11,DJ,TV ACTORS & ACTRESSES,,200,"Harry Bratsburg is the real name of this character actor who played Colonel Potter on ""M*A*S*H""",Harry Morgan,NA
1997-04-11,DJ,NATURE,,200,Chipmunks go into a sleeplike state called torpor during this winter period,Hibernation,NA
1997-04-11,DJ,THE MIDWEST,,200,"In mid-July 1995 this climatic extreme killed hundreds of Midwesterners, many elderly",Heat wave,NA
1997-04-11,DJ,THE CABINET,,200,This head of the post office was part of the cabinet from William Barry in 1829 to Winton Blount in 1971,Postmaster General,NA
1997-04-11,DJ,FOREIGN WORDS & PHRASES,,200,"This 2-word French phrase is commonly used to wish someone a healthy, hearty meal",Bon Appetit,NA
1997-04-11,DJ,HISTORY,,400,"While mayor of Paris, he lost twice to Francois Mitterand in elections for the French presidency",Jacques Chirac,NA
1997-04-11,DJ,TV ACTORS & ACTRESSES,,400,"She co-starred with her husband Bruce Boxleitner in the 1995 miniseries ""Danielle Steel's Zoya""",Melissa Gilbert,NA
1997-04-11,DJ,NATURE,,400,"Though the small species that carpet damp forest areas are more familiar, these plants can grow a yard high",Mosses,NA
1997-04-11,DJ,THE MIDWEST,,400,"Sedalia, Missouri, where Scott Joplin once lived, is known as the cradle of this style of music",Rag/ragtime,NA
1997-04-11,DJ,THE CABINET,,400,"Their ""affairs"" are the concern of secretary Jesse Brown",Veterans,NA
1997-04-11,DJ,FOREIGN WORDS & PHRASES,,400,"The name of these noted Russian cavalrymen is from a Turkic word for ""adventurer""",Cossacks,NA
1997-04-11,DJ,HISTORY,,600,Beginning in 1947 about 6 million Muslims fled from India to this country carved from it,Pakistan,NA
1997-04-11,DJ,TV ACTORS & ACTRESSES,,600,In October 1996 Anthony LaPaglia joined the cast of this series as wily attorney Jimmy Wyler,Murder One,NA
1997-04-11,DJ,NATURE,,600,"The caracal, a short-tailed African wildcat, is a close relative of this short-tailed North American animal",Bobcat,NA
1997-04-11,DJ,THE MIDWEST,,600,This adjective is often applied to Midwesterners' accents as well as to the Midwestern landscape,Flat,NA
1997-04-11,DJ,THE CABINET,,NA,"Famous people in this post have included Albert Fall, Stewart Udall & James Watt",Secretary of the Interior,NA
1997-04-11,DJ,FOREIGN WORDS & PHRASES,,600,They're the German equivalents of Mr. & Mrs.,Herr und Frau,NA
1997-04-11,DJ,HISTORY,,NA,"During the 18th century, England gained control over the Miskito Indians in Honduras & this country",Nicaragua,NA
1997-04-11,DJ,TV ACTORS & ACTRESSES,,800,"Now an ""ER"" doctor, he played Helen Hunt's teenage brother on the 1980s sitcom ""It Takes Two""",Anthony Edwards,NA
1997-04-11,DJ,NATURE,,800,A cylindrical sea creature is named for this salad ingredient,Cucumber,NA
1997-04-11,DJ,THE MIDWEST,,800,"From around 1885 to 1910 the political machine of George ""Boss"" Cox ran this southern Ohio metropolis",Cincinnati,NA
1997-04-11,DJ,THE CABINET,,800,From 1801 to 1804 Levi Lincoln was Attorney General; from 1881 to 1885 this Lincoln was Secretary of War,Robert Lincoln,NA
1997-04-11,DJ,FOREIGN WORDS & PHRASES,,800,"It's how you say ""Thank You"" in Japanese",Arigato,NA
1997-04-11,DJ,HISTORY,,1000,"In 1772 this empress participated in the first partition of Poland, acquiring Galicia for Austria",Maria Theresa,NA
1997-04-11,DJ,TV ACTORS & ACTRESSES,,1000,"Film fans know him as Brad in ""The Rocky Horror Picture Show""; now he's the mayor of NYC on ""Spin City""",Barry Bostwick,NA
1997-04-11,DJ,NATURE,,1000,"The extinct ""great"" species of this penguinlike seabird couldn't fly; living types can",Auk,NA
1997-04-11,DJ,THE MIDWEST,,1000,The families of Midwesterners Thorstein Veblen & Knute Rockne came from this Scandinavian country,Norway,NA
1997-04-11,DJ,THE CABINET,,1000,"He ran against Wilson for pres., served Harding & Coolidge as Secretary of State & became a chief justice",Charles Evans Hughes,NA
1997-04-11,DJ,FOREIGN WORDS & PHRASES,,1000,"This Dutch word can refer to a violent situation, or to a whirlpool",Maelstrom,NA
1997-04-11,FJ,PLAYWRIGHTS,,NA,"The hero of this playwright's Absurdist novel ""Watt"" works for a mysterious Mr. Knott, who never appears",Samuel Beckett,NA
