date,round,category,comment,value,clue,response,link
2006-11-13,J,GRAND CENTRAL STATION,,200,This former Chicago Bull has a steakhouse in the station,Michael Jordan,NA
2006-11-13,J,NEW TABLOID DUOS,(Alex: You have to identify the two people who make up each duo.),200,"A scandalous, legendary Camelot couple: Lancevere",Lancelot & Guinevere,NA
2006-11-13,J,HOW I MET YOUR MOTOR,,200,"A ""chopper"" can be a type of helicopter or a type of this vehicle",motorcycle,NA
2006-11-13,J,PLAYBILL,(Alex: The Broadway magazine.),200,It's been reigning over Broadway since 1997--long may it roar,The Lion King,http://www.j-archive.com/media/2006-11-13_J_03.jpg
2006-11-13,J,SNAKES ON A GAME,,200,"The Jacobson's organ in the roof of a snake's mouth is its organ of this sense, not taste",smell,NA
2006-11-13,J,3-LETTER WORDS,(Alex: It sounds easy.),200,An actor takes one during his curtain call,a bow,NA
2006-11-13,J,GRAND CENTRAL STATION,,400,This '60s first lady helped save Grand Central Station from destruction in the 1970s,Jackie Kennedy,NA
2006-11-13,J,NEW TABLOID DUOS,(Alex: You have to identify the two people who make up each duo.),400,Bet their charity foundation gets free software: Billinda,Bill & Melinda Gates,NA
2006-11-13,J,HOW I MET YOUR MOTOR,,400,"Appropriately, this Michigan city is known as ""Motor City""",Detroit,NA
2006-11-13,J,PLAYBILL,(Alex: The Broadway magazine.),400,"Calling all swingers, you'll go ape over this musical",Tarzan,http://www.j-archive.com/media/2006-11-13_J_05.jpg
2006-11-13,J,SNAKES ON A GAME,,400,The distinctive type of movement of the snake seen here gives it this name,a sidewinder,http://www.j-archive.com/media/2006-11-13_J_13.wmv
2006-11-13,J,3-LETTER WORDS,(Alex: It sounds easy.),400,Throw away your oven & join Woody Harrelson in the movement for this type of food,raw,NA
2006-11-13,J,GRAND CENTRAL STATION,,600,An entire alien civilization lives in a locker at Grand Central in the sequel to this Will Smith-Tommy Lee Jones film,Men In Black,NA
2006-11-13,J,NEW TABLOID DUOS,(Alex: You have to identify the two people who make up each duo.),600,"Sadly, marriage didn't work out for this New York showbiz couple:Daviza,with a D",Liza Minnelli & David Gest,NA
2006-11-13,NA,NA,NA,NA,NA,NA,NA
2006-11-13,J,PLAYBILL,(Alex: The Broadway magazine.),600,It's been a real tease since 2002,Hairspray,http://www.j-archive.com/media/2006-11-13_J_06.jpg
2006-11-13,J,SNAKES ON A GAME,,600,"Each year in India, up to 50,000 people are killed by kraits & these ""hooded"" snakes",a cobra,NA
2006-11-13,J,3-LETTER WORDS,(Alex: It sounds easy.),600,"Muhammad Ali stung like a bee with this short, straight punch",a jab,NA
2006-11-13,NA,NA,NA,NA,NA,NA,NA
2006-11-13,J,NEW TABLOID DUOS,(Alex: You have to identify the two people who make up each duo.),800,Stephen Colbert dubbed this acting duo Filliam H. Muffman,Felicity Huffman & William H. Macy,NA
2006-11-13,NA,NA,NA,NA,NA,NA,NA
2006-11-13,J,PLAYBILL,(Alex: The Broadway magazine.),800,"""A Chorus Line"" is ""one singular sensation"" again on Broadway with the music of this Tony-winning composer",Marvin Hamlisch,http://www.j-archive.com/media/2006-11-13_J_07.jpg
2006-11-13,J,SNAKES ON A GAME,,800,"Crotalus horridus is the timber species of this ""noisy"" venomous snake",rattlesnake,NA
2006-11-13,J,3-LETTER WORDS,(Alex: It sounds easy.),800,"A politician taking the low road is said to ""sling"" this",mud,NA
2006-11-13,NA,NA,NA,NA,NA,NA,NA
2006-11-13,J,NEW TABLOID DUOS,(Alex: You have to identify the two people who make up each duo.),NA,Even today they get the royal treatment:Charilla,Charles & Camilla Parker Bowles,NA
2006-11-13,NA,NA,NA,NA,NA,NA,NA
2006-11-13,J,PLAYBILL,(Alex: The Broadway magazine.),1000,"It's the last name of the great Dame seen here, who, in 2004, was ""Back With a Vengeance""",Everage,http://www.j-archive.com/media/2006-11-13_J_08a.jpg
2006-11-13,NA,NA,NA,NA,NA,NA,NA
2006-11-13,J,3-LETTER WORDS,(Alex: It sounds easy.),1000,"Manly first name of British plotter Fawkes & ""Sesame Street"" game-show host Smiley",Guy,NA
2006-11-13,DJ,NOTABLE NAMES,,400,Some thought she was on a spy mission when her plane disappeared over the Pacific in 1937,Amelia Earhart,NA
2006-11-13,DJ,NEIL! PATRICK! HARRIS!,,400,In 1969 he placed a seismometer meant to detect moonquakes,Neil Armstrong,NA
2006-11-13,DJ,WORLD CAPITALS,,400,In 1970 this capital's Place de L'Etoile was renamed Place Charles de Gaulle,Paris,NA
2006-11-13,DJ,DESPERATE WHITE HOUSE,,400,His presidency saw the first federal budget surplus in 29 years but also the second impeachment of a president,Clinton,NA
2006-11-13,DJ,MAGAZINES,,400,"Alfred E. Neuman is the worry-free, gap-toothed cover boy of this humor magazine",Mad,NA
2006-11-13,DJ,LILITH FAIR,,400,"Discouraged by women's place in rock & roll, this Nova Scotian seen here started Lilith Fair in 1997",Sarah McLachlan,http://www.j-archive.com/media/2006-11-13_DJ_21.jpg
2006-11-13,DJ,NOTABLE NAMES,,800,In 1958 his castle & San Simeon estate became California State Historic Landmark No. 640,William Randolph Hearst,NA
2006-11-13,DJ,NEIL! PATRICK! HARRIS!,,800,"This Revolutionary hero said, ""If this be treason, make the most of it""--as well as the liberty or death bit",Patrick Henry,NA
2006-11-13,DJ,WORLD CAPITALS,,800,This capital's Cathedral of the Archangel Michael is the burial site for many czars,Moscow,NA
2006-11-13,DJ,DESPERATE WHITE HOUSE,,800,"Two days after Fort Sumter fell, this president called for 75,000 men for the army & got more than he could equip",Abraham Lincoln,NA
2006-11-13,DJ,MAGAZINES,,800,In the names of magazines this word follows both Architectural & Reader's,Digest,NA
2006-11-13,NA,NA,NA,NA,NA,NA,NA
2006-11-13,NA,NA,NA,NA,NA,NA,NA
2006-11-13,DJ,NEIL! PATRICK! HARRIS!,,1200,"His film roles included Dumbledore in the ""Harry Potter"" series",Richard Harris,NA
2006-11-13,DJ,WORLD CAPITALS,,NA,The Sphinx lies just a few miles southwest of this capital,Cairo,NA
2006-11-13,DJ,DESPERATE WHITE HOUSE,,NA,"At a particularly rough time, John Dean said there was ""a cancer growing on (his) presidency""",Richard Nixon,NA
2006-11-13,DJ,MAGAZINES,,1200,"In 1928 Time magazine chose its first ""Man of the Year""; in 1985 this magazine began crowning ""The Sexiest Man Alive""",People,NA
2006-11-13,NA,NA,NA,NA,NA,NA,NA
2006-11-13,DJ,NOTABLE NAMES,,1600,"At his death in 1931, this Jersey boy had more than a thousand patents to his name",Thomas Edison,NA
2006-11-13,DJ,NEIL! PATRICK! HARRIS!,,1600,"After Buffalo Springfield broke up, this guy rejoined Stephen Stills & 2 others in 1969",Neil Young,NA
2006-11-13,DJ,WORLD CAPITALS,,1600,"Built on the site of the Aztecs' capital, it later served as the capital of New Spain",Mexico City,NA
2006-11-13,DJ,DESPERATE WHITE HOUSE,,1600,Televised hearings on the Iran-Contra affair revealed deep conflict among members of this Republican's administration,Ronald Reagan,NA
2006-11-13,DJ,MAGAZINES,,1600,Mick Jagger's band has been on the cover of this music magazine founded in 1967 more than anyone else--how fitting,Rolling Stone,NA
2006-11-13,NA,NA,NA,NA,NA,NA,NA
2006-11-13,DJ,NOTABLE NAMES,,2000,"In 1721 he was proclaimed ""Father of his Country"", ""Emperor of all Russia"" & ""the Great""",Peter,NA
2006-11-13,DJ,NEIL! PATRICK! HARRIS!,,2000,This 7-foot center out of Georgetown starred for the Knicks in the '80s & '90s,Patrick Ewing,NA
2006-11-13,DJ,WORLD CAPITALS,,2000,"The old part of this European capital has 3 main squares: Dam, Leidseplein & Rembrandtsplein",Amsterdam,NA
2006-11-13,DJ,DESPERATE WHITE HOUSE,,2000,A stock-market crash during his presidency vacuumed up $40 billion in losses & 40% of the value of NYSE stocks,Herbert Hoover,NA
2006-11-13,DJ,MAGAZINES,,2000,"This ""national"" magazine that takes readers all over the world has been around since 1888",National Geographic,NA
2006-11-13,DJ,LILITH FAIR,,2000,This alliterative femme was the first unsigned artist to have a No. 1 hit in the United States,Lisa Loeb,http://www.j-archive.com/media/2006-11-13_DJ_23.jpg
2006-11-13,FJ,THE ENCYCLOPEDIA BRITANNICA,,NA,"In the 1958 edition, this man penned the article on ventriloquism",Edgar Bergen,NA
