date,round,category,comment,value,clue,response,link
2005-02-07,J,BOTANY,,200,Growers of this pitted red pie fruit plant mulberry trees near their orchards to entice birds away,cherries,NA
2005-02-07,J,NEWSPAPER COMICS,,200,"Linus, the insecure boy seen here, is found in this comic strip",Peanuts,http://www.j-archive.com/media/2005-02-07_J_18.jpg
2005-02-07,J,GUM,(Alex: You're not supposed to chew it on our program...),200,Its campaign using twins dates back to the 1930s,Doublemint,NA
2005-02-07,J,THE LAST KING,,200,"Called the ""Citizen King"", Louis Philippe was the last king of this country",France,NA
2005-02-07,J,MAKES SCENTS TO ME!,,200,"Perfect for Valentine's Day, Fiorucci Loves You comes in a bottle shaped like one of these pierced with an arrow",a heart,NA
2005-02-07,J,CLEAN 4-LETTER WORDS,,200,"The bird that found land for Noah, or the soap that's 1/4 moisturizing lotion",Dove,NA
2005-02-07,J,BOTANY,,400,"(Cheryl of the Clue Crew reports from a ski slope.)  The bristlecone variety of this tree is the oldest type of living tree in the U.S., and can live 4,000 years or more",a pine,http://www.j-archive.com/media/2005-02-07_J_09a.jpg
2005-02-07,J,NEWSPAPER COMICS,,400,"This ""Horrible"" Viking of the comics has a son named Hamlet & a daughter named Honi",Hagar the Horrible,NA
2005-02-07,J,GUM,(Alex: You're not supposed to chew it on our program...),400,Walter Diemer only had this color of food dye on hand when he created his bubble gum,pink,NA
2005-02-07,J,THE LAST KING,,400,Kalakaua was the last king of what is now this U.S. state,Hawaii,NA
2005-02-07,J,MAKES SCENTS TO ME!,,400,Stacked Style makes 2 fragrances that rhyme: Razzle & this one,Dazzle,NA
2005-02-07,J,CLEAN 4-LETTER WORDS,,400,"The first appearance of daylight, or the dishwashing detergent that's tough on grease",Dawn,NA
2005-02-07,J,BOTANY,,NA,"His garden at Altbrunn Monastery included several pairs of yellow peas, each with a different trait",(Gregor) Mendel,NA
2005-02-07,J,NEWSPAPER COMICS,,600,"Don't laugh--he's the long-term adversary of Batman, seen here",The Joker,http://www.j-archive.com/media/2005-02-07_J_20.jpg
2005-02-07,J,GUM,(Alex: You're not supposed to chew it on our program...),600,"It calls itself ""America's No. 1 Cinnamon Gum""",Big Red,NA
2005-02-07,J,THE LAST KING,,600,"Leaving the throne in 1910, Manuel II was the last king of this European country",Portugal,NA
2005-02-07,J,MAKES SCENTS TO ME!,,600,"Dolce & Gabbana's light blue perfume smells like bluebell, bamboo & the Granny Smith type of this",apple,NA
2005-02-07,J,CLEAN 4-LETTER WORDS,,600,"How you feel when you're happy, or the joy of putting trash in this product's garbage bags, the first plastic ones sold",Glad,NA
2005-02-07,J,BOTANY,,800,"Maidenhair, Bracken, & Boston are species of this spore-bearing plant",a fern,NA
2005-02-07,J,NEWSPAPER COMICS,,800,They're the devilish duo of the funny pages seen here,Calvin and Hobbes,http://www.j-archive.com/media/2005-02-07_J_26.jpg
2005-02-07,J,GUM,(Alex: You're not supposed to chew it on our program...),800,Recent ads for this gum have offered reasons why the fifth dentist didn't recommend sugarless gum,Trident,NA
2005-02-07,J,THE LAST KING,,800,"Victor Emmanuel II didn't mind being the last king of this ""fishy"" Italian island; he got to be the first king of Italy",Sardinia,NA
2005-02-07,J,MAKES SCENTS TO ME!,,800,Taste is this singer's own personal fragrance creation for her Dessert Beauty line,Jessica Simpson,NA
2005-02-07,J,CLEAN 4-LETTER WORDS,,800,"The rise & fall of the ocean water, or a detergent that has cleaned clothes for more than 50 years",Tide,NA
2005-02-07,J,BOTANY,,1000,"Flowering plants range in size from the duckweed at 1/50"" long to this Australian gum tree that reaches 300 feet in height",a eucalyptus tree,NA
2005-02-07,J,NEWSPAPER COMICS,,1000,Ack!  He's the health-challenged pussy and friend of Opus seen here,Bill the Cat,http://www.j-archive.com/media/2005-02-07_J_30.jpg
2005-02-07,J,GUM,(Alex: You're not supposed to chew it on our program...),1000,The name of this gum brand sounds like a hard tissue found in teeth,Dentyne,NA
2005-02-07,J,THE LAST KING,,1000,"The last king of Greece shared this name with a ""Great"" Christian Roman Emperor",Constantine,NA
2005-02-07,J,MAKES SCENTS TO ME!,,1000,Bottles of this company's Brit perfume feature its famous plaid pattern,Burberry,http://www.j-archive.com/media/2005-02-07_J_14.jpg
2005-02-07,J,CLEAN 4-LETTER WORDS,,1000,"The knob on a radio, or the antibacterial soap you'd use on your hands if the knob was dirty",Dial,NA
2005-02-07,DJ,BLACK HISTORY MONTH,,400,In September 2004 she made history on TV by giving a brand new car to each member of her audience,Oprah (Winfrey),NA
2005-02-07,DJ,AMERICAN IDOL SONGS,,400,"Keith Beukelaer's version of this woman's ""Like A Virgin"" moved Simon to call him maybe the world's worst singer",Madonna,NA
2005-02-07,DJ,WORLD TRAVEL,,400,You can see snakes being milked for venom at the Red Cross snake farm in this capital of Thailand,Bangkok,NA
2005-02-07,DJ,TEXT MESSAGING,,400,"In this classic by Louisa May Alcott, Mrs. March got a letter addressed to ""My precious Marmee"" from her ""Topsy-turvy Jo""",Little Women,NA
2005-02-07,DJ,CATCH OF THE DAY,,400,A large albino whale recently sighted off Australia earned comparisons to this 1851 Melville beast,Moby-Dick,NA
2005-02-07,DJ,OPPOSITES ATTRACT,,400,"In grammar, it's the opposite of a suffix",a prefix,NA
2005-02-07,DJ,BLACK HISTORY MONTH,,800,Kweisi Mfume left the House of Representatives to head this civil rights organization in February 1996,the NAACP,NA
2005-02-07,DJ,AMERICAN IDOL SONGS,,800,"Diana DeGarmo sang ""My Heart Will Go On"", just like her favorite female pop singer, this ""Titanic"" chanteuse",Céline Dion,NA
2005-02-07,DJ,WORLD TRAVEL,,800,"Visit Ashgabat, Turkmenistan & you'll find that it's the sister city of this largest town in New Mexico",Albuquerque,NA
2005-02-07,DJ,TEXT MESSAGING,,800,"Van Helsing writes to Mrs. Harker to send her ""sad news of Miss Lucy Westerna's death"" in this spooky novel",Dracula,NA
2005-02-07,DJ,CATCH OF THE DAY,,800,"In one of the few times it's ever been seen, a rare megamouth variety of this fish recently washed ashore in Sumatra",a shark,NA
2005-02-07,DJ,OPPOSITES ATTRACT,,800,An epilogue is found at the end of a book; this opposite term is a short section at the beginning of a book,a prologue,NA
2005-02-07,DJ,BLACK HISTORY MONTH,,1200,"The army's last black regiment, the 24th infantry, was disbanded in October 1951, during this war",the Korean War,NA
2005-02-07,DJ,AMERICAN IDOL SONGS,,1200,"The first concert that Justin Guarini went to was this artist & his family; on ""Idol"", Justin sang ""P.Y.T.""",Michael Jackson,NA
2005-02-07,DJ,WORLD TRAVEL,,NA,"You might hire a mule to help you trek to the top of Mount Aconcagua, the higest peak on this continent",South America,NA
2005-02-07,DJ,TEXT MESSAGING,,1200,Madame Defarge knits a list in code to condemn the aristocracy in this Dickens tale,A Tale of Two Cities,NA
2005-02-07,DJ,CATCH OF THE DAY,,1200,In 2004 a N.J. man pulled one of these tropical predators also called a caribe from the Delaware River,a piranha,NA
2005-02-07,DJ,OPPOSITES ATTRACT,,1200,"The opposite of deride isn't dewalk but this, the title of an Aretha Franklin C-L-A-S-S-I-C",respect,NA
2005-02-07,DJ,BLACK HISTORY MONTH,,1600,"In May 1954, in the case of this family v. the Board of Education, segregation in school was ruled unconstitutional",Brown,NA
2005-02-07,DJ,AMERICAN IDOL SONGS,,1600,"Fantasia gave us ""Something To Talk About"" by belting out this bluesy female guitarist's song",Bonnie Raitt,NA
2005-02-07,DJ,WORLD TRAVEL,,1600,"You'll find the beautiful Butchart Gardens 14 miles north of this city, the ""queen"" of British Columbia",Victoria,NA
2005-02-07,DJ,TEXT MESSAGING,,1600,"A guide book whose cover says ""Don't Panic"" gives this Douglas Adams sci-fi novel its title",The Hitchhiker\'s Guide to the Galaxy,NA
2005-02-07,DJ,CATCH OF THE DAY,,1600,"With a razor-sharp beak & studded tentacles, a 20-foot one of these cephalopods was captured in Antarctica in 2003",a squid,NA
2005-02-07,DJ,OPPOSITES ATTRACT,,1600,"Give yourself credit for knowing that to an accountant, this is the opposite of a credit",a debit,NA
2005-02-07,DJ,BLACK HISTORY MONTH,,2000,In July 1881 this famous college opened in Alabama with Booker T. Washington as its first principal,Tuskegee,NA
2005-02-07,DJ,AMERICAN IDOL SONGS,,2000,"Clay Aiken sang the classic song about him, ""The Knife""",Mack,NA
2005-02-07,DJ,WORLD TRAVEL,,2000,"Bubbling mud pools, erupting geysers, & Maori song & dance will delight you at Whakarewarewa in this country",New Zealand,NA
2005-02-07,DJ,TEXT MESSAGING,,NA,"Christian gives Roxane a letter saying he loves her ""beyond measure""; this title character actually wrote it",Cyrano de Bergerac,NA
2005-02-07,DJ,CATCH OF THE DAY,,2000,"Sadly, the journey ended for Keiko, one of these animals, in 2003",an orca (or killer whale),NA
2005-02-07,DJ,OPPOSITES ATTRACT,,2000,Oil that's been processed for use is called refined; unrefined oil right out of the ground is called this,crude,NA
2005-02-07,FJ,THE ELEMENTS,,NA,"By weight, this element makes up more of the human body than all the others combined",oxygen,NA
