date,round,category,comment,value,clue,response,link
1997-05-05,J,WORLD PRESS,(VARLDS-PRESS),100,Some citizens in this Canadian capital get their news from the Citizen newspaper,Ottawa,NA
1997-05-05,J,AFRICAN HISTORY,(AFRIKANSK HISTORIA),100,In the 1500s the Portuguese transported Angolans as slaves to this South American colony,Brazil,NA
1997-05-05,J,"NUMBER, PLEASE","(TALET, TACK)",100,You saw thousands of spots before your eyes in the 2 Disney movies about this number of dalmatians,101,NA
1997-05-05,NA,NA,NA,NA,NA,NA,NA
1997-05-05,NA,NA,NA,NA,NA,NA,NA
1997-05-05,J,SPORTS TERMS,(SPORT-TERMER),100,"Racket,baseline,backcourt",Tennis,NA
1997-05-05,J,WORLD PRESS,(VARLDS-PRESS),200,"Xinhua, China's news agency, was founded by this political party",Communist Party,NA
1997-05-05,J,AFRICAN HISTORY,(AFRIKANSK HISTORIA),200,In 1969 General Siad Barre led a military coup in this country on the horn of Africa,Somalia,NA
1997-05-05,J,"NUMBER, PLEASE","(TALET, TACK)",200,"In the Biblical flood, the rain lasted this many days; the water stayed 110 more",40,NA
1997-05-05,J,BARNYARD ANIMALS,(DJUR I LAGARIN),200,"When bringing home the bacon, remember that this animal's meat is taboo to observant Muslims & Jews",Pig/swine,NA
1997-05-05,J,20th CENTURY WOMEN,(1900-TALS-KVINNOR),200,"On July 8, 1993 this British princess' stepmother, Raine Spencer, married a French count",Princess Diana,NA
1997-05-05,J,SPORTS TERMS,(SPORT-TERMER),200,"Fletching,bow,bull's-eye",Archery,NA
1997-05-05,J,WORLD PRESS,(VARLDS-PRESS),300,It's the length of time between issues of Germany's news magazine Der Spiegel,One week,NA
1997-05-05,J,AFRICAN HISTORY,(AFRIKANSK HISTORIA),300,Shaka increased the population of this tribe by absorbing his defeated enemies into it,Zulu,NA
1997-05-05,J,"NUMBER, PLEASE","(TALET, TACK)",300,"On a square, it's the total number of degrees of the interior angles",360,NA
1997-05-05,J,BARNYARD ANIMALS,(DJUR I LAGARIN),300,"A ""maid"" may have a special stool to sit on while attending to this bovine animal",a cow,NA
1997-05-05,J,20th CENTURY WOMEN,(1900-TALS-KVINNOR),300,"She was sworn in as Pakistan's first female prime minister on December 2, 1988 in Islamabad",Benazir Bhutto,NA
1997-05-05,J,SPORTS TERMS,(SPORT-TERMER),300,"Backward short leg,bat,wicket",Cricket,NA
1997-05-05,J,WORLD PRESS,(VARLDS-PRESS),400,El Periodico de Catalunya is the second-largest newspaper serving this second-largest Spanish city,Barcelona,NA
1997-05-05,J,AFRICAN HISTORY,(AFRIKANSK HISTORIA),400,This west African country takes its name from a trading empire that once included Timbuktu,Mali,NA
1997-05-05,J,"NUMBER, PLEASE","(TALET, TACK)",400,"John Lennon & Paul McCartney were in their 20s when they wrote ""When I'm"" this old",64,NA
1997-05-05,NA,NA,NA,NA,NA,NA,NA
1997-05-05,NA,NA,NA,NA,NA,NA,NA
1997-05-05,J,SPORTS TERMS,(SPORT-TERMER),400,"Pelota,cesta,cancha",jai alai,NA
1997-05-05,J,WORLD PRESS,(VARLDS-PRESS),500,"Now available around the world, this paper grew out of the N.Y. Herald's Paris edition",The International Herald Tribune,NA
1997-05-05,NA,NA,NA,NA,NA,NA,NA
1997-05-05,J,"NUMBER, PLEASE","(TALET, TACK)",500,From 1912 to 1959 there were this many states in the United States,48,NA
1997-05-05,NA,NA,NA,NA,NA,NA,NA
1997-05-05,NA,NA,NA,NA,NA,NA,NA
1997-05-05,J,SPORTS TERMS,(SPORT-TERMER),500,"Dohyo,chonmage,yobidashi",Sumo wrestling,NA
1997-05-05,DJ,INTERNATIONAL FESTIVALS,(INTERNATIONELLA FESTIVALER),200,"The running of these animals starts daily at 8 A.M. during the Festival of San Fermin in Pamplona, Spain",Bulls,NA
1997-05-05,DJ,SCULPTURE,(SKULPTUR),200,"In 1504 Leonardo da Vinci was on the commission that decided the location for this man's ""David""",Michelangelo,NA
1997-05-05,DJ,TRAVEL & TOURISM,(RESOR & TURISM),200,At the National Museum in Dublin you can see a bell reportedly used by this patron saint,Saint Patrick,NA
1997-05-05,DJ,THE ELEMENTS,(GRUNDAMMENA),200,Around 3600 B.C. King Menes of Egypt set this precious metal's value at two-fifths that of gold,Silver,NA
1997-05-05,NA,NA,NA,NA,NA,NA,NA
1997-05-05,DJ,LITERARY TRANSLATIONS,(LITTERARAY OVERSATT-NINGAR),200,"Many of these English Christmas songs are translations, like ""Silent Night"" from German",Carols,NA
1997-05-05,DJ,INTERNATIONAL FESTIVALS,(INTERNATIONELLA FESTIVALER),400,This second-largest Australian city's Moomba Festival features a world-class waterskiing tournament,Melbourne,NA
1997-05-05,DJ,SCULPTURE,(SKULPTUR),400,The name of the Farnese bull comes from the Farnese Palace in this Italian capital where it was once kept,Rome,NA
1997-05-05,DJ,TRAVEL & TOURISM,(RESOR & TURISM),400,"Not surprisingly, this Israeli national airline offers the most nonstop flights between Israel & the U.S.",El Al,NA
1997-05-05,DJ,THE ELEMENTS,(GRUNDAMMENA),400,"By volume, this element makes up about 78% of our atmosphere",Nitrogen,NA
1997-05-05,DJ,U.S. PRESIDENTS,(USA:S PRESIDENTER),400,He was a U.S. senator when he married Jacqueline Bouvier in 1953,John F. Kennedy,NA
1997-05-05,DJ,LITERARY TRANSLATIONS,(LITTERARAY OVERSATT-NINGAR),400,"Gilbert Adair faithfully adapted Georges Perec's novel ""A Void"", written without this vowel",E,NA
1997-05-05,DJ,INTERNATIONAL FESTIVALS,(INTERNATIONELLA FESTIVALER),600,In 1996 Wayne Shorter & Dave Brubeck performed at Vienna's festival for this type of music,Jazz,NA
1997-05-05,DJ,SCULPTURE,(SKULPTUR),600,"In 1881 this Cubist painter & sculptor was born in Malaga, Spain, the son of a professor of art",Pablo Picasso,NA
1997-05-05,DJ,TRAVEL & TOURISM,(RESOR & TURISM),600,"In Moscow's Teatralnaya Square, you can take in a show at this famous opera & ballet theater",Bolshoi,NA
1997-05-05,DJ,THE ELEMENTS,(GRUNDAMMENA),600,"Diamond, the hardest known substance, is made of crystallized atoms of this element",Carbon,NA
1997-05-05,DJ,U.S. PRESIDENTS,(USA:S PRESIDENTER),600,"On June 15, 1775 he was unanimously elected Commander in Chief of the Continental Army",George Washington,NA
1997-05-05,DJ,LITERARY TRANSLATIONS,(LITTERARAY OVERSATT-NINGAR),600,"Translator Rosemary Edmonds leaves the final ""A"" off the last name of this Tolstoy title heroine",Anna Karenina,NA
1997-05-05,DJ,INTERNATIONAL FESTIVALS,(INTERNATIONELLA FESTIVALER),800,"""Abduction from the Seraglio"" is performed at Topkapi Palace at this city's annual music festival",Istanbul,NA
1997-05-05,DJ,SCULPTURE,(SKULPTUR),NA,A Cellini masterpiece shows this Greek hero holding the head of Medusa,Perseus,NA
1997-05-05,DJ,TRAVEL & TOURISM,(RESOR & TURISM),800,Verses from the Koran decorate the walls of this marble tomb in Agra built by Shah Jahan for his late wife,Taj Mahal,NA
1997-05-05,DJ,THE ELEMENTS,(GRUNDAMMENA),NA,"This metal, the lightest solid element, was discovered here in Sweden by J.A. Arfvedson",Lithium,NA
1997-05-05,DJ,U.S. PRESIDENTS,(USA:S PRESIDENTER),800,"A revolving book stand he adapted may be seen at his home, Monticello",Thomas Jefferson,NA
1997-05-05,DJ,LITERARY TRANSLATIONS,(LITTERARAY OVERSATT-NINGAR),800,"2 translators of this man's ""The Satanic Verses"" were brutally attacked in July 1991",Salman Rushdie,NA
1997-05-05,DJ,INTERNATIONAL FESTIVALS,(INTERNATIONELLA FESTIVALER),1000,Yearly this small southeast Asian island country celebrates the 9 Emperor Gods with a 9-day festival,Singapore,NA
1997-05-05,DJ,SCULPTURE,(SKULPTUR),1000,Toronto's City Hall has an outdoor work by this British sculptor known for using holes in his art,Henry Moore,NA
1997-05-05,DJ,TRAVEL & TOURISM,(RESOR & TURISM),1000,Tourism is a growing industry in this pair of Caribbean islands known as T&T for short,Trinidad & Tobago,NA
1997-05-05,DJ,THE ELEMENTS,(GRUNDAMMENA),1000,This synthetic radioactive element was named for the discoverers of radium,Curium,NA
1997-05-05,DJ,U.S. PRESIDENTS,(USA:S PRESIDENTER),1000,"In 1859, before he was president, he wrote, ""He who would be no slave must consent to have no slave""",Abraham Lincoln,NA
1997-05-05,DJ,LITERARY TRANSLATIONS,(LITTERARAY OVERSATT-NINGAR),1000,Rabindranath Tagore translated his own poetry into English from this language spoken in Dhaka,Bengali,NA
1997-05-05,FJ,NOTABLE NAMES,,NA,"On January 30, 1997, the 49th anniversary of his death, some of his ashes were scattered in the Ganges River",Mohandas K. Gandhi,NA
