date,round,category,comment,value,clue,response,link
1999-10-21,J,MATH & SCIENCE,,100,"On the centigrade scale, it's the melting point of ice",0 (zero),NA
1999-10-21,J,A WORLD OF BEER,"(Alex: We'll give you the beer, you have to name its country of origin.)",100,Asahi,Japan,NA
1999-10-21,J,SOUTH DAKOTA,,100,The capitol building is on a 30-acre tract in this city overlooking the Missouri River,Pierre,NA
1999-10-21,J,BLACK AMERICANS,,100,In May 1999 he won the release of 3 U.S. soldiers held captive in Serbia,Rev. Jesse Jackson,NA
1999-10-21,J,HIs & BYEs,,100,"It wasn't necessary to dub this Schwarzenegger line in ""T2"" into Spanish","""Hasta La Vista, Baby!""",NA
1999-10-21,J,TV CHARACTERS' MAIDEN NAMES,,100,MacGillicuddy was her TV maiden name from 1951 to 1960 (it still is today in reruns),Lucille Ball,NA
1999-10-21,J,MATH & SCIENCE,,200,1 volt times 1 amp equals this unit,watt,NA
1999-10-21,J,A WORLD OF BEER,"(Alex: We'll give you the beer, you have to name its country of origin.)",200,Foster's,Australia,NA
1999-10-21,J,SOUTH DAKOTA,,NA,"A gruesome clash between the government & the Indians took place here on December 29, 1890",Wounded Knee,NA
1999-10-21,J,BLACK AMERICANS,,200,"During the 1996 Summer Olympics, this boxer was given a new gold medal to replace one from 1960",Muhammad Ali (Cassius Clay),NA
1999-10-21,J,HIs & BYEs,,200,"2-word greeting, or name of a famous fifties freckled marionette",Howdy Doody,NA
1999-10-21,J,TV CHARACTERS' MAIDEN NAMES,,200,"Like Jackie Kennedy, Marge Simpson had this maiden name",Bouvier,NA
1999-10-21,J,MATH & SCIENCE,,300,"Forces like gravity are measured in units abbreviated N., named for this scientist",Isaac Newton,NA
1999-10-21,J,A WORLD OF BEER,"(Alex: We'll give you the beer, you have to name its country of origin.)",300,Beck's,Germany,NA
1999-10-21,J,SOUTH DAKOTA,,300,South Dakota's Homestake Mine is one of the Western Hemisphere's largest producers of this metal,gold,NA
1999-10-21,J,BLACK AMERICANS,,300,"In 1998 this poet & author made her directorial debut with the movie ""Down in the Delta""",Maya Angelou,NA
1999-10-21,J,HIs & BYEs,,300,This reptilian-flavored farewell hails from the '30s,"""See Ya\' Later, Alligator!""",NA
1999-10-21,J,TV CHARACTERS' MAIDEN NAMES,,300,"Jamie had recently shed her maiden name, Stemple, when this sitcom debuted in 1992",Mad About You,NA
1999-10-21,J,MATH & SCIENCE,,400,"To convert kilograms into grams, multiply by this",1000,NA
1999-10-21,J,A WORLD OF BEER,"(Alex: We'll give you the beer, you have to name its country of origin.)",400,Moosehead,Canada,NA
1999-10-21,J,SOUTH DAKOTA,,400,"In Storybook Land in Aberdeen, where this author once lived, the ""Oz"" stories come to life",L. Frank Baum,NA
1999-10-21,J,BLACK AMERICANS,,400,"It's no secret, she was the first black model featured on a Victoria's Secret catalog cover",Tyra Banks,NA
1999-10-21,J,HIs & BYEs,,400,It's how Akihito would bid you farewell,Sayonara,NA
1999-10-21,J,TV CHARACTERS' MAIDEN NAMES,,400,"""Oh, Rob!""  This character was given 2 different maiden names, Meeker & Meehan","Laura Petrie (from ""The Dick Van Dyke Show"")",NA
1999-10-21,J,MATH & SCIENCE,,500,"Musical instruments are tuned to 440 cycles per second, this note on a piano",A,NA
1999-10-21,J,A WORLD OF BEER,"(Alex: We'll give you the beer, you have to name its country of origin.)",500,Harp,Ireland,NA
1999-10-21,J,SOUTH DAKOTA,,500,"On August 2, 1876 this gunfighter was shot in the back of the head by Jack McCall in Deadwood",Wild Bill Hickok,NA
1999-10-21,J,BLACK AMERICANS,,500,He formed his famous New York dance theater company in 1958 with a troupe of only 8 dancers,Alvin Ailey,NA
1999-10-21,J,HIs & BYEs,,500,"Greeting that can follow ""ship"" or ""chips""",Ahoy!,NA
1999-10-21,J,TV CHARACTERS' MAIDEN NAMES,,500,"She played Gloria Stivic, nee Bunker",Sally Struthers,NA
1999-10-21,DJ,SECRETARIES OF STATE,,200,He was the first person who could put U.S. Secretary of State on his resume,Thomas Jefferson,NA
1999-10-21,DJ,FOREIGN-BORN OSCAR WINNERS,,200,"Born in India in 1913, she won her second Oscar for playing Blanche DuBois in 1951",Vivian Leigh,NA
1999-10-21,DJ,SHAKESPEAREAN GEOGRAPHY,,200,The Boar's Head Tavern is one of many Shakespearean settings in this city,London,NA
1999-10-21,DJ,PHIL-ER UP,,200,Da!  In 1987 he became the first American talk show host to tape shows in Russia,Phil Donahue,NA
1999-10-21,DJ,THE YEAR OF THE HEADLINE,,200,Nazis Invade Poland!,1939,NA
1999-10-21,DJ,"""SEVEN""s",,200,"A state of great joy or satisfaction, or a series on the WB Network",Seventh Heaven,NA
1999-10-21,DJ,SECRETARIES OF STATE,,400,Dean Acheson continued the European recovery plan of this predecessor,George Marshall,NA
1999-10-21,DJ,FOREIGN-BORN OSCAR WINNERS,,400,Aussie Geoffrey got quite a rush winning for this 1996 film,Shine,NA
1999-10-21,DJ,SHAKESPEAREAN GEOGRAPHY,,400,"In ""Henry VI, Part 1"" it's a setting; in ""Romeo and Juliet"" it's a suitor for Juliet's hand",Paris,NA
1999-10-21,DJ,PHIL-ER UP,,400,"His impersonations on ""Saturday Night Live"" included Bill Clinton & Frank Sinatra",Phil Hartman,NA
1999-10-21,DJ,THE YEAR OF THE HEADLINE,,400,Frank Sinatra Passes Away!,1998,NA
1999-10-21,DJ,"""SEVEN""s",,400,This religious sect observes the sabbath on Saturday,Seventh-day Adventists,NA
1999-10-21,DJ,SECRETARIES OF STATE,,600,He was the only Secretary of State succeeded by a woman,Warren Christopher,NA
1999-10-21,DJ,FOREIGN-BORN OSCAR WINNERS,,600,"Of the 2 women to win acting awards for 1961, she was the Italian","Sophia Loren (for ""Two Women"")",NA
1999-10-21,DJ,SHAKESPEAREAN GEOGRAPHY,,600,"Messina, where ""Much Ado About Nothing"" takes place, is a port on this Italian island",Sicily,NA
1999-10-21,DJ,PHIL-ER UP,,600,"He composed & sang most of the songs in Disney's ""Tarzan"" movie",Phil Collins,NA
1999-10-21,DJ,THE YEAR OF THE HEADLINE,,600,Nixon Reelected President!,1972,NA
1999-10-21,DJ,"""SEVEN""s",,600,"This Akira Kurosawa film was the basis for the 1960 classic western ""The Magnificent Seven""",The Seven Samurai,NA
1999-10-21,DJ,SECRETARIES OF STATE,,800,"The last Secretary of State to become president, he served under Polk & Taylor before being elected in 1856",James Buchanan,NA
1999-10-21,DJ,FOREIGN-BORN OSCAR WINNERS,,800,"Her last of 3 Oscar wins was for playing Greta Ohlsson in 1974's ""Murder on the Orient Express""",Ingrid Bergman,NA
1999-10-21,DJ,SHAKESPEAREAN GEOGRAPHY,,800,"Hamlet's father, the king of Denmark, killed Fortinbras' father, king of this nearby country",Norway,NA
1999-10-21,DJ,PHIL-ER UP,,800,"This Boston Bruins center led the NHL in goals a record 6 straight seasons, from 1970 to 1975",Phil Esposito,NA
1999-10-21,DJ,THE YEAR OF THE HEADLINE,,800,"""Miracle On Ice!""  U.S. Men's Ice Hockey Team Wins Olympic Gold!",1980,NA
1999-10-21,DJ,"""SEVEN""s",,800,Burt Lancaster plays a general who plans to overthrow the president in this 1964 film,Seven Days in May,NA
1999-10-21,DJ,SECRETARIES OF STATE,,1000,"George Shultz served 7 years in the '80s, the longest run for someone in the post since this man in the '60s",Dean Rusk,NA
1999-10-21,DJ,FOREIGN-BORN OSCAR WINNERS,,NA,"This 1957 winner claimed he was born on Sakhalin Island, about 3,000 miles northeast of Siam",Yul Brynner,NA
1999-10-21,DJ,SHAKESPEAREAN GEOGRAPHY,,NA,"Theseus, duke of this city in ""A Midsummer Night's Dream"", doesn't run into fellow resident Timon",Athens,NA
1999-10-21,DJ,PHIL-ER UP,,1000,"Before he was elected senator, this Texan served in the House as both a Democrat & a Republican",Phil Gramm,NA
1999-10-21,DJ,THE YEAR OF THE HEADLINE,,1000,Sputnik 1 Launched!,1957,NA
1999-10-21,DJ,"""SEVEN""s",,1000,"A report by Marcos De Niza, a Franciscan priest, led Francisco Coronado to seek them",Seven Cities of Cibola/Gold,NA
1999-10-21,FJ,EXPLORERS,,NA,"On hearing of the discovery of George Mallory's body, this man told reporters he still thinks he was first",Sir Edmund Hillary,NA
