date,round,category,comment,value,clue,response,link
1988-11-09,J,"""FOUR"" WORDS",,100,50c,four bits,NA
1988-11-09,J,MOVIE TRIVIA,,100,"Woody Allen's first line in this film is ""Chapter 1.  He adored New York City.  He idolized it...""",Manhattan,NA
1988-11-09,J,POTENT POTABLES,,100,A fifth equals about 1/5 of this,a U.S. gallon,NA
1988-11-09,J,NAMES IN THE NEWS,,100,"After he moves out of his office on Pennsylvania Avenue, he rents an office in Los Angeles",Ronald Reagan,NA
1988-11-09,J,THE REVOLUTIONARY WAR,,100,A statue in New York of this leader was toppled and later made into American bullets,King George III,NA
1988-11-09,J,HAIR CARE,,100,"As a dessert, it can add weight to your body; as a styling product, it can add body to your hair",mousse,NA
1988-11-09,J,"""FOUR"" WORDS",,200,"King, king, king, king, or three, three, three, three, for example",four of a kind,NA
1988-11-09,J,MOVIE TRIVIA,,200,"In ""The Wizard of Oz"", she was the 1st character to wear the ruby slippers",the Wicked Witch of the East,NA
1988-11-09,J,POTENT POTABLES,,200,"Claiming U.S. creation of this ""Gaelic"" drink, San Francisco's Buena Vista Cafe sells some 2,200 cups daily",Irish coffee,NA
1988-11-09,J,NAMES IN THE NEWS,,200,"Yuri Churbanov, son-in-law of this Soviet leader, was tried for taking bribes",Leonid Brezhnev,NA
1988-11-09,J,THE REVOLUTIONARY WAR,,200,Washington attempted to kidnap this man and have him returned to U.S. forces for execution,Benedict Arnold,NA
1988-11-09,J,HAIR CARE,,200,"Style in which hair is rolled under at shoulder length, or a young male attendant at a hotel",page boy,NA
1988-11-09,J,"""FOUR"" WORDS",,300,An auto worker on the night shift might install this shift,four-on-the-floor (or four-speed),NA
1988-11-09,J,MOVIE TRIVIA,,300,The names of these two movie elephants differ by just one letter,Dumbo & Jumbo,NA
1988-11-09,J,POTENT POTABLES,,300,"This strong, dark type of beer takes its name from Einbeck, Germany, where it was first made",bock beer,NA
1988-11-09,J,NAMES IN THE NEWS,,300,This leader of the yippies in the 1960s recently debuted as a comedian in a New York club,Abbie Hoffman,NA
1988-11-09,J,THE REVOLUTIONARY WAR,,300,"The first page of this 1776 pamphlet reads, ""Government even in its best state is but a necessary evil""","""Common Sense""",NA
1988-11-09,J,HAIR CARE,,300,"In dollars, America's biggest-selling shampoo is this one for controlling dandruff",Head & Shoulders,NA
1988-11-09,J,"""FOUR"" WORDS",,400,"""Sweet Adeline"", sung by a barbershop quartet, features a blend of melody lines described as this",four-part harmony,NA
1988-11-09,J,MOVIE TRIVIA,,400,"Though he was best known for directing musicals, the last film he directed was a drama, ""Star 80""",Bob Fosse,NA
1988-11-09,J,POTENT POTABLES,,400,"It's usually made with bourbon, sugar, mint, and crushed ice",a mint julep,NA
1988-11-09,J,NAMES IN THE NEWS,,400,Larry Doyle and Neal Sternecky are reviving this comic strip that Walt Kelly created,Pogo,NA
1988-11-09,J,THE REVOLUTIONARY WAR,,400,This March 1770 event began with a group of rowdies hurling insults and snowballs at British soldiers,Boston Massacre,NA
1988-11-09,J,HAIR CARE,,NA,"Hair care item that's mentioned in the following song:""Won't you come home Bill Bailey /Won't you come home /She moans the whole day long...""",a (fine-tooth) comb,NA
1988-11-09,J,"""FOUR"" WORDS",,500,"A necktie tied a certain way, or a horse-drawn vehicle driven by one person",four-in-hand,NA
1988-11-09,J,MOVIE TRIVIA,,500,Marlon Brando and his motorcycle pals ganged up on a small town in this 1954 film,The Wild One,NA
1988-11-09,J,POTENT POTABLES,,500,Whiskey sours and daiquiris are similar except that daiquiris contain this instead of whiskey,rum,NA
1988-11-09,J,NAMES IN THE NEWS,,500,"In September 1988 a storm forced his plane to land at Johannesburg, though it wasn't on his itinerary",Pope John Paul II,NA
1988-11-09,J,THE REVOLUTIONARY WAR,,500,"This Philadelphia building hosted the first Continental Congress, though delegates didn't carry hammers",Carpenter\'s Hall,NA
1988-11-09,J,HAIR CARE,,500,"He was flown from London to Hollywood just to cut Mia Farrow's hair for the film ""Rosemary's Baby""",Vidal Sassoon,NA
1988-11-09,DJ,AFRICA,,200,"If we ever did a ""Starts with 'Rw' "" category, this is the only country you'd find in it",Rwanda,NA
1988-11-09,DJ,MISSIONARIES,,200,He was the missionary credited with converting Ireland to Christianity,St. Patrick,NA
1988-11-09,DJ,THE STARS,,200,This force is so strong in a black hole that it doesn't even allow light to escape,Gravity,NA
1988-11-09,DJ,CHILDREN'S LITERATURE,,200,"In Clement Moore's most famous poem, they ""were hung by the chimney with care""","""The Stockings""",NA
1988-11-09,DJ,STATE POSTAL ABBREVIATIONS,,200,"Your friendly family physician, or his state postal abbreviation, if he lives in Maryland",MD,NA
1988-11-09,DJ,HISTORIC WOMEN,,200,In the 1880s Roseanna McCoy added fuel to her family's feud by falling in love with a man named this,Hatfield,NA
1988-11-09,DJ,AFRICA,,400,Ocean on the Ivory Coast's coast,Atlantic Ocean,NA
1988-11-09,DJ,MISSIONARIES,,400,In the sixth century B.C. he sent monks to spread his teachings throughout India,Buddha (Siddhartha Gautama),NA
1988-11-09,DJ,THE STARS,,400,Every second the sun converts about 4 million tons of this into helium,Hydrogen,NA
1988-11-09,DJ,CHILDREN'S LITERATURE,,400,He kept his wife in a pumpkin shell,"Peter, Peter, pumpkin-eater",NA
1988-11-09,DJ,STATE POSTAL ABBREVIATIONS,,400,This postal abbreviation identifies Idaho,ID,NA
1988-11-09,DJ,HISTORIC WOMEN,,400,"Iva Toguri d'Aquino, a California-born UCLA graduate, was known by this nickname during WWII","""Tokyo Rose""",NA
1988-11-09,DJ,AFRICA,,600,"Despite its name, the Equator does not run through this African country",Equatorial Guinea,NA
1988-11-09,DJ,MISSIONARIES,,600,"After the queen of this South Seas island expelled French missionaries, France took over the island",Tahiti,NA
1988-11-09,DJ,THE STARS,,600,"No kidding, this star has been described as the nose of the constellation Canis Major",Sirius,NA
1988-11-09,DJ,CHILDREN'S LITERATURE,,600,Ward Greene's story of the same name inspired this 1955 Disney doggie romance,"""Lady And The Tramp""",NA
1988-11-09,DJ,STATE POSTAL ABBREVIATIONS,,NA,This state's postal abbreviation is alphabetically first,Alaska (AK),NA
1988-11-09,DJ,HISTORIC WOMEN,,600,"She became U.S. ambassador to Italy 18 years after marrying the publisher of ""Time""",Claire Boothe Luce,NA
1988-11-09,DJ,AFRICA,,800,The two African countries that share land borders with Egypt,Libya and Sudan,NA
1988-11-09,DJ,MISSIONARIES,,800,"in the 1890s, the Missionary party, led by Sanford Dole, forced this queen to abdicate",Liliuokalani,NA
1988-11-09,DJ,THE STARS,,800,Term for a rapidly spinning neutron star that emits radio waves,Pulsar,NA
1988-11-09,DJ,CHILDREN'S LITERATURE,,800,"Near the end of ""Through the Looking Glass"", this queen disappears in a bowl of soup",White Queen,NA
1988-11-09,DJ,STATE POSTAL ABBREVIATIONS,,800,"They're the two states whose postal abbreviations end with the letter ""C""",North & South Carolina (NC & SC),NA
1988-11-09,DJ,HISTORIC WOMEN,,800,"This Roman emperor's third wife, Messalina, was messing around, so he had her killed",Claudius,NA
1988-11-09,DJ,AFRICA,,NA,"It has not one, not two, but three capital cities",South Africa,NA
1988-11-09,DJ,MISSIONARIES,,1000,"Junipero Serra, who founded all those missions in California, was a member of this order",Franciscans  (Order of Friars Minor),NA
1988-11-09,DJ,THE STARS,,1000,This closely spaced group of stars is named after a group of seven sisters,Pleiades,NA
1988-11-09,DJ,CHILDREN'S LITERATURE,,1000,"This German studied law but was more famous for his ""Tales"", which inspired an 1881 Offenbach opera",Hoffmann,NA
1988-11-09,DJ,STATE POSTAL ABBREVIATIONS,,1000,It's the only state whose postal abbreviation is a pronoun,Maine (ME),NA
1988-11-09,DJ,HISTORIC WOMEN,,1000,This American-born saint was a widow with five children when she converted to Catholicism,Mother (Elizabeth Ann) Seton,NA
1988-11-09,FJ,FOREIGN PHRASES,,NA,"The Greek expression meaning ""philosophy (is) the guide of life"" is abbreviated by these three Greek letters",phi beta kappa,NA
