date,round,category,comment,value,clue,response,link
1990-05-08,J,HISTORY,,100,"At the same time Joan of Arc led the French, Itzcoatl was leading this group in Mexico",Aztecs,NA
1990-05-08,J,FAMOUS QUOTES,,100,"T. Tusser's 16th C. book ""A Hundred Good Points of Husbandry"" says, ""Sweet April showers do spring"" these",May flowers,NA
1990-05-08,J,INSECTS,,100,The lac insect secretes a substance used to make this varnish,Shellac/lacquer,NA
1990-05-08,J,THE 3 R's,,100,"Originally 43, this was reduced to 32 by the Soviet government in 1918 to increase literacy",Number of characters in the alphabet,NA
1990-05-08,J,FRUITS & VEGETABLES,,100,"They were once called ""Saratoga Chips"" after the town in New York where they were first made",Potato chips,NA
1990-05-08,J,MACY'S PARADE,(Alex: An annual tradition),100,"Traditionally he is the last ""celebrity"" to appear in the parade",Santa Claus,NA
1990-05-08,J,HISTORY,,200,"People began digging up this Italian city in 1748, only 1,669 years after it was buried",Pompeii,NA
1990-05-08,J,FAMOUS QUOTES,,200,"According to Lincoln, you can't do this to ""all of the people all the time""",Fool them,NA
1990-05-08,J,INSECTS,,200,"The largest one of these in the world is the Queen Alexandria birdwing, not the monarch",Butterfly,NA
1990-05-08,J,THE 3 R's,,200,In subtraction the difference is found by subtracting the subtrahend from this,Minuend,NA
1990-05-08,J,FRUITS & VEGETABLES,,200,"These red ""berries"" grown on the ground aren't true berries because the seeds are on the outside",Strawberries,NA
1990-05-08,J,MACY'S PARADE,(Alex: An annual tradition),200,"A band from Jupiter led off the 1989 parade, & this guy from Melmac served as a TV host",ALF,NA
1990-05-08,J,HISTORY,,300,4 treaties to mitigate the horrors of war were signed in this city in August 1949,Geneva,NA
1990-05-08,J,FAMOUS QUOTES,,300,"It's not clear who said ""Don't...fire until you see the whites of their eyes"" at this 1775 battle",Bunker Hill/Breed\'s Hill,NA
1990-05-08,J,INSECTS,,300,"To distinguish termites from ants, look at this feature: an ant has a slim one, like a wasp",Waist,NA
1990-05-08,J,THE 3 R's,,300,The Romans gave us this letter by adding a small stroke to the letter C,G,NA
1990-05-08,J,FRUITS & VEGETABLES,,300,"Of jams, jelly or preserves, the one that contains no fruit, only fruit juice",Jelly,NA
1990-05-08,J,MACY'S PARADE,(Alex: An annual tradition),300,"Though 1989 was his 50th year in show biz, his new balloon wasn't in the parade, Doc; it broke",Bugs Bunny,NA
1990-05-08,J,HISTORY,,NA,The Pope excommunicated her in 1570 after she made the Anglican church England's official religion,Elizabeth I,NA
1990-05-08,J,FAMOUS QUOTES,,400,"Vocation of the man of whom Longfellow said, ""The muscles of his brawny arms are strong as iron bands""",Blacksmith,NA
1990-05-08,J,INSECTS,,400,"Some insects have 3 of these sense organs, called ocelli, arranged in a triangle on the head",Eyes,NA
1990-05-08,J,THE 3 R's,,400,"The symbol ""y"" was once used in place of these 2 letters; hence the word ""ye"" as in ""ye olde pub""",TH,NA
1990-05-08,J,FRUITS & VEGETABLES,,400,"Thos. Jefferson is credited with introducing this vegetable, named for its ovoid shape, to the U.S.",Eggplant,NA
1990-05-08,J,MACY'S PARADE,(Alex: An annual tradition),400,"Other than humans, most live animals in the parade nowadays are these",Horses,NA
1990-05-08,J,HISTORY,,500,This cardinal helped establish the Academie Francaise in the 1630s,Cardinal Richelieu,NA
1990-05-08,J,FAMOUS QUOTES,,500,"Juvenal wrote a Roman's longings are limited to 2 things, ""panem et circenses"", meaning this",Bread & circus games,NA
1990-05-08,J,INSECTS,,500,"Of the 5 senses, it's the 1 a honeybee doesn't have",Hearing,NA
1990-05-08,J,THE 3 R's,,500,The invention of the 1st mechanical adding machine is credited to this French mathematician in 1642,Blaise Pascal,NA
1990-05-08,J,FRUITS & VEGETABLES,,500,Supreme Court said this salad ingredient could be classified as a vegetable (but it's botanically a fruit),Tomato,NA
1990-05-08,J,MACY'S PARADE,(Alex: An annual tradition),500,The Snoopy balloon travels with this companion balloon,Woodstock,NA
1990-05-08,DJ,U.S. CITIES,,200,Pierre Laclede named this Missouri city after not 1 but 2 French kings,St. Louis,NA
1990-05-08,DJ,WORLD LITERATURE,,200,"This student of Plato's wrote treatises on metaphysics, physics, poetics & rhetoric",Aristotle,NA
1990-05-08,DJ,COMPUTERS,,200,"Piece of peripheral hardware whose name comes from ""Modulator Demodulator""",Modem,NA
1990-05-08,DJ,ACTORS & THEIR ROLES,,200,"Alex Winter & Keanu Reeves played these title characters who had an ""excellent adventure""",Bill & Ted,NA
1990-05-08,DJ,VOCABULARY,,200,"Slang for someone doomed to failure, or an expired mallard",Dead duck,NA
1990-05-08,DJ,HEADS OF GOVERNMENT,,200,Prime MinisterBrian Mulroney,Canada,NA
1990-05-08,DJ,U.S. CITIES,,400,"Though Nashville is the capital, this is Tennessee's largest city",Memphis,NA
1990-05-08,DJ,WORLD LITERATURE,,400,Scheherazade told her husband stories for this many nights before he decided to let her live,"1,001",NA
1990-05-08,DJ,COMPUTERS,,400,"Like spouses who don't get along, computers that use different operating systems are said to be this",Incompatible,NA
1990-05-08,DJ,ACTORS & THEIR ROLES,,400,Chas. Fleischer provided the voice of Benny the Cab & the title character in this 1988 blockbuster,Who Framed Roger Rabbit,NA
1990-05-08,DJ,VOCABULARY,,400,"A type of crane,ora type of cough",Whooping,NA
1990-05-08,DJ,HEADS OF GOVERNMENT,,400,ChancellorHelmut Kohl,West Germany,NA
1990-05-08,DJ,U.S. CITIES,,600,Sherman's famous march to the sea ended 18 miles inland at this city,Savannah,NA
1990-05-08,DJ,WORLD LITERATURE,,600,Upton Sinclair's story of a Lithuanian immigrant family employed in the meat-packing industry,The Jungle,NA
1990-05-08,DJ,COMPUTERS,,600,"Term describing materials like silicon, halfway between an insulator & a conductor",Semiconductor,NA
1990-05-08,DJ,ACTORS & THEIR ROLES,,600,Her recent roles include an alien named Celeste & a photographer named Vicky,Kim Basinger,NA
1990-05-08,DJ,VOCABULARY,,600,A speleologist specializes in the scientific study or systematic exploration of these,Caves,NA
1990-05-08,DJ,HEADS OF GOVERNMENT,,600,PresidentHashemi Rafsanjani,Iran,NA
1990-05-08,DJ,U.S. CITIES,,800,"This is the largest U.S. city with ""Fort"" in its name",Fort Worth,NA
1990-05-08,DJ,WORLD LITERATURE,,NA,Aeschylus' dramatic account of the Titan who was condemned for giving fire to mere mortals,"""Prometheus Bound""",NA
1990-05-08,DJ,COMPUTERS,,800,"The simple operating system permanently written into main storage, it's what ""ROM"" stands for",Read-Only Memory,NA
1990-05-08,DJ,ACTORS & THEIR ROLES,,800,"In August 1989 he was in 3 films: ""Honey, I Shrunk the Kids"", ""Parenthood"" & ""Ghostbusters II""",Rick Moranis,NA
1990-05-08,DJ,VOCABULARY,,800,"By definition, an ungulate is an animal which has these",Hoofs,NA
1990-05-08,DJ,HEADS OF GOVERNMENT,,800,Prime MinisterRobert Hawke,Australia,NA
1990-05-08,DJ,U.S. CITIES,,NA,This Alaskan city was named after a senator from Indiana who became vice president,Fairbanks,NA
1990-05-08,DJ,WORLD LITERATURE,,1000,"In the era of colonialism, this British author wrote, ""Take Up the White Man's Burden""",Rudyard Kipling,NA
1990-05-08,DJ,COMPUTERS,,1000,The digits 0-9 & the letters A-Z are collectively known as this type of characters,Alphanumeric,NA
1990-05-08,DJ,ACTORS & THEIR ROLES,,1000,"In the 1989 film it was a sure thing he'd ""Say Anything"" to get Ione Skye",John Cusack,NA
1990-05-08,DJ,VOCABULARY,,1000,This adjective that describes an eagle-like nose comes from the Latin word for eagle,Aquiline,NA
1990-05-08,DJ,HEADS OF GOVERNMENT,,1000,MarshalKim Il-sung,North Korea,NA
1990-05-08,FJ,ISLANDS,,NA,"The largest island in the Tuscan Archipelago, its most famous resident left in 1815",Elba (former home of Napoleon),NA
