date,round,category,comment,value,clue,response,link
2007-02-02,J,THE GOOD BOOK,,200,God tells him his project will be fifty cubits in breadth & thirty cubits high,Noah,NA
2007-02-02,J,DOORS SONGS IN OTHER WORDS,,200,"""Ignite The Blaze Belonging To Me""","""Light My Fire""",NA
2007-02-02,J,FOOD & DRINK BRANDS,,200,This brand of grape juice was created in 1869 & was billed as unfermented wine,Welch\'s,NA
2007-02-02,J,ISLAND HOPPING,,200,"The Dodecanese Islands of this nation include Karpathos, Kos & Rhodes",Greece,NA
2007-02-02,J,MURDERS & ACQUISITIONS,(Alex: I like that one.),200,"These were certainly ""a girl's best friend"" for notorious British jewel thief Joan Hannington",diamonds,NA
2007-02-02,J,"""LET""S END THIS",,200,"In December 1776 Thomas Paine began ""The Crisis"", a series of this 8-letter type of publication",a pamphlet,NA
2007-02-02,J,THE GOOD BOOK,,400,"In Exodus 2:10 a woman ""called his name"" this: ""and she said, because I drew him out of the water""",Moses,NA
2007-02-02,J,DOORS SONGS IN OTHER WORDS,,400,"""Jockeys Of A Tornado""","""Riders On The Storm""",NA
2007-02-02,J,FOOD & DRINK BRANDS,,400,That's Dorothy Hope Smith's unfinished sketch of a neighbor's baby on the labels of this brand,Gerber\'s,NA
2007-02-02,J,ISLAND HOPPING,,400,"Little dots of nothing called the Shag Rocks lie about 700 miles east of these islands, subject of a 1980s conflict",the Falklands,NA
2007-02-02,J,MURDERS & ACQUISITIONS,(Alex: I like that one.),400,"The USA's first of these robberies, netting $245,000, was on Wall Street in 1831",a bank robbery,NA
2007-02-02,J,"""LET""S END THIS",,400,"A Denver or western one of these includes minced onions, minced green peppers & diced ham",an omelet,NA
2007-02-02,J,THE GOOD BOOK,,600,"In Revelation 18 earth bewails this mighty city's destruction (gardens & all, we assume)",Babylon,NA
2007-02-02,J,DOORS SONGS IN OTHER WORDS,,600,"""Greetings, Great Affection For Thee Wells Up Within Me""","""Hello, I Love You""",NA
2007-02-02,J,FOOD & DRINK BRANDS,,NA,"The sight of a balloon-filled sky filled a baking company VP with a sense of this, hence the name of their bread",wonder,NA
2007-02-02,J,ISLAND HOPPING,,600,"At about 43,000 square miles, it's the largest independent island nation in the western hemisphere",Cuba,NA
2007-02-02,J,MURDERS & ACQUISITIONS,(Alex: I like that one.),600,"Gunned down himself in 1957, Albert Anastasia had the Gilbert & Sullivan-inspired title ""Lord High"" this",executioner,NA
2007-02-02,J,"""LET""S END THIS",,600,Jonathan Livingston could tell you it's the throat or the esophagus,the gullet,NA
2007-02-02,J,THE GOOD BOOK,,800,Belshazzar sees the handwriting & this man interprets the handwriting,Daniel,NA
2007-02-02,J,DOORS SONGS IN OTHER WORDS,,800,"""Humans Tend Toward Weirdness""","""People Are Strange""",NA
2007-02-02,J,FOOD & DRINK BRANDS,,800,"This brand gives you ""that frosty mug sensation""",A&W Root Beer,NA
2007-02-02,J,ISLAND HOPPING,,800,This South Carolina site serves as the major east coast training base for the Marine Corps,Parris Island,NA
2007-02-02,J,MURDERS & ACQUISITIONS,(Alex: I like that one.),800,"This ""Tom Jones"" author also wrote ""Jonathan Wild"", about a real-life thief & extortionist hanged in 1725",(Henry) Fielding,NA
2007-02-02,J,"""LET""S END THIS",,800,In 1909 Wisconsin chose the wood species of this as its state flower,the violet,NA
2007-02-02,J,THE GOOD BOOK,,1000,"Chapter 6 of his book concerns his deep anguish; in chapter 10, he questions his oppression",Job,NA
2007-02-02,J,DOORS SONGS IN OTHER WORDS,,1000,"""Make Contact With Moi""","""Touch Me""",NA
2007-02-02,J,FOOD & DRINK BRANDS,,1000,The Dorsa brothers borrowed $35 to buy a waffle iron & this frozen brand was born,Eggo,NA
2007-02-02,J,ISLAND HOPPING,,1000,Ownership of the Kuril islands has been in dispute between Russia & this country,Japan,NA
2007-02-02,J,MURDERS & ACQUISITIONS,(Alex: I like that one.),1000,Fritz Haarmann was sort of the Jeffrey Dahmer of the chaotic post-WWI era in Germany named for this republic,Weimar,NA
2007-02-02,J,"""LET""S END THIS",,1000,"While in his mother's sitting room, this play character stabs & kills an old man through a curtain",Hamlet,NA
2007-02-02,DJ,A GOOD BOOK,,400,"E.B. White began this novel about a ""mouse"" for his 6-year-old niece; she was grown & reading Hemingway by its finish",Stuart Little,NA
2007-02-02,DJ,MUSIC & LYRICS,"(Alex: Clues will be given by Drew Barrymore, star of the upcoming film with that title.)",400,"(Drew Barrymore delivers the clue.) ""I Want To Hold Your Hand"" when I hear the song of that name written by this famous pair",John Lennon & Paul McCartney,http://www.j-archive.com/media/2007-02-02_DJ_06.jpg
2007-02-02,DJ,FORBES 100 MOST POWERFUL WOMEN,,400,"At No. 18, she's the only senator on the list",Hillary Clinton,NA
2007-02-02,DJ,SCIENCE,,400,Into the 20th Century it was thought the universe was one big galaxy--this one,the Milky Way,NA
2007-02-02,DJ,IT HAPPENED ON GROUNDHOG DAY,,400,1882:This influential writer & master of the English language is born in a Dublin suburb,James Joyce,NA
2007-02-02,DJ,IN THE MIDDLE OF THE STATE,(Alex: We're gonna give you the letters in the middle of a state's name.  You have to fill out the word and give us the name of the state.),400,"This state is powered by one ""AMP""",New Hampshire,NA
2007-02-02,DJ,A GOOD BOOK,,800,"""If it were I who was to be always young, and the picture that was to grow old"", this title guy ""would give my soul""",Dorian Gray,NA
2007-02-02,DJ,MUSIC & LYRICS,"(Alex: Clues will be given by Drew Barrymore, star of the upcoming film with that title.)",800,"(Drew Barrymore delivers the clue) ""The Sound Of Music"" just wouldn't be the same without the sound of this Broadway duo's music & lyrics",Rogers & Hammerstein,http://www.j-archive.com/media/2007-02-02_DJ_07.jpg
2007-02-02,DJ,FORBES 100 MOST POWERFUL WOMEN,,800,Do an MSN search & you'll find that this foundation co-founder & director is No. 12,Melinda Gates,NA
2007-02-02,DJ,SCIENCE,,NA,(Jon of the Clue Crew enlightens us with his scientific knowledge) It's a term for a machine that converts mechanical energy into electrical energy.  We've turned a motor into one by making it light up the bulb,a generator,http://www.j-archive.com/media/2007-02-02_DJ_27a.jpg
2007-02-02,DJ,IT HAPPENED ON GROUNDHOG DAY,,800,1940:This legendary singer debuts with the Tommy Dorsey Orchestra,Frank Sinatra,NA
2007-02-02,DJ,IN THE MIDDLE OF THE STATE,(Alex: We're gonna give you the letters in the middle of a state's name.  You have to fill out the word and give us the name of the state.),800,"Have some ""GIN"" in the middle of these two states",West Virginia & Virginia,NA
2007-02-02,DJ,A GOOD BOOK,,1200,"A line from this book says, ""She killed Miles.  And I've got... a black statuette that all that hell was about""",<I>The Maltese Falcon</I>,NA
2007-02-02,DJ,MUSIC & LYRICS,"(Alex: Clues will be given by Drew Barrymore, star of the upcoming film with that title.)",1200,"(Drew Barrymore delivers the clue) ""Do You Know The Way To San Jose?""  Then you'll know that Hal David wrote the lyrics, but this composer wrote the music",Burt Bacharach,http://www.j-archive.com/media/2007-02-02_DJ_08.jpg
2007-02-02,DJ,FORBES 100 MOST POWERFUL WOMEN,,1200,"On my honor, this Supreme Court Justice is No. 32",Ruth Bader Ginsburg,NA
2007-02-02,DJ,SCIENCE,,1200,"Vauquelin found Beryllium in 1798, the year after he found this, symbol Cr",Chromium,NA
2007-02-02,DJ,IT HAPPENED ON GROUNDHOG DAY,,1200,"1653:This city, later renamed New York City, is incorporated",New Amsterdam,NA
2007-02-02,DJ,IN THE MIDDLE OF THE STATE,(Alex: We're gonna give you the letters in the middle of a state's name.  You have to fill out the word and give us the name of the state.),1200,"It's a good place to get a ""TAN"" (Okay, not really)",Montana,NA
2007-02-02,DJ,A GOOD BOOK,,1600,"Chapter 8 of this 1860s novel is ""Jo Meets Apollyon""",<I>Little Women</I>,NA
2007-02-02,DJ,MUSIC & LYRICS,"(Alex: Clues will be given by Drew Barrymore, star of the upcoming film with that title.)",1600,"(Drew Barrymore delivers the clue) ""Jailhouse Rock"" & ""Love Potion No. 9"" are just 2 of the rock & roll classics by Jerry Leiber & this partner",(Mike) Stoller,http://www.j-archive.com/media/2007-02-02_DJ_09.jpg
2007-02-02,DJ,FORBES 100 MOST POWERFUL WOMEN,,1600,We're happy to report that this Chief International Correspondent for CNN made the list at No. 79,Christiane Amanpour,NA
2007-02-02,DJ,SCIENCE,,1600,"(Jimmy is in his Jeopardy! lab coat delivering the clue this time) You can take a simple nail, coil wire around it, connect it to a battery, and turn it into this attractive 13-letter item",an electromagnet,http://www.j-archive.com/media/2007-02-02_DJ_29a.jpg
2007-02-02,DJ,IT HAPPENED ON GROUNDHOG DAY,,1600,"1848:The Treaty of Guadalupe Hidalgo is signed, ending this war",the Mexican-American War,NA
2007-02-02,DJ,IN THE MIDDLE OF THE STATE,(Alex: We're gonna give you the letters in the middle of a state's name.  You have to fill out the word and give us the name of the state.),1600,"This state has a big ""EGO""",Oregon,NA
2007-02-02,DJ,A GOOD BOOK,,NA,"Dean says, ""Think of it, Sal.  I've never been to Chicago in all my life, never stopped"" in this 1957 classic",<I>On The Road</I>,NA
2007-02-02,DJ,MUSIC & LYRICS,"(Alex: Clues will be given by Drew Barrymore, star of the upcoming film with that title.)",2000,"(Drew Barrymore delivers the clue.) ""For The Good Times"", hits by this legend from Brownsville, Texas ""Help Me Make It Through The Night""",Kris Kristofferson,http://www.j-archive.com/media/2007-02-02_DJ_10.jpg
2007-02-02,DJ,FORBES 100 MOST POWERFUL WOMEN,,2000,"According to Forbes, the most powerful woman in the world is this German Chancellor",Angela Merkel,NA
2007-02-02,DJ,SCIENCE,,2000,"Predicted in 1928, the first known antiparticle was the anti-this, also called the positron",the antielectron,NA
2007-02-02,DJ,IT HAPPENED ON GROUNDHOG DAY,,2000,1971:This man begins a 7-year reign as dictator of Uganda,Idi Amin,NA
2007-02-02,DJ,IN THE MIDDLE OF THE STATE,(Alex: We're gonna give you the letters in the middle of a state's name.  You have to fill out the word and give us the name of the state.),2000,"Should I wear a ""BRA"" there?  I think not",Nebraska,NA
2007-02-02,FJ,FAMOUS AMERICANS,,NA,"In part, using donated French tanks, he formed the U.S. Army's first tank training school in 1917",George Patton,NA
