date,round,category,comment,value,clue,response,link
1990-05-14,J,WORD ORIGINS,,100,"This name for an earthenware beer mug is German for ""stone""",Stein,NA
1990-05-14,J,COMIC BOOKS,,100,"In addition to toys & a cartoon series, this comedy cop school series has spawned a Marvel comic",Police Academy,NA
1990-05-14,J,ECONOMICS,,100,"Economists say if the rate of this is 2 or 3% a year, it's normal; if it's ""galloping"", it's bad",Inflation,NA
1990-05-14,J,HOLIDAYS & OBSERVANCES,,100,"The most candy bought for a holiday is for this springtime one, not Valentine's Day",Easter,NA
1990-05-14,J,U.S. GEOGRAPHY,,100,This river that rises at Lake Itasca drains about 1/8 of the North American continent,Mississippi River,NA
1990-05-14,J,ACCORDING TO PEOPLE,(Alex: People magazine),100,"When Pat Sajak got married, People quoted her as saying, ""Th*y'll l*v* happ*ly *v*r aft*r!""",Vanna White,NA
1990-05-14,J,WORD ORIGINS,,200,"Italian for ""first lady"", it can refer to a temperamental woman or man",Prima donna,NA
1990-05-14,J,COMIC BOOKS,,200,"After DC killed off Jason Todd, Tim Drake was written in to become this red-breasted hero",Robin,NA
1990-05-14,J,ECONOMICS,,200,"After deducting all expenses from your gross profit, you're left with this",Net,NA
1990-05-14,J,HOLIDAYS & OBSERVANCES,,200,The New Year's Day of this calendar can fall between our January 20 & February 20,Chinese calendar,NA
1990-05-14,J,U.S. GEOGRAPHY,,200,"Of New York City's 5 boroughs, the one that is New York County",Manhattan,NA
1990-05-14,J,ACCORDING TO PEOPLE,(Alex: People magazine),200,"People said this late star's ""slapstick made her the greatest comedienne of all time.""",Lucille Ball,NA
1990-05-14,J,WORD ORIGINS,,300,"From the Latin for ""worm"", it's defined simply as ""animals obnoxious to man""",Vermin,NA
1990-05-14,J,COMIC BOOKS,,300,Getting caught in a gamma bomb blast in 1989 turned him from green to gray & boosted his intelligence,The Hulk,NA
1990-05-14,J,ECONOMICS,,300,Holders of this type of stock take precedence over common stock holders,Preferred,NA
1990-05-14,J,HOLIDAYS & OBSERVANCES,,300,"Bennington Battle Day, August 16th, is a legal holiday in this New England state",Vermont,NA
1990-05-14,J,U.S. GEOGRAPHY,,300,This lake was created when Hoover Dam was built on the Colorado River,Lake Mead,NA
1990-05-14,J,ACCORDING TO PEOPLE,(Alex: People magazine),300,People said that Helen Gurley Brown wants Johnny Depp to pose nude for this magazine,Cosmopolitan,NA
1990-05-14,J,WORD ORIGINS,,400,"From the Latin for ""hunger"", it's a period when food is extremely scarce",Famine,NA
1990-05-14,J,COMIC BOOKS,,NA,Crimefighting team seen here in their new incarnations for the 1990s:,The Green Hornet & Kato,NA
1990-05-14,J,ECONOMICS,,400,This system is a direct exchange of goods or services without the use of money,Barter,NA
1990-05-14,J,HOLIDAYS & OBSERVANCES,,400,The red or white rose is the official flower of this Sunday observance in June,Father\'s Day,NA
1990-05-14,J,U.S. GEOGRAPHY,,400,In Kansas more people live in this city than in Topeka & Kansas City combined,Wichita,NA
1990-05-14,J,ACCORDING TO PEOPLE,(Alex: People magazine),400,"Naming him ""The Sexiest Man Alive (1989)"", People called him ""Older, balder...and better!""",Sean Connery,NA
1990-05-14,J,WORD ORIGINS,,500,This Scottish cap was named for the hero of a Robert Burns poem,Tam O\' Shanter,NA
1990-05-14,J,COMIC BOOKS,,500,"Fictional detective with his own mystery magazine, he recently guest sleuthed with the Maze Agency",Ellery Queen,NA
1990-05-14,J,ECONOMICS,,500,"First American to win the Nobel Prize in Economics, he's the author of a widely used college textbook",Paul Samuelson,NA
1990-05-14,J,HOLIDAYS & OBSERVANCES,,500,Flag Day is a legal holiday only in this state where Betsy Ross worked as a seamstress,Pennsylvania,NA
1990-05-14,J,U.S. GEOGRAPHY,,500,The 1842 Webster-Ashburton Treaty fixed this state's border with New Brunswick,Maine,NA
1990-05-14,J,ACCORDING TO PEOPLE,(Alex: People magazine),500,"1 of ""The 25 Most Intriguing People"" of 1989, she celebrated her 31st birthday with Warren Beatty",Madonna,NA
1990-05-14,DJ,FICTIONAL CHARACTERS,,200,"This captain of the Nautilus, whose name means ""no one"", disappears at the end of the novel",Captain Nemo,NA
1990-05-14,DJ,EUROPEAN HISTORY,,200,"He didn't lead the march on Rome in 1922; he waited in Milan until he got the ""all clear"" & then went",Benito Mussolini,NA
1990-05-14,DJ,COLLEGES & UNIVERSITIES,,200,"Transylvania U., the oldest university west of the Alleghenies, is in Lexington in this state",Kentucky,NA
1990-05-14,DJ,QUOTES,,200,"According to Jonathan Swift, these ""and piecrust are made to be broken.""",Promises,NA
1990-05-14,DJ,BIOLOGY,,200,"Of all mammals, this one takes longest to mature",Man (humans),NA
1990-05-14,DJ,MUSICAL INSTRUMENTS,,200,In the '30s Laurens Hammond patented the 1st commercially practical electronic one of these,Organ,NA
1990-05-14,DJ,FICTIONAL CHARACTERS,,400,"John is a Shakespeare-quoting ""savage"" found on a N.M. reservation in this Huxley novel","""Brave New World""",NA
1990-05-14,DJ,EUROPEAN HISTORY,,400,"Noted for saying ""I am the state,"" he ruled France for 72 years, 1643-1715",Louis XIV,NA
1990-05-14,DJ,COLLEGES & UNIVERSITIES,,400,"A white oak at this New Brunswick, N.J. school supposedly inspired J. Kilmer to write ""Trees""",Rutgers,NA
1990-05-14,DJ,QUOTES,,400,"H.L. Mencken defined it as ""The inner voice which warns us that someone may be looking""",Conscience,NA
1990-05-14,DJ,BIOLOGY,,400,The human body's largest bone,Femur,NA
1990-05-14,DJ,MUSICAL INSTRUMENTS,,400,"The Highland version of this instrument has a blowpipe, a chanter & 3 drones",Bagpipes,NA
1990-05-14,DJ,FICTIONAL CHARACTERS,,600,"In wooing her, Siegfried was standing in for someone else, & when she found out, she killed him",Brunhilde,NA
1990-05-14,DJ,EUROPEAN HISTORY,,600,Romania was one Warsaw Pact country that didn't participate in the 1968 invasion of this country,Czechoslovakia,NA
1990-05-14,DJ,COLLEGES & UNIVERSITIES,,600,This school color of Syracuse gives its teams their nickname,Orange (Orangemen),NA
1990-05-14,DJ,QUOTES,,600,"""Love & Death"" director who said, ""It's not that I'm afraid to die; I just don't want to be there when it happens.""",Woody Allen,NA
1990-05-14,DJ,BIOLOGY,,NA,In 1956 scientists determined a normal human cell has this many chromosomes,46,NA
1990-05-14,DJ,MUSICAL INSTRUMENTS,,600,"In 1709 inventor B. Cristofori gave this instrument a name meaning ""harpsichord with soft & loud""",Piano,NA
1990-05-14,DJ,FICTIONAL CHARACTERS,,NA,"The silly Mrs. Bennet is the mother of Elizabeth, Jane, Lydia, Kitty & Mary in this classic","""Pride And Prejudice""",NA
1990-05-14,DJ,EUROPEAN HISTORY,,800,He became king of Spain in 1975 after Franco's death,Juan Carlos I,NA
1990-05-14,DJ,COLLEGES & UNIVERSITIES,,800,This Ivy League school has 2 major art museums: the Fogg & the Sackler,Harvard,NA
1990-05-14,DJ,QUOTES,,800,"This, said Wm. L. Garrison, ""will not be overthrown without...a most tremendous excitement.""",Slavery,NA
1990-05-14,DJ,BIOLOGY,,800,"Light-sensitive layer of nerve tissue covering the back 2/3 of the eyeball, it's an extension of the brain",Retina,NA
1990-05-14,DJ,MUSICAL INSTRUMENTS,,800,"Also called a helicon, this 3-valve tuba wraps around the player's body & has a flaring bell",Sousaphone,NA
1990-05-14,DJ,FICTIONAL CHARACTERS,,1000,Cecilia Brady is out to kill her father in this last F. Scott Fitzgerald novel,"""The Last Tycoon""",NA
1990-05-14,DJ,EUROPEAN HISTORY,,1000,In 1924 U.S. banker Charles Dawes came up with a plan to help this country pay its war reparations,Germany,NA
1990-05-14,DJ,COLLEGES & UNIVERSITIES,,1000,One of the many institutions of higher learning in this state capital is Oglethorpe University,Atlanta,NA
1990-05-14,DJ,QUOTES,,1000,"A biographer claimed he said, ""I disapprove of what you say, but I will defend to the death your right to say it.""",Voltaire,NA
1990-05-14,DJ,BIOLOGY,,1000,"This Swedish botanist, known for his system of classification, was the first to note that whales are mammals",Carl Linnaeus,NA
1990-05-14,DJ,MUSICAL INSTRUMENTS,,1000,2 types of this Italian plucked stringed instrument are the Neopolitan & the rarer Milanese,Mandolin,NA
1990-05-14,FJ,THE BIBLE,,NA,"Of the men mentioned in the King James Version, he's first alphabetically",Aaron (Moses\' brother),NA
