date,round,category,comment,value,clue,response,link
2007-02-13,J,ELECTION 2006,,200,"We don't know of any hanging chads when Katherine Harris, this state's ex-Secy. of State, lost her bid for the senate",Florida,NA
2007-02-13,J,MONSTER MASH,,200,"In the sequel to this film, a sea monster known as a kraken is dispatched by Davy Jones",Pirates of the Caribbean,NA
2007-02-13,J,YOU'RE IN THIS COUNTRY IF...,,200,You're buying ankle bracelets in Ankara,Turkey,NA
2007-02-13,J,SHOW ME THE MUNCHIES!,,200,"Logically enough, brands of this snack favorite include Jiffy Pop & Pop Secret",popcorn,NA
2007-02-13,J,AMERICAN HISTORY,,200,Witchcraft trials held in this town in 1692 led to the hangings of 19 people,Salem,NA
2007-02-13,J,RHYME TIME,,200,Cozy corner where you'd keep paperbacks & hardbacks,book nook,NA
2007-02-13,J,ELECTION 2006,,400,"(Cheryl of the Clue Crew points to a map.)  You can see what's called ""the two Virginias"" here, and Rockingham County, which went 70% for Allen, and this more urban county, home to the Pentagon and a cemetery, which went 70% for Webb",Arlington,http://www.j-archive.com/media/2007-02-13_J_02.jpg
2007-02-13,J,MONSTER MASH,,400,"Due to concerns about obesity, a ""Sesame Street"" monster's song was changed to This ""Is A Sometimes Food""",Cookie,NA
2007-02-13,J,YOU'RE IN THIS COUNTRY IF...,,400,You're cruising around Kiev,Ukraine,NA
2007-02-13,J,SHOW ME THE MUNCHIES!,,400,"Get twisted with these ancient treats made from dough that's baked, salted & usually twisted into a loose knot",a pretzel,NA
2007-02-13,J,AMERICAN HISTORY,,400,"Stonewall Jackson earned his nickname during the Battle of Manassas, also called the Battle of this creek",Bull Run,NA
2007-02-13,J,RHYME TIME,,400,A Twix or Jolly Rancher after it's been dropped on the beach,sandy candy,NA
2007-02-13,J,ELECTION 2006,,600,Missourians narrowly voted to support medical research on these embryonic cells,stem cells,NA
2007-02-13,J,MONSTER MASH,,600,"We're not exactly sure what the monster is on the island of this ABC drama, but Kate, Jack & Sawyer want to know",Lost,NA
2007-02-13,J,YOU'RE IN THIS COUNTRY IF...,,600,You're bicycling in Bucharest,Romania,NA
2007-02-13,J,SHOW ME THE MUNCHIES!,,600,It's Super Bowl time! Break out the chips & this yummy dip made from mashed avocados & cilantro,guacamole,NA
2007-02-13,J,AMERICAN HISTORY,,600,"These ""Articles"" served as the basis of our national government from 1781 to 1789",the Articles of Confederation,NA
2007-02-13,J,RHYME TIME,,600,Place designed for a small spraying striped animal to sleep,skunk bunk,NA
2007-02-13,J,ELECTION 2006,,NA,"African-American Keith Ellison of Minnesota is the 1st congressman of this faith, to which he converted at 19",Islam,NA
2007-02-13,J,MONSTER MASH,,800,Sunnydale was speechless when the guys seen here stole everyone's voices in an episode of this show,Buffy the Vampire Slayer,http://www.j-archive.com/media/2007-02-13_J_24.jpg
2007-02-13,J,YOU'RE IN THIS COUNTRY IF...,,800,You're banging a drum in Bangalore,India,NA
2007-02-13,J,SHOW ME THE MUNCHIES!,,800,"One of the two snacks mentioned in the song ""Take Me Out To The Ball Game""",peanuts or Cracker Jacks,NA
2007-02-13,J,AMERICAN HISTORY,,800,"When the Mexican War began in 1846, the Army of the West used this trail to invade New Mexico",the Santa Fe Trail,NA
2007-02-13,J,RHYME TIME,,800,"A weak, not in the best of health gastropod of the common garden variety",frail snail,NA
2007-02-13,J,ELECTION 2006,,1000,(Kelly of the Clue Crew shows us a map.)  A Democrat won with 60% of the vote in the rural 8th District of this state; the district went 60% for Bush in 2004,Indiana,http://www.j-archive.com/media/2007-02-13_J_05.jpg
2007-02-13,J,MONSTER MASH,,1000,Jack Black brings this monster back to 1933 New York City in a 2005 Peter Jackson film,King Kong,NA
2007-02-13,J,YOU'RE IN THIS COUNTRY IF...,,1000,You're undulating in Ulaanbaatar,Mongolia,NA
2007-02-13,J,SHOW ME THE MUNCHIES!,,1000,Many different snacks from this brand are supposedly baked by elves in a hollow tree,Keebler,NA
2007-02-13,J,AMERICAN HISTORY,,1000,Cleanup of this Pennsylvania nuclear power plant following the 1979 meltdown didn't end until 1993,Three Mile Island,NA
2007-02-13,J,RHYME TIME,,1000,"A sofa-bound grumbling, sulky person",couch grouch,NA
2007-02-13,DJ,BIOLOGY,,400,Some of these smallest blood vessels are so tiny that only one blood cell can pass through at a time,capillaries,NA
2007-02-13,DJ,FAMOUS YOUNG WOMEN,,400,"This singer/actress was born in Houston in 1987; her sister Haylie, in 1985",Hilary Duff,NA
2007-02-13,DJ,LET'S GO SHOPPING,,400,"First off, I need a pair of this brand's Chuck Taylor All Star sneakers",Converse,NA
2007-02-13,DJ,THE FRENCH,,400,"A baguette can be worn when it's a gemstone, or eaten when it's one of these",loaf of bread,NA
2007-02-13,DJ,PLENTY OF TIME,,400,"This sport's games have no set time limit; the longest pro game was 8 hours, 25 minutes between Pawtucket & Rochester",baseball,NA
2007-02-13,DJ,"CROSSWORD CLUES ""C""",,400,Gene carriers (11),chromosomes,NA
2007-02-13,DJ,BIOLOGY,,800,"It's the rudimentary plant contained within a seed, or a developing human before it's a fetus",embryo,NA
2007-02-13,DJ,FAMOUS YOUNG WOMEN,,800,"Save Hayden Panettiere, who plays an indestructible cheerleader on this NBC drama, save the world",Heroes,NA
2007-02-13,DJ,LET'S GO SHOPPING,,800,"""Get Your Fash On"" with cargo pants, flip flops & more at this sister store of The Gap",Old Navy,NA
2007-02-13,DJ,THE FRENCH,,800,"If you're a real Franco Poodle Dandy, Franco Poodle do or die, you were born on the 14th of July, aka this day",Bastille Day,NA
2007-02-13,DJ,PLENTY OF TIME,,800,"The theory of relativity says the existence of time depends on the presence of this, from the Latin for ""room""",space,NA
2007-02-13,DJ,"CROSSWORD CLUES ""C""",,800,"A man's home, proverbially (6)",castle,NA
2007-02-13,DJ,BIOLOGY,,1200,"(Jimmy of the Clue Crew stands next to a chart of the human body.) Important to the human body is the excretory system, which allows the body to get rid of waste largely through this pair of organs",kidneys,http://www.j-archive.com/media/2007-02-13_DJ_23.jpg
2007-02-13,DJ,FAMOUS YOUNG WOMEN,,1200,"She was ""All That"" on Nickelodeon but in 2006, ""She's the Man"" (as Viola Hastings)",Amanda Bynes,NA
2007-02-13,DJ,LET'S GO SHOPPING,,1200,"Seen here, this company's footwear will bring out the beast in me!  Now, if I could just decide on a color...",Crocs,http://www.j-archive.com/media/2007-02-13_DJ_13.jpg
2007-02-13,DJ,THE FRENCH,,NA,"Because the Seine flows northwest. then southwest, Parisians call the 2 sides this & this, not North & South",Rive Gauche & Rive Droite,NA
2007-02-13,DJ,PLENTY OF TIME,,1200,The need for uniform railroad schedules prompted adoption of this national system,time zones,NA
2007-02-13,DJ,"CROSSWORD CLUES ""C""",,1200,Basic understanding (13),comprehension,NA
2007-02-13,DJ,BIOLOGY,,1600,"To build tissue, the body needs 20 different ones of these ""protein building blocks"", both ""essential"" & ""nonessential""",amino acids,NA
2007-02-13,DJ,FAMOUS YOUNG WOMEN,,1600,"Prior to their 18th birthdays, CNN reported that the wealth of these twins to be $150 million... each!",The Olsen Twins,NA
2007-02-13,DJ,LET'S GO SHOPPING,,1600,"I'm looking for DVDs of the early seasons of this Comedy Central show featuring Stan, Kyle, Cartman & Kenny",South Park,NA
2007-02-13,DJ,THE FRENCH,,1600,This national anthem suggests that the impure blood of invaders be used to water French fields,La Marseillaise,NA
2007-02-13,DJ,PLENTY OF TIME,,1600,"In geological time, the Archean, Proterzoic & Phanerozoic are 3 of these verrrry long periods",eons,NA
2007-02-13,DJ,"CROSSWORD CLUES ""C""",,NA,"To urge, perhaps to drink certain sodas (4)",coax,NA
2007-02-13,DJ,BIOLOGY,,2000,"Diptera, the order of insects that includes flies & mosquitoes, literally means this",two-winged,NA
2007-02-13,DJ,FAMOUS YOUNG WOMEN,,2000,"We've got Scarlett fever over her, the voice of Mindy in ""The SpongeBob SquarePants Movie""",Johansson,NA
2007-02-13,DJ,LET'S GO SHOPPING,,2000,"(Hi, I'm Isaac Mizrahi.)  Look fabulous & live fabulous with my clothing & home collections for this retailer that hit the bull's-eye",Target,http://www.j-archive.com/media/2007-02-13_DJ_15.jpg
2007-02-13,DJ,THE FRENCH,,2000,You friend André has an accent aigu in his name; your friend Irène has this accent,grave,NA
2007-02-13,DJ,PLENTY OF TIME,,2000,A clock set in the year 2000 & losing 1 second a year would first be an hour off in this year,5600,NA
2007-02-13,DJ,"CROSSWORD CLUES ""C""",,2000,To inflect a verb (9),conjugate,NA
2007-02-13,FJ,20th CENTURY AUTHORS,,NA,"This author was born in 1926, the daughter of Amasa, an Alabama lawyer, & Frances, whose maiden name was Finch",Harper Lee,NA
