date,round,category,comment,value,clue,response,link
1988-11-17,J,WORD ORIGINS,,100,"The adjective ""ruddy"" comes from the Old English ""rudig"", meaning this color",red,NA
1988-11-17,J,SINGERS,,100,"Country singer Lacy J. Dalton was vice president of the ACM, which is this",the Academy of Country Music,NA
1988-11-17,J,PHYSICAL SCIENCE,,100,"An American, Theodore Maiman, built the first of these light-amplifying devices in 1960",a laser,NA
1988-11-17,J,AMERICAN LITERATURE,,100,An ex-football player who enters the ministry is the subject of this Sinclair Lewis novel,Elmer Gantry,NA
1988-11-17,J,BOTTOMS UP,,100,Legend says bats lived in a shed at its rum distillery & one of them is still on its labels,Bacardi,NA
1988-11-17,J,IN THE NEWS,,100,"Business is no longer ""hopping"" in these clubs, now that the last one in the U.S., in Lansing, Michigan, has closed",Playboy Clubs,NA
1988-11-17,J,WORD ORIGINS,,200,"It's a French word meaning ""Dutch,"" and in English it usually refers to a sauce",hollandaise,NA
1988-11-17,J,SINGERS,,200,"Some stores refused to stock his ""Lovesexy"" album because he was nude on the cover",Prince,NA
1988-11-17,J,PHYSICAL SCIENCE,,200,"When burning, sulfur becomes this compound that's used to keep dried fruit from turning brown",sulfur dioxide,NA
1988-11-17,J,AMERICAN LITERATURE,,200,James M. Cain's first novel; think letters & bells for a clue to its title,The Postman Always Rings Twice,NA
1988-11-17,J,BOTTOMS UP,,200,"Almond-flavored liqueur whose name comes from the Italian for ""bitter,"" not the Italian for ""love""",Amaretto,NA
1988-11-17,J,IN THE NEWS,,200,Forbes magazine said this singer has overtaken Bill Cosby as the highest-paid entertainer in the world,Michael Jackson,NA
1988-11-17,J,WORD ORIGINS,,300,"From the Latin for shield, ""scutum,"" it's a shield bearing a coat of arms",escutcheon,NA
1988-11-17,J,SINGERS,,300,"He made his first tour of the U.S. as a solo performer in 1988, & wham!, he was a smash",George Michael,NA
1988-11-17,J,PHYSICAL SCIENCE,,300,It's defined as a form of an element with the same atomic number but different atomic weight,Isotope,NA
1988-11-17,J,AMERICAN LITERATURE,,300,"J.P. Marquand, who won a Pulitzer for ""The Late George Apley,"" created this Japanese spy/detective",Mr. Moto,NA
1988-11-17,J,BOTTOMS UP,,300,"The recipe for Tia Maria came from this island & ""has been closely guarded for generations""",Jamaica,NA
1988-11-17,J,IN THE NEWS,,300,This U.N. Secretary General negotiated a cease-fire between Iraq & Iran,Javier Perez de Cuellar,NA
1988-11-17,J,WORD ORIGINS,,400,"An Arabic word for ""poor"" gave us this term for a Muslim or Hindu beggar said to have mystical powers",fakir,NA
1988-11-17,J,SINGERS,,400,"The 1968 song about ""Sittin' On The Dock Of The Bay"" was a posthumous No. 1 hit for him",Otis Redding,NA
1988-11-17,J,PHYSICAL SCIENCE,,400,"Named for an English scientist, it's a division of classical physics",Newtonian,NA
1988-11-17,J,AMERICAN LITERATURE,,400,Among his many books for boys are the Ragged Dick & Tattered Tom series,Horatio Alger,NA
1988-11-17,J,BOTTOMS UP,,400,This hazelnut liqueur was named for the mysterious monk who made it 300 years ago,Frangelico,NA
1988-11-17,J,IN THE NEWS,,400,Canada's maple sugar industry is directly endangered by this pollution,acid rain,NA
1988-11-17,J,WORD ORIGINS,,500,"Named for a town in France, this sheer net fabric is used to make bridal veils & tutus",tulle,NA
1988-11-17,J,SINGERS,,500,"Mrs. Andrew Lloyd Webber, she starred on Broadway in ""Phantom of the Opera""",Sarah Brightman,NA
1988-11-17,J,PHYSICAL SCIENCE,,500,"This era, the age of mammals, represents less than 1 percent of geologic time",the Cenozoic Era,NA
1988-11-17,J,AMERICAN LITERATURE,,500,Richard Henry Dana's 1840 classic based on a voyage he took around Cape Horn,Two Years Before the Mast,NA
1988-11-17,J,BOTTOMS UP,,500,"Called ""the world's oldest whiskey distillery"", it's in County Antrim, Ireland",Bushmills,NA
1988-11-17,J,IN THE NEWS,,NA,A sharp decline in Cabbage Patch doll sales contributed to this toy company's filing Chapter 11,Coleco,NA
1988-11-17,DJ,WORLD HISTORY,,200,"According to legend, he was a swineherd before he conquered the Incas",Francisco Pizarro,NA
1988-11-17,DJ,THEATER,,200,"In the female version of this Neil Simon play, the title characters are named Olive & Florence","""The Odd Couple""",NA
1988-11-17,DJ,LAKES & RIVERS,,200,"The longest river in Europe, it's noted for its boatmen",Volga,NA
1988-11-17,DJ,PRESIDENTIAL HOMES,,200,Rancho del Cielo,Ronald Reagan,NA
1988-11-17,DJ,MUSICAL EUROPE,,200,Some evidence indicates Beethoven moved 79 times during his 35-year stay in this central European capital,Vienna,NA
1988-11-17,DJ,"""AND"" SO IT GOES",,200,"In the Pledge of Allegiance, these four words follow ""with liberty""","""and justice for all""",NA
1988-11-17,DJ,WORLD HISTORY,,400,"As a result of the Napoleonic Wars, this country lost Norway to Sweden in 1814",Denmark,NA
1988-11-17,DJ,THEATER,,400,"""The Fantasticks"" opens with El Gallo singing this song","""Try To Remember""",NA
1988-11-17,DJ,LAKES & RIVERS,,400,River that runs from Pittsburgh to Cairo--Illinois that is,Ohio River,NA
1988-11-17,DJ,PRESIDENTIAL HOMES,,400,La Casa Pacifica,Richard Nixon,NA
1988-11-17,DJ,MUSICAL EUROPE,,400,"""Troldhaugen"" is the name of the house this Norwegian built a few miles outside Bergen",Edvard Grieg,NA
1988-11-17,DJ,"""AND"" SO IT GOES",,NA,The exit line which usually followed the music heard here:,"""And Away We Go!""",http://www.j-archive.com/media/1988-11-17_DJ_24.mp3
1988-11-17,DJ,WORLD HISTORY,,600,"""Great"" King of Prussia whose last words were ""I am tired of ruling over slaves""",Frederick the Great (Frederick II),NA
1988-11-17,DJ,THEATER,,NA,"In this play, Audrey II is described as ""a cross between a Venus fly trap and an avocado""",Little Shop of Horrors,NA
1988-11-17,DJ,LAKES & RIVERS,,600,The German-speaking Swiss call it the Genfersee,Lake Geneva,NA
1988-11-17,DJ,PRESIDENTIAL HOMES,,600,The Hermitage,Andrew Jackson,NA
1988-11-17,DJ,MUSICAL EUROPE,,600,"On a 1969 album cover, the Beatles are shown crossing this road outside the recording studio",Abbey Road,NA
1988-11-17,DJ,"""AND"" SO IT GOES",,600,"Title of 1956 French film & its 1988 American remake, both directed by Roger Vadim",And God Created Woman,NA
1988-11-17,DJ,WORLD HISTORY,,800,"He had a wife named Cleopatra, a daughter named Cleopatra, & a famous son, Alexander the Great",Philip of Macedon (Philip II),NA
1988-11-17,DJ,THEATER,,800,"She adapted the stage version of ""The Member of the Wedding"" from her own novel",Carson McCullers,NA
1988-11-17,DJ,LAKES & RIVERS,,800,"Shreveport, Louisiana, and Hanoi, Vietnam, are both on rivers that have this colorful name",Red River,NA
1988-11-17,DJ,PRESIDENTIAL HOMES,,800,The Elms,Lyndon B. Johnson,NA
1988-11-17,DJ,MUSICAL EUROPE,,800,"For 10 years, his widow, Constanze, lived in Copenhagen with her second husband, Georg Nissen",W.A. Mozart,NA
1988-11-17,DJ,"""AND"" SO IT GOES",,800,Monty Python's Flying Circus borrowed this catch phrase from BBC announcers,"""And now for something completely different""",NA
1988-11-17,DJ,WORLD HISTORY,,1000,The Cuban missile crisis made this the tensest month of 1962,October,NA
1988-11-17,DJ,THEATER,,1000,"His 1956 play ""Look Back in Anger"" was called ""A landmark in the history of the theatre""",John Osborne,NA
1988-11-17,DJ,LAKES & RIVERS,,1000,"Over 300 rivers flow into this largest freshwater lake in Asia, & only one flows out, the Angara",Lake Baikal,NA
1988-11-17,DJ,PRESIDENTIAL HOMES,,1000,"Hickory Hill, which he later sold to his brother",John F. Kennedy,NA
1988-11-17,DJ,MUSICAL EUROPE,,1000,You'd have to go to this country to visit museums honoring composer Bedrich Smetana,Czechoslovakia,NA
1988-11-17,DJ,"""AND"" SO IT GOES",,1000,Pepys often ended his diary entries with these four words referring to the end of the day's affairs,"""And so to bed""",NA
1988-11-17,FJ,GEOGRAPHY,,NA,"Now independent, this island has been ruled by Phoenicians, Romans, Arabs, Normans, French & British",Malta,NA
