date,round,category,comment,value,clue,response,link
2007-06-07,J,NONFICTION,,200,"This mega-bestseller by John Gray is touted as ""the classic guide to understanding the opposite sex""","Men Are From Mars, Women Are From Venus",NA
2007-06-07,J,TV INITIALS,,200,"Erik Estrada was a CHiP, meaning he worked for this agency",California Highway Patrol,NA
2007-06-07,J,PUBLISHING,,200,"In the 17th century Oxford University Press got the right to print this ""royal"" version of the Bible, quite a cash cow",King James Bible,NA
2007-06-07,J,DUDE-ERONOMY,,200,Totally cool! This dude wrote Deuteronomy as a way of reinforcing what he first learned on Mount Sinai,Moses,NA
2007-06-07,J,CLASSIC AD CAMPAIGNS,,200,"""It's the real thing""",Coca-Cola,NA
2007-06-07,J,"YOU GET A ""D""",,200,"Curl up on a desert island with his ""Political History of the Devil"" or ""Robinson Crusoe""",Daniel Defoe,NA
2007-06-07,J,NONFICTION,,400,"Oprah chose for her book club ""The Measure of a Man: A Spiritual Autobiography"" by this Oscar winner",Sidney Poitier,NA
2007-06-07,J,TV INITIALS,,400,"On the series ""24"", C.T.U., the good guys, stands for this",Counter-Terrorism Unit,NA
2007-06-07,J,PUBLISHING,,400,"Like the ""Idiot's Guide"" series 2 years earlier, this series with a similar title began with a book about DOS",...for Dummies,NA
2007-06-07,J,DUDE-ERONOMY,,400,"Sweet! The fifth chapter of Deuteronomy raps out this list of dos & don'ts, just in case we spaced it",the Ten Commandments,NA
2007-06-07,J,CLASSIC AD CAMPAIGNS,,400,"""We try harder""",Avis,NA
2007-06-07,J,"YOU GET A ""D""",,400,"National Lead was one of the 12 companies tracked by this ""average"" when it debuted May 26, 1896",Dow Jones Industrial Average,NA
2007-06-07,J,NONFICTION,,600,The first edition of this book about the body was published in 1858 with 750 pages & 363 figures,Gray\'s Anatomy,NA
2007-06-07,J,TV INITIALS,,600,"In the 1960s Peter Graves led this squad, ""IMF"" for short",Impossible Missions Force,NA
2007-06-07,J,PUBLISHING,,NA,Puffin & Firebird are young readers imprints of this publisher,Penguin,NA
2007-06-07,J,DUDE-ERONOMY,,600,"Awesome, dude! Deuteronomy says that all debts are to be canceled after this many years!",seven,NA
2007-06-07,J,CLASSIC AD CAMPAIGNS,,600,"""Look, mom -- no cavities!""",Crest,NA
2007-06-07,J,"YOU GET A ""D""",,600,"In the comics, she's Dagwood & Blondie's dog",Daisy,NA
2007-06-07,J,NONFICTION,,800,"Her ""The Sea Around Us"" was among the top 10 nonfiction bestsellers for 1951 & 1952",Rachel Carson,NA
2007-06-07,J,TV INITIALS,,800,"It's the ""S"" in ""M*A*S*H""",Surgical,NA
2007-06-07,J,PUBLISHING,,800,"Since 1933 this publication called this ""reviews"" has provided pre-publication reviews to its subscribers",Kirkus,NA
2007-06-07,J,DUDE-ERONOMY,,800,"Grab your surfboard, rad boy! In Deuteronomy, this sea is referred to as the ""salt sea""",Dead Sea,NA
2007-06-07,J,CLASSIC AD CAMPAIGNS,,800,"""Ring around the collar""",Wisk,NA
2007-06-07,J,"YOU GET A ""D""",,800,"6-letter word meaning to expose as being false or ridiculous, like certain wacky theories",debunk,NA
2007-06-07,J,NONFICTION,,1000,"Oliver Sacks shared some of his fascinating neurological cases in ""The Man Who Mistook His Wife For A"" this",hat,NA
2007-06-07,J,TV INITIALS,,1000,"( I'm Bill Goldberg. ) I tossed Detective Stabler through a window when I made my prime time TV debut in 2007 on this NBC drama & by the way, the head writer is my cousin Neal",Law & Order: Special Victims Unit,http://www.j-archive.com/media/2007-06-07_J_10.jpg
2007-06-07,J,PUBLISHING,,1000,"""Electronic Mission Aircraft"" & ""Fighting Ships"" are put out by this publisher with a feminine-sounding name",Jane\'s,NA
2007-06-07,J,DUDE-ERONOMY,,1000,"Party on, dude! This guy gets appointed to be the new leader of the Israelites!",Joshua,NA
2007-06-07,J,CLASSIC AD CAMPAIGNS,,1000,"""Does she... or doesn't she?""",Clairol,NA
2007-06-07,J,"YOU GET A ""D""",,1000,"In Greek mythology, the mother of Persephone",Demeter,NA
2007-06-07,DJ,20th CENTURY ASIA,,400,This chairman soon ended his Hundred Flowers Movement encouraging criticism of the Communist Party,Mao Zedong,NA
2007-06-07,DJ,JUILLIARD ALUMNI,,400,"Not averse to portraying icons, this alum has played Jim Morrison, Elvis Presley & Batman on film",Val Kilmer,NA
2007-06-07,DJ,ANATOMY,,400,The roof of the mouth is made up of hard & soft ones that are covered by mucous membranes,palates,NA
2007-06-07,DJ,2 FOR THE MONEY,(Alex: We need two responses instead of one.),400,"A thrice-married Revolutionary War flag seamstress from Philly, & the ice-resurfacing machine patented in 1953",Betsy Ross & Zamboni,NA
2007-06-07,DJ,LINCOLN LORE,,400,"Legend says Abe became interested in this profession when he found Blackstone's ""Commentaries"" in a rubbish barrel",law,NA
2007-06-07,DJ,10-LETTER WORDS,(Alex: Sounds like a difficult board.),400,"Intolerable, as in a Milan Kundera title",unbearable,NA
2007-06-07,DJ,20th CENTURY ASIA,,NA,In 1902 Abdul Aziz Ibn Saud captured what's now this capital city,Riyadh,NA
2007-06-07,DJ,JUILLIARD ALUMNI,,800,"In 1992, a year after playing an older Peter Pan, he was a mime instructor in ""Shakes the Clown""",Robin Williams,NA
2007-06-07,DJ,ANATOMY,,800,"(Cheryl of the Clue Crew presents from a lab.)  Due to its worm-like shape, the adjective vermiform is commonly used to refer to this tube that's attached to the cecum",appendix,http://www.j-archive.com/media/2007-06-07_DJ_02a.jpg
2007-06-07,DJ,2 FOR THE MONEY,(Alex: We need two responses instead of one.),800,"9-foot man from the Biblical books of Samuel, & the franchise that created the Frappuccino in 1995",Goliath & Starbucks,NA
2007-06-07,DJ,LINCOLN LORE,,800,Lincoln said one of things that made him president was this man's retouched Cooper Union photo of him,Mathew Brady,http://www.j-archive.com/media/2007-06-07_DJ_10.jpg
2007-06-07,DJ,10-LETTER WORDS,(Alex: Sounds like a difficult board.),800,The tent that housed the Ark of the Covenant; today the Mormons have a big one in Salt Lake City,tabernacle,NA
2007-06-07,DJ,20th CENTURY ASIA,,1200,The future leader of independent Malaya is shown in this city signing an agreement ending British rule,Kuala Lumpur,http://www.j-archive.com/media/2007-06-07_DJ_06.jpg
2007-06-07,DJ,JUILLIARD ALUMNI,,1200,This man who began leading the Federal Reserve in 1987 studied clarinet & sax at the school,Alan Greenspan,NA
2007-06-07,DJ,ANATOMY,,1200,The meniscus disks in your knee are a type of this material that may tear if you twist wrong,cartilage,NA
2007-06-07,DJ,2 FOR THE MONEY,(Alex: We need two responses instead of one.),1200,"The Russian president right before Putin & an ""Absolut"" type of alcohol (There's no connection)",Boris Yeltsin & vodka,NA
2007-06-07,DJ,LINCOLN LORE,,1200,"In a classic ""Twilight Zone"" episode, a time traveler tries to save Lincoln but is drugged by this man",John Wilkes Booth,NA
2007-06-07,DJ,10-LETTER WORDS,(Alex: Sounds like a difficult board.),1200,"From the Greek for ""together"" & ""name"", it means having the same meaning",synonymous,NA
2007-06-07,DJ,20th CENTURY ASIA,,1600,"In the 1990s 5 ""stan"" nations agreed to give up to .3% of national income to restore this shrunken saltwater body",Aral Sea,NA
2007-06-07,DJ,JUILLIARD ALUMNI,,1600,"This Oscar winner, the most ""verbal"" of ""The Usual Suspects"", got into Juilliard but blew his ""Gong Show"" audition",Kevin Spacey,NA
2007-06-07,DJ,ANATOMY,,1600,It includes the ascending colon & the sigmoid colon,large intestine,NA
2007-06-07,DJ,2 FOR THE MONEY,(Alex: We need two responses instead of one.),1600,"One-mile-deep Arizona landmark that's up to 18 miles wide & ex-MTV ""Weasel"" star of ""Jury Duty""",Grand Canyon & Pauly Shore,NA
2007-06-07,DJ,LINCOLN LORE,,NA,"On his April 4, 1865 visit to Richmond, Lincoln sat at this man's desk; we don't know if he put his feet up on it",Jefferson Davis,NA
2007-06-07,DJ,10-LETTER WORDS,(Alex: Sounds like a difficult board.),1600,Graphic representation of surface features on a region of a map,topography,NA
2007-06-07,DJ,20th CENTURY ASIA,,2000,An alternate to the Ho Chi Minh Trail was a trail named for this Cambodian royal,Norodom Sihanouk,NA
2007-06-07,DJ,JUILLIARD ALUMNI,,2000,"In 1958, this Israeli violinist entered Juilliard; in 1963 he played Carnegie Hall",Itzhak Perlman,NA
2007-06-07,DJ,ANATOMY,,2000,"(Jimmy of the Clue Crew reads in front of a skeleton)It's the medical name for these two bones, from the Latin for ""key""; in birds, they fuse to form a wishbone",clavicle,http://www.j-archive.com/media/2007-06-07_DJ_20a.jpg
2007-06-07,DJ,2 FOR THE MONEY,(Alex: We need two responses instead of one.),2000,"6-letter fuzzy nylon fastening device used in place of zippers, & the ""king of the pan flute""",velcro & (Gheorghe) Zamfir,NA
2007-06-07,DJ,LINCOLN LORE,,2000,"It's unusual for U.S. coins that Lincoln faces right on his penny, first issued in 1909 to commemorate this",100th anniversary of his birth,NA
2007-06-07,DJ,10-LETTER WORDS,(Alex: Sounds like a difficult board.),2000,It's how the words seen here are presented,italicized,NA
2007-06-07,FJ,ARTISTS,,NA,"One of his last letters said, ""I am risking my life for (my work) and my reason has half-foundered owing to it...""",Vincent van Gogh,NA
