date,round,category,comment,value,clue,response,link
1998-06-18,J,PEOPLE IN HISTORY,,100,"One of the signers of Israel's Declaration of Independence, she became prime minister in 1969",Golda Meir,NA
1998-06-18,J,INVESTING YOUR JEOPARDY! WINNINGS,,100,"Now that you're flush, consider the ""whole life"" type of this, unless you're planning to die soon",Insurance,NA
1998-06-18,J,TELEVISION,,100,"The apartment complex located at 4616 on this title L.A. street is home to some ""FOX""y ladies",Melrose Place,NA
1998-06-18,J,FAMILIAR PHRASES,,100,"It's ""The shortest distance between two points""",Straight line,NA
1998-06-18,J,LET'S GO TO FLORIDA,,100,"You can see a miniature replica of this city's Forbidden City at Splendid China, a park in Kissimmee",Peking/Beijing,NA
1998-06-18,J,"WHO ""M I""?",,100,"During my long relationship with Woody Allen, I starred in 13 of his films",Mia Farrow,NA
1998-06-18,J,PEOPLE IN HISTORY,,200,"Before designing the first successful steamboat, he worked as a portrait painter",Robert Fulton,NA
1998-06-18,J,INVESTING YOUR JEOPARDY! WINNINGS,,200,"To minimize your risk, buy these ""colorful"" stocks in established, reliable companies",Blue chips,NA
1998-06-18,J,TELEVISION,,200,"""Promised Land"" with Gerald McRaney is a spinoff of this heavenly CBS series",Touched by an Angel,NA
1998-06-18,J,FAMILIAR PHRASES,,200,It's where something embarrassing is swept,Under the rug/carpet,NA
1998-06-18,J,LET'S GO TO FLORIDA,,200,"The ""Terrors of the Deep"" attraction at this park might even scare Shamu",Sea World,NA
1998-06-18,J,"WHO ""M I""?",,200,"From 1961 to 1964, I invited TV home viewers to ""Sing Along With"" me",Mitch Miller,NA
1998-06-18,J,PEOPLE IN HISTORY,,300,"This ""Nine Days' Queen"" of England was a granddaughter of Henry VIII's sister Mary",Lady Jane Grey,NA
1998-06-18,J,INVESTING YOUR JEOPARDY! WINNINGS,,300,"Don't blow your money on Hanson CDs (compact discs), put it in one of these bank CDs",Certificates of Deposit,NA
1998-06-18,J,TELEVISION,,300,"He's played Pete Ryan, Alexander Mundy & Jonathan Hart",Robert Wagner,NA
1998-06-18,J,FAMILIAR PHRASES,,300,"Pool table piece you don't want to be ""behind""",The 8 ball,NA
1998-06-18,J,LET'S GO TO FLORIDA,,300,The Cypress Roots Museum traces the history of this famous floral site,Cypress Gardens,NA
1998-06-18,J,"WHO ""M I""?",,300,In 1505 I was summoned by Pope Julius II to create his tomb,Michelangelo,NA
1998-06-18,J,PEOPLE IN HISTORY,,400,This redshirts leader led his final campaign when he fought for France in the Franco-Prussian War,Giuseppe Garibaldi,NA
1998-06-18,J,INVESTING YOUR JEOPARDY! WINNINGS,,400,"The new Roth type of this ""account"" allows tax-free withdrawals when you're in your 60s",IRA (Individual Retirement Account),NA
1998-06-18,J,TELEVISION,,NA,"(Hi, I'm Julie Pinson)  ""Port Charles"" is a spin-off from this soap that's also set in Port Charles",General Hospital,NA
1998-06-18,J,FAMILIAR PHRASES,,400,"Shifting your debts is ""Robbing Peter to pay"" this saint",Paul,NA
1998-06-18,J,LET'S GO TO FLORIDA,,400,For years Gomek the giant crocodile was the big attraction at this oldest Florida city's alligator farm,St. Augustine,NA
1998-06-18,J,"WHO ""M I""?",,400,"Since leaving Czechoslovakia, I've directed films like ""One Flew Over the Cuckoo's Nest"" & ""Amadeus""",Milos Forman,NA
1998-06-18,J,PEOPLE IN HISTORY,,500,Guess what?  This Cherokee who devised an alphabet took the English name George Guess,Sequoya,NA
1998-06-18,J,INVESTING YOUR JEOPARDY! WINNINGS,,500,"If buying corporate mutual bonds, you should know this is Moody's highest rating",AAA,NA
1998-06-18,J,TELEVISION,,500,"After NBC canceled this Sam Waterston series in 1993, PBS produced a movie to wrap up its loose ends",I\'ll Fly Away,NA
1998-06-18,J,FAMILIAR PHRASES,,500,"Alexander Pope criticized these who claimed to be authorities with ""Fools rush in where angels"" do this",Fear to tread,NA
1998-06-18,J,LET'S GO TO FLORIDA,,500,"The Wallendas' poles, rigging & costumes are on view at the Circus Museum in this Florida city",Sarasota,NA
1998-06-18,J,"WHO ""M I""?",,500,You can hear me doing what I did best in the following:(playing his trumpet),Miles Davis,NA
1998-06-18,DJ,MUSICAL INSTRUMENTS,,200,The mouthpiece of an oboe contains a double one,Reed,NA
1998-06-18,DJ,FICTIONAL FOLKS,,200,"Huck, as in Huck Finn, is short for this",Huckleberry Finn,NA
1998-06-18,DJ,1980s FILM FACTS,,200,"Leonard Maltin said this '84 mermaid film was ""A bit too long, but...I really don't want to carp""",Splash,NA
1998-06-18,DJ,THE COSSACKS ARE COMING!,,200,For his books on the Cossacks of the Don River Mikhail Sholokhov won this top prize in 1965,Nobel Prize for Literature,NA
1998-06-18,DJ,LEGENDARY HOTTIES,,200,"After this bird rose up from its ashes, it would gather them into a ball & fly them to Egypt",Phoenix,NA
1998-06-18,DJ,ANT-ONYMS,,200,"Most members of an ant colony are these, as opposed to resters",Workers,NA
1998-06-18,DJ,MUSICAL INSTRUMENTS,,400,A flamenco dancer should also be accomplished on these percussion instruments,Castanets,NA
1998-06-18,DJ,FICTIONAL FOLKS,,400,He gave Charlie a tour of his chocolate factory,Willy Wonka,NA
1998-06-18,DJ,1980s FILM FACTS,,400,"As Eliot Ness, Kevin Costner cleaned up the mess in Chicago in this 1987 film",The Untouchables,NA
1998-06-18,DJ,THE COSSACKS ARE COMING!,,400,"While there were a few mechanized units, the Cossacks in WWII mainly served in these units",Cavalry,NA
1998-06-18,DJ,LEGENDARY HOTTIES,,400,"The name of Agni, the Hindi fire god, gave us this word meaning ""to start a fire""",Ignite/ignition,NA
1998-06-18,DJ,ANT-ONYMS,,400,"Like termites, ants are this type of insect, not solitary",Social,NA
1998-06-18,DJ,MUSICAL INSTRUMENTS,,600,"Heard here & in a 1997 film, the Grimethorpe Colliery Band is this type of ""heavy metal"" band:",Brass band,NA
1998-06-18,DJ,FICTIONAL FOLKS,,600,1938 Daphne Du Maurier novel in which you find the second Mrs. De Winter of our discontent,"""Rebecca""",NA
1998-06-18,DJ,1980s FILM FACTS,,600,"Robin Williams ""sail""ed into movie stardom as this title character in a Robert Altman film",Popeye,NA
1998-06-18,DJ,THE COSSACKS ARE COMING!,,600,"For a while the city of Kharkiv, founded as a Cossack outpost, replaced Kiev as capital of this republic",Ukraine,NA
1998-06-18,DJ,LEGENDARY HOTTIES,,600,"When Phaeton borrowed his dad Helios' chariot, he was joy-riding on this heavenly body",Sun,NA
1998-06-18,DJ,ANT-ONYMS,,600,"If you want a mound built to damage farm machinery, ""hire"" these ants",Fire ants,NA
1998-06-18,DJ,MUSICAL INSTRUMENTS,,800,It's played tilted back on the right shoulder; the shortest of the 47 strings are closest to the body,Harp,NA
1998-06-18,DJ,FICTIONAL FOLKS,,NA,This author felt he had no choice but to create Sophie Zawistowska,William Styron,NA
1998-06-18,DJ,1980s FILM FACTS,,NA,It's the last name of the politician played by Paul Newman in the clip seen here:,"(Earl) Long (from the movie ""Blaze"")",NA
1998-06-18,DJ,THE COSSACKS ARE COMING!,,800,In 1992 this Russian president granted the Cossacks the status of an ethnic group,Boris Yeltsin,NA
1998-06-18,DJ,LEGENDARY HOTTIES,,800,Siegfried discovered this woman asleep in a ring of fire,Brunhilde,NA
1998-06-18,DJ,ANT-ONYMS,,800,Amazon ants become masters when they steal the young from other nests & make them these,Slaves,NA
1998-06-18,DJ,MUSICAL INSTRUMENTS,,1000,"Popularized by Lionel Hampton, you have to plug it in first",Vibraphone/vibes,NA
1998-06-18,DJ,FICTIONAL FOLKS,,1000,"Where's Mr. Waldo?  In this Welsh poet's ""Under Milk Wood""",Dylan Thomas,NA
1998-06-18,DJ,1980s FILM FACTS,,1000,"This offbeat director cast himself as a nutty psychiatrist in his own film ""Hairspray""",John Waters,NA
1998-06-18,DJ,THE COSSACKS ARE COMING!,,1000,"The name Cossack comes from ""Kazak"", a word in this language that also gave us the word yogurt",Turkish,NA
1998-06-18,DJ,LEGENDARY HOTTIES,,1000,"Apollo tells this Roman blacksmith god that Venus is cheating on him, in the painting seen here:",Vulcan,NA
1998-06-18,DJ,ANT-ONYMS,,1000,The extinct passenger pigeon & this African army ant are both known for moving in huge swarms,Driver ants,NA
1998-06-18,FJ,U.S. STATESMEN,,NA,"In 1814 & 1815, before he was president, he served simultaneously as Secretary of State & Secretary of War",James Monroe (under President Madison),NA
