date,round,category,comment,value,clue,response,link
1990-08-25,J,GEOGRAPHY,,200,"The Sahel is a zone of sparse, grassy vegetation on the edge of this desert",Sahara,NA
1990-08-25,J,ACTORS & THEIR ROLES,,200,G. Depardieu was named best actor at Cannes for playing this swordsman; you might say he won by a nose,Cyrano de Bergerac,NA
1990-08-25,J,AMERICAN LITERATURE,,200,In “Moby Dick” the narrator begins by telling the reader to call him this,Ismael,NA
1990-08-25,J,HOLIDAYS & OBSERVANCES,,200,On the 2nd Saturday in May this country observes National Windmill Day,Holland (or The Netherlands),NA
1990-08-25,J,PHOTOGRAPHY,,200,"Light regulator that comes in leaf, rotary & focal-plane types",a shutter,NA
1990-08-25,J,SPELLING,,200,"A creamy salad dressing made with raw egg yolk, oil, vinegar or lemon juice & seasonings",M-A-Y-O-N-N-A-I-S-E,NA
1990-08-25,J,GEOGRAPHY,,400,Among principal mountain ranges in this country are the Wicklow & MacGillicuddy's Reeks,Ireland,NA
1990-08-25,J,ACTORS & THEIR ROLES,,400,"Clint Eastwood's role in “White Hunter, Black Heart” was inspired by this director of “The African Queen”",John Huston,NA
1990-08-25,J,AMERICAN LITERATURE,,400,C. Auguste Dupin is an amateur detective who appears in 3 of his short stories,(Edgar Allan) Poe,NA
1990-08-25,J,HOLIDAYS & OBSERVANCES,,400,"This N.Y. congresswoman, known for her hats, introduced the bill creating Women's Equality Day",Bella Abzug,NA
1990-08-25,J,PHOTOGRAPHY,,400,Film is coated with light sensitive halides of this metal suspended in gelatin,silver,NA
1990-08-25,J,SPELLING,,400,In German it means “lightning war”,B-L-I-T-Z-K-R-I-E-G,NA
1990-08-25,J,GEOGRAPHY,,600,"Associated with Jesus' childhood, this city in lower Galilee is the largest Arab city in Israel",Nazareth,NA
1990-08-25,J,ACTORS & THEIR ROLES,,600,2-time Oscar winner who made her feature film debut in “Julia” & played W. Allen's ex in “Manhattan”,Meryl Streep,NA
1990-08-25,J,AMERICAN LITERATURE,,600,Nick Adams is the protagonist in many of the short stories in this author's “In Our Time”,Hemingway,NA
1990-08-25,J,HOLIDAYS & OBSERVANCES,,600,The earliest date on which this holiday can fall is October 8th,Columbus Day,NA
1990-08-25,J,PHOTOGRAPHY,,600,This letter is used to designate the aperture of a lens,f,NA
1990-08-25,J,SPELLING,,600,"From the Greek, it's a fictitious name used by an author",P-S-E-U-D-O-N-Y-M,NA
1990-08-25,J,GEOGRAPHY,,800,Bishop Albert of Livonia & his crusaders founded this capital of Latvia in 1201,Riga,NA
1990-08-25,J,ACTORS & THEIR ROLES,,800,Errol Flynn's last film with this frequent leading lady was “They Died With Their Boots On”,Olivia De Havilland,NA
1990-08-25,J,AMERICAN LITERATURE,,800,Edith Wharton's tragic tale of a New England farmer who falls in love with his wife's cousin Mattie,Ethan Frome,NA
1990-08-25,J,HOLIDAYS & OBSERVANCES,,800,Public law 99-54 recognizes “pause for the pledge” as part of this holiday,Flag Day,NA
1990-08-25,J,PHOTOGRAPHY,,NA,"In 1839 he was given an annuity of 6,000 francs for revealing his photographic process",(Louis) Daguerre,NA
1990-08-25,J,SPELLING,,800,The ancient Roman Pont du Gard is an example of this type of bridge built to carry water,A-Q-U-E-D-U-C-T,NA
1990-08-25,J,GEOGRAPHY,,1000,"Henry Bessemer set up shop in this English town, & it has since become famous for its steel",Sheffield,NA
1990-08-25,J,ACTORS & THEIR ROLES,,1000,The first film she starred in after her brief marriage to a prince was 1952's “Affair In Trinidad”,Rita Hayworth,NA
1990-08-25,J,AMERICAN LITERATURE,,1000,Father of Pearl!  He's the minister in Hawthorne's “The Scarlet Letter”,(Arthur) Dimmesdale,NA
1990-08-25,J,HOLIDAYS & OBSERVANCES,,1000,This Jewish holiday begun in 165 B.C. celebrates the purification of the temple of Jerusalem,Hanukkah,NA
1990-08-25,J,PHOTOGRAPHY,,1000,"Photographer of “Moonrise, Hernandez, N.M.”, he was a director of The Sierra Club 1934-71",Ansel Adams,NA
1990-08-25,J,SPELLING,,1000,The city in New York that's home to Vassar College,P-O-U-G-H-K-E-E-P-S-I-E,NA
1990-08-25,DJ,U.S. HISTORY,,500,"Legend says this October 8, 1871 event began in a stable at Jefferson & DeKoven Streets in Chicago",Great Chicago Fire,NA
1990-08-25,DJ,BIBLICAL WOMEN,,500,She was asked to “entice” Samson “and see wherein his great strength lieth”,Delilah,NA
1990-08-25,DJ,PHYSICAL SCIENCE,,500,"Unlike glaciers, pack ice forms from this type of water",salt (seawater),NA
1990-08-25,DJ,ARTISTS,,500,He moved back to France from Tahiti in 1893 but returned to the South Seas permanently 2 years later,Gauguin,NA
1990-08-25,DJ,SHAKESPEARE,,500,"Alas, you don't need an actor to play this character in “Hamlet”; all you need is a skull",Yorick,NA
1990-08-25,DJ,INTERNATIONAL PARKS,,500,"Among the animals you'll find in this country's Kruger National Park are zebras, lions & giraffes",South Africa,NA
1990-08-25,DJ,U.S. HISTORY,,1000,Andrew Jackson was fighting against 50 ships commanded by Edw. Packenham when he won this 1815 battle,Battle of New Orleans,NA
1990-08-25,DJ,BIBLICAL WOMEN,,1000,"To the devout, this wife of King Ahab represented evil",Jezebel,NA
1990-08-25,DJ,PHYSICAL SCIENCE,,1000,"Greek for whom a theorem about right triangles is named, he was 1 of the 1st to think the Earth is round",Pythagoras,NA
1990-08-25,DJ,ARTISTS,,1000,In 1505 he was recalled to Rome to make a tomb for the Renaissance Pope Julius II,Michelangelo,NA
1990-08-25,DJ,SHAKESPEARE,,1000,This historical play dramatizes the events which led to England's break with the Roman Catholic church,Henry VIII,NA
1990-08-25,DJ,INTERNATIONAL PARKS,,1000,This Kenyan capital contains a 44-square-mile national park & game preserve,Nairobi,NA
1990-08-25,DJ,U.S. HISTORY,,1500,"In 1831 the Anti-Masonic Party held the first of these ever, to prepare for the 1832 election",(nominating) convention,NA
1990-08-25,DJ,BIBLICAL WOMEN,,1500,"Though in love with Rachel, Jacob was tricked into marrying this sister first",Leah,NA
1990-08-25,DJ,PHYSICAL SCIENCE,,1500,"The quantum theory of electrodynamics explains some phenomena in terms of these, not waves",particles,NA
1990-08-25,DJ,ARTISTS,,NA,Rockefeller Ctr. destroyed his “Man At The Crossroads” because of a Lenin look-alike in the mural,Diego Rivera,NA
1990-08-25,DJ,SHAKESPEARE,,1500,"In this play's first scene, dastardly deeds are done at the tomb of the Andronici",Titus Andronicus,NA
1990-08-25,DJ,INTERNATIONAL PARKS,,1500,Teide National Park in this Spanish archipelago is located on Tenerife Island,Canary Islands,NA
1990-08-25,DJ,U.S. HISTORY,,2000,The Platt Amendment of 1901 provided for the withdrawal of U.S. troops from this country,Cuba,NA
1990-08-25,DJ,BIBLICAL WOMEN,,2000,"A patron saint of cooks, she was the sister of Lazarus & Mary of Bethany",Martha,NA
1990-08-25,DJ,PHYSICAL SCIENCE,,2000,Any process by which neutral atoms become electrically charged is called this,ionizations,NA
1990-08-25,DJ,ARTISTS,,2000,He painted “The Transfiguration” & for 6 years directed the construction of St. Peter's Church in Rome,Raphael,NA
1990-08-25,DJ,SHAKESPEARE,,NA,"He has 3 sons-in-law: the Duke of Albany, the Duke of Cornwall & the king of France",Lear,NA
1990-08-25,DJ,INTERNATIONAL PARKS,,2000,1 of 2 South American countries each having a park on its side of Iguacu Falls,Brazil (or Argentina),NA
1990-08-25,DJ,U.S. HISTORY,,2500,William Jennings Bryan was elected to his first public office in this state,Nebraska,NA
1990-08-25,DJ,BIBLICAL WOMEN,,2500,"While in the land of Midian, he married Zipporah, a daughter of Jethro",Moses,NA
1990-08-25,DJ,PHYSICAL SCIENCE,,2500,2 of the 6 planetary probes launched by the U.S.,"Mariner & Voyager  (Ranger, Surveyor, Pioneer & Viking)",NA
1990-08-25,DJ,ARTISTS,,2500,This ancient Greek's only surviving original sculpture is “Hermes & Dionysus”,Praxiteles,NA
1990-08-25,DJ,SHAKESPEARE,,2500,The renouncing of magic in this play is believed to be the bard's symbolic farewell to the stage,The Tempest,NA
1990-08-25,DJ,INTERNATIONAL PARKS,,2500,"This Mexico City park, which antedates Columbus is believed to be the oldest in the Americas",Chapultepec,NA
1990-08-25,FJ,THE CALENDAR,,NA,This month was formerly called Quintilis,July,NA
