date,round,category,comment,value,clue,response,link
2007-07-20,J,THE WORLD ALMANAC 2007,,200,"Of the 4 of these that will happen in 2007, Americans will see only the lunar ones",an eclipse,NA
2007-07-20,J,SPORTS TERMS,(Alex: You have to identify the sport for us.),200,"Net,ace,foot fault",tennis,NA
2007-07-20,J,COLORS,,200,Here's a hint from Heloise: celebrate St. Patrick's Day by dyeing your mashed potatoes this color,green,NA
2007-07-20,J,STATE CAPITALS,,200,In 1821 Mississippi named its capital for this hero of the War of 1812; he didn't become president until 8 years later,(Andrew) Jackson,NA
2007-07-20,J,IN THE BOOKSTORE,,200,"""Ahab's Wife"" tells a whale of a tale about a character mentioned briefly in this classic novel",Moby-Dick,NA
2007-07-20,J,FOREIGN WORDS & PHRASES,,200,"Before a trip, it's proper to wish someone ""bon"" this, whether they're traveling by ship or not",voyage,NA
2007-07-20,J,THE WORLD ALMANAC 2007,,400,"""Offbeat News Stories"" included a prize given to scientists who explained why these birds don't get headaches",woodpeckers,NA
2007-07-20,J,SPORTS TERMS,(Alex: You have to identify the sport for us.),400,"Goalie,throw-in,midfielder",soccer,NA
2007-07-20,J,COLORS,,400,It's the color named for the fatty part of milk that rises to the top,cream,NA
2007-07-20,J,STATE CAPITALS,,400,"When Kansas became a state in 1861, this city became capital",Topeka,NA
2007-07-20,J,IN THE BOOKSTORE,,400,"""Hope Was Here"" is a book about a teen waitress at the Welcome Stairways Diner in this ""Dairy State""",Wisconsin,NA
2007-07-20,J,FOREIGN WORDS & PHRASES,,400,"In many places of business, ""no zapatos, no service"", ""zapatos"" being Spanish for these",shoes,NA
2007-07-20,J,THE WORLD ALMANAC 2007,,600,"Born in 1984, this Brit is the youngest man on the list ""Widely Known World Personalities of the Present""",Prince Harry,NA
2007-07-20,J,SPORTS TERMS,(Alex: You have to identify the sport for us.),600,"Bunker,wedge,caddie",golf,NA
2007-07-20,J,COLORS,,600,"On the flag of El Salvador, the stripe of this color represents peace",white,NA
2007-07-20,J,STATE CAPITALS,,600,This capital lies in the Eagle Valley about 30 miles south of Reno,Carson City,NA
2007-07-20,J,IN THE BOOKSTORE,,600,"Take a bite out of ""The Vampire Armand"", the sixth book in her ""Vampire Chronicles""",Anne Rice,NA
2007-07-20,J,FOREIGN WORDS & PHRASES,,600,"Italian for ""to the tooth"", it's how to order your pasta if you want it a little firm",al dente,NA
2007-07-20,J,THE WORLD ALMANAC 2007,,800,"Alphabetically, a select list of endangered species runs from albatross to this",zebra,NA
2007-07-20,J,SPORTS TERMS,(Alex: You have to identify the sport for us.),800,"Bomb,backfield,blitz",football,NA
2007-07-20,J,COLORS,,800,"In names of Crayola colors, this color has preceded ""heart"", ""pizzazz"" & ""mountain majesty""",purple,NA
2007-07-20,J,STATE CAPITALS,,800,Tempe is a southern suburb of this state capital,Phoenix,NA
2007-07-20,J,IN THE BOOKSTORE,,800,"""Fever 1793"" depicts a teen's struggle during the 1793 epidemic of this ""colorful"" fever in Philadelphia",yellow fever,NA
2007-07-20,J,FOREIGN WORDS & PHRASES,,800,"Germany's superhighway, it's the equivalent of our expressways",the Autobahn,NA
2007-07-20,J,THE WORLD ALMANAC 2007,,1000,The editors' picks for a 2006 time capsule include a yellow ribbon magnet with this 3-word slogan,"""Support our troops.""",NA
2007-07-20,J,SPORTS TERMS,(Alex: You have to identify the sport for us.),1000,"Fletch,quiver,bowstring",archery,NA
2007-07-20,J,COLORS,,1000,Jewelers know that a tourmaline of this color is sometimes called a Brazilian sapphire,blue,NA
2007-07-20,J,STATE CAPITALS,,NA,A statue of Ethan Allen stands within the portico of the state capitol building in this city,Montpelier,NA
2007-07-20,J,IN THE BOOKSTORE,,1000,"A secret code called nu shu is pivotal to the plat of ""Snow Flower and the Secret Fan"", set in this country",China,NA
2007-07-20,J,FOREIGN WORDS & PHRASES,,1000,"""Seize the day"", I tell you, but do it with this Latin phrase",carpe diem,NA
2007-07-20,DJ,SCIENCE,,400,The third law of thermodynamics implies that a system can never be brought to this temperature point,absolute zero,NA
2007-07-20,DJ,ANNUAL EVENTS,,400,The first one of these days was originally conceived as an environmental teach-in,Earth Day,NA
2007-07-20,DJ,WAY BACK IN THE 1990s,,400,"When the U.K.'s 99-year lease on this crown colony ended, China retook control on July 1, 1997",Hong Kong,NA
2007-07-20,DJ,FAMOUS CANADIANS,,400,In 1917 & 1918 Ontario's Billy Bishop claimed 72 aerial victories as an Ace in this war,World War I,NA
2007-07-20,DJ,NOW WE'RE IN BUSINESS!,,400,Eating at this fast-food chain twice daily helped Jared Fogle lose over 200 pounds,Subway,NA
2007-07-20,DJ,"CROSSWORD CLUES ""D""",(Alex: Each correct response will begin with that letter.  I'll tell you how many letters in the word.),400,10-sport olympic event(9),the decathlon,NA
2007-07-20,DJ,SCIENCE,,800,"In 2006, Israeli scientists claimed to have created the ""ball"" type of this stormy phenomenon using a microwave oven",a lightning storm,NA
2007-07-20,DJ,ANNUAL EVENTS,,800,In 2007 Elvis Presley Birthday Week in Memphis included cake for all visitors to this mansion on January 8th,Graceland,NA
2007-07-20,DJ,WAY BACK IN THE 1990s,,800,"On Aug. 10, 1993 she was sworn in as the 107th Supreme Court Justice",Ginsburg,NA
2007-07-20,DJ,FAMOUS CANADIANS,,800,Toronto-born journalist Morley Safer began hosting this Sunday TV news magazine way back in 1970,60 Minutes,NA
2007-07-20,DJ,NOW WE'RE IN BUSINESS!,,800,In July 2004 this tech company said it would give back $75 billion to its shareholders,Microsoft,NA
2007-07-20,DJ,"CROSSWORD CLUES ""D""",(Alex: Each correct response will begin with that letter.  I'll tell you how many letters in the word.),800,"To consume quickly, like a good book(6)",to devour,NA
2007-07-20,DJ,SCIENCE,,1200,"This type of ""cell"" sounds like it causes disease, but it refers to a gamete, such as an egg cell",a germ cell,NA
2007-07-20,DJ,ANNUAL EVENTS,,1200,This Sunday before Easter celebrates Jesus' triumphant entry into Jerusalem,Palm Sunday,NA
2007-07-20,DJ,WAY BACK IN THE 1990s,,1200,"Partying like it was February of 1999, Hugo Chavez became President of this country",Venezuela,NA
2007-07-20,DJ,FAMOUS CANADIANS,,1200,Nova Scotia's Samuel Cunard founded the famous Cunard line of these in 1838,cruisers (or ships),NA
2007-07-20,DJ,NOW WE'RE IN BUSINESS!,,1200,"Give us your best ""Gilbert Gottfried as a duck"" impression & name this insurance co. headquartered in Columbus, Georgia",Aflac,NA
2007-07-20,DJ,"CROSSWORD CLUES ""D""",(Alex: Each correct response will begin with that letter.  I'll tell you how many letters in the word.),1200,"Pious, or ardent(6)",devout,NA
2007-07-20,DJ,SCIENCE,,NA,We went underground to learn that this unit is equal to about 6.022 x 1023 molecules of a given substance,a mole,NA
2007-07-20,DJ,ANNUAL EVENTS,,1600,Jerry Lewis has been hosting the Muscular Dystrophy Telethon on this holiday weekend since 1966,Labor Day,NA
2007-07-20,DJ,WAY BACK IN THE 1990s,,NA,"On Jan. 1, 1993 2 new European nations were formed from the split of this suddenly ex-country",Czechoslovakia,NA
2007-07-20,DJ,FAMOUS CANADIANS,,1600,James Gosling helped create this computer language that shares its name with a breakfast beverage,Java,NA
2007-07-20,DJ,NOW WE'RE IN BUSINESS!,,1600,"Dash off a letter to this telecom giant's Overland Park, Kansas HQ where you can hear a pin drop",Sprint,NA
2007-07-20,DJ,"CROSSWORD CLUES ""D""",(Alex: Each correct response will begin with that letter.  I'll tell you how many letters in the word.),1600,Strauss' Beautiful Blue body of water(6),the Danube,NA
2007-07-20,DJ,SCIENCE,,2000,"In 2007 Intel announced a new faster chip design replacing silicon with this element, symbol Hf",hafnium,NA
2007-07-20,DJ,ANNUAL EVENTS,,2000,"By law, a term of the U.S. Supreme Court begins on the first Monday in this month",October,NA
2007-07-20,DJ,WAY BACK IN THE 1990s,,2000,"On Oct. 26, 1994 a peace treaty was signed between Israel & this country led by King Hussein I",Jordan,NA
2007-07-20,DJ,FAMOUS CANADIANS,,2000,"Co-discoverer of this pancreatic hormone, Ontario's Frederick Banting won a 1923 Nobel Prize",insulin,NA
2007-07-20,DJ,NOW WE'RE IN BUSINESS!,,2000,"""We're going to race the truck.  People love the truck"", claimed this delivery company",UPS,NA
2007-07-20,DJ,"CROSSWORD CLUES ""D""",(Alex: Each correct response will begin with that letter.  I'll tell you how many letters in the word.),2000,Branch of medicine for the skin(11),dermatology,NA
2007-07-20,FJ,17th CENTURY PEOPLE,,NA,"Rev. John Robinson, Minister to these people, wrote them a letter saying how upset he was not to be going with them",the Pilgrims,NA
