date,round,category,comment,value,clue,response,link
1986-04-23,J,THE KENNEDYS,,100,The U.S. Kennedys trace their roots back to county Wexford in this country,Ireland,NA
1986-04-23,J,LOUISIANA,,100,"Though only the southern end is in Louisiana, this is considered the major physical feature of the state",the Mississippi River,NA
1986-04-23,J,ROCK ‘N ROLL,,100,This rock group featuring Belinda Carlisle has now officially gone-gone,The Go-Go\'s,NA
1986-04-23,J,THE OLD TESTAMENT,,100,"According to the 10th Commandment, you shouldn’t do this to a neighbor’s ox, servant or wife",covet,NA
1986-04-23,J,HOUSEHOLD HINTS,,100,"Instead of using regular paint remover to remove paint from hands, try this foamy toiletry",shaving cream,NA
1986-04-23,J,IN OTHER WORDS,"(Alex: Now that last category… is… exactly what it says.  All of the responses in the category will mean exactly the same thing as the answers that will appear, except--it will be in other words.) [Audience laughs]",100,"Effortlessly arrive, effortlessly depart","easy come, easy go",NA
1986-04-23,J,THE KENNEDYS,,200,He said “Do you realize the responsibility I carry?  I’m (the) only person standing between Nixon & the White House”,John F. Kennedy,NA
1986-04-23,J,LOUISIANA,,200,"In production of cotton, minerals & natural gas, the 1 in which Louisiana doesn’t rank #2 in the U.S.",cotton,NA
1986-04-23,J,ROCK ‘N ROLL,,200,Beatles song about purchasing affection that was 1st to hit #1 in U.S. & Britain at same time,"""Can’t Buy Me Love""",NA
1986-04-23,J,THE OLD TESTAMENT,,200,"While Encyclopedia Americana says this Old Testament book should be read as a parable, we say it’s a big fish story",Jonah,NA
1986-04-23,J,HOUSEHOLD HINTS,,200,"For small repairs, nail polish can sometimes substitute for this",glue,NA
1986-04-23,J,IN OTHER WORDS,"(Alex: Now that last category… is… exactly what it says.  All of the responses in the category will mean exactly the same thing as the answers that will appear, except--it will be in other words.) [Audience laughs]",200,Pattern assumed by disintegration of an Oreo,that’s the way the cookie crumbles,NA
1986-04-23,J,THE KENNEDYS,,300,She supervised the historic restoration of the White House & gave a TV tour of it,Jackie Kennedy,NA
1986-04-23,J,LOUISIANA,,300,"Counting migrants, in January 25% of all these fowl in the U.S. are wintering in Louisiana",duck,NA
1986-04-23,J,ROCK ‘N ROLL,,300,Release of this Jacksons album was held up until “Thriller” sales peaked,Victory,NA
1986-04-23,J,THE OLD TESTAMENT,,300,Samuel took a horn of oil & did this to David amidst his brethren,anoint,NA
1986-04-23,J,HOUSEHOLD HINTS,,300,Heavy starching of braided rugs will keep ends from doing this,curling,NA
1986-04-23,J,IN OTHER WORDS,"(Alex: Now that last category… is… exactly what it says.  All of the responses in the category will mean exactly the same thing as the answers that will appear, except--it will be in other words.) [Audience laughs]",300,A void of originality exists beneath our class G star,nothing new under the sun,NA
1986-04-23,J,THE KENNEDYS,,400,States that have been represented by Joseph Kennedy’s sons in the U.S. Senate,Massachusetts & New York,NA
1986-04-23,J,LOUISIANA,,400,"Louisiana has had 11, including 1 which was over 250,000 words & amended 537 times",a constitution,NA
1986-04-23,J,ROCK ‘N ROLL,,400,"Van Morrison sang of “making love in the green grass, behind the stadium” with her","""Brown Eyed Girl""",NA
1986-04-23,NA,NA,NA,NA,NA,NA,NA
1986-04-23,J,HOUSEHOLD HINTS,,400,"To save pennies at the supermarket, avoid buying products displayed on shelves at this level",eye level,NA
1986-04-23,J,IN OTHER WORDS,"(Alex: Now that last category… is… exactly what it says.  All of the responses in the category will mean exactly the same thing as the answers that will appear, except--it will be in other words.) [Audience laughs]",400,Expired Homo sapiens don’t relate fables,dead men tell no tales,NA
1986-04-23,J,THE KENNEDYS,,500,"Rose’s maiden name, it became the middle name of one of her sons",Fitzgerald,NA
1986-04-23,J,LOUISIANA,,500,The more familiar name of New Orleans’ 85-block “Vieux Carre”,the French Quarter,NA
1986-04-23,J,ROCK ‘N ROLL,,500,"In 1985, Tears for Fears said “everybody wants to” do this",rule the world,NA
1986-04-23,NA,NA,NA,NA,NA,NA,NA
1986-04-23,J,HOUSEHOLD HINTS,,500,"Mary Ellen says to soften peanut butter & add flavor, “open” a bottle of this oil & put in a drop",sesame seed oil,NA
1986-04-23,J,IN OTHER WORDS,"(Alex: Now that last category… is… exactly what it says.  All of the responses in the category will mean exactly the same thing as the answers that will appear, except--it will be in other words.) [Audience laughs]",500,The person that finances a Scottish musician gets to pick song played,he who pays the piper calls the tune,NA
1986-04-23,DJ,UNITED NATIONS,,200,Article 1 of U.N. charter says maintaining this is the U.N.’s primary purpose,world peace,NA
1986-04-23,DJ,BIRDS,,200,"According to Aesop, greed killed the goose that did this",laid the golden egg,NA
1986-04-23,DJ,BASEBALL,,200,"In 1919-21, this championship was a best-of-9 series",the World Series,NA
1986-04-23,DJ,THE 19th CENTURY,,200,"Great Britain, Prussia, Austria & Russia joined forces in 1815 to rid Europe of him once & for all",Napoleon,NA
1986-04-23,DJ,ASTRONOMY,,200,"Of lunar, or solar eclipses, the more frequent",a solar eclipse,NA
1986-04-23,DJ,POTENT QUOTABLES,,200,"In the pirate drinking song, it follows “yo-ho-ho”",a bottle of rum,NA
1986-04-23,DJ,UNITED NATIONS,,400,The name “United Nations” was adopted in WWII to note countries opposed to these powers,the Axis powers,NA
1986-04-23,DJ,BIRDS,,400,"Though this diving bird has a weird, laughing cry, it isn’t really crazy",a loon,NA
1986-04-23,DJ,BASEBALL,,NA,2 of the 6 current major league teams that have never won a league pennant,"(2 of) the Montreal Expos, the Seattle Mariners, the California Angels, the Texas Rangers, the Toronto Blue Jays, & the Houston Astros",NA
1986-04-23,DJ,THE 19th CENTURY,,400,The 2-year war with this country from 1846-48 cost the U.S. almost $100 million,Mexico,NA
1986-04-23,DJ,ASTRONOMY,,400,"This planet is only about ¾ as dense as water, so it probably wouldn’t leave “rings” in the bathtub",Saturn,NA
1986-04-23,DJ,POTENT QUOTABLES,,400,William Lampton said this state was “where the corn is full of kernels & the colonels full a corn”,Kentucky,NA
1986-04-23,NA,NA,NA,NA,NA,NA,NA
1986-04-23,DJ,BIRDS,,600,"Name of this ugly, naked-headed bird can refer to someone disgustingly predatory",a vulture,NA
1986-04-23,DJ,BASEBALL,,600,More current active major leaguers come from San Pedro de Macoris in this country than from Chicago,the Dominican Republic,NA
1986-04-23,DJ,THE 19th CENTURY,,600,"Until the 19th century & porcelain, hippopotamus bone was the popular material for these falsies",false teeth,NA
1986-04-23,DJ,ASTRONOMY,,NA,Title of this number one 1958 hit,"""Little Star""",http://www.j-archive.com/media/1986-04-23_DJ_22.mp3
1986-04-23,DJ,POTENT QUOTABLES,,600,"In 1825, Anthelme Brillat-Savarin said, “a meal without wine is like a day without” this",sunshine,NA
1986-04-23,NA,NA,NA,NA,NA,NA,NA
1986-04-23,DJ,BIRDS,,800,"Bird to which Shelley wrote, “Hail to thee, blithe spirit”",a skylark,NA
1986-04-23,DJ,BASEBALL,,800,"1st man elected to Baseball Hall of Fame, he played 22 seasons for Detroit",Ty Cobb,NA
1986-04-23,DJ,THE 19th CENTURY,,800,"In 1848, Zachary Taylor was the 2nd & last candidate of this party to be elected president",the Whigs,NA
1986-04-23,DJ,ASTRONOMY,,800,German astronomer whose laws of planetary motion were published in 1609,Johannes Kepler,NA
1986-04-23,DJ,POTENT QUOTABLES,,800,G.W. Young was the one who insisted that these “must never touch mine”,lips that touch liquor,NA
1986-04-23,NA,NA,NA,NA,NA,NA,NA
1986-04-23,DJ,BIRDS,,1000,"With longest migratory flight, it spends winters in southern & summers in northern polar regions",the arctic tern,NA
1986-04-23,DJ,BASEBALL,,1000,"In 1920, Bill Wambsganss became only player in World Series history to execute this feat",an unassisted triple play,NA
1986-04-23,NA,NA,NA,NA,NA,NA,NA
1986-04-23,NA,NA,NA,NA,NA,NA,NA
1986-04-23,DJ,POTENT QUOTABLES,,1000,Famous poetical drinking instruction Ben Jonson gave “to Celia”,drink to me only with thine eyes,NA
1986-04-23,FJ,THE OSCARS,,NA,"This Best Picture had the shortest title, using only 2 different letters",Gigi,NA
