date,round,category,comment,value,clue,response,link
2005-03-15,J,THE NEWSPAPER,,200,"Stop the presses!  In 1982 it became America's first national, general interest newspaper",USA Today,NA
2005-03-15,J,THE SPORTS PAGE,,200,"Yankee manager Billy Martin nearly came to blows in the dugout with this ""Mr. October"" slugger in 1977",Reggie Jackson,NA
2005-03-15,J,THE BOOK REVIEW,,200,"""American Soldier"" is a memoir by this general who led American & Coalition forces in Iraq",Tommy Franks,NA
2005-03-15,J,THE FOOD SECTION,,200,"For Japanese New Year, feast on mochi, pounded cakes made from this grain",rice,NA
2005-03-15,J,THE PERSONALS,,200,"330 B.C.:At 26, I've conquered Persia... can you conquer my heart?",Alexander the Great,NA
2005-03-15,J,"THE ""C""ROSSWORD PUZZLE",,200,1986 disaster city in Ukraine(9),Chernobyl,NA
2005-03-15,J,THE NEWSPAPER,,400,"When it hit the streets in 1831, Michigan Intelligencer was part of its name",The Detroit Free Press,NA
2005-03-15,J,THE SPORTS PAGE,,400,"This Packer QB's first NFL completion was to himself, a deflected pass for -7 yards on Sept. 13, 1992",Brett Favre,NA
2005-03-15,J,THE BOOK REVIEW,,400,"This comedian is pictured on the cover of ""America (The Book): A Citizen's Guide to Democracy Inaction""",Jon Stewart,NA
2005-03-15,J,THE FOOD SECTION,,400,"No Passover would be complete without plates of this appetizer, ground fish with egg & matzo meal",gefilte fish,NA
2005-03-15,J,THE PERSONALS,,400,"Dec. 14, 1809:Divorced today!  Ex-empress, 46, Malmaison-bound, desires tall man for a change",Josephine,NA
2005-03-15,J,"THE ""C""ROSSWORD PUZZLE",,400,Premium California red winegrape(8),cabernet,NA
2005-03-15,J,THE NEWSPAPER,,600,This city's Observer serves 40 counties in North & South Carolina,Charlotte,NA
2005-03-15,J,THE SPORTS PAGE,,600,"""All of my books are thought-provoking"", said this NBA analyst seen here",Charles Barkley,http://www.j-archive.com/media/2005-03-15_J_02.jpg
2005-03-15,J,THE BOOK REVIEW,,600,"A book about this ever-popular sweet substance is subtitled ""The Nature of Indulgence""",chocolate,NA
2005-03-15,J,THE FOOD SECTION,,600,"The Russian paskha sweet cheese mold for this holiday has the initials XB on it, meaning ""Christ is risen""",Easter,NA
2005-03-15,J,THE PERSONALS,,600,"450 A.D.:""Scourge of God"" demands sister of emperor of West Roman Empire as bride--now!",Attila the Hun,NA
2005-03-15,J,"THE ""C""ROSSWORD PUZZLE",,600,"Michigan city, or DeVille maker(8)",Cadillac,NA
2005-03-15,J,THE NEWSPAPER,,800,This paper rises each morning from its headquarters at Calvert & Centre Streets,The Baltimore Sun,NA
2005-03-15,J,THE SPORTS PAGE,,800,"At the 2000 Las Vegas invitational, Jerry Kelly happily tied a PGA record with 8 of these in a row",birdies,NA
2005-03-15,J,THE BOOK REVIEW,,800,"The 6-word title of this bestselling dating guide offers ""The No-Excuses Truth to Understanding Guys""",He\'s Just Not That Into You,NA
2005-03-15,J,THE FOOD SECTION,,800,"Pan de muerto, an egg-rich bread, is a favorite in Mexico on this aptly named 4-word holiday",Day of the Dead,NA
2005-03-15,J,THE PERSONALS,,800,"1944:Radio actress, mid-20s, desires Argentinean VP for relationship",Eva Peron,NA
2005-03-15,J,"THE ""C""ROSSWORD PUZZLE",,800,"A yellowish green, or a liqueur(10)",chartreuse,NA
2005-03-15,J,THE NEWSPAPER,,1000,"At the request of its founder, this Boston paper runs 1 religious article each day in its home forum section",The Christian Science Monitor,NA
2005-03-15,J,THE SPORTS PAGE,,NA,One of this league's biggest newsmakers in 2004-'05 was Commissioner Gary Bettman,the National Hockey League,NA
2005-03-15,J,THE BOOK REVIEW,,1000,"""How to Talk to a Liberal (if You Must)"" is subtitled ""The World According to"" her",Ann Coulter,NA
2005-03-15,J,THE FOOD SECTION,,1000,A sweet called shira is made with this spice from the seed seen here,cardamom,http://www.j-archive.com/media/2005-03-15_J_08.jpg
2005-03-15,J,THE PERSONALS,,1000,"37 A.D.:Let's have Italian!  ""Little Boot"" emperor seeks hot companion shoe for stylish fit",Caligula,NA
2005-03-15,J,"THE ""C""ROSSWORD PUZZLE",,1000,"Used in atomic clocks, it melts at 83.3 degrees F.(6)",cesium,NA
2005-03-15,DJ,MUSIC,,400,Pernambuco or brazilwood is frequently used to make this accessory for string players,bows,NA
2005-03-15,DJ,FIVE EASY PISCES,,400,"Perhaps inspired by his zodiac symbol, he wrote ""One Fish Two Fish Red Fish Blue Fish""",Dr. Seuss,NA
2005-03-15,DJ,CHAPLIN,,400,Charlie Chaplin said that in creating his Tramp character he added this to make him look older,a mustache,NA
2005-03-15,DJ,FROM THE CIA WORLD FACTBOOK,,400,"The IDF, this country's defense force, based at Keflavik, is manned by Americans",Iceland,NA
2005-03-15,DJ,THE STATE OF EDUCATION,(Alex: Name the U.S. state where you'll find these schools...),400,"The University of Puget Sound,Gonzaga University",Washington State,NA
2005-03-15,DJ,15-LETTER WORDS,[All three contestants laugh at this category.],400,Film industry position of the person who oversees the camerawork & the lighting,cinematographer,NA
2005-03-15,DJ,MUSIC,,NA,"(Cheryl of the Clue Crew reports from a chalkboard.)  In the treble clef, the lines of the staff are E-G-B-D-F, so the spaces are known by this anatomical acronym",FACE,http://www.j-archive.com/media/2005-03-15_DJ_18.jpg
2005-03-15,DJ,FIVE EASY PISCES,,800,"He's the Pisces born March 6, 1475 who said, ""I saw the angel in the marble and carved until I set him free""",Michelangelo,NA
2005-03-15,DJ,CHAPLIN,,800,"In ""Benny & Joon"" this actor performed Chaplin's dancing roll scene from ""The Gold Rush""",Johnny Depp,NA
2005-03-15,DJ,FROM THE CIA WORLD FACTBOOK,,NA,"The center of power of an empire until 1918, this country is a bit smaller than Maine",Austria,NA
2005-03-15,DJ,THE STATE OF EDUCATION,(Alex: Name the U.S. state where you'll find these schools...),800,"Stillman College,Auburn University",Alabama,NA
2005-03-15,DJ,15-LETTER WORDS,[All three contestants laugh at this category.],800,It's the illegal conduct being identified here,unsportsmanlike conduct,http://www.j-archive.com/media/2005-03-15_DJ_28.jpg
2005-03-15,DJ,MUSIC,,1200,The keynote of a major or minor scale also has this drinkable name,tonic,NA
2005-03-15,DJ,FIVE EASY PISCES,,1200,"""When we met first and loved..."" begins one of the famous sonnets by this ""Portuguese"" Pisces",Elizabeth Barrett Browning,NA
2005-03-15,DJ,CHAPLIN,,1200,"Chaplin was born April 16, 1889 in England & died Christmas day in 1977 in this country",Switzerland,NA
2005-03-15,DJ,FROM THE CIA WORLD FACTBOOK,,1200,"Nepal's regime is threatened by this type of movement, named for a Chinese leader",Maoists,NA
2005-03-15,DJ,THE STATE OF EDUCATION,(Alex: Name the U.S. state where you'll find these schools...),1200,"Tougaloo College,Jackson State University",Mississippi,NA
2005-03-15,DJ,15-LETTER WORDS,[All three contestants laugh at this category.],1200,It's a refusal to obey orders or submit to authority in the military,insubordination,NA
2005-03-15,DJ,MUSIC,,1600,"(Cheryl of the Clue Crew blows into a saxophone.)  From the French for ""mouth"", it's the way you form your lips & teeth around a horn's mouthpiece",the embouchure,http://www.j-archive.com/media/2005-03-15_DJ_16.wmv
2005-03-15,DJ,FIVE EASY PISCES,,1600,"Elizabeth Taylor is a Pisces & so was this man--the explorer, not her husband of the same name",Richard Burton,NA
2005-03-15,DJ,CHAPLIN,,1600,"In 1914, this Keystone Studios head was the last person other than Chaplin to direct him in a film",(Mack) Sennett,NA
2005-03-15,DJ,FROM THE CIA WORLD FACTBOOK,,1600,"Frequent recent invasions haven't hurt this Asian country's opium crop, the world's largest",Afghanistan,NA
2005-03-15,DJ,THE STATE OF EDUCATION,(Alex: Name the U.S. state where you'll find these schools...),1600,"Bowling Green State University,Case Western Reserve University",Ohio,NA
2005-03-15,DJ,15-LETTER WORDS,[All three contestants laugh at this category.],1600,"Specifically, the person in an organization who enforces Robert's Rules of Order",the parliamentarian,NA
2005-03-15,DJ,MUSIC,,2000,"From the Italian for ""big"", it's a concerto for an orchestra & a group of instrumental soloists",(concerto) grosso,NA
2005-03-15,DJ,FIVE EASY PISCES,,2000,"Since Pisces is a water sign, it's not surprising that he composed ""Water Music"" in 1717",Handel,NA
2005-03-15,DJ,CHAPLIN,,2000,"In ""Limelight"" Chaplin cast as his partner this other great comic of the silent screen",Buster Keaton,NA
2005-03-15,DJ,FROM THE CIA WORLD FACTBOOK,,2000,"Though illegal, the Muslim Brotherhood is the main opposition to this African in power since 1981",Hosni Mubarak,NA
2005-03-15,DJ,THE STATE OF EDUCATION,(Alex: Name the U.S. state where you'll find these schools...),2000,"Suffolk University,Brandeis University",Massachusetts,NA
2005-03-15,DJ,15-LETTER WORDS,[All three contestants laugh at this category.],2000,"In the armed forces, it's what the NC stands for in NCO",noncommissioned,NA
2005-03-15,FJ,ARTISTIC MASTERPIECES,,NA,"""Shouldn't the shining dots of the sky be as accessible as the black dots on the map of France?"" the artist wrote of this work",The Starry Night (by Vincent Van Gogh),NA
