date,round,category,comment,value,clue,response,link
2000-04-20,J,FOREIGN NATIONAL PARKS,(Alex: You have to identify the country.),100,Cooloola & Goongarrie,Australia,NA
2000-04-20,J,TEXTILES,,100,"Panne, cut & crushed are types of this thick pile fabric",velvet,NA
2000-04-20,J,THANKS FOR THE MEMOIRS,,100,"This star of the 1952 movie ""Million Dollar Mermaid"" called her 1999 memoir ""The Million Dollar Mermaid""",Esther Williams,NA
2000-04-20,NA,NA,NA,NA,NA,NA,NA
2000-04-20,J,"DIRIGIBLES, BLIMPS & ZEPPELINS",,100,"In 1925 this Ohio company unveiled its first blimp, the Pilgrim",Goodyear,NA
2000-04-20,J,"""O"" YES!",,100,"A synonym for scent, this noun is from the Latin for ""smell""",odor,NA
2000-04-20,J,FOREIGN NATIONAL PARKS,(Alex: You have to identify the country.),200,Gran Paradiso,Italy,NA
2000-04-20,J,TEXTILES,,200,Ancient Egyptian priests wore this textile made from flax; so did mummies,linen,NA
2000-04-20,J,THANKS FOR THE MEMOIRS,,200,"""King of the World"" chronicles ""The Rise of an American Hero"", this legendary boxer & minister of Islam",Muhammad Ali,NA
2000-04-20,NA,NA,NA,NA,NA,NA,NA
2000-04-20,J,"DIRIGIBLES, BLIMPS & ZEPPELINS",,200,"In 1925 Amundsen, Ellsworth & Nobile made news when they flew over this point in a blimp",North Pole,NA
2000-04-20,J,"""O"" YES!",,200,"Impenetrable to light, like some glass",opaque,NA
2000-04-20,J,FOREIGN NATIONAL PARKS,(Alex: You have to identify the country.),300,Cali Headlands,Colombia,NA
2000-04-20,J,TEXTILES,,300,Pashmina is a fashionable type of this luxurious fabric made from the hair of a wild goat native to India & Tibet,cashmere,NA
2000-04-20,J,THANKS FOR THE MEMOIRS,,300,"No surprise, this lead singer of Jefferson Airplane talks about sex, drugs & rock & roll in ""Somebody to Love?""",Grace Slick,NA
2000-04-20,J,NAMED FOR THE STAR,,300,"(Hi, I'm Danny Masterson of ""That '70s Show"")  For 2 seasons I played Christine Baranski's son & Alicia Witt's love interest on this show",Cybill,NA
2000-04-20,J,"DIRIGIBLES, BLIMPS & ZEPPELINS",,300,"The U.S. Navy's ZR1, Shenandoah, was its first filled with this gas",helium,NA
2000-04-20,J,"""O"" YES!",,300,"It's a single performance by a band in a single locale, or the title of a Wesley Snipes film",One Night Stand,NA
2000-04-20,J,FOREIGN NATIONAL PARKS,(Alex: You have to identify the country.),400,Great Gobi Desert,Mongolia,NA
2000-04-20,J,TEXTILES,,400,This textile with a printed design is named for the Indian city where it was created,Madras/calico,NA
2000-04-20,J,THANKS FOR THE MEMOIRS,,400,"""Lost in the Funhouse"" explores ""The Life and Mind"" of this comic & world champ of inter-gender wrestling",Andy Kaufman,NA
2000-04-20,J,NAMED FOR THE STAR,,400,"Led Zeppelin appeared on U.S. TV in 1976 on this impresario's ""Rock Concert""",Don Kirshner,NA
2000-04-20,J,"DIRIGIBLES, BLIMPS & ZEPPELINS",,400,"Of the Bucs, Broncos or Bills, the one whose NFL stadium you'll never see the Fujifilm blimp fly over",Broncos (that blimp has an altitude limit of 5000 feet),NA
2000-04-20,J,"""O"" YES!",,400,"A temporary suspension of operation; of electrical power, for example",outage,NA
2000-04-20,J,FOREIGN NATIONAL PARKS,(Alex: You have to identify the country.),500,Granma Landing,Cuba,NA
2000-04-20,J,TEXTILES,,500,"From the French for ""caterpillar"", this tufted fabric makes cozy robes & bedspreads",chenille,NA
2000-04-20,J,THANKS FOR THE MEMOIRS,,500,"""'Tis"" is the sequel to ""Angela's Ashes"", his memoir of an Irish Catholic childhood",Frank McCourt,NA
2000-04-20,J,NAMED FOR THE STAR,,500,"""Eye to Eye With"" this newswoman made news for a 1995 interview with Newt Gingrich's mom",Connie Chung,NA
2000-04-20,J,"DIRIGIBLES, BLIMPS & ZEPPELINS",,NA,L.A. & this N.J. city were the only U.S. stops the Graf Zeppelin made during its round-the-world trip in 1929,Lakehurst,NA
2000-04-20,J,"""O"" YES!",,500,"From the Old Norse for ""manager"", it's a non-governmental investigator who resolves complaints",ombudsman,NA
2000-04-20,NA,NA,NA,NA,NA,NA,NA
2000-04-20,NA,NA,NA,NA,NA,NA,NA
2000-04-20,DJ,THE ARCHER,,200,It's William Tell's famous familial feat of archery,shooting the apple off his son\'s head,NA
2000-04-20,DJ,THE GOAT,,200,Many blamed France's financial problems just before the revolution on this queen's spending,Marie Antoinette,NA
2000-04-20,DJ,THE BULL,,200,"At 1999's end, this internet bookseller had seen its stock rise 6,000% without showing a profit",Amazon.com,NA
2000-04-20,DJ,"THE ""RAM""","(Alex: You thought we had more signs of the Zodiac - we fooled you, cameraperson!)",200,"An episode of violent, destructive behavior",rampage,NA
2000-04-20,DJ,THE CRAB,,NA,An organization called CRAB does research into this disease by using biostatistics,cancer,NA
2000-04-20,DJ,THE TWINS,,400,The Twins' web site says the highlight of their losing 1999 season was this feat on September 11 by pitcher Eric Milton,No-hitter,NA
2000-04-20,DJ,THE ARCHER,,400,"This ""diminutive"" companion of Robin Hood was a skillful archer too",Little John,NA
2000-04-20,DJ,THE GOAT,,400,In 1999 this U.S. city's police chief quit after riots disrupted the World Trade Organization meetings,Seattle,NA
2000-04-20,DJ,THE BULL,,400,In January 2000 Alan Greenspan was nominated to a fourth term as chairman of this agency,Federal Reserve,NA
2000-04-20,DJ,"THE ""RAM""","(Alex: You thought we had more signs of the Zodiac - we fooled you, cameraperson!)",400,"If there's no room at this company's inn, try one of its Limiteds or Plaza Hotels",Ramada,NA
2000-04-20,DJ,THE CRAB,,600,"A crab that's sold as ""soft-shelled"" is one that has just done this, so its shell is soft",molted,NA
2000-04-20,DJ,THE TWINS,,600,This Twins Hall of Famer seen here made a run at a .400 average in 1977:,Rod Carew,NA
2000-04-20,DJ,THE ARCHER,,600,"This Homeric hero shot the suitors of his wife Penelope ""till the dead lay in piles""",Odysseus,NA
2000-04-20,DJ,THE GOAT,,600,"In May 1988 Ed Meese, facing calls to quit this cabinet post, instead fired his spokesman",Attorney General,NA
2000-04-20,DJ,THE BULL,,600,"It set a trading volume record on December 17, 1999 at 1,349,711,000 shares",New York Stock Exchange,NA
2000-04-20,DJ,"THE ""RAM""","(Alex: You thought we had more signs of the Zodiac - we fooled you, cameraperson!)",600,"""Aimless"" name for the type of roses seen here:",rambling roses,NA
2000-04-20,DJ,THE CRAB,,800,"This rhesus monkey of southeast Asia likes to ""craque"" open a crab for lunch",macaque,NA
2000-04-20,DJ,THE TWINS,,800,"In '65, in their first World Series, the Twins lost game 7 to this Dodger lefty",Sandy Koufax,NA
2000-04-20,DJ,THE ARCHER,,800,This rock star says his hero is Michigan bow hunter Claude Pollington,Ted Nugent,NA
2000-04-20,DJ,THE GOAT,,800,"In 1998 Japanese premier Hashimoto quit after leading this party, the LDP, to defeat",Liberal Democratic Party,NA
2000-04-20,DJ,THE BULL,,NA,In November 1999 this 93-year-old delivery company brought home $5.47 billion in its initial public offering,UPS (United Parcel Service),NA
2000-04-20,DJ,"THE ""RAM""","(Alex: You thought we had more signs of the Zodiac - we fooled you, cameraperson!)",800,Harpsichordist Robert Veyron-Lacroix was a longtime musical partner of this celebrated flutist,Jean-Pierre Rampal,NA
2000-04-20,DJ,THE CRAB,,1000,"Want really long crab legs for dinner?  Try this crab's which can span over 10 feet (just check their ""web"" site)",spider crab,NA
2000-04-20,DJ,THE TWINS,,1000,"From 1901 to 1960, the franchise represented the nation's capital as this team",Washington Senators,NA
2000-04-20,NA,NA,NA,NA,NA,NA,NA
2000-04-20,DJ,THE GOAT,,1000,"Nixon's personal secretary, she took the blame for an 18-minute gap on one of the Watergate tapes",Rose Mary Woods,NA
2000-04-20,DJ,THE BULL,,1000,"Founded by Bill Porter in 1982, this online brokerage launched its own web site in 1996",E*TRADE,NA
2000-04-20,DJ,"THE ""RAM""","(Alex: You thought we had more signs of the Zodiac - we fooled you, cameraperson!)",1000,Heraldic pose of the creature seen here:(griffin),rampant,NA
2000-04-20,FJ,FAMOUS AMERICANS,,NA,"The first person selected to the Intl. Swimming Hall of Fame, his last starring film role was in 1955's ""Devil Goddess""",Johnny Weissmuller,NA
