date,round,category,comment,value,clue,response,link
2000-06-19,J,U.S.A.,,100,Fillmore filled in as Utah's territorial capital until this city took over in 1856,Salt Lake City,NA
2000-06-19,J,MOVIE SPOUSES,,100,"Spencer Tracy's in ""Guess Who's Coming to Dinner""",Katharine Hepburn,NA
2000-06-19,J,THE 1860s,,100,"In March of 1867 Secretary of State Seward arranged to buy this ""icebox"" for a total of $7.2 million",Alaska,NA
2000-06-19,J,A CENTURY OF FOOD,,100,"A San Pedro, California packer first put this fish into cans in 1903; its casserole wasn't introduced until the '30s",Tuna,NA
2000-06-19,J,POSTS,,100,In 1492 Martin Pinzon commanded this ship; his brother Vicente commanded the Nina,Pinta,NA
2000-06-19,J,"""CK""",,100,"The ""culture"" type is emotional disruption caused by living in a society not one's own",Shock,NA
2000-06-19,J,U.S.A.,,200,"The ""American"" breed of this dog is Virginia's official state dog -- Tallyho!",Foxhound,NA
2000-06-19,J,MOVIE SPOUSES,,200,"Michelle Pfeiffer's in ""The Story of Us""",Bruce Willis,NA
2000-06-19,J,THE 1860s,,200,"In 1864 this motto first appeared on a U.S. coin, a 2-cent piece","""In God We Trust""",NA
2000-06-19,J,A CENTURY OF FOOD,,200,George Bush vetoed this veggie 62 years after it was brought to the U.S. from Italy,Broccoli,NA
2000-06-19,J,POSTS,,200,"In 1981, just before becoming president of Egypt on Sadat's death, Hosni Mubarak held this post",Vice president,NA
2000-06-19,J,"""CK""",,200,"Edmund Bergler, credited with inventing the term ""writer's"" this, must not have felt it -- he wrote several books",Block,NA
2000-06-19,J,U.S.A.,,300,Music lovers know this city is home to the Rhode Island Philharmonic,Providence,NA
2000-06-19,J,MOVIE SPOUSES,,300,"Meg Ryan's in ""When a Man Loves a Woman""",Andy Garcia,NA
2000-06-19,J,THE 1860s,,300,In 1865 this man began making distinctive cowboy hats in his one-man factory in Philadelphia,John Stetson,NA
2000-06-19,J,A CENTURY OF FOOD,,300,"In 1949 Charles Lubin introduced a cheesecake with this name, his daughter's",Sara Lee,NA
2000-06-19,J,POSTS,,300,"Irving Thalberg produced ""A Night at the Opera"" as a unit producer at this studio",MGM,NA
2000-06-19,J,"""CK""",,300,A metal measuring rod that's poked into a car's crankcase,Dipstick,NA
2000-06-19,J,U.S.A.,,400,"Sounds fishy, but Mystic Aquarium is one of the top attractions in this state",Connecticut,NA
2000-06-19,J,MOVIE SPOUSES,,400,"Jeff Daniels' in ""Terms of Endearment""",Debra Winger,NA
2000-06-19,J,THE 1860s,,400,"On October 4, 1861 the U.S. Navy authorized the construction of this ironclad ship; it was launched 118 days later",Monitor,NA
2000-06-19,J,A CENTURY OF FOOD,,NA,Reuben Mattus created this ice cream (& its Danish-sounding name) in the Bronx in 1961,Haagen-Dazs,NA
2000-06-19,J,POSTS,,400,"In 1877 Bat Masterson was elected sheriff of Ford County, Kansas with this ""car"" town as his headquarters",Dodge City,NA
2000-06-19,J,"""CK""",,400,"They're barrel's 2 partners in an expression meaning ""the whole thing""",Lock & stock,NA
2000-06-19,J,U.S.A.,,500,"At 306 feet high, the Bennington Battle Monument in this state was once the tallest battle monument in the world",Vermont,NA
2000-06-19,J,MOVIE SPOUSES,,500,"Richard Dreyfuss' in ""Close Encounters...""",Teri Garr,NA
2000-06-19,J,THE 1860s,,500,"In 1868 this lodge, the B.P.O.E., was founded in New York City by 15 entertainers",Benevolent and Protective Order of Elks,NA
2000-06-19,J,A CENTURY OF FOOD,,500,"Mr. Cardini's 1924 invention, it was called ""The greatest recipe to originate from the Americas in 50 years""",Caesar salad,NA
2000-06-19,J,POSTS,,500,This 11th century poet held the post of astronomer in the Persian royal court,Omar Khayyam,NA
2000-06-19,J,"""CK""",,500,Athletic position in which the thighs are against the chest & the arms wrap around the shins,Tuck,NA
2000-06-19,DJ,POETRY,,200,"Poe poem containing the line ""What a world of happiness their harmony foretells!""","""The Bells""",NA
2000-06-19,DJ,TERMS OF SERVICE,,200,President of Uganda:1971-1979,Idi Amin,NA
2000-06-19,DJ,ALSO AT THE 2000 GRAMMYS,,200,"The Best Chamber Music Performance was this German's sonatas with Lambert Orkis, not Schroeder, on piano",Beethoven,NA
2000-06-19,DJ,POPES NAMED LEO,,200,Leo I's Petrine Theory established that the popes inherit this man's authority,Saint Peter,NA
2000-06-19,DJ,WEIRD WEIGHTS & MEASURES,,200,"A kip is a deadweight load equivalent to this many pounds, half a short ton",1000,NA
2000-06-19,DJ,"""EX"" WORDS",,200,Form of address for a foreign ambassador or a bishop,Your Excellency,NA
2000-06-19,DJ,POETRY,,400,"His epic Civil War poem ""John Brown's Body"" won the Pulitzer Prize in 1929",Stephen Vincent Benet,NA
2000-06-19,DJ,TERMS OF SERVICE,,400,Prime minister of Japan:1941-1944,Hideki Tojo,NA
2000-06-19,DJ,ALSO AT THE 2000 GRAMMYS,,400,"The Best Long Form Music Video featured this ""fiery"" rock guitarist who died in 1970",Jimi Hendrix,NA
2000-06-19,DJ,POPES NAMED LEO,,400,In an 1895 letter Leo XIII wrote against this country's separation of church & state,USA,NA
2000-06-19,DJ,WEIRD WEIGHTS & MEASURES,,400,"Don't wine, a jeroboam is just 2 of these you might find in your wine Selleck...er, cellar",Magnums,NA
2000-06-19,DJ,"""EX"" WORDS",,400,"From the Latin for ""up high"", it means to glorify or honor",Exalt,NA
2000-06-19,DJ,POETRY,,600,This 1915 Edgar Lee Masters work was an assemblage of over 200 self-inscribed epitaphs from a Midwestern town,"""Spoon River Anthology""",NA
2000-06-19,DJ,TERMS OF SERVICE,,600,"""Magnificent"" dictator of Florence, Italy:1478-1492",Lorenzo de\' Medici,NA
2000-06-19,DJ,ALSO AT THE 2000 GRAMMYS,,NA,"Burning Spear won for Best Album in this musical category with ""Calling Rastafari""",Reggae,NA
2000-06-19,DJ,POPES NAMED LEO,,600,"Leo IV rebuilt Rome after it was sacked by the Saracens, people of this religion",Islam,NA
2000-06-19,DJ,WEIRD WEIGHTS & MEASURES,,600,"A centistere is this fraction of a stere, a measure of stacked wood",a hundredth,NA
2000-06-19,DJ,"""EX"" WORDS",,600,Spit,Expectorate,NA
2000-06-19,DJ,POETRY,,800,"This Longfellow schooner ""Sailed the wintry sea; and the skipper had taken his little daughter to bear him company""",Hesperus,NA
2000-06-19,DJ,TERMS OF SERVICE,,800,Prime minister of Canada:1984-1993,Brian Mulroney,NA
2000-06-19,DJ,ALSO AT THE 2000 GRAMMYS,,800,Los Palominos won for Best Performance in this Mexican-American style made famous by Selena,Tejano,NA
2000-06-19,DJ,POPES NAMED LEO,,800,"After being attacked on the streets of Rome in 799, Leo III took refuge with this king of the Franks",Charlemagne,NA
2000-06-19,DJ,WEIRD WEIGHTS & MEASURES,,800,"It can be a unit of circular measure equal to 60 degrees, or an instrument used by navigators to measure angles",Sextant,NA
2000-06-19,DJ,"""EX"" WORDS",,800,"""Extrude"" means to thrust out; drop 2 letters & you get this similar word meaning to ooze forth",Exude,NA
2000-06-19,DJ,POETRY,,1000,"This Shelley poem is subtitled ""An Elegy on the Death of John Keats""","""Adonais""",NA
2000-06-19,DJ,TERMS OF SERVICE,,1000,Prime minister of Great Britain:1916-1922,David Lloyd George,NA
2000-06-19,DJ,ALSO AT THE 2000 GRAMMYS,,1000,"Richard Burton won a Grammy in 1976; this man, no relation, won in 2000 for reading the words of Martin Luther King",LeVar Burton,NA
2000-06-19,DJ,POPES NAMED LEO,,1000,Term for the buying of religious offices; Leo IX was the pope who put a stop to it,Simony,NA
2000-06-19,DJ,WEIRD WEIGHTS & MEASURES,,NA,"Last name of the child star of ""Terminator 2""; he'll go the whole 220 yards for you",(Edward) Furlong,NA
2000-06-19,DJ,"""EX"" WORDS",,1000,"In 1978 this group topped the pop charts with ""Kiss You All Over""; since then they've had 10 No. 1 country hits",Exile,NA
2000-06-19,FJ,HISTORIC PEOPLE,,NA,"Venetians called him ""Il Milione"", man of the million lies",Marco Polo,NA
