date,round,category,comment,value,clue,response,link
2000-06-21,J,JOHN QUINCY ADAMS,,100,"When John Quincy passed the bar in 1790, his father had this job",vice president,NA
2000-06-21,J,'90s MOVIES,,100,"John Malkovich was Cyrus ""The Virus"" Grissom, the leader of a group of criminals who hijack a plane in this 1997 thriller",Con Air,NA
2000-06-21,J,THE NORTHERNMOST CAPITAL CITY,(Alex: From the list we will give you.),100,"Lagos,Algiers,Mogadishu",Algiers,NA
2000-06-21,J,STUPID ANSWERS,,100,"It's the collective 2-word name for the extinct bears who lived in caves 1,000,000 years ago",cave bears,NA
2000-06-21,J,DUKES & EARLS,,100,"Charles Duke, Jr. got to go into space only once, but he did get to go here!",Moon,NA
2000-06-21,J,"ENDS IN ""WIG""",,100,It's a quantity of drink taken at one time,swig,NA
2000-06-21,J,JOHN QUINCY ADAMS,,200,"At age 63 John left the White House & began to serve in this house, where he was called ""Old Man Eloquent""",House of Representatives,NA
2000-06-21,J,'90s MOVIES,,200,This film seen here rounded up big crowds in the summer of '91:,City Slickers,NA
2000-06-21,J,THE NORTHERNMOST CAPITAL CITY,(Alex: From the list we will give you.),200,"Montevideo,Buenos Aires,Bogota",Bogota,NA
2000-06-21,J,STUPID ANSWERS,,200,"This Englishman born August 19, 1939 was the drummer in ""Ginger Baker's Air Force""",Ginger Baker,NA
2000-06-21,J,DUKES & EARLS,,200,"As Earl of this, James Brudenell had a sweater named for him",Cardigan,NA
2000-06-21,J,"ENDS IN ""WIG""",,200,"An important person, like a politician or an executive producer",big-wig,NA
2000-06-21,J,JOHN QUINCY ADAMS,,300,"John refused to attend the presidential inauguration of this man, his successor",Andrew Jackson,NA
2000-06-21,J,'90s MOVIES,,300,Rob Lowe played the leader of a conservative religious group in this 1997 sci-fi film starring Jodie Foster,Contact,NA
2000-06-21,J,THE NORTHERNMOST CAPITAL CITY,(Alex: From the list we will give you.),300,"Cairo,Damascus,Amman",Damascus,NA
2000-06-21,J,STUPID ANSWERS,,300,It's the name given the nearly 1-week-long military conflict between Israel & several Arab neighbors in 1967,Six-Day War,NA
2000-06-21,J,DUKES & EARLS,,300,"""As I walk through this world, nothing can stop this"" 1962 Gene Chandler No. 1 hit","""Duke of Earl""",NA
2000-06-21,J,"ENDS IN ""WIG""",,300,"A small piece of a tree; as a verb it means ""to understand""",twig,NA
2000-06-21,J,JOHN QUINCY ADAMS,,400,"Little John & his mom were witnesses to this June 17, 1775 battle",Bunker Hill,NA
2000-06-21,J,'90s MOVIES,,400,"Clint Eastwood's dialogue in this 1995 romance meant it was ""time to harvest the corn"", according to People magazine",The Bridges of Madison County,NA
2000-06-21,J,THE NORTHERNMOST CAPITAL CITY,(Alex: From the list we will give you.),400,"Managua,San Salvador,Guatemala City",Guatemala City,NA
2000-06-21,J,STUPID ANSWERS,,400,"3-letter word that begins the titles of all 3 Best Picture winners of 1930, 1949 & 1950",All,NA
2000-06-21,J,DUKES & EARLS,,400,It's a bergamot-flavored brew,Earl Grey tea,NA
2000-06-21,J,"ENDS IN ""WIG""",,400,"First name of von Drake, Donald Duck's uncle from the European side of the family",Ludwig,NA
2000-06-21,J,JOHN QUINCY ADAMS,,500,"In 1811 Madison appointed him to this body; the Senate approved it, but John turned it down",Supreme Court,NA
2000-06-21,J,'90s MOVIES,,500,Whitney Houston played the spouse of a New York pastor in this 1996 film,The Preacher\'s Wife,NA
2000-06-21,J,THE NORTHERNMOST CAPITAL CITY,(Alex: From the list we will give you.),NA,"Oslo,Helsinki,Stockholm",Helsinki,NA
2000-06-21,J,STUPID ANSWERS,,500,"This great Hindu hero's story is told in the ""Ramayana""",Rama,NA
2000-06-21,J,DUKES & EARLS,,500,In the 1940s this man whose first name was Earl invented the type of container seen here:,Tupper,NA
2000-06-21,J,"ENDS IN ""WIG""",,500,Eek!  Kill it!  Kill it!...it's the insect seen here:,earwig,NA
2000-06-21,DJ,THE 20th CENTURY,,200,"On April 18, 1960 this Democratic presidential candidate said, ""I don't think that my religion is anyone's business""",John F. Kennedy,NA
2000-06-21,DJ,THAT WAS ENTERTAINMENT!,,200,"Clown Dan Rice, who sported the beard of this national symbol, was so popular he ran for president in 1868",Uncle Sam,NA
2000-06-21,DJ,MUSEUMS,,200,"In 2000 Jackson, Tennessee's Railroad Museum celebrates the centennial of this engineer's heroic deed",Casey Jones,NA
2000-06-21,DJ,BASEBALL LIT,,200,"David Halberstam looks back on a great World Series in the book titled this month, ""1964""",October,NA
2000-06-21,DJ,CABINET MINISTERS,,200,"In 1986 this country saw its first cabinet minister dismissed in 33 years, education head Masayuki Fujio",Japan,NA
2000-06-21,DJ,RHYME TIME,,200,A faux filet mignon,fake steak,NA
2000-06-21,DJ,THE 20th CENTURY,,400,The 1901 oil discovery at Spindletop near Beaumont launched the oil industry in this state,Texas,NA
2000-06-21,DJ,THAT WAS ENTERTAINMENT!,,400,Silent film star portrayed in the 1951 film seen here:,Rudolph Valentino,NA
2000-06-21,DJ,MUSEUMS,,400,"From the Greek for ""through"" & ""view"", it's the type of museum display seen here:",a diorama,http://www.j-archive.com/media/2000-06-21_DJ_30.jpg
2000-06-21,DJ,BASEBALL LIT,,400,"""The Bingo Long Traveling All-Stars and Motor Kings"" is set in the segregated leagues called these",Negro Leagues,NA
2000-06-21,DJ,CABINET MINISTERS,,400,"This island nation's minister of culture & education, Bjorn Bjarnason, is the son of a former prime minister",Iceland,NA
2000-06-21,DJ,RHYME TIME,,400,An amphibian avenue,toad road,NA
2000-06-21,DJ,THE 20th CENTURY,,600,"On May 11, 1950 President Truman traveled to Washington state to dedicate this dam northwest of Spokane",Grand Coulee Dam,NA
2000-06-21,DJ,THAT WAS ENTERTAINMENT!,,600,"In 1922 this trumpeter joined the Creole Jazz Band led by King Oliver, who became his mentor",Louis Armstrong,NA
2000-06-21,DJ,MUSEUMS,,600,Prince Edward Island's museum of these displays Canada's own Shepody variety as well as the russet Burbank,potatoes,NA
2000-06-21,DJ,BASEBALL LIT,,NA,"Douglass Wallop's ""The Year the Yankees Lost the Pennant"" was the basis for this musical","""Damn Yankees""",NA
2000-06-21,DJ,CABINET MINISTERS,,600,From 1956 to 1966 she was Israel's minister of foreign affairs,Golda Meir,NA
2000-06-21,DJ,RHYME TIME,,600,A small bird from New Zealand,peewee kiwi,NA
2000-06-21,DJ,THE 20th CENTURY,,800,This WWII portable military shelter was first built at the Rhode Island naval air station for which it was named,quonset hut,NA
2000-06-21,DJ,THAT WAS ENTERTAINMENT!,,800,"For 5 years Tony Charmoli's dancers brought their charm to her televised ""Chevy Show""",Dinah Shore,NA
2000-06-21,DJ,MUSEUMS,,800,"This famed American architect designed Bilbao, Spain's new Guggenheim, seen here:",Frank Gehry,NA
2000-06-21,DJ,BASEBALL LIT,,800,Roger Angell's classic baseball articles include a profile of this Hall of Fame Cardinals pitcher of the '60s,Bob Gibson,NA
2000-06-21,DJ,CABINET MINISTERS,,800,This former minister of agriculture & rural development became president of France in 1995,Jacques Chirac,NA
2000-06-21,DJ,RHYME TIME,,800,An oarsman who's not as quick as the rest,slower rower,NA
2000-06-21,DJ,THE 20th CENTURY,,1000,"In 1989 this space probe flew by Neptune, discovering geyser-like eruptions on its moon Triton",Voyager,NA
2000-06-21,DJ,THAT WAS ENTERTAINMENT!,,1000,"Long before Chuck Barris, radio's Major Bowes gonged out performers on this ""hour""",Original Amateur Hour,NA
2000-06-21,DJ,MUSEUMS,,1000,"Assembled from European religious structures, it's the medieval art branch of the Museum of Modern Art",The Cloisters,NA
2000-06-21,DJ,BASEBALL LIT,,1000,"In 1999 Stephen King published ""The Girl Who Loved"" this Red Sox relief pitcher",Tom Gordon,NA
2000-06-21,DJ,CABINET MINISTERS,,NA,In 1967 this minister of justice began his campaign to become prime minister of Canada,Pierre Elliott Trudeau,NA
2000-06-21,DJ,RHYME TIME,,1000,A less vibrant hue,duller color,NA
2000-06-21,FJ,SCIENCE WORD ORIGINS,(Alex: Was this a scary category or what?),NA,"Coined by the chemist J.B. van Helmont, the word gas comes from this Greek word meaning ""unformed mass""",chaos,NA
