date,round,category,comment,value,clue,response,link
1998-03-12,J,SUPERSTITIONS,,100,"Do this on a Monday, you do it ""for danger""; bless you",sneeze,NA
1998-03-12,J,BUDDY THE BEEKEEPER,,100,Buddy mixes equal parts of this & hot water to feed a new colony with no honey to eat,sugar,NA
1998-03-12,J,THE 1970s,,100,"From Calvin Klein & others this piece of denim apparel became ""designer"", i.e. tight & expensive",blue jeans,NA
1998-03-12,J,HANNA-BARBERA CATS,,100,Hanna-Barbera's first network show featured this cat with the dog Reddy,Ruff,NA
1998-03-12,J,BATTLE CRIES,,100,"Despite Captain Lawrence's final orders, it's what the crew of the Chesapeake did on June 1, 1813",give up the ship,NA
1998-03-12,J,BODY LANGUAGE,,100,"A person who acts rashly & harms himself is said to ""cut off"" this ""to spite his face""",his nose,NA
1998-03-12,J,SUPERSTITIONS,,200,"An 1831 book said as you pass under one of these you must spit through it, or spit 3 times afterwards",a ladder,NA
1998-03-12,J,BUDDY THE BEEKEEPER,,200,"Buddy doesn't like being asked ""Who's the lucky fella?"" when he wears this between his hat & collar",a beekeeper\'s veil,NA
1998-03-12,J,THE 1970s,,200,"Danny Zuko & Sandy Dumbrowski end up together in this musical that opened Valentine's Day, 1972",Grease,NA
1998-03-12,J,HANNA-BARBERA CATS,,200,"Close friends get to call him ""T.C.""",Top Cat,NA
1998-03-12,J,BATTLE CRIES,,200,American paratroopers were the first to use this man's name as a battle cry,Geronimo,NA
1998-03-12,J,BODY LANGUAGE,,200,It's the type of predictable automatic action some liberals are accused of having,knee jerk,NA
1998-03-12,J,SUPERSTITIONS,,300,These grotesque stone figures acted as drain spouts as well as sentinels to frighten away evil spirits,gargoyles,NA
1998-03-12,J,BUDDY THE BEEKEEPER,,300,"Buddy makes people mad when he blows this in elevators, but he blows it at bees to calm them down",smoke,NA
1998-03-12,J,THE 1970s,,300,A toy skycycle named for this daredevil was introduced before his 1974 Snake River Canyon jump,Evel Knievel,NA
1998-03-12,J,HANNA-BARBERA CATS,,300,"""Yogi Bear Show"" lion who might ""exit stage left""",Snagglepuss,NA
1998-03-12,J,BATTLE CRIES,,300,This warning appeared on a revolutionary-era flag with an ill-tempered rattlesnake,"""Dont Tread On Me""",NA
1998-03-12,J,BODY LANGUAGE,,300,"This word may refer to part of your foot, the end of a loaf of bread, or a despicable cad",heel,NA
1998-03-12,J,SUPERSTITIONS,,400,"If you lose an eyelash, put it on your finger, do this, then blow it away",make a wish,NA
1998-03-12,J,BUDDY THE BEEKEEPER,,400,"Buddy might say ""None of your business"" if asked about harvesting this product used in candles & polishes",beeswax,NA
1998-03-12,J,THE 1970s,,NA,In 1972 Mujibur Rahman became the first PM of this new Asian nation for which a concert was held in 1971,Bangladesh,NA
1998-03-12,J,HANNA-BARBERA CATS,,400,"These were the 2 ""Meeces"" Mr. Jinks hated to pieces",Pixie & Dixie,NA
1998-03-12,J,BATTLE CRIES,,400,Title of the song here:,The Battle Cry Of Freedom,NA
1998-03-12,J,BODY LANGUAGE,,400,"This term for strenuous extra effort sounds like it means ""arm joint lubricant""",elbow grease,NA
1998-03-12,J,SUPERSTITIONS,,500,"The Carpenters sang about one of these ""for luck and we're on our way""",a kiss,NA
1998-03-12,J,BUDDY THE BEEKEEPER,,500,In spring Buddy gets ready for these masses of bees to fly from their hives & form new colonies,swarms,NA
1998-03-12,J,THE 1970s,,500,A deadly disease was identified after an outbreak at this group's 1976 convention in Philadelphia,the American Legion,NA
1998-03-12,J,HANNA-BARBERA CATS,,500,Her back-up group was The Pussycats,Josie,NA
1998-03-12,J,BATTLE CRIES,,500,"It's said this slogan came from a cartoon that appeared in the Washington Post on April 3, 1898","""Remember the Maine""",NA
1998-03-12,J,BODY LANGUAGE,,500,"When you inadvertently give someone else the advantage, you ""play into"" these",their hands,NA
1998-03-12,DJ,1980s LIT,,200,"""From Bauhaus to Our House"" is Tom Wolfe's derisive attack on the modernist movement in this field",architecture,NA
1998-03-12,DJ,WHAT CITY ARE WE IN?,,200,"Regent's Park,St. James's Park,Hyde Park",London,NA
1998-03-12,DJ,1930s TV,,200,This Cincinnati-based soap company has been advertising on TV since 1939,Procter & Gamble,NA
1998-03-12,DJ,WISDOM OF THE AGES,,200,"An Aesop moral says ""familiarity breeds"" this",contempt,NA
1998-03-12,DJ,EVERYBODY TALKS ABOUT IT...,,200,It's the only U.S. state whose recorded temperature has never dropped below 0 degrees Fahrenheit,Hawaii,NA
1998-03-12,DJ,PSYCHOBABBLE,,200,"According to a popular saying, this defense mechanism ""ain't just a river in Egypt""",denial,NA
1998-03-12,DJ,1980s LIT,,400,"The stories of Raymond Carver typified this style whose name indicates it does the most with the ""least""",minimalist,NA
1998-03-12,DJ,WHAT CITY ARE WE IN?,,400,"The Hofborg,Freud's Apartment,St. Stephen's Cathedral",Vienna,NA
1998-03-12,DJ,1930s TV,,400,In September 1939 NBC had its transmitter on this building; CBS had its on the Chrysler Building later,the Empire State Building,NA
1998-03-12,DJ,WISDOM OF THE AGES,,400,"A Lao-Tzu line is traditionally quoted as ""a journey of 1,000 miles must begin with"" this",a single step,NA
1998-03-12,DJ,EVERYBODY TALKS ABOUT IT...,,400,In 1849 Joseph Henry of the Smithsonian received the first weather report via this new invention,the telegraph,NA
1998-03-12,DJ,PSYCHOBABBLE,,400,Researcher Elizabeth Loftus has found that she can invent these & have subjects take them as their own,memories,NA
1998-03-12,DJ,1980s LIT,,600,"He wrote the 1987 novel ""Alnilam"" over a period of 30 years, publishing ""Deliverance"" in the meantime",James Dickey,NA
1998-03-12,DJ,WHAT CITY ARE WE IN?,,600,"The Mauritshuis,The International Institute for Social Studies,The International Court of Justice",The Hague,NA
1998-03-12,DJ,1930s TV,,600,"TV covered this PM's arrival from Munich September 30, 1938 live; the ""Peace For Our Time"" speech came later",Neville Chamberlain,NA
1998-03-12,DJ,WISDOM OF THE AGES,,NA,"Pindar knew these ""have a longer life than deeds""",words,NA
1998-03-12,DJ,EVERYBODY TALKS ABOUT IT...,,600,"Talk about dry!  In 1971, after 400 years, parts of this Chilean desert finally got some rain",the Atacama Desert,NA
1998-03-12,DJ,PSYCHOBABBLE,,600,"""Getting over it"" is a nontechnical equivalent of this late stage of grieving",acceptance (or closure),NA
1998-03-12,DJ,1980s LIT,,800,"Type of machine referred to in the title of Tracy Kidder's nonfiction work ""The Soul of a New Machine""",a computer,NA
1998-03-12,DJ,WHAT CITY ARE WE IN?,,800,"Lake Gardens,The Rubber Research Institute,The National Museum of Malaysia",Kuala Lumpur,NA
1998-03-12,DJ,1930s TV,,800,This Dodger manager was interviewed by Red Barber before an August 1939 game telecast,Leo Durocher,NA
1998-03-12,DJ,WISDOM OF THE AGES,,800,"A fragment from Euripides has the line ""Those whom God wishes to destroy, he"" first does this",makes mad,NA
1998-03-12,DJ,EVERYBODY TALKS ABOUT IT...,,800,"U.S. bomber pilots in World War II discovered this ""river"" flowing through the upper troposphere",the jet stream,NA
1998-03-12,DJ,PSYCHOBABBLE,,800,"If your family resists change, keeps secrets & ignores conflict, it may qualify for this adjective",dysfunctional,NA
1998-03-12,DJ,1980s LIT,,1000,Stevens works as a butler of Darlington Hall in this 1989 novel by Kazuo Ishiguro,The Remains of the Day,NA
1998-03-12,DJ,WHAT CITY ARE WE IN?,,1000,"Place Ville-Marie,Place Jacques Cartier,Beaver Lake",Montreal,NA
1998-03-12,DJ,1930s TV,,1000,Joseph Goebbels had his hands in the telecast of this August 1936 event,the Summer Olympics (from Berlin),NA
1998-03-12,DJ,WISDOM OF THE AGES,,1000,"Heraclitus said ""All is flux, nothing stays still"" & ""nothing endures but"" this",Change,NA
1998-03-12,DJ,EVERYBODY TALKS ABOUT IT...,,NA,Meaning of the meteorological symbol seen here:,partly cloudy,http://www.j-archive.com/media/1998-03-12_DJ_30.jpg
1998-03-12,DJ,PSYCHOBABBLE,,1000,"""No more"" says author Melody Beattie of this state of being affected & trying to control another's acts",co-dependency,NA
1998-03-12,FJ,MEDIEVAL DRAMA,,NA,"The name of this title character of a morality play has become a synonym for the average, ordinary person",Everyman,NA
