date,round,category,comment,value,clue,response,link
2007-10-16,J,THE HILLS,,200,In 2006 Coldwell Banker said the average home sale price in this town next to West Hollywood was $1.8 million,Beverly Hills,NA
2007-10-16,J,NOT NOMINATED FOR BEST PICTURE,,200,"Bogie & Hepburn floated across the screen in this 1951 film that pleased audiences & critics, but not the Academy",The African Queen,NA
2007-10-16,J,"FISH, BIRD OR MAMMAL",,200,The skate,a fish,NA
2007-10-16,J,"""KIN"" FOLK",,200,In 1948 Irv Robbins & this brother-in-law began franchising their small chain of ice cream stores,(Burt) Baskin,NA
2007-10-16,J,HODGEPODGE,,200,"This rap ""clan"" featuring Method Man & RZA took its name from a mythical martial arts sword",The Wu-Tang Clan,NA
2007-10-16,J,SPEL-EMENTS,(Alex: We will give you two elements in our clue.  You have to come up with the symbols for those elements and combine those symbols to create a new word.),200,"Helium,aluminum",heal (He-Al),NA
2007-10-16,J,THE HILLS,,400,"On June 17, 1775, after Breed's Hill was fortified, reserve Patriot troops occupied this hill",Bunker Hill,NA
2007-10-16,J,NOT NOMINATED FOR BEST PICTURE,,400,"You couldn't drag a Best Picture nomination out of the Academy for this 1959 Billy Wilder film; well, nobody's perfect",Some Like It Hot,NA
2007-10-16,J,"FISH, BIRD OR MAMMAL",,400,The tarsier,a mammal,NA
2007-10-16,J,"""KIN"" FOLK",,400,He began formulating his low-carb approach to dieting after reading an article in a 1963 issue of JAMA,(Robert) Atkins,NA
2007-10-16,J,HODGEPODGE,,400,Number of the latest U.S. Constitutional amendment to take effect,27,NA
2007-10-16,J,SPEL-EMENTS,(Alex: We will give you two elements in our clue.  You have to come up with the symbols for those elements and combine those symbols to create a new word.),400,"Neon,argon",near (Ne-Ar),NA
2007-10-16,J,THE HILLS,,600,The Esquiline & the Viminal are 2 of the 7 hills on which this ancient city was built,Rome,NA
2007-10-16,J,NOT NOMINATED FOR BEST PICTURE,,600,The Academy must have been out to lunch not nominating this 1961 Audrey Hepburn film,Breakfast at Tiffany\'s,NA
2007-10-16,J,"FISH, BIRD OR MAMMAL",,600,The honeycreeper,a bird,NA
2007-10-16,J,"""KIN"" FOLK",,600,"This ""Eugene Onegin"" author was charged with writing subversive poetry in 1820 & lost his job in St. Petersburg",Pushkin,NA
2007-10-16,J,HODGEPODGE,,600,2-word name for the body of water these D.C. skaters are having fun on back in the day,the Reflecting Pool,http://www.j-archive.com/media/2007-10-16_J_13.jpg
2007-10-16,J,SPEL-EMENTS,(Alex: We will give you two elements in our clue.  You have to come up with the symbols for those elements and combine those symbols to create a new word.),600,"Copper,boron",cub (Cu-B),NA
2007-10-16,J,THE HILLS,,800,High peaks in this range of low mountains in South Dakota & Wyoming include Parker Peak & Custer Peak,the Black Hills,NA
2007-10-16,J,NOT NOMINATED FOR BEST PICTURE,,800,In 1954 this Jimmy Stewart & Grace Kelly starrer from Alfred Hitchcock didn't get a second glance,Rear Window,NA
2007-10-16,J,"FISH, BIRD OR MAMMAL",,800,The bongo,a mammal,NA
2007-10-16,J,"""KIN"" FOLK",,800,In 1832 an English physician first described this disease of lymph tissue that now bears his name,Hodgkin\'s (disease),NA
2007-10-16,J,HODGEPODGE,,800,"(Jon of the Clue Crew zaps some styrofoam peanuts with liquid from a test tube in the Jeopardy! science lab.) You might think styrofoam peanuts are hard to get rid of, but they can be dissolved using this solvent, the same one found in nail polish remover",acetone,http://www.j-archive.com/media/2007-10-16_J_14a.jpg
2007-10-16,J,SPEL-EMENTS,(Alex: We will give you two elements in our clue.  You have to come up with the symbols for those elements and combine those symbols to create a new word.),NA,"Calcium,iron",cafe (Ca-Fe),NA
2007-10-16,J,THE HILLS,,1000,"At the foot of the Mendip Hills, you'll find this cheese-y 7-letter English town",Cheddar,NA
2007-10-16,J,NOT NOMINATED FOR BEST PICTURE,,1000,"""Driving Miss Daisy"" won for 1989, the year this Spike Lee film about urban racism was passed over",Do the Right Thing,NA
2007-10-16,J,"FISH, BIRD OR MAMMAL",,1000,The cichlid,a fish,NA
2007-10-16,J,"""KIN"" FOLK",,1000,In 1941 she was the only member of the House of Rep. to vote against the Declaration of War against Japan,Jeannette Rankin,NA
2007-10-16,J,HODGEPODGE,,1000,"Less secure than an heir apparent, one who's in line for a throne but could still be superseded is the ""heir"" this",presumptive,NA
2007-10-16,J,SPEL-EMENTS,(Alex: We will give you two elements in our clue.  You have to come up with the symbols for those elements and combine those symbols to create a new word.),1000,"Hydrogen,silver",hag (H-Ag),NA
2007-10-16,DJ,THE 1930s,,400,"W.H. Auden wrote of this civil war-torn country, ""History to the defeated may say alas but cannot help nor pardon""",Spain,NA
2007-10-16,DJ,ENTERTAINMENT HISTORY,,400,"Born William Claude Dukenfield, he's supposed to have said, ""Anyone who hates children and dogs can't be all bad""",W.C. Fields,NA
2007-10-16,DJ,WEEKEND AT BERNIE'S,,400,"This writer, ""GBS"", died on Nov. 2, 1950",George Bernard Shaw,NA
2007-10-16,DJ,COLLEGES & UNIVERSITIES,,400,The Trustees of the College of California bought 160 acres of land north of Oakland & named the site this in 1866,Berkeley,NA
2007-10-16,DJ,NAME THE PLAYWRIGHT,,400,"""Speed-the-Plow"",""Glengarry Glen Ross""",David Mamet,NA
2007-10-16,DJ,"THE ""IX"" IS IN",,400,"From an 1859 song, it's a nickname for the Old South","""Dixie""",NA
2007-10-16,DJ,THE 1930s,,800,"As the depression hit Europe, this figure in Belgium went from 5.4% in 1930 to 23.5% in 1932",unemployment,NA
2007-10-16,DJ,ENTERTAINMENT HISTORY,,800,Dance style of brothers & Kennedy Center honorees Fayard & Harold Nicholas,tap,NA
2007-10-16,DJ,WEEKEND AT BERNIE'S,,800,"This novelist, a pure ""Natural"", died in NYC on March 18, 1986",Bernard Malamud,NA
2007-10-16,DJ,COLLEGES & UNIVERSITIES,,800,"This Tulsa college was founded by & named for an evangelist, now the school's chancellor",Oral Roberts,NA
2007-10-16,DJ,NAME THE PLAYWRIGHT,,800,"""An American Daughter"",""The Heidi Chronicles""",Wendy Wasserstein,NA
2007-10-16,DJ,"THE ""IX"" IS IN",,800,A cross with the figure of Jesus upon it,a crucifix,NA
2007-10-16,DJ,THE 1930s,,NA,Melvin Purvis gained fame (more than Hoover liked) as head of the FBI's office in this city,Chicago,http://www.j-archive.com/media/2007-10-16_DJ_18.jpg
2007-10-16,DJ,ENTERTAINMENT HISTORY,,1200,"In Vaudeville, Jerry, Helen, Josephine & George M. were ""The Four"" these",Cohans,NA
2007-10-16,DJ,WEEKEND AT BERNIE'S,,1200,"This WWII British commander who led the 21st Army Group at Normandy passed away on March 24, 1976",Montgomery,NA
2007-10-16,DJ,COLLEGES & UNIVERSITIES,,1200,The logo of this one-time Methodist college is seen here,Duke University,http://www.j-archive.com/media/2007-10-16_DJ_08.jpg
2007-10-16,DJ,NAME THE PLAYWRIGHT,,1200,"""Lettice and Lovage"",""Amadeus""",Peter Shaffer,NA
2007-10-16,DJ,"THE ""IX"" IS IN",,1200,"An alchemical liquid ""of life"" believed to be capable of prolonging it",an elixir,NA
2007-10-16,DJ,THE 1930s,,1600,The Baltic States' fate was decided by a secret protocol to the August 1939 non-aggression pact of these 2 nations,Germany & the Soviet Union,NA
2007-10-16,DJ,ENTERTAINMENT HISTORY,,1600,"(Hi, I'm Harry Shearer.)  Rochester!  Did you know that in 1953 I played this comic as a boy on his self-titled TV ""Program""?",Jack Benny,http://www.j-archive.com/media/2007-10-16_DJ_14.jpg
2007-10-16,DJ,WEEKEND AT BERNIE'S,,1600,"On Dec. 24, 1975 Bernard Herrmann died shortly after scoring this 1976 De Niro & Foster classic; it's dedicated to him",Taxi Driver,NA
2007-10-16,DJ,COLLEGES & UNIVERSITIES,,NA,"An anthem says, ""With each pealing bell... hail, all hail"" this New York university (it rhymes)",Cornell,NA
2007-10-16,DJ,NAME THE PLAYWRIGHT,,1600,"""A Moon for the Misbegotten"",""The Iceman Cometh""",Eugene O\'Neill,NA
2007-10-16,DJ,"THE ""IX"" IS IN",,1600,"Adjective meaning extravagantly impractical, like something done by the Man of La Mancha",quixotic,NA
2007-10-16,DJ,THE 1930s,,2000,"1 of the 2 men, a Southern pol & a soldier, whom FDR said were the 2 most dangerous in the country",Huey Long (or Douglas MacArthur),NA
2007-10-16,DJ,ENTERTAINMENT HISTORY,,2000,Cathy Lewis was this title character paired with Fibber McGee on a '50s TV show based on a hit radio show,Molly,NA
2007-10-16,DJ,WEEKEND AT BERNIE'S,,2000,"After he helped liberate Chile, he got liberated from life on Oct. 24, 1842",Bernardo O\'Higgins,NA
2007-10-16,DJ,COLLEGES & UNIVERSITIES,,2000,Lord Jeffs is the nickname of the athletic teams of this Massachusetts college,Amherst,NA
2007-10-16,DJ,NAME THE PLAYWRIGHT,,2000,"""Curse of the Starving Class"",""True West""",Sam Shepard,NA
2007-10-16,DJ,"THE ""IX"" IS IN",,2000,An array of numbers or other mathematical functions multiplied according to certain rules,a matrix,NA
2007-10-16,FJ,ECONOMICS,,NA,In 2007 this 18th century professor & writer became the first Scotsman to appear on an English banknote,Adam Smith,NA
