date,round,category,comment,value,clue,response,link
2000-02-10,J,ASIAN HISTORY,,100,This country's Saud dynasty dates back to the mid-1400s,Saudi Arabia,NA
2000-02-10,J,SIGNS & SYMBOLS,,100,Term for the type of moon used as a symbol by the Ottoman Turks,Crescent,NA
2000-02-10,J,IT'S WHAT WE DO,,100,"Paper giant Weyerhaeuser can beat you to this, producing 2.5 million tons a year at 9 mills",A pulp,NA
2000-02-10,J,BROADWAY,,100,19-year-old Laura Benanti played Maria to Richard Chamberlain's Capt. Von Trapp in the recent revival of this musical,"""The Sound of Music""",NA
2000-02-10,J,COUNTRIES BY COLLEGE,(Alex: We'll give you the colleges.),100,"Max Planck Institute for Computer Science,Braunschweig Tech,The University of Augsburg",Germany,NA
2000-02-10,J,BASEBALL WORDS,,100,Spiders catch them in their webs,Flies,NA
2000-02-10,J,ASIAN HISTORY,,200,"In 1934 he & his followers began a 6,000-mile march from Jiangxi province to the village of Yan'an in northern China",Mao Tse-tung,NA
2000-02-10,J,SIGNS & SYMBOLS,,200,The cross seen here is used as a symbol in the battle against this disease abbreviated TB:,Tuberculosis,NA
2000-02-10,J,IT'S WHAT WE DO,,200,"Salespeople at this athletic shoe retailer are known as ""stripers"" & dress accordingly",The Foot Locker,NA
2000-02-10,J,BROADWAY,,200,"Set in part in a Brooklyn disco, this musical is based on a film that your mom probably swooned over in 1977","""Saturday Night Fever""",NA
2000-02-10,J,COUNTRIES BY COLLEGE,(Alex: We'll give you the colleges.),200,"St. Petersburg State,Rostov State,Novosibirsk State",Russia,NA
2000-02-10,J,BASEBALL WORDS,,200,What a catcher might eat his dinner on,Home plate,NA
2000-02-10,J,ASIAN HISTORY,,300,"In 1992 rebels overthrew its government; one faction, the Taliban, now controls most of the country",Afghanistan,NA
2000-02-10,J,SIGNS & SYMBOLS,,300,There are this many rings in the symbol of the Olympics,5,NA
2000-02-10,J,IT'S WHAT WE DO,,300,"A leading Italian restaurant chain, it's increasing its expertise by opening the Culinary Institute of Tuscany",The Olive Garden,NA
2000-02-10,J,BROADWAY,,300,Susan Lucci spent her 1999 Christmas vacation making her Broadway debut as Annie Oakley in this musical,"""Annie Get Your Gun""",NA
2000-02-10,J,COUNTRIES BY COLLEGE,(Alex: We'll give you the colleges.),300,"Menoufia University,Zagazig University,Alexandria University",Egypt,NA
2000-02-10,J,BASEBALL WORDS,,300,A highly prized form of carbon,Diamond,NA
2000-02-10,J,ASIAN HISTORY,,400,"This country was officially reunified July 2, 1976, 2 days before the U.S. Bicentennial",Vietnam,NA
2000-02-10,J,SIGNS & SYMBOLS,,400,"All we are saying is, it began as an anti-nuclear emblem at a 1958 British demonstration",Peace sign,NA
2000-02-10,J,IT'S WHAT WE DO,,400,"Going back to 1906, this all-""American"" company predates its rival, Hallmark",American Greetings,NA
2000-02-10,J,BROADWAY,,400,Andrea McArdle's daughter Alexis made her Broadway debut in 1996 as young Cosette in this musical,"""Les Miserables""",NA
2000-02-10,J,COUNTRIES BY COLLEGE,(Alex: We'll give you the colleges.),400,"McGill University,University College of the Cariboo,Alberta College of Art & Design",Canada,NA
2000-02-10,J,BASEBALL WORDS,,400,People who used peroxide on their hair,Bleachers,NA
2000-02-10,J,ASIAN HISTORY,,500,"In 1192 Japan's emperor gave military leader Yoritomo this title which means ""great general""",Shogun,NA
2000-02-10,J,SIGNS & SYMBOLS,,NA,"The original form of the ampersand comes from a combination of these 2 letters in the Latin for ""and""",Et,NA
2000-02-10,J,IT'S WHAT WE DO,,500,"Dynegy, whose name comes from ""dynamic energy"", operates 17,000 miles of these to move oil & gas",Pipelines,NA
2000-02-10,J,BROADWAY,,500,"Christopher Walken starred in ""The Dead"", a musical adaptation of a story in this Irishman's 1914 book ""Dubliners""",James Joyce,NA
2000-02-10,J,COUNTRIES BY COLLEGE,(Alex: We'll give you the colleges.),500,"Potchefstroom University,Technikon Natal,Rand Afrikaans University",South Africa,NA
2000-02-10,J,BASEBALL WORDS,,500,"It's material from which flags are made, or decorations in the colors of a flag",Bunting,NA
2000-02-10,DJ,ANIMAL ANCESTORS,,200,Animals of this class that includes frogs & salamanders were the ancestors of reptiles,Amphibians,NA
2000-02-10,DJ,THE CINEMA OF JOHNNY DEPP,,200,"In ""Sleepy Hollow"", Depp played this crime-solving constable; the character was a teacher in the original story",Ichabod Crane,NA
2000-02-10,DJ,WHAT THE ELEMENT,,200,"Old dimes, teapots & the Lone Ranger's bullets (which could have killed werewolves) are made of this metal",Silver,NA
2000-02-10,DJ,ISMs,,200,Copying your term paper directly out of an encyclopedia,plagiarism,NA
2000-02-10,DJ,MARK TWAIN,,200,Mark Twain was a pen name; this was his real name,Samuel Langhorne Clemens,NA
2000-02-10,DJ,LIFE ON THE MISSISSIPPI,,200,"The Mississippi flows about 2,340 miles & empties into this body of water",Gulf of Mexico,NA
2000-02-10,DJ,ANIMAL ANCESTORS,,400,"The multiple-toed feet of Eohippus, this domestic animal's ancestor, evolved into 1 toe covered by a hoof",Horse,NA
2000-02-10,DJ,THE CINEMA OF JOHNNY DEPP,,400,This Depp title character was created by a mad scientist played by Vincent Price,Edward Scissorhands,NA
2000-02-10,DJ,WHAT THE ELEMENT,,400,"Thallium is said to look like this element, so get the thallium out & give us your question",Lead,NA
2000-02-10,DJ,ISMs,,400,"One of these can be ""of fire"" or by immersion in water during a religious rite",Baptism,NA
2000-02-10,DJ,MARK TWAIN,,400,"Twain wrote that in ""The Deerslayer"", this author ""scored 114 offenses against literary art out of a possible 115""",James Fenimore Cooper,NA
2000-02-10,DJ,LIFE ON THE MISSISSIPPI,,400,The clear waters of the upper river are home to this member of the salmon family that spawns upriver,Trout,NA
2000-02-10,DJ,ANIMAL ANCESTORS,,NA,"Ursavus elmensis, the ""down"" version of this carnivore, was small enough to hunt in treetops",Bear,NA
2000-02-10,DJ,THE CINEMA OF JOHNNY DEPP,,600,"""What's Eating"" this character is probably having to live in a small town with his very dysfunctional family",Gilbert Grape,NA
2000-02-10,DJ,WHAT THE ELEMENT,,600,"Alphabetically, the noble gases run from Ar, argon to Xe, this",Xenon,NA
2000-02-10,DJ,ISMs,,600,Ye gods!  It's defined as the belief in more than one god,Polytheism,NA
2000-02-10,DJ,MARK TWAIN,,NA,This 1889 novel contrasts American homespun ingenuity with the Dark Ages' superstition & ineptitude,"""A Connecticut Yankee in King Arthur\'s Court""",NA
2000-02-10,DJ,LIFE ON THE MISSISSIPPI,,600,The muddy waters of the lower Mississippi are home to bullhead & other types of these barbeled bottom feeders,Catfish,NA
2000-02-10,DJ,ANIMAL ANCESTORS,,800,"Moeritherium, with an elongated snout & front teeth, was the ancestor of this present-day animal",Elephant,NA
2000-02-10,DJ,THE CINEMA OF JOHNNY DEPP,,800,"In a 1995 film co-starring Marlon Brando, Depp believes he is this legendary lover",Don Juan,NA
2000-02-10,DJ,WHAT THE ELEMENT,,800,The element with this atomic number was created by bombarding bismuth (83) with nickel (28),111,NA
2000-02-10,DJ,ISMs,,800,Manorialism was the economic basis of this system of political & military obligation in the Middle Ages,Feudalism,NA
2000-02-10,DJ,MARK TWAIN,,800,In the 1850s Twain was an apprentice one of these under Horace Bixby; he became a licensed one in 1859,Riverboat pilot,NA
2000-02-10,DJ,LIFE ON THE MISSISSIPPI,,800,"He first sighted the Mississippi in May 1541; fittingly, his men buried him in the river after he died May 21, 1542",Hernando de Soto,NA
2000-02-10,DJ,ANIMAL ANCESTORS,,1000,"Arthropods, including shrimps & spiders, are descended from aquatic segmented ones of these",Worms,NA
2000-02-10,DJ,THE CINEMA OF JOHNNY DEPP,,1000,"Cross-dressing, angora-sweater-wearing director portrayed by Depp in a 1994 film",Ed Wood,NA
2000-02-10,DJ,WHAT THE ELEMENT,,1000,"Lawrencium, named for Ernest Lawrence, was discovered in one of these -- the linear type, not a cyclotron",Particle accelerator,NA
2000-02-10,DJ,ISMs,,1000,"From a word meaning ""dot"", it's the style exemplified by the painting seen here:",Pointillism,NA
2000-02-10,DJ,MARK TWAIN,,1000,"Twain said, ""There is no distinctly Native American criminal class except"" this body",Congress,NA
2000-02-10,DJ,LIFE ON THE MISSISSIPPI,,1000,The mighty Mississippi River begins as a stream out of this lake in northwestern Minnesota,Lake Itasca,NA
2000-02-10,FJ,FICTIONAL CHARACTERS,,NA,"Title hero whose boarding school's motto is ""Draco Dormiens Nunquam Titillandus"", ""Never Tickle A Sleeping Dragon""",Harry Potter,NA
