date,round,category,comment,value,clue,response,link
2000-02-14,J,FICTION,,100,"Kaye Gibbons' ""Ellen Foster"" & ""A Virtuous Woman"" have found their way into this TV host's book club",Oprah Winfrey,NA
2000-02-14,J,ENTERTAINING CATS,,100,Jim Davis draws the line at this title cat,Garfield,NA
2000-02-14,J,AROUND THE WORLD,,100,"When remeasured in 1999, this highest mountain was found to have grown by 7 feet",Mount Everest,NA
2000-02-14,J,BEASTLY RHYME TIME,,100,An oversized oinker,Big pig,NA
2000-02-14,J,CANDY,,100,"Get the ""Cool Sensation"" of these mint candies made by Hershey",York Peppermint Patties,NA
2000-02-14,J,IT HAPPENED ON VALENTINE'S DAY,,100,In 1929 Al Capone's men massacred rival gangsters on St. Valentine's Day in this city,Chicago,NA
2000-02-14,J,FICTION,,200,"Isabel Allende's 1999 novel ""Daughter of Fortune"" begins in Valparaiso in this country",Chile,NA
2000-02-14,J,ENTERTAINING CATS,,200,"Distinct phraser heard here reading ""The Autobiography of Foudini M. Cat"":",David Hyde Pierce,NA
2000-02-14,J,AROUND THE WORLD,,200,"Most of this small British dependency on ths Spanish coast is dominated by a big ""rock""",Gibraltar,NA
2000-02-14,J,BEASTLY RHYME TIME,,200,An appaloosa from Oslo,Norse horse,NA
2000-02-14,J,CANDY,,200,"According to a jingle, ""Almond Joy's Got Nuts"", this candy bar ""Don't""",Mounds,NA
2000-02-14,J,IT HAPPENED ON VALENTINE'S DAY,,200,"TV's Mrs. Brady, she was born on Feb. 14, 1934",Florence Henderson,NA
2000-02-14,J,FICTION,,300,"Chili Palmer returns in ""Be Cool"", a 1999 sequel to this Elmore Leonard novel","""Get Shorty""",NA
2000-02-14,J,ENTERTAINING CATS,,300,This colorful big cat has been bopping to a Henry Mancini theme since 1963,The Pink Panther,NA
2000-02-14,J,AROUND THE WORLD,,300,For safety reasons this landmark seen here was closed to the public in 1990:,Leaning Tower of Pisa,NA
2000-02-14,J,BEASTLY RHYME TIME,,300,A bird of prey allowed by law,Legal eagle,NA
2000-02-14,J,CANDY,,300,"The name of this candy bar, taffy with a peanut butter center, runs from A to Z to A",Abba-Zaba,NA
2000-02-14,J,IT HAPPENED ON VALENTINE'S DAY,,300,"In 1995 Arthur Chaskalson, who defended Nelson Mandela in 1964, was sworn in as this country's chief justice",South Africa,NA
2000-02-14,J,FICTION,,400,"Say a little prayer for this title character of a 1989 John Irving novel, who speaks in capital letters",Owen Meany,NA
2000-02-14,J,ENTERTAINING CATS,,400,Beanie Baby fanatics know Blizzard is a white one of these,Tiger,NA
2000-02-14,J,AROUND THE WORLD,,NA,"Vatnajokull, the largest glacier in this country, covers some 3,200 square miles",Iceland,NA
2000-02-14,J,BEASTLY RHYME TIME,,400,"Goldilocks sat on one (actually, on all three)",Bear chair,NA
2000-02-14,J,CANDY,,400,The character seen here represents this candy:,Lemonheads,NA
2000-02-14,J,IT HAPPENED ON VALENTINE'S DAY,,400,"Americans fell in love with her when she gave a TV tour of the White House on Feb. 14, 1962",Jacqueline Kennedy Onassis,NA
2000-02-14,J,FICTION,,500,"Newsweek calls this ""Cryptonomicon"" author ""The Hacker Hemingway""",Neal Stephenson,NA
2000-02-14,J,ENTERTAINING CATS,,500,"The cat seen here lives with the TV family with this last name:(Salem the Cat: ""I'll take 'World Domination' for $1000, Alex!"")","Spellman (on ""Sabrina the Teenage Witch"")",NA
2000-02-14,J,AROUND THE WORLD,,500,"Argentina, Bolivia & Brazil could say to this small country, ""Halt, we've got you surrounded!""",Paraguay,NA
2000-02-14,J,BEASTLY RHYME TIME,,500,The jargon of an Australian wild dog,Dingo lingo,NA
2000-02-14,J,CANDY,,500,The peaks & the triangular shape of this Swiss chocolate bar were inspired by the Matterhorn,Toblerone,NA
2000-02-14,J,IT HAPPENED ON VALENTINE'S DAY,,500,"On Feb. 14, 1989 the Ayatollah Khomeini called for the death of this Indian-born British author",Salman Rushdie,NA
2000-02-14,DJ,FRICTION,,200,These fluid-filled swellings on the skin are most commonly caused by burns or friction,Blisters,NA
2000-02-14,DJ,SCARY MOVIE SEQUELS,(Alex: Aren't they all!),200,"This 1997 movie opens with Jada Pinkett meeting her end at a screening of ""Stab""",Scream 2,NA
2000-02-14,DJ,EDIBLE LINGO,,200,"Life's not the pits when it's like ""a bowl of"" these",Cherries,NA
2000-02-14,DJ,CELEBRITY ALUMNI,,200,"Though he's rather dim as Dick on ""3rd Rock from the Sun"", he graduated magna cum laude from Harvard",John Lithgow,NA
2000-02-14,DJ,THE AMERICAN REVOLUTION,,200,She ran the farm while the revolution kept her & future president John apart for most of 10 years,Abigail Adams,NA
2000-02-14,DJ,LOVE POETRY WITH JOHNNY GILBERT,,200,"We hope she meant the following for husband Robert:(""I love thee to the level of every day's most quiet need, by sun and candlelight"")",Elizabeth Barrett Browning,NA
2000-02-14,DJ,FRICTION,,400,A violinist rubs this substance onto his bow to increase the friction between it & the strings,Rosin,NA
2000-02-14,DJ,SCARY MOVIE SEQUELS,(Alex: Aren't they all!),400,"""Judgment Day"" was the subtitle to this 1991 movie sequel",Terminator 2,NA
2000-02-14,DJ,EDIBLE LINGO,,400,"Some people can be ""as nutty as"" this holiday treat with a long shelf life",Fruitcake,NA
2000-02-14,DJ,CELEBRITY ALUMNI,,400,She was a freshman at the University of Miami when she joined the Miami Sound Machine in 1975,Gloria Estefan,NA
2000-02-14,DJ,THE AMERICAN REVOLUTION,,400,"At Cornwallis' defeat, 1 of the 3 major American divisions was headed by this Frenchman",Marquis de Lafayette,NA
2000-02-14,DJ,LOVE POETRY WITH JOHNNY GILBERT,,400,"It's the object John Donne is addressing here:(""Why doest thou thus through windows and through curtains call on us; must to thy emotions lovers' seasons run"")",Sun,NA
2000-02-14,DJ,FRICTION,,600,"The rolling element types of these friction-reducing machine parts come in 2 varieties, roller & ball",Bearings,NA
2000-02-14,DJ,SCARY MOVIE SEQUELS,(Alex: Aren't they all!),NA,"""The Dream Child"" was the subtitle to the fifth installment in this series",Nightmare on Elm Street,NA
2000-02-14,DJ,EDIBLE LINGO,,600,"Hold on to your wallet if you're ever ""packed in like"" these small herring relatives",Sardines,NA
2000-02-14,DJ,CELEBRITY ALUMNI,,600,"David Schwimmer's friends know he studied speech & drama at this Evanston, Illinois school",Northwestern,NA
2000-02-14,DJ,THE AMERICAN REVOLUTION,,NA,"For his dealings with this man, Major John Andre concocted codes & used secret inks",Benedict Arnold,NA
2000-02-14,DJ,LOVE POETRY WITH JOHNNY GILBERT,,600,"With words like the following, this poet's name could be read as a statement:(""Is fair art thou my bonnie lass..."")",Robert Burns,NA
2000-02-14,DJ,FRICTION,,800,Friction gives a balloon rubbed on wool a static charge by transferring these subatomic particles,Electrons,NA
2000-02-14,DJ,SCARY MOVIE SEQUELS,(Alex: Aren't they all!),800,"In this series Part 4 was ""The Final Chapter"", but Part 5 was ""A New Beginning""",Friday the 13th,NA
2000-02-14,DJ,EDIBLE LINGO,,800,A score of zero in sports is also known by this bird term,Goose egg,NA
2000-02-14,DJ,CELEBRITY ALUMNI,,800,This oldest of the Baldwin acting brothers was a poli sci major at George Washington University,Alec Baldwin,NA
2000-02-14,DJ,THE AMERICAN REVOLUTION,,800,This future treasury secretary was appointed Washington's aide-de-camp in 1777,Alexander Hamilton,NA
2000-02-14,DJ,LOVE POETRY WITH JOHNNY GILBERT,,800,"It's the line that precedes the following:(""Thou art more lovely and more temperate; rough winds do shape the darling buds of May"")",How do I compare thee to a summer\'s day?,NA
2000-02-14,DJ,FRICTION,,1000,Friction is what makes this type of machine impossible; all machines will eventually run down,Perpetual motion machine,NA
2000-02-14,DJ,SCARY MOVIE SEQUELS,(Alex: Aren't they all!),1000,"""The Evil Escapes"" in the fourth installment of this normally housebound ""Horror""",The Amityville Horror,NA
2000-02-14,DJ,EDIBLE LINGO,,1000,"Proverbs 9:17 wisely observes that ""Stolen waters are sweet, and"" this food ""eaten in secret is pleasant""",Bread,NA
2000-02-14,DJ,CELEBRITY ALUMNI,,1000,"He wrote his 1st complete play, ""Camel"", while studying at Goddard College; ""Glengarry Glen Ross"" came later",David Mamet,NA
2000-02-14,DJ,THE AMERICAN REVOLUTION,,1000,"A staff officer for Frederick the Great, he came to fight after meeting Franklin in France",Baron von Steuben,NA
2000-02-14,DJ,LOVE POETRY WITH JOHNNY GILBERT,,1000,"She wasn't so ""saint""ly when she wrote the following:(""What lips my lips have kissed and where and why I have forgotten and what arms have lain under my head til morning"")",Edna St. Vincent Millay,NA
2000-02-14,FJ,HISTORIC QUOTATIONS,,NA,According to Suetonius it was inscribed on a parade wagon after the 5-day Pontic campaign of 47 B.C.,"\""Veni, Vidi, Vici\"" (\""I came, I saw, I conquered\"")",NA
