date,round,category,comment,value,clue,response,link
2007-11-07,J,U.S. MOUNTAINS,,200,"On July 4, 1961 this Colorado peak was designated a national historic landmark",Pike\'s Peak,NA
2007-11-07,J,SPORTS,,200,"On August 5, 1991 Sergei Bubka became the first to exceed 20 feet in this track & field event",the pole vault,NA
2007-11-07,J,BLOGS OF THE NEW YORK TIMES,,200,"You old school gamers, check out ""The Gambit"", a blog about this ancient game",chess,NA
2007-11-07,J,TRADITIONAL ANNIVERSARY GIFTS,,200,"For a 3rd anniversary, it's a gift made of this, be it a jacket, gloves or a briefcase",leather,NA
2007-11-07,J,OLD TESTAMENT NAMES,,200,"Oddly, his name means ""dove"" & not ""he of the big fish""",Jonah,NA
2007-11-07,J,"THE ""L"" YOU SAY",,200,Mersey me!  World Book's article on this city on the Mersey makes no mention of the Fab Four,Liverpool,NA
2007-11-07,J,U.S. MOUNTAINS,,400,"This Hawaiian peak is the world's largest in terms of volume, estimated to be more than 16,000 cubic miles",Mauna Loa,NA
2007-11-07,J,SPORTS,,400,"In a 2007 college football shocker, this team ended USC's 35-game home winning streak",Stanford,NA
2007-11-07,J,BLOGS OF THE NEW YORK TIMES,,400,"A blog about baseball is named for these--pieces of equipment, not mammals",bats,NA
2007-11-07,J,TRADITIONAL ANNIVERSARY GIFTS,,400,Lucky her--this is the traditional gift for both the 60th & 75th anniversaries,diamond,NA
2007-11-07,J,OLD TESTAMENT NAMES,,400,"Hebrew for ""friend"" or ""companion"", she was the companion & daughter-in-law of Naomi",Ruth,NA
2007-11-07,J,"THE ""L"" YOU SAY",,400,It's home to Gregor Erhart's statue of Mary Magdalene (I must remember to tell Dan Brown),the Louvre,NA
2007-11-07,J,U.S. MOUNTAINS,,600,"Early settlers in Oregon called the ""3 Sisters"" in this mountain range Faith, Hope & Charity",the Cascades,NA
2007-11-07,J,SPORTS,,600,"This Dallas Cowboys running back rushed for an NFL record 18,355 yards",Emmitt Smith,NA
2007-11-07,J,BLOGS OF THE NEW YORK TIMES,,600,"If you want to be in the front row of fashion, you'll walk (but not take off) ""on"" this Times blog",The Runway,NA
2007-11-07,J,TRADITIONAL ANNIVERSARY GIFTS,,600,"For year 30, maybe an oyster dinner, cufflinks for him & a necklace for her made of these",pearls,NA
2007-11-07,J,OLD TESTAMENT NAMES,,NA,"Though his name is from Hebrew for ""laughter"", he probably didn't laugh much while he was on that altar",Isaac,NA
2007-11-07,J,"THE ""L"" YOU SAY",,600,It's a tasty slang term for a clarinet,a licorice stick,NA
2007-11-07,J,U.S. MOUNTAINS,,800,"This state's tallest peak is 4,784-foot Brasstown Bald, not Stone Mountain",Georgia,NA
2007-11-07,J,SPORTS,,800,"In a 2001 tournament, this Swedish golfer shot a 59, the lowest score ever achieved on the LPGA Tour",Sorenstam,NA
2007-11-07,J,BLOGS OF THE NEW YORK TIMES,,800,"""Bits"", a technology blog, discusses ""blundits"", a combination of ""blogger"" & this word",pundits,NA
2007-11-07,J,TRADITIONAL ANNIVERSARY GIFTS,,800,"For a 55th anniversary, how about a trip to Ireland, a ""Wizard of Oz"" DVD, & this gift",emeralds,NA
2007-11-07,J,OLD TESTAMENT NAMES,,800,"Various sources list her name as meaning ""temptress"" & ""seductive""",Delilah,NA
2007-11-07,J,"THE ""L"" YOU SAY",,800,Legend says that gods dropped rocks from the sky & formed the Garden of the Gods on this Hawaiian isle,Lanai,NA
2007-11-07,J,U.S. MOUNTAINS,,1000,This mountain near Los Angeles was named for Gen. George S. Patton's grandfather & is home to a famous observatory,Mt. Wilson,NA
2007-11-07,J,SPORTS,,1000,"Home of the Travers Stakes, this N.Y. racetrack is North America's oldest continuously operating track",Saratoga,NA
2007-11-07,J,BLOGS OF THE NEW YORK TIMES,,1000,"Like his book, rogue economist Steven Levitt explores the hidden side of everything in this blog",Freakonomics,NA
2007-11-07,J,TRADITIONAL ANNIVERSARY GIFTS,,1000,"For a 15th anniversary, you might give one of this Austrian company's crystal figurines, like the one seen here",Swarovski,http://www.j-archive.com/media/2007-11-07_J_27.jpg
2007-11-07,J,OLD TESTAMENT NAMES,,1000,"""Behold, a son"", this firstborn son of Jacob",Reuben,NA
2007-11-07,J,"THE ""L"" YOU SAY",,1000,"From the Latin for ""ghastly"", this adjective describes those vivid, shocking details beloved by the tabloids",lurid,NA
2007-11-07,DJ,INSIDE THE ARTIST'S STUDIO,(Alex: ...but with a bit of a twist: you have to identify the artist being interviewed by James Lipton.),400,"(James Lipton reads.)  At 20, you went to St. Petersburg's Imperial School of Fine Arts, in 1907; what's your favorite Russian curse word?",Chagall,http://www.j-archive.com/media/2007-11-07_DJ_17a.jpg
2007-11-07,DJ,THE SUNNY SIDE OF THE STREEP,,400,Meryl & Lily Tomlin played country duo Yolanda & Rhonda Johnson in this 2006 Robert Altman film,A Prairie Home Companion,NA
2007-11-07,DJ,MIND MY WORDS,,400,"Around 550 B.C.:""The boy cried, 'Wolf! Wolf!' and the villagers came out to help him""",Aesop,NA
2007-11-07,DJ,THE STORY SFORZA,,400,"The family name was Attendolo until Muzio made it more ""force""ful & set the dynasty up in this N. Italian city",Milan,NA
2007-11-07,DJ,TRAIN TIMETABLES,,400,"Frankfurt 0615,this city's Spandau Station 0940 (if the trains run on time)",Berlin,NA
2007-11-07,DJ,KNOWLEDGE OF FONTS,,400,"From the Latin for ""flowing"" comes the name of these typefaces that resemble handwriting script",cursive,NA
2007-11-07,DJ,INSIDE THE ARTIST'S STUDIO,(Alex: ...but with a bit of a twist: you have to identify the artist being interviewed by James Lipton.),NA,"(James Lipton reads.)  Deafened by illness in 1792, you would paint 2 masterpieces regarding May 1808;  Madrid trembled at your genius",(Francisco) Goya,http://www.j-archive.com/media/2007-11-07_DJ_18a.jpg
2007-11-07,DJ,THE SUNNY SIDE OF THE STREEP,,800,"In 2004 Meryl Streep got paranoid as Aunt Josephine, who helped kids steer clear of Count Olaf, played by him",Jim Carrey,NA
2007-11-07,DJ,MIND MY WORDS,,800,"1588:""I know I have the body of a weak & feeble woman, but I have the heart & stomach of a king!""",Elizabeth I,NA
2007-11-07,DJ,THE STORY SFORZA,,800,"While working for Ludovico Sforza, he knocked out ""The Last Supper"" on the wall of a local church",da Vinci,NA
2007-11-07,DJ,TRAIN TIMETABLES,,800,"This capital's Yaroslavski Station 2122,Irkutsk 0233 (of day 5)",Moscow,NA
2007-11-07,DJ,KNOWLEDGE OF FONTS,,800,"Sans serif fonts are known as grotesque or this other spooky ""architectural"" name",Gothic fonts,NA
2007-11-07,DJ,INSIDE THE ARTIST'S STUDIO,(Alex: ...but with a bit of a twist: you have to identify the artist being interviewed by James Lipton.),1200,"1947's ""Watery Paths"" was in your poured painting style; simply brilliant",Jackson Pollock,http://www.j-archive.com/media/2007-11-07_DJ_19.jpg
2007-11-07,DJ,THE SUNNY SIDE OF THE STREEP,,1200,"Meryl voiced Aunt Esme on this Texas-based animated show in an episode titled ""A Beer Can Named Desire""",King of the Hill,NA
2007-11-07,DJ,MIND MY WORDS,,NA,"400 B.C.:""I will use treatment to help the sick according to my ability and my judgment""",Hippocrates,NA
2007-11-07,DJ,THE STORY SFORZA,,1200,Francisco assumed this title in 1450 when he married into the Visconti family,Duke (of Milan),NA
2007-11-07,DJ,TRAIN TIMETABLES,,1200,"BOS (Boston) 0915,NYP (this station) 1245",Penn Station,NA
2007-11-07,DJ,KNOWLEDGE OF FONTS,,1200,"It's a Latin adjective meaning ""Swiss""",Helvetica,http://www.j-archive.com/media/2007-11-07_DJ_05.jpg
2007-11-07,DJ,INSIDE THE ARTIST'S STUDIO,(Alex: ...but with a bit of a twist: you have to identify the artist being interviewed by James Lipton.),1600,"(James Lipton reads.)  And then, from 1508 to 1511, you created the fresco walls in the Stanza della Segnatura, including ""Disputa""; remarkable",Raphael,http://www.j-archive.com/media/2007-11-07_DJ_20a.jpg
2007-11-07,DJ,THE SUNNY SIDE OF THE STREEP,,1600,Shirley MacLaine welcomes Meryl to rehab in this comedy written by Carrie Fisher,Postcards from the Edge,NA
2007-11-07,DJ,MIND MY WORDS,,1600,"44 B.C.:""All Gaul is divided into 3 parts""",(Julius) Caesar,NA
2007-11-07,DJ,THE STORY SFORZA,,1600,"Appointed Ambassador to France in 1922, Carlo Sforza resigned over this new Italian premier's policies",Mussolini,NA
2007-11-07,DJ,TRAIN TIMETABLES,,1600,"Edinburgh, Scotland 1505;Swansea, this country 2331",Wales,NA
2007-11-07,DJ,KNOWLEDGE OF FONTS,,1600,"Lavish or exuberant parties, or this crazy font",Wingdings,http://www.j-archive.com/media/2007-11-07_DJ_06.jpg
2007-11-07,DJ,INSIDE THE ARTIST'S STUDIO,(Alex: ...but with a bit of a twist: you have to identify the artist being interviewed by James Lipton.),2000,"(James Lipton reads.)  Missouri-born, your 1931 mural ""America Today"" graced the New School for Social Research's walls for decades",(Thomas Hart) Benton,http://www.j-archive.com/media/2007-11-07_DJ_21a.jpg
2007-11-07,DJ,THE SUNNY SIDE OF THE STREEP,,2000,Shirley MacLaine welcomes Meryl & Albert Brooks to the Past Lives Pavilion in this comedy,Defending Your Life,NA
2007-11-07,DJ,MIND MY WORDS,,2000,"1875:""From each according to his abilities, to each according to his needs""",(Karl) Marx,NA
2007-11-07,DJ,THE STORY SFORZA,,2000,In 1535 the Sforza ruling line ended & the area passed to Holy Roman Emperor Charles V of this Austrian family,the Hapsburgs,NA
2007-11-07,DJ,TRAIN TIMETABLES,,2000,"In this country, the Chandigarh choo-choo gets into Panipat Junction at 0400",India,NA
2007-11-07,DJ,KNOWLEDGE OF FONTS,,2000,This font is named for an 18th century Italian typeface designer,Bodoni,http://www.j-archive.com/media/2007-11-07_DJ_07.jpg
2007-11-07,FJ,EARLY AMERICAN SHORT STORIES,,NA,"This short story, written around 1820, contains the line ""If I can but reach that bridge... I am safe""","\""The Legend of Sleepy Hollow\""",NA
