date,round,category,comment,value,clue,response,link
1999-11-29,J,BIBLICAL VOICES,,100,"Jesus ""cried out with a loud voice"" & commanded this dead man to ""come forth""",Lazarus,NA
1999-11-29,J,"THE ""A"" LIST",,100,You're this if you're from the Pampas,Argentinian,NA
1999-11-29,J,MYTH & MAGIC,,100,"Unlike in the U.S., if one of these crosses your path in England, it means good luck",a black cat,NA
1999-11-29,J,BEFORE & AFTER,,100,"The buck stops with this president who wrote ""Breakfast at Tiffany's""",Harry S. Truman Capote,NA
1999-11-29,J,FOREIGN-BORN YANKS,,100,"The G in MGM, he was born in Warsaw, Poland",Samuel Goldwyn,NA
1999-11-29,J,JOHNNY GILBERT ROCKS!,"(Alex: Last season, we had JOHNNY GILBERT DOES SHAKESPEARE; it proved to be so popular that our viewers wanted us to feature him again, and that's what we're doing today!)",100,"More than 2,000 versions of this 1965 song have been recorded:""Suddenly /I'm not half the man I used to be /There's a shadow hanging over me""","""Yesterday""",NA
1999-11-29,J,BIBLICAL VOICES,,200,"This apostle ""lifted up his voice"" & addressed the crowd at Pentecost",Peter,NA
1999-11-29,J,"THE ""A"" LIST",,200,You're this if you're from Adelaide,Australian,NA
1999-11-29,J,MYTH & MAGIC,,200,Cloves of this are sometimes placed in a bridal bouquet for good luck,garlic,NA
1999-11-29,J,BEFORE & AFTER,,200,George Washington's Virginia estate that co-chaired Clinton's transition team,Mount Vernon Jordan,NA
1999-11-29,J,FOREIGN-BORN YANKS,,200,This member of Clinton's cabinet was born in Prague,Madeleine Albright,NA
1999-11-29,J,JOHNNY GILBERT ROCKS!,"(Alex: Last season, we had JOHNNY GILBERT DOES SHAKESPEARE; it proved to be so popular that our viewers wanted us to feature him again, and that's what we're doing today!)",200,"This song topped the pop, R&B & country charts in 1957:""The warden said, 'Hey, buddy, don't you be no square /If you can't find a partner, use a wooden chair'""","""Jailhouse Rock""",NA
1999-11-29,J,BIBLICAL VOICES,,300,This blind father recognized Jacob's voice but thought his goatskin-covered hands were those of Esau,Isaac,NA
1999-11-29,J,"THE ""A"" LIST",,300,You're this if you're from Innsbruck,Austrian,NA
1999-11-29,J,MYTH & MAGIC,,300,This card deck's Minor Arcana has 14 cards in each suit; a page is between the 10 & jack,tarot,NA
1999-11-29,NA,NA,NA,NA,NA,NA,NA
1999-11-29,J,FOREIGN-BORN YANKS,,300,"A college football head coach from 1918 to 1931, he hailed from Voss, Norway",Knute Rockne,NA
1999-11-29,J,JOHNNY GILBERT ROCKS!,"(Alex: Last season, we had JOHNNY GILBERT DOES SHAKESPEARE; it proved to be so popular that our viewers wanted us to feature him again, and that's what we're doing today!)",300,"This song was written for a 1967 film:""Where have you gone, Joe DiMaggio /A nation turns its lonely eyes to you (Woo, woo, woo)""","""Mrs. Robinson""",NA
1999-11-29,J,BIBLICAL VOICES,,NA,"His was the ""voice of one crying in the wilderness""",John the Baptist,NA
1999-11-29,J,"THE ""A"" LIST",,400,You're this if you're from Kabul,Afghanistanian,NA
1999-11-29,J,MYTH & MAGIC,,400,"Not feeling well?  You may want to cleanse this field surrounding your body, from the Greek for ""breath"" or ""breeze""",an aura,NA
1999-11-29,NA,NA,NA,NA,NA,NA,NA
1999-11-29,J,FOREIGN-BORN YANKS,,400,"He hosts a late-night network news show, but not from Lancashire, England, where he was born",Ted Koppel,NA
1999-11-29,J,JOHNNY GILBERT ROCKS!,"(Alex: Last season, we had JOHNNY GILBERT DOES SHAKESPEARE; it proved to be so popular that our viewers wanted us to feature him again, and that's what we're doing today!)",400,"People were crazy about this 1999 song:""Her lips are devil-red and her skin's the color of mocha...""","""Livin\' La Vida Loca""",NA
1999-11-29,J,BIBLICAL VOICES,,500,"In the first book of Samuel, he asked, ""Is this thy voice, my son David?""",Saul,NA
1999-11-29,J,"THE ""A"" LIST",,500,You're this if you're from Luanda,Angolan,NA
1999-11-29,J,MYTH & MAGIC,,500,This plant yields a hair dye as well as as tint used in magical hand & foot tattoos,henna,NA
1999-11-29,NA,NA,NA,NA,NA,NA,NA
1999-11-29,J,FOREIGN-BORN YANKS,,500,"Born in Petrovichi, Russia, this prolific writer's works include ""Foundation's Edge"" & ""The Gods Themselves""",Isaac Asimov,NA
1999-11-29,J,JOHNNY GILBERT ROCKS!,"(Alex: Last season, we had JOHNNY GILBERT DOES SHAKESPEARE; it proved to be so popular that our viewers wanted us to feature him again, and that's what we're doing today!)",500,"The title track of a 1976 album, this song topped the charts in 1977:""You can check out any time you like, but you can never leave""","""Hotel California""",NA
1999-11-29,DJ,RUSSIAN CITIES,,200,"By the 15th C., this city was capital of the Russian state & the seat of the Russian Orthodox Church",Moscow,NA
1999-11-29,DJ,FRED ASTAIRE FILMS,,200,Astaire was nominated for a Supporting Actor Oscar for this fiery 1974 disaster epic,The Towering Inferno,NA
1999-11-29,DJ,WORD ORIGINS,,200,Type of moustache named for its resemblance to a bicycle part,Handlebar,NA
1999-11-29,DJ,AMERICAN NICKNAMES,,200,"The ""Tip"" of Congress","Thomas P. ""Tip"" O\'Neill",NA
1999-11-29,DJ,4 OUT OF 5,,200,4 out of the 5 traditional human senses,"Hearing, sight, smell, taste, touch",NA
1999-11-29,DJ,DOCTORS,,200,"With over $3 billion in annual sales, this soft drink has 6% of the U.S. market",Dr. Pepper,NA
1999-11-29,DJ,RUSSIAN CITIES,,400,"Important Russian cities on this longest Russian river include Nizhniy Novgorod, Kazan & Samara",Volga,NA
1999-11-29,DJ,FRED ASTAIRE FILMS,,400,Fred came out of retirement to replace an injured Gene Kelly as Judy Garland's co-star in this holiday musical,Easter Parade,NA
1999-11-29,DJ,WORD ORIGINS,,400,This word for a shopping center comes from a London site where a ball & mallet game was played in narrow alleys,Mall (from Pall Mall),NA
1999-11-29,DJ,AMERICAN NICKNAMES,,400,"1977's ""Son of Sam""",David Berkowitz,NA
1999-11-29,DJ,4 OUT OF 5,,400,"4 out of 5 people living at 742 Evergreen Terrace on TV's ""The Simpsons""","Bart, Homer, Lisa, Maggie & Marge Simpson",NA
1999-11-29,DJ,DOCTORS,,400,"A high school friend who was ""The Professor"" helped give this Philadelphia 76ers star his nickname, Dr. J.",Julius Erving,NA
1999-11-29,DJ,RUSSIAN CITIES,,600,"This city of 180,000 shares its name with Marx' co-writer of ""The Communist Manifesto""",Engels,NA
1999-11-29,DJ,FRED ASTAIRE FILMS,,600,Appropriate title question of this 1937 Fred Astaire-Ginger Rogers film,Shall We Dance?,NA
1999-11-29,DJ,WORD ORIGINS,,600,"Sanskrit for ""great queen"", she's the wife of a maharajah",Maharani,NA
1999-11-29,DJ,AMERICAN NICKNAMES,,600,"Hollywood's ""Swifty""","Irving ""Swifty"" Lazar",NA
1999-11-29,DJ,4 OUT OF 5,,600,4 out of the 5 Biblical books of Moses known as the Pentateuch,"Genesis, Exodus, Leviticus, Numbers & Deuteronomy",NA
1999-11-29,DJ,DOCTORS,,600,"His work includes ""Hunches in Bunches"", ""Fox in Socks"" & ""Gerald McBoing-Boing""",Dr. Seuss (Theodor Geisel),NA
1999-11-29,DJ,RUSSIAN CITIES,,800,"Heavenly beings Gabriel, Michael & Raphael might enjoy this city on the Dvina River near the White Sea",Arkhangelsk (Archangel),NA
1999-11-29,NA,NA,NA,NA,NA,NA,NA
1999-11-29,DJ,WORD ORIGINS,,800,This white gypsum cement that hardens quickly is named for the French city where it was originally made,Plaster of Paris,NA
1999-11-29,DJ,AMERICAN NICKNAMES,,800,"""The Long Island Lolita"" of the tabloids",Amy Fisher,NA
1999-11-29,DJ,4 OUT OF 5,,800,4 out of the first 5 letters of the Greek alphabet,"Alpha, beta, gamma, delta, epsilon",NA
1999-11-29,DJ,DOCTORS,,NA,"In 1988 he said, ""I was proud of the youths who opposed the war in Vietnam -- they were my babies""",Dr. Benjamin Spock,NA
1999-11-29,DJ,RUSSIAN CITIES,,NA,"Like a ballet company, this city was named for revolutionary hero Sergei",Kirov,NA
1999-11-29,NA,NA,NA,NA,NA,NA,NA
1999-11-29,DJ,WORD ORIGINS,,1000,"Dervied from Old French for ""crane's foot"", it's a genealogical chart or family tree",Pedigree,NA
1999-11-29,DJ,AMERICAN NICKNAMES,,1000,"New York's former ""Senator Pothole""",Alfonse D\'Amato,NA
1999-11-29,NA,NA,NA,NA,NA,NA,NA
1999-11-29,DJ,DOCTORS,,1000,"Published in 1957, this epic novel tells the story of a physician's love for the wife of a Russian revolutionary","""Doctor Zhivago""",NA
1999-11-29,FJ,U.S. STATES,,NA,It's the only state whose name & capital city both consist of 2 words,New Mexico (Santa Fe),NA
