date,round,category,comment,value,clue,response,link
1999-11-30,J,BARCELONA,,100,"On Sundays, in front of the Gothic Cathedral, people perform the Sardana, one of these",Dance,NA
1999-11-30,J,COPS,,100,"These important pieces of evidence might contain loops, arches & whorls",Fingerprints,NA
1999-11-30,J,1690s AMERICA,,100,"In 1690 ""Publick Occurrences"" became the first one of these published in the colonies; it lasted one issue",Newspaper,NA
1999-11-30,J,MOVIE QUOTES,(Alex: I'll give you the year & the quote; you identify the film for me.),100,"1987:""Greed...is good!Greed is right!Greed works!""",Wall Street,NA
1999-11-30,J,PLUM CRAZY,,100,"He said, ""What a good boy am I!"" after pulling a plum out of his Christmas pie",Little Jack Horner,NA
1999-11-30,J,"A LITTLE ""R"" & ""R""",,100,"It's not a 100-meter dash for rodents, but a tiring, meaningless competitve activity",Ratrace,NA
1999-11-30,J,BARCELONA,,200,A statue of this explorer points to the sea from atop a 167' column near Barcelona's harbor,Christopher Columbus,NA
1999-11-30,J,COPS,,200,"It's the ""unfashionable"" name for officers who do not wear uniforms when on duty",Plainclothes,NA
1999-11-30,J,1690s AMERICA,,200,In 1694 Anne Arundel Town became the capital of Maryland & soon changed its name to this,Annapolis,NA
1999-11-30,J,MOVIE QUOTES,(Alex: I'll give you the year & the quote; you identify the film for me.),200,"1989:""I'll have what she's having""",When Harry Met Sally...,NA
1999-11-30,J,PLUM CRAZY,,200,"French for plum, it means a dried plum in English",Prune,NA
1999-11-30,J,"A LITTLE ""R"" & ""R""",,200,"This hit song reached No. 2 twice, by Bobby Day in 1958 & by Michael Jackson in 1972","""Rockin\' Robin""",NA
1999-11-30,J,BARCELONA,,300,"The women of Barcelona's Carrer Avinyo inspired this cubist's ""Les Demoiselles D'Avignon""",Pablo Picasso,NA
1999-11-30,J,COPS,,300,"From the Middle English for ""lively"", it's the police activity seen here:",Frisking,NA
1999-11-30,J,1690s AMERICA,,300,In 1694 this Virginia college received a coat of arms from the College of Arms in London,William and Mary,NA
1999-11-30,J,MOVIE QUOTES,(Alex: I'll give you the year & the quote; you identify the film for me.),300,"1976:""Is it safe?""",Marathon Man,NA
1999-11-30,J,PLUM CRAZY,,300,"In Chinese restaurants plum sauce is also known by this ""fowl"" name",Duck sauce,NA
1999-11-30,J,"A LITTLE ""R"" & ""R""",,300,"Like John Doe, this name is often used in legal proceedings to designate an unidentified male",Richard Roe,NA
1999-11-30,J,BARCELONA,,NA,"(Hello, I'm Jay Leno)  In this year, Barcelona hosted the Olympics & I became the permanent host of ""The Tonight Show""",1992,NA
1999-11-30,J,COPS,,400,"When cops put out an APB on a suspect, APB stands for this",All Points Bulletin,NA
1999-11-30,J,1690s AMERICA,,400,"On July 6, 1699 this pirate was captured in Boston",Captain Kidd,NA
1999-11-30,J,MOVIE QUOTES,(Alex: I'll give you the year & the quote; you identify the film for me.),400,"1984:""The numbers all go to 11...right across the board...""  ""Most amps go up to 10?...""  ""These go to 11""",This Is Spinal Tap,NA
1999-11-30,J,PLUM CRAZY,,400,This famed horticulturist developed the Santa Rosa plum,Luther Burbank,NA
1999-11-30,J,"A LITTLE ""R"" & ""R""",,400,This engine is used to arrest or reverse the motion of a missile,Retrorocket,NA
1999-11-30,J,BARCELONA,,500,"Once suppressed under Franco, this native language is again widely used in Barcelona",Catalan/Catalonian,NA
1999-11-30,J,COPS,,500,"It's the numerical response that means ""Message confirmed"", good buddy",10-4,NA
1999-11-30,J,1690s AMERICA,,500,"With the French & Indian War, some New Hampshire towns considered a re-annexation to this colony in March 1690",Massachusetts,NA
1999-11-30,J,MOVIE QUOTES,(Alex: I'll give you the year & the quote; you identify the film for me.),500,"1939:""You all think I'm licked.  Well, I'm not licked, & I'm going to stay right here & fight for this just cause""",Mr. Smith Goes to Washington,NA
1999-11-30,J,PLUM CRAZY,,500,"A wild European plum, this fruit of the blackthorn is steeped in gin to make a type of liqueur",Sloe,NA
1999-11-30,J,"A LITTLE ""R"" & ""R""",,500,"Officially, this celebrated regiment was named the First United States Volunteer Cavalry",Rough Riders,NA
1999-11-30,DJ,NUCLEAR PHYSICIST'S DICTIONARY,,200,These devices use electromagnets to increase the velocity & energy of charged particles,Accelerators,NA
1999-11-30,DJ,U.S.A.,,200,"This Wyoming city known for its planetarium was named for a cavalry lieutenant, not for a friendly ghost",Casper,NA
1999-11-30,DJ,LITERARY LOCALES,,200,1904:Never-Never-Land,"""Peter Pan""",NA
1999-11-30,NA,NA,NA,NA,NA,NA,NA
1999-11-30,DJ,SHAKESPEARE,,200,"After Othello stabs him, this villain says, ""I bleed, sir, but not kill'd""",Iago,NA
1999-11-30,DJ,BRITISH SPELLING BEE,"(Alex: We will give you a clue, you have to spell the word the way the British people would spell it.)",200,A telly that isn't black & white must be this,C-O-L-O-U-R,NA
1999-11-30,DJ,NUCLEAR PHYSICIST'S DICTIONARY,,400,It's the hypothetical fusion of atomic nuclei at a lower temperature & pressure than now required,Cold fusion,NA
1999-11-30,DJ,U.S.A.,,400,Alabama's official state one of these is the tarpon,Fish,NA
1999-11-30,DJ,LITERARY LOCALES,,400,1901:Baskerville Hall,"""The Hound of the Baskervilles""",NA
1999-11-30,DJ,SPORTS VENUES,,400,"(Hi, I'm Wesley Walls of the Carolina Panthers)  I played in this building for the 49ers in the Super Bowl; later, I played there for the Saints",Louisiana Superdome,NA
1999-11-30,DJ,SHAKESPEARE,,400,"This mischievous trickster delivers the epilogue to ""A Midsummer Night's Dream""",Puck,NA
1999-11-30,DJ,BRITISH SPELLING BEE,"(Alex: We will give you a clue, you have to spell the word the way the British people would spell it.)",400,It's the British version of the word we spell C-O-N-N-E-C-T-I-O-N,C-O-N-N-E-X-I-O-N,NA
1999-11-30,DJ,NUCLEAR PHYSICIST'S DICTIONARY,,600,"These elementary particles can be designated up, down, strange, charm, beauty, bottom, truth or top",Quarks,NA
1999-11-30,DJ,U.S.A.,,600,"Shoppers love Freeport, the ""Birthplace of"" this state; it has more than 100 stores, including L.L. Bean",Maine,NA
1999-11-30,DJ,LITERARY LOCALES,,600,8th or 9th century B.C.:The Land of the Lotus-Eaters,"""The Odyssey""",NA
1999-11-30,DJ,SPORTS VENUES,,600,"For first-class Thai kick-boxing action, head for Rajadamnoen Stadium in this city",Bangkok,NA
1999-11-30,DJ,SHAKESPEARE,,600,"In the lottery of the caskets in ""The Merchant of Venice"", Bassanio chooses a casket made of this element",Lead,NA
1999-11-30,DJ,BRITISH SPELLING BEE,"(Alex: We will give you a clue, you have to spell the word the way the British people would spell it.)",600,"When parked facing down Notting Hill, turn your tyres into this pavement edge",K-E-R-B,NA
1999-11-30,DJ,NUCLEAR PHYSICIST'S DICTIONARY,,800,"Named for a German physicist, this device detects the radiation of subatomic particles",Geiger counter,NA
1999-11-30,DJ,U.S.A.,,800,This city is home to the University of Vermont,Burlington,NA
1999-11-30,DJ,LITERARY LOCALES,,800,1667:Pandemonium,"""Paradise Lost""",NA
1999-11-30,DJ,SPORTS VENUES,,NA,Fondly remembered Flatbush Avenue structure seen here:,Ebbets Field,NA
1999-11-30,DJ,SHAKESPEARE,,800,"As he dies in Alexandria, his last words are ""Now my spirit is going.  I can no more""",Antony,NA
1999-11-30,DJ,BRITISH SPELLING BEE,"(Alex: We will give you a clue, you have to spell the word the way the British people would spell it.)",800,A game of tic-tac-toe is a game of these & crosses,N-O-U-G-H-T-S,NA
1999-11-30,NA,NA,NA,NA,NA,NA,NA
1999-11-30,DJ,U.S.A.,,1000,"This Boston library was founded in 1807; its name may be ""Greek"" to you",The Boston Athenaeum,NA
1999-11-30,DJ,LITERARY LOCALES,,1000,1949:Oceania,"""1984""",NA
1999-11-30,DJ,SPORTS VENUES,,1000,Remember this arena -- the 1999 NBA champions play there,Alamodome (San Antonio Spurs),NA
1999-11-30,DJ,SHAKESPEARE,,NA,"This title character imprisons his brother, the Duke of Clarence, in the Tower of London",Richard III,NA
1999-11-30,NA,NA,NA,NA,NA,NA,NA
1999-11-30,FJ,JAZZ SINGERS,,NA,Comedian Harry Anderson was among those who gave eulogies at this singer's June 1999 funeral,Mel Torme,NA
