date,round,category,comment,value,clue,response,link
2007-11-22,J,FACTS & FIGURES,,200,"Name & number please: launched in 2004, it's 1,132 feet long, has 10 restaurants & 5 pools, & carries 2,620 passengers",the Queen Mary 2,NA
2007-11-22,J,TENNIS,,200,The ladies' singles trophy for this event is a sterling silver tray called the Rosewater Dish,Wimbledon,NA
2007-11-22,J,THE CONTINENT...,,200,...with the most countries,Africa,NA
2007-11-22,J,LET'S MEAT FOR BREAKFAST,,200,"I'm in the mood for corned beef this, from the French for ""to cut up""",hash,NA
2007-11-22,J,POTLUCK,,200,In 1977 a Tunisian immigrant became the last prisoner in France to be executed with this device,a guillotine,NA
2007-11-22,J,THE SHORT FORM,,200,"If your internist gives you a scrip, it's short for this",prescription,NA
2007-11-22,J,FACTS & FIGURES,,400,"With more than 1 billion members, it's the largest branch of Christianity",Catholicism,NA
2007-11-22,J,TENNIS,,400,This feisty American's 1984 winning percentage of .965 is the best in the ATP Tour's modern era,John McEnroe,NA
2007-11-22,J,THE CONTINENT...,,400,...that can be typed using a single row of letters on a standard keyboard,Europe,NA
2007-11-22,J,LET'S MEAT FOR BREAKFAST,,400,I think I'll chow down on some CFS; that's Texas talk for chicken-fried this,steak,NA
2007-11-22,J,POTLUCK,,400,"Eat it, wear it, or play it--what a Greek would do with a bouzouki",play it,NA
2007-11-22,J,THE SHORT FORM,,400,"""Frag"", meaning to kill a fellow soldier, started as a short form of this term for a type of grenade",fragmentation,NA
2007-11-22,J,FACTS & FIGURES,,600,"At just more than 30 days, he served the shortest term as president",William Henry Harrison,NA
2007-11-22,J,TENNIS,,NA,"Only 3 women have won more than 100 singles titles: Martina Navratilova, Chris Evert & this European",Steffi Graf,NA
2007-11-22,J,THE CONTINENT...,,600,...that extends down to about 54 degrees south latitude,South America,NA
2007-11-22,J,LET'S MEAT FOR BREAKFAST,,600,"What Americans call ""Canadian"" this is not truly Canadian; give me the ""peameal"" type, a real specialty of my homeland",bacon,NA
2007-11-22,J,POTLUCK,,600,"From the French for ""chart"", it's the proper term for a person who designs & prepares maps",cartographer,NA
2007-11-22,J,THE SHORT FORM,,600,"""Buck"", as in dollar, is short for this item once used in trade & barter",buckskin,NA
2007-11-22,J,FACTS & FIGURES,,800,In 2002 a team at the University of Tokyo calculated this to 1.2411 trillion digits after the decimal point,pi,NA
2007-11-22,J,TENNIS,,800,"It's the ""ITF Team Championship for Men""",Davis Cup,NA
2007-11-22,J,THE CONTINENT...,,800,...with the first country alphabetically,Asia,NA
2007-11-22,J,LET'S MEAT FOR BREAKFAST,,800,"I'll have a honey glazed one of these, from the company of the same name--yep, a whole one, spiral sliced",a ham,NA
2007-11-22,J,POTLUCK,,800,The 4 Noble Truths are the fundamental principles of this religion,Buddhism,NA
2007-11-22,J,THE SHORT FORM,,800,A cab you drink is short for this word,Cabernet,NA
2007-11-22,J,FACTS & FIGURES,,1000,"In 2000 an almost 4,200-square-mile iceberg broke free from this ice shelf in Antarctica",the Ross Ice Shelf,NA
2007-11-22,J,TENNIS,,1000,"In April 2007 Switzerland issued its very first stamp of a living person, a 1-franc stamp depicting this tennis player",Roger Federer,NA
2007-11-22,J,THE CONTINENT...,,1000,...where the Latter-Day Saints believe that Zion or New Jerusalem will be built,North America,NA
2007-11-22,J,LET'S MEAT FOR BREAKFAST,,1000,Maybe I'll try the black pudding--that sounds a lot better than this sanguine synonym,blood pudding,NA
2007-11-22,J,POTLUCK,,1000,This U.S. president was called Bert for short,Herbert Hoover,NA
2007-11-22,J,THE SHORT FORM,,1000,A cab you ride in is short for this word that was a carriage before it was a VW,cabriolet,NA
2007-11-22,DJ,EUROPEAN HISTORY,,400,In 1991 Poland's Democratic Union Party won the most seats in the House & Senate; it was formed from this trade group,Solidarity,NA
2007-11-22,DJ,OSCAR-NOMINATED SONGS,(Alex: You have to identify the movie for us.),400,"""A Whole New World""(1992)",Aladdin,NA
2007-11-22,DJ,THE SCIENCE OF LIQUOR,,400,"In cryoextraction, this is done to grapes to produce the most concentrated juice in pressing",freezing,NA
2007-11-22,DJ,BOOKS & AUTHORS,,400,"In 2003 Mitch Albom had a No. 1 bestseller with ""The Five People You Meet"" here",Heaven,NA
2007-11-22,DJ,SAINTS,,400,St. Columba of this country was martyred in 853 after telling some Moors that Muhammad was a false prophet,Spain,NA
2007-11-22,DJ,"""U"" KNOW IT",,400,"Here's a high-class clue: it's the last word in the kid's rhyme that begins, ""I see London, I see France...""",underpants,NA
2007-11-22,DJ,EUROPEAN HISTORY,,800,"He was King of England from 1189 to 1199 but spent only 6 months there; the rest of the time, he was off fighting",Richard the Lionheart,NA
2007-11-22,DJ,OSCAR-NOMINATED SONGS,(Alex: You have to identify the movie for us.),800,"""Let's Hear It For The Boy""(1984)",Footloose,NA
2007-11-22,DJ,THE SCIENCE OF LIQUOR,,800,"Germany's Purity Law of 1516 states that German beer must contain only water, hops & this germinated grain",barley,NA
2007-11-22,DJ,BOOKS & AUTHORS,,800,"In 1947 he published his first story collection, ""Dark Carnival""; the ""Martian Chronicles"" came 3 years later",Ray Bradbury,NA
2007-11-22,DJ,SAINTS,,800,St. John Eudes promoted devotion to this sacred body part not just of Jesus but of Mary too,the (sacred) heart,NA
2007-11-22,DJ,"""U"" KNOW IT",,800,More than 25 moons are circling it,Uranus,NA
2007-11-22,DJ,EUROPEAN HISTORY,,1200,From 1541 to 1784 this current capital of Slovakia served as the capital of Hungary,Bratislava,NA
2007-11-22,DJ,OSCAR-NOMINATED SONGS,(Alex: You have to identify the movie for us.),1200,"""Zip-A-Dee-Doo-Dah""(1947)",Song of the South,NA
2007-11-22,DJ,THE SCIENCE OF LIQUOR,,1200,Zymurgy is the chemistry branch that deals with this process in which sugar is converted into alcohol,fermentation,NA
2007-11-22,DJ,BOOKS & AUTHORS,,1200,"In Willa Cather's ""O Pioneers!"", the heroine Alexandra Bergson is of immigrant stock from this country",Sweden,NA
2007-11-22,DJ,SAINTS,,1200,"Hermit monk Saint Simeon Stylites resided for decades on one of these, 60 feet tall",column,NA
2007-11-22,DJ,"""U"" KNOW IT",,1200,"(Kelly of the Clue Crew shows an anatomical diagram on the monitor.)  It's the 2-word term for the continuous anatomical system that contains the kidneys, the ureters, the bladder & the urethra",the urinary system,http://www.j-archive.com/media/2007-11-22_DJ_18.jpg
2007-11-22,DJ,EUROPEAN HISTORY,,1600,"In the 100-year period before 268 B.C., Rome annexed all of Italy below this river that flows through Turin",the Po,NA
2007-11-22,DJ,OSCAR-NOMINATED SONGS,(Alex: You have to identify the movie for us.),1600,"""Papa, Can You Hear Me?""(1983)",Yentl,NA
2007-11-22,DJ,THE SCIENCE OF LIQUOR,,1600,Jameson Irish Whiskey gains its golden hue thanks partly to this acid that also helps give leather its color,tannic acid,NA
2007-11-22,DJ,BOOKS & AUTHORS,,NA,"James Michener's ""Centennial"" centers on a fictional town in this state",Colorado,NA
2007-11-22,DJ,SAINTS,,1600,The Pope struck a medal to celebrate the 1572 massacre of Huguenots on this saint's day,St. Bartholomew,NA
2007-11-22,DJ,"""U"" KNOW IT",,1600,"A patentable invention must be new, non-obvious, & this, like the ""arts"" the constitution encourages",useful,NA
2007-11-22,DJ,EUROPEAN HISTORY,,2000,"On Feb. 28, 1813 these 2 countries whose names rhyme teamed up against France in the Treaty of Kalisch",Russia & Prussia,NA
2007-11-22,DJ,OSCAR-NOMINATED SONGS,(Alex: You have to identify the movie for us.),2000,"""Lose Yourself""(2002)",8 Mile,NA
2007-11-22,DJ,THE SCIENCE OF LIQUOR,,NA,"After 15 years of aging, 30% of an original quantity of bourbon (the ""angels' share"") has been lost to this process",evaporation,NA
2007-11-22,DJ,BOOKS & AUTHORS,,2000,"In 2007 his book ""The Road"" earned him a Pulitzer Prize & entry into Oprah's Book Club",Cormac McCarthy,NA
2007-11-22,DJ,SAINTS,,2000,The order founded by this saint in Toulouse was zealous in carrying out the Inquisition,Saint Dominic (founder of the Dominicans),NA
2007-11-22,DJ,"""U"" KNOW IT",,2000,"Woody Guthrie sang, ""You can't scare me, I'm sticking to"" this group",the union,NA
2007-11-22,FJ,FAMOUS NAMES,,NA,"In the 19th century he created a new type of reference work, a dictionary named from the Greek for ""treasury""",Roget,NA
