date,round,category,comment,value,clue,response,link
2000-12-08,J,GREAT BRITS,,100,One of the social events of 1999 was this Spice Girl's castle wedding to soccer star David Beckham,Posh Spice,NA
2000-12-08,J,TEA TIME,,100,Spots for this brisk tea starred claymation baseball heroes Reggie Jackson & Babe Ruth,Lipton,NA
2000-12-08,J,FILL IN THE SHAKESPEARE,,100,"""Friends, Romans, Countrymen, lend me"" these",Your ears,NA
2000-12-08,J,AROUND THE COMMONWEALTH,,100,"The first people to settle this country migrated there 40,000 years ago; Europeans settled Botany Bay in 1788",Australia,NA
2000-12-08,J,THE BRITISH INVASION,,100,These “Hermits” got  their name because their lead singer resembled a character on TV's “Rocky & His Friends”,Herman\'s Hermits,NA
2000-12-08,J,"GOD SAVE THE ""QUEEN""",,100,Bogie starred in the 1951 film version of this soggy C.S. Forester novel,The African Queen,NA
2000-12-08,J,GREAT BRITS,,200,"In the 20 years before “Paradise Lost”, he was more focused on pamphleteering than poetry",Milton,NA
2000-12-08,J,TEA TIME,,200,"This rabbit was put to bed with camomile tea, but Flopsy, Mopsy & Cotton Tail had bread, milk & blackberries",Peter (Rabbit),NA
2000-12-08,J,FILL IN THE SHAKESPEARE,,200,"""All the world's"" this, ""and all the men and women merely players""",a stage,NA
2000-12-08,J,AROUND THE COMMONWEALTH,,200,"The world's seventh-largest country in size, this Commonwealth country is second by population",India,NA
2000-12-08,J,THE BRITISH INVASION,,200,Called the most successful female singer in British history she had her first U.S. No. 1 hit in 1964 with “Downtown”,Petula Clark,NA
2000-12-08,J,"GOD SAVE THE ""QUEEN""",,200,A poetic preface by Sir Walter Raleigh introduces this epic Spenser poem,The Faerie Queene,NA
2000-12-08,J,GREAT BRITS,,300,This “Arthur” co-star who died at 96 in 2000 acted onstage into his mid-80s,Sir John Gielgud,NA
2000-12-08,J,TEA TIME,,300,Tasseography is a fancy name for this divination practice,reading tea leaves,NA
2000-12-08,J,FILL IN THE SHAKESPEARE,,300,"""The play's the thing wherein I'll catch the conscience of"" this person",the king,NA
2000-12-08,J,AROUND THE COMMONWEALTH,,300,This Western Hemisphere Commonwealth nation has more lakes & inland rivers than any other country,Canada,NA
2000-12-08,J,THE BRITISH INVASION,,300,"Born in Belfast, he sang lead for the group Them before scoring hits on his own like “Brown Eyed Girl”",Van Morrison,NA
2000-12-08,J,"GOD SAVE THE ""QUEEN""",,300,"In some traditions, the Ark of the Covenant was taken to Ethiopia by Menelik, the son of Solomon & this woman",the Queen of Sheba,NA
2000-12-08,J,GREAT BRITS,,400,In the 1660s it took a “geneous” like him to show that white light is hetero-geneous,Newton,NA
2000-12-08,J,TEA TIME,,400,Earl Grey tea is flavored with oil of bergamott which is this fruit,orange,NA
2000-12-08,J,FILL IN THE SHAKESPEARE,,400,"""Once more unto"" this, ""dear friends, once more; or close the wall up with our English dead!""",the breach,NA
2000-12-08,J,AROUND THE COMMONWEALTH,,400,"English is the official language of this oil-rich country that borders Chad, NIger & Cameroon",Nigeria,NA
2000-12-08,J,THE BRITISH INVASION,,400,"Featuring a frenzied solo, this British band's “You Really Got Me” soared to No. 1",The Kinks,NA
2000-12-08,J,"GOD SAVE THE ""QUEEN""",,400,Simple curves & cabriole legs characterize this popular 18th century furniture style,Queen Anne,NA
2000-12-08,J,GREAT BRITS,,500,In 1963 Lord Denning led the official inquiry into this British government sex scandal,John Profumo Affair,NA
2000-12-08,J,TEA TIME,,500,"A word for “tea” in Asia, it's the name for a mix of black tea, milk & spices sometimes served as a latte",chai,NA
2000-12-08,J,FILL IN THE SHAKESPEARE,,NA,"These people ""die many times before their deaths""",cowards,NA
2000-12-08,J,AROUND THE COMMONWEALTH,,500,Constitutional changes in 2000 for this Asian country may help end its civil war between Tamils & Sinhalese,Sri Lanka,NA
2000-12-08,J,THE BRITISH INVASION,,500,Hits like “Tuesday Afternoon” from “Days of Future Passed” hooked this band musically into the Summer of Love,The Moody Blues,NA
2000-12-08,J,"GOD SAVE THE ""QUEEN""",,500,"You'll find its main campus in Flushing, New York",Queen\'s College,NA
2000-12-08,DJ,THE OLD TESTAMENT,,200,"Like John Henry, Jael had this in her hand & used it to nail Sisera's head to the ground",hammer,NA
2000-12-08,DJ,FILMS OF THE '70s,,200,"Sally Field won a victory for the union & an Oscar for herself, in this 1979 film",Norma Rae,NA
2000-12-08,DJ,MS. PRESIDENT,,200,"Maggie Walker was the USA's first woman president of one of these, St. Luke Penny Savings in Richmond",bank,NA
2000-12-08,DJ,TAXI!,,200,Licensed taxis in New York City are this color,yellow,NA
2000-12-08,DJ,THE ARTS,,200,This structure is a traditional part of state capitols to represent the unity of government,dome,NA
2000-12-08,DJ,RHYME TIME,,200,The purple Teletubby,Tinky Winky,NA
2000-12-08,DJ,THE OLD TESTAMENT,,400,Muscleman in the Ruben's work seen here:,Samson,NA
2000-12-08,DJ,FILMS OF THE '70s,,400,"Set during the Vietnam War, it captured 5 Oscars including one for director Michael Cimino",The Deer Hunter,NA
2000-12-08,DJ,MS. PRESIDENT,,400,Seen here she was president of her country from 1986 to 1992,Corazon Aquino,NA
2000-12-08,DJ,TAXI!,,400,You can do it to Mary or Columbia as well as to a taxi,hail,NA
2000-12-08,DJ,THE ARTS,,400,"Sam Wagstaff, a major collector of this visual art that uses silver, later turned to collecting silver",photography,NA
2000-12-08,DJ,RHYME TIME,,400,“Colorful” 1986 No. 1 album by Madonna,True Blue,NA
2000-12-08,DJ,THE OLD TESTAMENT,,NA,Moses couldn't enter the promised land after striking this to produce water instead of speaking to it,rock,NA
2000-12-08,DJ,FILMS OF THE '70s,,600,"Dennis Christopher, Dennis Quaid & Daniel Stern were cycling buddies in this coming-of-age drama",Breaking Away,NA
2000-12-08,DJ,MS. PRESIDENT,,600,She retired at age 80 as president of the National American Woman Suffrage Association,Susan B. Anthony,NA
2000-12-08,DJ,TAXI!,,600,The sitcom “Taxi” used cabs from this famous company founded in 1922,Checker,NA
2000-12-08,DJ,THE ARTS,,600,"This city's renaissance artists, like Titian & Giorgione, emphasized color more than the Florentines",Venice,NA
2000-12-08,DJ,RHYME TIME,,600,It's Ben & Jerry's banana ice cream with walnuts & pieces of dark chocolate,Chunky Monkey,NA
2000-12-08,DJ,THE OLD TESTAMENT,,800,Job lived in Uz; Abraham lived in this city of the Chaldees,Ur,NA
2000-12-08,DJ,FILMS OF THE '70s,,800,"(Hi, I'm Melody Thomas Scott from The Young and the Restless.  The answer is:)  In 1976 I appeared in John Wayne's final film, this Western in which he played a dying gunslinger",The Shootist,http://www.j-archive.com/media/2000-12-08_DJ_14.jpg
2000-12-08,DJ,MS. PRESIDENT,,800,In 1946 Sarah Blanding became the first woman president of this then 85-year-old New York women's college,Vassar,NA
2000-12-08,DJ,TAXI!,,800,"Contrary to its “roving” name, this type of cab isn't licensed to cruise the streets",Gypsy cab,NA
2000-12-08,DJ,THE ARTS,,800,"The modern dance pioneer seen here--she died in a bizarre shawl, not scarf, accident:",Isadora Duncan,http://www.j-archive.com/media/2000-12-08_DJ_23.jpg
2000-12-08,DJ,RHYME TIME,,800,A synonym for potpourri or miscellany,hodgepodge,NA
2000-12-08,DJ,THE OLD TESTAMENT,,1000,"In a showdown with the prophets of Baal, his prayer for fire was answered; theirs weren't",Elijah,NA
2000-12-08,DJ,FILMS OF THE '70s,,1000,In a 1972 comedy Alan Arkin fancied himself a casanova in “The Last of” these,the red hot lovers,NA
2000-12-08,DJ,MS. PRESIDENT,,1000,In 1954 she performed in “The Firebird” & became president of the Royal Academy of Dancing,(Dame) Margot Fonteyn,NA
2000-12-08,DJ,TAXI!,,NA,This slang word for a taxi or its driver is shortened from the name of a horse-drawn carriage,hack (from hackney),NA
2000-12-08,DJ,THE ARTS,,1000,The name of this plaster used in the 18th c. to make faux marble refers to rough exterior coating,stucco,NA
2000-12-08,DJ,RHYME TIME,,1000,"A weapon like a taser, that fires electric darts to temporarily incapacitate a person",stun gun,NA
2000-12-08,FJ,AFRICAN-AMERICAN AUTHORS,,NA,A conversation he had with Miles Davis became the first of the “Playboy Interviews” in 1962,Alex Haley,NA
