date,round,category,comment,value,clue,response,link
2000-12-19,J,AMERICAN EXPLORERS,,100,"From trips there around 1910 to get animals to stuff, Carl Akeley felt this continent's wildlife was doomed",Africa,NA
2000-12-19,J,CLASSIC TV EPISODES,,100,"1991:""A Walsh Family Christmas""","Beverly Hills, 90210",NA
2000-12-19,J,ART & ARTISTS,,100,"This Spanish surrealist collaborated on 2 films with Luis Bunuel, ""Un Chien Andalou"" & ""L'Age D'Or""",Salvador Dali,NA
2000-12-19,J,CELEBRITY ROOMMATES,,100,"Robert Duvall, Gene Hackman & this ""Graduate"" all lived together & all later won Oscars -- must've been the water",Dustin Hoffman,NA
2000-12-19,J,THAT'S SOUP-ER,,100,"A nursery rhyme says that this soup made with peas can be enjoyed hot, cold or in the pot 9 days old",Pease porridge,NA
2000-12-19,J,DID I HEAR THAT RIGHT?,,100,"""Saturday Night Live"" editorialist Emily Litella wasn't sure why all the fuss about these ""on television""",Violins,NA
2000-12-19,J,AMERICAN EXPLORERS,,200,"Looking for this legendary in-between fossil in Mongolia, Roy Chapman Andrews discovered dinosaur eggs",The Missing Link,NA
2000-12-19,J,CLASSIC TV EPISODES,,200,"1983:""Goodbye, Farewell and Amen""",M*A*S*H,NA
2000-12-19,J,ART & ARTISTS,,200,"Toulouse-Lautrec's 1892 painting ""At"" this music hall features portraits of himself, his cousin & other patrons",Moulin Rouge,NA
2000-12-19,J,CELEBRITY ROOMMATES,,200,"Until Henry Fonda got married, he lived with this actor -- what a ""Wonderful Life""",Jimmy Stewart,NA
2000-12-19,J,THAT'S SOUP-ER,,200,It's the geographic name for tomato-based clam chowder,Manhattan,NA
2000-12-19,J,DID I HEAR THAT RIGHT?,,200,"A coming-of-age novel by Bruce Ducker is titled ""Lead Us Not Into"" this NYC train depot",Penn Station,NA
2000-12-19,J,AMERICAN EXPLORERS,,300,"In 1955 Louise Boyd sent a telegram to the Society of Women Geographers, ""Flew over"" this ""yesterday""",North Pole,NA
2000-12-19,J,CLASSIC TV EPISODES,,300,"1976:""Angels in Chains""",Charlie\'s Angels,NA
2000-12-19,J,ART & ARTISTS,,300,"This Frenchman considered ""Where Do We Come From?  What Are We?  Where Are We Going?"" to be his ""Best Canvas""",Paul Gauguin,NA
2000-12-19,J,CELEBRITY ROOMMATES,,300,"TV's ""Mr. Peepers"", he was one of tough guy Marlon Brando's roommates",Wally Cox,NA
2000-12-19,J,THAT'S SOUP-ER,,300,"Chicken soup's curative powers earned it the nickname ""Jewish"" this",Penicillin,NA
2000-12-19,J,DID I HEAR THAT RIGHT?,,300,"(Hi, I'm Tony Danza)  On ""Friends"", Lisa Kudrow was convinced that this man's song ""Tiny Dancer"" was really ""Tony Danza""",Elton John,NA
2000-12-19,J,AMERICAN EXPLORERS,,400,In the 1860s William Dall explored Alaska for a U.S. company planning on linking the U.S. & Russia with this,Telegraph line,NA
2000-12-19,J,CLASSIC TV EPISODES,,400,"1997:""Never Kill A Boy on the First Date""",Buffy the Vampire Slayer,NA
2000-12-19,J,ART & ARTISTS,,NA,This Russian-born artist designed the stained glass windows for Jerusalem's Hadassah-Hebrew Medical Center,Marc Chagall,NA
2000-12-19,J,CELEBRITY ROOMMATES,,400,"Seen here, this actor got his stage name when college roomie Stanley Tucci said, ""You don't look like an Irving""",Ving Rhames,NA
2000-12-19,J,THAT'S SOUP-ER,,400,"A clear broth made by cooking veggies, poultry, meat or fish in water, it can be compressed into a concentrated cube",Bouillon,NA
2000-12-19,J,DID I HEAR THAT RIGHT?,,400,"George W. Bush once referred to these 2 trade obstacles as ""terriers & bariffs""",Tariffs & barriers,NA
2000-12-19,J,AMERICAN EXPLORERS,,500,"After being led there by a local, Hiram Bingham claimed he ""discovered"" this lost Incan city in Peru",Machu Picchu,NA
2000-12-19,J,CLASSIC TV EPISODES,,500,"1974:""Blood of the Dragon""",Kung Fu,NA
2000-12-19,J,ART & ARTISTS,,500,"In this work, Van Gogh captured the misery of a family gathered around a table dining only on a plate of spuds","""The Potato Eaters""",NA
2000-12-19,J,CELEBRITY ROOMMATES,,500,"The Coens wrote ""Raising Arizona"" for Holly Hunter after this roommate of hers got the lead in ""Blood Simple""",Frances McDormand,NA
2000-12-19,J,THAT'S SOUP-ER,,500,This celebrated seafood stew hails from Provence,Bouillabaisse,NA
2000-12-19,J,DID I HEAR THAT RIGHT?,,500,"In a 2000 film, the idiomatically challenged ""Trixie"" speaks of ""drinking yourself into"" this South American country","Bolivia (instead of ""oblivion"")",NA
2000-12-19,DJ,CHEMISTRY,,200,The heat source of a spectroscope is this type of gas burner named for German chemist Robert,Bunsen burner,NA
2000-12-19,DJ,YULETIDE FAVORITES,(Alex: That's appropriate!),200,"Title reason why ""You better watch out, you better not cry, better not pout""","""Santa Claus Is Coming to Town""",NA
2000-12-19,DJ,LITERARY HODGEPODGE,,200,"""Miss Ravenel's Conversion From Secession to Loyalty"" is John De Forest's 1867 novel about this war",Civil War,NA
2000-12-19,DJ,"THE ""ANTI""-CATEGORY",,200,An astringent applied under the arms to curtail sweating,Anti-perspirant,NA
2000-12-19,DJ,BELIZE TO MEET YOU,,200,"Belize City, the country's largest city, lies on this sea",Caribbean Sea,NA
2000-12-19,DJ,HOPE YOU GUESS MY NAME,,200,In 1986 this man married the woman who thus became the Duchess of York,Prince Andrew,NA
2000-12-19,DJ,CHEMISTRY,,400,It's the branch of chemistry generally concerned with non-carbon elements & their compounds,Inorganic chemistry,NA
2000-12-19,DJ,YULETIDE FAVORITES,(Alex: That's appropriate!),400,"Weather condition on Christmas Eve when Santa asked Rudolph, ""Won't you guide my sleigh tonight?""",Foggy,NA
2000-12-19,DJ,LITERARY HODGEPODGE,,400,"In Willa Cather's ""Shadows on the Rock"", the ""Rock"" is this French-Canadian city",Quebec City,NA
2000-12-19,DJ,"THE ""ANTI""-CATEGORY",,400,A disappointing end after a big buildup,Anti-climax,NA
2000-12-19,DJ,BELIZE TO MEET YOU,,400,Name of the Indians who lived in Belize before Europeans came & of the mountains where Victoria's Peak is found,Mayans,NA
2000-12-19,DJ,HOPE YOU GUESS MY NAME,,400,"This big, ""bad"" band leader, seen here, was born in Strasburg, North Dakota in 1903",Lawrence Welk,NA
2000-12-19,DJ,CHEMISTRY,,600,This element makes up about 78% of normal dry air by volume,Nitrogen,NA
2000-12-19,DJ,YULETIDE FAVORITES,(Alex: That's appropriate!),600,"(Here comes the clue with Tony Bennett.)  My Christmas album ""Snowfall"" includes this song that mentions ""warm woolen mittens""","""My Favorite Things""",http://www.j-archive.com/media/2000-12-19_DJ_18.jpg
2000-12-19,DJ,LITERARY HODGEPODGE,,600,"He used his poem ""The Road Not Taken"" as the opening poem in his collection ""Mountain Interval""",Robert Frost,NA
2000-12-19,DJ,"THE ""ANTI""-CATEGORY",,600,"Sherman's ""Act"" of 1890",Anti-Trust Act,NA
2000-12-19,DJ,BELIZE TO MEET YOU,,600,Belize lies on the southeast coast of this peninsula,Yucatan Peninsula,NA
2000-12-19,DJ,HOPE YOU GUESS MY NAME,,600,In 1633 the Catholic Church found him guilty of teaching heresy; in 1992 they admitted they were wrong,Galileo,NA
2000-12-19,DJ,CHEMISTRY,,NA,"For ice, it's 6 degrees Celsius; for tungsten, it's 3,410 degrees Celsius",Melting point,NA
2000-12-19,DJ,YULETIDE FAVORITES,(Alex: That's appropriate!),800,"Based on verses from Psalm 98, it contains the line ""Let Earth receive her king""","""Joy to the World""",NA
2000-12-19,DJ,LITERARY HODGEPODGE,,800,"Her book ""Taltos: Lives of the Mayfair Witches"" would be perfect to read during ""The Witching Hour""",Anne Rice,NA
2000-12-19,DJ,"THE ""ANTI""-CATEGORY",,800,"Signed May 26, 1972 , it's abbreviated as the ABM Treaty",Anti-Ballistic Missile Treaty,NA
2000-12-19,DJ,BELIZE TO MEET YOU,,800,"Until 1991 this neighboring country didn't recognize Belize's independence, asserting claims from the 1800s",Guatemala,NA
2000-12-19,DJ,HOPE YOU GUESS MY NAME,,800,"One of the couple seen here who assumed their historic duties November 12, 1990(in Tokyo)",Emperor Akihito or Empress Michiko,NA
2000-12-19,DJ,CHEMISTRY,,1000,"It's an atom that has gained or lost one or more electrons, & carries a positive or a negative charge",Ion,NA
2000-12-19,DJ,YULETIDE FAVORITES,(Alex: That's appropriate!),1000,"In December 1957 Bobby Helms had his biggest pop hit with this song; it must have been ""the right time""","""Jingle Bell Rock""",NA
2000-12-19,DJ,LITERARY HODGEPODGE,,1000,"This Lake poet's autobiographical poem ""The Prelude, or, Growth of A Poet's Mind"" was published in 1850, after his death",William Wordsworth,NA
2000-12-19,DJ,"THE ""ANTI""-CATEGORY",,1000,"A central character without traditional attributes, like Yossarian in ""Catch-22""",Anti-hero,NA
2000-12-19,DJ,BELIZE TO MEET YOU,,NA,"In 1862 Belize was proclaimed a colony under this name; in 1871, a crown colony",British Honduras,NA
2000-12-19,DJ,HOPE YOU GUESS MY NAME,,1000,"On January 4, 1995 he became speaker of the U.S. House of Representatives",Newt Gingrich,NA
2000-12-19,FJ,POLITICAL HISTORY,,NA,"Between 1894 & 1901 adherents of this political theory killed the heads of state of France, Spain, Italy & the U.S.",Anarchy,NA
