date,round,category,comment,value,clue,response,link
2001-01-19,J,THE AFI'S 100 GREATEST AMERICAN MOVIES,(AFI: American Film Institute),100,"He directed 5 of the movies on the list including No. 9, ""Schindler's List""",Steven Spielberg,NA
2001-01-19,J,INTERNET SHORTHAND,,100,FYI,For Your Information,NA
2001-01-19,J,BAG LADIES,,100,Judith Leiber makes tiny evening bags from the skin of this largest bird,Ostrich,NA
2001-01-19,J,"""W""ORDS",,100,The vernal equinox signals the end of this in the Northern Hemisphere,Winter,NA
2001-01-19,J,TEMPERATURE,,100,"When taken orally, it's the average body temperature of a healthy human at rest",98.6 F.,NA
2001-01-19,J,CLIMB IT,,100,"You can climb to the crown of this NYC landmark but you have to take the stairs, all 354 of them!",Statue of Liberty,NA
2001-01-19,J,THE AFI'S 100 GREATEST AMERICAN MOVIES,(AFI: American Film Institute),200,1 of only 2 animated films on the list,Fantasia (or Snow White),NA
2001-01-19,J,INTERNET SHORTHAND,,200,PLS,Please,NA
2001-01-19,J,BAG LADIES,,200,Hermes named a popular bag after this '50s film star turned princess,Grace Kelly,NA
2001-01-19,J,"""W""ORDS",,200,Walk like a duck,Waddle,NA
2001-01-19,J,TEMPERATURE,,200,"On the Fahrenheit scale, water freezes at 32 degrees & boils at this temperature",212,NA
2001-01-19,J,CLIMB IT,,200,"The Hillary Step, a 40-foot spur of snow & ice, is the last obstacle you must climb before reaching its summit",Mount Everest,NA
2001-01-19,J,THE AFI'S 100 GREATEST AMERICAN MOVIES,(AFI: American Film Institute),300,This classic seen here is planted firmly at No. 21,The Grapes of Wrath,NA
2001-01-19,J,INTERNET SHORTHAND,,300,OTOH,On the other hand,NA
2001-01-19,J,BAG LADIES,,300,"A bag owned by this woman who ""handbagged"" British political foes was purchased in 2000 for $150,000",Margaret Thatcher,NA
2001-01-19,J,"""W""ORDS",,300,"They might be giants, but in Don Quixote's case, he was tilting at these",Windmills,NA
2001-01-19,J,TEMPERATURE,,300,"Term for the increase in the Earth's average temperature; by 2100, the Earth may be 3 to 8 degrees hotter",Global warming,NA
2001-01-19,J,CLIMB IT,,300,"When attempting this African mountain, use the Marangu Route; you'll find it's the easiest & most comfortable",Mount Kilimanjaro,NA
2001-01-19,J,THE AFI'S 100 GREATEST AMERICAN MOVIES,(AFI: American Film Institute),400,This Oscar-winning western from 1992 rode in at No. 98 on the list,Unforgiven,NA
2001-01-19,J,INTERNET SHORTHAND,,400,FCOL,For cryin\' out loud,NA
2001-01-19,J,BAG LADIES,,400,These bags as sold by Karen Millen are more chic than those given away on PBS pledge drives,Tote bags,NA
2001-01-19,J,"""W""ORDS",,400,"Ah-one & ah-two, it's the marine snail in the photo looking at you",Whelk,NA
2001-01-19,J,TEMPERATURE,,400,"At 136 degrees F., the hottest place ever recorded on Earth was near Tripoli in this country in 1922",Libya,NA
2001-01-19,J,CLIMB IT,,400,You might follow in astronaut James Irwin's footsteps up this mountain in search of Noah's Ark,Mount Ararat,NA
2001-01-19,J,THE AFI'S 100 GREATEST AMERICAN MOVIES,(AFI: American Film Institute),NA,This 1972 movie is No. 3 on the list; its sequel is No. 32,The Godfather,NA
2001-01-19,J,INTERNET SHORTHAND,,500,GG,Got to go,NA
2001-01-19,J,BAG LADIES,,500,Stars like Julianne Moore have advertised leather bags for this company whose name is a type of transport,Coach,NA
2001-01-19,J,"""W""ORDS",,500,"Don't let dull knives dampen your spirit, use one of these abrasive items to sharpen them",Whetstone,NA
2001-01-19,J,TEMPERATURE,,500,In 1971 Prospect Creek in this state reached a record low temperature in the U.S. of -80 degrees F.,Alaska,NA
2001-01-19,J,CLIMB IT,,500,You'll see some Inca ruins during the 1-hour climb to the top of Huayna Picchu in this country,Peru,NA
2001-01-19,DJ,LITERARY RELATIVES,,200,"He was born in Dublin, the son of noted Irish painter John Butler Yeats",William Butler Yeats,NA
2001-01-19,DJ,INTERNATIONAL ATHLETES,,200,"At the 1998 Winter Olympics, ""Happy"" Harada helped this home team win gold in ski jumping",Japan,NA
2001-01-19,DJ,ANCIENT PLACES,,200,This Greek city didn't allow deformed children to live & boys began military training at age 7,Sparta,NA
2001-01-19,DJ,GEOLOGY,,200,"One of these struck Boston in 1755, Missouri in 1811 & Charleston in 1886, so it's not west coast-specific",Earthquake,NA
2001-01-19,DJ,ART & ARTISTS,,200,"Gauguin collected art by painters of this movement, like Pissarro & Monet & exhibited with them from 1880 to 1882",Impressionism,NA
2001-01-19,DJ,LETTER DROP,,200,"From a winning finish in a race, drop this letter to get a closed hand",R (first/fist),NA
2001-01-19,DJ,LITERARY RELATIVES,,400,"These brothers known for their 1857 collection of ""fairy tales"" shared the middle name Karl",Grimm brothers,NA
2001-01-19,DJ,INTERNATIONAL ATHLETES,,400,Byron & Wayne Black are tennis stars from this country that wasn't kind to blacks when it was Rhodesia,Zimbabwe,NA
2001-01-19,DJ,ANCIENT PLACES,,400,"Around 480 B.C. this north African city-state was not so Puny-c;, it controlled most of the western Mediterranean",Carthage,NA
2001-01-19,DJ,GEOLOGY,,400,"Of the 3 main classes of rock, this one accounts for about 75% of all the exposed rocks on land",Sedimentary,NA
2001-01-19,DJ,ART & ARTISTS,,400,Bernini designed the colonnade around the piazza at this basilica to represent the church's embrace,St. Peter\'s Basilica,NA
2001-01-19,DJ,LETTER DROP,,400,"From a 2-wheeled horse-drawn vehicle, drop this letter to get a 4-wheeled power vehicle",T (cart/car),NA
2001-01-19,DJ,LITERARY RELATIVES,,600,"This ""Fahrenheit 451"" author's ancestors include a woman who was tried for witchcraft in Salem, Mass.",Ray Bradbury,NA
2001-01-19,DJ,INTERNATIONAL ATHLETES,,600,"Spanish golfing phenom Sergio Garcia has this ""weathered"" nickname meaning ""The Boy Child""","""El Nino""",NA
2001-01-19,DJ,ANCIENT PLACES,,600,This first capital of ancient Egypt was at the apex of the Nile delta,Memphis,NA
2001-01-19,DJ,GEOLOGY,,NA,"From the Greek kryos, ""ice"", it's the shape a mineral grows into when unrestricted",Crystal,NA
2001-01-19,DJ,ART & ARTISTS,,600,"A landscape by this ""elder"" Flemish painter is seen here",Pieter Bruegel the Elder,NA
2001-01-19,DJ,LETTER DROP,,600,Drop this letter from 30 days to get a lepidopteran,N (month/moth),NA
2001-01-19,DJ,LITERARY RELATIVES,,800,"When Elinor Wylie married William Rose Benet, she became the sister-in-law of this poet & novelist",Stephen Vincent Benet,NA
2001-01-19,DJ,INTERNATIONAL ATHLETES,,800,"7'2"" Dikembe Mutombo led the NBA in this defensive move 3 straight years, 1994-1996",Blocked shots,NA
2001-01-19,DJ,ANCIENT PLACES,,800,"Lycia, like Nicaea, was in what's now this Eurasian country",Turkey,NA
2001-01-19,DJ,GEOLOGY,,800,Term for a plate pulling apart; a great valley in Africa has been formed by & named for it,Rift/rifting,NA
2001-01-19,DJ,ART & ARTISTS,,800,"This Belgian surrealist painted a pipe & the words ""Ceci n'est pas une pipe"" (""This is not a pipe"")",Rene Magritte,NA
2001-01-19,DJ,LETTER DROP,,800,"From darkness or depression, drop this letter to get a weaving apparatus",G (gloom/loom),NA
2001-01-19,DJ,LITERARY RELATIVES,,1000,"This author of ""The Virginian"" was the grandson of famed 19th century British actress Fanny Kemble",Owen Wister,NA
2001-01-19,DJ,INTERNATIONAL ATHLETES,,1000,"Boxer Roberto Duran became a national hero in this, his native country",Panama,NA
2001-01-19,DJ,ANCIENT PLACES,,NA,"Not to inflate its importance, but this top city in Phoenicia was trading with Spain by 800 B.C.",Tyre,NA
2001-01-19,DJ,GEOLOGY,,1000,1 of the 3 minerals on the Mohs scale that can be scratched with a copper penny,"Calcite, gypsum or talc",NA
2001-01-19,DJ,ART & ARTISTS,,1000,Around 1884 Edgar Degas painted the portrait seen here of this fellow impressionist,Mary Cassatt,NA
2001-01-19,DJ,LETTER DROP,,1000,Drop this letter from quick & active to get a Jewish circumcision,K (brisk/bris),NA
2001-01-19,FJ,BALLET,,NA,"Russian, Chinese, Arabian & Spanish dances are highlights of this ballet that premiered December 18, 1892",The Nutcracker,NA
