date,round,category,comment,value,clue,response,link
2008-01-18,J,WATER UNDER THE BRIDGE,,200,Beneath the Tower Bridge in London:this river,the Thames,NA
2008-01-18,J,FILMS FROM COMIC BOOKS,,200,Jake Gyllenhaal was reportedly ready to take over this role after Tobey Maguire suffered back pains,Spider-Man,NA
2008-01-18,J,BOOK KNOWLEDGE,,200,A book's backstrip covers the part that has this anatomical name,the spine,NA
2008-01-18,J,YOU ARE WHAT YOU EAT,,200,"Ah yes, my sweet, if you eat this sticky liquid, comb & all, I'll definitely call you my this",honey,NA
2008-01-18,J,HAYDN,,200,"Joseph Haydn was born in 1732 in Rohrau, 25 miles east of this world capital to which he moved in 1740",Vienna,NA
2008-01-18,J,SEEK,,200,"Many have sought this creature of the Pacific NW; at 7 to 10 ft. tall & about 500 lbs., you'd think he'd be easy to find",Bigfoot,NA
2008-01-18,J,WATER UNDER THE BRIDGE,,400,Beneath Patna's Mahatma Gandhi Bridge:this river,the Ganges,NA
2008-01-18,J,FILMS FROM COMIC BOOKS,,400,"Severely underweight from his role in ""The Machinist"", Christian Bale gained 100 pounds to play this role",Batman,NA
2008-01-18,J,BOOK KNOWLEDGE,,400,"Shakespeare wrote, ""What's past is"" this introductory part of a book",prologue,NA
2008-01-18,J,YOU ARE WHAT YOU EAT,,400,"Eat too many of this ""original goumet jelly bean"" & its name may describe your tummy",a Jelly Belly,NA
2008-01-18,J,HAYDN,,400,Let me pump... you up (with info)--Joseph Haydn's middle name; this was his first name,Franz,NA
2008-01-18,J,SEEK,,400,This sought-after spring was thought to be on Bimini; Ponce De Leon then sought Bimini but found Florida instead,the Fountain of Youth,NA
2008-01-18,J,WATER UNDER THE BRIDGE,,600,Under the Brooklyn Bridge:this river,the East River,NA
2008-01-18,J,FILMS FROM COMIC BOOKS,,600,Ths title heroine played by Halle Berry has vertical pupils & a penchant for tuna,Catwoman,NA
2008-01-18,J,BOOK KNOWLEDGE,,600,"Mulvany, Nancy, 177;birth of, 28;education of, 213;as expert in creating these, 326-331",an index,NA
2008-01-18,J,YOU ARE WHAT YOU EAT,,600,"If I eat a frankfurter before I show off my skiing stunts, you have every reason to call me one of these",a hot dog,NA
2008-01-18,J,HAYDN,,600,"In 1781 Haydn befriended this composer from Salzburg, 10 years before his all-too-premature death",Mozart,NA
2008-01-18,J,SEEK,,NA,"In 2003 the BBC did an extensive sonar search for this creature, first reported in 565 A.D.",the Loch Ness Monster,NA
2008-01-18,J,WATER UNDER THE BRIDGE,,800,Beneath the Tacoma Narrows Bridge:this inlet,Puget Sound,NA
2008-01-18,J,FILMS FROM COMIC BOOKS,,800,"The 2007 ""Fantastic Four"" sequel was subtitled ""Rise of"" this galactic traveler",the Silver Surfer,NA
2008-01-18,J,BOOK KNOWLEDGE,,800,"A colophon is a section at the end of a book that often names this, like 10-point Baskerville",the font,NA
2008-01-18,J,YOU ARE WHAT YOU EAT,,800,"Lewis Browning ate more than 22,000 of these creme-filled Hostess cakes; if you did the same, I'd call you one",a Twinkie,NA
2008-01-18,J,HAYDN,,800,"Haydn's ""Farewell"" Symphony was written this period in his work that translates into ""storm & stress""",Sturm und Drang,NA
2008-01-18,J,SEEK,,800,Many have looked for this legendary item on Mount Ararat; others think it's in Kurdistan,Noah\'s Ark,NA
2008-01-18,J,WATER UNDER THE BRIDGE,,1000,Under the Sunshine Skyway Bridge:this bay,Tampa Bay,NA
2008-01-18,J,FILMS FROM COMIC BOOKS,,1000,"In a 2003 film this blind superhero, the ""Man Without Fear"", battled Bullseye & a NYC crimelord called the Kingpin",Daredevil,NA
2008-01-18,J,BOOK KNOWLEDGE,,1000,"Entomological name for a blank page at the start of a book, suitable for inscriptions",the fly (or the fly leaf),NA
2008-01-18,J,YOU ARE WHAT YOU EAT,,1000,"If you spend your last dime on one of these New Orleans-style hero sandwiches, you really will turn into one",a poor boy,NA
2008-01-18,J,HAYDN,,1000,Symphony No. 94 is called this for its unexpected loud chord shortly after the soft beginning of the 2nd movement,"the ""Surprise Symphony""",NA
2008-01-18,J,SEEK,,1000,"In 1590 a storm forced Gov. John White to abandon his search for members of this colony, who were never seen again",Roanoke,NA
2008-01-18,DJ,PHOTOGRAPHY,,400,"""Men at Work"" is a 1932 book containing Lewis Hines' 1930 photos chronicling the construction of this skyscraper",the Empire State Building,NA
2008-01-18,DJ,TOUGH TUNES,,400,"The Godfather of Soul, James Brown ""Can't dance"" because of these ""in his pants""",ants,NA
2008-01-18,DJ,POTENT POTABLES,,400,"If 007 is coming over, better read the book ""Shaken Not Stirred: A Celebration of"" this cocktail",the martini,NA
2008-01-18,DJ,13-LETTER WORDS,,400,"From a Washington Irving character, it's a nickname for a New Yorker, Dutch-descended or otherwise",a knickerbocker,NA
2008-01-18,DJ,LITERARY GREAT ESCAPES,,400,"In this 1852 work, Eliza makes a harrowing escape across a frozen river from a slave trader named Haley",Uncle Tom\'s Cabin,NA
2008-01-18,DJ,YOU'VE BEEN EXILED,,400,"Later to run a pizza parlor in Virginia, Nguyen Ngoc Loan uses a gun in an infamous photo taken in this city in 1968",Saigon,NA
2008-01-18,DJ,PHOTOGRAPHY,,800,"(Kelly of the Clue Crew gets nearer, much larger.)  It's the camera attachment that accounts for the way you're seeing me right now",a fisheye lens,http://www.j-archive.com/media/2008-01-18_DJ_22.jpg
2008-01-18,DJ,TOUGH TUNES,,800,"Vanessa Williams sang, ""Just when I thought our chance had passed, you go and"" do this",save the best for last,NA
2008-01-18,DJ,POTENT POTABLES,,800,"In cockney rhyming slang, this liquor is a ""gay & frisky""",whiskey,NA
2008-01-18,DJ,13-LETTER WORDS,,800,"On completing law school, you're likely to receive a J.D., a doctor of this degree",jurisprudence,NA
2008-01-18,DJ,LITERARY GREAT ESCAPES,,800,"By clinging to the belly of a ram, this mythological figure escaped from the cave of the cyclops",Odysseus,NA
2008-01-18,DJ,YOU'VE BEEN EXILED,,800,"This country's first president, Syngman Rhee, fled the country in 1960 & died in 1965 in exile in Hawaii",South Korea,NA
2008-01-18,DJ,PHOTOGRAPHY,,1200,In 1907 2 French brothers with this last name marketed their autochrome glass plates to produce color photos,Lumière,NA
2008-01-18,DJ,TOUGH TUNES,,1200,"In a Michael Martin Murphey song, this title horse ""busted down its stall / in a blizzard he was lost""",Wildfire,NA
2008-01-18,DJ,POTENT POTABLES,,1200,Searching for fine tequila?  Look for a label that says it's 100% this color agave,blue,NA
2008-01-18,DJ,13-LETTER WORDS,,1200,"(Jon of the Clue Crew plop, plops 2 tablets in a glass; they fizz, fizz.)  When you drop Alka-Seltzer in water, a series of reactions, including the release of carbon dioxide, creates this bubbly effect, from the Latin for ""begin to boil""",effervescence,http://www.j-archive.com/media/2008-01-18_DJ_28.wmv
2008-01-18,DJ,LITERARY GREAT ESCAPES,,NA,Henri Charriere recounted his numerous escape attempts from French prisons in South America in this work,Papillon,NA
2008-01-18,DJ,YOU'VE BEEN EXILED,,1200,"In 1973, 14 years after his overthrow, this Cuban dictator died in exile in Spain",Batista,NA
2008-01-18,DJ,PHOTOGRAPHY,,NA,"From the Latin for ""to open"", it's the camera part that controls the intensity of light striking the film",aperture,NA
2008-01-18,DJ,TOUGH TUNES,,1600,"Neil Diamond sang that a woman from this state ""shines with her own kind of light""",Kentucky,NA
2008-01-18,DJ,POTENT POTABLES,,1600,"This word for a sweetened mixture of rum, beer & beaten egg can also mean a turned-up hairstyle",a flip,NA
2008-01-18,DJ,13-LETTER WORDS,,1600,It's one who compiles a dictionary,lexicographer,NA
2008-01-18,DJ,LITERARY GREAT ESCAPES,,1600,"In ""The Deerslayer"", this character escapes from the Hurons when Chingachgook helps to free him",Natty Bumppo,NA
2008-01-18,DJ,YOU'VE BEEN EXILED,,1600,"During exile in the U.S. in 1915, ex-prez Victoriano Huerta of this country was thrown in prison",Mexico,NA
2008-01-18,DJ,PHOTOGRAPHY,,2000,Her first photo-essay appeared in Esquire in 1960; much of her work thereafter depicted human oddities,(Diane) Arbus,NA
2008-01-18,DJ,TOUGH TUNES,,2000,"In a Led Zeppelin tune, Robert Plant was ""packin'"" his ""bags for"" these title mountains, familiar to Tolkien fans",the Misty Mountains,NA
2008-01-18,DJ,POTENT POTABLES,,2000,A Harvey Wallbanger just won't have the right bang without this yellow liqueur,Galliano,NA
2008-01-18,DJ,13-LETTER WORDS,,2000,"From the Greek word for ""scale"", it's the term for a butterfly or moth expert",a lepidopterist,NA
2008-01-18,DJ,LITERARY GREAT ESCAPES,,2000,Pangloss keeps his incorrigible optimism intact when he escapes an incompetent hangman's noose in this satire,Candide,NA
2008-01-18,DJ,YOU'VE BEEN EXILED,,2000,"Napoleon's oldest brother, he spent many years in exile in New Jersey following Waterloo",Joseph,NA
2008-01-18,FJ,BIBLICAL NAMES,,NA,"The name of this rebellious young man of the Old Testament can be translated from the Hebrew as ""father of peace""",Absalom,NA
