date,round,category,comment,value,clue,response,link
2000-11-16,J,MOUNTAINS,,100,"Jon Krakauer gave a personal account of the 1996 disaster on this mountain in the book ""Into Thin Air""",Mount Everest,NA
2000-11-16,J,COLLEGE HODGEPODGE,,100,Trojan Family is the alumni magazine of this university,USC (University of Southern California),NA
2000-11-16,J,STARS IN MUSIC VIDEOS,,100,"Rebecca Gayheart plays one of these in Train's ""Meet Virginia"", but turns in her order pad at the end of the song",Waitress,NA
2000-11-16,J,STATE NICKNAMES,,100,"""Little Rhody""",Rhode Island,NA
2000-11-16,J,BETWEEN WORLD WARS,,100,"A 1925 storm spelled disaster for the helium-filled Shenandoah, one of these transports",Zeppelin/airship,NA
2000-11-16,J,10-LETTER WORDS,,100,"It can mean lasting 100 years, or a 100th anniversary celebration",Centennial,NA
2000-11-16,J,MOUNTAINS,,200,Yosemite National Park is located in this California mountain range,Sierra Nevadas,NA
2000-11-16,J,COLLEGE HODGEPODGE,,200,"In 1938 a Fredericksburg, VA. college was renamed to honor Mary Washington, this relative of George",His mother,NA
2000-11-16,J,STARS IN MUSIC VIDEOS,,200,"LFO's ""Girl on TV"" is this girl who has the time of her life in Neutrogena ads",Jennifer Love Hewitt,NA
2000-11-16,J,STATE NICKNAMES,,200,"""The Sooner State""",Oklahoma,NA
2000-11-16,J,BETWEEN WORLD WARS,,200,"The Allies had a ""fixed"" income after WWI, asking 132 billion marks in these German compensation payments",Reparations,NA
2000-11-16,J,10-LETTER WORDS,,200,It's the longest side of a right triangle,Hypotenuse,NA
2000-11-16,J,MOUNTAINS,,300,"This country's highest peak, Mount Elbrus, lies in the Caucasus Mountains on the Georgian border",Russia,NA
2000-11-16,J,COLLEGE HODGEPODGE,,300,"(Hi, I'm Margaret Bickers, a contestant in the 1992 Jeopardy! college tournament, now a pilot in Iowa.)  This government agency runs a center for aviation systems reliability at Iowa State",FAA (Federal Aviation Administration),http://www.j-archive.com/media/2000-11-16_J_14.jpg
2000-11-16,J,STARS IN MUSIC VIDEOS,,300,"Appearing in ""Real Love"" by Slaughter, she's been leading a ""Charmed"" life since ""90210""",Shannen Doherty,NA
2000-11-16,J,STATE NICKNAMES,,300,"""The Razorback State""",Arkansas,NA
2000-11-16,J,BETWEEN WORLD WARS,,300,"In 1924 Ramsay MacDonald, son of a servant girl, became Britain's first PM from this working man's party",Labour,NA
2000-11-16,J,10-LETTER WORDS,,300,This branch of medicine deals with the diseases & functions of the heart,Cardiology,NA
2000-11-16,J,MOUNTAINS,,400,This Philippine mountain hadn't erupted for more than 600 years when it became active in 1991,Mount Pinatubo,NA
2000-11-16,J,COLLEGE HODGEPODGE,,400,30% of Bryn Mawr students spend at least one semester abroad during this year of study,Junior year,NA
2000-11-16,J,STARS IN MUSIC VIDEOS,,400,"""Halo"" by Depeche Mode has good karma with this TV Dharma",Jenna Elfman,NA
2000-11-16,J,STATE NICKNAMES,,400,"""The Badger State""",Wisconsin,NA
2000-11-16,J,BETWEEN WORLD WARS,,400,"He's the bright light of '20s lit, seen here",F. Scott Fitzgerald,NA
2000-11-16,J,10-LETTER WORDS,,400,"In a children's song, this bird ""sits in the old gum tree""",Kookaburra,NA
2000-11-16,J,MOUNTAINS,,NA,"The Athabascan name for this North American mountain means ""The Great One""",Mount McKinley/Mount Denali,NA
2000-11-16,J,COLLEGE HODGEPODGE,,500,"Founded in 1861, this Poughkeepsie school became the first of the Seven Sisters to go co-ed, with 40 WWII veterans",Vassar College,NA
2000-11-16,J,STARS IN MUSIC VIDEOS,,500,"You can see this actress, film's Wednesday Addams, any day in Moby's ""Natural Blues""",Christina Ricci,NA
2000-11-16,J,STATE NICKNAMES,,500,"""The Cowboy State""",Wyoming,NA
2000-11-16,J,BETWEEN WORLD WARS,,500,"In 1933 the League of Nations voted 42-1 to condemn the invasion of Manchuria, the 1 being this invader",Japan,NA
2000-11-16,J,10-LETTER WORDS,,500,"From the Latin for ""growing up"", it's another term for a teen",Adolescent,NA
2000-11-16,DJ,CHEMISTRY,,200,"Carbon in this form has every atom linked tetrahedrally to 4 others, making it really hard",Diamond,NA
2000-11-16,DJ,LIGHTS!  CAMERA!  ACTION MOVIE!,,200,"As Annie, the reluctant bus driver, Sandra Bullock ground through the gears in this 1994 action hit",Speed,NA
2000-11-16,DJ,FROM THE KORAN,,200,"The Koran begins, ""In the name of"" him, ""most benevolent, ever-merciful""",Allah,NA
2000-11-16,DJ,GOVERNMENT & POLITICS,,200,This cabinet department leases offshore areas for oil & natural gas drilling,Department of the Interior,NA
2000-11-16,DJ,RATS!,,200,"Like deer, male rats are called bucks & female rats are called these",Does,NA
2000-11-16,DJ,"""V"" SHALL SEE",,200,Mr. Spock's home planet,Vulcan,NA
2000-11-16,DJ,CHEMISTRY,,400,"Usually colorless, this liquid is the simplest oxygen hydride",Water,NA
2000-11-16,DJ,LIGHTS!  CAMERA!  ACTION MOVIE!,,400,"Like Scotland in 1995, the American colonies are defended by Mel Gibson in this jingoistic 2000 epic",The Patriot,NA
2000-11-16,DJ,FROM THE KORAN,,400,"""Those who were arrogant...were seized by"" this disaster & ""lay overturned on the ground in their homes""",Earthquake,NA
2000-11-16,DJ,GOVERNMENT & POLITICS,,400,In 1998 2 men were elected governor who were not Republican or Democrat: Angus King & this man,Jesse Ventura,NA
2000-11-16,DJ,RATS!,,400,"Of 5 weeks, 5 months or 5 years, the earliest age at which a rat can begin breeding",5 weeks,NA
2000-11-16,DJ,"""V"" SHALL SEE",,400,"From the French for ""to see"", it's a Peeping Tom",Voyeur,NA
2000-11-16,DJ,CHEMISTRY,,600,"I got an F in chemistry, this F, a gas",Fluorine,NA
2000-11-16,DJ,LIGHTS!  CAMERA!  ACTION MOVIE!,,600,Arnold Schwarzenegger has come back several times as one of these deadly title movie robots,The Terminator,NA
2000-11-16,DJ,FROM THE KORAN,,600,The title given to chapter 47 is the name of this prophet,Mohammed,NA
2000-11-16,DJ,GOVERNMENT & POLITICS,,NA,Minimum number of electoral votes a state may have,3 (2 senators & 1 representative),NA
2000-11-16,DJ,RATS!,,600,"Ratborne diseases include typhus, rabies & this type of plague AKA the ""Black Death"" of medieval times",Bubonic plague,NA
2000-11-16,DJ,"""V"" SHALL SEE",,NA,"Meaning word-for-word, it's also a brand of computer disk",Verbatim,NA
2000-11-16,DJ,CHEMISTRY,,800,"""Willie was a chemist, but Willie is no more, what Willie thought was H2O was"" this",H2SO4 (Sulfuric acid),NA
2000-11-16,DJ,LIGHTS!  CAMERA!  ACTION MOVIE!,,800,"$20 million was ""Gone"" from producers' pockets to pay Nicolas Cage's salary in this 2000 actioner",Gone in 60 Seconds,NA
2000-11-16,DJ,FROM THE KORAN,,800,"""We sent Moses and"" this brother ""to Pharaoh and his nobles""",Aaron,NA
2000-11-16,DJ,GOVERNMENT & POLITICS,,800,"Created July 24, 1789, it's the main committee in the House that deals with tax bills",Ways and Means,NA
2000-11-16,DJ,RATS!,,800,The highly adaptable brown rat also has the name of this Scandinavian country,Norway rat,NA
2000-11-16,DJ,"""V"" SHALL SEE",,800,Destructive animals or insects,Vermin,NA
2000-11-16,DJ,CHEMISTRY,,1000,Colorful last name of the man famous for describing the motion of small particles in a gas or liquid,Brown,NA
2000-11-16,DJ,LIGHTS!  CAMERA!  ACTION MOVIE!,,1000,"This man directed the action hits ""Just Heroes"" & ""The Killer"" in Hong Kong before directing ""M:I-2"" in the U.S.",John Woo,NA
2000-11-16,DJ,FROM THE KORAN,,1000,"""We enjoined upon Abraham and"" this son ""to keep our house immaculate""",Ishmael,NA
2000-11-16,DJ,GOVERNMENT & POLITICS,,1000,This South Dakota Democrat has been minority leader in the U.S. Senate since 1995,Tom Daschle,NA
2000-11-16,DJ,RATS!,,1000,"Rats are members of this order of mammals whose name is from the Latin for ""gnaw""",Rodentia (rodents),NA
2000-11-16,DJ,"""V"" SHALL SEE",,1000,In mathematics it's a quantity involving both direction & magnitude,Vector,NA
2000-11-16,FJ,HISTORIC TITLES,,NA,"Since 1578, only 14 men have held this title, including a 1989 Nobel Prize winner",The Dalai Lama,NA
