date,round,category,comment,value,clue,response,link
2000-11-20,J,ROCK ME,,100,"Michelangelo made ""David"", seen here, from this rock",Marble,NA
2000-11-20,J,2000 COMMENCEMENT SPEAKERS,,100,This Jell-O pudding pitchman said the darnedest things to kids at Xavier University's commencement,Bill Cosby,NA
2000-11-20,J,PRESIDENTIAL NICKNAMES,,100,"His hunting rifle accessory made him ""Telescope Teddy""",Teddy Roosevelt,NA
2000-11-20,J,POETS & POETRY,,100,"Most of this ""Color Purple"" author's first volume of poetry, ""Once"", was written in one week in 1964",Alice Walker,NA
2000-11-20,J,COLLEGE FOOTBALL,,100,"Term for a player who isn't recruited, but just ""ambles"" onto the field to try out",Walk-on,NA
2000-11-20,J,MONEY TALKS,,100,"One ""saved is"" one ""earned""",A penny,NA
2000-11-20,J,ROCK ME,,200,It's molten rock below ground,Magma,NA
2000-11-20,J,2000 COMMENCEMENT SPEAKERS,,200,Graduates of Middlebury College in Vermont listened to this former president -- of Poland,Lech Walesa,NA
2000-11-20,J,PRESIDENTIAL NICKNAMES,,200,"He was ""Haberdasher Harry""",Harry S. Truman,NA
2000-11-20,J,POETS & POETRY,,200,"""Howl"", his first book of poetry, was published by City Lights, a bookstore owned by poet Lawrence Ferlinghetti",Allen Ginsberg,NA
2000-11-20,J,COLLEGE FOOTBALL,,200,Mississippi State is represented by this persistent creature seen here,Bulldog,NA
2000-11-20,J,MONEY TALKS,,200,It's an old warning said on parting about not accepting false five-cent pieces,"""Don\'t take any wooden nickels""",NA
2000-11-20,J,ROCK ME,,300,"A basic copper aluminum phosphate, it's the type of stone used here in an ancient Aztec ornament",Turquoise,NA
2000-11-20,J,2000 COMMENCEMENT SPEAKERS,,300,"This author took ""The Firm"" stance of telling Arkansas State grads to ""leave the country""",John Grisham,NA
2000-11-20,J,PRESIDENTIAL NICKNAMES,,300,"The ""Father of the Declaration of Independence""",Thomas Jefferson,NA
2000-11-20,J,POETS & POETRY,,300,"In ""Endymion"" he wrote, ""A thing of beauty is a joy forever""",John Keats,NA
2000-11-20,J,COLLEGE FOOTBALL,,NA,The university of this state was the fitting 1999-2000 champion of the Big Sky Conference,Montana,NA
2000-11-20,J,MONEY TALKS,,300,"Term for the money used to ""germinate"" a new business, like maybe a flower shop",Seed money,NA
2000-11-20,J,ROCK ME,,400,"Stalactites & stalagmites are formed primarily in caves of this ""stone""",Limestone,NA
2000-11-20,J,2000 COMMENCEMENT SPEAKERS,,400,Take a memo:Stanford got a secretary to speak -- this Secretary-General,Kofi Annan,NA
2000-11-20,J,PRESIDENTIAL NICKNAMES,,400,"""The Hero of Fort Donelson"" as well as ""The Hero of Appomattox""",Ulysses S. Grant,NA
2000-11-20,J,POETS & POETRY,,400,In 1945 this South American country's Gabriela Mistral won the Nobel Prize for Literature,Chile,NA
2000-11-20,J,COLLEGE FOOTBALL,,400,This school's 1999 win over its archrival was overshadowed by the fatal collapse of a bonfire tower,Texas A&M,NA
2000-11-20,J,MONEY TALKS,,400,"It was an old translation of the Bible that turned ""money obtained dishonestly"" into ""filthy"" this",Lucre,NA
2000-11-20,J,ROCK ME,,500,It's the earthy term for crystal lime nodules like the one seen here,Geode,NA
2000-11-20,J,2000 COMMENCEMENT SPEAKERS,,500,"In May 2000 Princeton got a queen, this Mideastern one, who's a Princeton alumna",Queen Noor of Jordan (Lisa Halaby),NA
2000-11-20,J,PRESIDENTIAL NICKNAMES,,500,"The ""Land Hero of 1812""",Andrew Jackson,NA
2000-11-20,J,POETS & POETRY,,500,"A poem by Poe purports to be the confession of this lame Asiatic conqueror, also a Christopher Marlowe subject",Tamerlane,NA
2000-11-20,J,COLLEGE FOOTBALL,,500,"The Outland Trophy goes to the nation's outstanding interior one of these -- no, not decorator",Lineman,NA
2000-11-20,J,MONEY TALKS,,500,"To destroy someone's financial condition little by little is to do this to them ""to death""",Nickel & dime them,NA
2000-11-20,DJ,ROCK ME,,200,In 1999 he hit the road with his E Street Band in their first major tour in over a decade,Bruce Springsteen,NA
2000-11-20,DJ,THE AMERICAN REVOLUTION,,200,"Both Continental Congresses met in this city; the first convened on September 5, 1774, the second on May 10, 1775",Philadelphia,NA
2000-11-20,DJ,"OOH, A COMEDIAN",,200,"This comedian & sitcom star has written about ""Couplehood""",Paul Reiser,NA
2000-11-20,DJ,TRAVEL,,200,"This U.S. university performs its Hasty Pudding theatricals in Bermuda during ""College Weeks"" in March & April",Harvard,NA
2000-11-20,DJ,RELIGION 101,,200,"Every 12 years, followers of Jainism travel to Mysore in this country to bathe a statue of Gomateshwara",India,NA
2000-11-20,DJ,"I ""PASS""ED!",,200,A travel document for identification,Passport,NA
2000-11-20,DJ,ROCK ME,,400,"She's the distinctive-voiced singer whose recent hits include ""I Try"" & ""Do Something""",Macy Gray,NA
2000-11-20,DJ,THE AMERICAN REVOLUTION,,400,"More than 1000 British soldiers were killed or wounded in this June 17, 1775 battle in Massachusetts",Bunker Hill,NA
2000-11-20,DJ,"OOH, A COMEDIAN",,400,"As this geeky bow-tie-clad character, Paul Reubens played a sold-out show at Carnegie Hall",Pee-wee Herman,NA
2000-11-20,DJ,TRAVEL,,400,"The resort of Puerto Vallarta in this country lies on Banderas Bay, presumably not named for Antonio",Mexico,NA
2000-11-20,DJ,RELIGION 101,,400,This Jewish holy day follows Rosh Hashanah by 10 days,Yom Kippur,NA
2000-11-20,DJ,"I ""PASS""ED!",,400,"Perhaps a much-sought northwest one, it's a corridor or pathway enclosed on both sides",Passage,NA
2000-11-20,DJ,ROCK ME,,600,The secret's out -- this Rob Thomas group grew out of another band called Tabitha's Secret,Matchbox 20,NA
2000-11-20,DJ,THE AMERICAN REVOLUTION,,600,"To aid them in the war, the British hired about 30,000 of these German soldiers, so named for their home principality",Hessians,NA
2000-11-20,DJ,"OOH, A COMEDIAN",,600,"After leaving ""SNL"", he joined the original cast of ""Just Shoot Me""",David Spade,NA
2000-11-20,DJ,TRAVEL,,600,A museum in Tahiti is devoted to this French artist's works & his life in Polynesia,Paul Gauguin,NA
2000-11-20,DJ,RELIGION 101,,600,"The basis of this religion's caste system can be found in the Manu Smriti, or Code of Manu",Hinduism,NA
2000-11-20,DJ,"I ""PASS""ED!",,600,"It means ""unresisting"", but it often precedes ""resistance""",Passive,NA
2000-11-20,DJ,ROCK ME,,800,"(Hi, I'm Nile Rodgers)  2 of the hit albums I produced during the '80s were ""Like A Virgin"" by Madonna & ""Let's Dance"" by this singer",David Bowie,NA
2000-11-20,DJ,THE AMERICAN REVOLUTION,,NA,Guerrilla leader Francis Marion earned this nickname for his daring raids from the South Carolina marshes,"""The Swamp Fox""",NA
2000-11-20,DJ,"OOH, A COMEDIAN",,800,"I don't want to get off on a rant, but this comic was great when he started on ""MNF"" in July 2000",Dennis Miller,NA
2000-11-20,DJ,TRAVEL,,800,A haunted castle full of mummies is a new attraction at the West Edmonton Mall in this Canadian province,Alberta,NA
2000-11-20,DJ,RELIGION 101,,800,Followers of this Japanese religion believe that the sun goddess was the ancestor of the Imperial Family,Shintoism,NA
2000-11-20,DJ,"I ""PASS""ED!",,800,"This word borrowed from French means ""outmoded""",Passe,NA
2000-11-20,DJ,ROCK ME,,1000,"They're the rockers in the song heard here(""Can you take me higher..."")",Creed,NA
2000-11-20,DJ,THE AMERICAN REVOLUTION,,1000,"The first of these 85 essays urging ratification of the Constitution appeared on October 27, 1787 in a NYC newspaper",The Federalist Papers,NA
2000-11-20,DJ,"OOH, A COMEDIAN",,1000,"His 1997 comedy special was called ""Bring The Pain!""",Chris Rock,NA
2000-11-20,DJ,TRAVEL,,1000,"The open-air Makola Market is a popular place to shop in Accra, the capital of this African country",Ghana,NA
2000-11-20,DJ,RELIGION 101,,NA,This religious leader was born around 563 B.C. in what is now Nepal,Buddha,NA
2000-11-20,DJ,"I ""PASS""ED!",,1000,"A bunch, often ""of brats""",Passel,NA
2000-11-20,FJ,BRITAIN'S NATIONAL PORTRAIT GALLERY,(Alex: Think about the last time you were there!),NA,In April 2000 the portrait of this living woman was moved from the Contemporary section to History,Margaret Thatcher,NA
