date,round,category,comment,value,clue,response,link
1999-03-18,J,WHERE THINGS HAPPENED,,100,"This British prime minister gave a famous speech in Fulton, Missouri March 5, 1946",Winston Churchill,NA
1999-03-18,J,TV SITCOMS,,100,Mabel is Paul & Jamie Buchman's baby on this series,Mad About You,NA
1999-03-18,J,"ENGLISH ""T""",,100,It flows from the Cotswold Hills to its mouth on the North Sea,the Thames River,NA
1999-03-18,J,POET-TREE,,100,"This bird-&-feline pair ""sailed away, for a year and a day, to the land where the bong-tree grows""",the Owl & the Pussycat,NA
1999-03-18,J,PEOPLE,,100,This media mogul & owner of the Atlanta Braves is the USA's largest private bison rancher,Ted Turner,NA
1999-03-18,J,ANAGRAMMED HITCHCOCK FILMS,,100,"""PORE""",Rope,NA
1999-03-18,J,WHERE THINGS HAPPENED,,200,This site of the Great Mosque & the Kaaba was the capital of the kingdom of Hejaz,Mecca,NA
1999-03-18,J,TV SITCOMS,,200,Andy Dick plays bumbling reporter Matthew Brock on this sitcom set at New York's WNYX,NewsRadio,NA
1999-03-18,J,"ENGLISH ""T""",,200,"Over the years many got ""the chop"" at this historic London stronghold",the Tower of London,NA
1999-03-18,J,POET-TREE,,200,"""The dead tree gives no shelter"", he observed in ""The Waste Land""",T.S. Eliot,NA
1999-03-18,J,PEOPLE,,200,"The youngest American billionaire ever at age 31, he now owns the Bettman Archive of photo images",Bill Gates,NA
1999-03-18,J,ANAGRAMMED HITCHCOCK FILMS,,200,"""TO ZAP""",Topaz,NA
1999-03-18,J,WHERE THINGS HAPPENED,,300,California city where Father Junipero Serra is buried & Clint Eastwood once served as mayor,Carmel,NA
1999-03-18,J,TV SITCOMS,,NA,"(Hi, I'm Jane Leeves.)  I played Marla, the virgin who stumbled onto a contest & ended up with JFK Jr. on an episode of this sitcom",Seinfeld,http://www.j-archive.com/media/1999-03-18_J_03.jpg
1999-03-18,J,"ENGLISH ""T""",,300,"This square is located at the north end of Whitehall, not on the southwest coast of Spain",Trafalgar Square,NA
1999-03-18,J,POET-TREE,,300,"""So was I once myself a swinger of birches; and so I dream of going back to be"", wrote this New England poet",Robert Frost,NA
1999-03-18,J,PEOPLE,,300,"The female lead in ""Basic Instinct"", she's definitely not a dumb blonde; her IQ is said to be 154",Sharon Stone,NA
1999-03-18,J,ANAGRAMMED HITCHCOCK FILMS,,300,"""ZEN FRY""",Frenzy,NA
1999-03-18,J,WHERE THINGS HAPPENED,,400,When Marco Polo reached this city in 1275 it was called Cambaluc,Peking (or Beijing),NA
1999-03-18,J,TV SITCOMS,,400,"On this series, Mayim Bialik played a sassy teenager who lived with her 2 older brothers & her divorced dad",Blossom,NA
1999-03-18,J,"ENGLISH ""T""",,400,"She replaced James Callaghan May 4, 1979",Margaret Thatcher,NA
1999-03-18,J,POET-TREE,,400,"""Ah, droop not, my oak!"" wrote this lord in ""To an Oak at Newstead""",Lord Byron,NA
1999-03-18,J,PEOPLE,,400,"She wore bulky trench coats in episodes of ""The X-Files"" to hide her real-life pregnancy",Gillian Anderson,NA
1999-03-18,J,ANAGRAMMED HITCHCOCK FILMS,,400,"""POUND BELLS""",Spellbound,NA
1999-03-18,J,WHERE THINGS HAPPENED,,500,Edmond Halley had an observatory on this island 145 years before Napoleon was observed there,Saint Helena,NA
1999-03-18,J,TV SITCOMS,,500,"This Marla Gibbs sitcom was named for the Washington, D.C. building its characters lived in",227,NA
1999-03-18,J,"ENGLISH ""T""",,500,"In 1907 Great Britain, France & Russia completed this defensive ""Entente""",the Triple Entente,NA
1999-03-18,J,POET-TREE,,500,"Ogden Nash spoofed this poet by writing, ""I think that I shall never see a billboard lovely as a tree""","Joyce Kilmer (who wrote ""Trees"")",NA
1999-03-18,J,PEOPLE,,500,"In 1987 this director of ""Taxi Driver"" directed Michael Jackson's ""Bad"" video",Martin Scorsese,NA
1999-03-18,J,ANAGRAMMED HITCHCOCK FILMS,,500,"""BOIL FATE""",Lifeboat,NA
1999-03-18,DJ,THE RED PLANET,(Alex: Guess which one?),200,Examples of this explosive phenomena on Mars include Ascraeus Mons & Pavonis Mons,volcanoes,NA
1999-03-18,DJ,THE BLACK SEA,(Alex: Uh-oh... colors!),200,It's the largest peninsula jutting into the Black Sea,the Crimean Peninsula,NA
1999-03-18,DJ,THEY'VE GOT THE BLUES,,200,"This ""experienced"" left-hander recorded haunting blues songs like ""Red House"" & ""Voodoo Chile""",Jimi Hendrix,NA
1999-03-18,DJ,EAT A GREEN THING,,200,"Bibb & butterhead are not an MTV cartoon duo, but varieties of this vegetable",lettuce,NA
1999-03-18,DJ,MR. OR MS. BROWN,,200,It's the name of Charles Schulz' friend who inspired his classic comic strip everyman,Charlie Brown,NA
1999-03-18,DJ,SORTA RHYMES WITH PURPLE?,,200,"Examples include leatherback, loggerhead & mutant ninja",a turtle,NA
1999-03-18,DJ,THE RED PLANET,(Alex: Guess which one?),400,"Once thought to be the work of an advanced civilization, these features are now known to be an optical illusion",canals,NA
1999-03-18,DJ,THE BLACK SEA,(Alex: Uh-oh... colors!),400,The only nation on the Black Sea that shares its name with a U.S. state,Georgia,NA
1999-03-18,DJ,THEY'VE GOT THE BLUES,,400,"""Royal"" guitarist whose early recording ""Three O'Clock Blues"" was a hit in 1952",B.B. King,NA
1999-03-18,DJ,EAT A GREEN THING,,400,Small versions of this common garden vegetable used for pickling are often called gherkins,cucumbers,NA
1999-03-18,DJ,MR. OR MS. BROWN,,400,"This man's execution on December 2, 1859 made him a martyr to the anti-slavery cause",John Brown,NA
1999-03-18,DJ,SORTA RHYMES WITH PURPLE?,,400,"Jaleel White played this heroic nerd for 9 years on ""Family Matters""",Steve Urkel,NA
1999-03-18,DJ,THE RED PLANET,(Alex: Guess which one?),NA,The 2 planets in our solar system that are smaller than Mars,Mercury & Pluto,NA
1999-03-18,DJ,THE BLACK SEA,(Alex: Uh-oh... colors!),600,"Sailing south from the Black Sea via the Bosporus, you'll pass through this sea before reaching the Mediterranean",the Sea of Marmara,NA
1999-03-18,DJ,THEY'VE GOT THE BLUES,,600,"With albums like ""Texas Flood"" & ""Soul to Soul"", this guitarist was the leading figure in the 1980s blues-rock revival",Stevie Ray Vaughan,NA
1999-03-18,DJ,EAT A GREEN THING,,600,These vegetables with a flavor like mild cabbage include the name of a city,Brussels sprouts,NA
1999-03-18,DJ,MR. OR MS. BROWN,,NA,This best-selling author became a magazine editor in 1965,Helen Gurley Brown,NA
1999-03-18,DJ,SORTA RHYMES WITH PURPLE?,,600,"To congeal, as milk does when it spoils",curdle,NA
1999-03-18,DJ,THE RED PLANET,(Alex: Guess which one?),800,Pathfinder & its rover Sojourner touched down on Mars on this date in 1997,July 4th,NA
1999-03-18,DJ,THE BLACK SEA,(Alex: Uh-oh... colors!),800,Any 2 of the 4 large rivers beginning with the letter D that drain into the Black Sea,"(2 of) Danube, Dnieper, Dniester & Don",NA
1999-03-18,DJ,THEY'VE GOT THE BLUES,,800,It's the nickname of legendary Texas bluesman Sam Hopkins,"""Lightnin\'""",NA
1999-03-18,DJ,EAT A GREEN THING,,800,"The name of this herb that is used mainly as a decoration on meat dishes comes from the Greek for ""rock celery""",parsley,NA
1999-03-18,DJ,MR. OR MS. BROWN,,800,"Now an Oakland Raiders All-Pro wide receiver, this man won the Heisman Trophy in 1987",Tim Brown,NA
1999-03-18,DJ,SORTA RHYMES WITH PURPLE?,,800,"From the Old French for ""excess"", it's an amount or quantity beyond what is needed",surplus,NA
1999-03-18,DJ,THE RED PLANET,(Alex: Guess which one?),1000,"Named for the attendants of Ares, the Greek god of war, they are the 2 moons of Mars",Phobos & Deimos,NA
1999-03-18,DJ,THE BLACK SEA,(Alex: Uh-oh... colors!),1000,This Ukranian Black Sea port was the site of a Russian naval victory in 1905,Odessa,NA
1999-03-18,DJ,THEY'VE GOT THE BLUES,,1000,"The father of the British blues movement, he formed the Bluesbreakers in the early '60s",John Mayall,NA
1999-03-18,DJ,EAT A GREEN THING,,1000,"Also called roquette, this peppery salad green is very popular with Italian palates",arugula,NA
1999-03-18,DJ,MR. OR MS. BROWN,,1000,"Born July 25, 1978, she was the world's first ""Test Tube Baby""",Louise Brown,NA
1999-03-18,DJ,SORTA RHYMES WITH PURPLE?,,1000,"Not an army officer, but an individual grain of a cereal grass like corn",a kernel,NA
1999-03-18,FJ,PRESIDENTIAL BIRTHPLACES,"(Alex: For the first time in many, many months, this will be a video Final Jeopardy!)",NA,20th century president whose birthplace is depicted here,Herbert Hoover,http://www.j-archive.com/media/1999-03-18_FJ.jpg
