date,round,category,comment,value,clue,response,link
1998-04-01,J,APRIL,,100,"On April 10, 1912, this ship left Southampton, England on its maiden, & last, voyage",the Titanic,NA
1998-04-01,J,FOOLS,,100,Brian Burns got 5 years for robbing one of these stands run by 2 little girls in New Jersey,a lemonade stand,NA
1998-04-01,J,DAY,,100,"It was no ""Calamity"" when Doris Day played this Wild West woman in a 1953 film",Calamity Jane,NA
1998-04-01,J,THE MALE OF THE SPECIES,,100,This boy's name is given to any male housecat,Tom,NA
1998-04-01,J,ATHLETIC CUPS,,100,"Pele scored 12 career goals in helping Brazil win this trophy 3 times: 1958, 1962 & 1970",the World Cup (in soccer),NA
1998-04-01,J,IT'S A GUY THING,,100,"When this eye-gouging comedy team started in Vaudeville in 1923, they were just a duo",The Three Stooges,NA
1998-04-01,J,APRIL,,200,"This song, heard here, was one of 6 No. 1 hits for its performer:","""April Love""",http://www.j-archive.com/media/1998-04-01_J_13.mp3
1998-04-01,J,FOOLS,,200,Duane Babcock left the meter running in this vehicle while he robbed a bank; the driver later turned him in,a cab,NA
1998-04-01,J,DAY,,200,"This TV ""Maverick"" drove into a swimming pool as Doris' husband in ""The Thrill of It All""",James Garner,NA
1998-04-01,J,THE MALE OF THE SPECIES,,200,"Hey hen, it's kookie to ask this cock of the walk to lend you its comb",a rooster,NA
1998-04-01,J,ATHLETIC CUPS,,200,"To accommodate the rosters of all winning NHL teams, it now measures 35 1/4"" high & 54"" around the base",the Stanley Cup,NA
1998-04-01,J,IT'S A GUY THING,,200,"Proverbially, they're what men hate asking for, even if they end, ""You can't miss it""",directions,NA
1998-04-01,J,APRIL,,300,"He was 70 when his ""American Dictionary of the English Language"" was first published on April 14, 1828",Webster,NA
1998-04-01,J,FOOLS,,300,A 1997 TV ad for the Cadillac Catera shows it illegally crossing a double yellow line to do this,pass (another car),NA
1998-04-01,J,DAY,,300,Doris' biggest co-star wasn't Cary Grant or Rock Hudson but this title elephant,Jumbo,NA
1998-04-01,J,THE MALE OF THE SPECIES,,300,"A male duck, or the commander of the Golden Hind",Drake,NA
1998-04-01,J,ATHLETIC CUPS,,300,"This cup was first presented by England's Royal Yacht Squadron on August 22, 1851",the Americas Cup,NA
1998-04-01,J,IT'S A GUY THING,,300,It's the main hormone producing male characteristics like facial hair & love of sports cars,testosterone,NA
1998-04-01,J,APRIL,,400,"The April 12, 1955 news of the Salk polio vaccine coincided with the 10th anniversary of this man's death",FDR,NA
1998-04-01,J,FOOLS,,400,A 13-year-old in Georgia was suspended for 10 days for giving his French teacher a bottle of this as a gift,wine,NA
1998-04-01,J,DAY,,NA,"Doris earned an Oscar nomination for her chatty role in this 1959 film, seen here:""Who is that woman?""""Some little eavesdropper on my party line--she's always listening in.  It's how she brightens up her drab, empty life.""""If I could get a call through once in a while, my life wouldn't be so drab!""",Pillow Talk,NA
1998-04-01,J,THE MALE OF THE SPECIES,,400,"Doe, a rabbit, a female rabbit, & this, a male",a buck,NA
1998-04-01,NA,NA,NA,NA,NA,NA,NA
1998-04-01,J,IT'S A GUY THING,,400,"""The Single Guy"" is a column in this magazine that, contrary to its name, is actually a monthly",GQ (Gentlemen\'s Quarterly),NA
1998-04-01,J,APRIL,,500,"On April 27, 1956 he retired as boxing's only undefeated heavyweight champ",Rocky Marciano,NA
1998-04-01,J,FOOLS,,500,3 men from Yemen sued NASA in July 1997 claiming this probe was trespassing on their planet: Mars,Pathfinder,NA
1998-04-01,J,DAY,,500,"Hey there!  This father of singer Bonnie was Doris' leading man in ""The Pajama Game""",John Raitt,NA
1998-04-01,J,THE MALE OF THE SPECIES,,500,"When male badgers & pigs get together, the females think they're  a bunch of these",boars,NA
1998-04-01,NA,NA,NA,NA,NA,NA,NA
1998-04-01,J,IT'S A GUY THING,,500,In 1990 Colorado football coach Bill McCartney founded this movement of Christian men,Promise Keepers,NA
1998-04-01,DJ,LOUIS XIV,,200,Louis' nickname; he used the symbol as his emblem,"the ""Sun King""",NA
1998-04-01,DJ,SHOE BIZ,,200,"Jolly Walkers, formerly Big Foot Shoes, has been making shoes for these performers for over 25 years",clowns,NA
1998-04-01,DJ,BRIT BITS & PIECES,,200,The BBC has been broadcasting this bell's chimes since 1923,Big Ben,NA
1998-04-01,DJ,MORE OPERATIC DEMISES,,200,"In a biblical opera, this shorn strongman really brings down the house; his audience was just crushed",Samson,NA
1998-04-01,DJ,THE FACE OF AN ANGEL,,200,"As the angel in 1996's ""Michael"", this actor takes credit for writing Psalm 85",John Travolta,NA
1998-04-01,DJ,"""HI"" FIVE",,200,"Seize control of an aircraft, or greet actor Lemmon",hijack,NA
1998-04-01,DJ,LOUIS XIV,,400,"Charles de Batz, Sieur d'Artagnan, a soldier in Louis' service, is well known because of this 1844 novel",The Three Musketeers,NA
1998-04-01,DJ,SHOE BIZ,,400,"Once touted as ""the world's most comfortable shoes"", their logo is seen here:",Hush Puppies,http://www.j-archive.com/media/1998-04-01_DJ_19.jpg
1998-04-01,DJ,BRIT BITS & PIECES,,400,"First discussed in 1802, this British-French project was finally opened to the public in 1994",the Chunnel (the channel tunnel),NA
1998-04-01,DJ,MORE OPERATIC DEMISES,,400,A crap game on Catfish Row turns deadly when Crown kills Robbins with a cotton-hook in this opera,Porgy & Bess,NA
1998-04-01,DJ,THE FACE OF AN ANGEL,,400,"In 1997 this ""Touched by an Angel"" co-star published an autobiography ""Angels Along the Way""",Della Reese,NA
1998-04-01,DJ,"""HI"" FIVE",,400,"It's the state flower of Hawaii, & the national flower of Malaysia",the hibiscus,NA
1998-04-01,DJ,LOUIS XIV,,600,Its was Louis' money pit; once he started building this Royal Residence in the 1660s it was hard to stop,Versailles,NA
1998-04-01,DJ,SHOE BIZ,,600,"Stride Rite must ""feel good"" since acquiring this sneakers brand in 1979",Keds,NA
1998-04-01,DJ,BRIT BITS & PIECES,,NA,Reference work conceived in 1857; the As were published in the 1880s & they got the Zs out in 1921,the Oxford English Dictionary (the OED),NA
1998-04-01,DJ,MORE OPERATIC DEMISES,,NA,"In a Melville-inspired opera, this young sailor is hanged from the yardarm of the H.M.S. Indomitable",Billy Budd,NA
1998-04-01,DJ,THE FACE OF AN ANGEL,,600,"On the Smothers Brothers' sitcom, this one played the bungling angel",Tommy Smothers,NA
1998-04-01,DJ,"""HI"" FIVE",,600,It was Ulysses Grant's original first name,Hiram,NA
1998-04-01,DJ,LOUIS XIV,,800,"At this age Louis said, ""Today I am a man"", & dumped his mother as regent",13,NA
1998-04-01,DJ,SHOE BIZ,,800,"Created in Germany, these sandals are famous for ""contoured footbeds"" of cork & latex",Birkenstocks,NA
1998-04-01,DJ,BRIT BITS & PIECES,,800,"Animal most associated with the legendary Lord Mayor of London, Dick Whittington",the cat,NA
1998-04-01,DJ,MORE OPERATIC DEMISES,,800,"In ""Elegy for Young Lovers"", 2 lovers expire while searching for edelweiss in this country's Eastern Alps",Austria,NA
1998-04-01,DJ,THE FACE OF AN ANGEL,,800,"He was 39 in 1978 when he appeared as Teen Angel in the film ""Grease""",Frankie Avalon,NA
1998-04-01,DJ,"""HI"" FIVE",,800,"Opened in 1925, this Florida park is famous for its horse races & flamingos",Hialeah,NA
1998-04-01,DJ,LOUIS XIV,,1000,"Wanting the Huguenots to convert, Louis revoked the Edict of this in 1685",Nantes,NA
1998-04-01,DJ,SHOE BIZ,,1000,"This leading maker of golf, walking & running shoes is named for its founder, Charles Eaton",Etonics,NA
1998-04-01,DJ,BRIT BITS & PIECES,,1000,Some 1300 seats in this memorial to Victoria's husband were sold on 999-year leases to raise building funds,the Royal Albert Hall,NA
1998-04-01,DJ,MORE OPERATIC DEMISES,,1000,"In a Richard Strauss opera, this daughter of Agamemnon is so ""complex"" that she dances herself to death",Elektra,NA
1998-04-01,NA,NA,NA,NA,NA,NA,NA
1998-04-01,DJ,"""HI"" FIVE",,1000,It's one of the ancient Latin names for Ireland,Hibernia,NA
1998-04-01,FJ,APRIL 1 IN HISTORY,"(Alex: I know, some of you were expecting Pat Sajak on our program again today, but we did that last year, so--it's been done!)",NA,"April 1 is the anniversary of the Battle of Five Forks, the last decisive battle of this war",the Civil War,NA
