date,round,category,comment,value,clue,response,link
2008-02-25,J,AMERICANA,,200,"A nickname for New York is ""the Big"" this fruit",an apple,NA
2008-02-25,J,CHICK FLICKS,,200,"Mel Gibson was in a fowl mood when he voiced Rocky Rhodes, a ""flying rooster"" in this animated film",Chicken Run,NA
2008-02-25,J,5 BOTTLES OF BEER ON THE BOARD,,200,"This ""King of Beers"" was the official beer of the 2007 Sports Illustrated Swimsuit Issue",Budweiser,NA
2008-02-25,J,THE LOSING TICKET,,200,In 1960 it was him & Henry Cabot Lodge Jr.,Richard Nixon,NA
2008-02-25,J,I'M BEING SENT TO KYRGYZSTAN,,200,The Kyrgyz formerly had this way of life also called transhumant; the Soviets made them settle down,nomadic,NA
2008-02-25,J,"""O.L.""",,200,"In 1964 Jan & Dean sang about the ""Little"" this ""From Pasadena""","""The Little Old Lady From Pasadena""",NA
2008-02-25,J,AMERICANA,,400,George Bush Intercontinental Airport is in this city,Houston,NA
2008-02-25,J,CHICK FLICKS,,400,"Singer Roger Miller played Alan-a-Dale, rooster minstrel, in this Disney classic",Robin Hood,NA
2008-02-25,J,5 BOTTLES OF BEER ON THE BOARD,,400,"This company's website says it has been ""brewed for over 30 years (&) is the first lite beer""",Miller,NA
2008-02-25,J,THE LOSING TICKET,,400,William Miller shared his ticket in 1964,Barry Goldwater,NA
2008-02-25,J,I'M BEING SENT TO KYRGYZSTAN,,400,"Of Mishlek, Bishkek or Dishrek, the present name of the capital city (formerly Pishpek)",Bishkek,NA
2008-02-25,J,"""O.L.""",,400,"in the 1980s research scientists first detected a ""hole"" in this above Antarctica",the ozone layer,NA
2008-02-25,J,AMERICANA,,NA,"After getting lost crossing a California desert & suffering intensely, emigrants gave the area this name",Death Valley,NA
2008-02-25,J,CHICK FLICKS,,600,"The tagline to this 2005 animated feature was ""This time the sky really is falling""",Chicken Little,NA
2008-02-25,J,5 BOTTLES OF BEER ON THE BOARD,,600,"This company's beer, introduced in 1874, ""is brewed in the Rockies for a uniquely crisp, clean... Mile High taste""",Coors,NA
2008-02-25,J,THE LOSING TICKET,,600,Humphrey & Muskie were edged out in this year,1968,NA
2008-02-25,J,I'M BEING SENT TO KYRGYZSTAN,,600,The Kyrgyz Range in the north of K'stan extends into this other K'stan,Kazakhstan,NA
2008-02-25,J,"""O.L.""",,600,"The U.S. military decoration called this ""cluster"" denotes multiple bestowals of an award such as the Purple Heart",oak leaf,NA
2008-02-25,J,AMERICANA,,800,"In 1958 Crayola changed the name of its Prussian blue crayon to this ""timely"" blue",midnight blue,NA
2008-02-25,J,CHICK FLICKS,,800,Kate Hepburn teamed up with this title marshal to track down her father's killer in a 1975 Western,Rooster Cogburn,NA
2008-02-25,J,5 BOTTLES OF BEER ON THE BOARD,,800,"In 1897 Wilhelm Hasse of the Moctezuma Brewery created a beer named Siglo XX; today, it's known as this",Dos Equis,NA
2008-02-25,J,THE LOSING TICKET,,800,In 1976 Ford & this man were a pair of 4-letter words to voters,(Bob) Dole,NA
2008-02-25,J,I'M BEING SENT TO KYRGYZSTAN,,800,"Kyrgyzstan was the first former Soviet republic to join the WTO, short for this",the World Trade Organization,NA
2008-02-25,J,"""O.L.""",,800,"(Jon of the Clue Crew reports next to a giant cetacean at the American Museum of Natural History in New York.) Featuring the world's biggest blue whale model, one of New York's most iconic spaces is the American Museum of Natural History's Milstein Hall of this",Ocean Life,http://www.j-archive.com/media/2008-02-25_J_04.jpg
2008-02-25,J,AMERICANA,,1000,The Caldecott is for illustrators; authors get this medal for the most distinguished American children's book,the Newbery,NA
2008-02-25,J,CHICK FLICKS,,1000,"In ""The Ghost and Mr. Chicken"", this actor played a wannabe reporter who had to stay in a haunted house",Don Knotts,NA
2008-02-25,J,5 BOTTLES OF BEER ON THE BOARD,,1000,Two-row barley & German noble aroma hops help make this Founding Father's Boston Lager go down easy,Samuel Adams,NA
2008-02-25,J,THE LOSING TICKET,,1000,Running mate Sparkman failed to spark this Democrat's 1952 campaign,(Adlai) Stevenson,NA
2008-02-25,J,I'M BEING SENT TO KYRGYZSTAN,,1000,"Noted author Aytmatov captured Kyrgyz geography in ""Tales of Mountains and"" these semiarid plains",steppes,NA
2008-02-25,J,"""O.L.""",,1000,This type of work force  is also called trade unionism,organized labor,NA
2008-02-25,DJ,TENORS,,400,"This exuberant Italian who died in 2007 sang for 500,000 opera lovers in Central Park June 26, 1993",Pavarotti,NA
2008-02-25,DJ,SONG TITLES -- NOW IN GERMAN,,400,"1981:Dolly Parton,""Neun Bis Funf""","""9 To 5""",NA
2008-02-25,DJ,THROWING THE BOOK AT YOU,,400,"Heirs of billionaire Troy Phelan battle over his estate in ""The Testament"" by this author/lawyer",Grisham,NA
2008-02-25,DJ,ENDS WITH 2 VOWELS,,400,This Muslim temple typically has one or more towers called minarets,a mosque,NA
2008-02-25,DJ,PIRATES,,400,"In November 1717 he took a 26-gun French ship called the Concorde, added 14 guns, & renamed it Queen Anne's Revenge",Blackbeard,NA
2008-02-25,DJ,THEY MEAN BUSINESS!,,400,19th century robber baron Jay Gould caused the Black Friday panic with his speculation on this commodity,gold,NA
2008-02-25,DJ,TENORS,,800,"Booed at this Milan venue in 2006, Roberto Alagna walked off, & his jeans-clad understudy had to carry on",La Scala,NA
2008-02-25,DJ,SONG TITLES -- NOW IN GERMAN,,800,"1983:Paul McCartney & Michael Jackson,""Sagen, Sagen, Sagen""","""Say, Say, Say""",NA
2008-02-25,DJ,THROWING THE BOOK AT YOU,,800,"""Javert in Disarray"" is a chapter in this 1862 tale",Les Misérables,NA
2008-02-25,DJ,ENDS WITH 2 VOWELS,,NA,"Slang for a private eye like Sam Spade, it can also mean to move softly",gumshoe,NA
2008-02-25,DJ,PIRATES,,800,"Stede Bonnet has been described as the only pirate who actually made his victims do this, to their death",walk the plank,NA
2008-02-25,DJ,THEY MEAN BUSINESS!,,800,"It's Proctor & Gamble's main toothbrush brand, & they must want you to squeeze some Crest onto it",Oral-B,NA
2008-02-25,DJ,TENORS,,1200,"Entertainment options in Palermo in May 1897 included him as Enzo Grimaldo in ""La Gioconda""",(Enrico) Caruso,NA
2008-02-25,DJ,SONG TITLES -- NOW IN GERMAN,,1200,"1986:The Bangles,""Gehen Sie Wie Ein Agypter""","""Walk Like An Egyptian""",NA
2008-02-25,DJ,THROWING THE BOOK AT YOU,,1200,This 1996 novel detailing a woman's Jamaican adventure spent 21 weeks on the N.Y. Times bestseller list,How Stella Got Her Groove Back,NA
2008-02-25,DJ,ENDS WITH 2 VOWELS,,1200,It's a passage in prose or a part of a play in which one character speaks alone,a soliloquy (or monologue),NA
2008-02-25,DJ,PIRATES,,1200,"Weapons used by pirates included pistols, daggers & this curved sword whose name is from the French for ""knife""",cutlass,NA
2008-02-25,DJ,THEY MEAN BUSINESS!,,NA,"""Computer, Communication, Compatibility"" were combined to describe the business of this Silicon Valley co.",3Com,NA
2008-02-25,DJ,TENORS,,1600,This last name of the great tenor Beniamino  was hijacked for the title of a poorly reviewed 2003 Ben Affleck film,Gigli,NA
2008-02-25,DJ,SONG TITLES -- NOW IN GERMAN,,1600,"1992:Right Said Fred,""Ich Bin Zu Reizvoll""","""I\'m Too Sexy""",NA
2008-02-25,DJ,THROWING THE BOOK AT YOU,,1600,A marlin's skeletal remains play a pivotal role in this 1952 literary work,The Old Man and the Sea,NA
2008-02-25,DJ,ENDS WITH 2 VOWELS,,1600,"In this fast-moving game, players use a basket called a cesta to throw the ball",jai alai,NA
2008-02-25,DJ,PIRATES,,1600,"In 1674, 4 years after ravaging Cuba, this English buccaneer was knighted & named Lt. Governor of Jamaica",Sir Henry Morgan,NA
2008-02-25,DJ,THEY MEAN BUSINESS!,,1600,"Even if you don't have the Donald's bank, you can still invest in properties with a REIT, this type of investment trust",real estate,NA
2008-02-25,DJ,TENORS,,2000,Jean de Reszke made the ladies swoon when he premiered as this Wagnerian lover in 1895,Tristan,NA
2008-02-25,DJ,SONG TITLES -- NOW IN GERMAN,,2000,"1984:Wham!,""Wecken Sie Mich Oben Auf Bevor Sie Gehen-Gehen""","""Wake Me Up Before You Go Go""",NA
2008-02-25,DJ,THROWING THE BOOK AT YOU,,2000,"""...All perfume yes and his heart was going like mad and yes I said yes I will Yes"" ends this book",Ulysses,NA
2008-02-25,DJ,ENDS WITH 2 VOWELS,,2000,"In mythology, she was the maiden carved in ivory by Pygmalion & brought to life by Aphrodite",Galatea,NA
2008-02-25,DJ,PIRATES,,2000,In 1529 this red-bearded corsair captured Algiers & made it a stronghold of piracy on the Mediterranean,Barbarossa,NA
2008-02-25,DJ,THEY MEAN BUSINESS!,,2000,This company owns HarperCollins Publishers as well as 20th Century Fox,News Corp(oration),NA
2008-02-25,FJ,BIBLICAL PLACE NAMES,,NA,"In ""Return of the Jedi"", a planet shares its name with this home of a woman who summons a spirit for Saul",Endor,NA
