date,round,category,comment,value,clue,response,link
2008-03-04,J,LANDMARKS THE SPOT,,200,A common transport is seen here in this European city,Venice,http://www.j-archive.com/media/2008-03-04_J_11.jpg
2008-03-04,J,THE HISTORY OF HOCKEY,,200,"It was founded on Nov. 26, 1917; its first president was Frank Calder, later of Cup fame",the National Hockey League,NA
2008-03-04,J,"""C"" BIRDS",,200,Domesticated varieties of this Old World finch are usually bright or pale yellow,a canary,NA
2008-03-04,J,COMMON BONDS,,200,"Gemini,Minnesota,Olsen",twins,NA
2008-03-04,J,THE U.S. SENATE GLOSSARY,(Alex: And these will be terms as defined by that glossary.),200,The 2 rhyming answers asked for on a roll call vote,yea or nay,NA
2008-03-04,J,MUSICAL BEFORE & AFTER,,200,"Nursery rhyme rock song by Carl Perkins that says, ""Come blow your horn"" & ""Well it's 1 for the money, 2 for the show""","""Little Boy Blue Suede Shoes""",NA
2008-03-04,J,LANDMARKS THE SPOT,,400,"At its peak, this amphitheater could hold 45,000 spectators",the Colosseum,http://www.j-archive.com/media/2008-03-04_J_12.jpg
2008-03-04,J,THE HISTORY OF HOCKEY,,400,"In 1966 this city's franchise was awarded to Jack Kent Cooke for $2 million & a new arena, the Forum",Los Angeles,NA
2008-03-04,J,"""C"" BIRDS",,400,"The ani is a species of this ""crazy"" bird",a cuckoo,NA
2008-03-04,J,COMMON BONDS,,400,"A cannon,pottery,a Trump apprentice",fired,NA
2008-03-04,J,THE U.S. SENATE GLOSSARY,(Alex: And these will be terms as defined by that glossary.),400,This kind of voting allows a senator to cast a vote in committee for an absent senator,proxy voting,NA
2008-03-04,J,MUSICAL BEFORE & AFTER,,400,"""Left a good job in the city workin' for the man... whose fleece was white as snow"", says this nursery rhyme rock song","""Proud Mary Had A Little Lamb""",NA
2008-03-04,J,LANDMARKS THE SPOT,,600,"Along with its most famous inhabitant, a room of a museum in this Italian city is seen here",Florence,http://www.j-archive.com/media/2008-03-04_J_13.jpg
2008-03-04,J,THE HISTORY OF HOCKEY,,600,The Rosebuds of this Northwest city were the first pro hockey team in the U.S.,Portland,NA
2008-03-04,J,"""C"" BIRDS",,600,"Because this black bird eats a wide range of agricultural crops, it isn't popular with farmers",a crow,NA
2008-03-04,J,COMMON BONDS,,600,"Artesian,Herbert George,Indian",wells,NA
2008-03-04,J,THE U.S. SENATE GLOSSARY,(Alex: And these will be terms as defined by that glossary.),600,"These ""rooms"" adjacent to the Senate chamber serve as gathering places for party members to speak in private",the cloakroom,NA
2008-03-04,J,MUSICAL BEFORE & AFTER,,600,"Michael Jackson song from ""Dangerous"" becomes a basketball film in which Rosie Perez is on ""Jeopardy!""","""Black Or White Men Can\'t Jump""",NA
2008-03-04,J,LANDMARKS THE SPOT,,800,No StairMaster needed to get your exercise at this Mexican location with a 2-word name,Chichen Itza,http://www.j-archive.com/media/2008-03-04_J_14.jpg
2008-03-04,J,THE HISTORY OF HOCKEY,,800,"The Air Canada Centre opened on Feb. 20, 1999 with the 639th game between the Maple Leafs & these longtime rivals",the (Montreal) Canadiens,NA
2008-03-04,J,"""C"" BIRDS",,800,"With a 9-1/2 foot wingspan, this largest land bird in North America can be seen soaring over the Grand Canyon",a condor,NA
2008-03-04,J,COMMON BONDS,,800,"A glance,a base,thunder",things you steal,NA
2008-03-04,J,THE U.S. SENATE GLOSSARY,(Alex: And these will be terms as defined by that glossary.),800,"To do this to ""the floor"" is to finish one's remarks after speaking on an issue",to yield the floor,NA
2008-03-04,NA,NA,NA,NA,NA,NA,NA
2008-03-04,J,LANDMARKS THE SPOT,,1000,"Designed for millennium celebrations, it's the London ""body part"" seen here",the London Eye,http://www.j-archive.com/media/2008-03-04_J_15.jpg
2008-03-04,J,THE HISTORY OF HOCKEY,,1000,"In 1913 the Pacific Coast Hockey Association introduced these, which form the border of teams' defensive zones",the blue lines,NA
2008-03-04,J,"""C"" BIRDS",,1000,"The sandhill, seen here, is the most abundant species of this bird",a crane,http://www.j-archive.com/media/2008-03-04_J_05.jpg
2008-03-04,J,COMMON BONDS,,1000,"Farmer Hoggett,Paul Bunyan,the 1920 Yankees",things with a Babe,NA
2008-03-04,J,THE U.S. SENATE GLOSSARY,(Alex: And these will be terms as defined by that glossary.),NA,Term for the Senate's official adviser on rules & procedures for conducting Senate business,the Parliamentarian,NA
2008-03-04,NA,NA,NA,NA,NA,NA,NA
2008-03-04,DJ,WELCOME TO CARLSBAD CAVERNS,,400,"(Kelly of the Clue Crew reports from inside Carlsbad Caverns Nat'l Park, New Mexico.)  Calcite formations called soda straws are precursors to these larger formations that grow from cave ceilings",stalactites,http://www.j-archive.com/media/2008-03-04_DJ_06.jpg
2008-03-04,DJ,FROM HERE TO MATERNITY,(Alex: You have to identify the mother of each person we mention in the clue.),400,Lisa Marie Presley,Priscilla Presley,NA
2008-03-04,DJ,OFFICIAL STATE FOOD & DRINK,,400,It's the official state berry of Massachusetts--let us all give thanks,cranberry,NA
2008-03-04,DJ,JACK LONDON,,400,"Jack London often purchased story ideas, including ""The Assassination Bureau"", from this ""Babbitt"" author",Sinclair Lewis,NA
2008-03-04,DJ,"""CAL"" OF THE WILD",,400,It's exercise like jumping jacks or pushups; drop & give me 20!,calisthenics,NA
2008-03-04,DJ,THE ASSASSINATION BUREAU,,400,Sara Jane Moore was one of 2 would-be assassins of this man in 1975,Gerald Ford,NA
2008-03-04,DJ,WELCOME TO CARLSBAD CAVERNS,,800,"(Jon of the Clue Crew reports from the amphitheater at Carlsbad Caverns Nat'l Park, New Mexico.)  Carlsbad Caverns, not San Juan Capistrano, is home to what may be the USA's largest colony of the cave species of this bird, which cohabits with the bats",the swallow,http://www.j-archive.com/media/2008-03-04_DJ_22.wmv
2008-03-04,DJ,FROM HERE TO MATERNITY,(Alex: You have to identify the mother of each person we mention in the clue.),800,Ben Stiller,Anne Meara,NA
2008-03-04,DJ,OFFICIAL STATE FOOD & DRINK,,800,Pucker up for this official state pie of Florida,key lime,NA
2008-03-04,DJ,JACK LONDON,,800,Beauty Smith trains the title wolf dog to become a lethal dog fighter in this Jack London novel,White Fang,NA
2008-03-04,DJ,"""CAL"" OF THE WILD",,800,"For a .44 magnum firearm, it's what the .44 is",caliber,NA
2008-03-04,DJ,THE ASSASSINATION BUREAU,,800,"Spencer Perceval, the only British prime minister to be assassinated, was killed in the meeting place of this body",the House of Commons,NA
2008-03-04,DJ,WELCOME TO CARLSBAD CAVERNS,,1200,"(Jon of the Clue Crew reports from the amphitheater at Carlsbad Caverns Nat'l Park, New Mexico.)  Each night thousands of Mexican freetail bats leave the batcave in search of food using this process in which sound reflects off prey",echolocation,http://www.j-archive.com/media/2008-03-04_DJ_23.jpg
2008-03-04,DJ,FROM HERE TO MATERNITY,(Alex: You have to identify the mother of each person we mention in the clue.),1200,Rumer Willis,Demi Moore,NA
2008-03-04,DJ,OFFICIAL STATE FOOD & DRINK,,1200,"This melon made it big--really big--as Oklahoma's state vegetable (yep, vegetable--they already had a state fruit)",watermelon,NA
2008-03-04,DJ,JACK LONDON,,1200,The 1913 Hobart Bosworth film is the first movie of this Jack London novel about Wolf Larsen & his ship,The Sea Wolf,NA
2008-03-04,DJ,"""CAL"" OF THE WILD",,1200,Sea nymph who detained Odysseus for 7 years,Calypso,NA
2008-03-04,DJ,THE ASSASSINATION BUREAU,,1200,"Engelbert Dollfuss, the chancellor of this neighbor of Germany, was assassinated by Nazis in 1934",Austria,NA
2008-03-04,DJ,WELCOME TO CARLSBAD CAVERNS,,1600,"(Jon of the Clue Crew wriggles through a small cave opening at Carlsbad Caverns Nat'l Park, New Mexico.)  Carlsbad is part of an ancient one of these structures, on the edge of an inland sea; it was mostly formed by the remains of algae & sponges, not coral",a reef,http://www.j-archive.com/media/2008-03-04_DJ_24.jpg
2008-03-04,DJ,FROM HERE TO MATERNITY,(Alex: You have to identify the mother of each person we mention in the clue.),1600,Shaun Cassidy,Shirley Jones,NA
2008-03-04,DJ,OFFICIAL STATE FOOD & DRINK,,1600,The official state drink of Rhode Island is milk with this flavor syrup; that'll wake you up,coffee,NA
2008-03-04,DJ,JACK LONDON,,1600,"In ""The Call of the Wild"", a dog with this name is stolen & forced to be a working dog in Alaska",Buck,NA
2008-03-04,DJ,"""CAL"" OF THE WILD",,NA,Port city indicated here,Calais,http://www.j-archive.com/media/2008-03-04_DJ_29.jpg
2008-03-04,DJ,THE ASSASSINATION BUREAU,,1600,"Bearing the name of the man who filmed it, it's the best-known recording of JFK's assassination",the Zapruder film,NA
2008-03-04,DJ,WELCOME TO CARLSBAD CAVERNS,,2000,"(Kelly of the Clue Crew reports from inside Carlsbad Caverns Nat'l Park, New Mexico.)  The immense chambers in the cave at Carlsbad Cavern are the result of the aggressive dissolution of limestone by this acid, H2SO4",sulfuric acid,NA
2008-03-04,DJ,FROM HERE TO MATERNITY,(Alex: You have to identify the mother of each person we mention in the clue.),2000,Sean Astin,Patty Duke,NA
2008-03-04,DJ,OFFICIAL STATE FOOD & DRINK,,NA,"Natchitoches meat pie, which has its own festival, is the official meat pie of this state",Louisiana,NA
2008-03-04,DJ,JACK LONDON,,2000,"The popular Jack London story ""To Build"" this is about a man trying to survive a harsh Yukon winter night",a fire,NA
2008-03-04,NA,NA,NA,NA,NA,NA,NA
2008-03-04,DJ,THE ASSASSINATION BUREAU,,2000,"In 1835, this U.S. president survived an assassination attempt when both pistols used by the gunman misfired",Andrew Jackson,NA
2008-03-04,FJ,SPACE: 2007,,NA,A NASA Mars lander has this mythic name because it was made of parts from a scrapped 2001 mission,Phoenix,NA
