date,round,category,comment,value,clue,response,link
1999-05-04,J,PRESIDENTIAL PORTRAITS,,100,He was the first president born in a log cabin,Andrew Jackson,NA
1999-05-04,J,SO YOU WANT TO BE A BALLET DANCER,,100,"When you belly up to this, you'll use it to steady yourself while you practice your moves",Bar,NA
1999-05-04,J,IT'S A LEAP,,100,It's the next year that will be a leap year,2000,NA
1999-05-04,J,IMPERSONATORS,,100,Impersonator El Vez puts a Mexican spin on this singer,Elvis Presley,NA
1999-05-04,J,CLIFFS NOTES,(Alex: About great works of literature.),100,Poor family makes big move from Oklahoma to California; it doesn't work out,"""The Grapes of Wrath""",NA
1999-05-04,J,"THEY'RE ""OFF""",,100,Event that immediately follows the countdown at Cape Canaveral,Blast off/liftoff,NA
1999-05-04,J,PRESIDENTIAL PORTRAITS,,200,He's the war hero seen here,Ulysses S. Grant,NA
1999-05-04,J,SO YOU WANT TO BE A BALLET DANCER,,200,Learn to do your shopping early; Decembers will be spent rehearsing this ballet that premiered in December 1892,"""The Nutcracker""",NA
1999-05-04,J,IT'S A LEAP,,200,Some of these largest marsupials can travel up to 16 feet in one leap,Kangaroos,NA
1999-05-04,J,IMPERSONATORS,,200,"When she appeared at the 1999 Oscars dressed as Elizabeth, she said, ""I am the African queen""",Whoopi Goldberg,NA
1999-05-04,J,CLIFFS NOTES,(Alex: About great works of literature.),200,Massachusetts man spends 2 years living alone in a cabin in the woods; writes book,"""Walden""",NA
1999-05-04,J,"THEY'RE ""OFF""",,200,A football game begins with one,Kickoff,NA
1999-05-04,J,PRESIDENTIAL PORTRAITS,,300,"""The Adventures of Huckleberry Finn"" was published during his term in office",Chester A. Arthur,NA
1999-05-04,J,SO YOU WANT TO BE A BALLET DANCER,,300,"When class ends, remember to do reverence, one or a series of these, to your teacher",Bow/curtsey,NA
1999-05-04,J,IT'S A LEAP,,300,In 1958 this country predicted its Great Leap Forward would establish a Communist utopia,China,NA
1999-05-04,J,IMPERSONATORS,,300,"Lucille Ball was the mirror image of this Marx Brother when she impersonated him on ""I Love Lucy""",Harpo Marx,NA
1999-05-04,J,CLIFFS NOTES,(Alex: About great works of literature.),NA,London physician creates new designer drug; has way too much fun; pays dearly,"""Dr. Jekyll and Mr. Hyde""",NA
1999-05-04,J,"THEY'RE ""OFF""",,300,"""Laverne & Shirley"" to ""Happy Days"", for example",Spin-off,NA
1999-05-04,J,PRESIDENTIAL PORTRAITS,,400,He was the first Democratic president elected after the Civil War,Grover Cleveland,NA
1999-05-04,J,SO YOU WANT TO BE A BALLET DANCER,,400,"You'll feel full of ""esprit de"" this group, a ballet's main ensemble",Corps,NA
1999-05-04,J,IT'S A LEAP,,400,"In song Kenny Loggins & Bruce Springsteen are among artists who've taken a ""leap of"" this",Faith,NA
1999-05-04,J,IMPERSONATORS,,400,"(Hello, I am Jon Lovitz. [Coughs])  My ""SNL"" impersonation of this 1988 presidential candidate was not the reason he lost the election",Michael Dukakis,http://www.j-archive.com/media/1999-05-04_J_29.jpg
1999-05-04,J,CLIFFS NOTES,(Alex: About great works of literature.),400,English schoolboys crash-land on a deserted island; real bad things happen,"""Lord of the Flies""",NA
1999-05-04,J,"THEY'RE ""OFF""",,400,"When push comes to this, it means to leave shore",Shove off,NA
1999-05-04,J,PRESIDENTIAL PORTRAITS,,500,He was our shortest president,"James Madison (at 5\' 4"")",NA
1999-05-04,J,SO YOU WANT TO BE A BALLET DANCER,,500,"In addition to your positions, remember your port de bras, the set of movements of these",Arms,NA
1999-05-04,J,IT'S A LEAP,,500,"This ""Leviathan"" philosopher's last words concerned his ""leap in the dark""",Thomas Hobbes,NA
1999-05-04,J,IMPERSONATORS,,500,"In 1995 the ""Tonight Show"" featured ""dancing"" men impersonating this California judge",Lance Ito,NA
1999-05-04,J,CLIFFS NOTES,(Alex: About great works of literature.),500,German soldier goes to fight in World War I; gets killed; end of story,"""All Quiet on the Western Front""",NA
1999-05-04,J,"THEY'RE ""OFF""",,500,A round of golf begins with one,Tee off,NA
1999-05-04,DJ,THE WINNING SIDE,(Alex: You have to identify the nation or state.),200,"The Battle of Marathon,490 B.C.",Greeks/Athens,NA
1999-05-04,DJ,CINEMATIC CHICAGO,,200,Maniacal musical mayhem of brothers Jake & Elwood punctuates this Chicago-set 1980 comedy,The Blues Brothers,NA
1999-05-04,DJ,ROMANIA MANIA,,200,A replica of this city's Trajan's Column stands near Bucharest's treasury,Rome,NA
1999-05-04,NA,NA,NA,NA,NA,NA,NA
1999-05-04,NA,NA,NA,NA,NA,NA,NA
1999-05-04,DJ,10-LETTER WORDS,,200,"A bumpy plane ride is usually caused by this irregular motion of air, sometimes ""clear air""",Turbulence,NA
1999-05-04,DJ,THE WINNING SIDE,(Alex: You have to identify the nation or state.),400,"The Battle of Chancellorsville,1863",Confederacy,NA
1999-05-04,DJ,CINEMATIC CHICAGO,,400,Chicago con men Newman & Redford stage an elaborate revenge on a gangster in this film that won 7 Oscars,The Sting,NA
1999-05-04,DJ,ROMANIA MANIA,,400,"Spit it out!  One of Romania's main agricultural products is the seed of this flower, genus Helianthus",Sunflower,NA
1999-05-04,DJ,MEDIEVAL TECHNOLOGY,,400,"Now common, before 1400 this device was used only in a few applications like grindstones & hurdy-gurdys",Crank,NA
1999-05-04,DJ,ROCKET SCIENCE,,400,The Atlas is an example of this first stage that lifts a multistage rocket off the ground,Booster,NA
1999-05-04,DJ,10-LETTER WORDS,,400,"A passionate preacher who holds public services, or any one of the 4 Gospel writers",Evangelist,NA
1999-05-04,DJ,THE WINNING SIDE,(Alex: You have to identify the nation or state.),600,"The Battle of San Jacinto,1836",Texas,NA
1999-05-04,DJ,CINEMATIC CHICAGO,,600,Tom Cruise played a North Shore teenager who goes a bit wild when his parents go out of town in this 1983 comedy,Risky Business,NA
1999-05-04,DJ,ROMANIA MANIA,,600,"The happy cemetery seen here is in this 39,000-square-mile region of Romania associated with unnatural death",Transylvania,NA
1999-05-04,DJ,MEDIEVAL TECHNOLOGY,,600,12th C. mathematician Bhaskara had an idea for this type of machine that hasn't been made yet,Perpetual motion machine,NA
1999-05-04,DJ,ROCKET SCIENCE,,600,"During the Gulf War, the U.S. used these ""All-American"" missiles to intercept Iraq's Scuds",Patriot missiles,NA
1999-05-04,DJ,10-LETTER WORDS,,600,This term for a competent but undistinguished craftsman sounds like a person who takes lots of trips,Journeyman,NA
1999-05-04,DJ,THE WINNING SIDE,(Alex: You have to identify the nation or state.),NA,"The Battle of Quebec,1759",British,NA
1999-05-04,DJ,CINEMATIC CHICAGO,,800,An eerie fascination with fire fuels this 1991 Kurt Russell picture about heroic Chicago firefighters,Backdraft,NA
1999-05-04,DJ,ROMANIA MANIA,,800,"Ilie Nastase, sometimes called ""Nasty"", led Romania to this sport's Davis Cup finals in 1969, 1971 & 1972",Tennis,NA
1999-05-04,DJ,MEDIEVAL TECHNOLOGY,,NA,"Dante described Satan waving his arms like a ""molin che il vento gira"", one of these structures",Windmill,NA
1999-05-04,DJ,ROCKET SCIENCE,,800,"The ICBM, which stands for this, can deliver a payload to a military target thousands of miles away",Intercontinental ballistic missile,NA
1999-05-04,DJ,10-LETTER WORDS,,800,"Title adjective for Anne Tyler's ""Tourist""",Accidental,NA
1999-05-04,DJ,THE WINNING SIDE,(Alex: You have to identify the nation or state.),1000,"The Battle of Marengo, Italy,1800",France,NA
1999-05-04,DJ,CINEMATIC CHICAGO,,1000,"Say the name of this Chicago-set 1992 horror movie 5 times into a mirror & a ""sweet"" killer will appear",Candyman,NA
1999-05-04,DJ,ROMANIA MANIA,,1000,The Danube divides Romania from this Black Sea neighbor country to the south,Bulgaria,NA
1999-05-04,DJ,MEDIEVAL TECHNOLOGY,,1000,Ornamental hipposandals were used in ancient times; these didn't evolve until the Middle Ages,Horseshoes,NA
1999-05-04,DJ,ROCKET SCIENCE,,1000,In 1966 the U.S. government awarded his heirs $1 million for infringements on his rocket patents,Robert Goddard,NA
1999-05-04,DJ,10-LETTER WORDS,,1000,"From the Latin for ""to tear"", it's a jagged tear or wound, Ouch!",Laceration,NA
1999-05-04,FJ,HISTORIC GEOGRAPHY,,NA,"Named for its shape, this region stretches NW from the Persian Gulf, W. to Syria, then S. through Palestine",the Fertile Crescent,NA
