date,round,category,comment,value,clue,response,link
2008-04-09,J,QUOTATIONS,,200,"In 1952, after being relieved of command in Korea, he said, ""It is fatal to enter any war without the will to win it""",(Douglas) MacArthur,NA
2008-04-09,J,OSCAR-WINNING SONGS,"(Alex: We'll give you the song, you identify the motion picture.)",200,"""When You Wish Upon A Star""",Pinocchio,NA
2008-04-09,J,HAVE SOME WINE,,200,Grades of this wine run from extra-brut to doux,champagne,NA
2008-04-09,J,LEADING MEN,,200,In 2006 this country's President Ahmadinejad admitted it was enriching uranium,Iran,NA
2008-04-09,J,LEFT TO YOUR OWN DEVICES,,200,"When this device is ""on hook"", the speech circuit is disabled & the ringing circuit is connected",a phone,NA
2008-04-09,J,"""T.W.""",,200,"This brand was introduced as Plastone, a premium car polish, in 1944",Turtle Wax,NA
2008-04-09,J,QUOTATIONS,,400,"Winston Churchill said it's good for the uneducated ""to read books of quotations."" This one ""is an admirable work""",Bartlett\'s,NA
2008-04-09,J,OSCAR-WINNING SONGS,"(Alex: We'll give you the song, you identify the motion picture.)",400,"""Take My Breath Away""",Top Gun,NA
2008-04-09,J,HAVE SOME WINE,,400,"If selling wine, remember that every bottle must list the name, the producer & this content if it's over 14%",the alcohol content,NA
2008-04-09,J,LEADING MEN,,400,"In 1938 this prime minister returned to Britain from a meeting with Hitler saying, ""I believe it is peace in our time""",Chamberlain,NA
2008-04-09,J,LEFT TO YOUR OWN DEVICES,,400,"The name of this ancient device used for calculations is from the Latin for ""counting board""",an abacus,NA
2008-04-09,J,"""T.W.""",,400,"The younger, often second, spouse of a rich middle-aged man",a trophy wife,NA
2008-04-09,J,QUOTATIONS,,600,"After losing the heavyweight title to Gene Tunney in 1926, he told his wife, ""Honey, I just forgot to duck""",(Jack) Dempsey,http://www.j-archive.com/media/2008-04-09_J_03.jpg
2008-04-09,J,OSCAR-WINNING SONGS,"(Alex: We'll give you the song, you identify the motion picture.)",600,"""You Must Love Me""",Evita,NA
2008-04-09,J,HAVE SOME WINE,,NA,"After dinner, enjoy a nice port wine from this nation's Douro Valley where it originated",Portugal,NA
2008-04-09,J,LEADING MEN,,600,Otmar Hasler is prime minister of this small Alpine nation between Switzerland & Austria,Liechtenstein,NA
2008-04-09,J,LEFT TO YOUR OWN DEVICES,,600,"On a crash cart in a hospital, you'll find this device that shocks the heart",a defibrillator,NA
2008-04-09,J,"""T.W.""",,600,You might have learned to ride your bike with the help of these attachments,training wheels,NA
2008-04-09,J,QUOTATIONS,,800,"In April 1974 this kidnapped heiress announced, ""This is Tania... I'm a soldier in the People's Army""",Patricia Hearst,NA
2008-04-09,J,OSCAR-WINNING SONGS,"(Alex: We'll give you the song, you identify the motion picture.)",800,"""I'm Easy""",Nashville,NA
2008-04-09,J,HAVE SOME WINE,,800,"A wine lover know""z"" this Calif. grape that produces red & white has been traced back to Italy's Primitivo",Zinfandel,NA
2008-04-09,J,LEADING MEN,,800,Hugo Chavez of this South American country is an admirer of Simon Bolivar,Venezuela,NA
2008-04-09,J,LEFT TO YOUR OWN DEVICES,,800,"Elisha Otis' son Charles improved on the device that slowed a speeding this, whether or not the rope broke",an elevator,NA
2008-04-09,J,"""T.W.""",,800,"This Southerner wrote the 1959 classic ""Sweet Bird of Youth""",Tennessee Williams,NA
2008-04-09,J,QUOTATIONS,,1000,"In 1975 she commented on a 1955 event by saying, ""My only concern was to get home after a hard day's work""",Rosa Parks,NA
2008-04-09,J,OSCAR-WINNING SONGS,"(Alex: We'll give you the song, you identify the motion picture.)",1000,"""Under the Sea""",The Little Mermaid,NA
2008-04-09,J,HAVE SOME WINE,,1000,"You don't have to pull the feathers off this ""chilly"" pink sparkling wine originally from Germany",Cold Duck,NA
2008-04-09,J,LEADING MEN,,1000,"Like his father whom he succeeded, Bashar al-Assad heads the Ba'ath Party in this Middle East country",Syria,NA
2008-04-09,J,LEFT TO YOUR OWN DEVICES,,1000,"(Kelly of the Clue Crew gives the clue from a lab.)  Stretch a balloon over a glass, secure with rubber bands, then place a straw on top & you have a simple version of this device that measures air pressure",a barometer,http://www.j-archive.com/media/2008-04-09_J_10a.jpg
2008-04-09,J,"""T.W.""",,1000,"Dominating the tropics, these blow mainly from the northeast in the Northern Hemisphere",trade winds,NA
2008-04-09,DJ,SCIENCE & NATURE,,400,"In the U.S., alligators & crocodiles co-exist only at the southern tip of this state",Florida,NA
2008-04-09,DJ,FILMS OF THE '40s,,400,"Van Heflin, Gig Young & Robert Coote played Athos, Porthos & Aramis in this ""novel"" 1948 film",The Three Musketeers,NA
2008-04-09,DJ,ASIAN PERSUASION,,400,"Following college, Anderson Cooper studied Vietnamese at the University of this Asian capital city",Hanoi,NA
2008-04-09,DJ,"""OO"" WHO?",,400,"Kentucky has only one national forest, & it's named for this trailblazer",Daniel Boone,NA
2008-04-09,DJ,LITERARY SEQUELS,,400,"""The Restaurant at the End of the Universe"" was one of Douglas Adams' sequels to this novel",The Hitchhiker\'s Guide to the Galaxy,NA
2008-04-09,DJ,BODY LANGUAGE,,400,"To know how many of you showed up for the 3-hour video of my trip to Manitoba, I'll take this ""count""",a head count,NA
2008-04-09,DJ,SCIENCE & NATURE,,800,In 1991 radar images hinted that there was ice at the north pole of this inner planet,Mercury,NA
2008-04-09,DJ,FILMS OF THE '40s,,800,"At the end of 1949's ""In the Good Old Summertime"", Liza Minnelli made her screen debut as this woman's daughter",Judy Garland,NA
2008-04-09,DJ,ASIAN PERSUASION,,800,"Despite war & a U.S. invasion in 2001, this nation has the highest birthrate in Asia, 46 births per 1,000 citizens",Afghanistan,NA
2008-04-09,DJ,"""OO"" WHO?",,800,"He's the subject of the biographies ""Official and Confidential"" & ""The Man and the Secrets""",J. Edgar Hoover,NA
2008-04-09,DJ,LITERARY SEQUELS,,800,"In 1959 Grace Metalious returned to this town, hoping to cash in on the success of her earlier novel",Peyton Place,NA
2008-04-09,DJ,BODY LANGUAGE,,800,Hyphenated adjective meaning so appetizing you salivate,mouth-watering,NA
2008-04-09,DJ,SCIENCE & NATURE,,1200,17th century Dutch scientist Christiaan Huygens developed the wave theory of this,light,NA
2008-04-09,DJ,FILMS OF THE '40s,,1200,"(Film critic Leonard Maltin delivers the clue.) This 1941 detective drama, a Bogart classic, is in my top 5; after all these years, it's still a challenge to figure out",The Maltese Falcon,http://www.j-archive.com/media/2008-04-09_DJ_26.jpg
2008-04-09,DJ,ASIAN PERSUASION,,1200,"Growing only about 5-9 inches long, the amago salmon is native to the southern islands of this Asian nation",Japan,NA
2008-04-09,DJ,"""OO"" WHO?",,1200,"What he really said in 1925 was that ""the chief business of the American people is business""",Calvin Coolidge,NA
2008-04-09,DJ,LITERARY SEQUELS,,1200,"""Of Time and the River"" was his sequel to ""Look Homeward, Angel""",Thomas Wolfe,NA
2008-04-09,DJ,BODY LANGUAGE,,1200,A drink taken for ocular stimulation on waking up,an eye-opener,NA
2008-04-09,DJ,SCIENCE & NATURE,,NA,"Dinosaurs died out in this geological era that means ""middle life""",the Mesozoic era,NA
2008-04-09,DJ,FILMS OF THE '40s,,1600,"He made a cameo appearance as a man carrying a violin in his own film ""Spellbound""",Hitchcock,NA
2008-04-09,DJ,ASIAN PERSUASION,,1600,"It's the Indian city that's the home to Eden Gardens, Asia's largest arena for cricket",Calcutta,NA
2008-04-09,DJ,"""OO"" WHO?",,1600,"For 5 months in 1863, he was commander of the Army of the Potomac",Joe Hooker,NA
2008-04-09,DJ,LITERARY SEQUELS,,NA,"""Myron"" was Gore Vidal's sequel to this novel",Myra Breckinridge,NA
2008-04-09,DJ,BODY LANGUAGE,,1600,"Sir, to toy with a woman's affections makes you a cad, a bounder, this--technically a calcaneus",a heel,NA
2008-04-09,DJ,SCIENCE & NATURE,,2000,"In 1766 this English chemist discovered the properties of hydrogen, which he called ""inflammable air""",Henry Cavendish,NA
2008-04-09,DJ,FILMS OF THE '40s,,2000,The 1949 film about this big ape won a special effects Oscar (remember--we said 1949),Mighty Joe Young,NA
2008-04-09,DJ,ASIAN PERSUASION,,2000,"Because of its distinctive call, this central Asian bovine is known as the grunting ox",a yak,NA
2008-04-09,DJ,"""OO"" WHO?",,2000,The woman seen here was one of many painted by this Dutch-born abstract expressionist,(Willem) de Kooning,http://www.j-archive.com/media/2008-04-09_DJ_05.jpg
2008-04-09,DJ,LITERARY SEQUELS,,2000,"""My Career Goes Bung"" was Aussie author Miles Franklin's sequel to this novel",My Brilliant Career,NA
2008-04-09,DJ,BODY LANGUAGE,,2000,This type of pork-barrel spending refers to funds directed to a member of Congress' pet project,an earmark,NA
2008-04-09,FJ,1950s FICTION,,NA,"Later translated into Russian by the author, it was dubbed both one of the best books of 1955 & one of the filthiest",Lolita,NA
