date,round,category,comment,value,clue,response,link
2008-04-10,J,READ YOUR BIBLE,,200,"In the New Testament, Zacchaeus climbs a tree to get a better view of this man",Jesus,NA
2008-04-10,J,"MOVIE ""NIGHT""",,200,"Wilfrid Brambell played Paul McCartney's granddad, ""a clean old man"", in this 1964 film",A Hard Day\'s Night,NA
2008-04-10,J,BRITISH VS. AMERICAN AUTO TERMINOLOGY,,200,"What the British call an estate car, we call this type of ""wagon""",a station wagon,NA
2008-04-10,J,SNAKES,,200,"This Egyptian queen didn't make an asp of herself, but she did use an asp snake to kill herself in 30 B.C.",Cleopatra,NA
2008-04-10,J,ON THE CUTTING EDGE,,200,The knife made to section this citrus fruit has a double-serrated edge with a gentle curve the last couple inches,a grapefruit,NA
2008-04-10,J,STARTS & ENDS WITH THE SAME LETTER,,200,A Utah senator or boat's passageway,Hatch,NA
2008-04-10,J,READ YOUR BIBLE,,400,"According to 1 Kings, after her death, Queen  Jezebel's body would be eaten in the street by these animals",dogs,NA
2008-04-10,J,"MOVIE ""NIGHT""",,400,David Strathairn played Edward R. Murrow in this 2005 film,"Good Night, and Good Luck",NA
2008-04-10,J,BRITISH VS. AMERICAN AUTO TERMINOLOGY,,400,"It's a windscreen to the limeys, but it's one of these to us Yanks",a windshield,NA
2008-04-10,J,SNAKES,,400,The timber species of these American pit vipers are found in 27 states,a rattlesnake,NA
2008-04-10,J,ON THE CUTTING EDGE,,400,It was used by the farmer's wife to cut off the tails of the 3 blind mice,a carving knife,NA
2008-04-10,J,STARTS & ENDS WITH THE SAME LETTER,,400,"A cutting remark or a sharp point, perhaps on a fishhook",a barb,NA
2008-04-10,J,READ YOUR BIBLE,,600,Luke 22:3 says that Satan entered into this apostle,Judas,NA
2008-04-10,J,"MOVIE ""NIGHT""",,600,1967 drama in which they called Rod Steiger Sheriff Gillespie & Sidney Poitier Mr. Tibbs,In the Heat of the Night,NA
2008-04-10,J,BRITISH VS. AMERICAN AUTO TERMINOLOGY,,600,"What we call gasoline, the Brits call this",petrol,NA
2008-04-10,J,SNAKES,,600,"The Eastern species of this is encircled with broad red and black bands, separated by narrow yellow ones",a coral snake,http://www.j-archive.com/media/2008-04-10_J_16.jpg
2008-04-10,J,ON THE CUTTING EDGE,,600,"The name of this large kitchen knife resembling a hatchet is from a word meaning ""to split""",a cleaver,NA
2008-04-10,J,STARTS & ENDS WITH THE SAME LETTER,,600,A generally nonmalignant growth on the surface of a mucous membrane,a polyp,NA
2008-04-10,J,READ YOUR BIBLE,,800,"It's the color of manna, as described in Exodus",white,NA
2008-04-10,J,"MOVIE ""NIGHT""",,800,Vampires appear when the sun sets for a month in Alaska in this 2007 film based on a graphic novel,30 Days of Night,NA
2008-04-10,J,BRITISH VS. AMERICAN AUTO TERMINOLOGY,,800,"This car part is the bonnet to the Brits, but to us it's one of these",the hood,NA
2008-04-10,J,SNAKES,,800,"Ophiophagus hannah, the scientific name of this ""royal"" venomous snake, means that it eats other snakes",a king cobra,NA
2008-04-10,J,ON THE CUTTING EDGE,,800,This wedding knife comes in a server set & is often engraved with the names of the bride & groom,a cake knife,NA
2008-04-10,J,STARTS & ENDS WITH THE SAME LETTER,,800,It's the noble gas on the periodic table that fits the category,neon,NA
2008-04-10,J,READ YOUR BIBLE,,NA,"Found in some Bibles but not in others, this collection of writings is from the Greek for ""hidden things""",the Apocrypha,NA
2008-04-10,J,"MOVIE ""NIGHT""",,1000,"Joaquin Phoenix hides that he's from a family full of cops, including brother Mark Wahlberg in this 2007 drama",We Own the Night,NA
2008-04-10,J,BRITISH VS. AMERICAN AUTO TERMINOLOGY,,1000,"It's a transmission in America & one of these ""box""es across the Atlantic",a gearbox,NA
2008-04-10,J,SNAKES,,1000,"With a top speed of about 12 mph, this deadly African snake is said to be the world's fastest serpent",the black mamba,NA
2008-04-10,J,ON THE CUTTING EDGE,,1000,A specialty knife designed to slice this deli item has holes so that the slices will not stick to the blade,cheese,NA
2008-04-10,J,STARTS & ENDS WITH THE SAME LETTER,,1000,An estate given by a lord to a vassal in return for service,a fief,NA
2008-04-10,DJ,HEALTH MATTERS,,400,"Disclosing tablets stain this sticky whitish film on teeth, showing what you missed when you brushed & flossed",plaque,NA
2008-04-10,DJ,'60s TV,,400,"In 1961 this Western expanded to an hour; half-hour reruns began airing under the title ""Marshal Dillon""",Gunsmoke,NA
2008-04-10,DJ,ANAGRAMMED CANADIAN CITIES,,400,Napoleon would feel defeated there:WOO LATER,Waterloo,NA
2008-04-10,DJ,EUROPEAN HISTORY,,400,In 1689 William III & this queen ascended the British throne & accepted Parliament's Bill of Rights,Mary,NA
2008-04-10,DJ,SPEAK OF THE DICKENS!,,400,"""A boat of dirty and disreputable appearance"" is floating on this river at the beginning of ""Our Mutual Friend""",the Thames,NA
2008-04-10,DJ,"IT'S ALL ABOUT ""U""",,400,Diva fashionista Wilhelmina Slater is the nemesis of this ABC title character,Ugly Betty,NA
2008-04-10,DJ,HEALTH MATTERS,,800,Avascular necrosis of the femoral head may lead to surgery to replace this joint,the hip joint,NA
2008-04-10,DJ,'60s TV,,800,"Before starring as Detective Frank Cannon in the '70s, he narrated ""The Fugitive"" & ""Rocky and His Friends"" in the '60s",William Conrad,http://www.j-archive.com/media/2008-04-10_DJ_04.jpg
2008-04-10,DJ,ANAGRAMMED CANADIAN CITIES,,800,"An ""equine"" town in the Yukon:HE HOTWIRES",Whitehorse,NA
2008-04-10,DJ,EUROPEAN HISTORY,,800,In 1415 Czech religious reformer John Hus was condemned & burned at the stake for this crime,heresy,NA
2008-04-10,DJ,SPEAK OF THE DICKENS!,,800,"""The Old Curiosity Shop"" mentions this ""corner"" in ""that dreary pile"" Westminster Abbey; Dickens ended up there",the Poet\'s Corner,NA
2008-04-10,DJ,"IT'S ALL ABOUT ""U""",,800,"In the 5th inning of a 1920 World Series game, Bill Wambsganss pulled off this kind of triple play",an unassisted triple play,NA
2008-04-10,DJ,HEALTH MATTERS,,NA,"(Jimmy of the Clue Crew delivers the clue.) For a six-foot man who weighs 170 pounds, divide weight in pounds by height in inches square, then multiply by 703 to calculate this number for an adult; normal range is 18.5 to 24.9",BMI (body mass index),http://www.j-archive.com/media/2008-04-10_DJ_13.jpg
2008-04-10,DJ,'60s TV,,1200,"In 1965 Pernell Roberts left this series & his part as eldest son Adam, saying he'd grown tired of the role",Bonanza,NA
2008-04-10,DJ,ANAGRAMMED CANADIAN CITIES,,1200,Capital of a prairie province:MOON DENT,Edmonton,NA
2008-04-10,DJ,EUROPEAN HISTORY,,1200,"In 1862 this Prussian said that ""The great questions of the day"" would be decided ""by iron and blood""",Bismarck,NA
2008-04-10,DJ,SPEAK OF THE DICKENS!,,1200,"In an 1845 tale, Mrs. Peerybingle says, ""To have"" one of these ""on the hearth is the luckiest thing in all the world!""",a cricket,NA
2008-04-10,DJ,"IT'S ALL ABOUT ""U""",,1200,"Rare except in ""Jeopardy!"" clues & nature films, this adjective means relating to or typical of bears",ursine,NA
2008-04-10,DJ,HEALTH MATTERS,,1600,"Chronic bronchitis & emphysema are causes of COPD, chronic obstructive this disease",pulmonary,NA
2008-04-10,DJ,'60s TV,,1600,"Martial arts star Bruce Lee played Kato, sidekick to this masked crimefighter, in an ABC series",the Green Hornet,NA
2008-04-10,DJ,ANAGRAMMED CANADIAN CITIES,,1600,"A ""feminine"" city on Prince Edward Island:NEWT LOOT CHART",Charlottetown,NA
2008-04-10,DJ,EUROPEAN HISTORY,,1600,In 1946 Vojvodina & this province were made autonomous within Serbia in Yugoslavia,Kosovo,NA
2008-04-10,DJ,SPEAK OF THE DICKENS!,,NA,"This ghost wears a long chain made of ""cash-boxes, keys, padlocks, ledgers, deeds, and heavy purses wrought in steel""",Jacob Marley,NA
2008-04-10,DJ,"IT'S ALL ABOUT ""U""",,1600,"As Schliemann is to Troy, Woolley is to this city",Ur,NA
2008-04-10,DJ,HEALTH MATTERS,,2000,"(Cheryl of the Clue Crew delivers the clue in front of a large monitor.)  Within moments of a fracture, the bone begins to knit by creating a callus, which is a tough meshwork of this protein found in skin and bones; eventually the callus is replaced by bone",collagen,http://www.j-archive.com/media/2008-04-10_DJ_15b.jpg
2008-04-10,DJ,'60s TV,,2000,"On July 10, 1962, this  satellite relayed the first live TV images across the Atlantic from the United States to France",Telstar,http://www.j-archive.com/media/2008-04-10_DJ_08.jpg
2008-04-10,DJ,ANAGRAMMED CANADIAN CITIES,,2000,A provincial capital (long may it rule):GAINER,Regina,NA
2008-04-10,DJ,EUROPEAN HISTORY,,2000,In 338 B.C. this Macedonian king ended Greece's independence with victory in the battle of Chaeronea,Philip,NA
2008-04-10,DJ,SPEAK OF THE DICKENS!,,2000,"Dickens thought of calling this mystery ""Dead? Or Alive?"", leading some to think the title hero didn't really die",The Mystery of Edwin Drood,NA
2008-04-10,DJ,"IT'S ALL ABOUT ""U""",,2000,These mystical scriptures of Hinduism date from about 900 B.C.,the Upanishads,NA
2008-04-10,FJ,U.S. AGRICULTURE,,NA,"In the 50 states, the highlighted area seen here is by far the most important for producing this",coffee,http://www.j-archive.com/media/2008-04-10_FJ.jpg
