date,round,category,comment,value,clue,response,link
1995-07-07,J,AMERICANA,,100,On December 19 the people of this U.S. state celebrate Princess Bernice Pauahi Bishop's birthday,Hawaii,NA
1995-07-07,J,SPORTS,,100,"In 1967 this New York Jets quarterback became the first pro to pass for more than 4,000 yards in a season",Joe Namath,NA
1995-07-07,J,GRAINS & STAPLES,,100,"The name of this food, not a true grain, comes from the Dutch meaning ""beech wheat""",buckwheat,NA
1995-07-07,J,HISTORIC WOMEN,,100,"On April 5, 1614, in Jamestown, she married John Rolfe",Pocahontas,NA
1995-07-07,J,ORGANIZATIONS,,100,Since 1908 this group has distributed over 26 million Bibles to hotels & other institutions,Gideon,NA
1995-07-07,J,PROVERBS,,100,"It's the 4-letter word that ""makes the world go round""",love,NA
1995-07-07,J,AMERICANA,,200,In 1986 this New York capital celebrated the 300th anniversary of its charter as a city,Albany,NA
1995-07-07,J,SPORTS,,200,"Founded in 1897, it's the world's oldest annual marathon",the Boston Marathon,NA
1995-07-07,J,GRAINS & STAPLES,,200,The rolled form of this grain cooks in about 5 minutes; the steel-cut takes much longer,oats,NA
1995-07-07,J,HISTORIC WOMEN,,200,"Anna Ivanovna, empress of Russia from 1730 to 1740, was the niece of this great ruler",Peter the Great,NA
1995-07-07,J,ORGANIZATIONS,,200,It's what the R stands for in AARP,retired,NA
1995-07-07,J,PROVERBS,,200,"There's ""no time like"" this",the present,NA
1995-07-07,J,AMERICANA,,300,This U.S. First Lady once taught dance in Grand Rapids,Betty Ford,NA
1995-07-07,J,SPORTS,,300,"In 1991, after 12 seasons at the Salt Palace, this NBA team moved its home games to the Delta Center",the Utah Jazz,NA
1995-07-07,J,GRAINS & STAPLES,,300,"Basmati, an aromatic type of this grain, is grown in India",rice,NA
1995-07-07,J,HISTORIC WOMEN,,300,"After 5 years in office, she resigned as Israeli prime minister in 1974",Golda Meir,NA
1995-07-07,J,ORGANIZATIONS,,300,"Not surprisingly, this organization, founded in 1884, maintains one of the world's finest reference libraries on dogs",the American Kennel Club,NA
1995-07-07,J,PROVERBS,,300,"It's the type of pot that ""never boils""",a watched pot,NA
1995-07-07,J,AMERICANA,,400,"Lancaster, which has the largest stockyards east of Chicago, was this state's capital from 1799 to 1812",Pennsylvania,NA
1995-07-07,J,SPORTS,,400,In 1992 Viktor Petrenko won the world championship in this sport,ice skating (men\'s figure skating),NA
1995-07-07,J,GRAINS & STAPLES,,400,"Millet seed, an important food for North Africans, is most often fed to these pets in the U.S.",birds,NA
1995-07-07,J,HISTORIC WOMEN,,400,The proceeds from some of her souvenir hatchets helped fund a home for wives of alcoholics,Carrie Nation,NA
1995-07-07,J,ORGANIZATIONS,,400,Members of this volunteer crime-fighting organization are famous for wearing red berets,the Guardian Angels,NA
1995-07-07,J,PROVERBS,,400,"It ""comes not alone"" & ""makes waste""",haste,NA
1995-07-07,J,AMERICANA,,500,"This Connecticut city famous for its university is nicknamed ""Elm City"" because it once had many elm-lined streets",New Haven,NA
1995-07-07,J,SPORTS,,500,"During his 1955-1966 career, this Dodger pitcher averaged 9.28 strikeouts per 9 innings",(Sandy) Koufax,NA
1995-07-07,J,GRAINS & STAPLES,,500,The pot type of this grain retains more of the bran than the pearl type,barley,NA
1995-07-07,J,HISTORIC WOMEN,,500,In 1813 this mistress of the late Lord Nelson was imprisoned for debt,Lady Hamilton,NA
1995-07-07,J,ORGANIZATIONS,,NA,"During Egypt's suspension from this group, 1979-1989, its headquarters was located in Tunisia",the Arab League,NA
1995-07-07,J,PROVERBS,,500,"""Every"" one of these ""fits not every foot""",a shoe,NA
1995-07-07,DJ,GEOGRAPHY,,200,A smaller canal connecting to this river brings fresh water to the Suez Canal,the Nile,NA
1995-07-07,NA,NA,NA,NA,NA,NA,NA
1995-07-07,DJ,AUTHORS,,200,"This author of ""The Time Machine"" coined the phrase ""the war that will end war""",H.G. Wells,NA
1995-07-07,DJ,1938,,200,On December 10 he announced he'd leave his Hyde Park estate & its papers & books to the U.S. government,FDR,NA
1995-07-07,DJ,MUSICAL THEATRE,,200,"Barbra Streisand introduced the song ""People"" in this musical",Funny Girl,NA
1995-07-07,NA,NA,NA,NA,NA,NA,NA
1995-07-07,DJ,GEOGRAPHY,,400,"Many things in Hong Kong are named for this queen, including the mountain peak on Hong Kong island",Victoria,NA
1995-07-07,NA,NA,NA,NA,NA,NA,NA
1995-07-07,DJ,AUTHORS,,400,"This author gave us the line ""I'll make him an offer he can't refuse""",(Mario) Puzo,NA
1995-07-07,DJ,1938,,400,"By accepting his membership dues, the League of Nations recognized him as emperor of Ethiopia",Haile Selassie,NA
1995-07-07,DJ,MUSICAL THEATRE,,400,In 1994 Brooke Shields made her Broadway debut as Betty Rizzo in this musical,Grease,NA
1995-07-07,NA,NA,NA,NA,NA,NA,NA
1995-07-07,DJ,GEOGRAPHY,,600,Lake Avernus in Campania in this country was believed by the ancients to be the entrance to Hades,Italy,NA
1995-07-07,DJ,20th CENTURY DESIGN,,600,The U.S. pavilion at Montreal's Expo 67 was covered by one of these,a geodesic dome,NA
1995-07-07,DJ,AUTHORS,,600,"This ""Return of the Native"" author's first novel, ""Desperate Remedies"", was published in 1871",Thomas Hardy,NA
1995-07-07,DJ,1938,,600,17 acres surrounding her cottage were transferred to the Shakespeare Birthplace Trust,Anne Hathaway,NA
1995-07-07,DJ,MUSICAL THEATRE,,600,"1992's ""Hello Muddah, Hello Fadduh!"" was inspired by the comic songs of this man",Allan Sherman,NA
1995-07-07,DJ,MIDDLE INITIAL C.,,600,"This father of Andrew Wyeth illustrated more than 20 juvenile classics, including ""Treasure Island""",N.C. Wyeth,NA
1995-07-07,DJ,GEOGRAPHY,,800,"The western portion of the Baltic island of Usedom belongs to Germany; the eastern, to this country",Poland,NA
1995-07-07,DJ,20th CENTURY DESIGN,,800,"Lighter than steel, this metal is also associated with the Modernist style of the '20s & '30s",aluminum,NA
1995-07-07,DJ,AUTHORS,,800,This Dr. Dolittle creator studied civil engineering at M.I.T.,Hugh Lofting,NA
1995-07-07,DJ,1938,,800,"Returning from Ireland to NYC in August, this aviator was given a parade down…er, up Broadway","""Wrong Way"" Corrigan",NA
1995-07-07,DJ,MUSICAL THEATRE,,NA,"1966 Jerry Herman musical that features the following:""For we need a little Christmas /Right this very minute /Candles in the window /Carols at the spinet /Yes, we need a little Christmas /Right this very minute /It hasn't snowed a single flurry /But Santa, dear, we're in a hurry /So climb down the chimney /Put up the brightest string of lights I've ever seen...""",Mame,NA
1995-07-07,DJ,MIDDLE INITIAL C.,,800,"Born in South Carolina in 1782, he was known as a ""war hawk"" because he supported the War of 1812",John C. Calhoun,NA
1995-07-07,DJ,GEOGRAPHY,,1000,Boothia Peninsula in this country is the former location of the north magnetic pole,Canada,NA
1995-07-07,DJ,20th CENTURY DESIGN,,1000,The firm of Piano & Rogers is famous for this high-tech Paris landmark built 1971-77,the Pompidou Centre,NA
1995-07-07,DJ,AUTHORS,,NA,1 of only 3 authors to win 2 Pulitzer Prizes for Fiction,"(1 of) Faulkner, Tarkington & John Updike",NA
1995-07-07,DJ,1938,,1000,"On April 27, 1938 Countess Geraldine Apponyi of Hungary married King Zog of this country",Albania,NA
1995-07-07,DJ,MUSICAL THEATRE,,1000,"""Cabaret"" was based partly on this 1951 play by John Van Druten",I Am a Camera,NA
1995-07-07,DJ,MIDDLE INITIAL C.,,1000,"When the parents of this ""pathfinder"" ran off together, his mother was still legally married to another man",John C. Fremont,NA
1995-07-07,FJ,NOTORIOUS,,NA,"Oscar Collazo, serving a life sentence for his assassination attempt on this president, was released in 1979",Harry Truman,NA
