date,round,category,comment,value,clue,response,link
1995-11-22,J,FOREIGN AUTHORS,,100,"This author of ""Around the World in Eighty Days"" also wrote librettos for operettas",Jules Verne,NA
1995-11-22,J,FISH,,100,The rainbow variety of this fish is part of the same genus as the Atlantic salmon,Trout,NA
1995-11-22,J,NATIONAL MONUMENTS,,100,Little Big Horn Battlefield National Monument is located south of Hardin in this state,Montana,NA
1995-11-22,J,SPORTS,,100,"On July 9, 1922 this future movie Tarzan became the first to swim the 100-meter freestyle in under a minute",Johnny Weissmuller,NA
1995-11-22,J,19th CENTURY AMERICA,,100,In May of 1873 the Post Office issued postcards with postage of this value,One cent,NA
1995-11-22,J,"""O"" & ""OS""","(Alex: The correct response will either begin with ""O"" or it will begin with ""O-S"".)",100,Synonym for antonym,Opposite,NA
1995-11-22,J,FOREIGN AUTHORS,,200,"Nikos Kazantzakis continued the adventures of this Homeric hero in a 33,333-line sequel",Odysseus,NA
1995-11-22,J,FISH,,200,These snakelike fish constitute the order Anguilliformes,Eels,NA
1995-11-22,J,NATIONAL MONUMENTS,,200,"The USA's largest national monument, this state's Misty Fjords, consists of glaciers & long, deep fjords",Alaska,NA
1995-11-22,J,SPORTS,,200,Kim Zmeskal & Shannon Miller are the only U.S. women to win the all-around title at these world championships,Gymnastics,NA
1995-11-22,J,19th CENTURY AMERICA,,200,In February of 1895 the U.S. reserves of this were down to a dangerously low $41 million dollars,Gold,NA
1995-11-22,J,"""O"" & ""OS""","(Alex: The correct response will either begin with ""O"" or it will begin with ""O-S"".)",200,Dog school,obedience,NA
1995-11-22,J,FOREIGN AUTHORS,,300,"After his return to Russia in 1994, this former dissident was given his own TV talk show",Aleksandr Solzhenitsyn,NA
1995-11-22,J,FISH,,300,Farming of the channel species of this fish is a rapidly growing business in the southern U.S.,Catfish,NA
1995-11-22,J,NATIONAL MONUMENTS,,300,In 1948 a replica of the log cabin in which this black educator was born was constructed at his memorial,Booker T. Washington,NA
1995-11-22,J,SPORTS,,300,"Of the four Grand Slam golf tournaments, it's the only one played outside the U.S.",British Open,NA
1995-11-22,J,19th CENTURY AMERICA,,300,"In 1804, this vice president ran for governor of New York, and lost",Aaron Burr,NA
1995-11-22,J,"""O"" & ""OS""","(Alex: The correct response will either begin with ""O"" or it will begin with ""O-S"".)",300,This Egyptian god's many burial places were considered sacred ground,Osiris,NA
1995-11-22,J,FOREIGN AUTHORS,,400,"Although he spent most of his life in Prague, Franz Kafka spoke & wrote in this language",German,NA
1995-11-22,J,FISH,,400,These aggressive aquarium fish are native to Thailand's clear but weedy waters,Fighting fish,NA
1995-11-22,J,NATIONAL MONUMENTS,,400,"This Wyoming formation has a base diameter of about 1,000 feet & a summit diameter of about 275 feet",Devils Tower,NA
1995-11-22,J,SPORTS,,400,"With a capacity of 63,000, this San Francisco ballpark is the National League's largest",Candlestick Park,NA
1995-11-22,J,19th CENTURY AMERICA,,NA,"Davy Crockett was in this city March 6, 1836",San Antonio (site of the Alamo),NA
1995-11-22,J,"""O"" & ""OS""","(Alex: The correct response will either begin with ""O"" or it will begin with ""O-S"".)",400,In 451 these Teutonic tribesmen joined with Attila in his expedition against Gaul,Ostrogoths,NA
1995-11-22,J,FOREIGN AUTHORS,,500,"Most of Nadine Gordimer's novels including ""July's People"" are set in this country where she grew up",South Africa,NA
1995-11-22,J,FISH,,500,This fish is called a muskie for short,muskellunge,NA
1995-11-22,J,NATIONAL MONUMENTS,,500,Arizona's Canyon De Chelly National Monument lies within this Indian reservation,Navajo,NA
1995-11-22,J,SPORTS,,500,The first to win this Patriots' Day event was John McDermott in 1897,Boston Marathon,NA
1995-11-22,J,19th CENTURY AMERICA,,500,"During an 1840 speaking tour in England, he persuaded thousands to emigrate to Nauvoo, Illinois",Brigham Young,NA
1995-11-22,J,"""O"" & ""OS""","(Alex: The correct response will either begin with ""O"" or it will begin with ""O-S"".)",500,The two Greek letters that fit this category,Omega & Omicron,NA
1995-11-22,DJ,FIRST LADIES,,200,This second wife of Ronald Reagan was born Anne Frances Robbins,Nancy Davis Reagan,NA
1995-11-22,DJ,BODIES OF WATER,,200,The temperature & salinity of this smallest ocean vary as the ice cover freezes & melts,Arctic Ocean,NA
1995-11-22,DJ,THEATRE,,200,"A Catholic woman & a Protestant man fall in love in ""Remembrance"", set in this Northern Ireland capital",Belfast,NA
1995-11-22,DJ,TRANSPORTATION,,200,"Not surprisingly, there are more motor vehicles registered in this state than any other",California,NA
1995-11-22,DJ,HALF BROTHERS,,200,"Soon after his father's death in 1743, he went to live with half-brother Lawrence at Mount Vernon",George Washington,NA
1995-11-22,DJ,THE ELEMENTS,,200,"The CD in your CD player  doesn't contain this element, Cd, but the batteries running it might",cadmium,NA
1995-11-22,DJ,FIRST LADIES,,400,In the 1940s she invested part of her inheritance in radio station KTBC in Austin,Lady Bird Johnson,NA
1995-11-22,DJ,BODIES OF WATER,,400,"U.S. Naval personnel in Cuba call it ""Gitmo"" for short",Guantanamo Bay,NA
1995-11-22,DJ,THEATRE,,400,"This Norwegian wrote his 1866 play ""Brand"" in rhyming verse",Henrik Ibsen,NA
1995-11-22,DJ,TRANSPORTATION,,400,"The name of this form of transportation comes from a Latin word meaning ""for all""",Omnibus,NA
1995-11-22,DJ,HALF BROTHERS,,400,"Michael Seeger, half-brother of this American folk singer, was a founder of the New Lost City Ramblers",Pete Seeger,NA
1995-11-22,DJ,THE ELEMENTS,,400,"Its atomic number is 28, but we think it would have made more sense if it was 5",Nickel,NA
1995-11-22,DJ,FIRST LADIES,,600,"In 1890 at age 5, she met her future husband in an Independence, Missouri Sunday school class",Bess Truman,NA
1995-11-22,DJ,BODIES OF WATER,,600,It separates Tierra del Fuego from the tip of the South American mainland,Straits of Magellan,NA
1995-11-22,DJ,THEATRE,,600,"This Greek-American diva is the leading character in Terrence McNally's play ""Master Class""",Maria Callas,NA
1995-11-22,DJ,TRANSPORTATION,,600,"In 1910, it became the first type of aircraft to offer commercial passenger service",Dirigible,NA
1995-11-22,DJ,HALF BROTHERS,,600,"Cato the Younger was half-brother of Servilia, mother of this chief assassin of Julius Caesar",Brutus,NA
1995-11-22,DJ,THE ELEMENTS,,600,Compounds featuring this element are used to treat the most common type of anemia,Iron,NA
1995-11-22,DJ,FIRST LADIES,,800,"While first lady, she arranged the White House wedding of her stepdaughter Alice in 1906",Edith Roosevelt,NA
1995-11-22,DJ,BODIES OF WATER,,800,"Site of a massive oil spill in 1989, it was named for the third son of King George III",Prince William Sound,NA
1995-11-22,DJ,THEATRE,,800,"""Edward II"", his play about a murdered king, premiered around 1592; sadly, he was killed in 1593",Christopher Marlowe,NA
1995-11-22,DJ,TRANSPORTATION,,800,"Completed in 1916, this Russian railroad is the longest in the world",Trans-Siberian Railroad,NA
1995-11-22,DJ,HALF BROTHERS,,NA,She was involved in an amorous episode with Thomas Seymour during the reign of her half-brother Edward VI,Queen Elizabeth I,NA
1995-11-22,DJ,THE ELEMENTS,,800,"Holmium was named by Per Teodor Cleve for this, his hometown",Stockholm,NA
1995-11-22,DJ,FIRST LADIES,,1000,"This first lady died in 1944 & was buried in West Branch, Iowa",Lou Henry Hoover,NA
1995-11-22,DJ,BODIES OF WATER,,NA,Ciudad Bolivar & Ciudad Guayana are the major cities on this river,Orinoco,NA
1995-11-22,DJ,THEATRE,,1000,"A man named Berenger appears in several of his plays including ""Rhinoceros"" & ""Exit the King""",Eugène Ionesco,NA
1995-11-22,DJ,TRANSPORTATION,,1000,In 1994 this ill-fated Italian cruise ship sank off the coast of Somalia,Achille Lauro,NA
1995-11-22,DJ,HALF BROTHERS,,1000,This third king of Israel succeeded to the throne after half-brother Adonijah tried to seize it,Solomon,NA
1995-11-22,DJ,THE ELEMENTS,,1000,"Noble gas whose name is from the Greek word for ""sun""",Helium,NA
1995-11-22,FJ,THE OSCARS,,NA,2 of the 5 actors before Tom Hanks to win 2 Best Actor Oscars,"(2 of) Marlon Brando, Gary Cooper, Dustin Hoffman, Fredric March & Spencer Tracy",NA
