date,round,category,comment,value,clue,response,link
1995-07-04,J,FAMOUS TEXANS,,100,"He was born near Stonewall, Texas in 1908; his wife Lady Bird was born in Karnack",Lyndon Baines Johnson,NA
1995-07-04,J,THE EMMYS,,100,In 1991 Kirstie Alley won an Emmy for playing Rebecca Howe on this sitcom,Cheers,NA
1995-07-04,J,TRANSPORTATION,,100,The wheels of these ancient Egyptian vehicles usually had 6 spokes,chariots,NA
1995-07-04,J,BENJAMIN FRANKLIN,,100,"Ben organized Philadelphia's first company to fight these, much needed where all buildings were wood",fires,NA
1995-07-04,J,MONEY,,100,This German unit of currency is abbreviated DM,a Deutsche Mark,NA
1995-07-04,J,"""L""s ON THE MAP",,100,World Book says this British city may have been named for the mythical Liver bird,Liverpool,NA
1995-07-04,J,FAMOUS TEXANS,,200,"This San Antonio resident helps out America's homemakers with lots of ""Hints""",Heloise,NA
1995-07-04,J,THE EMMYS,,200,It holds the record for most Emmys by a miniseries with 9,Roots,NA
1995-07-04,J,TRANSPORTATION,,200,"Fire departments have 3 main types of truck: pumper, rescue & this kind",ladder,NA
1995-07-04,J,BENJAMIN FRANKLIN,,200,In 1731 Ben joined this fraternal organization becoming Grand Master of the Grand Penn. Lodge in 1749,the Masons,NA
1995-07-04,J,MONEY,,200,The first of these U.S. coins were struck in 1964,Kennedy half-dollars,NA
1995-07-04,J,"""L""s ON THE MAP",,200,"There's a monument to the great racehorse Man O' War in this city, Kentucky's second largest",Lexington,NA
1995-07-04,J,FAMOUS TEXANS,,300,"A native of Texas, this author has set many of his novels there, including ""Lonesome Dove""",Larry McMurtry,NA
1995-07-04,J,THE EMMYS,,300,"In 1977 it was said that she ""won by a bionic vote"" as best actress in a drama series",Lindsay Wagner,NA
1995-07-04,J,TRANSPORTATION,,300,"Marked out in 1775, it was Kentucky's first road",the Wilderness Road,NA
1995-07-04,J,BENJAMIN FRANKLIN,,300,Ben's last public act was to sign a petition to Congress urging the abolition of this,slavery,NA
1995-07-04,J,MONEY,,300,"Of ding, dong or cong, the basic monetary unit of Vietnam",a dong,NA
1995-07-04,J,"""L""s ON THE MAP",,300,"Europeans were once banned from this Tibetan capital, which was known as ""the Forbidden City""",Lhasa,NA
1995-07-04,J,FAMOUS TEXANS,,400,"A Texas county is named for this ""father of condensed milk"" who was one of the state's pioneer settlers",(Gail) Borden,NA
1995-07-04,J,THE EMMYS,,400,Peter Falk has won 4 Emmys for playing this role,Columbo,NA
1995-07-04,J,TRANSPORTATION,,400,"New Mexico's first railroad, it began operation in the state in 1878","the (Atchison, Topeka and) Santa Fe Railway",NA
1995-07-04,J,BENJAMIN FRANKLIN,,400,Franklin lived abroad for 27 of his 84 years: 18 in Britain & 9 in this country,France,NA
1995-07-04,J,MONEY,,400,"The dirham, the main currency of the United Arab Emirates, derives its name from this Greek coin",a drachma,NA
1995-07-04,J,"""L""s ON THE MAP",,400,This city is the home of Bolivian Catholic University,La Paz,NA
1995-07-04,J,FAMOUS TEXANS,,500,"The family home of this longtime Speaker of the House is now a museum in Bonham, Texas",Sam Rayburn,NA
1995-07-04,J,THE EMMYS,,500,"In 1973 this director & choreographer won a Tony for ""Pippin"" & an Emmy for ""Liza with a 'Z'""",Bob Fosse,NA
1995-07-04,J,TRANSPORTATION,,NA,"The Oregon, California & Mormon trails followed this east-west River in Nebraska",the Platte,NA
1995-07-04,J,BENJAMIN FRANKLIN,,500,"Franklin's son William, governor of this colony, was a staunch Tory",New Jersey,NA
1995-07-04,J,MONEY,,500,In 1973 this country introduced coinage of the new Queen Margrethe II,Denmark,NA
1995-07-04,J,"""L""s ON THE MAP",,500,"Napoleon lost the 1813 Battle of this German city, which is also called the Battle of the Nations",Leipzig,NA
1995-07-04,DJ,HISTORY,,200,In 1856 France joined Britain in a second Opium War with this country,China,NA
1995-07-04,DJ,ARCHITECTURE,,200,Henry Hobson Richardson designed this Massachusetts city's Trinity Church in the Romanesque style,Boston,NA
1995-07-04,DJ,COMPOSERS,,200,"This ""Messiah"" composer said Christoph Gluck ""knows no more counterpoint than my cook""",Handel,NA
1995-07-04,DJ,PLACE NAME ORIGINS,,200,"The name of this former capital of West Germany is a Celtic word for ""town""",Bonn,NA
1995-07-04,DJ,TREES,,200,The pulp of the pods of this Eastern Mediterranean tree is used as a chocolate substitute,carob,NA
1995-07-04,DJ,WOMEN AUTHORS,,200,"Anne Edwards' biography of this author is titled ""Road to Tara""",Margaret Mitchell,NA
1995-07-04,DJ,HISTORY,,400,"It was seized by Iranian militants on November 4, 1979 & held for over 400 days",the American embassy,NA
1995-07-04,DJ,ARCHITECTURE,,400,Finlandia Hall in this capital city was one of Finnish architect Alvar Aalto's last creations,Helsinki,NA
1995-07-04,DJ,COMPOSERS,,400,"The first English composer elevated to the peerage, his title was Baron Britten of Aldeburgh",Benjamin Britten,NA
1995-07-04,DJ,PLACE NAME ORIGINS,,400,"The names Donegal & Dundee refer to these structures, one ""on the Dee"", one ""of the foreigners""",forts,NA
1995-07-04,DJ,TREES,,400,Rosin & turpentine are obtained from the resin of the slash & longleaf varieties of this tree,pine,NA
1995-07-04,DJ,WOMEN AUTHORS,,400,Beginning in 1978 Joyce Carol Oates was a writer in residence at this New Jersey university,Princeton,NA
1995-07-04,DJ,HISTORY,,600,"Between 1868 and 1894, Benjamin Disraeli was Prime Minister of England twice & this man was P.M. 4 times",Gladstone,NA
1995-07-04,DJ,ARCHITECTURE,,600,"Domino's Pizza founder Tom Monaghan once owned a museum devoted to this ""Prairie Style"" architect",Frank Lloyd Wright,NA
1995-07-04,DJ,COMPOSERS,,600,"The plot of this ""New World Symphony"" composer's opera ""Dimitrij"" begins where ""Boris Godunov"" ends",Dvorák,NA
1995-07-04,DJ,PLACE NAME ORIGINS,,NA,"The name of this large Russian lake is from Altaic for ""rich take"", referring to its rich take of fish",Lake Baikal,NA
1995-07-04,DJ,TREES,,600,The Japanese varieties of this fruit tree are grown solely for their ornamental value,the cherry,NA
1995-07-04,DJ,WOMEN AUTHORS,,600,"In the mid-1960s this co-founder of Ms. magazine wrote for the TV series ""That Was the Week that Was""",Gloria Steinem,NA
1995-07-04,DJ,HISTORY,,800,"The ""Golden Age"" of this Indian empire occurred during the reign of Shah Jahan, who built the Taj Mahal",the Mughals,NA
1995-07-04,DJ,ARCHITECTURE,,800,The Cathedral of Notre Dame at Reims is a masterpiece of this architectural style,Gothic,NA
1995-07-04,DJ,COMPOSERS,,800,"""The Erl-King"" & ""The Wanderer"" are among this 19th century composer's most famous lieder",Franz Schubert,NA
1995-07-04,DJ,PLACE NAME ORIGINS,,800,"This Belgian port's name may mean ""against the dike""",Antwerp,NA
1995-07-04,DJ,TREES,,NA,"South American Indians called this tree, Hevea brasiliensis, cahuchu, which means ""weeping wood""",the rubber tree,NA
1995-07-04,DJ,WOMEN AUTHORS,,800,"""Francois le Champi"" is an 1848 novel by this woman who liked to wear men's clothes",George Sand,NA
1995-07-04,DJ,HISTORY,,1000,In 404 B.C. a starving Athens was forced to give up its long fight in this war,the Peloponnesian War,NA
1995-07-04,DJ,ARCHITECTURE,,1000,This uppermost part of a capital has the same name as an ancient calculator,an abacus,NA
1995-07-04,DJ,COMPOSERS,,1000,"Russian ""Eugene Onegin"" composer whose brother Modest wrote the libretto for his last opera, ""Iolanta""",Tchaikovsky,NA
1995-07-04,DJ,PLACE NAME ORIGINS,,1000,This northern sea was named for a British admiral who was famous for a wind scale,Beaufort,NA
1995-07-04,DJ,TREES,,1000,A national park in California is named for this yucca plant that grows there,the Joshua tree,NA
1995-07-04,DJ,WOMEN AUTHORS,,1000,From 1917 to 1919 this poet from Maine was an actress & playwright with the Provincetown Players,Edna St. Vincent Millay,NA
1995-07-04,FJ,THE DECLARATION OF INDEPENDENCE,,NA,"1 of the 3 things ""we mutually pledge to each other"" at the end of the Declaration","(1 of) our lives, our fortunes, & our sacred honor",NA
