date,round,category,comment,value,clue,response,link
2003-05-19,J,THAT'S MY ATTORNEY GENERAL,(Alex: You have to identify the president.),200,John Ashcroft,George W. Bush,NA
2003-05-19,J,MERCURIAL,,200,"The Mercury News bills itself as ""The Newspaper of"" this California tech area",Silicon Valley,NA
2003-05-19,J,LITERARY LINES,,200,"""This is a story of how a Baggins had an adventure"" is a line from Chapter 1 of this novel","""The Hobbit""",NA
2003-05-19,J,SHATTERING ALLUSIONS,,200,"A person who can get out of tight situations is one of these, the name of a '20s escape artist",a Houdini,NA
2003-05-19,J,EARNINGS FROM THE CRYPT,(Alex: This is based on Forbes' top earning dead celebrities in the year 2002.),200,"With $37 million in 1 year, the ""King"" of the world's top-earning late celebrities is this man",Elvis Presley,NA
2003-05-19,J,HOW ODD!,,200,"To make the film ""The Sound of Music"" shorter, a theater manager in Seoul, South Korea cut all of these out of it",the songs,NA
2003-05-19,J,THAT'S MY ATTORNEY GENERAL,(Alex: You have to identify the president.),400,Janet Reno,Bill Clinton,NA
2003-05-19,J,MERCURIAL,,400,In the early '60s this man known as Q became a vice president at Mercury Records,Quincy Jones,NA
2003-05-19,J,LITERARY LINES,,400,"Completes the concluding line from ""Gone With The Wind"": ""After all...""","""Tomorrow is another day""",NA
2003-05-19,J,SHATTERING ALLUSIONS,,400,2 feuding families can be the Montagues & the Capulets or the Hatfields & these,the McCoys,NA
2003-05-19,J,EARNINGS FROM THE CRYPT,(Alex: This is based on Forbes' top earning dead celebrities in the year 2002.),400,"Of the 2 Beatles who qualify for the Forbes list, this man made more with a total of $20 million",John Lennon,NA
2003-05-19,J,HOW ODD!,,400,"Reportedly, when Henry Ford built his first automobile, he forgot to put in one of these gears",reverse,NA
2003-05-19,J,THAT'S MY ATTORNEY GENERAL,(Alex: You have to identify the president.),600,"Robert Kennedy(2 presidents, please)",John F. Kennedy & Lyndon B. Johnson,NA
2003-05-19,J,MERCURIAL,,600,The Mercury is the WNBA team in this city in which the mercury has hit 122,Phoenix,NA
2003-05-19,J,LITERARY LINES,,NA,"1954 novel that contains the lines ""This is our island.  It's a good island.  Until the grown-ups come to fetch us we'll have fun""","""Lord of the Flies""",NA
2003-05-19,J,SHATTERING ALLUSIONS,,600,"You may be ""read"" this; England passed the original one back in 1715 to deal with noisy protests",the riot act,NA
2003-05-19,J,EARNINGS FROM THE CRYPT,(Alex: This is based on Forbes' top earning dead celebrities in the year 2002.),600,The highest-earning late female celebrity is this sex symbol who pulled in $7 million,Marilyn Monroe,NA
2003-05-19,J,HOW ODD!,,600,It's the only precious gem composed of only one element,diamond (carbon),NA
2003-05-19,J,THAT'S MY ATTORNEY GENERAL,(Alex: You have to identify the president.),800,Edwin Meese III,Ronald Reagan,NA
2003-05-19,J,MERCURIAL,,800,"This Mercury astronaut didn't make it into orbit when launched May 5, 1961",Alan Shepard,NA
2003-05-19,J,LITERARY LINES,,800,"""1984"" begins, ""It was a bright cold day in April, and the clocks were striking"" this odd hour",13,NA
2003-05-19,J,SHATTERING ALLUSIONS,,800,"The double whammy goes back to Evil-Eye Fleegle, a character in this Al Capp strip",Li\'l Abner,NA
2003-05-19,J,EARNINGS FROM THE CRYPT,(Alex: This is based on Forbes' top earning dead celebrities in the year 2002.),800,"With $28 million, the number 2-earning late celebrity in the world is this cartoonist",Charles Schulz,NA
2003-05-19,J,HOW ODD!,,800,"This insect, the Musca domestica, can become a great-grandmother in only 60 days",common housefly,NA
2003-05-19,J,THAT'S MY ATTORNEY GENERAL,(Alex: You have to identify the president.),1000,Elliot Richardson,Richard Nixon,NA
2003-05-19,J,MERCURIAL,,1000,"The most famous broadcast of ""The Mercury Theater on the Air"" was this tale about Mars, broadcast October 30, 1938","""War of the Worlds""",NA
2003-05-19,J,LITERARY LINES,,1000,"This 1934 novel begins ""Monsieur Van Gogh!  It's time to wake up!""","""Lust for Life""",NA
2003-05-19,J,SHATTERING ALLUSIONS,,1000,"Being in the middle of things puts you at this, the point on the surface above the focus of an earthquake",epicenter,NA
2003-05-19,J,EARNINGS FROM THE CRYPT,(Alex: This is based on Forbes' top earning dead celebrities in the year 2002.),1000,"At $10 million made in a year, this man is certainly the highest-earning late Jamaican on the list",Bob Marley,NA
2003-05-19,J,HOW ODD!,,1000,"His name may be erased from your head, but he directed odd movies like ""Eraserhead"" & ""Mulholland Drive""",David Lynch,NA
2003-05-19,DJ,PHYSICAL SCIENCE,,400,"If a recipe told you to bring carbon to this point, you'd need to raise its temperature to 8,720 degrees",boiling point,NA
2003-05-19,DJ,POND CROSSERS,,400,"Once NYC's chief engineer, Marc Brunel later spent 19 years digging the first tunnel under this British river",Thames,NA
2003-05-19,DJ,GUINNESS RECORDS,,400,"Tish, one of these won by a British couple at a fair in 1956, swam happily in its bowl for a record 43 years",goldfish,NA
2003-05-19,DJ,AFRICAN COUNTRIES BY CITIES,(Alex: We'll give you the cities.),400,"Zagazig, Memphis,Aswan",Egypt,NA
2003-05-19,DJ,SKI YOU AT THE MOVIES,,400,"This actor who owns his own ski resort did much of his own skiing in the 1969 film ""Downhill Racer""",Robert Redford,NA
2003-05-19,DJ,"""RH"" FACTOR",,400,The African species of this mammal are either hook-lipped or square-lipped,rhinoceros,NA
2003-05-19,DJ,PHYSICAL SCIENCE,,800,A 1992 experiment using surface tension on polished silicon got water to defy physics by doing this,to go up,NA
2003-05-19,DJ,POND CROSSERS,,800,"In the 1820s American publishers ignored his bird drawings, so he took them to England",John James Audubon,NA
2003-05-19,DJ,GUINNESS RECORDS,,800,"Though its name is only 3 letters long, it's the biggest retail fashion chain",Gap,NA
2003-05-19,DJ,AFRICAN COUNTRIES BY CITIES,(Alex: We'll give you the cities.),800,"Kimberley,Humansdorp,Soweto",South Africa,NA
2003-05-19,DJ,SKI YOU AT THE MOVIES,,800,"Peter Sellers ""Clouseaus"" in on jewel thief David Niven at a ski resort in this 1964 film",The Pink Panther,NA
2003-05-19,DJ,"""RH"" FACTOR",,800,This island 12 miles off the coast of Turkey was the site of one of the 7 Wonders of the Ancient World,Rhodes (the Colossus),NA
2003-05-19,DJ,PHYSICAL SCIENCE,,NA,"This field is measured in nanoteslas -- it's about 60,000 nanoteslas at the poles & 30,000 at the equator",Earth\'s magnetic field,NA
2003-05-19,NA,NA,NA,NA,NA,NA,NA
2003-05-19,DJ,GUINNESS RECORDS,,NA,In this 1996 film Madonna went through a record 85 costume changes,Evita,NA
2003-05-19,DJ,AFRICAN COUNTRIES BY CITIES,(Alex: We'll give you the cities.),1200,"Tangier,Meknes,Casablanca",Morocco,NA
2003-05-19,DJ,SKI YOU AT THE MOVIES,,1200,"An Oscar-winning documentary profiled Yuichiro Miura, ""The Man Who Skied Down"" this mountain",Mount Everest,NA
2003-05-19,DJ,"""RH"" FACTOR",,1200,"From the Greek for ""orator"", it's the art of using language effectively & persuasively",rhetoric,NA
2003-05-19,DJ,PHYSICAL SCIENCE,,1600,In 1925 Wolfgang Pauli stated his exclusion principle -- no 2 of these particles in an atom can be in the same state,electrons,NA
2003-05-19,NA,NA,NA,NA,NA,NA,NA
2003-05-19,DJ,GUINNESS RECORDS,,1600,Guinness lists this product line as the most successful portable music system,Sony Walkman,NA
2003-05-19,DJ,AFRICAN COUNTRIES BY CITIES,(Alex: We'll give you the cities.),1600,"Malindi,Machakos,Mombasa",Kenya,NA
2003-05-19,DJ,SKI YOU AT THE MOVIES,,1600,"In a 1969 film, Dean Martin's daughter Claudia & this star of ""Adam-12"" got ""Ski Fever""",Martin Milner,NA
2003-05-19,DJ,"""RH"" FACTOR",,1600,In 1910 this future South Korean president became the first Korean to earn a Ph.D. from an American university,Syngman Rhee,NA
2003-05-19,DJ,PHYSICAL SCIENCE,,2000,Its formula is H2S & it smells like rotten eggs,hydrogen sulfide,NA
2003-05-19,DJ,POND CROSSERS,,2000,"This last name of British lord Jeffrey, who captured Montreal, is on a Massachusetts college",Amherst,NA
2003-05-19,DJ,GUINNESS RECORDS,,2000,"Alan Whitworth figures when he's done in 2007, his sketch of this fortification in England will be 73 miles long",Hadrian\'s Wall,NA
2003-05-19,DJ,AFRICAN COUNTRIES BY CITIES,(Alex: We'll give you the cities.),2000,"Tobruk,Benghazi,As-Sidrah",Libya,NA
2003-05-19,DJ,SKI YOU AT THE MOVIES,,2000,(Sarah of the Clue Crew at a ski resort in Colorado)  I've wanted to go skiing ever since I saw Audrey Hepburn meet Cary Grant at a ski resort in this classic 1963 caper,Charade,NA
2003-05-19,DJ,"""RH"" FACTOR",,2000,"Irises have this horizontal, underground stem which produces shoots & roots of a new plant",rhizome,NA
2003-05-19,FJ,AWARDS,,NA,The organization that sponsored the Stage Door Canteens during WWII is now known for these annual awards,Tony Awards,NA
