date,round,category,comment,value,clue,response,link
2004-06-28,J,LUXEMBOURG,,200,Rivaner is a profitable type of this planted in Luxembourg's Moselle Valley,grape,NA
2004-06-28,J,THE CINEMA,,200,"1999 film with the line ""The answer is out there, Neo, and it's looking for you, and it will find you if you want it to""",The Matrix,NA
2004-06-28,J,WHAT AM I HAVING?,,200,(Sarah of the Clue Crew delivers the clue from Germany.)  Haben sie Bier vom Fass?--I just asked for this form of beer,draft beer,http://www.j-archive.com/media/2004-06-28_J_08.jpg
2004-06-28,J,Y-R,"(Alex: Not The Young and the Restless, but each correct response will begin with a ""Y"" and end with a letter ""R"".)",200,"An astronomer may speak of a solar, lunar, equinoctial or sidereal one",a year,NA
2004-06-28,J,HAIR TODAY,,200,"This palindromic word can mean to cut short, or a short, blunt cut, with or without bangs",bob,NA
2004-06-28,J,GONE TOMORROW?,,200,"The Oahu tree one of these gastropods is quickly, not slowly, disappearing",a snail,NA
2004-06-28,J,LUXEMBOURG,,400,"Encyclopedia Britannica says this, not French, is the lingua franca of Luxembourg",German,NA
2004-06-28,J,THE CINEMA,,400,"The park bench Tom Hanks sat on in much of this 1994 film was in Chippewa Square in Savannah, Georgia",Forrest Gump,NA
2004-06-28,J,WHAT AM I HAVING?,,400,"(Sofia of the Clue Crew delivers the clue from Spain.)  Por favor, un plato de chorizo--a plate of this, please",sausage,http://www.j-archive.com/media/2004-06-28_J_09.jpg
2004-06-28,J,Y-R,"(Alex: Not The Young and the Restless, but each correct response will begin with a ""Y"" and end with a letter ""R"".)",400,A short war between Israel & Egypt & Syria in October 1973 was named for this high holiday,Yom Kippur,NA
2004-06-28,J,HAIR TODAY,,400,In 2004 this real estate tycoon told People magazine that his signature swept-forward style is his own handiwork,Trump,NA
2004-06-28,J,GONE TOMORROW?,,400,The Hine's emerald species of this insect has a wingspan that can reach about 3.5 inches,a dragonfly,NA
2004-06-28,J,LUXEMBOURG,,600,"During his years in exile, this ""Les Miserables"" author lived for a while in Vianden; his house there is now a museum",Victor Hugo,NA
2004-06-28,J,THE CINEMA,,600,"The popular soundtrack of this 2000 film includes ""I Am A Man Of Constant Sorrow"" & ""You Are My Sunshine""","O Brother, Where Art Thou?",NA
2004-06-28,J,WHAT AM I HAVING?,,600,"(Sofia of the Clue Crew delivers the clue from Venice.)  Caffe con zucchero, per favore--I take my coffee with this",sugar,http://www.j-archive.com/media/2004-06-28_J_10.jpg
2004-06-28,J,Y-R,"(Alex: Not The Young and the Restless, but each correct response will begin with a ""Y"" and end with a letter ""R"".)",600,"In October 2002 he made another supersonic flight, 55 years after his first",Chuck Yeager,NA
2004-06-28,J,HAIR TODAY,,600,This rastafarian style is Whoopi Goldberg's trademark,dreadlocks,NA
2004-06-28,J,GONE TOMORROW?,,600,The endangerment of the New Mexico ridge-nosed species of this snake was caused in part by collectors,a rattlesnake,NA
2004-06-28,J,LUXEMBOURG,,NA,In the 1940s Luxembourg joined with these 2 countries to form a customs union,Belgium & the Netherlands,NA
2004-06-28,J,THE CINEMA,,800,"It was the mythological container sought by Lara Croft in ""Lara Croft Tomb Raider: The Cradle of Life""",Pandora\'s box,NA
2004-06-28,J,WHAT AM I HAVING?,,800,(Sofia of the Clue Crew delivers the clue from Mexico.)  Voy a comer pollo con mole--I'm having this in a classic Mexican sauce,chicken,http://www.j-archive.com/media/2004-06-28_J_11a.jpg
2004-06-28,J,Y-R,"(Alex: Not The Young and the Restless, but each correct response will begin with a ""Y"" and end with a letter ""R"".)",800,This Cole was a known associate of Jesse James,Younger,NA
2004-06-28,J,HAIR TODAY,,800,"This 6-letter hairstyle is ""business in front, party in the back""",a mullet,NA
2004-06-28,J,GONE TOMORROW?,,800,"Picoides borealis is the red-cockaded species of this bird, still on the endangered list in 2004",the woodpecker,NA
2004-06-28,J,LUXEMBOURG,,1000,The Congress of Vienna in 1815 made Luxembourg a state headed by this type of ruler,a grand duke,NA
2004-06-28,J,THE CINEMA,,1000,"In this animated film, Henry J. Waternoose says, ""Kids these days.  They just don't get scared like they used to""","Monsters, Inc.",NA
2004-06-28,J,WHAT AM I HAVING?,,1000,"(Sarah of the Clue Crew delivers the clue from the Bronx.)  Hey, Sal, I got some hungry people out here; give me a garbage pie--I just ordered up one of these",a pizza with everything,http://www.j-archive.com/media/2004-06-28_J_12.jpg
2004-06-28,J,Y-R,"(Alex: Not The Young and the Restless, but each correct response will begin with a ""Y"" and end with a letter ""R"".)",1000,"""Savage Sam"" is a sequel to the Fred Gipson book called ""Old"" this",Yeller,NA
2004-06-28,J,HAIR TODAY,,1000,"George Clooney popularized the close-cut style named this, like a certain leader",a Caesar (cut),NA
2004-06-28,J,GONE TOMORROW?,,1000,Among the colorful mammals on the endangered list are the gray & the red ones of these predators,a wolf,NA
2004-06-28,DJ,MAIN STREET U.S.A.,,400,"Borgen's Cafe, on Main St. in Westby, Wisconsin, feels a bit like Oslo, with menus & banter in this language",Norwegian,NA
2004-06-28,DJ,POP MUSIC,,400,"This rapper won a 2000 MTV award for Best Male Video for ""The Real Slim Shady""",Eminem,NA
2004-06-28,DJ,"""A""NCIENT GREEKS",,400,A fabulist:620-560 B.C.,Aesop,NA
2004-06-28,DJ,FLOWERS,,400,"The white petals of this flower are usually pulled to see if ""she loves me"" or ""she loves me not""",a daisy,NA
2004-06-28,DJ,BRITISH INVENTIONS,,400,"A perambulator or pram to the Brits, it was invented in 1733 by William Kent for the Duke of Devonshire's kids",a baby carriage,NA
2004-06-28,DJ,BEFORE & AFTER,,400,1980 scarefest in which mom & daughter switch bodies one day & are stalked by Jason at Camp Crystal Lake,Freaky Friday the 13th,NA
2004-06-28,DJ,MAIN STREET U.S.A.,,800,In Salt Lake City take Main Street to this square to find the Mormon Tabernacle,Temple Square,NA
2004-06-28,DJ,POP MUSIC,,800,"'60s Dylan classic that begins, ""Once upon a time you dressed so fine""","""Like A Rolling Stone""",NA
2004-06-28,DJ,"""A""NCIENT GREEKS",,800,A philosopher & student of Plato:384-322 B.C.,Aristotle,NA
2004-06-28,DJ,FLOWERS,,800,This flower seen here is often spotted on a man's lapel,a carnation,http://www.j-archive.com/media/2004-06-28_DJ_22.jpg
2004-06-28,DJ,BRITISH INVENTIONS,,800,In 1676 Robert Hooke came up with a universal one of these to manipulate the mirrors of his helioscope,a universal joint,NA
2004-06-28,DJ,BEFORE & AFTER,,800,Leif Ericson's dad who was a huge star with low surface temperature,Erik the Red Giant,NA
2004-06-28,DJ,MAIN STREET U.S.A.,,1200,"There's a house dating from 1648 on Main St. in this ""directional"" resort village in New York's Hamptons",Southampton,NA
2004-06-28,DJ,POP MUSIC,,1200,"In the summer of 2002 this country star hit the Hot 100 chart with ""Courtesy Of The Red, White And Blue""",Toby Keith,NA
2004-06-28,DJ,"""A""NCIENT GREEKS",,1200,A comedic dramatist:445-385 B.C.,Aristophanes,NA
2004-06-28,DJ,FLOWERS,,NA,These flowers blooming in a Flanders cemetery during WWI inspired a famous poem by Major John McCrae,poppies,NA
2004-06-28,DJ,BRITISH INVENTIONS,,1200,The name of this Scot who invented the steam hammer sounds just like the American who invented basketball,(James) Nasmyth,NA
2004-06-28,DJ,BEFORE & AFTER,,1200,"Fictional girl sleuth who's the granddaughter of ""The Great Profile""",Nancy Drew Barrymore,NA
2004-06-28,DJ,MAIN STREET U.S.A.,,1600,"Bob Seger was ""down on Main Street"" in this city, home to a university",Ann Arbor,NA
2004-06-28,DJ,POP MUSIC,,1600,"Alicia Keys received 5 Grammys for 2001, including best new artist & song of the year for this hit","""Fallin\'""",NA
2004-06-28,DJ,"""A""NCIENT GREEKS",,1600,A mathematician:287-212 B.C.,Archimedes,NA
2004-06-28,DJ,FLOWERS,,1600,"Grown from bulbs, they're the cheerful spring flowers seen here",daffodils,http://www.j-archive.com/media/2004-06-28_DJ_24.jpg
2004-06-28,DJ,BRITISH INVENTIONS,,1600,"For the military, zoologist John Kerr developed the ""dazzle paint"" type of this, something animals also use",camouflage,NA
2004-06-28,DJ,BEFORE & AFTER,,1600,Projection at the southern tip of South America also called a cornucopia,Cape Horn o\' Plenty,NA
2004-06-28,DJ,MAIN STREET U.S.A.,,NA,"Your feelings may run deep on historic Main Street in this city, home of Oklahoma State University",Stillwater,NA
2004-06-28,DJ,POP MUSIC,,2000,"""Come Back Home"" is the first single from his 2003 album ""Day I Forgot""",Pete Yorn,NA
2004-06-28,DJ,"""A""NCIENT GREEKS",,2000,"The ""Oresteia"" tragedian:525-456 B.C.",Aeschylus,NA
2004-06-28,DJ,FLOWERS,,2000,"In song, Colorado is where these bluish & white state flowers grow",the Rocky Mountain columbines,NA
2004-06-28,DJ,BRITISH INVENTIONS,,2000,The miner's safety lamp was also called by the name of this British chemist who invented it in 1815,Sir Humphry Davy,NA
2004-06-28,DJ,BEFORE & AFTER,,2000,"""Lethal Weapon"" director whose group was caught in a Sierra Nevada pass in the winter of 1846-47",the Richard Donner Party,NA
2004-06-28,FJ,BOOK TITLES,,NA,"""I am the rose of Sharon"" & ""When you know your name, you should hang on to it"" are from 2 different books titled this",Song of Solomon,NA
