date,round,category,comment,value,clue,response,link
2004-07-21,J,POPULAR SCIENCE TOP STORIES OF 2003,,200,Japanese scientists genetically engineered this type of coffee plant with 70% less jitter than the regular,decaf,NA
2004-07-21,J,FIRST NAME'S THE SAME,,200,"Close, Frey",Glenn,NA
2004-07-21,J,CRIME TIME,,200,"During crime sprees with Clyde Barrow, she took the time to mail samples of her poetry to local newspapers",Bonnie Parker,NA
2004-07-21,J,STATE NICKNAME FUN,,200,These 2 states with a precious metal in their nicknames border each other,California and Nevada,NA
2004-07-21,J,I'VE GOT A BEEF WITH YOU,,200,"When Sizzler has these ""all-you-can-eat"", they'll stick to yours",ribs,NA
2004-07-21,J,"YOU'RE MAKING ME ""MAD""",,200,"Dolley Payne married him September 15, 1794",James Madison,NA
2004-07-21,J,POPULAR SCIENCE TOP STORIES OF 2003,,400,"A weighty issue, but researchers found that eating the ""dark"" type of this food daily can lower blood pressure",chocolate,NA
2004-07-21,J,FIRST NAME'S THE SAME,,400,"Herman, Harrelson",Woody,NA
2004-07-21,J,CRIME TIME,,400,"He got his ""Scarface"" after being knifed by a drunk at Frankie Yale's Harvard Inn in Brooklyn in 1917",Al Capone,NA
2004-07-21,J,STATE NICKNAME FUN,,400,The nickname of this state includes a greeting in a non-English language,Hawaii,NA
2004-07-21,J,I'VE GOT A BEEF WITH YOU,,400,"The cut above the round, it also begins with ""R""",rump,NA
2004-07-21,J,"YOU'RE MAKING ME ""MAD""",,400,It became the capital during the reign of Philip II,Madrid,NA
2004-07-21,J,POPULAR SCIENCE TOP STORIES OF 2003,,600,A microwave detector put the precise age of this at 13.7 billion years (give or take 1%),the universe,NA
2004-07-21,J,FIRST NAME'S THE SAME,,600,"Franklin, Standish",Miles,NA
2004-07-21,J,CRIME TIME,,600,"On March 3, 1934 this Public Enemy escaped from Lake County Jail in Crown Point, Ind., allegedly using a wooden gun",John Dillinger,NA
2004-07-21,J,STATE NICKNAME FUN,,600,"A ride at the Albuquerque Int'l Balloon Fiesta might show you why New Mexico is the ""land of"" this",Enchantment,NA
2004-07-21,J,I'VE GOT A BEEF WITH YOU,,600,The name of this cut from the side of the animal is also used for the extreme left or right side of an army,the flank,NA
2004-07-21,J,"YOU'RE MAKING ME ""MAD""",,600,"Technically, it's bovine spongiform encephalopathy",mad cow disease,NA
2004-07-21,J,POPULAR SCIENCE TOP STORIES OF 2003,,800,"Oddly, geologists learned that much of the sand in the Grand Canyon came from these mountains between Quebec & Alabama",the Appalachians,NA
2004-07-21,J,FIRST NAME'S THE SAME,,800,"Rogers, Newton",Wayne,NA
2004-07-21,J,CRIME TIME,,800,William & Emily Harris were members of this radical terrorist group that kidnapped Patty Hearst in Feb. 1974,Symbionese Liberation Army,NA
2004-07-21,J,STATE NICKNAME FUN,,800,Minnesota may have gotten this nickname from a cartoon showing railroad organizers as tunneling mammals,Gopher State,NA
2004-07-21,J,I'VE GOT A BEEF WITH YOU,,800,The cut of meat between the neck & the shoulder blade; it also is a clamp between the bit & the drill,chuck,NA
2004-07-21,J,"YOU'RE MAKING ME ""MAD""",,800,He attributes his TV sports telestrating skills to watching Reagan's doctor diagram where he was shot in 1981,John Madden,NA
2004-07-21,J,POPULAR SCIENCE TOP STORIES OF 2003,,1000,"This scientist, a model for Dr. Strangelove, passed away in September at age 95",Edward Teller,NA
2004-07-21,J,FIRST NAME'S THE SAME,,1000,"Hayes, Newton",Isaac,NA
2004-07-21,J,CRIME TIME,,1000,In 1965 this former surfing champion was convicted of stealing the Star of India sapphire,Jack Murphy (Murph the Surf),NA
2004-07-21,J,STATE NICKNAME FUN,,NA,In 2004 a biologist caused great excitement when he photographed an actual wild one of these in Michigan,a wolverine,NA
2004-07-21,J,I'VE GOT A BEEF WITH YOU,,1000,"From a chicken, it's a breast; from a cow, it's called this & Aunt Esther might make a nice one for Pesach",brisket,NA
2004-07-21,J,"YOU'RE MAKING ME ""MAD""",,1000,The French made this island a colony in 1896,Madagascar,NA
2004-07-21,DJ,GERMAN HISTORY,,400,"After the death of President Hindenburg in 1934, Hitler assumed this title meaning ""leader""",the fuhrer,NA
2004-07-21,DJ,CHARACTERS IN MUSICALS,,400,"Mary Martin, Sandy Duncan & Cathy Rigby have all starred on Broadway in this male role",Peter Pan,NA
2004-07-21,DJ,THE HOUSES SEARS BUILT,,400,"Sears issued its first book of modern homes in 1908, the same year Henry Ford introduced this car to the public",the Model T,NA
2004-07-21,DJ,WALKING THE DOG,,400,This sporting dog was first bred by German nobles in the court of Weimar in the early 19th century,Weimaraner,NA
2004-07-21,DJ,THERE'S A PLACE FOR US,,400,"You can check Shabbat start times on jpost.com, a website for a newspaper in this city",Jerusalem,NA
2004-07-21,DJ,"""LA"" DEE DA",,400,"The Census Bureau uses ""Hispanic"", but many of South & Central American heritage prefer this 1-word term",latino,NA
2004-07-21,DJ,GERMAN HISTORY,,800,"Nickname of Duke Henry, who fought Albert the Bear to control Saxony in the 1100s; only Ulrich the Tiger was missing","""the lion""",NA
2004-07-21,DJ,CHARACTERS IN MUSICALS,,800,"As a child in the '60s, Pia Zadora played Tevye's daughter Bielke in this Broadway musical",Fiddler On The Roof,NA
2004-07-21,DJ,THE HOUSES SEARS BUILT,,800,Sears homes can be found in all the 48 contiguous states; Carlinville SW of Springfield in this state has the most,Illinois,NA
2004-07-21,DJ,WALKING THE DOG,,800,"This toy dog seems to be named for a Mediterranean island, but might be named for Melita, Sicily",Maltese,NA
2004-07-21,DJ,THERE'S A PLACE FOR US,,800,"George H.W. Bush has a home in Tanglewood, a neighborhood of this Texas city",Houston,NA
2004-07-21,DJ,"""LA"" DEE DA",,800,It's the exciting activity seen here,lawn bowling,http://www.j-archive.com/media/2004-07-21_DJ_07.jpg
2004-07-21,DJ,GERMAN HISTORY,,1200,"(Sofia of the Clue Crew reports from Berlin, Germany.) Completed in 1894, the Reichstag dates from this numerical Reich in German history",the Second Reich,http://www.j-archive.com/media/2004-07-21_DJ_03.jpg
2004-07-21,DJ,CHARACTERS IN MUSICALS,,1200,"There should be an ""ABBA""-dabba honeymoon for Sophie, the bride-to-be in this musical full of ABBA songs",Mamma Mia!,NA
2004-07-21,DJ,THE HOUSES SEARS BUILT,,1200,One of the models has the same name as this film capital where many of these cottages still exist,Hollywood,NA
2004-07-21,DJ,WALKING THE DOG,,1200,"3 AKC-recognized breeds have ""miniature"" in their names: miniature pinscher, miniature bull terrier & this",miniature schnauzer,NA
2004-07-21,DJ,THERE'S A PLACE FOR US,,1200,You'll discover this city is home to the main campus of the Ohio State University,Columbus,NA
2004-07-21,DJ,"""LA"" DEE DA",,1200,This company's Blue is one of the top-selling imported beers in the U.S.,Labatt,NA
2004-07-21,DJ,GERMAN HISTORY,,1600,"Though the uprising called the Peasants' War was partly based on this man's ideas, he came out against it in 1525",Martin Luther,NA
2004-07-21,DJ,CHARACTERS IN MUSICALS,,1600,"Natasha Richardson, Molly Ringwald & Brooke Shields each played this role in ""Cabaret"" on Broadway",Sally Bowles,NA
2004-07-21,DJ,THE HOUSES SEARS BUILT,,1600,"For $11,500 you could purchase plans & materials for this type of building even if it wasn't little or red",a schoolhouse,NA
2004-07-21,DJ,WALKING THE DOG,,1600,This terrier is known as a westie for short,West Highlands Terrier,NA
2004-07-21,DJ,THERE'S A PLACE FOR US,,1600,"Belgium has 3 federal regions, Wallonia, Flanders & this one, which includes the capital",Brussels,NA
2004-07-21,DJ,"""LA"" DEE DA",,1600,"(Sarah of the Clue Crew reports from the Franklin Institute in Philadelphia, PA.) The lower this number for Foucault pendulum's location, the slower its rate of rotation",latitude,http://www.j-archive.com/media/2004-07-21_DJ_09.jpg
2004-07-21,DJ,GERMAN HISTORY,,2000,"In 1631, during this decades-long war, Sweden's army marched to the Rhine",Thirty Years\' War,NA
2004-07-21,DJ,CHARACTERS IN MUSICALS,,2000,Sutton Foster won a Tony for playing the title flapper in this musical based on a Julie Andrews film,Thoroughly Modern Millie,NA
2004-07-21,DJ,THE HOUSES SEARS BUILT,,NA,"The Princeville & the Avalon models are an example of this bungalow type whose name means ""artisan""",a craftsman,NA
2004-07-21,DJ,WALKING THE DOG,,NA,2 puppies rescued from a British brig off the coast of Maryland in 1807 are the ancestors of this retriever,Chesapeake Bay Retriever,NA
2004-07-21,DJ,THERE'S A PLACE FOR US,,2000,St. Paul was born as Saul in this city,Tarsus,NA
2004-07-21,DJ,"""LA"" DEE DA",,2000,"This Hamburg native who's designed for Chloe & Fendi is known as ""King Karl""",Karl Lagerfeld,NA
2004-07-21,FJ,SINGERS,"(Alex: I would love to sing for you, but instead, I will read the clue.)",NA,"Her recording career lasted just 8 years, starting in 1955 with ""A Church, A Courtroom And Then Good-Bye""",Patsy Cline,NA
