date,round,category,comment,value,clue,response,link
2003-04-03,J,THE NATURAL WORLD,,200,"Of all the elements, this metallic one has the shortest name",tin,NA
2003-04-03,J,LOTTO FEVER,(Alex: Sounds like fun!),200,"An illegal lottery, or the fourth book of the Old Testament",Numbers,NA
2003-04-03,J,REMEMBER THE '80s,,200,"In 1982 this country, appropriately, began issuing a series of panda coins",China,NA
2003-04-03,J,COUNTRY MUSIC HALL OF FAME & MUSEUM,,200,"Guitars on display include ones from Mother Maybelle Carter & this ""Man in Black"", her son-in-law",Johnny Cash,NA
2003-04-03,J,GOING WIRELESS,,200,"Thanks to firms like Pegaso & Telmex, this country now has more cellular users than fixed line customers",Mexico,NA
2003-04-03,J,"CROSSWORD CLUES ""R""",,200,Cock-a-doodle doodler(7),rooster,NA
2003-04-03,J,THE NATURAL WORLD,,400,"(Sarah of the Clue Crew scuba diving in the Barrier Reef near Belize)  Sponges are classified based on what this structure is made of, such as calcium carbonate or silica",the skeleton,NA
2003-04-03,J,LOTTO FEVER,(Alex: Sounds like fun!),400,"One of the USA's 500 largest businesses by revenue is this state's lottery, based in Schenectady",New York,NA
2003-04-03,J,REMEMBER THE '80s,,400,In 1985 this large Middle Eastern country's Prince Sultan became the first Arab astronaut,Saudi Arabia,NA
2003-04-03,J,COUNTRY MUSIC HALL OF FAME & MUSEUM,,400,You can see her wringer washer & the nurse's cap she wore while working to support Wynonna & Ashley,Naomi Judd,NA
2003-04-03,J,GOING WIRELESS,,400,The Kyocera QCP 6035 Smartphone combines a cell phone with one of these multifunction organizers,PDA (personal digital assistant),NA
2003-04-03,J,"CROSSWORD CLUES ""R""",,400,A Mackintosh(8),raincoat,NA
2003-04-03,J,THE NATURAL WORLD,,600,"Granite contains this mineral whose name contains the German word for ""field""",feldspar,NA
2003-04-03,J,LOTTO FEVER,(Alex: Sounds like fun!),600,In 1980 Congress forbade the use of this for distribution of lottery materials,the mails,NA
2003-04-03,J,REMEMBER THE '80s,,600,"(Cheryl of the Clue Crew at the Henry Ford Museum in Detroit)  On March 30, 1981 outside the Washington Hilton, this man was shoved into this 1972 Lincoln limousine",Ronald Reagan,NA
2003-04-03,J,COUNTRY MUSIC HALL OF FAME & MUSEUM,,600,"She's the Hall of Famer heard here, makin' like Jerry Lee Lewis",Dolly Parton,NA
2003-04-03,J,GOING WIRELESS,,600,In 1946 this detective's 2-way wrist radio made its debut in the funnies,Dick Tracy,NA
2003-04-03,J,"CROSSWORD CLUES ""R""",,600,Approve an amendment(6),ratify,NA
2003-04-03,J,THE NATURAL WORLD,,800,"Sadly, the one-horned Javan species of this is nearly extinct",rhinoceros,NA
2003-04-03,J,LOTTO FEVER,(Alex: Sounds like fun!),800,13 workers at one of this coffee chain's stores in California became stars when they won big bucks in 2000...$87 million,Starbucks,NA
2003-04-03,J,REMEMBER THE '80s,,800,"Reportedly, this fad happened for the first time on October 15, 1981 during a baseball game in the Oakland Coliseum",the wave,NA
2003-04-03,J,COUNTRY MUSIC HALL OF FAME & MUSEUM,,800,"In 2002 the museum exhibited quilts loaned by this superstar, & 5 of her costumes from ""Annie Get Your Gun""",Reba McEntire,NA
2003-04-03,J,GOING WIRELESS,,800,"44 GM models offer this wireless service that now has over 2,000,000 members",OnStar,NA
2003-04-03,J,"CROSSWORD CLUES ""R""",,NA,"The first ""R"" in radar",radio,NA
2003-04-03,J,THE NATURAL WORLD,,1000,"Weighing 300 pounds or more, this South American boa is the heaviest of all snakes",anaconda,NA
2003-04-03,J,LOTTO FEVER,(Alex: Sounds like fun!),1000,"2000 saw a fight in England over running the lottery, with this Virgin king at the forefeont",Richard Branson,NA
2003-04-03,J,REMEMBER THE '80s,,1000,"The nomination of this U.S. Appeals Court judge to the Supreme Court was rejected by the Senate on October 23, 1987",Robert Bork,NA
2003-04-03,J,COUNTRY MUSIC HALL OF FAME & MUSEUM,,1000,"You could never put a price on this funny lady seen here who was inducted in 1975(""Howdeeee!"")",Minnie Pearl,NA
2003-04-03,J,GOING WIRELESS,,1000,"Buying one of this company's DynaTAC models in 1984 could have set you back about $4,000",Motorola,NA
2003-04-03,J,"CROSSWORD CLUES ""R""",,1000,Monastery mess hall(9),refectory,NA
2003-04-03,DJ,"NAME THAT ""P""OET","(Alex: The poet's name will begin with the letter ""P"".)",400,"""Crossing the Water"", a collection of her poems, was published posthumously in 1971",Sylvia Plath,NA
2003-04-03,DJ,BIG SCREEN COMPASS BEARINGS,,400,Cary Grant's 1959 cross-country adventure,North by Northwest,NA
2003-04-03,DJ,ISLANDS OF THE SOUTH PACIFIC,,400,The 1840 Treaty of Waitangi guaranteed the Maori rights to this country's land in return for British sovereignty,New Zealand,NA
2003-04-03,DJ,FLOWERS,,400,The Cattleya is the variety of this flower most widely used for corsages,orchids,NA
2003-04-03,DJ,FOREIGN FOLKS,,400,"From 1957 to 1974 this tycoon owned & operated Olympic Airways, Greece's national airlines",Aristotle Onassis,NA
2003-04-03,DJ,SLANG,,400,To bend the elbow is to indulge in this activity,drink,NA
2003-04-03,DJ,"NAME THAT ""P""OET","(Alex: The poet's name will begin with the letter ""P"".)",800,"Volumes such as ""My Sister, Life"" brought him renown as a lyrical poet long before he created Zhivago",Boris Pasternak,NA
2003-04-03,DJ,BIG SCREEN COMPASS BEARINGS,,800,James Dean's starring debut,East of Eden,NA
2003-04-03,DJ,ISLANDS OF THE SOUTH PACIFIC,,800,Most of the inhabitants of this tiny island are descended from the Bounty mutineers & their Polynesian wives,Pitcairn Island,NA
2003-04-03,DJ,FLOWERS,,800,"Proceeds from the sale of her rose, seen here, are donated to her memorial fund in England",Princess Diana,NA
2003-04-03,DJ,FOREIGN FOLKS,,800,This world leader who worked toward peace in the Middle East was assassinated in Cairo in 1981,Anwar Sadat,NA
2003-04-03,DJ,SLANG,,800,"'90s slang for an attractive woman, like the Archie Comics blonde of that name",Betty,NA
2003-04-03,DJ,"NAME THAT ""P""OET","(Alex: The poet's name will begin with the letter ""P"".)",1200,"(Jimmy of the Clue Crew standing in front of the Colosseum in Rome)  Not a European poet, but this American coined the phrase ""The glory that was Greece & the grandeur that was Rome""",Edgar Allan Poe,NA
2003-04-03,DJ,BIG SCREEN COMPASS BEARINGS,,1200,Zip-a-dee-doo-dah!  Uncle Remus tells his tales in this 1946 Disney classic,Song of the South,NA
2003-04-03,DJ,ISLANDS OF THE SOUTH PACIFIC,,1200,"Administered by the U.S. Department of the Interior, this territory consists of Tutuila & 6 other islands",American Samoa,NA
2003-04-03,DJ,FLOWERS,,1200,Luther Burbank developed the Shasta variety of this flower,daisy,NA
2003-04-03,DJ,FOREIGN FOLKS,,1200,Laszlo Papp of this country was the first boxer to win Olympic gold medals in 3 successive games,Hungary,NA
2003-04-03,DJ,SLANG,,1200,"To get something on credit is to get it ""on"" this part of a shirt where debts were once jotted down",on the cuff,NA
2003-04-03,DJ,"NAME THAT ""P""OET","(Alex: The poet's name will begin with the letter ""P"".)",1600,"Loomis was the middle name of this ""Cantos"" poet who loomed large over his fellow Imagists",Ezra Pound,NA
2003-04-03,DJ,BIG SCREEN COMPASS BEARINGS,,NA,Eloquent pacifist World War I film about German boys in the trenches,All Quiet on the Western Front,NA
2003-04-03,DJ,ISLANDS OF THE SOUTH PACIFIC,,1600,James A. Michener once called this island 143 miles northwest of Tahiti the world's most beautiful island island,Bora Bora,NA
2003-04-03,NA,NA,NA,NA,NA,NA,NA
2003-04-03,DJ,FOREIGN FOLKS,,NA,In 1984 this cleric from Klerksdorp was awarded the Nobel Peace Prize,Bishop Desmond Tutu,NA
2003-04-03,DJ,SLANG,,1600,"In the U.S. it refers to an old man, but in Britain it's just a guy, especially one like Black Sabbath's Mr. Butler",geezer,NA
2003-04-03,DJ,"NAME THAT ""P""OET","(Alex: The poet's name will begin with the letter ""P"".)",2000,"He claimed that he wrote his ""Ode on Solitude"" when he was 12 (& ""An Essay on Man"" somewhat later)",Alexander Pope,NA
2003-04-03,DJ,BIG SCREEN COMPASS BEARINGS,,2000,"""Spellbound"" 1987 big screener featuring Susan, Michelle, Jack & Cher",The Witches of Eastwick,NA
2003-04-03,DJ,ISLANDS OF THE SOUTH PACIFIC,,2000,Current king Taufa'ahau Tupou IV was the first person in this nation's history to earn a college degree,Tonga,NA
2003-04-03,NA,NA,NA,NA,NA,NA,NA
2003-04-03,DJ,FOREIGN FOLKS,,2000,In 1928 this Norwegian died in a plane crash while trying to rescue a fellow explorer from another crash,Roald Amundsen,NA
2003-04-03,DJ,SLANG,,2000,"This 19th century slang term for dollars may have been influenced by the French ""Napoleon""",simoleons,NA
2003-04-03,FJ,U.S. PRESIDENTS,,NA,He was the first U.S. president not of British descent,Martin Van Buren,NA
