date,round,category,comment,value,clue,response,link
2009-01-05,J,YOU: BEING BEAUTIFUL,(Alex: And all of the clues in that category will be given by the book's author Dr. Oz.),200,"(Dr. Oz presents.)  Ease your stress & its aging effect by applying pressure to the web of your hand, a homemade version of this technique",acupressure,http://www.j-archive.com/media/2009-01-05_J_20.wmv
2009-01-05,J,SONGS FROM MUSICALS,,200,"""Sherry"" &""December 1963(Oh, What A Night)""",Jersey Boys,NA
2009-01-05,J,"THE HOLY ""C""",,200,Pharaoh & his men pursued the children of Israel into the Red Sea aboard these horse-drawn vehicles,chariots,NA
2009-01-05,J,WOOD YOU OR WOODN'T YOU?,,200,"It's the body part proverbially ""greased"" when someone gets bribed",a palm,NA
2009-01-05,J,THEY STILL MAKE THAT?,,200,KTS Productions still makes these tapes perfect for your custom van--What? No Frampton?,an 8-track,NA
2009-01-05,J,THE BATTLE OF THE SEXES,,200,Hembrismo has been used as the feminine counterpart to this very masculine term,machismo,NA
2009-01-05,J,YOU: BEING BEAUTIFUL,(Alex: And all of the clues in that category will be given by the book's author Dr. Oz.),400,(Dr. Oz presents.)  Exposure to U.V. radiation dries out & can burn the skin & also releases these liberated molecules that can damage the DNA & lead to cancer,free radicals,http://www.j-archive.com/media/2009-01-05_J_21.wmv
2009-01-05,J,SONGS FROM MUSICALS,,400,"""The Music OfThe Night"" &""All I Ask Of You""",Phantom of the Opera,NA
2009-01-05,J,"THE HOLY ""C""",,400,"Roman soldiers put this on Jesus' head, ""and they put on him a purple robe""",a crown of thorns,NA
2009-01-05,J,WOOD YOU OR WOODN'T YOU?,,400,This word precedes Falls & Rapids in Iowa city names,Cedar,NA
2009-01-05,J,THEY STILL MAKE THAT?,,400,Put your hands together for this gizmo seen on TV since 1985--but don't turn me off while you're at it,The Clapper,NA
2009-01-05,J,THE BATTLE OF THE SEXES,,400,"Spear refers to the male side of the family & this word that includes ""staff"" refers to the female side",distaff,NA
2009-01-05,J,YOU: BEING BEAUTIFUL,(Alex: And all of the clues in that category will be given by the book's author Dr. Oz.),600,"(Dr. Oz presents.)  Try to get 20 minutes of sunlight a day, but only at low levels when your shadow's taller than you in order to get what you need of this vitamin",vitamin D,http://www.j-archive.com/media/2009-01-05_J_22.wmv
2009-01-05,J,SONGS FROM MUSICALS,,600,"""Epiphany"" &""The Worst Pies In London""",Sweeney Todd,NA
2009-01-05,J,"THE HOLY ""C""",,600,Both Matthew & Mark tell us that John the Baptist wore a garment made of the hair of this animal,a camel,NA
2009-01-05,J,WOOD YOU OR WOODN'T YOU?,,600,"Also preceding ""Goose"" in the nickname of a plane, as a verb, this means to neaten up",spruce,NA
2009-01-05,J,THEY STILL MAKE THAT?,,600,"American Safety Razor /Still makes this stuff, dear /Give us your response /It goes here",Burma-Shave,NA
2009-01-05,J,THE BATTLE OF THE SEXES,,600,"A motto on theGreat Seal ofMaryland saysin Italian, ""Manly"" these""Womanly Words""",deeds,NA
2009-01-05,J,YOU: BEING BEAUTIFUL,(Alex: And all of the clues in that category will be given by the book's author Dr. Oz.),800,"(Dr. Oz presents.)  Those gorgeous high-heeled shoes can cause a partial dislocation of the big toe, causing a bony prominence known as this",a bunion,http://www.j-archive.com/media/2009-01-05_J_24.wmv
2009-01-05,J,SONGS FROM MUSICALS,,800,"""If You Believe"" &""Ease On Down The Road""",The Wiz,NA
2009-01-05,J,"THE HOLY ""C""",,800,Joseph's brothers stripped off this garment that his father had given him & cast him into a pit,the coat of many colors,NA
2009-01-05,J,WOOD YOU OR WOODN'T YOU?,,800,"Schwarzenegger was billed as ""The Austrian"" this 3-letter word",Oak,NA
2009-01-05,J,THEY STILL MAKE THAT?,,800,"You can still get these CO2 candies introduced in 1975 (don't worry, that kid from the Life ad didn't really O.D. on 'em)",Pop Rocks,NA
2009-01-05,J,THE BATTLE OF THE SEXES,,800,"Completes the rhyming proverb ""Man may work from sun to sun...""",But a woman\'s work is never done,NA
2009-01-05,J,YOU: BEING BEAUTIFUL,(Alex: And all of the clues in that category will be given by the book's author Dr. Oz.),1000,(Dr. Oz presents.)  As many as 1 American in 50 may be unrealistically dissatisfied with their bodies called body dysmorphic disorder; it's a form of this--OCD for short,obsessive-compulsive disorder,http://www.j-archive.com/media/2009-01-05_J_30.jpg
2009-01-05,J,SONGS FROM MUSICALS,,1000,"""Kids"" &""Put On A Happy Face""",Bye Bye Birdie,NA
2009-01-05,J,"THE HOLY ""C""",,1000,This grandson of Noah shares his name with the Promised Land,Canaan,NA
2009-01-05,J,WOOD YOU OR WOODN'T YOU?,,NA,"To long for or yearn, it's from the Latin for ""punishment""",pine,NA
2009-01-05,J,THEY STILL MAKE THAT?,,1000,"This ""exclusive"" fashion brand for which Anthony Geary did ads relaunched in 2008",Members Only,NA
2009-01-05,J,THE BATTLE OF THE SEXES,,1000,"From the Latin for ""woman"" & ""man"" come the words muliebrity & this one that means manliness or potency",virility,NA
2009-01-05,DJ,RICE,,400,"Inari is the god of rice, which is used to make this popular Japanese wine",sake,NA
2009-01-05,DJ,LOMBARDY,,400,"While visiting Palazzo Affaitati in Cremona, check out the museo devoted to this violin-making family",Stradivarius,NA
2009-01-05,DJ,UNITE US,,400,"Now with about 10 million total members, these 2 unions united in 1955",the AFL & the CIO,NA
2009-01-05,DJ,ART MONK,,400,"Though he left monastic life in 1432, Fra Filippo Lippi enjoyed the constant patronage of this family",the Medici,NA
2009-01-05,DJ,"""EL""-WAY",,400,"It's a mournful poem for the dead, perhaps ""Written In A Country Churchyard""",an elegy,NA
2009-01-05,DJ,PIGSKIN LEGENDS,,400,"(Jon of the Clue Crew stands with some bronze busts of inductees at the Pro Football Hall of Fame in Canton, OH.)  Nick Buoniconti, Larry Csonka, Bob Griese, Jim Langer, Larry Little & Paul Warfield were all enshrined in the Hall of Fame & were all members of this undefeated team",the Miami Dolphins,http://www.j-archive.com/media/2009-01-05_DJ_01b.jpg
2009-01-05,DJ,RICE,,800,"This ""grimy"" type of Cajun rice traditionally has gizzards in the mix, but ground beef works too",dirty rice,NA
2009-01-05,DJ,LOMBARDY,,800,"The regional capital of Lombardy is this city, home to La Scala",Milan,NA
2009-01-05,DJ,UNITE US,,800,In 1986 7 million Americans from coast to coast united these at the behest of USA for Africa,hands,NA
2009-01-05,DJ,ART MONK,,800,"Many books were handmade by monks in the Middle Ages, like this brightened type of manuscript",illuminated,http://www.j-archive.com/media/2009-01-05_DJ_09a.jpg
2009-01-05,DJ,"""EL""-WAY",,NA,"There are books called these""Of Style"",""Of Editing"" &""Of Grammar""",The Elements,NA
2009-01-05,DJ,PIGSKIN LEGENDS,,800,"This ""Too Tall"" Tennessee State defensive end was drafted No. 1 overall in 1974",Ed Jones,NA
2009-01-05,DJ,RICE,,1200,"We're just mad about using a little saffron in this dish whose name comes from the Italian for ""rice""",risotto,NA
2009-01-05,DJ,LOMBARDY,,1200,The alliance known as the Lombard League was formed in 1167 to combat this red-bearded Holy Roman Emperor,Frederick I Barbarossa,NA
2009-01-05,DJ,UNITE US,,1200,"Since the 1871 Franco-Prussian War , Lorraine & this province have been treated as a unit",Alsace,NA
2009-01-05,DJ,ART MONK,,1200,"Dominican Fra Bartolommeo painted the portrait of this philosopher, author of ""Summa Theologica""",(Saint Thomas) Aquinas,http://www.j-archive.com/media/2009-01-05_DJ_10.jpg
2009-01-05,DJ,"""EL""-WAY",,1200,"A Eugene O'Neill play finds ""Desire Under"" these",the Elms,NA
2009-01-05,DJ,PIGSKIN LEGENDS,,1200,"(Kelly of the Clue Crew reports from the Pro Football Hall of Fame in Canton, OH.)  In 1967, this bench provided support but little warmth to players of the Ice Bowl, the NFL's coldest championship game at this stadium",Lambeau Field,http://www.j-archive.com/media/2009-01-05_DJ_03b.jpg
2009-01-05,DJ,RICE,,1600,In 1958 Vince Domenico mixed a dry chicken soup mix with rice & vermicelli & created this brand,Rice-A-Roni,NA
2009-01-05,DJ,LOMBARDY,,1600,An Italian resort on Lombardy's Lake Como shares this name with a Vegas hotel,Bellagio,NA
2009-01-05,NA,NA,NA,NA,NA,NA,NA
2009-01-05,DJ,ART MONK,,1600,"Raise a glass of liqueur to friar Giovanni da Fiesole, known for devout frescoes & nicknamed this",Fra Angelico,NA
2009-01-05,DJ,"""EL""-WAY",,1600,"In the play ""Arsenic and Old Lace"", the poison is administered in this fruity wine",elderberry,NA
2009-01-05,DJ,PIGSKIN LEGENDS,,1600,"In his first 10 seasons, 1998-2007, this Viking-Raider-Patriot amassed more than 12,000 receiving yards",(Randy) Moss,NA
2009-01-05,DJ,RICE,,2000,"This type of rice gets its name from the Hindi word for ""fragrant""",basmati,NA
2009-01-05,DJ,LOMBARDY,,2000,"The Ticino, a tributary of this river, forms part of the border between Lombardy & Piedmont",the Po,NA
2009-01-05,NA,NA,NA,NA,NA,NA,NA
2009-01-05,DJ,ART MONK,,2000,"In the work seen here, Benedictine monk Don Giulio Clovio shows the conversion of this saint",Paul,http://www.j-archive.com/media/2009-01-05_DJ_12a.jpg
2009-01-05,DJ,"""EL""-WAY",,2000,"It's a person's manner of speaking in public, perhaps eloquently",elocution,NA
2009-01-05,DJ,PIGSKIN LEGENDS,,2000,"(Kelly of the Clue Crew reports from the Pro Football Hall of Fame in Canton, OH.)  Jim Thorpe's classmates in the first group inducted into the Pro Football Hall of Fame included this red-haired Bears running back of the '20s",(Red) Grange,http://www.j-archive.com/media/2009-01-05_DJ_05a.jpg
2009-01-05,FJ,CHARACTERS IN NOVELS,,NA,"Molly, the wife in this 1922 novel, represents a modern-day Penelope",Ulysses,NA
