date,round,category,comment,value,clue,response,link
2009-02-04,J,ROTTEN POETRY ABOUT GOOD POETS,,200,"Okay, we've been savin' / His poem, ""The Raven"" / But to go even deeper / Check out ""The Sleeper""",(Edgar Allan) Poe,NA
2009-02-04,J,THEIR GREATEST HITS ALBUMS,,200,"""The Immaculate Collection""(1990)",Madonna,NA
2009-02-04,J,PODGE-POURRI,,200,"In Esperanto ""no man is an"" insulo, this",an island,NA
2009-02-04,J,VETERANS' BENEFITS,,200,"For eligible vets, the VA offers guaranteed ones of these with competitive rates & little or no down payment",mortgages (home loans),NA
2009-02-04,J,FUNERAL OFFICIANTS,,200,"Joseph Hopkins Twichell, this man's ""Tramp Abroad"" traveling companion, conducted his funeral service",Mark Twain,NA
2009-02-04,J,FAMILIAR PHRASES,,200,"A great fuss about something trivial is ""a tempest in"" this, like chip's mother",a teapot,NA
2009-02-04,J,ROTTEN POETRY ABOUT GOOD POETS,,400,"Our New Year's are fine / 'Cause he wrote ""Auld Lang Syne"" / His pen was hot, man / He's the national poet of Scotland",(Robert) Burns,NA
2009-02-04,J,THEIR GREATEST HITS ALBUMS,,400,"""Forty Licks"" (2002) & ""Hot Rocks: 1964-1971""",The Rolling Stones,NA
2009-02-04,J,PODGE-POURRI,,400,"It began in 1986 as a 20-person Summer Solstice Fest at S.F.'s Baker Beach; in 2008, 49,599 went, but to a different place",Burning Man,NA
2009-02-04,J,VETERANS' BENEFITS,,400,"20,000 veterans of this war marched on Washington in 1932 demanding a war bonus that had been promised them",World War I,NA
2009-02-04,J,FUNERAL OFFICIANTS,,400,The Archbishop of Canterbury who presided over this royal's 2002 service was the ninth in her long life,the Queen Mother,NA
2009-02-04,J,FAMILIAR PHRASES,,400,"If we could find him, a soldier who's gone AWOL could tell us that AWOL stands for this",Absent Without Leave,NA
2009-02-04,J,ROTTEN POETRY ABOUT GOOD POETS,,600,"Blind by 1652 / 22 years of life remained / Still much for him to do / Like pen ""Paradise Regained""",Milton,NA
2009-02-04,J,THEIR GREATEST HITS ALBUMS,,600,"""Greatest Hits: Straight Up!"" (2007)",Paula Abdul,NA
2009-02-04,J,PODGE-POURRI,,600,"Don't take ""four score & seven years"" to tell us it equals this many total years",87,NA
2009-02-04,J,VETERANS' BENEFITS,,600,In 1988 this president created the cabinet-level Department of Veterans Affairs,Ronald Reagan,NA
2009-02-04,J,FUNERAL OFFICIANTS,,600,In April 2005 Joseph Ratzinger officiated at this man's funeral,John Paul II,NA
2009-02-04,J,FAMILIAR PHRASES,,600,"In a song he wrote during WWII Frank Loesser popularized the phrase, ""Praise the lord and pass"" this",the ammunition,NA
2009-02-04,J,ROTTEN POETRY ABOUT GOOD POETS,,800,"Remember your classes / His ""Bells and Pomegranates"" collection / Includes ""Pippa Passes""",Robert Browning,NA
2009-02-04,J,THEIR GREATEST HITS ALBUMS,,800,"""My Generation: The Very Best of..."" (1996)",The Who,NA
2009-02-04,J,PODGE-POURRI,,800,"This composer's Nibelungs stopped working Feb. 13, 1883",Wagner,NA
2009-02-04,J,VETERANS' BENEFITS,,800,The U.S. government expanded veterans' medical benefits following this conflict that ended in 1975,the Vietnam War,NA
2009-02-04,J,FUNERAL OFFICIANTS,,800,This Arizona senator's sendoff in 1998 was presided over by Rev. Carlozzi & Rabbi Plotkin,Barry Goldwater,NA
2009-02-04,J,FAMILIAR PHRASES,,NA,"From ""Casey at the Bat"", when there's a letdown or disappointment ""There is no joy in"" this place",Mudville,NA
2009-02-04,J,ROTTEN POETRY ABOUT GOOD POETS,,1000,"A 19th c. shut-in / We really don't mean to butt in / Her ""A Route of Evanescence"" / Would've thrilled Donald Pleasence",Emily Dickinson,NA
2009-02-04,J,THEIR GREATEST HITS ALBUMS,,1000,"""All the Hits: From Surf City to Drag City"" (2004)",Jan & Dean,NA
2009-02-04,J,PODGE-POURRI,,1000,"""Dynam"" is a combining form meaning this 5-letter word that can precede drill, broker or brake",power,NA
2009-02-04,J,VETERANS' BENEFITS,,1000,"The G.I. bill is officially the SRA, this group's ""Readjustment Act""",Servicemen,NA
2009-02-04,J,FUNERAL OFFICIANTS,,1000,Ralph Abernathy conducted his friend Martin Luther King Jr.'s funeral service at this church,Ebenezer Baptist Church,NA
2009-02-04,J,FAMILIAR PHRASES,,1000,"The future is inevitable, at least according to this phrase translated from the Latin ""iacta alea est""",the die is cast,NA
2009-02-04,DJ,EUGENE O'NEILL,,400,"In the 1910s O'Neill lived in this region of lower Manhattan where many an artist has found his ""voice""",Greenwich Village,NA
2009-02-04,DJ,THE HAIRY APE,,400,"He played a trucker whose sidekick was an orangutan named Clyde in ""Every Which Way But Loose""",Clint Eastwood,NA
2009-02-04,DJ,BEYOND THE HORIZON,,400,Set out like Hemingway on a fishing trip due south from Key West & you eventually reach this nation,Cuba,NA
2009-02-04,DJ,"AH, WILDERNESS!",,400,"O3, aka this, can be detected many miles downwind from urban centers & can harm forest vegetation",ozone,NA
2009-02-04,DJ,MORE STATELY MANSIONS,,400,This mansion is the official residence of the mayor of New York City,Gracie,NA
2009-02-04,DJ,"THE ""ICE"" MAN COMETH",,400,"Any edible, aromatic vegetable substance added to food for flavor",spice,NA
2009-02-04,DJ,EUGENE O'NEILL,,800,O'Neill was furious when this 18-year-old daughter of his married 54-year-old Charlie Chaplin,Oona O\'Neill,NA
2009-02-04,DJ,THE HAIRY APE,,800,This cartoon ape lives at Mr. Peebles' pet store--he won't stay sold,Magilla Gorilla,NA
2009-02-04,DJ,BEYOND THE HORIZON,,800,Brush up on your kana & kanji if you head due west out of L.A. because you'll need them in this nation you reach,Japan,NA
2009-02-04,DJ,"AH, WILDERNESS!",,800,"This term can refer to a decisive ""event"" or to an area that drains to a common waterway",a watershed,NA
2009-02-04,DJ,MORE STATELY MANSIONS,,800,"Tired of camping in tents at his San Simeon ranch, he told architect Julia Morgan ""to build a little something""",(William Randolph) Hearst,NA
2009-02-04,DJ,"THE ""ICE"" MAN COMETH",,800,"A move in baseball that results in an out for you, but advances any runner on base",a sacrifice,NA
2009-02-04,DJ,EUGENE O'NEILL,,1200,"In 1929 O'Neill's play ""Strange"" this was banned in Boston, so it played in nearby Quincy instead",Strange Interlude,NA
2009-02-04,DJ,THE HAIRY APE,,1200,Rod Serling co-wrote the screenplay for this 1968 classic--you damned dirty ape!,Planet of the Apes,NA
2009-02-04,DJ,BEYOND THE HORIZON,,NA,"Head due east from Washington, D.C. or New York City & you'll first hit this Southern European country",Portugal,NA
2009-02-04,DJ,"AH, WILDERNESS!",,1200,"(Kelly of the Clue Crew shows an animation on the monitor.)  During rainstorms, forest floors can hold as much as five times their weight in water; the trees' roots hold the saturated soil in place, controlling this",erosion,http://www.j-archive.com/media/2009-02-04_DJ_08.wmv
2009-02-04,DJ,MORE STATELY MANSIONS,,1200,"An official residence of Queen Elizabeth, it's the largest occupied castle in the world",Windsor Castle,NA
2009-02-04,DJ,"THE ""ICE"" MAN COMETH",,1200,"From the Latin for ""in my view"", it's guidance offered to another",advice,NA
2009-02-04,DJ,EUGENE O'NEILL,,1600,As a young man O'Neill was fast friends with this reporter & Communist Labor Party co-founder,John Reed,NA
2009-02-04,DJ,THE HAIRY APE,,1600,"Alisa Berk played Kala, the primate mother, in this 1984 film subtitled ""The Legend of Tarzan, Lord of the Apes""",Greystoke,NA
2009-02-04,DJ,BEYOND THE HORIZON,,1600,Attu island in the Aleutians is only 560 miles due east of this Russian peninsula,Kamchatka,NA
2009-02-04,DJ,"AH, WILDERNESS!",,1600,"In rain forests epiphytes, AKA air plants, grow both in the understory & in this top forest layer",the canopy,NA
2009-02-04,DJ,MORE STATELY MANSIONS,,1600,This chateau just outside of Paris was built in 1623 as a hunting lodge for Louis XIII,Versailles,NA
2009-02-04,DJ,"THE ""ICE"" MAN COMETH",,1600,To lure or lead on by exciting hope or desire,entice,NA
2009-02-04,DJ,EUGENE O'NEILL,,NA,"This epic O'Neill work is based partly on the ""Oresteia"" of Aeschylus",Mourning Becomes Electra,NA
2009-02-04,DJ,THE HAIRY APE,,2000,"He's the wise shaman baboon in ""The Lion King""",Rafiki,NA
2009-02-04,DJ,BEYOND THE HORIZON,,2000,The closest nation to the contiguous U.S. that it doesn't border is this archipelagic country,the Bahamas,NA
2009-02-04,DJ,"AH, WILDERNESS!",,2000,"Most endangered species become that way because of the loss of this, Latin for ""it dwells""",habitat,NA
2009-02-04,DJ,MORE STATELY MANSIONS,,2000,"This 70-room palazzo in Newport, Rhode Island was the Vanderbilts' summer cottage",The Breakers,NA
2009-02-04,DJ,"THE ""ICE"" MAN COMETH",,2000,Governor of a province who rules as the representative of his sovereign,a viceroy,NA
2009-02-04,FJ,20th CENTURY FIRSTS,,NA,"On Oct. 14, 1947 in the Mojave Desert the first of these sounds was made by man; it was the byproduct of another first",sonic boom,NA
