date,round,category,comment,value,clue,response,link
2009-02-05,J,BIBLICAL QUOTES,,200,"She commanded Samson, ""Tell me, I pray thee, wherein thy great strength lieth""",Delilah,NA
2009-02-05,J,ROCK FORMATIONS,,200,"Kurt Cobain & Krist Novoselic met through Buzz Osborne, leader of the Melvins, & found freedom as this group in 1987",Nirvana,NA
2009-02-05,J,FASHIONABLE COMMON BONDS,,200,"Hobble,wrap,micro mini",skirt,NA
2009-02-05,J,FUNDRAISING,,200,"Keep a big donor's gifts flowing: put him on this ""of directors"" or ""of governors""",board,NA
2009-02-05,J,DELAWARE,,200,"Home to a major U.S. Air Force base, this capital was founded in 1683",Dover,NA
2009-02-05,J,"THE ""FIRST"" STATE",,200,In 1887 Joseph Conrad gained literary material sailing as this on a ship bound for Java,first mate,NA
2009-02-05,J,BIBLICAL QUOTES,,400,"This disciple wouldn't believe Jesus' resurrection until he saw ""in his hands the print of the nails""",Thomas,NA
2009-02-05,J,ROCK FORMATIONS,,400,"This Jimmy Page foursome first played together as part of the session group on P.J. Proby's ""Three Week Hero""",Led Zeppelin,NA
2009-02-05,J,FASHIONABLE COMMON BONDS,,400,"Action,kid,opera",gloves,NA
2009-02-05,J,FUNDRAISING,,400,This service's code says donors to a 501 (c)(3) organization can generally take a tax deduction,the IRS,NA
2009-02-05,J,DELAWARE,,400,Delaware has this many representatives in the U.S. House,1,NA
2009-02-05,J,"THE ""FIRST"" STATE",,400,Ryan Howard's day job with the Phillies,first baseman,NA
2009-02-05,J,BIBLICAL QUOTES,,600,In Exodus Moses & Aaron inform pharaoh that the lord has this very strong 4-word suggestion,"""Let my people go""",NA
2009-02-05,J,ROCK FORMATIONS,,600,"Jack wed Meg & took her name, & in 1997 formed this band on a lark, with him on bass & her on drums",The White Stripes,NA
2009-02-05,J,FASHIONABLE COMMON BONDS,,600,"Puritan,Peter Pan,choir-boy",collars,NA
2009-02-05,J,FUNDRAISING,,600,Chilly alliterative term for phoning someone to ask for money without any prior notice,cold call,NA
2009-02-05,J,DELAWARE,,600,"Designated in 1999, the tiger swallowtail is Delaware's official one of these insects",butterfly,NA
2009-02-05,J,"THE ""FIRST"" STATE",,600,"In 1975 Donald Johanson found a group of 13 hominid fossils he dubbed this, like the Nixons or Trumans",the first family,NA
2009-02-05,J,BIBLICAL QUOTES,,NA,"Herod thought that Jesus was this man ""whom I beheaded: he is risen from the dead""",John the Baptist,NA
2009-02-05,J,ROCK FORMATIONS,,800,"This punk group was the brainchild of entrepreneur Malcolm McLaren, who asked John Lydon to be its lead singer",The Sex Pistols,NA
2009-02-05,J,FASHIONABLE COMMON BONDS,,800,"French,Cuban,wedge",heels,NA
2009-02-05,J,FUNDRAISING,,800,"Donations in the form of equipment or time instead of money are called ""in"" this 4-letter word",in kind,NA
2009-02-05,J,DELAWARE,,800,"Nicknamed ""Pete"", this former gov. of Delaware once worked in the chemical co. his ancestors founded in 1802",du Pont,NA
2009-02-05,J,"THE ""FIRST"" STATE",,800,This nuclear capability is designed to completely knock out an enemy's ability to respond to your attack,first strike,NA
2009-02-05,J,BIBLICAL QUOTES,,1000,"In Proverbs this king writes, ""The fear of the Lord is the beginning of knowledge""",Solomon,NA
2009-02-05,J,ROCK FORMATIONS,,1000,This Southern California group was originally assembled as a backup band for Linda Ronstadt,The Eagles,NA
2009-02-05,J,FASHIONABLE COMMON BONDS,,1000,"Hobo,envelope,beaded",purses,NA
2009-02-05,J,FUNDRAISING,,1000,"In fundraising DM stands for this mail, which aims to scare up new donors",direct mail,NA
2009-02-05,J,DELAWARE,,1000,"Sailing under a Dutch flag, this English navigator & explorer discovered Delaware in 1609",Henry Hudson,NA
2009-02-05,J,"THE ""FIRST"" STATE",,1000,"In a symphony orchestra, the leader of this group serves as concertmaster",first violin,NA
2009-02-05,DJ,BASIC SCIENCE,,400,"(Sarah of the Clue Crew holds up a sugar cube.)  At sea level, at 32 degrees Fahrenheit, 1 cubic centimeter of air, the size of a sugar cube, contains 45 billion billion of these, from the Latin for ""little mass""",a molecule,http://www.j-archive.com/media/2009-02-05_DJ_17a.jpg
2009-02-05,DJ,REAL TO REEL,,400,This 1984 movie recounted the friendship of an American journalist & a translator in war-torn Cambodia,The Killing Fields,NA
2009-02-05,DJ,THROUGH THE 1800s WITH SARAH POLK,,400,"Born in 1803 in Tennessee, Sarah later attended school in this state due east, husband James' birthplace",North Carolina,NA
2009-02-05,DJ,BULL,,400,John Travolta & Debra Winger demonstrated the fine art of riding a mechanical bull at Gilley's in this 1980 film,Urban Cowboy,NA
2009-02-05,DJ,THERE ARE SOME STRINGS ATTACHED,,400,This instrument heard here reminds me of something; hmm...I'm starting to remember,a harp,http://www.j-archive.com/media/2009-02-05_DJ_12.mp3
2009-02-05,DJ,COMMON ABBREVIATIONS,,400,"All things considered, NPR is this popular listening place",National Public Radio,NA
2009-02-05,DJ,BASIC SCIENCE,,800,"The name of this green pigment found in plants is partly from the Greek for ""green""",chlorophyll,NA
2009-02-05,DJ,REAL TO REEL,,800,"In ""Changeling"" she plays a mom who takes on the LAPD after her son disappears & a different boy is returned to her",Angelina Jolie,NA
2009-02-05,DJ,THROUGH THE 1800s WITH SARAH POLK,,800,"In the 1840s First Lady Sarah, seeing James enter rooms unnoticed, made this song a regular feature of his entrances","""Hail To The Chief""",NA
2009-02-05,DJ,BULL,,800,This energy drink was originally developed by a Thai businessman in 1962 & sold under the name Krating Daeng,Red Bull,NA
2009-02-05,DJ,THERE ARE SOME STRINGS ATTACHED,,800,This guitar family member's circular body is covered in front with tightly stretched plastic or parchment,a banjo,NA
2009-02-05,DJ,COMMON ABBREVIATIONS,,800,"Plan for your golden years by putting money in an IRA, one of these",an individual retirement account,NA
2009-02-05,DJ,BASIC SCIENCE,,1200,"Newton's first law, about bodies at rest & in motion, is also called the law of this",the law of inertia,NA
2009-02-05,DJ,REAL TO REEL,,1200,African captives revolt aboard their slave ship & then have to stand trial in this movie based on an 1839 event,Amistad,NA
2009-02-05,DJ,THROUGH THE 1800s WITH SARAH POLK,,1200,"During the Civil War, Mrs. Polk's Tennessee home had this official status & both Union & CSA leaders visited",neutrality,NA
2009-02-05,DJ,BULL,,1200,"In 1996 Standing Rock College of Fort Yates, N.D., a Native American school, changed its name to this for a Sioux chief",Sitting Bull (College),NA
2009-02-05,DJ,THERE ARE SOME STRINGS ATTACHED,,1200,George Harrison enjoyed this instrument seen here,a sitar,http://www.j-archive.com/media/2009-02-05_DJ_14.jpg
2009-02-05,DJ,COMMON ABBREVIATIONS,,1200,"A PAC, one of these, might help your electoral chances",a political action committee,NA
2009-02-05,DJ,BASIC SCIENCE,,1600,Graphite is a soft form of this element,carbon,NA
2009-02-05,DJ,REAL TO REEL,,1600,In this 1990 movie Robin Williams played a doctor who roused a group of patients out of their catatonic states,Awakenings,NA
2009-02-05,DJ,THROUGH THE 1800s WITH SARAH POLK,,1600,In 1877 Sarah got the first one of these ever hooked up in Nashville,a telephone,NA
2009-02-05,DJ,BULL,,1600,In 1923 James Cummings & Earl McLeod designed the first one of these using a Model T frame & a wooden blade,a bulldozer,NA
2009-02-05,DJ,THERE ARE SOME STRINGS ATTACHED,,1600,"On this pre-piano item played by Lurch on TV, the strings are plucked by points connected with the keys",a harpsichord,NA
2009-02-05,DJ,COMMON ABBREVIATIONS,,1600,"Yes, sir! A PFC is one of these in the military",a private first class,NA
2009-02-05,DJ,BASIC SCIENCE,,NA,"(Kelly of the Clue Crew shows a graph on the monitor.)  Symbolized lambda, the total distance covered by one complete cycle of oscillation from peak to peak or trough to trough is called this",a wavelength,http://www.j-archive.com/media/2009-02-05_DJ_21.jpg
2009-02-05,DJ,REAL TO REEL,,2000,"In this movie Meryl Streep as Aussie mom Lindy Chamberlain exclaimed, ""The dingo's got my baby!""",A Cry In The Dark,NA
2009-02-05,DJ,THROUGH THE 1800s WITH SARAH POLK,,2000,In 1888 Mrs. Polk pushed a button in Nashville & these came on at the Cincinnati Centennial Expo,the lights,NA
2009-02-05,DJ,BULL,,NA,"""Bull City"", this place's nickname, is derived from a product sold by American Tobacco",Durham,NA
2009-02-05,DJ,THERE ARE SOME STRINGS ATTACHED,,2000,"It ain't slang for money, dough or cashola, but it is the instrument seen here",a lute,http://www.j-archive.com/media/2009-02-05_DJ_16.jpg
2009-02-05,DJ,COMMON ABBREVIATIONS,,2000,"To a home viewer, a DVD is one of these",a digital video disc,NA
2009-02-05,FJ,AMERICAN FICTION WRITERS,,NA,"He was also the U.S.'s best-paid sportswriter, with stories of people like Chicago O'Brien & Jack the Bookie",Damon Runyon,NA
