date,round,category,comment,value,clue,response,link
1988-04-06,J,RELIGION,,100,A recent N.Y. Times-CBS poll indicates a majority of U.S. Catholic priests would like to do this,marry,NA
1988-04-06,J,HUMOROUS QUOTES,,100,"Commerce Sec'y Peter Peterson said, ""The era of low-cost energy is almost dead. Popeye is running out of"" this",spinach,NA
1988-04-06,J,SEE THE USA,,100,"To see Don Ho's show, go to the Hilton's Dome Show Room in this city",Honolulu,NA
1988-04-06,J,TV TRIVIA,,100,"Only 3 men to have held this position are Douglas Edwards, Walter Cronkite, & Dan Rather",anchormen for the CBS Evening News,NA
1988-04-06,J,THE YEAR THAT WAS,"(Alex: And since we have one category that's making its very first appearance on our program, THE YEAR THAT WAS, we give you a few clues to lead you into telling us what the year was.)",100,"Capone set 1-year income record, Ruth set 1-year homer record, Lindbergh set 1-man flying record",1927,NA
1988-04-06,J,SOAP,,100,Company that's America's biggest soapmaker,Procter & Gamble,NA
1988-04-06,J,RELIGION,,200,Religion whose Bible begins with the Book of Genesis & ends with II Chronicles,Judaism,NA
1988-04-06,J,HUMOROUS QUOTES,,200,"Dean Martin said, ""If you drink, don't"" do this; ""Don't even putt""",to drive,NA
1988-04-06,J,SEE THE USA,,200,Each year kids can compete in the National  Fence Painting Contest in this Missouri town,Hannibal,NA
1988-04-06,J,TV TRIVIA,,200,"In 1968, this ""Gunsmoke"" star became the 1st woman inducted into the Cowboy Hall of Fame",Amanda Blake,NA
1988-04-06,J,THE YEAR THAT WAS,"(Alex: And since we have one category that's making its very first appearance on our program, THE YEAR THAT WAS, we give you a few clues to lead you into telling us what the year was.)",200,"Over 400,000 attended Woodstock, Chicago 8 went on trial, Neil Armstrong walked on the Moon",1969,NA
1988-04-06,J,SOAP,,200,Generic name for synthetic soap substitutes,detergents,NA
1988-04-06,J,RELIGION,,300,The American Quakers' General Conference headquarters is in this city,Philadelphia,NA
1988-04-06,J,HUMOROUS QUOTES,,300,"Secretary of State who said, ""There cannot be a crisis next week; my schedule is already full""",Henry Kissinger,NA
1988-04-06,J,SEE THE USA,,300,"According to American Express, this state draws the most visitors from other states",Florida,NA
1988-04-06,J,TV TRIVIA,,300,"Though Dobie Gillis chased all the other girls, this one wanted to marry him",Zelda Gilroy,NA
1988-04-06,J,THE YEAR THAT WAS,"(Alex: And since we have one category that's making its very first appearance on our program, THE YEAR THAT WAS, we give you a few clues to lead you into telling us what the year was.)",300,"U.S. recognized the Soviet Union, Prohibition was repealed, Hitler was appointed German chancellor",1933,NA
1988-04-06,J,SOAP,,300,Some toilet soaps contain surfactants to prevent formation of this when you use it,bathtub rings (or scum),NA
1988-04-06,J,RELIGION,,400,The United Church is this large country's largest protestant denomination,Canada,NA
1988-04-06,J,HUMOROUS QUOTES,,400,"Ernie Kovacs described it as ""a medium, so called because it is neither rare nor well done""",television,NA
1988-04-06,J,SEE THE USA,,400,"It's always 54° F. there, Kentucky's best-known national attraction",Mammoth Cave,NA
1988-04-06,J,TV TRIVIA,,NA,"This sitcom topped the ratings for 5 seasons in a row, from 1971 to 1976",All in the Family,NA
1988-04-06,J,THE YEAR THAT WAS,"(Alex: And since we have one category that's making its very first appearance on our program, THE YEAR THAT WAS, we give you a few clues to lead you into telling us what the year was.)",400,"Communist coup in Czechoslovakia, Berlin blockade began, State of Israel established",1948,NA
1988-04-06,NA,NA,NA,NA,NA,NA,NA
1988-04-06,J,RELIGION,,500,"Common in Africa, it's not the worship of animals but of spirits",animism,NA
1988-04-06,J,HUMOROUS QUOTES,,500,"It's claimed Rousseau said, ""To do is to be"" & Sartre said, ""To be is to do"" while he said, ""Doobedoobedoo""",Frank Sinatra,NA
1988-04-06,J,SEE THE USA,,500,The Appalachian National Scenic Trail runs all the way from Maine to this state,Georgia,NA
1988-04-06,J,TV TRIVIA,,500,"They not only played ""The Beverly Hillbillies"" theme, but made annual appearances on the show",(Lester) Flatt & (Earl) Scruggs,NA
1988-04-06,J,THE YEAR THAT WAS,"(Alex: And since we have one category that's making its very first appearance on our program, THE YEAR THAT WAS, we give you a few clues to lead you into telling us what the year was.)",500,"Soviets invade Afghanistan, Sandinistas take power in Nicaragua, U.S. hostages taken in Iran",1979,NA
1988-04-06,NA,NA,NA,NA,NA,NA,NA
1988-04-06,DJ,PRESIDENTS,,200,"Were he still alive, this president would now be 70 years old",JFK,NA
1988-04-06,DJ,CHINA,,200,China is the only country in the world with more than this many people,one billion,NA
1988-04-06,DJ,BOOKS & AUTHORS,,200,"Robert Penn Warren took this novel's title from a line in ""Humpty Dumpty""",All the King\'s Men,NA
1988-04-06,DJ,THE MIDDLE AGES,,200,"In 1 of these, mounted knights used blunted weapons, while Jeopardy! champs use their knowledge",a tournament,NA
1988-04-06,DJ,FOLK SONGS,,200,"""Hush little baby, don't say a word, Papa's gonna buy you"" one of these",a mockingbird,NA
1988-04-06,DJ,"""WATER""",,200,Farmers in southeast Asia use them to work in rice paddies; it's lucky they like to wallow in mud,water buffalo,NA
1988-04-06,DJ,PRESIDENTS,,400,"Complaining of this president's English, H.L. Mencken called it ""Gamalielese""",Warren G. Harding,NA
1988-04-06,DJ,CHINA,,400,"Though the Chinese invented gunpowder, they originally only used it in these",fireworks,NA
1988-04-06,DJ,BOOKS & AUTHORS,,400,"This Irishman's first & most understandable novel was ""A Portrait of the Artist as a Young Man""",James Joyce,NA
1988-04-06,DJ,THE MIDDLE AGES,,400,"About 1000 A.D., they discovered North America & called parts of it Helluland, Markland, and Vinland",the Vikings,NA
1988-04-06,NA,NA,NA,NA,NA,NA,NA
1988-04-06,DJ,"""WATER""",,400,Marlon Brando and Eva Marie Saint each won one of this 1954 films 8 Oscars,On The Waterfront,NA
1988-04-06,DJ,PRESIDENTS,,600,He presided over our national Bicentenial celebration,Gerald Ford,NA
1988-04-06,DJ,CHINA,,600,"China wants Portugal to return this colony no later than 1997, the year they'll get Hong Kong",Macao,NA
1988-04-06,DJ,BOOKS & AUTHORS,,600,"In ""The Fountainhead"", she wrote ""Great men can't be ruled""",Ayn Rand,NA
1988-04-06,DJ,THE MIDDLE AGES,,600,"This ""Venerable"" saint is called ""The Father of English History""",The Venerable Bede,NA
1988-04-06,NA,NA,NA,NA,NA,NA,NA
1988-04-06,DJ,"""WATER""",,600,Jesus did this at a wedding in Cana of Galilee,turned water into wine,NA
1988-04-06,DJ,PRESIDENTS,,800,"President who was known as the ""Schoolmaster in Politics""",Woodrow Wilson,NA
1988-04-06,DJ,CHINA,,800,They were China's last imperial dynasty,the Manchus (the Qing Dynasty),NA
1988-04-06,DJ,BOOKS & AUTHORS,,800,"The story of an indecisive man, it was been called Joseph Conrad's ""Hamlet""",Lord Jim,NA
1988-04-06,DJ,THE MIDDLE AGES,,NA,"Tradition says Rurik, a Norse leader, settled in Novgorod in 862 & became founder of this country",Russia,NA
1988-04-06,NA,NA,NA,NA,NA,NA,NA
1988-04-06,DJ,"""WATER""",,NA,It's reported The Rolling Stones took their name from the following blues song by this singer:,Muddy Waters,http://www.j-archive.com/media/1988-04-06_DJ_19.mp3
1988-04-06,DJ,PRESIDENTS,,1000,"After Garfield's death, he refused to move into the White House until it was redecorated",(Chester) Arthur,NA
1988-04-06,DJ,CHINA,,1000,"In 1887, 900,000 people died when this river, ""China's sorrow"", overflowed",the Yellow River (Hwang Ho),NA
1988-04-06,DJ,BOOKS & AUTHORS,,1000,Caldwell novel in which land set aside for the church keeps on being switched to different locations,God\'s Little Acre,NA
1988-04-06,DJ,THE MIDDLE AGES,,1000,"Though called a hermit, he led thousands of crusaders to conquer the Holy Land",Peter the Hermit,NA
1988-04-06,DJ,FOLK SONGS,,1000,"""Roll 'em up & twist 'em up a high tuckahaw, & hit 'em up a tune called"" this","""Turkey In The Straw""",NA
1988-04-06,DJ,"""WATER""",,1000,"A leading producer of brass in the U.S., this Connecticut city is called the ""Brass Center of the World""",Waterbury,NA
1988-04-06,FJ,WORLD TRADE,,NA,"Of all fresh fruits, the U.S. imports more of this one than any other",bananas,NA
