date,round,category,comment,value,clue,response,link
2003-04-29,J,WAYNE'S WORLD,,200,"An airport in Orange County, California is named for this movie ""Duke""",John Wayne,NA
2003-04-29,J,JUST MARRIED,,200,In 1804 Napoleon's brother Jerome & his Baltimore-bred bride honeymooned at this upstate New York site,Niagara Falls,NA
2003-04-29,J,CHEMICAL ELEMENTS,,200,"This metal's ""Age"" began around 1200 B.C. & no, it didn't follow the Wash & Dry Age",the Iron Age,NA
2003-04-29,J,THE THEATRE,,200,"Playwright Jean Anouilh had a lot at ""stake"" with ""L'Alouette"", his play about this female saint",Joan of Arc,NA
2003-04-29,J,"BOY, DO YOU NEED MAKE-UP!",,200,"Jet-lagged or just hung-over?  Let's wake up your face with Wu Morning!, a mask from this Asian country",China,NA
2003-04-29,J,ANIMAL VERBS,,200,"Flutter, like eyelashes",bat,NA
2003-04-29,J,WAYNE'S WORLD,,400,In 1998 he was picked as the top player of all time by The Hockey News,Wayne Gretzky,NA
2003-04-29,J,JUST MARRIED,,400,"2 of the traditional ""Big 5"" animals you'd hope to see on a safari honeymoon","(2 of) lion, elephant, leopard, rhinoceros & Cape buffalo",NA
2003-04-29,J,CHEMICAL ELEMENTS,,400,"Centrum multivitamins say they're ""Complete from A to"" this element",zinc,NA
2003-04-29,J,THE THEATRE,,400,"This director of the film ""Moulin Rouge!"" brought his hit production of ""La boheme"" to Broadway in 2002",Baz Luhrmann,NA
2003-04-29,J,"BOY, DO YOU NEED MAKE-UP!",,400,"Let's dramatize your look with some Hard Candy mascara in pickle, a shade of this color",green,NA
2003-04-29,J,ANIMAL VERBS,,400,"To decide irrevocably, like someone's fate",seal,NA
2003-04-29,J,WAYNE'S WORLD,,600,Wayne Rogers left this show after a contract dispute; his character Trapper John got discharged & went home,M*A*S*H,NA
2003-04-29,J,JUST MARRIED,,600,"In Venice, this professional needs a license to operate his boat, but not to sing to newlyweds",a gondolier,NA
2003-04-29,J,CHEMICAL ELEMENTS,,600,Wondering what to do with your cadmium?  Combine it with nickel to make the popular NiCad types of these,batteries,NA
2003-04-29,J,THE THEATRE,,NA,"Now ear this: ""Vincent in Brixton"" is a play about this artist",Vincent Van Gogh,NA
2003-04-29,J,"BOY, DO YOU NEED MAKE-UP!",,600,Bad Girl & Lush aren't what your agent calls you; they're pencils from Benefit made to line eyes & these,lips,NA
2003-04-29,J,ANIMAL VERBS,,600,"In cooking, to cut open & spread flat, as with shrimp or steak",butterfly,NA
2003-04-29,J,WAYNE'S WORLD,,800,He headlines at the Stardust in Las Vegas 40 weeks a year,Wayne Newton,NA
2003-04-29,NA,NA,NA,NA,NA,NA,NA
2003-04-29,J,CHEMICAL ELEMENTS,,800,Martin Klaproth named this radioactive element that he discovered in 1789 for a planet discovered in 1781,uranium,NA
2003-04-29,NA,NA,NA,NA,NA,NA,NA
2003-04-29,J,"BOY, DO YOU NEED MAKE-UP!",,800,Your face may get a lift from this music-&-airline mogul's Virgin Cosmetics,Richard Branson,NA
2003-04-29,NA,NA,NA,NA,NA,NA,NA
2003-04-29,NA,NA,NA,NA,NA,NA,NA
2003-04-29,NA,NA,NA,NA,NA,NA,NA
2003-04-29,J,CHEMICAL ELEMENTS,,1000,"At -37.93 degrees Fahrenheit, this metal becomes a solid",mercury,NA
2003-04-29,NA,NA,NA,NA,NA,NA,NA
2003-04-29,J,"BOY, DO YOU NEED MAKE-UP!",,1000,"I think I'll adorn myself with Tova Borgnine's All Over crayons (wonder if she uses them on this guy, her husband)",Ernest Borgnine,NA
2003-04-29,NA,NA,NA,NA,NA,NA,NA
2003-04-29,DJ,INDEPENDENCE DAY,,400,This country celebrates Cinco de Mayo on May 5 & its independence on September 16,Mexico,NA
2003-04-29,DJ,THE BEVERLY HILLS PUBLIC LIBRARY,,400,"Beg all you want, you can't do this with Siegel & Shim's ""Dictionary of Accounting Terms"" -- it's a reference book",check it out,NA
2003-04-29,DJ,GRACELAND,,400,(Sarah of the Clue Crew at Graceland in Memphis)  This person who released their first album in 2003 often napped in the Monkey Chair at Graceland's Jungle Room,Lisa Marie Presley,NA
2003-04-29,DJ,THE PIANIST,,400,"Once the highest-paid musician, he dazzled us with costumes & candelabra, as well as his piano playing",Liberace,NA
2003-04-29,DJ,HAIL TO THE CHIEF,,400,"The family bible records his first 2 names as David Dwight, not Dwight David",Eisenhower,NA
2003-04-29,DJ,WHAT ARE YOU AFRAID OF?,,400,"Rhytiphobia is the fear of getting these -- botox, anyone?",wrinkles,NA
2003-04-29,DJ,INDEPENDENCE DAY,,800,On September 7 you can party on down to Rio & celebrate this South American country's independence,Brazil,NA
2003-04-29,DJ,THE BEVERLY HILLS PUBLIC LIBRARY,,800,"""Before Taliban"" & ""Behind the Burqa"" are books about this country",Afghanistan,NA
2003-04-29,DJ,GRACELAND,,800,"Elvis' pets at Graceland included these birds of the pheasant family, with spreading tail feathers",peacocks,NA
2003-04-29,DJ,THE PIANIST,,800,He's the pianist who's tickling the ivories in the photo seen here,Richard M. Nixon,NA
2003-04-29,DJ,HAIL TO THE CHIEF,,800,"Stephen T. Logan, & later William H. Herndon, were his law partners in Springfield, Illinois",Abraham Lincoln,NA
2003-04-29,DJ,WHAT ARE YOU AFRAID OF?,,800,"Melissophobia isn't the fear of Joan Rivers' daughter but the fear of these insects, honey",bees,NA
2003-04-29,DJ,INDEPENDENCE DAY,,1200,"This ""is the word""; ""It's got groove, it's got meaning"" & it's got its independence day on March 25",Greece,NA
2003-04-29,DJ,THE BEVERLY HILLS PUBLIC LIBRARY,,1200,"Shelved not far from his novel ""A Farewell to Arms"" is a bio of him subtitled ""A Life Without Consequences""",Ernest Hemingway,NA
2003-04-29,DJ,GRACELAND,,1200,"(Cheryl of the Clue Crew at Graceland in Memphis)  The initials ""TCB"" painted here on the tail of Elvis Presley's airplane stand for this","""Taking Care of Business""",NA
2003-04-29,NA,NA,NA,NA,NA,NA,NA
2003-04-29,DJ,HAIL TO THE CHIEF,,1200,His first proclamation as president was to declare a national day of mourning for John F. Kennedy,Lyndon Baines Johnson,NA
2003-04-29,DJ,WHAT ARE YOU AFRAID OF?,,1200,"You may want to avoid Jay Leno if you have geniophobia, the fear of this body part",the chin,NA
2003-04-29,DJ,INDEPENDENCE DAY,,1600,"After the czar was overthrown in 1917, Finland declared its independence from this country",Russia,NA
2003-04-29,NA,NA,NA,NA,NA,NA,NA
2003-04-29,DJ,GRACELAND,,NA,In the 1960s Elvis began a tradition of lining his driveway with lights of this color found in an Elvis Xmas song,blue,NA
2003-04-29,NA,NA,NA,NA,NA,NA,NA
2003-04-29,DJ,HAIL TO THE CHIEF,,1600,"As part of his ""New Deal"", he took American currency off the gold standard in 1933",Franklin D. Roosevelt,NA
2003-04-29,DJ,WHAT ARE YOU AFRAID OF?,,NA,Gallophobes fear anything related to this country -- better cancel that film with Gerard Depardieu,France,NA
2003-04-29,NA,NA,NA,NA,NA,NA,NA
2003-04-29,DJ,THE BEVERLY HILLS PUBLIC LIBRARY,,2000,The language books are in the 400s in this numerical system used by the library,Dewey Decimal System,NA
2003-04-29,DJ,GRACELAND,,2000,(Sarah of the Clue Crew)  This TV-radio console was a gift to Elvis from this company for the sale of more than 50 million albums,RCA,NA
2003-04-29,NA,NA,NA,NA,NA,NA,NA
2003-04-29,NA,NA,NA,NA,NA,NA,NA
2003-04-29,DJ,WHAT ARE YOU AFRAID OF?,,2000,"Tippi Hedren doesn't suffer from ornithophobia, the fear of these creatures",birds,NA
2003-04-29,FJ,FILMS OF THE '60s,"(Alex: We're being very selfish, Vivica; we like looking at you and having you around!)",NA,"In the top films of 2 consecutive years in the 1960s, she played a nanny & a governess",Julie Andrews,NA
