date,round,category,comment,value,clue,response,link
2009-07-16,J,KIDS RULE!,,200,"Henry VI was just 9 months old when he succeeded his dad, Henry V, as king of this in 1422",England,NA
2009-07-16,J,ANIMATED CREATURES,,200,Bruno the dog is turned into a footman for the horse-drawn pumpkin coach in this animated film,Cinderella,NA
2009-07-16,J,"SPIDERS, MAN!",,200,Spiders usually have this many eyes; one for each leg?,8,NA
2009-07-16,J,PORT OF CALL,,200,Yokohama in this country was a small fishing village of only 350 people when Commodore Perry first visited,Japan,NA
2009-07-16,J,MIXED BAG,,200,"In 2009 14-year-old Danny Johnson became a legend of rock when he scored 973,954 points in this game",Guitar Hero,NA
2009-07-16,J,"LET'S ""CH""AT",,200,"They're routine tasks done around the house, & before you go out to play, you'd better do yours",chores,NA
2009-07-16,J,KIDS RULE!,,400,"This ""boy king"" was about 9 years old when he became a pharaoh around 1333 B.C.",Tutankhamen,NA
2009-07-16,J,ANIMATED CREATURES,,400,"This pet of Lilo's is actually Genetic Experiment 626, a fugitive alien",Stitch,NA
2009-07-16,J,"SPIDERS, MAN!",,400,"""Charlotte's Web"" is about a spider who becomes friends with Wilbur, one of these farm animals",a pig,NA
2009-07-16,J,PORT OF CALL,,400,This largest city in Texas has a 52-mile shipping channel that links its port with the Gulf of Mexico,Houston,NA
2009-07-16,J,MIXED BAG,,400,"(Sarah of the Clue Crew holds a proverbial glass of, well, colored liquid of some sort.)  As an optimist, it's how I see this glass",half full,http://www.j-archive.com/media/2009-07-16_J_12.jpg
2009-07-16,J,"LET'S ""CH""AT",,400,It's the form of carbon your dad probably uses when he fires up the barbecue,charcoal,NA
2009-07-16,J,KIDS RULE!,,600,Fyodor III was 14 in 1676 when he ascended to the throne of Russia & took this Russian title,Tsar Fyodor,NA
2009-07-16,J,ANIMATED CREATURES,,600,"In this film Rhino the hamster helps his dog hero, who doesn't actually have super powers",Bolt,NA
2009-07-16,J,"SPIDERS, MAN!",,600,"Scientifically known as Lactrodectus mactans, this ""dark"" spider can have a deadly bite",a black widow,NA
2009-07-16,J,PORT OF CALL,,600,This largest Maryland city & port saw the rockets' red glare during the War of 1812,Baltimore,NA
2009-07-16,J,MIXED BAG,,600,"Even if your parents don't drive one, you should know that SUV stands for this type of vehicle",a sports utility vehicle,NA
2009-07-16,J,"LET'S ""CH""AT",,600,"To make butter, you need one of these special containers in which to stir the milk or cream",churn,NA
2009-07-16,J,KIDS RULE!,,800,Jeanne de Navarre was 13 when she became this country's queen in 1285,France,NA
2009-07-16,J,ANIMATED CREATURES,,800,In this film the mouse Roddy St. James finds a new world after going down the bathroom's whirlpool,Flushed Away,NA
2009-07-16,J,"SPIDERS, MAN!",,800,Stand back--it's the hairy variety of spider seen here,the tarantula,http://www.j-archive.com/media/2009-07-16_J_24.jpg
2009-07-16,J,PORT OF CALL,,NA,Port Said in this African country was established when work on the Suez Canal began,Egypt,NA
2009-07-16,J,MIXED BAG,,800,"In 1881 a famous gunfight took place at the O.K. Corral in this Arizona city with a ""grave"" name",Tombstone,NA
2009-07-16,J,"LET'S ""CH""AT",,800,The basic tools for carving stone are a hammer & this long-bladed implement seen here,a chisel,http://www.j-archive.com/media/2009-07-16_J_06a.jpg
2009-07-16,J,KIDS RULE!,,1000,"Isabella II, the daughter of Ferdinand VII, was just under 3 years old when she was proclaimed queen of this in 1833",Spain,NA
2009-07-16,J,ANIMATED CREATURES,,1000,Lovelace is a rockhopper who will answer any of life's questions for the price of a pebble in this film,Happy Feet,NA
2009-07-16,J,"SPIDERS, MAN!",,1000,"Little Miss Muffet was a well-known sufferer of this phobia, the technical term for a fear of spiders",arachnophobia,NA
2009-07-16,J,PORT OF CALL,,1000,This Australian port city was founded as a British penal colony in 1788,Sydney,NA
2009-07-16,J,MIXED BAG,,1000,This holiday that celebrates a Mexican victory in 1862 may be more widely celebrated in the U.S. than in Mexico itself,Cinco de Mayo,NA
2009-07-16,J,"LET'S ""CH""AT",,1000,"One of the driest places on Earth, the Atacama Desert lies mainly in this South American country",Chile,NA
2009-07-16,DJ,PRESIDENT & ACCOUNTED FOR,,400,"In 2008 people wondered whether this former president might add the title ""First Man"" to his resume",Bill Clinton,NA
2009-07-16,DJ,KIDS LOVE MUSEUMS,,400,You may want to take your parents to the Memphis Rock 'n' Soul Museum in this state,Tennessee,NA
2009-07-16,DJ,MEASURE IT,,400,"If your mom says you have a fever with a body temperature of 39, she's using this scale",Celsius,NA
2009-07-16,DJ,BIBLE BASICS,,400,The Virgin Mary was betrothed to this village carpenter,Joseph,NA
2009-07-16,DJ,CANDY IS DANDY,,400,The galaxy that we're in shares its name with this candy bar,a Milky Way,NA
2009-07-16,DJ,PARTS OF SPEECH,(Alex: And you have to give the part of speech that is the underlined word in each clue.),400,"Ms. Missy Massey got mussed up & messy in Missoula, Montana",a noun,NA
2009-07-16,DJ,PRESIDENT & ACCOUNTED FOR,,800,"After his tragic assassination, he was succeeded by Andrew Johnson",Lincoln,NA
2009-07-16,DJ,KIDS LOVE MUSEUMS,,800,Sweet!  Learn all about sugarcane at the sugar museum on the island of Maui in this state,Hawaii,NA
2009-07-16,DJ,MEASURE IT,,800,The can seen here holds this many fluid ounces,12,http://www.j-archive.com/media/2009-07-16_DJ_12.jpg
2009-07-16,DJ,BIBLE BASICS,,800,"After he was swallowed by a great fish, he finally obeyed God's orders to go to Nineveh",Jonah,NA
2009-07-16,DJ,CANDY IS DANDY,,800,These candies were named for their resemblance to something you hope you won't need on a boat,Life Savers,NA
2009-07-16,DJ,PARTS OF SPEECH,(Alex: And you have to give the part of speech that is the underlined word in each clue.),800,"I'm sorry, but I didn't know   you owned that yak when I said that",a pronoun,NA
2009-07-16,DJ,PRESIDENT & ACCOUNTED FOR,,1200,"In 1960 he defeated Richard Nixon by fewer than 115,000 popular votes",JFK (John Kennedy),NA
2009-07-16,DJ,KIDS LOVE MUSEUMS,,1200,"At circus world in Wisconsin, you can visit the circus museum & ride a pony or this gray pachyderm, too",an elephant,NA
2009-07-16,DJ,MEASURE IT,,1200,"For moderately active 12- & 13-year-old boys, the government recommends consuming 2,200 of these units a day",calories,NA
2009-07-16,DJ,BIBLE BASICS,,1200,"Jesus gave his apostle Simon this name, from the Greek for ""rock"", & made him a ""fisher of men""",Peter,NA
2009-07-16,DJ,CANDY IS DANDY,,1200,"Hershey's ""affectionately"" introduced these in 1907; the name may be from the sound of machines that make them",Hershey\'s Kisses,NA
2009-07-16,DJ,PARTS OF SPEECH,(Alex: And you have to give the part of speech that is the underlined word in each clue.),1200,Paper or plastic?,a conjunction,NA
2009-07-16,DJ,PRESIDENT & ACCOUNTED FOR,,1600,In 1978 he made an unsuccessful run for a Texas congressional seat,George W. Bush,NA
2009-07-16,DJ,KIDS LOVE MUSEUMS,,1600,"Wow!  The ""largest children's museum in the world"" is in this capital of Indiana",Indianapolis,NA
2009-07-16,DJ,MEASURE IT,,1600,"In Portugal, ask someone how heavy he is & he'll answer you in these units, each 2.2 pounds",a kilogram,NA
2009-07-16,DJ,BIBLE BASICS,,NA,"Appropriately, the name of this guy who suffered righteously comes from a Hebrew word meaning ""persecuted""",Job,NA
2009-07-16,DJ,CANDY IS DANDY,,1600,"As an adjective, it means ""easily broken""; as a noun, it's candy made with caramelized sugar & nuts",brittle,NA
2009-07-16,DJ,PARTS OF SPEECH,(Alex: And you have to give the part of speech that is the underlined word in each clue.),1600,"Fo' shizzle, my dizzles!  I've recorded a new rap CD you'll find extremely phat",an adverb,NA
2009-07-16,DJ,PRESIDENT & ACCOUNTED FOR,,2000,"As Georgia's gov., he shrank state government by merging about 300 state agencies & boards into about 30 agencies",Jimmy Carter,NA
2009-07-16,DJ,KIDS LOVE MUSEUMS,,2000,The Tactile Dome inside the Exploratorium is totally dark; you have to use this tactile sense to guide you,touch,NA
2009-07-16,DJ,MEASURE IT,,NA,"If the minimum height for a ride is 3'4"", you must be this many inches tall to get on",40 inches,NA
2009-07-16,DJ,BIBLE BASICS,,2000,This prophet's hobbies included dunking people in the river & dining on locusts & wild honey,John the Baptist,NA
2009-07-16,DJ,CANDY IS DANDY,,2000,"""Hungry?  Grab"" one of these peanut, caramel & nougat chocolate bars that also come in Cruncher & Almond varieties",a Snickers (a Snicker accepted),NA
2009-07-16,DJ,PARTS OF SPEECH,(Alex: And you have to give the part of speech that is the underlined word in each clue.),2000,"The roof, the roof, the roof is on fire!",a preposition,NA
2009-07-16,FJ,WOMEN AUTHORS,,NA,"As a child, she liked to play witches & wizards with her friends Ian & Vikki Potter",J.K. Rowling,NA
