date,round,category,comment,value,clue,response,link
2003-10-09,J,EUROPE,(Alex: Good place to begin!),200,The world's earliest steam locomotives pulled cars full of this product out of mines in Wales,coal,NA
2003-10-09,J,FRUITS & VEGETABLES,,200,"The sugar variety of this is preferred for pies, the Connecticut field variety for jack-o'-lanterns",pumpkin,NA
2003-10-09,J,BEFORE HE WAS PRESIDENT...,,200,"He was the author of ""Profiles in Courage""",(John F.) Kennedy,NA
2003-10-09,J,POLITICALLY INCORRECT SONGS,,200,"Lyric that completes the line ""We're drinkin' my friend, to the end of a brief episode, make it one for my baby...""",and one for the road,NA
2003-10-09,J,"""STREET""s",,200,"America's second-largest daily newspaper, it's published in New York City & 4 regional editions",The Wall Street Journal,NA
2003-10-09,J,SOUNDS THE SAME,,200,"Feeble, or 7 days",weak/week,NA
2003-10-09,J,EUROPE,(Alex: Good place to begin!),400,The residents of this country noted for its Grand Prix are almost all foreigners,Monaco,NA
2003-10-09,J,FRUITS & VEGETABLES,,400,The scientific name of this veggie -- or is it a fruit? -- is Lycopersicon esculentum,tomato,NA
2003-10-09,J,BEFORE HE WAS PRESIDENT...,,400,He was a matinee idol,Ronald Reagan,NA
2003-10-09,J,POLITICALLY INCORRECT SONGS,,400,"""Gonna meet the boys on floor number two"" for this title activity of a 1985 Motley Crue hit","""Smokin\' In The Boys Room""",NA
2003-10-09,J,"""STREET""s",,400,"Elvis could have told you it's the location of ""Heartbreak Hotel""",down at the end of lonely street,NA
2003-10-09,J,SOUNDS THE SAME,,400,"Your lips say ""No, no, no,"" but these say ""Yes, yes, yes""",eyes/ayes,NA
2003-10-09,J,EUROPE,(Alex: Good place to begin!),600,City seen here during a lazy summer day,Pamplona,NA
2003-10-09,J,FRUITS & VEGETABLES,,600,"Unlike the green variety of this vegetable, the string on sugar snaps runs around both sides of the pod",peas,NA
2003-10-09,J,BEFORE HE WAS PRESIDENT...,,600,"He was postmaster of New Salem, Illinois",Abraham Lincoln,NA
2003-10-09,J,POLITICALLY INCORRECT SONGS,,600,"""Some get a kick from"" this, a Cole Porter song says, ""I'm sure that if I had even one sniff it would bore me terrific'ly too""",cocaine,NA
2003-10-09,J,"""STREET""s",,600,It's the shrewd awareness & resourcefulness needed to survive a hostile urban environment,street smarts,NA
2003-10-09,J,SOUNDS THE SAME,,600,"Very sage, or a pair of the letter after X",wise/Ys,NA
2003-10-09,J,EUROPE,(Alex: Good place to begin!),800,"Bulgaria is a leading producer of attar, an oil from these flowers",roses,NA
2003-10-09,J,FRUITS & VEGETABLES,,800,In Italian cabbage is cavolo & this vegetable is cavolfiore,cauliflower,NA
2003-10-09,J,BEFORE HE WAS PRESIDENT...,,800,"He owned a haberdashery in Kansas City, Missouri",Harry S. Truman,NA
2003-10-09,J,POLITICALLY INCORRECT SONGS,,800,"""She makes the Indy 500 look like a Roman chariot race now...and she'll have fun, fun, fun til"" this happens",til Daddy takes the T-Bird away,NA
2003-10-09,J,"""STREET""s",,800,"In ""O Little Town of Bethlehem"", it's where ""the everlasting light"" shineth",in thy dark street,NA
2003-10-09,J,SOUNDS THE SAME,,800,To find & dig out this metal containing material with this boating implement would be a stroke of luck,ore/oar,NA
2003-10-09,J,EUROPE,(Alex: Good place to begin!),1000,In 1997 this eastern European country restored the citizenship of its exiled King Michael,Romania,NA
2003-10-09,J,FRUITS & VEGETABLES,,1000,"Although this juice orange may have originated in Portugal, it bears the name of a Spanish city & region",Valencia,NA
2003-10-09,J,BEFORE HE WAS PRESIDENT...,,NA,He was Thomas Jefferson's secretary of state,(James) Madison,NA
2003-10-09,J,POLITICALLY INCORRECT SONGS,,1000,"This song by Sheila E. begins, ""She wears a long fur coat of mink, even in the summer time""","""The Glamorous Life""",NA
2003-10-09,J,"""STREET""s",,1000,"One of the world's top marketers of business information, its NYSE symbol is DNB",Dun & Bradstreet,NA
2003-10-09,J,SOUNDS THE SAME,,1000,"Reasonable, or a payment for travel",fair/fare,NA
2003-10-09,DJ,TALKING RELIGION,,400,"(Sarah of the Clue Crew reports from Waikiki Beach in Oahu, Hawaii.)  Around 1830 these conservative religious workers made hula dancers wear long dresses instead of skirts",missionaries,NA
2003-10-09,DJ,"LITERARY CROSSWORD CLUES ""S""",,400,"Gertrude, or her beer mug(5)",stein,NA
2003-10-09,DJ,CABLE TV,,400,"""Scorecard Report"" & ""Peter Jacobsen Plugged In"" are seen on the sports channel devoted to this",golf,NA
2003-10-09,DJ,GAS,,400,Hank Hill knows it's the most common U.S. residential liquefied petroleum gas,propane,NA
2003-10-09,DJ,FOOD,,400,"An energetic person is full of these, maybe the fava type",beans,NA
2003-10-09,DJ,LODGING,(Alex: We're going on a trip!),400,"If you're looking at a long time in Tempe, try Studio 6, the extended-stay version of this chain",Motel 6,NA
2003-10-09,DJ,TALKING RELIGION,,800,"St. Augustine's mother was a Christian, but his father was one of these, from the Latin for ""country dweller""",pagan,NA
2003-10-09,DJ,"LITERARY CROSSWORD CLUES ""S""",,800,"It's paired with ""Sense""(11)",Sensibility,NA
2003-10-09,DJ,CABLE TV,,800,"One of the most popular shows on the Food Network is ""The Essence of"" him",Emeril,NA
2003-10-09,DJ,GAS,,800,"(Sofia of the Clue Crew reports from the Goodyear Blimp's home base.)  Having learned from the Hindenburg, modern non-rigid airships use helium in place of this explosive gas",hydrogen,NA
2003-10-09,DJ,FOOD,,800,Government money that a congressman steers toward his home district,pork,NA
2003-10-09,DJ,LODGING,(Alex: We're going on a trip!),800,"What some say the movie ""Stagecoach"" is, or ""The World's Largest Hotel Chain"", with more than 4,000 hotels",Best Western,NA
2003-10-09,DJ,TALKING RELIGION,,1200,"(Sarah of the Clue Crew reports from in front of Westminster Abbey in London.)  The statues over the west front door are all of these, people who died for their Christian faith",martyrs,NA
2003-10-09,DJ,"LITERARY CROSSWORD CLUES ""S""",,1200,Caldecott Medalist Maurice(6),Sendak,NA
2003-10-09,DJ,CABLE TV,,NA,"""The Eulogy"" is HBO's e-mail newsletter devoted to this series",Six Feet Under,NA
2003-10-09,DJ,GAS,,1200,"Used in WWI & against Iraq's Kurds, it's named for its smell",mustard gas,NA
2003-10-09,DJ,FOOD,,1200,"To mean a quarrel, vegetarians can use ""rhubarb"" & carnivores can use this",beef,NA
2003-10-09,DJ,LODGING,(Alex: We're going on a trip!),1200,"Spelled the same way as a type of regular payment, it's a small European hotel or boarding house",pension,NA
2003-10-09,DJ,TALKING RELIGION,,NA,"Pedilavium is this ceremony, part of the Maundy Thursday observance",the washing of the feet,NA
2003-10-09,DJ,"LITERARY CROSSWORD CLUES ""S""",,1600,Miserly Marner(5),Silas,NA
2003-10-09,DJ,CABLE TV,,1600,"(Hi, I'm Billy Ray Cyrus.)  In 2001 I began practicing medicine in the Big Apple on this Pax TV drama",Doc,NA
2003-10-09,DJ,GAS,,1600,"The atmosphere of Venus, the heaviest of any planet, is mainly this common gas 1.5 times heavier than air",carbon dioxide,NA
2003-10-09,DJ,FOOD,,1600,Diana Prince occasionally has to take her hair out of this to become Wonder Woman,a bun,NA
2003-10-09,DJ,LODGING,(Alex: We're going on a trip!),1600,"In 1912 King Alfonso inaugurated this -- not his own home, but the Madrid hotel",the Palace,NA
2003-10-09,DJ,TALKING RELIGION,,2000,An apostle spreads his belief; this word with the same beginning means one who abandons it,apostate,NA
2003-10-09,DJ,"LITERARY CROSSWORD CLUES ""S""",,2000,Hesse-ian Buddhist saga(10),Siddhartha,NA
2003-10-09,DJ,CABLE TV,,2000,"What Sonya Fitzpatrick is, or the Animal Planet series on which she communicates with animals telepathically",The Pet Psychic,NA
2003-10-09,NA,NA,NA,NA,NA,NA,NA
2003-10-09,DJ,FOOD,,2000,"A story or joke that's been repeated often, maybe too often",a chestnut,NA
2003-10-09,DJ,LODGING,(Alex: We're going on a trip!),2000,Escoffier was once the chef of this elegant French-named hotel at Fifth Avenue & 61st Street,the Pierre Hotel,NA
2003-10-09,FJ,MOVIE CHARACTERS,,NA,"On the AFI's 2003 lists of favorite movie heroes & villains of all time, this character appears on both lists",the Terminator,NA
