date,round,category,comment,value,clue,response,link
2004-01-23,J,METALS,,200,"Around 3000 B.C. it had 2/5 the value of gold, but in 2002 it had about 1/75 gold's value",silver,NA
2004-01-23,J,UNSUNG HEROES,,200,In 1912 Tom Crean made a solo 35-mile trek on this continent to save 2 of his mates,Antarctica,NA
2004-01-23,J,U.S. CITIES,,200,Farmers in this state's San Joaquin Valley ship their stock through Stockton,California,NA
2004-01-23,J,WEIGHTS & MEASURES,,200,Term for a single exposure on a reel of motion picture film,frame,NA
2004-01-23,J,FITS HUGH,,200,Plans are for Hugh Grant to return as Daniel Cleaver in the sequel to this 2001 Renee Zellweger film,Bridget Jones\'s Diary,NA
2004-01-23,J,"TO A ""TEE""","(Alex: Each response will end in those 3 letters, ""T-E-E"".)",200,Type of ballot to file when you're not there to vote on election day,an absentee,NA
2004-01-23,J,METALS,,400,"Ancient Roman pewter was 30% this metal, which for safety's sake is no longer used",lead,NA
2004-01-23,J,UNSUNG HEROES,,400,We breathe a bit easier because Rep. Kenneth Roberts sponsored the original version of this act in 1963,the Clean Air Act,NA
2004-01-23,J,U.S. CITIES,,400,This Kentucky city was founded in 1775 & named for a battle site in Massachusetts,Lexington,NA
2004-01-23,J,WEIGHTS & MEASURES,,400,In the 14th century Edward II declared it was equal to 3 barley corns laid end-to-end,an inch,NA
2004-01-23,J,FITS HUGH,,400,Hugh tried to woo Emma in this 1995 film based on a Jane Austen novel,Sense and Sensibility,NA
2004-01-23,J,"TO A ""TEE""","(Alex: Each response will end in those 3 letters, ""T-E-E"".)",400,"Ring in, miss the clue -- tough.  We don't offer a ""money back"" one",guarantee,NA
2004-01-23,J,METALS,,600,This alloy metal popular for bathroom rails gets softer as it includes more copper & less zinc,brass,NA
2004-01-23,J,UNSUNG HEROES,,NA,Tennessee militia general William Carroll sailed down the Mississippi to help out at this 1815 battle,the Battle of New Orleans,NA
2004-01-23,J,U.S. CITIES,,600,In November 2001 this city's Journal & Constitution newspapers fully merged,Atlanta,NA
2004-01-23,J,WEIGHTS & MEASURES,,600,This equivalent to 1 cup is slang for a short person,half pint,NA
2004-01-23,J,FITS HUGH,,600,"In this 1995 film directed by Chris Columbus, Hugh finds out his girlfriend is pregnant",Nine Months,NA
2004-01-23,J,"TO A ""TEE""","(Alex: Each response will end in those 3 letters, ""T-E-E"".)",600,"It's been said that ""A camel is a horse designed by"" this",committee,NA
2004-01-23,J,METALS,,800,"Atomic number 13, you touch it when you unwrap a stick of Wrigley's chewing gum",aluminum,NA
2004-01-23,J,UNSUNG HEROES,,800,"Fred Hollows crusaded primarily to save Third World folks from this blinding condition, using synthetic lenses",cataracts,NA
2004-01-23,J,U.S. CITIES,,800,"Rochester, New York grew because of its location on this",the Erie Canal,NA
2004-01-23,J,WEIGHTS & MEASURES,,800,"If a gigawatt you see, this is the number of watts you get",a billion,NA
2004-01-23,J,FITS HUGH,,800,"The 2003 ABC series ""I'm With Her"", about a star falling for an ordinary guy, sounds like this film of Hugh's",Notting Hill,NA
2004-01-23,J,"TO A ""TEE""","(Alex: Each response will end in those 3 letters, ""T-E-E"".)",800,"Conversation marked by quick, witty banter",repartee,NA
2004-01-23,J,METALS,,1000,"Coffinite, discovered in Colorado in 1955, is an ore that's 60% this valuable radioactive metal",uranium,NA
2004-01-23,J,UNSUNG HEROES,,1000,"(Sofia of the Clue Crew at the Johnson Space Center in Houston)  This NASA flight director of the 1960s & '70s wrote the book ""Failure Is Not an Option""",Gene Kranz,NA
2004-01-23,J,U.S. CITIES,,1000,"This Idaho city, founded in 1861, was named for the co-leader of an expedition that camped there in 1805",Lewiston,NA
2004-01-23,J,WEIGHTS & MEASURES,,1000,"(Jimmy of the Clue Crew)  It's the standard unit of size for nails; this baby, used in framing a house, is a 16",penny,NA
2004-01-23,J,FITS HUGH,,1000,"In this 1999 comedy Hugh tried to learn how to say ""fuggeddaboutit""",Mickey Blue Eyes,NA
2004-01-23,J,"TO A ""TEE""","(Alex: Each response will end in those 3 letters, ""T-E-E"".)",1000,"The order Sirena includes the dugong, the extinct Steller's sea cow & this",the manatee,NA
2004-01-23,DJ,ART & ARTISTS,,400,"He was nearly blind when he painted his series of ""Water Lilies""",(Claude) Monet,NA
2004-01-23,DJ,ENTERTAINING BIRDS,,400,This canary with a wide-eyed stare is constantly on alert for Sylvester the Cat,Tweety,NA
2004-01-23,DJ,BODIES OF WATER,,400,Nunivak Island & the Pribilof Islands are in this sea,the Bering Sea,NA
2004-01-23,DJ,GET THE MESSAGE,,400,The last message from her in 1937 pertained to her location & an alternate radio frequency for communication,Amelia Earhart,NA
2004-01-23,DJ,BURIED AT ARLINGTON NATIONAL CEMETERY,,400,"Seen here, his is one of the most visited graves at Arlington",John F. Kennedy,NA
2004-01-23,DJ,ABBREVIATIONS,,400,Biologically speaking:RNA,ribonucleic acid,NA
2004-01-23,DJ,ART & ARTISTS,,800,"Seen here, he's the most famous occupant at California's Huntington Library","""The Blue Boy""",NA
2004-01-23,DJ,ENTERTAINING BIRDS,,800,"Winken, Blinken & Nod were 3 orphaned pet birds raised by young Opie Taylor on a 1963 episode of this sitcom",The Andy Griffith Show,NA
2004-01-23,DJ,BODIES OF WATER,,800,"(Alex: Here's Jeff Probst in South America [Amazon])  The decomposition of organic matter & a low silt content give the Rio Negro this color water, hence its name",black,NA
2004-01-23,DJ,GET THE MESSAGE,,800,"In 1968 this pop group delivered ""I've Got to Get a Message to You""",the Bee Gees,NA
2004-01-23,DJ,BURIED AT ARLINGTON NATIONAL CEMETERY,,800,"A soldier during WWII, this civil rights leader, murdered in Mississippi in 1963, is buried at Arlington",(Medgar) Evers,NA
2004-01-23,DJ,ABBREVIATIONS,,800,Sydney is its capital:NSW,New South Wales,NA
2004-01-23,DJ,ART & ARTISTS,,1200,"Marcel Duchamp's most famous painting is ""Nude Descending"" this",A Staircase,NA
2004-01-23,DJ,ENTERTAINING BIRDS,,1200,"Catchphrases of this large windbag of a rooster include ""Pay Attention, Boy!"" & ""Go Away Boy, You Bother Me""",Foghorn Leghorn,NA
2004-01-23,DJ,BODIES OF WATER,,1200,"The Cinque Terre, 5 fishing villages on the Italian Riviera, overlook the Ligurian Sea, an arm of this sea",the Mediterranean,NA
2004-01-23,DJ,GET THE MESSAGE,,1200,In April 1913 Woodrow Wilson became the first president since John Adams to deliver this message in person,the State of the Union,NA
2004-01-23,DJ,BURIED AT ARLINGTON NATIONAL CEMETERY,,1200,"This rear admiral rests beneath a granite globe, with a bronze star marking the North Pole",(Robert) Peary,NA
2004-01-23,DJ,ABBREVIATIONS,,1200,On a radio:FM,frequency modulation,NA
2004-01-23,DJ,ART & ARTISTS,,1600,"His ""Vampire"" painting from 1893 just might make you ""Scream""",Edvard Munch,NA
2004-01-23,DJ,ENTERTAINING BIRDS,,1600,"In commercials, a persistent white duck voiced by Gilbert Gottfried is the spokes-bird for this insurance company",Aflac,NA
2004-01-23,DJ,BODIES OF WATER,,1600,The French call this body of water the Pas de Calais; we call it this,the Strait of Dover,NA
2004-01-23,DJ,GET THE MESSAGE,,1600,"4 words that ended the historic message: ""Houston, Tranquility Base here...""",the Eagle has landed,NA
2004-01-23,DJ,BURIED AT ARLINGTON NATIONAL CEMETERY,,1600,"Roger Chaffee & this astronaut, killed in a 1967 fire aboard their Apollo spacecraft, are buried next to each other",Gus Grissom,NA
2004-01-23,DJ,ABBREVIATIONS,,NA,Successor to the AEC:NRC,the Nuclear Regulatory Commission,NA
2004-01-23,DJ,ART & ARTISTS,,NA,"Four of her works, including the one seen here, were recently featured on U.S. stamps",Mary Cassatt,NA
2004-01-23,DJ,ENTERTAINING BIRDS,,2000,"The mascot of the U.S. Forest Service, this owl wore a Robin Hood-style hat & told us to ""Give a Hoot!  Don't Pollute!""",Woodsy,NA
2004-01-23,DJ,BODIES OF WATER,,2000,"The chief cities on this river in Oregon include Portland, Salem & Eugene",the Willamette,NA
2004-01-23,DJ,GET THE MESSAGE,,2000,"The messages left by this lost colony were ""Cro"" on a tree & ""Croatoan"" on a post",Roanoke Island,NA
2004-01-23,DJ,BURIED AT ARLINGTON NATIONAL CEMETERY,,2000,"Seen here, this Purple Heart recipient & veteran ABC newsman was laid to rest in 1983",(Frank) Reynolds,NA
2004-01-23,DJ,ABBREVIATIONS,,2000,A measure of distance equal to 93 million miles:AU,astronomical unit,NA
2004-01-23,FJ,LITERARY FEMALES,,NA,"She's the only female character in all the A.A. Milne ""Winnie The Pooh"" stories",Kanga,NA
