date,round,category,comment,value,clue,response,link
2009-12-02,J,ACTRESSES' ROLES,,200,"""Along Came Polly"",""Office Space"",""Love Happens""",Jennifer Aniston,NA
2009-12-02,J,"""W""ORLD HISTORY",,200,In 1900 they made history with a glider that had a new feature: a horizontal front rudder for pitch control,the Wright Brothers,NA
2009-12-02,J,REMEMBER THESE LADIES,,200,The dad & brother of this House Speaker have both served as the mayor of Baltimore,Nancy Pelosi,NA
2009-12-02,J,A MUSICAL PASTICHE,,200,"In the 1950s Sinatra described the music of this rock legend as ""deplorable, a rancid smelling aphrodisiac""",Elvis Presley,NA
2009-12-02,J,ALCOHOLICS UNANIMOUS,,200,"After Zelda broke their engagement, he went on a bender, then to St. Paul to rewrite a novel he'd begun at Princeton",F. Scott Fitzgerald,NA
2009-12-02,J,"""ITZ"" AT THE END",,200,A scatterbrained or eccentric person,a ditz,NA
2009-12-02,J,ACTRESSES' ROLES,,400,"""Laugh-In"",""Shampoo"",""Private Benjamin""",Goldie Hawn,NA
2009-12-02,J,"""W""ORLD HISTORY",,400,"This duke of Bohemia spread Christianity, was martyred & is remembered in a Christmas carol as a ""good king""",Wenceslas,NA
2009-12-02,J,REMEMBER THESE LADIES,,400,"In her 2008 memoir ""Audition"", this journalist from ""The View"" says that Alan Greenspan is ""a very nice dancer""",Barbara Walters,NA
2009-12-02,J,A MUSICAL PASTICHE,,400,"From Old French for ""entertainer"", they were the strolling musicians of the Middle Ages",minstrels,NA
2009-12-02,J,ALCOHOLICS UNANIMOUS,,400,"This author of the 1950 novel ""Burning Bright"" felt the wrath of grapes",John Steinbeck,NA
2009-12-02,J,"""ITZ"" AT THE END",,400,"From the German for ""to spray"", it's a quick spray or squirt",spritz,NA
2009-12-02,J,ACTRESSES' ROLES,,600,"""Sleeper"",""Annie Hall"",""The Godfather""",Diane Keaton,NA
2009-12-02,J,"""W""ORLD HISTORY",,600,"It's what the ""W"" stands for in WPA, a New Deal program FDR created for the unemployed in 1935",Works,NA
2009-12-02,J,REMEMBER THESE LADIES,,600,"...And God created this French actress & animal rights activist in Paris Sept. 28, 1934",Bardot,NA
2009-12-02,J,A MUSICAL PASTICHE,,600,"Though it wasn't particularly jazzy, the ukulele reached its peak of popularity in the U.S. in this decade",the \'20s,NA
2009-12-02,J,ALCOHOLICS UNANIMOUS,,600,"An overdose of alcohol helped kill this Welsh poet on Nov. 9, 1953",Dylan Thomas,NA
2009-12-02,J,"""ITZ"" AT THE END",,600,This cracker was introduced by Nabisco in 1934 & named to conjure up an image of wealth & glamour,Ritz,NA
2009-12-02,J,ACTRESSES' ROLES,,800,"""Boys on the Side"",""Never Been Kissed"",""Charlie's Angels""",Drew Barrymore,NA
2009-12-02,J,"""W""ORLD HISTORY",,800,"This English cardinal died Nov. 29, 1530, on the way to face treason charges",Wolsey,NA
2009-12-02,J,REMEMBER THESE LADIES,,800,"This style maven launched her ""Everyday"" collection at Kmart in 1997",Martha Stewart,NA
2009-12-02,J,A MUSICAL PASTICHE,,800,Timpani are multiple mounted ones of these instruments,drums,NA
2009-12-02,J,ALCOHOLICS UNANIMOUS,,800,"In 1929 this Algonquin wit's ""Big Blonde"", about an alcoholic serial mistress, won the O. Henry Award",Dorothy Parker,NA
2009-12-02,J,"""ITZ"" AT THE END",,800,This 2-time Winter Olympics site has been known for its mineral springs since Roman times,Saint Moritz,NA
2009-12-02,J,ACTRESSES' ROLES,,1000,"""Henry & June"",""Pulp Fiction"",""The Truth About Cats & Dogs""",Uma Thurman,NA
2009-12-02,J,"""W""ORLD HISTORY",,1000,"Signed in 1648, the peace of this historic German region ended the Thirty Years' War",Westphalia,NA
2009-12-02,J,REMEMBER THESE LADIES,,1000,"In a letter to Abelard, she not-so-subtly hinted, ""letters from absent friends are welcome""",Héloïse,NA
2009-12-02,J,A MUSICAL PASTICHE,,1000,"Of classical music's ""three B's"", the one born in Hamburg in 1833",Johannes Brahms,NA
2009-12-02,J,ALCOHOLICS UNANIMOUS,,NA,"This alcoholic playwright created the bitter alcoholic Jamie Tyrone & a ""long day"" for his cursed family",Eugene O\'Neill,NA
2009-12-02,J,"""ITZ"" AT THE END",,1000,"Nickname of Friedrich Christian Lang, director of the classic 1927 film ""Metropolis""",Fritz,NA
2009-12-02,DJ,20th CENTURY AMERICA,,400,Citizen soldiers of the Revolutionary War couldn't have dreamed of this U.S. ICBM first deployed in 1962,the Minuteman,NA
2009-12-02,DJ,"SPORTS, ILLUSTRATED",,400,"(Sarah of the Clue Crew shows an archery target on the monitor.)  In target archery, an arrow that hits the outer white ring is worth 1 point, the inner blue scores 6, & a shot in the center yellow scores this many",10,http://www.j-archive.com/media/2009-12-02_DJ_11.wmv
2009-12-02,DJ,TOOTSIE ROLLS,,400,It's the principal ingredient on the label of a Tootsie Roll (don't think too hard),sugar,NA
2009-12-02,DJ,"SCIENCE CROSSWORD CLUES ""E""",,400,An outbreak of disease(8),an epidemic,NA
2009-12-02,DJ,CURRENT BIOGRAPHY: 1970,,400,"The biography for this Cuban leader says he likes classical music, baseball & skin diving",Fidel Castro,NA
2009-12-02,DJ,THE WAY IN,,400,"Before taking a drink, you might say ""down"" this, also an opening in the deck",the hatch,NA
2009-12-02,DJ,20th CENTURY AMERICA,,NA,"In 1985 this company said that it hadn't seen the ""deep emotional"" ties people had to its traditional product",Coca-Cola,NA
2009-12-02,DJ,"SPORTS, ILLUSTRATED",,800,"Thrown straight from the shoulder with a sharp, snapping motion, it's the quick lead punch seen here",a jab,http://www.j-archive.com/media/2009-12-02_DJ_12.wmv
2009-12-02,DJ,TOOTSIE ROLLS,,800,Year of the patriotic ad seen here,1918,http://www.j-archive.com/media/2009-12-02_DJ_02a.jpg
2009-12-02,DJ,"SCIENCE CROSSWORD CLUES ""E""",,800,"Simple substance, my dear Watson(7)",an element,NA
2009-12-02,DJ,CURRENT BIOGRAPHY: 1970,,800,"The oldest of 6 kids in a Catholic family; her father, John F. Fitzgerald, was a mayor of Boston",Rose Kennedy,NA
2009-12-02,DJ,THE WAY IN,,800,This 4-letter entrance is also the total paid attendance at a concert or sporting event,gate,NA
2009-12-02,DJ,20th CENTURY AMERICA,,1200,1958's Cooper v. Aaron was one of several Supreme Court decisions aimed at ending this policy in schools,segregation,NA
2009-12-02,DJ,"SPORTS, ILLUSTRATED",,1200,"(Sarah of the Clue Crew shows a football diagram on the monitor.)  Designed to confuse the defense with a quick change of direction, this type of football play has a backwards-sounding name",a reverse,http://www.j-archive.com/media/2009-12-02_DJ_13.wmv
2009-12-02,DJ,TOOTSIE ROLLS,,1200,Tootsie Roll's Chicago plant also produces more than 4 billion of these gumdrops annually--that's a lot of connecting,Dots,NA
2009-12-02,DJ,"SCIENCE CROSSWORD CLUES ""E""",,1200,Negative particle(8),an electron,NA
2009-12-02,DJ,CURRENT BIOGRAPHY: 1970,,1200,"His ""canon comprises more than 900 published pieces"" including ""Sophisticated Lady""",Duke Ellington,NA
2009-12-02,DJ,THE WAY IN,,1200,"This word precedes ""of Perception"" in an Aldous Huxley book title, & it gave Jim Morrison an idea",Doors,NA
2009-12-02,DJ,20th CENTURY AMERICA,,1600,"On April 21, 1976 FDA administrator Harry Meyer got the first vaccination in the campaign against this piggish strain",swine flu,NA
2009-12-02,DJ,"SPORTS, ILLUSTRATED",,1600,Canine name for the type of golf hole seen here,a dogleg,http://www.j-archive.com/media/2009-12-02_DJ_14.jpg
2009-12-02,DJ,TOOTSIE ROLLS,,1600,"Tootsie Roll's recipe for this treat has graham cracker crumbs, 2 lbs. of cream cheese & 8 oz. of Tootsie Rolls",the Tootsie Roll cheesecake,NA
2009-12-02,DJ,"SCIENCE CROSSWORD CLUES ""E""",,NA,"A catalyzing protein, like amylase(6)",an enzyme,NA
2009-12-02,DJ,CURRENT BIOGRAPHY: 1970,,1600,"""One Generation After"", his tenth book, marked the 25th anniversary of his liberation from Buchenwald",(Elie) Wiesel,NA
2009-12-02,DJ,THE WAY IN,,1600,"An opening to board a ship, or an exclamation meaning ""Move, I'm coming through!""",gangway,NA
2009-12-02,DJ,20th CENTURY AMERICA,,2000,"In 1922 he & Ub Iwerks started a business to make animated cartoon ""Laugh-O-Grams"", but it went bankrupt",(Walt) Disney,NA
2009-12-02,DJ,"SPORTS, ILLUSTRATED",,2000,(Kelly of the Clue Crew shows a tennis court on the monitor.)  It's the name for the tennis court area highlighted here or for the guards on a basketball team,the backcourt,http://www.j-archive.com/media/2009-12-02_DJ_15a.jpg
2009-12-02,DJ,TOOTSIE ROLLS,,2000,"We ""fell"" for these candies introduced in 2008; they're Tootsie Pops without the stick",Tootsie Pop Drops,NA
2009-12-02,DJ,"SCIENCE CROSSWORD CLUES ""E""",,2000,A real piece of work(3),an erg,NA
2009-12-02,DJ,CURRENT BIOGRAPHY: 1970,,2000,This publisher & philanthropist's bio mentions his 1969 swearing in as U.S. Ambassador to Great Britain,Walter Annenberg,NA
2009-12-02,DJ,THE WAY IN,,2000,An Internet site that offers e-mail & a search engine is called one of these entryways to the web,a portal,NA
2009-12-02,FJ,PHRASE ORIGINS,,NA,"Used in 1947's ""U.S. Strategic Bombing Survey"", this 2-word term became widely used again in NYC on 9/11/01",ground zero,NA
