date,round,category,comment,value,clue,response,link
2004-02-26,J,THE NATIONAL CIVIL RIGHTS MUSEUM,(Alex: In honor of Black History Month.),200,"(Sarah of the Clue Crew in Memphis, Tennessee)  The National Civil Rights Museum is built on the site of the Lorraine Motel, where Martin Luther King was assassinated in this year",1968,NA
2004-02-26,J,BOB HOPE,,200,Bob began his overseas trips to entertain U.S. troops during this war,the Second World War,NA
2004-02-26,J,THE NUMBER OF...,,200,...face cards for each suit in a standard deck,3,NA
2004-02-26,J,CHI-TOWN NICKNAMES,,200,A New York editor gave Chicago this nickname to describe its politicians during its first World's Fair,"""The Windy City""",NA
2004-02-26,J,THE JEOPARDY! WORLD ORCHESTRA,,200,"Heard here, the Vietnamese version of this ""wood voice"" instrument is made of bamboo",xylophone,NA
2004-02-26,J,"DOUBLE ""L"" WORDS",,200,"At the gym, this machine lets you walk or run in place by means of a moving belt",treadmill,NA
2004-02-26,J,THE NATIONAL CIVIL RIGHTS MUSEUM,(Alex: In honor of Black History Month.),400,"(Cheryl of the Clue Crew)  From 1943 to 1956, Rosa Parks was secretary of her local chapter of this organization",the NAACP,NA
2004-02-26,J,BOB HOPE,,400,"In ""Road to Rio"" Bob asks her, ""How did you get into that dress -- with a spraygun?""",Dorothy Lamour,NA
2004-02-26,J,THE NUMBER OF...,,400,...sub-Earth orbital planets,2 (Mercury & Venus),NA
2004-02-26,J,CHI-TOWN NICKNAMES,,400,"In his poem ""Chicago"" Carl Sandburg called the city this ""Butcher for the World""",Hog Butcher,NA
2004-02-26,J,THE JEOPARDY! WORLD ORCHESTRA,,400,"Used in pairs, these instruments are heard in many kinds of Latin music",maracas,NA
2004-02-26,J,"DOUBLE ""L"" WORDS",,400,"In 1998 this beast, seen here, reared its ugly head again",Godzilla,NA
2004-02-26,J,THE NATIONAL CIVIL RIGHTS MUSEUM,(Alex: In honor of Black History Month.),600,(Sarah)  This exhibit recreates the famous series of these protest actions that took place in 1960 in North Carolina,sit-ins,NA
2004-02-26,J,BOB HOPE,,NA,"Bob first hosted these on February 29, 1940 at the Ambassador Hotel",the Academy Awards,NA
2004-02-26,J,THE NUMBER OF...,,600,...white stripes on the U.S. flag,6,NA
2004-02-26,J,CHI-TOWN NICKNAMES,,600,"Sandburg called Chicago the ""City of Big"" these",Shoulders,NA
2004-02-26,J,THE JEOPARDY! WORLD ORCHESTRA,,600,The didgeridoo heard here originated on this continent,Australia,NA
2004-02-26,J,"DOUBLE ""L"" WORDS",,600,"In Greek myth, Paris killed this hero by shooting him with an arrow; what a heel!",Achilles,NA
2004-02-26,J,THE NATIONAL CIVIL RIGHTS MUSEUM,(Alex: In honor of Black History Month.),800,(Cheryl)  The Greyhound bus represents these riders who bravely tried to desegregate bus stations in 1961,the Freedom Riders,NA
2004-02-26,J,BOB HOPE,,800,"In 1985 Bob Hope received one of these ""Honors"" named for a president who shared his May 29 birthday",the Kennedy Center Honors,NA
2004-02-26,J,THE NUMBER OF...,,800,...years of famine predicted by Joseph in Genesis 41:27,7,NA
2004-02-26,J,CHI-TOWN NICKNAMES,,800,"That wry poet Carl came up with ""Stacker of"" this",Wheat,NA
2004-02-26,J,THE JEOPARDY! WORLD ORCHESTRA,,800,This ancient instrument is sounded on a new year's day,the shofar,NA
2004-02-26,J,"DOUBLE ""L"" WORDS",,800,John Brown died on one in 1859,the gallows,NA
2004-02-26,J,THE NATIONAL CIVIL RIGHTS MUSEUM,(Alex: In honor of Black History Month.),1000,"(Sarah) The ""Voices of Struggle"" Gallery includes this woman, who told her passengers, ""You'll be free or die""",Harriet Tubman,NA
2004-02-26,J,BOB HOPE,,1000,This 1955 movie musical about Vaudevillian Eddie Foy & his performing family starred Bob Hope & Jerry Mathers,The Seven Little Foys,NA
2004-02-26,J,THE NUMBER OF...,,1000,...different men who've been president of the United States,42,NA
2004-02-26,J,CHI-TOWN NICKNAMES,,1000,"Good-old Carl S. hammered home the fact that the city is a this ""maker""",tool maker,NA
2004-02-26,J,THE JEOPARDY! WORLD ORCHESTRA,,1000,The best thing about using this instrument is that you can do your laundry when you're done,the washboard,NA
2004-02-26,J,"DOUBLE ""L"" WORDS",,1000,"There are more than 600 species of this butterfly, including the one seen here",Swallowtail,NA
2004-02-26,DJ,BOTANY,,400,"The white clover & the wood sorrel are among the plants called these, a symbol of Ireland",shamrocks,NA
2004-02-26,DJ,CLASSIC SCI-FI & HORROR FILMS,,400,"Before he was Spock, he had a small role in the mutant ant infestation classic ""Them!"" in 1954",(Leonard) Nimoy,NA
2004-02-26,DJ,THE SOUTHERNMOST CAPITAL CITY,,400,"Brasilia,Buenos Aires,Bogota",Buenos Aires,NA
2004-02-26,DJ,SNAKE STUFF,,400,Stunts on this NBC show have had players bob for plums in a tank of snakes & be put into the snake pit,Fear Factor,NA
2004-02-26,DJ,MEN WITH FORT-ITUDE,,400,This first secretary of war under the Constitution gets a gold star for his Kentucky fort,(Henry) Knox,NA
2004-02-26,DJ,WOMEN WITH 40-TUDE,(Alex: Women who are 40 in 2004.),400,"Henry's granddaughter, Peter's daughter & Jane's niece, she marked 40 on January 27",Bridget Fonda,NA
2004-02-26,DJ,BOTANY,,800,"Also called the harking, this yellow rose is named for the actress who harked back to Kansas from Oz",(Judy) Garland,NA
2004-02-26,DJ,CLASSIC SCI-FI & HORROR FILMS,,800,"Yes, dahling, this Hungarian actress played Talleah in the 1958 cult favorite ""Queen of Outer Space""",Zsa Zsa Gabor,NA
2004-02-26,DJ,THE SOUTHERNMOST CAPITAL CITY,,800,"Helsinki,Moscow,Bucharest",Bucharest,NA
2004-02-26,DJ,SNAKE STUFF,,800,"The world's largest venomous snake, its bite could kill an elephant",the king cobra,NA
2004-02-26,DJ,MEN WITH FORT-ITUDE,,800,He built the Cantonment post in Kansas & got more than a lifetime sentence of his name on a fort,Leavenworth,NA
2004-02-26,DJ,WOMEN WITH 40-TUDE,(Alex: Women who are 40 in 2004.),800,"This ""Fast Car"" singer has been on the music scene since the '80s & the life scene since March 1964",(Tracy) Chapman,NA
2004-02-26,DJ,BOTANY,,1200,"On a cob of corn, the tassels are the male flowers & these are the female",the kernels,NA
2004-02-26,DJ,CLASSIC SCI-FI & HORROR FILMS,,1200,"Holy Moses!  He played a doctor fighting off zombies spawned by germ warfare in ""The Omega Man""",(Charlton) Heston,NA
2004-02-26,DJ,THE SOUTHERNMOST CAPITAL CITY,,1200,"Jakarta,Canberra,Wellington",Wellington,NA
2004-02-26,DJ,SNAKE STUFF,,1200,"In the Siberian language of Tuvan, snakes are called ""ground"" these even though they don't live in water",fish,NA
2004-02-26,DJ,MEN WITH FORT-ITUDE,,1200,This man seen here lent his name to an Indiana fort,(Anthony) Wayne,NA
2004-02-26,DJ,WOMEN WITH 40-TUDE,(Alex: Women who are 40 in 2004.),1200,In her 40 years she's married a Brinkman & a Boxleitner & been president of the Screen Actors Guild,(Melissa) Gilbert,NA
2004-02-26,DJ,BOTANY,,1600,"In the Concise Columbia Encyc., this member of the carrot family is right after another member, parsley",parsnip,NA
2004-02-26,DJ,CLASSIC SCI-FI & HORROR FILMS,,1600,"More famous for his 14 films as Sherlock Holmes, he was the ""Son of Frankenstein"" in 1939",(Basil) Rathbone,NA
2004-02-26,DJ,THE SOUTHERNMOST CAPITAL CITY,,1600,"Tripoli,Mogadishu,Algiers",Mogadishu,NA
2004-02-26,DJ,SNAKE STUFF,,1600,"For its 400th issue, Photo magazine recreated the photo of her & a snake from issue 200 using her daughter Sonja",Nastassja Kinski,NA
2004-02-26,DJ,MEN WITH FORT-ITUDE,,1600,"This ""Gamecock of the Revolution"" settled in South Carolina where he lived a fortified life until age 97",Thomas Sumter,NA
2004-02-26,DJ,WOMEN WITH 40-TUDE,(Alex: Women who are 40 in 2004.),1600,"She turned 40 in 2003; her ""Leaving Las Vegas"" co-star Nicolas Cage hits it in 2004",Elisabeth Shue,NA
2004-02-26,DJ,BOTANY,,NA,"The trailing arbutus, also known as this, is shipshape as the state flower of Massachusetts",the mayflower,NA
2004-02-26,DJ,CLASSIC SCI-FI & HORROR FILMS,,2000,"Intent on demolishing Tokyo, Gamera was a giant monster one of these reptiles that breathed fire & could fly",turtle,NA
2004-02-26,DJ,THE SOUTHERNMOST CAPITAL CITY,,2000,"Vientiane,Hanoi,Phnom Penh",Phnom Penh,NA
2004-02-26,DJ,SNAKE STUFF,,2000,"According to legend, Hermes traded a lyre to Apollo for this snake-wrapped stick",caduceus,NA
2004-02-26,DJ,MEN WITH FORT-ITUDE,,NA,"The largest fortification the British built in colonial America was a fort named for this ""Elder"" P.M.",William Pitt,NA
2004-02-26,DJ,WOMEN WITH 40-TUDE,(Alex: Women who are 40 in 2004.),2000,"Geesh, she was only 10 when she took home an Oscar in 1974; she's 40 now",Tatum O\'Neal,NA
2004-02-26,FJ,PSYCHOLOGY,,NA,"The concept of the ""Oedipus Complex"" was introduced in this 1899 book",The Interpretation of Dreams,NA
