date,round,category,comment,value,clue,response,link
2001-11-01,J,THE NEAREST CONTINENT,(Alex: We'll give you an island; you name the nearest continent to that island.  It might also be the continent the island is part of.),100,Baffin Island,North America,NA
2001-11-01,J,FEMINISM,,100,"The 1848 feminist ""Declaration of Sentiments"" adds these 2 words to 1776's ""All men are created equal""","""and women""",NA
2001-11-01,J,SPACE,,100,"(Sofia of the Clue Crew hangs out with a probe replica at the Jet Propulsion Lab.)  In 1995 on Jupiter, this craft, named for a scientist, made the first direct measurements of a giant planet's atmosphere",Galileo,http://www.j-archive.com/media/2001-11-01_J_15.jpg
2001-11-01,J,"THEY GOT MILK, TOO?",,100,"In their ""got milk?"" ad, these tennis sisters said, ""Make ours doubles""",the Williams Sisters (Serena & Venus),NA
2001-11-01,J,NAME THE SPORT,,100,"Carpet, hazards, a windmill, a castle",putt-putt (or miniature golf),NA
2001-11-01,J,QUASI-RELATED PAIRS,,100,An Academy Award & a famous cartoon cat,Oscar & Felix,NA
2001-11-01,J,THE NEAREST CONTINENT,(Alex: We'll give you an island; you name the nearest continent to that island.  It might also be the continent the island is part of.),200,Hainan,Asia,NA
2001-11-01,J,FEMINISM,,200,The Violence Against Women Act of 2000 addresses this behavior ranging from lying in wait to actual harassment,stalking,NA
2001-11-01,J,SPACE,,200,This is the largest of the terrestrial planets; it has one of the largest satellites as well,Earth,NA
2001-11-01,J,"THEY GOT MILK, TOO?",,200,"The ""Be a Dark Knight"" milk ad featured this comic book superhero",Batman,NA
2001-11-01,J,NAME THE SPORT,,200,"11 teammates, a center circle, a penalty area, a goal",soccer,NA
2001-11-01,J,QUASI-RELATED PAIRS,,200,"Sodium chloride, for example, & a park at the southern tip of Manhattan",a salt & Battery,NA
2001-11-01,J,THE NEAREST CONTINENT,(Alex: We'll give you an island; you name the nearest continent to that island.  It might also be the continent the island is part of.),300,Trinidad & Tobago,South America,NA
2001-11-01,J,FEMINISM,,300,This American tennis tournament evened men's & women's prize money in 1973; Wimbledon still hasn't,the U.S. Open,NA
2001-11-01,J,SPACE,,300,"(Sofia of the Clue Crew, dressed for a clean environment, delivers the clue from the Jet Propulsion Lab.)  You're looking at a Cassini spacecraft, like the one en route to study Titan, a moon of this planet",Saturn,http://www.j-archive.com/media/2001-11-01_J_26.jpg
2001-11-01,J,"THEY GOT MILK, TOO?",,300,"This animated kids' group had 2 ads; one had them ""in Paris""",the Rugrats,NA
2001-11-01,J,NAME THE SPORT,,300,"6 teammates, a center line, a blue line, a crease",ice hockey,NA
2001-11-01,J,QUASI-RELATED PAIRS,,300,A postgraduate degree & Lithgow's male offspring,Master\'s & John\'s son,NA
2001-11-01,J,THE NEAREST CONTINENT,(Alex: We'll give you an island; you name the nearest continent to that island.  It might also be the continent the island is part of.),400,East Frisian Islands,Europe,NA
2001-11-01,J,FEMINISM,,400,"Sometimes shortened to MCP, this negative term had a vogue with early women's libbers",male chauvinist pig,NA
2001-11-01,J,SPACE,,400,Johann Bode proposed the name of a mythological father for this planet,Uranus,NA
2001-11-01,J,"THEY GOT MILK, TOO?",,400,This rock group sported chocolate mustaches that could be seen on their white makeup,Kiss,NA
2001-11-01,J,NAME THE SPORT,,400,"4 teammates, a safety zone, a 40 yard mark, goal posts",polo,NA
2001-11-01,J,QUASI-RELATED PAIRS,,400,"""Lolita"" actor James & psychic Jeane",Mason & Dixon,NA
2001-11-01,J,THE NEAREST CONTINENT,(Alex: We'll give you an island; you name the nearest continent to that island.  It might also be the continent the island is part of.),500,Sao Tome & Principe,Africa,NA
2001-11-01,J,FEMINISM,,NA,"Secretary of State Bainbridge Colby signed it at home Aug. 26, 1920; his wife & daughters must have been excited",the 19th Amendment,NA
2001-11-01,J,SPACE,,500,"(Cheryl of the Clue Crew delivers the clue from the Jet Propulsion Lab.)  I'm in the Mars yard with a model of this Martian rover, whose name also means ""a visitor""",Sojourner,http://www.j-archive.com/media/2001-11-01_J_28a.jpg
2001-11-01,J,"THEY GOT MILK, TOO?",,500,"A 2000 ad showing this pop sensation at ages 3 & 18 was the 100th ""got milk?"" ad",Britney Spears,NA
2001-11-01,J,NAME THE SPORT,,500,"4 teammates, a house, a hog line, a tee line",curling,NA
2001-11-01,J,QUASI-RELATED PAIRS,,500,A song on a CD & a chosen area of study,track & field,NA
2001-11-01,DJ,SHAKESPEARE,,200,"""Come on, and kiss me, Kate"" is actually a line in this comedy that inspired the musical ""Kiss Me, Kate""",The Taming of the Shrew,NA
2001-11-01,DJ,DOGS OF WAR,,200,"Stubby, a bull terrier, helped in the battles at Chateau Thierry, the Marne & the Meuse-Argonne in this war",World War I,NA
2001-11-01,DJ,THE BIG WHIGS,,200,In 1840 the 2 major political parties in the U.S. were the Whigs & this party,the Democrats,NA
2001-11-01,DJ,LAKES & RIVERS,,200,World Book reports 3-foot-long trout are among the fish found in this lake that borders Peru & Bolivia,Lake Titicaca,NA
2001-11-01,DJ,THE BRITISH MUSEUM,,200,"The museum once housed 2 copies of this 1215 document, now in the British Library",the Magna Carta,NA
2001-11-01,DJ,"FINISH THE ""LOVE""LY LYRIC",,200,"Stephen Stills:""And the eagle flies with the dove, & if you can't be with the one you love, honey...""","""love the one you\'re with""",NA
2001-11-01,DJ,SHAKESPEARE,,400,"""Henry VI, Part I"" features the master-gunner of Orleans & this woman known in the play as Joan la Pucelle",Joan of Arc,NA
2001-11-01,DJ,DOGS OF WAR,,400,"Scout dog York completed 148 combat patrols in this ""police action""",the Korean War,NA
2001-11-01,DJ,THE BIG WHIGS,,400,"With members like Daniel Webster & Henry Clay, the Whig party was formed about 1832 to oppose this president",Jackson,NA
2001-11-01,DJ,LAKES & RIVERS,,400,This New York City river is actually a tidal strait connecting upper New York Bay with Long Island Sound,the East River,NA
2001-11-01,DJ,THE BRITISH MUSEUM,,400,"You won't find this Egyptian monument's beard on the plains of Giza, but in the British Museum",the Sphinx,NA
2001-11-01,DJ,"FINISH THE ""LOVE""LY LYRIC",,400,"J. Geils Band:""Love, it's gonna make you cry, I've had the blues, the reds & the pinks, one thing for sure...""","""love stinks""",NA
2001-11-01,DJ,SHAKESPEARE,,NA,"In ""King John"", King John's first words to her are ""Silence, good mother; hear the embassy""",Eleanor of Aquitaine,NA
2001-11-01,DJ,DOGS OF WAR,,600,In WWII Chips earned a Silver Star & a Purple Heart after landing at Licata on this European island,Sicily,NA
2001-11-01,DJ,THE BIG WHIGS,,600,"One big Whig of the 1840s was this founder of the New York Tribune who popularized the phrase ""Go west, young man""",(Horace) Greeley,NA
2001-11-01,DJ,LAKES & RIVERS,,600,"336 rivers flow into this Siberian lake, but only one, the Angora, flows out of it",Lake Baikal,NA
2001-11-01,DJ,THE BRITISH MUSEUM,,600,It's the British Museum translator seen here,the Rosetta Stone,http://www.j-archive.com/media/2001-11-01_DJ_24.jpg
2001-11-01,DJ,"FINISH THE ""LOVE""LY LYRIC",,600,"The Searchers:""When I kissed a cop down on 34th and Vine, he broke my little bottle of...""","""Love Potion No. 9""",NA
2001-11-01,DJ,SHAKESPEARE,,800,"Julius Caesar observes that this man ""has a lean and hungry look; he thinks too much:  such men are dangerous""",Cassius,NA
2001-11-01,DJ,DOGS OF WAR,,800,A memorial was erected for the 25 dobermans who gave their lives liberating this largest Mariana island in WWII,Guam,NA
2001-11-01,DJ,THE BIG WHIGS,,800,He was the first Whig governor of New York & as Johnson's Secretary of State purchased Alaska for the U.S.,Seward,NA
2001-11-01,DJ,LAKES & RIVERS,,800,"This river that flows to Lyon, France rises from a glacier of the same name in Switzerland",the Rhone,NA
2001-11-01,DJ,THE BRITISH MUSEUM,,800,"In 1816 he didn't lose his ""Marbles""; he sold them to the British Museum",Lord Elgin,NA
2001-11-01,DJ,"FINISH THE ""LOVE""LY LYRIC",,800,"Bee Gees:""Keep me warm in your love and then softly leave and it's me you need to show...""","""how deep is your love""",NA
2001-11-01,DJ,SHAKESPEARE,,1000,"Title character who says, ""Like an eagle in a dove-cote, I flutter'd your Volscians in Corioli""",Coriolanus,NA
2001-11-01,DJ,DOGS OF WAR,,1000,The dog Soter warned the citizens of an attack in this ancient Greek port city founded by Dorians,Corinth,NA
2001-11-01,DJ,THE BIG WHIGS,,NA,He was the second Whig party member elected U.S. president who had also been a general,(Zachary) Taylor,NA
2001-11-01,DJ,LAKES & RIVERS,,1000,"This largest Central American lake has several islands, including Ometepe, which has 2 volcanoes",Lake Nicaragua,NA
2001-11-01,DJ,THE BRITISH MUSEUM,,1000,Jonathan Harker studies up on Transylvania in the British Museum library at the beginning of this novel,Dracula,NA
2001-11-01,DJ,"FINISH THE ""LOVE""LY LYRIC",,1000,"Pat Benatar:""We are young, heartache to heartache we stand, no promises, no demands...""","""love is a battlefield""",NA
2001-11-01,FJ,AMERICAN LITERATURE,,NA,"""The Mute"" was the working title of this 1940 novel by a female author",The Heart Is a Lonely Hunter (by Carson McCullers),NA
