date,round,category,comment,value,clue,response,link
2009-12-15,J,STATE FACTS,,200,"Its state tree, a certain blue spruce, was discovered on Pikes Peak",Colorado,NA
2009-12-15,J,MUSICAL NAME ORIGINS,,200,The palindromic name of this Scandinavian band comes from the 4 members' first names,ABBA,NA
2009-12-15,J,MIX-OLOGISTS,(Alex: You'll be presented with anagrams of various -ologies.),200,Go to him if you can't go:SUITOR LOG,urologist,NA
2009-12-15,J,FILL IN THE PLAY TITLE,,200,"Thornton Wilder's""O.T.""",Our Town,NA
2009-12-15,J,IN BLACK'S LAW DICTIONARY,,200,"""The malicious burning of someone else's dwelling house or outhouse"" (glad the outhouse is protected, too)",arson,NA
2009-12-15,J,TRANSLATE THE PORTUGUESE,,200,Ola,hello,NA
2009-12-15,J,STATE FACTS,,NA,It's the only U.S. state with a 1-syllable name,Maine,NA
2009-12-15,J,MUSICAL NAME ORIGINS,,400,This Mark Knopfler band chose its name to reflect the musicians' bad financial situation,Dire Straits,NA
2009-12-15,J,MIX-OLOGISTS,(Alex: You'll be presented with anagrams of various -ologies.),400,He's all in your mind:GLITCH SOP SOY,psychologist,NA
2009-12-15,J,FILL IN THE PLAY TITLE,,400,"Neil Simon's""B.B.M.""",Brighton Beach Memoirs,NA
2009-12-15,J,IN BLACK'S LAW DICTIONARY,,400,"""The fact of having or holding property in one's power"" (it's not 9/10 of Black's, it's only 1 entry)",possession,NA
2009-12-15,J,TRANSLATE THE PORTUGUESE,,400,Adeus,good-bye,NA
2009-12-15,J,STATE FACTS,,600,"The honeybee, its state insect, is a reference to deseret, a Book of Mormon word meaning ""honeybee""",Utah,NA
2009-12-15,J,MUSICAL NAME ORIGINS,,600,"He had the same real name as one of The Monkees, so this ""Space Oddity"" man named himself after a knife",David Bowie,NA
2009-12-15,J,MIX-OLOGISTS,(Alex: You'll be presented with anagrams of various -ologies.),600,He can see inside of you:GOT ARID SOIL,radiologist,NA
2009-12-15,J,FILL IN THE PLAY TITLE,,600,"David Mamet's""G.G.R.""",Glengarry Glen Ross,NA
2009-12-15,J,IN BLACK'S LAW DICTIONARY,,600,"This 3-word term is an ""unpreventable event caused exclusively by forces of nature""",act of God,NA
2009-12-15,J,TRANSLATE THE PORTUGUESE,,600,Por favor,please,NA
2009-12-15,J,STATE FACTS,,800,"Its motto is as tough as granite: ""Live free or die""",New Hampshire,NA
2009-12-15,J,MUSICAL NAME ORIGINS,,800,This Australian metal band saw their name on an appliance & only knew it had something to do with electricity,AC/DC,NA
2009-12-15,J,MIX-OLOGISTS,(Alex: You'll be presented with anagrams of various -ologies.),800,Have a heart:DRASTIC IGLOO,cardiologist,NA
2009-12-15,J,FILL IN THE PLAY TITLE,,800,"Anton Chekhov's""U.V.""",Uncle Vanya,NA
2009-12-15,J,IN BLACK'S LAW DICTIONARY,,800,"""An accused person's formal response... to a criminal charge""",a plea,NA
2009-12-15,J,TRANSLATE THE PORTUGUESE,,800,Obrigado,thank you,NA
2009-12-15,J,STATE FACTS,,1000,"Though endangered, the nene is its state bird",Hawaii,NA
2009-12-15,J,MUSICAL NAME ORIGINS,,1000,"This ""Boys Are Back In Town"" band was named for a female robot in a comic strip, not from the nickname of the Model T",Thin Lizzy,NA
2009-12-15,J,MIX-OLOGISTS,(Alex: You'll be presented with anagrams of various -ologies.),1000,He'll get on your nerves:STURGEON OIL,neurologist,NA
2009-12-15,J,FILL IN THE PLAY TITLE,,1000,"John Osborne's""L.B.I.A.""",Look Back in Anger,NA
2009-12-15,J,IN BLACK'S LAW DICTIONARY,,1000,"""The initial step in... prosecution whereby the defendant is brought before the court to hear the charges""",an arraignment,NA
2009-12-15,J,TRANSLATE THE PORTUGUESE,,1000,Sim,yes,NA
2009-12-15,DJ,STATE FACTS,,400,"As of 2007, it begins at 2 A.M. on the second Sunday in March & ends at 2 A.M. on the first Sunday in November",Daylight Savings Time,NA
2009-12-15,DJ,FLOWER GIRLS,,400,Bo & Luke Duke's scantily clad cousin,Daisy Duke,NA
2009-12-15,DJ,NOTABLE AMERICANS,,400,"The first American-born winner of this Nobel was Robert Millikan, for his study of the elementary electric charge",Physics,NA
2009-12-15,DJ,IT'S A GAS,,400,One of the main jobs of red blood cells is to carry this gas from the lungs to the body's tissues,oxygen,NA
2009-12-15,DJ,"BIBLE ""R""OSTER",,400,"In Acts, after Peter knocks at a door she forgets to let him in; Carlton the doorman could've helped",Rhoda,NA
2009-12-15,DJ,DOUBLE DOUBLE LETTERS,,400,"In the arena form of this sport, the field is only 50 yards long",football,NA
2009-12-15,DJ,STATE FACTS,,800,Sofia is the capital of this country on the Balkan Peninsula,Bulgaria,NA
2009-12-15,DJ,FLOWER GIRLS,,800,"On TV's ""The Golden Girls"", this was Betty White's character",Rose Nylund,NA
2009-12-15,DJ,NOTABLE AMERICANS,,800,"Sing the song of this poet, one of the Roughs, seen here",Walt Whitman,http://www.j-archive.com/media/2009-12-15_DJ_22.jpg
2009-12-15,DJ,IT'S A GAS,,800,In the Sun hydrogen gas is transformed by a series of atomic reactions into this other gas,helium,NA
2009-12-15,DJ,"BIBLE ""R""OSTER",,800,"This name for a son of Leah means ""behold a son"" in Hebrew; it has nothing to do with a sandwich",Reuben,NA
2009-12-15,DJ,DOUBLE DOUBLE LETTERS,,800,You're blushing--I hope I haven't done this to you by telling that story from when you were 6,embarrassed,NA
2009-12-15,DJ,STATE FACTS,,1200,It is both National Poetry Month & National Humor Month,April,NA
2009-12-15,DJ,FLOWER GIRLS,,1200,"Ms. Graham of ""Swingers"" & ""Austin Powers: The Spy Who Shagged Me""",Heather Graham,NA
2009-12-15,DJ,NOTABLE AMERICANS,,1200,A plaza in San Francisco is named for this politician who was a city supervisor when he was slain in 1978,(Harvey) Milk,NA
2009-12-15,DJ,IT'S A GAS,,1200,"Rising too fast from deep water forces nitrogen gas into the blood, causing this condition in scuba divers",the bends,NA
2009-12-15,DJ,"BIBLE ""R""OSTER",,1200,"Infertile for the first 20 years of her marriage to Isaac, she later had the twins Jacob & Esau",Rebekah,NA
2009-12-15,DJ,DOUBLE DOUBLE LETTERS,,1200,The fresh type of this pizza cheese comes packed in whey or water,mozzarella,NA
2009-12-15,DJ,STATE FACTS,,1600,"This great statue of Giza has the Arabic name Abu al-Awl, ""father of terror""",the Sphinx,NA
2009-12-15,DJ,FLOWER GIRLS,,1600,Mrs. Herman Munster,Lily,NA
2009-12-15,DJ,NOTABLE AMERICANS,,NA,He chaired the commission that investigated the deaths of JFK & Lee Harvey Oswald,(Earl) Warren,NA
2009-12-15,DJ,IT'S A GAS,,1600,"Firedamp, basically methane, is most often found in these places",coal mines,NA
2009-12-15,DJ,"BIBLE ""R""OSTER",,1600,All trouble faded away for her as she wandered slowly through the Fields of Boaz,Ruth,NA
2009-12-15,DJ,DOUBLE DOUBLE LETTERS,,1600,"Unlike a close relative, the blue-winged variety of this Aussie bird doesn't ""laugh"" but cackles",kookaburra,NA
2009-12-15,DJ,STATE FACTS,,2000,(Jimmy of the Clue Crew shows a geometric diagram on the monitor.)  A tangent is a line that touches a circle at one point; a line that intersects at two points is called this,a secant,http://www.j-archive.com/media/2009-12-15_DJ_20.jpg
2009-12-15,DJ,FLOWER GIRLS,,2000,"Pug-faced Slytherin student Parkinson, who's keen on Draco Malfoy",Pansy,NA
2009-12-15,DJ,NOTABLE AMERICANS,,2000,"This American lyricist collaborated with Frederick Loewe on the song ""The Rain In Spain"", among others",(Alan Jay) Lerner,NA
2009-12-15,DJ,IT'S A GAS,,2000,The first use of this elemental gas as a weapon was by the Germans at the Second Battle of Ypres,chlorine,NA
2009-12-15,DJ,"BIBLE ""R""OSTER",,2000,"One of the 7 archangels, he's not a painter, but rather presides over the spirits of men in the afterlife",Raphael,NA
2009-12-15,DJ,DOUBLE DOUBLE LETTERS,,NA,These French-speaking people make up about 30% of Belgium's population,Walloons,NA
2009-12-15,FJ,NORTH AMERICAN BIRDS,,NA,"This bird is known for its size (5 feet tall), its call (carries 2 miles) & its rarity; in 1941 there were only 21 in the wild",the whooping crane,NA
