date,round,category,comment,value,clue,response,link
2009-12-29,J,THE SMITHS,,200,Explorer said to have been saved by Pocahontas,John Smith,NA
2009-12-29,J,BIBLE BOOKS BY QUOTATION,,200,"""And God remembered Noah, and every living thing, and all the cattle that was with him in the ark""",Genesis,NA
2009-12-29,J,YOU'RE ALL WET,,200,"To see the tides in the Bay of Fundy at their highest, visit Minas Basin in this country",Canada,NA
2009-12-29,J,"JAVA, THE HUT",,200,This restaurant's new McCafe offers iced coffee as well as the hot stuff,McDonald\'s,NA
2009-12-29,J,NAME THAT SPORT,,200,PGA,golf,NA
2009-12-29,J,"I CAN DO IT IN 5 ""NOTE""S",,200,Letter-perfect slang for a $100 bill,a C-note,NA
2009-12-29,J,THE SMITHS,,400,"Howdy Doody, seen here as a bobblehead, was created by this man, his TV costar",Buffalo Bob Smith,http://www.j-archive.com/media/2009-12-29_J_17.jpg
2009-12-29,J,BIBLE BOOKS BY QUOTATION,,400,"""And God spake unto Moses, and said unto him, I am the lord""",Exodus,NA
2009-12-29,J,YOU'RE ALL WET,,400,"Wisconsin honeymooners may visit Big Manitou, at 165 feet one of the highest of these east of the Rockies",a waterfall,NA
2009-12-29,J,"JAVA, THE HUT",,400,"The Coffee Bean & Tea Leaf offers herbal infusions like lemon chamomile that are ""100%"" this ""-free""",caffeine,NA
2009-12-29,J,NAME THAT SPORT,,400,MLS,soccer,NA
2009-12-29,J,"I CAN DO IT IN 5 ""NOTE""S",,400,The late author David Foster Wallace was known for using these at the bottoms of pages,footnotes,NA
2009-12-29,J,THE SMITHS,,NA,"Founded a church in 1830, murdered 14 years later",Joseph Smith,NA
2009-12-29,J,BIBLE BOOKS BY QUOTATION,,600,"""So they took up (him), and cast him forth into the sea""",Jonah,NA
2009-12-29,J,YOU'RE ALL WET,,600,"3 streams, the Jordan, Bear & Weber, flow in, but there are no streams that empty this large U.S. lake",the Great Salt Lake,NA
2009-12-29,J,"JAVA, THE HUT",,600,This coffee company's logo features 2 stars & a twin-tailed mermaid,Starbucks,NA
2009-12-29,J,NAME THAT SPORT,,600,"USTA, founded in 1881",tennis,NA
2009-12-29,J,"I CAN DO IT IN 5 ""NOTE""S",,600,Barack Obama delivered this speech at the 2004 Democratic National Convention,keynote,NA
2009-12-29,J,THE SMITHS,,800,Leading blues singer of the 1920s who recorded nearly 200 songs,Bessie Smith,NA
2009-12-29,J,BIBLE BOOKS BY QUOTATION,,800,"""Then Satan answered the Lord, and said, doth (this man) fear God for nought?""",Job,NA
2009-12-29,J,YOU'RE ALL WET,,800,(Jimmy of the Clue Crew shows an animated map of the Atlantic on the monitor.)  The fusion of the north and south equatorial currents along with water from the Gulf of Mexico form this warm current,the Gulf Stream,http://www.j-archive.com/media/2009-12-29_J_04.wmv
2009-12-29,J,"JAVA, THE HUT",,800,Try a Kaffe Kreme at this shop where their coffee is as good as their doughnuts,Krispy Kreme,NA
2009-12-29,J,NAME THAT SPORT,,800,USAV,volleyball,NA
2009-12-29,J,"I CAN DO IT IN 5 ""NOTE""S",,800,It's the fractional music item seen here,a half-note,http://www.j-archive.com/media/2009-12-29_J_13.jpg
2009-12-29,J,THE SMITHS,,1000,Rhodesian politician who declared independence from Great Britain,Ian Smith,NA
2009-12-29,J,BIBLE BOOKS BY QUOTATION,,1000,"""And when he had opened the seventh seal, there was silence in heaven about the space of half an hour""",Revelation,NA
2009-12-29,J,YOU'RE ALL WET,,1000,The name of this ocean is derived from the name of a Titan in Greek myth who was a brother of Prometheus,the Atlantic,NA
2009-12-29,J,"JAVA, THE HUT",,1000,"Have some joe at cafes named for this fictional Colombian who represents more than 500,000 coffee growers",Juan Valdez,NA
2009-12-29,J,NAME THAT SPORT,,1000,"PBA, founded in 1958",bowling,NA
2009-12-29,J,"I CAN DO IT IN 5 ""NOTE""S",,1000,To signify certain ideas in addition to the explicit meaning,connote,NA
2009-12-29,DJ,UNCIVIL UNREST,,400,"""This is the farewell kiss, you dog"", said Muntader al-Zaidi as he threw both of these at Pres. Bush in Dec. 2008",his shoes,NA
2009-12-29,DJ,ACTORS & THEIR ROLES,,400,Colonel Claus von Stauffenberg & Ron Kovic,Tom Cruise,NA
2009-12-29,DJ,MEALTIME LIT,,400,Perhaps Mr. Capote feasted on French toast while writing this 1958 tale of Miss Golightly,Breakfast at Tiffany\'s,NA
2009-12-29,DJ,"BRAND ""X""","(Alex: Each correct response will contain an ""X"".)",400,"This brand's packages were originally labeled ""sanitary cold cream remover""",Kleenex,NA
2009-12-29,DJ,WE HAWK OLD INVENTIONS,,400,"He got movable type moving, & there are only about 40 of his 1450s Bible left!  Act now!",Gutenberg,NA
2009-12-29,DJ,LITTLE-USED WORDS,,400,A malison is a curse; a benison is this,a blessing,NA
2009-12-29,DJ,UNCIVIL UNREST,,800,The decidedly misnamed Avenue of Eternal Peace on this square was the site of deadly protests in 1989,Tiananmen Square,NA
2009-12-29,DJ,ACTORS & THEIR ROLES,,800,Tinkerbell & Erin Brockovich,Julia Roberts,NA
2009-12-29,DJ,MEALTIME LIT,,800,William Inge may have needed bug repellent while writing this 1953 play,Picnic,NA
2009-12-29,DJ,"BRAND ""X""","(Alex: Each correct response will contain an ""X"".)",800,"Pursue perfection with this make of car, whose logo is seen here",Lexus,http://www.j-archive.com/media/2009-12-29_DJ_04.jpg
2009-12-29,DJ,WE HAWK OLD INVENTIONS,,800,In December 1877 editors of Sci. American checked out his cylinder phonograph; the sentimental value alone is huge!,Edison,NA
2009-12-29,DJ,LITTLE-USED WORDS,,800,"The cholesterol-conscious may order a glair omelet, glair meaning this",egg-white,NA
2009-12-29,DJ,UNCIVIL UNREST,,1200,Seen here is an illustration of this 1773 protest,the Boston Tea Party,http://www.j-archive.com/media/2009-12-29_DJ_13a.jpg
2009-12-29,DJ,ACTORS & THEIR ROLES,,1200,Larry Gigli & George Reeves,Ben Affleck,NA
2009-12-29,DJ,MEALTIME LIT,,1200,"Anne Tyler sported a full menu when she wrote the bestselling ""Dinner at"" this ""Restaurant""",Dinner at the Homesick Restaurant,NA
2009-12-29,DJ,"BRAND ""X""","(Alex: Each correct response will contain an ""X"".)",1200,"This Mars candy bar is 2 fingers of cookie, caramel & chocolate",Twix,NA
2009-12-29,DJ,WE HAWK OLD INVENTIONS,,1200,"We have a certain ""view"" of this guy who 1st perfected his ""quick freeze machine"" for fish in 1926; enjoy our 1/2-priced halibut!",(Clarence) Birdseye,NA
2009-12-29,DJ,LITTLE-USED WORDS,,NA,An horologe is any device that gives you this information,time,NA
2009-12-29,DJ,UNCIVIL UNREST,,1600,"Washington, D.C. & Seattle have been targets of heated protests against the World Bank & the IMF, short for this",International Monetary Fund,NA
2009-12-29,DJ,ACTORS & THEIR ROLES,,1600,Elizabeth Swann & Elizabeth Bennet,Keira Knightley,NA
2009-12-29,DJ,MEALTIME LIT,,1600,"After ""The Hitchhiker's Guide to the Galaxy"", he served up ""The Long Dark Tea-Time of the Soul""",Douglas Adams,NA
2009-12-29,DJ,"BRAND ""X""","(Alex: Each correct response will contain an ""X"".)",1600,This company's Jack Kilby created the first integrated circuit back in 1958,Texas Instruments,NA
2009-12-29,DJ,WE HAWK OLD INVENTIONS,,1600,"Within 10 years of inventing the steel plow in 1837, he was producing 1,000 annually; nothing runs like...",John Deere,NA
2009-12-29,DJ,LITTLE-USED WORDS,,1600,Dundrearies are long these worn with a hairless chin,sideburns,NA
2009-12-29,DJ,UNCIVIL UNREST,,2000,These 1886 Chicago riots involved strikers from the McCormick Reaper Works,the Haymarket Riots,NA
2009-12-29,DJ,ACTORS & THEIR ROLES,,2000,Wyatt Earp & Snake Plissken,Kurt Russell,NA
2009-12-29,DJ,MEALTIME LIT,,2000,"We hope William S. Burroughs was clothed while writing this tale of a trip to the ""interzone""",Naked Lunch,NA
2009-12-29,DJ,"BRAND ""X""","(Alex: Each correct response will contain an ""X"".)",NA,"Lesney Products, a London die-casting business, introduced this toy brand in 1953",Matchbox,NA
2009-12-29,DJ,WE HAWK OLD INVENTIONS,,2000,You can't put a price on this German's scale for classifying the relative hardness of minerals--but we can!,(Friedrich) Mohs,NA
2009-12-29,DJ,LITTLE-USED WORDS,,2000,One of these may have shapely futtocks: a futtock is a curved timber in its frame,a ship,NA
2009-12-29,FJ,AMERICAN MUSIC,,NA,"The brilliance of Anne Brown, a soprano, changed the title of a 1935 opera that was to be called simply this one name",Porgy,NA
