date,round,category,comment,value,clue,response,link
2010-02-01,J,19th CENTURY AMERICA,,200,"In 1848 the U.S. got 1/2 million square miles from Mexico, including land north of the Gila River & this Intl. border river",the Rio Grande,NA
2010-02-01,J,IT'S A MALL WORLD,,200,There's a 9.6 million-square-foot mall in Dongguan in this country,China,NA
2010-02-01,J,STARTS WITH 2 VOWELS,(Alex: Each correct response.),200,The grunt of a sow,an oink,NA
2010-02-01,J,THINGS WITH STINGS,,200,"The sting-happy European fire ant is polygynous, meaning it has lots of these royals per colony",queens,NA
2010-02-01,J,COLLEGE FADS,,200,In the 1960s for some reason it was great fun to smash these instruments to bits; perhaps a baby grand?,a  piano,NA
2010-02-01,J,STREAKING,,200,"In the 1971-72 NBA season, this team won a record 33 games in a row (without Kobe!)",the Lakers,NA
2010-02-01,J,19th CENTURY AMERICA,,400,"In 1864 this NYC politician set up a printing company, then assigned all city printing to it",Boss Tweed,NA
2010-02-01,J,IT'S A MALL WORLD,,400,Malls of South America include Cidade Jardim in this largest Brazilian city,São Paulo,NA
2010-02-01,J,STARTS WITH 2 VOWELS,(Alex: Each correct response.),400,The first word of the Lord's Prayer,our,NA
2010-02-01,J,THINGS WITH STINGS,,400,"There are some 1,400 known species of this arachnid that has pincers up front & a stinger in the tail",a scorpion,NA
2010-02-01,J,COLLEGE FADS,,400,"Ah, the 1950s...time for panty raids & the stuffing of these small structures with as many people as possible",phone booths,NA
2010-02-01,J,STREAKING,,400,USC football's 34-game win streak from 2003 to 2006 set a record for this conference,the PAC 10,NA
2010-02-01,J,19th CENTURY AMERICA,,600,"On Oct. 18, 1867 General Lovell Rousseau formally received this territory purchased 7 months earlier",the Alaska Territory,NA
2010-02-01,J,IT'S A MALL WORLD,,600,The West Edmonton Mall is this province's top tourist attraction,Alberta,NA
2010-02-01,J,STARTS WITH 2 VOWELS,(Alex: Each correct response.),600,"Without purpose, perhaps because you don't have your favorite instant messenger",aimless,NA
2010-02-01,J,THINGS WITH STINGS,,600,"The ""killer"" honey bee Apis mellifera scutellata is also known by this ""continental"" name",an African killer bee,NA
2010-02-01,J,COLLEGE FADS,,600,The campus lunacy of swallowing these members of the carp family peaked in the 1930s,goldfish,NA
2010-02-01,J,STREAKING,,600,This swimmer won at least 6 gold medals at each of the last 2 summer Olympics,Michael Phelps,NA
2010-02-01,J,19th CENTURY AMERICA,,800,"This Ill. senator sponsored the Kansas-Nebraska Act, allowing each territory to decide the issue of slavery",Stephen Douglas,NA
2010-02-01,J,IT'S A MALL WORLD,,800,"Art & commerce do mix, as you'll find at the Paris Mall Carrousel du this",Louvre,NA
2010-02-01,J,STARTS WITH 2 VOWELS,(Alex: Each correct response.),NA,It's the only state that fits the bill,Iowa,NA
2010-02-01,J,THINGS WITH STINGS,,800,"Ecch! The wasp D. longicaudata oviposits in the larvae of the Caribbean fruit fly, meaning it does this there",lays its eggs,NA
2010-02-01,J,COLLEGE FADS,,800,In the 1980s groups of students started forming circles & kicking these little bags back & forth,hackysacks,NA
2010-02-01,J,STREAKING,,800,He led the NHL in scoring for 7 straight years in the '80s with Edmonton,Gretzky,NA
2010-02-01,J,19th CENTURY AMERICA,,1000,In August 1812 this future president was put in charge of the Northwestern Army,William Henry Harrison,NA
2010-02-01,J,IT'S A MALL WORLD,,1000,This rhyming London street runs between Regent & St. James' Streets,Pall Mall,NA
2010-02-01,J,STARTS WITH 2 VOWELS,(Alex: Each correct response.),1000,"This word referring to a Roman soothsayer has become a verb meaning ""to predict""",augur,NA
2010-02-01,J,THINGS WITH STINGS,,1000,Xylocopa is this bee that chews holes in wood; it's named for a job that does more constructive wood work,carpenter,NA
2010-02-01,J,COLLEGE FADS,,1000,"Originally worn by sailors, these flared jeans became popular on college campuses in the '60s & '70s",bell-bottoms,NA
2010-02-01,J,STREAKING,,1000,"After his 56-game hitting streak ended in 1941, this Yankee hit in 16 straight; that's 72 out of 73 games",Joe DiMaggio,NA
2010-02-01,DJ,FRATERNITIES,,400,"The Granddaddy of all modern fraternities, this organization began accepting non-stoneworkers in the 1600s",the Masons,NA
2010-02-01,DJ,POP CULTURE,,400,Hindi actor Dev Patel cashed in as the title character in this 2008 Best Picture Oscar winner,Slumdog Millionaire,NA
2010-02-01,DJ,TYPES OF...,,400,Dill & bread-&-butter are types of these,pickles,NA
2010-02-01,DJ,BOB'S YOUR POET,,400,"Former poet laureate Robert Pinsky was lauded for his translation of ""The Inferno of"" this other poet",Dante,NA
2010-02-01,DJ,JUST AVERAGE,,400,Just average 3.75 miles a day for a week & you'll have totaled about this marathon distance,26 miles (& 385 yards),NA
2010-02-01,DJ,FROM THE GREEK FOR...,,400,"""Mythical bird"", whether you're in Arizona or not",a Phoenix,NA
2010-02-01,DJ,FRATERNITIES,,800,"Founded in 1888, the Loyal Order of this large deer once had Warren G. Harding & Charlie Chaplin as members",moose,NA
2010-02-01,DJ,POP CULTURE,,800,"Sadly, in 2009, the bell tolled for 15-year-old Gigi, a dog of this breed, who gained fame starring in Taco Bell commercials",a Chihuahua,NA
2010-02-01,DJ,TYPES OF...,,800,"Bing,Lycos",search engines,NA
2010-02-01,DJ,BOB'S YOUR POET,,800,"""The Twa Dogs"" & ""Scotch Drink"" are among his ""Poems, Chiefly in the Scottish Dialect""",(Rabbie) Burns,NA
2010-02-01,DJ,JUST AVERAGE,,800,Just average 101 & 297 to get this prime number,199,NA
2010-02-01,DJ,FROM THE GREEK FOR...,,800,"""False name""; that's it, really. A false name",a pseudonym,NA
2010-02-01,DJ,FRATERNITIES,,1200,Key Club is a high school branch of the fraternal organization begun in 1915,the Kiwanis,NA
2010-02-01,DJ,POP CULTURE,,1200,"Popular magazines from Food Network chefs include ""Cooking with Paula Deen"" & ""Every Day with"" her",Rachael Ray,NA
2010-02-01,DJ,TYPES OF...,,1200,"All Terrain,Mud Terrain,Radial",tires,NA
2010-02-01,DJ,BOB'S YOUR POET,,1200,"Robert Herrick gave us the line ""Gather ye"" these ""while ye may""",rosebuds,NA
2010-02-01,DJ,JUST AVERAGE,,1200,The average is also called the arithmetic this,mean,NA
2010-02-01,DJ,FROM THE GREEK FOR...,,1200,"""A band of dancers & singers""; it's sung after some verses",a chorus,NA
2010-02-01,DJ,FRATERNITIES,,NA,"Founded in 1882, they were named for the discoverer of the Americas",the Knights of Columbus,NA
2010-02-01,DJ,POP CULTURE,,1600,"After a short stint on ""Melrose Place"", Ashlee Simpson-Wentz was Broadway bound as Roxie Hart in this musical",Chicago,NA
2010-02-01,DJ,TYPES OF...,,1600,"Power ""I"",Spread",offenses in football,NA
2010-02-01,DJ,BOB'S YOUR POET,,1600,"This American poet wrote, ""Nature's first green is gold, her hardest hue to hold""",Robert Frost,NA
2010-02-01,DJ,JUST AVERAGE,,1600,Just average Joe & Josephine to get this average number of letters in their names,six,NA
2010-02-01,DJ,FROM THE GREEK FOR...,,NA,"""Going out""; it's a book in the Bible",Exodus,NA
2010-02-01,DJ,FRATERNITIES,,2000,"To be a member of A.O.H., the ancient order of these, you must be a Catholic & either Irish or of Irish descent",Hibernians,NA
2010-02-01,DJ,POP CULTURE,,2000,"This star of ""The Nanny Diaries"" has a twin brother named Hunter",Scarlett Johannson,NA
2010-02-01,DJ,TYPES OF...,,2000,"Coptic, Pashto, Nadsat",languages,NA
2010-02-01,DJ,BOB'S YOUR POET,,2000,This Boston-born poet was related to astronomer Percival & to fellow poets Amy & James Russell,"Robert Lowell, Jr.",NA
2010-02-01,DJ,JUST AVERAGE,,2000,"(Kelly of the Clue Crew stands in front of an equation.)  Items get different importance when calculating slugging average. A single counts as one, a triple as three, making it this type of average that sounds heavy.",weighted average,http://www.j-archive.com/media/2010-02-01_DJ_25.jpg
2010-02-01,DJ,FROM THE GREEK FOR...,,2000,"""relating to memory""; one is ""every good boy does fine""",a mnemonic,NA
2010-02-01,FJ,MEDICINE,,NA,"The genes of this organism were discovered to be 2 parts pig, 1 part human & 1 part bird",H1N1 (or swine flu),NA
