date,round,category,comment,value,clue,response,link
2010-03-24,J,STATE FLAGS & SEALS,,200,"There's one of these in the center of Texas' state seal, on its flag & in its nickname",a star,NA
2010-03-24,J,JOKING MATTERS,,200,"One ""headline"" featured on his talk show read, ""Suicide counselor accused of trying to kill patient""",Jay Leno,NA
2010-03-24,J,IN THE KITCHEN,,200,This smooth cylinder is used to flatten bread dough or to inflict a cranial injury on a philandering husband,a rolling pin,NA
2010-03-24,J,FAMOUS NAMES IN THE BIG BROTHER HOUSE,,200,"As he did after the 1962 Calif. governor's race, on eviction he says the house won't have him to kick around anymore",Nixon,NA
2010-03-24,J,HISTORIC TRANSPORTS,,200,"Though it never made it into space, thanks to ""Star Trek"" fans the first Space Shuttle orbiter was called this",the Enterprise,NA
2010-03-24,J,HIDDEN COUNTRIES,"(Alex: You have to name the country that is hidden, in letters, within each of the clues.  The letters are in order, of course.)",200,I economize with lunch in a box,China (in lun<b>ch in a</b> box),NA
2010-03-24,J,STATE FLAGS & SEALS,,400,The front of its state seal shows Lord Baltimore as a knight in full armor,Maryland,NA
2010-03-24,J,JOKING MATTERS,,400,"Mitch Hedberg: ""The depressing thing about"" this Chris Evert sport is ""no matter how good I get, I'll never be as good as a wall""",tennis,NA
2010-03-24,J,IN THE KITCHEN,,400,In the 1920s Charles Strite invented the first home version of this automatic pop-up appliance,a toaster,NA
2010-03-24,J,FAMOUS NAMES IN THE BIG BROTHER HOUSE,,400,The houseguests boot this American general who took over command of Philadelphia in 1778 for his dastardly double dealing,(Benedict) Arnold,NA
2010-03-24,J,HISTORIC TRANSPORTS,,400,"Seen here, it was captured on film over Manhattan shortly before its demise",the Hindenburg,http://www.j-archive.com/media/2010-03-24_J_15.wmv
2010-03-24,J,HIDDEN COUNTRIES,"(Alex: You have to name the country that is hidden, in letters, within each of the clues.  The letters are in order, of course.)",400,"Truly, you have created a beauteous painting",Spain (in beauteou<b>s pain</b>ting),NA
2010-03-24,J,STATE FLAGS & SEALS,,600,"This state's seal includes its longer, official name: ""The State of"" this & ""Providence Plantations""",Rhode Island,NA
2010-03-24,J,JOKING MATTERS,,600,"On ""SNL"", Christopher Walken ""got a fever, & the only prescription is more"" of this instrument",cowbell,NA
2010-03-24,J,IN THE KITCHEN,,600,"To use this hinged utensil, put cloves into the extruder basket, then squeeze the handles together",a garlic press,NA
2010-03-24,J,FAMOUS NAMES IN THE BIG BROTHER HOUSE,,600,In 1947 his fasting stopped riots in Calcutta & his sunny attitude takes him far in the game; everyone likes Mo,Gandhi,NA
2010-03-24,J,HISTORIC TRANSPORTS,,600,"The centerpiece of the Evergreen Aviation Museum in Oregon is this giant flying boat, piloted only once by Howard Hughes","the ""Spruce Goose""",NA
2010-03-24,J,HIDDEN COUNTRIES,"(Alex: You have to name the country that is hidden, in letters, within each of the clues.  The letters are in order, of course.)",600,Your job is to find the hidden marksman,Denmark (in hid<b>den mark</b>sman),NA
2010-03-24,J,STATE FLAGS & SEALS,,NA,Both its flag & seal were re-adopted in 1967 when a portrait by Gilbert Stuart was approved for the seal,Washington,NA
2010-03-24,J,JOKING MATTERS,,800,"Emo Philips: A computer ""once beat me at"" this game ""but it was no match for me at kickboxing""",chess,NA
2010-03-24,J,IN THE KITCHEN,,800,"From the Latin for ""strain"", it's a bowl-shaped strainer used to drain liquids from such foods as pasta",a colander,NA
2010-03-24,NA,NA,NA,NA,NA,NA,NA
2010-03-24,J,HISTORIC TRANSPORTS,,800,"In June of 1943, he made the cover of Life magazine along with his helicopter",Igor Sikorsky,http://www.j-archive.com/media/2010-03-24_J_17a.jpg
2010-03-24,J,HIDDEN COUNTRIES,"(Alex: You have to name the country that is hidden, in letters, within each of the clues.  The letters are in order, of course.)",800,Beach walking may require you to put on galoshes,Tonga (in pu<b>t on ga</b>loshes),NA
2010-03-24,J,STATE FLAGS & SEALS,,1000,"This one-word motto meaning ""ever upward"" appears on the flag & seal of New York",Excelsior,NA
2010-03-24,J,JOKING MATTERS,,1000,This sitcom star who played Dr. Robert Hartley said his stammer got him a home in Beverly Hills & he's not correcting it,Bob Newhart,NA
2010-03-24,J,IN THE KITCHEN,,1000,"Despite its name, it's a slicing tool, not a guitar-like instrument, so don't strum it",a mandoline,http://www.j-archive.com/media/2010-03-24_J_13.jpg
2010-03-24,J,FAMOUS NAMES IN THE BIG BROTHER HOUSE,,1000,"Also pushed out by Castro in 1959, he tells Julie Chen, ""I just didn't see the backdoor coming""",(Fulgencio) Batista,NA
2010-03-24,J,HISTORIC TRANSPORTS,,1000,"In 2007 while undergoing renovations, this historic British tea clipper was further damaged by a fire",the Cutty Sark,NA
2010-03-24,J,HIDDEN COUNTRIES,"(Alex: You have to name the country that is hidden, in letters, within each of the clues.  The letters are in order, of course.)",1000,Give a dog a bone & he'll bark gratefully,Gabon (in do<b>g a bon</b>e),NA
2010-03-24,DJ,COMPLETES THE OPERA TITLE,,400,"Rossini:""The ____ of Seville""",Barber,NA
2010-03-24,DJ,SPORTS SHORTS,,400,This Boston College QB played large for the Patriots & was the CFL's most outstanding player 6 times,(Doug) Flutie,NA
2010-03-24,DJ,JUST LEAF ALREADY,,400,Seen here are the leaves of this type of plant that dominated the Earth 300 million years ago,a fern,http://www.j-archive.com/media/2010-03-24_DJ_18.jpg
2010-03-24,DJ,CERVANTES,,400,"The Cervantes Prize is awarded annually to an author who works in this dialect, the basis of modern Spanish",Castillian,NA
2010-03-24,DJ,DONKEY,,400,"Though not the best at digging, donkeys are called these in Spanish",burros,NA
2010-03-24,DJ,O.T.,,400,"This emigrant route started in Independence, Missouri & moved west to the Columbia River region",the Oregon Trail,NA
2010-03-24,DJ,COMPLETES THE OPERA TITLE,,800,"Puccini:""The Girl of the Golden ____""",West,NA
2010-03-24,DJ,SPORTS SHORTS,,800,"We couldn't do a ""SPORTS SHORTS"" category without mentioning a few of these athletes like Laffit Pincay & Gary Stevens",jockeys,NA
2010-03-24,DJ,JUST LEAF ALREADY,,800,The leaves of this plant are used as a seasoning & the plant is often used as a hedge on the Pacific coast,rosemary,http://www.j-archive.com/media/2010-03-24_DJ_19.jpg
2010-03-24,DJ,CERVANTES,,800,"Cervantes' day job was securing provisions for this ""invincible"" naval force",the Spanish Armada,NA
2010-03-24,DJ,DONKEY,,800,A donkey tries hair extensions on its lower legs in order to become a part of the team in a commercial for this beer,Budweiser,NA
2010-03-24,DJ,O.T.,,800,In the NFL going into O.T. means playing this,overtime,NA
2010-03-24,DJ,COMPLETES THE OPERA TITLE,,1200,"Stravinsky:""The ____'s Progress""",Rake,NA
2010-03-24,DJ,SPORTS SHORTS,,1200,"Even though he was 6'1"", NBA star Nate Archibald sported this diminutive nickname","""Tiny""",NA
2010-03-24,DJ,JUST LEAF ALREADY,,1200,NHL fans are familiar with these items,a maple leaf,http://www.j-archive.com/media/2010-03-24_DJ_20.jpg
2010-03-24,DJ,CERVANTES,,1200,"Cervantes' ""La Galatea"" was this type of romance that typically involves a society of shepherds",a pastoral,NA
2010-03-24,DJ,DONKEY,,1200,"In a Carlo Collodi tale, this protagonist turns into a donkey & is sold to a circus owner",Pinocchio,NA
2010-03-24,DJ,O.T.,,1200,Sufferers of bronchopulmonary disease might spend some time in one of these enclosures,an oxygen tent,NA
2010-03-24,DJ,COMPLETES THE OPERA TITLE,,1600,"Donizetti:""The Daughter of the ____""",Regiment,NA
2010-03-24,DJ,SPORTS SHORTS,,1600,"(Jimmy of the Clue Crew climbs some steps.)  His vertical leap adding an astonishing 42 inches to his reach, this 5'7"" NBA player won the NBA's Slam Dunk Contest in 1986",Spud Webb,http://www.j-archive.com/media/2010-03-24_DJ_04a.jpg
2010-03-24,DJ,JUST LEAF ALREADY,,1600,This type of tree with the leaf seen here is in the beech family,an oak,http://www.j-archive.com/media/2010-03-24_DJ_25.jpg
2010-03-24,DJ,CERVANTES,,1600,"Cervantes' first published poems appeared in a volume about the passing of this king's wife, Elizabeth of Valois",Philip II of Spain,NA
2010-03-24,DJ,DONKEY,,NA,"In this 1945 novel, Benjamin the Donkey says, ""Donkeys live a long time.  None of you has ever seen a dead donkey""",Animal Farm,NA
2010-03-24,DJ,O.T.,,NA,"This ""vocational"" type of treatment encourages patients to engage in activities",occupational therapy,NA
2010-03-24,DJ,COMPLETES THE OPERA TITLE,,2000,"Mascagni:""Cavalleria ____""",rusticana,NA
2010-03-24,DJ,SPORTS SHORTS,,2000,"Willie ""Stretch"" McCovey starred at first base; Freddie ""The Flea"" Patek, at this infield position",shortstop,NA
2010-03-24,DJ,JUST LEAF ALREADY,,2000,The leaves of this plant from the mustard family are great in a salad,arugula,http://www.j-archive.com/media/2010-03-24_DJ_26.jpg
2010-03-24,DJ,CERVANTES,,2000,In 1575 Miguel was sold into slavery in this current North African capital on the Mediterranean,Algiers,NA
2010-03-24,DJ,DONKEY,,2000,"He first used the donkey as a symbol for Democrats in the 1870 cartoon ""Live jackass kicking a dead lion""",(Thomas) Nast,NA
2010-03-24,DJ,O.T.,,2000,"In a hit song Bob Seger liked this type of ""rock and roll""","that ""Old Time""",NA
2010-03-24,FJ,ANIMATED MOVIES,,NA,The answer to the title of this Oscar winner is Judge Doom,Who Framed Roger Rabbit,NA
