date,round,category,comment,value,clue,response,link
2010-05-05,J,STATE THE STATE,,200,"State that's home to the Alfred P. Sloan Museum, featuring the Buick Automotive Gallery",Michigan,NA
2010-05-05,J,ELVIS LYRICS,,200,"""Well it's one for the money, two for the show, three to get ready, now go, cat, go, but don't you step on my...""","""Blue Suede Shoes""",NA
2010-05-05,J,DOLLARS & NONSENSE,,200,"The Alaskan island of Gravina, pop. 50, was to be one end of what was called this ""to nowhere"", price tag $320 million",bridge to nowhere,NA
2010-05-05,J,"MIDDLE NAME, PLEASE",,200,Of President Stephen Cleveland,Grover,NA
2010-05-05,J,PICKLES,,200,"In a nursery rhyme ""Peter Piper picked a peck"" (about 8 quarts) of these ""pickled"" items",peppers,NA
2010-05-05,J,"""V"" LIKE 7-LETTER WORDS",,200,Crayolas & Band-Aids come in this kind of pack that gives you lots of choice,variety,NA
2010-05-05,J,STATE THE STATE,,400,"This state has parishes like Jefferson Davis, Jackson & Union... wait, Union?",Louisiana,NA
2010-05-05,J,ELVIS LYRICS,,400,"""Well, since my baby left me, well I found a new place to dwell, well it's down at the end of lonely street""","""Heartbreak Hotel""",NA
2010-05-05,J,DOLLARS & NONSENSE,,400,"""Baby you're a rich man"", but divorcing Heather Mills reportedly cost this musician $50 million",Paul McCartney,NA
2010-05-05,J,"MIDDLE NAME, PLEASE",,400,Of former First Lady Eleanor Carter,Rosalynn,NA
2010-05-05,J,PICKLES,,400,This member of the parsley family with a 4-letter name is a main flavoring agent in pickles,dill,NA
2010-05-05,J,"""V"" LIKE 7-LETTER WORDS",,400,"A person who preys ruthlessly upon others, or Anne Rice's Lestat",vampire,NA
2010-05-05,J,STATE THE STATE,,600,"It's the only state that ends with a ""G""",Wyoming,NA
2010-05-05,J,ELVIS LYRICS,,600,"""Everybody in the whole cell block was dancin' to the...""","""Jailhouse Rock""",NA
2010-05-05,J,DOLLARS & NONSENSE,,600,In Feb. 2010 this huge insurance co. we all bailed out said it would pay as much as $100 million in employee bonuses,AIG,NA
2010-05-05,J,"MIDDLE NAME, PLEASE",,600,Of comedy playwright Marvin Simon,Neil,NA
2010-05-05,J,PICKLES,,600,"The national dish of South Korea, it's pickled cabbage, radishes, other vegetables & spices",kimchi,NA
2010-05-05,J,"""V"" LIKE 7-LETTER WORDS",,600,You're like this scavenging bird seen here,vulture,http://www.j-archive.com/media/2010-05-05_J_03.jpg
2010-05-05,J,STATE THE STATE,,800,"This state's official bird, the cactus wren, likes to build its nest in the saguaro cactus",Arizona,NA
2010-05-05,J,ELVIS LYRICS,,800,"""My hands are shaky and my knees are weak, I can't seem to stand on my own two feet""","""All Shook Up""",NA
2010-05-05,J,DOLLARS & NONSENSE,,800,"Architect Julia Morgan's records on this California castle show it cost under $10 million, even with 41 fireplaces",San Simeon (or the Hearst Castle),NA
2010-05-05,J,"MIDDLE NAME, PLEASE",,800,Of late NASCAR driver Ralph Earnhardt,Dale,NA
2010-05-05,J,PICKLES,,800,"Eaten between different servings of sushi, gari is a thinly sliced, pickled variety of this herb",ginger,NA
2010-05-05,J,"""V"" LIKE 7-LETTER WORDS",,800,"After it dries, this leaves a hard, glossy coating on wood",varnish,NA
2010-05-05,J,STATE THE STATE,,NA,The flag of this state features a Seminole woman scattering flowers,Florida,NA
2010-05-05,J,ELVIS LYRICS,,1000,"""And his mama cries, 'cause if there's one thing that she don't need it's another hungry mouth to feed""","""In The Ghetto""",NA
2010-05-05,J,DOLLARS & NONSENSE,,1000,"In 1971 Clifford Irving got $750,000 for presenting the bogus autobiography of this eccentric man",Howard Hughes,NA
2010-05-05,J,"MIDDLE NAME, PLEASE",,1000,Of British PM Arthur Chamberlain,Neville Chamberlain,NA
2010-05-05,J,PICKLES,,1000,"This Pittsburgh-based food businessman was known as the ""pickle king""",H.J. Heinz,NA
2010-05-05,J,"""V"" LIKE 7-LETTER WORDS",,1000,"It means boldly courageous or brave, as in a comic strip prince",valiant,NA
2010-05-05,DJ,THAT'S HOT!,,400,"This country's record high is 114 at Yellow Grass, Saskatchewan in 1937",Canada,NA
2010-05-05,DJ,MOVIE TITLE FILL IN THE BLANK,(Alex: You have to give us the one word that is common to both titles.),400,"""The _____ Bride"" & ""The _____ and the Frog""",Princess,NA
2010-05-05,DJ,AT THE ZOO,,400,"You can see how this tallest animal is most vulnerable when drinking, as it has to splay its legs & lower its head",the giraffe,NA
2010-05-05,DJ,"WHAT ARE YOU, YELLOW?",,400,It wouldn't be Easter without these marshmallow treats,Peeps,http://www.j-archive.com/media/2010-05-05_DJ_25.jpg
2010-05-05,DJ,MAYORS,,400,"We're pretty sure it wasn't his singing that got him elected mayor of Palm Springs, California in 1988",Sonny Bono,NA
2010-05-05,DJ,RHYME TIME,,400,The main burglar,the chief thief,NA
2010-05-05,DJ,THAT'S HOT!,,800,"In 1974 the temp reached a balmy 59 at Vanda Station on this continent (hey, that's hot for there)",Antarctica,NA
2010-05-05,DJ,MOVIE TITLE FILL IN THE BLANK,(Alex: You have to give us the one word that is common to both titles.),800,""" _____  "" & "" ____ in the Air""",Up,NA
2010-05-05,DJ,AT THE ZOO,,800,"Wow! It's a spiny-tailed iguana, one of these that holds the 21 mph reptile land speed record",a lizard,NA
2010-05-05,DJ,"WHAT ARE YOU, YELLOW?",,800,The name of this flower seen here reflects its color & its shape,a buttercup,http://www.j-archive.com/media/2010-05-05_DJ_24a.jpg
2010-05-05,DJ,MAYORS,,800,"Before representing California in the Senate, she was mayor of San Francisco",Dianne Feinstein,NA
2010-05-05,DJ,RHYME TIME,,NA,A radio personality who provokes & pushes the limits of decency,a shock jock,NA
2010-05-05,DJ,THAT'S HOT!,,1200,The water in Frying Pan Lake in this country near Australia gets up to about 130 degrees,New Zealand,NA
2010-05-05,DJ,MOVIE TITLE FILL IN THE BLANK,(Alex: You have to give us the one word that is common to both titles.),1200,"""A Serious _____ "" & ""A Single _____ """,Man,NA
2010-05-05,DJ,AT THE ZOO,,1200,"Let's go look at the lorikeets in this structure, from the Latin for ""bird""",aviary,NA
2010-05-05,DJ,"WHAT ARE YOU, YELLOW?",,1200,"In identifying the butterfly seen here, the name of this fierce animal comes before ""swallowtail""",tiger,http://www.j-archive.com/media/2010-05-05_DJ_21.jpg
2010-05-05,DJ,MAYORS,,NA,"In the 1800s, Josiah Quincy, his son & grandson all served as the mayor of this capital",Boston,NA
2010-05-05,DJ,RHYME TIME,,1200,"An immobilizer used by the police (don't taze me, bro!)",a stun gun,NA
2010-05-05,DJ,THAT'S HOT!,,1600,Tirat Tsvi in what's now this country hit 129 in 1942,Israel,NA
2010-05-05,DJ,MOVIE TITLE FILL IN THE BLANK,(Alex: You have to give us the one word that is common to both titles.),1600,"""The _____ Victoria"" & "" _____ Guns""",Young,NA
2010-05-05,DJ,AT THE ZOO,,1600,Can't hear you--maybe we should continue our conversation away from the howler type of this,monkey,NA
2010-05-05,DJ,"WHAT ARE YOU, YELLOW?",,1600,Archaeologist & physician Harry Mera designed this state's flag,New Mexico,http://www.j-archive.com/media/2010-05-05_DJ_22.jpg
2010-05-05,DJ,MAYORS,,1600,"Dave Bing, this city's new mayor, wants to revive the innovative spirit of Henry Ford & Berry Gordy",Detroit,NA
2010-05-05,DJ,RHYME TIME,,1600,A very low-alcohol lager,near beer,NA
2010-05-05,DJ,THAT'S HOT!,,2000,The Pacific islands' top temp was a 1912 reading of 108 at Tuguegarao in this island nation,the Philippines,NA
2010-05-05,DJ,MOVIE TITLE FILL IN THE BLANK,(Alex: You have to give us the one word that is common to both titles.),2000,"""The Last _____ "" & ""The _____ Agent""",Station,NA
2010-05-05,DJ,AT THE ZOO,,2000,"The sun type is the smallest of these carnivores, with the males only 130 lbs.--still looks mean, though",bears,NA
2010-05-05,DJ,"WHAT ARE YOU, YELLOW?",,2000,"Seen here is the yellowtail type of this fish, not the familiar red type",the snapper,http://www.j-archive.com/media/2010-05-05_DJ_23.jpg
2010-05-05,DJ,MAYORS,,2000,"The son of Italian immigrants, he served in the House of Representatives before becoming NYC's mayor in 1934",LaGuardia,NA
2010-05-05,DJ,RHYME TIME,,2000,In December 2001 U.S. forces thought Osama bin Laden was in this region of Afghanistan,Tora Bora,NA
2010-05-05,FJ,MOVIE HISTORY,,NA,"During the making of this classic, sets from ""King Kong"" & ""The Garden of Allah"" were intentionally burned down",Gone with the Wind,NA
