date,round,category,comment,value,clue,response,link
2010-07-01,J,THE QUOTABLE '60s,,200,"They're the 4 words following Neil Armstrong's historic ""Houston, Tranquility Base here...""",the Eagle has landed,NA
2010-07-01,J,STATE YOUR BUSINESS,"(Alex: In fact, you have to tell us the state in which the business is located.)",200,"3M:We'll only need one M, though",Minnesota,NA
2010-07-01,J,THE GREEK LETTER EQUIVALENT,,200,G,gamma,NA
2010-07-01,J,"""HOLE""-Y",,200,2-word term for an oil well that doesn't yield any oil,a dry hole,NA
2010-07-01,J,COW,,200,"To prevent the bovine inflammation known as mastitis, practice good hygiene when doing this to your cows",milking,NA
2010-07-01,J,BATMAN,,200,It's Batman's secret lair beneath Wayne Manor,the Batcave,NA
2010-07-01,J,THE QUOTABLE '60s,,400,"In 1966 he angered a lot of people when he said, ""We're more popular than Jesus now""",John Lennon,NA
2010-07-01,J,STATE YOUR BUSINESS,"(Alex: In fact, you have to tell us the state in which the business is located.)",400,"Ben & Jerry's:May I suggest the flavor ""Jeopar-Delight!""?",Vermont,NA
2010-07-01,J,THE GREEK LETTER EQUIVALENT,,400,K,kappa,NA
2010-07-01,J,"""HOLE""-Y",,400,"To change its pitch, there is a series of these on any woodwind instrument",finger holes,NA
2010-07-01,J,COW,,400,The 600-pound cow made by Sarah Pratt each year for the Iowa state fair is made from this dairy product,butter,NA
2010-07-01,J,BATMAN,,400,His butler & confidante,Alfred,NA
2010-07-01,J,THE QUOTABLE '60s,,600,"Referring to these riots in 1965, Governor Pat Brown said, ""Why, this is the worst disaster since my election""",the Watts Riots,NA
2010-07-01,J,STATE YOUR BUSINESS,"(Alex: In fact, you have to tell us the state in which the business is located.)",NA,"Kellogg's:You read the side of the box a million times, now it pays off",Michigan,NA
2010-07-01,J,THE GREEK LETTER EQUIVALENT,,600,M,mu,NA
2010-07-01,J,"""HOLE""-Y",,600,A collapsed cavity in the ground caused by water erosion,a sinkhole,NA
2010-07-01,J,COW,,600,This sign of the zodiac is represented by a bovine,Taurus,NA
2010-07-01,J,BATMAN,,600,"This actor was the Batman in ""The Dark Knight""",Christian Bale,NA
2010-07-01,J,THE QUOTABLE '60s,,800,"In 1967 he told his daughter, ""Your daddy may go down in history as having started World War III""",(Lyndon) Johnson,NA
2010-07-01,J,STATE YOUR BUSINESS,"(Alex: In fact, you have to tell us the state in which the business is located.)",800,Microsoft:They don't own the state... yet,Washington,NA
2010-07-01,J,THE GREEK LETTER EQUIVALENT,,800,R,rho,NA
2010-07-01,J,"""HOLE""-Y",,800,This nearly inaccessible canyon in Wyoming was one of Butch Cassidy & his gang's main hideouts,the Hole in the Wall,NA
2010-07-01,J,COW,,800,A young & calfless cow is known as one of these,a heifer,NA
2010-07-01,J,BATMAN,,800,"On the TV series, the line that ended each episode was ""Tune in tomorrow, same bat time, same"" this",bat channel,NA
2010-07-01,J,THE QUOTABLE '60s,,1000,"""Viva la huelga"" (long live the strike) was the slogan of his United Farm Workers",César Chávez,NA
2010-07-01,J,STATE YOUR BUSINESS,"(Alex: In fact, you have to tell us the state in which the business is located.)",1000,DuPont:I just wanna say one word to you--plastics,Delaware,NA
2010-07-01,J,THE GREEK LETTER EQUIVALENT,,1000,F,phi,NA
2010-07-01,J,"""HOLE""-Y",,1000,Reports differ on how many British prisoners in 1756 were locked in & lost their lives in what's known as this,the Black Hole of Calcutta,NA
2010-07-01,J,COW,,1000,"The reticulum, rumen, omasum & abomasum make up a cow's this",stomach,NA
2010-07-01,J,BATMAN,,1000,"This rocker composed the scores for ""Batman"" & ""Batman Returns""",Danny Elfman,NA
2010-07-01,DJ,ANTHROPOLOGY,,400,"At 40% intact, the 3.2-million-year-old Australopithecus afarensis skeleton with this nickname is remarkably complete",Lucy,http://www.j-archive.com/media/2010-07-01_DJ_26.jpg
2010-07-01,DJ,'90s BEST PICTURE PLOT POINTS,,400,Poor Jack Dawson leaves Southampton in 1912 to go to America for a new start; has trouble along the way,Titanic,NA
2010-07-01,DJ,JULY,,400,"In July 1932 this U.S. president ordered the forcible eviction of World War I veterans gathered in Washington, D.C.",Hoover,NA
2010-07-01,DJ,ON THE PHONE,,400,"The Iridium 9555 connects via this way up high & says it ""works everywhere, without exception""",satellite,NA
2010-07-01,DJ,PLEASE BELIZE ME,,400,In 1981 the sun set on this empire's colonial rule in newly independent Belize,the British Empire (the United Kingdom accepted),NA
2010-07-01,DJ,"""OY"" TO THE WORLD",,400,Fake duck for a hunter,a decoy,NA
2010-07-01,DJ,ANTHROPOLOGY,,800,"In 2009 scientists suggested that Ida, a 47-million-year-old fossil, was one of these, a hypothetical bridge species",a missing link,NA
2010-07-01,DJ,'90s BEST PICTURE PLOT POINTS,,800,"Multi-talented man scores for the Crimson Tide & bests Chinese at ping pong, among other feats",Forrest Gump,NA
2010-07-01,DJ,JULY,,800,This iconic French monument was officially inaugurated in July 1836,the Arc de Triomphe,NA
2010-07-01,DJ,ON THE PHONE,,800,Back in 1997 Philippe Kahn jerry-rigged a camera & cell phone & used it to send pictures of this proud event,the birth of his daughter,NA
2010-07-01,DJ,PLEASE BELIZE ME,,800,"On Oct. 31, 1961 Belize City was severely damaged by one of these; the capital was moved inland a few years later",a hurricane,NA
2010-07-01,DJ,"""OY"" TO THE WORLD",,800,"This fabric may take its name from the Old French for ""cloth of the king""",corduroy,NA
2010-07-01,DJ,ANTHROPOLOGY,,NA,"This couple, stars of paleoanthropology, are seen here helping a 600,000-year-old skull smile for the camera",the Leakeys,http://www.j-archive.com/media/2010-07-01_DJ_28.jpg
2010-07-01,DJ,'90s BEST PICTURE PLOT POINTS,,1200,In WWII Italy burned Hungarian count tells of his North African tragic love,The English Patient,NA
2010-07-01,DJ,JULY,,1200,"Your parents may ""read"" you this; England passed the original one back in July 1715 to deal with noisy protests",the Riot Act,NA
2010-07-01,DJ,ON THE PHONE,,1200,An old time phone might be a wall set or this type of set named for a 4-letter horizontal surface,a desk set,http://www.j-archive.com/media/2010-07-01_DJ_18.jpg
2010-07-01,DJ,PLEASE BELIZE ME,,1200,Belize has been involved for decades in border disputes with this western neighbor,Guatemala,NA
2010-07-01,DJ,"""OY"" TO THE WORLD",,1200,"Developed in 1923, it's the yummy hybrid edible seen here",a boysenberry,http://www.j-archive.com/media/2010-07-01_DJ_23.jpg
2010-07-01,DJ,ANTHROPOLOGY,,1600,"In 1856 quarrymen in Germany unearthed part of a skeleton from this archaic man, the archetypal ""caveman""",Neanderthal,NA
2010-07-01,DJ,'90s BEST PICTURE PLOT POINTS,,1600,"Union officer goes native, seeks/kills buffalo",Dances with Wolves,NA
2010-07-01,DJ,JULY,,1600,"In July 1492 some 200,000 Jews were expelled from this European monarchy",Spain,NA
2010-07-01,DJ,ON THE PHONE,,1600,The iPhone's intelligent this suggests which word you might want to type next,keyboard,NA
2010-07-01,DJ,PLEASE BELIZE ME,,1600,"Belize's highest peak is known as this author's ""Delight"", for its resemblance to the setting of ""The Lost World""",Sir Arthur Conan Doyle,NA
2010-07-01,DJ,"""OY"" TO THE WORLD",,NA,A diplomat with less authority than an ambassador,an envoy,NA
2010-07-01,DJ,ANTHROPOLOGY,,2000,"Dubois found the first fossils IDed as this species of our genus; later, finding a femur convinced him that it walked upright",Homo erectus,NA
2010-07-01,DJ,'90s BEST PICTURE PLOT POINTS,,2000,Gal seeks/kills Buffalo Bill,The Silence of the Lambs,NA
2010-07-01,DJ,JULY,,2000,July 622 marks the beginning of this calendar,the Islamic calendar,NA
2010-07-01,DJ,ON THE PHONE,,2000,This easy-to-use cell phone is named for a dance of days gone by,the Jitterbug,http://www.j-archive.com/media/2010-07-01_DJ_20a.jpg
2010-07-01,DJ,PLEASE BELIZE ME,,2000,About one quarter of Belize's population is of this ethnicity of mixed African & European descent,Creole,NA
2010-07-01,DJ,"""OY"" TO THE WORLD",,2000,"Among Hindu deities, Vishnu is the preserver & Shiva is this",the destroyer,NA
2010-07-01,FJ,MONARCHS,,NA,Cairo's Al-Rifai mosque is the resting place of 2 Egyptian kings & of a 20th century ruler of this Mideast country,Iran,NA
