date,round,category,comment,value,clue,response,link
2010-07-20,J,TOP U.S. FRANCHISES,,200,"Oh, thank heaven for this largest chain of convenience stores where you can get a Big Gulp day or night",7-Eleven,NA
2010-07-20,J,CLASSIC MOVIE ORIGINAL DIALOGUE?,(Alex: You have to identify the film for us.),200,"""No thanks, Mrs. Robinson.  I don't know what a 'cougar' is & I don't think I want to find out.  Is Elaine home?""",The Graduate,NA
2010-07-20,J,"HELLO, DOLL-Y",,200,This type of doll represents a particular person; sticking pins in it is said to reinforce spells cast on that person,a voodoo doll,NA
2010-07-20,J,CREATURES OF NATURE,,200,"Taking the 'go"" out of escargot, this mollusk is said to be able to lie dormant for months at a time",the snail,NA
2010-07-20,J,1984,,200,January 1:This Southeast Asian sultanate gains its full independence from Great Britain,Brunei,NA
2010-07-20,J,"BIG ""BROTHER""",,200,Zeppo or Gummo,Marx Brothers,NA
2010-07-20,J,TOP U.S. FRANCHISES,,400,"Ante up the money & you can have one of these hardware stores; it's ""the helpful place""",Ace,NA
2010-07-20,J,CLASSIC MOVIE ORIGINAL DIALOGUE?,(Alex: You have to identify the film for us.),400,"""Oh, geez... George, it turns out Bedford Falls would be better off if you'd never been born.  Now... this is awkward""",It\'s a Wonderful Life,NA
2010-07-20,J,"HELLO, DOLL-Y",,400,"In the 1880s this inventor reduced the size of a phonograph so that it could fit inside a doll & make it ""talk""",Edison,NA
2010-07-20,J,CREATURES OF NATURE,,400,The peregrine type of this bird can reach speeds of 200 mph in a dive,a falcon,NA
2010-07-20,J,1984,,400,January 24:Apple introduces this influential  computer model,the Macintosh,NA
2010-07-20,J,"BIG ""BROTHER""",,400,"A sibling by marriage, not genetics",a brother-in-law (or step-brother),NA
2010-07-20,J,TOP U.S. FRANCHISES,,600,"""Grill & chill"" with this franchise that's been serving up its soft-serve ice cream since 1940",Dairy Queen,NA
2010-07-20,J,CLASSIC MOVIE ORIGINAL DIALOGUE?,(Alex: You have to identify the film for us.),600,"""No, no, no, I'm Antoninus! I'm not that guy!  You want him!  He's right there!  The one that looks like Kirk Douglas""",Spartacus,NA
2010-07-20,J,"HELLO, DOLL-Y",,600,"Mattel has announced 2 new ""I Can Be..."" dolls of her: news anchor & computer engineer",Barbie,NA
2010-07-20,J,CREATURES OF NATURE,,600,See this alliterative sea creature?  It can pack a 300- to 650-volt wallop,an electric eel,http://www.j-archive.com/media/2010-07-20_J_23.jpg
2010-07-20,J,1984,,600,"May 19:Led by a Great One, this Canadian team takes its first Stanley Cup",the Edmonton Oilers,NA
2010-07-20,J,"BIG ""BROTHER""",,600,5-word nickname of Philadelphia,"""The City of Brotherly Love""",NA
2010-07-20,J,TOP U.S. FRANCHISES,,NA,This women-only circuit-training fitness center began franchising in 1995,Curves,NA
2010-07-20,J,CLASSIC MOVIE ORIGINAL DIALOGUE?,(Alex: You have to identify the film for us.),800,"""No.  Wilson woulda killed you, Terry.  You wouldn't have been a contender, just a bum, which is what you are.  Sorry.""",On the Waterfront,NA
2010-07-20,J,"HELLO, DOLL-Y",,800,"Chrissa Maxwell, who moved to Minnesota to live with her grandmother, is the 2009 girl of the year in this line",American Girl,NA
2010-07-20,J,CREATURES OF NATURE,,800,"Now known as an insurance mascot, this type of lizard gets a grip using its roughly 14,000 setae on each footpad",a gecko,NA
2010-07-20,J,1984,,800,August 21:Half a million people march through the streets of Manila protesting this president's rule,Marcos,NA
2010-07-20,J,"BIG ""BROTHER""",,800,Sanguine term for a steadfast friend,a blood brother,NA
2010-07-20,J,TOP U.S. FRANCHISES,,1000,"Begun in Japan, this chain of math & reading centers ranks as the top tutoring services franchise",Kumon,NA
2010-07-20,J,CLASSIC MOVIE ORIGINAL DIALOGUE?,(Alex: You have to identify the film for us.),1000,"""Oh, Rosebud!  I thought you said something else.  That was his sled.  That all you need?  I'm kinda busy""",Citizen Kane,NA
2010-07-20,J,"HELLO, DOLL-Y",,1000,This doll with the red-&-white striped legs & red yarn hair was created by cartoonist Johnny Gruelle in 1915,Raggedy Ann,NA
2010-07-20,J,CREATURES OF NATURE,,1000,The Hercules type of this insect can lift things 850 times its own weight,a beetle,NA
2010-07-20,J,1984,,1000,Jan. 3:Syria frees a U.S. Navy flier following a visit from this U.S. politician; June 27: Cuba frees 48 prisoners ditto,Jesse Jackson,NA
2010-07-20,J,"BIG ""BROTHER""",,1000,"The title of this WWII-set miniseries is also a phrase from Shakespeare's ""Henry V""",Band of Brothers,NA
2010-07-20,DJ,GEOMETRY,,400,A cube has this many sides,6,NA
2010-07-20,DJ,PRO NOUNS,,400,"Pro golfers know this term for an assistant comes from Latin for ""head""",caddie,NA
2010-07-20,DJ,OPERA CHARACTERS,,400,"In various versions of ""Othello"", she's smothered, strangled or stabbed to death",Desdemona,NA
2010-07-20,DJ,CAN YOU PICTURE IT?,,400,"In 2008, this leader went from president to prime minister, but he's still very powerful",Putin,http://www.j-archive.com/media/2010-07-20_DJ_21.jpg
2010-07-20,DJ,STATE LAKES,"(Alex: We'll give you the lake, you identify the state for us.)",400,Yellowstone Lake,Wyoming,NA
2010-07-20,DJ,FROM THE GREEK,,400,"Greek gives us this word for a poetic foot of 2 syllables, an unstressed followed by a stressed",iamb,NA
2010-07-20,DJ,GEOMETRY,,800,"(Sarah of the Clue Crew shows a geometric animation on the monitor.)  When three boxes form a right triangle, the sum of the squares in the top two boxes is equal to the number of squares in the larger box, illustrating this geometric theorem",the Pythagorean theorem,http://www.j-archive.com/media/2010-07-20_DJ_12.wmv
2010-07-20,DJ,PRO NOUNS,,800,Baseball pros are familiar with this geometric name for the area where the next hitter waits his turn,the on-deck circle,NA
2010-07-20,DJ,OPERA CHARACTERS,,800,"Yum-Yum, who is due to marry Ko-Ko, falls in love with the minstrel Nanki-Poo in this operetta",The Mikado,NA
2010-07-20,DJ,CAN YOU PICTURE IT?,,800,He's the multiple gold medal-winning Olympian seen here,Jesse Owens,http://www.j-archive.com/media/2010-07-20_DJ_22a.jpg
2010-07-20,DJ,STATE LAKES,"(Alex: We'll give you the lake, you identify the state for us.)",800,Grand Lake O' the Cherokees,Oklahoma,NA
2010-07-20,DJ,FROM THE GREEK,,800,"This bowl-shaped depression at the mouth of a volcano is from the Greek for ""mixing vessel""",crater,NA
2010-07-20,DJ,GEOMETRY,,1200,"No matter how many sides a convex polygon has, the sum of its exterior angles will always equal this many degrees",360,NA
2010-07-20,DJ,PRO NOUNS,,1200,A tennis pro can teach you not to step over the baseline while you serve--that would be one of these,a foot fault,NA
2010-07-20,DJ,OPERA CHARACTERS,,NA,"A one-act opera based on an episode in ""Great Expectations"" is called this woman's ""Wedding night""",Miss Havisham,NA
2010-07-20,DJ,CAN YOU PICTURE IT?,,1200,The tattoo seen here was made with this reddish-orange dye,henna,http://www.j-archive.com/media/2010-07-20_DJ_23.jpg
2010-07-20,DJ,STATE LAKES,"(Alex: We'll give you the lake, you identify the state for us.)",1200,Lake Shasta,California,NA
2010-07-20,DJ,FROM THE GREEK,,NA,"The name of this learning disability is partly from the Greek for 'word""",dyslexia,NA
2010-07-20,DJ,GEOMETRY,,1600,"An ellipse's center of symmetry is midway between these 2 points, abbreviated f.",foci,NA
2010-07-20,DJ,PRO NOUNS,,1600,In pro basketball it's a violation to stay in this part of the court for more than 3 seconds,the paint,NA
2010-07-20,DJ,OPERA CHARACTERS,,1600,This widower & hunchback is the court jester to the Duke of Mantua,Rigoletto,NA
2010-07-20,DJ,CAN YOU PICTURE IT?,,1600,"Seen here, the largest high relief sculpture in the world is located in this state",Georgia,http://www.j-archive.com/media/2010-07-20_DJ_24a.jpg
2010-07-20,DJ,STATE LAKES,"(Alex: We'll give you the lake, you identify the state for us.)",1600,Sam Rayburn Lake,Texas,NA
2010-07-20,DJ,FROM THE GREEK,,1600,"(Alex reports from a Ford Motor Company plant in Dearborn, MI.)  To make jobs easier & safer, trucks on the assembly line are raised or lowered on these accordion lifts, which are called skillets; it's an example of this science of practical human engineering; it comes from the Greek word which means ""work""",ergonomics,http://www.j-archive.com/media/2010-07-20_DJ_29.wmv
2010-07-20,DJ,GEOMETRY,,2000,(Sarah of the Clue Crew shows a geometric animation on the monitor.)  Two identical regular pyramids with square bases attached base to base form the regular type of this geometrical figure in which all faces are equilateral triangles,an octahedron,http://www.j-archive.com/media/2010-07-20_DJ_15.wmv
2010-07-20,DJ,PRO NOUNS,,2000,"In pro hockey, it's 64 feet from the goal line to this line",the blue line,NA
2010-07-20,DJ,OPERA CHARACTERS,,2000,"Characters in this John Adams opera include Chou En-lai, Chairman Mao & Henry Kissinger",Nixon in China,NA
2010-07-20,DJ,CAN YOU PICTURE IT?,,2000,"It's the cave where the work seen here was found; obviously, it was home to some of the first muralists",Lascaux,http://www.j-archive.com/media/2010-07-20_DJ_25.jpg
2010-07-20,DJ,STATE LAKES,"(Alex: We'll give you the lake, you identify the state for us.)",2000,Lake Peekskill,New York,NA
2010-07-20,DJ,FROM THE GREEK,,2000,It can be an introductory scene of a play or an introductory verse of a poem,prologue,NA
2010-07-20,FJ,LEGENDARY PUBLIC SERVANTS,,NA,"In 1929 he became a special agent with the Treasury Department's Prohibition Bureau, Chicago Division",Eliot Ness,NA
