date,round,category,comment,value,clue,response,link
2010-10-12,J,"GOODBYE, COLUMBUS",,200,"Ya, mon!  On June 29, 1504 Columbus was rescued from this island where he'd been shipwrecked for a year",Jamaica,NA
2010-10-12,J,ALIASES,,200,"Bruce Banner, who learned it's not easy being green",The Hulk,NA
2010-10-12,J,"""DOLLAR""S & ""CENT""S",,200,"In a song from ""Annie"", ""The sun'll come out tomorrow, bet"" this ""that tomorrow there'll be sun""",your bottom dollar,NA
2010-10-12,J,VWLLSS NTNS,(Alex: VOWELLESS NATIONS.),200,An archipelago:FJ,Fiji,NA
2010-10-12,J,HOME SWEET HOME,,200,It's located at 3734 Elvis Presley Boulevard in Memphis,Graceland,NA
2010-10-12,J,ALSO A BODY PART,,200,It's the hole in a needle,eye,NA
2010-10-12,J,"GOODBYE, COLUMBUS",,400,"Columbus said goodbye for good in this year, 14 years after he set out on his most famous voyage",1506,NA
2010-10-12,J,ALIASES,,400,"Diedrich Knickerbocker, a ""sleepy"" novelist",Washington Irving,NA
2010-10-12,J,"""DOLLAR""S & ""CENT""S",,400,"Clint Eastwood starred in this 1964 Spaghetti Western & its sequel, ""For a Few Dollars More""",A Fistful of Dollars,NA
2010-10-12,J,VWLLSS NTNS,(Alex: VOWELLESS NATIONS.),400,In the North Atlantic:CLND,Iceland,NA
2010-10-12,J,HOME SWEET HOME,,400,"The house where she wrote ""Silent Spring"" is a National Historic Monument in Silver Spring, Maryland",Rachel Carson,NA
2010-10-12,J,ALSO A BODY PART,,400,Verb meaning to be in charge of a committee or organization,head,NA
2010-10-12,J,"GOODBYE, COLUMBUS",,600,"On Christmas Day 1492, Columbus waved a sad bye-bye to this ship after it ran aground",the Santa Maria,NA
2010-10-12,J,ALIASES,,600,"""Lady Day"", a nickname originated by sax man Lester Young",Billie Holiday,NA
2010-10-12,J,"""DOLLAR""S & ""CENT""S",,600,Situated next to,adjacent,NA
2010-10-12,J,VWLLSS NTNS,(Alex: VOWELLESS NATIONS.),600,Off the coast of Africa:CP VRD,Cape Verde,NA
2010-10-12,J,HOME SWEET HOME,,600,Seen here is a partial view of her childhood home in Alabama in the 1950s; notice the water pump,Helen Keller,http://www.j-archive.com/media/2010-10-12_J_23.jpg
2010-10-12,J,ALSO A BODY PART,,600,"When you pick up a tab, you do this to ""the bill""",foot,NA
2010-10-12,J,"GOODBYE, COLUMBUS",,800,"Sometime before 1477, Columbus bade farewell to this Italian city of his birth",Genoa,NA
2010-10-12,J,ALIASES,,NA,"Harry Longabaugh, whose nickname came from the Wyoming town in which he was imprisoned",The Sundance Kid,NA
2010-10-12,J,"""DOLLAR""S & ""CENT""S",,800,This policy aims to encourage the investment of capital in foreign countries,dollar diplomacy,NA
2010-10-12,J,VWLLSS NTNS,(Alex: VOWELLESS NATIONS.),800,In Africa:THP,Ethiopia,NA
2010-10-12,J,HOME SWEET HOME,,800,"Spanish for ""Sea to Lake"" this Palm Beach estate was home to Donald Trump & earlier, Marjorie Merriweather Post",Mar-a-Lago,NA
2010-10-12,J,ALSO A BODY PART,,800,"Slang for a bar or nightclub; in ""Casablanca"", Humphrey Bogart refers to a ""gin"" one",joint,NA
2010-10-12,J,"GOODBYE, COLUMBUS",,1000,"On April 16, 1503, on his last voyage, Columbus left Rio Belen in what's now this narrow country",Panama,NA
2010-10-12,J,ALIASES,,1000,"Sir Percy Blakeney, a ""colorful"" fop with a sword",The Scarlet Pimpernel,NA
2010-10-12,J,"""DOLLAR""S & ""CENT""S",,1000,The star system closest to our sun is the Alpha system in this constellation in the southern hemisphere,Centauri,NA
2010-10-12,J,VWLLSS NTNS,(Alex: VOWELLESS NATIONS.),1000,In South America:CDR,Ecuador,NA
2010-10-12,J,HOME SWEET HOME,,1000,"In 1839, this president bought Lindenwald, the estate he would retire to, in Kinderhook",Van Buren,NA
2010-10-12,J,ALSO A BODY PART,,1000,Part of the face that also means to have a friendly chat,jaw (or chin),NA
2010-10-12,DJ,FLAGS & ANTHEMS,,400,"A 1999 law officially adopted this country's rising sun flag & its anthem, whose title means ""his majesty's reign""",Japan,NA
2010-10-12,DJ,BEFORE & AFTER AT THE MOVIES,,400,Simba climbs to the top of the Empire State Building with Fay Wray in his arms,The Lion King Kong,NA
2010-10-12,DJ,DIVAS,,400,Italian soprano Renata Tebaldi was chosen by Toscanini to sing at the reopening of this Milan opera house in 1946,La Scala,NA
2010-10-12,DJ,SPANISH TO ENGLISH,,400,A culinary profession: panadero,baker (breadmaker acceptable),NA
2010-10-12,DJ,PRINCESS,,400,"In his novels, Luthien Tinuviel was daughter of Thingol Greycloak, greatest of the Grey-elven kings",Tolkien,NA
2010-10-12,DJ,DIARIES,,400,"On July 25, 1945 this president wrote, ""We have discovered the most terrible bomb in the history of the world""",Harry Truman,NA
2010-10-12,DJ,FLAGS & ANTHEMS,,800,The blue field of Somalia's flag was influenced by the flag of this organization,the United Nations,NA
2010-10-12,DJ,BEFORE & AFTER AT THE MOVIES,,800,A mouse-like boy runs afoul of a carnivorous plant,Stuart Little Shop of Horrors,NA
2010-10-12,DJ,DIVAS,,800,"As a 13-year-old, she moved to Greece with her mother & the family name was changed back to Kalogeropoulos",Maria Callas,NA
2010-10-12,DJ,SPANISH TO ENGLISH,,800,"A proverb: ""no hay tiempo como el presente""","""there is no time like the present""",NA
2010-10-12,DJ,PRINCESS,,800,"She was adopted, but still managed to become an Imperial senator, representing Alderaan",(Princess) Leia,NA
2010-10-12,DJ,DIARIES,,800,"In her journals Anne Morrow called him ""a knight in shining armor, with myself as his devoted page""",Lindbergh,NA
2010-10-12,DJ,FLAGS & ANTHEMS,,1200,"(Kelly of the Clue Crew stands in front of a map of the Middle East.) Perhaps to distinguish it from neighboring Bahrain's flag, this country chose mauve for its dual-tone flag",Qatar,http://www.j-archive.com/media/2010-10-12_DJ_04.jpg
2010-10-12,DJ,BEFORE & AFTER AT THE MOVIES,,1200,A schoolteacher travels to Siam & finds herself the only living person left in New York City,The King and I Am Legend,NA
2010-10-12,DJ,DIVAS,,1200,"Bet this Australian was ""toasty"" with the fur she often wore around her neck to keep her throat warm",(Nellie) Melba,NA
2010-10-12,DJ,SPANISH TO ENGLISH,,1200,It's found in a toolbox: martillo,a hammer,NA
2010-10-12,DJ,PRINCESS,,1200,The warring countries of Guilder & Florin propel the action in this William Goldman tale,The Princess Bride,NA
2010-10-12,DJ,DIARIES,,1200,"In 1662 his diary contained the first known British reference to Punchinello, later shortened to Punch",(Samuel) Pepys,NA
2010-10-12,DJ,FLAGS & ANTHEMS,,1600,"In 1922, after 91 years as an instrumental, this S. Amer. country's anthem got words calling it ""a brave colossus""",Brazil,NA
2010-10-12,DJ,BEFORE & AFTER AT THE MOVIES,,1600,Fanny Brice takes over for Diana Ross in a biopic,Funny Lady Sings the Blues,NA
2010-10-12,DJ,DIVAS,,NA,"The Met's Rudolph Bing refused to hire this diva known as ""Bubbles"" because she hadn't been trained in Europe",Beverly Sills,NA
2010-10-12,DJ,SPANISH TO ENGLISH,,1600,A delicious fruit:manzana,an apple,NA
2010-10-12,DJ,PRINCESS,,1600,"The 1884 satiric opera ""Princess Ida"" by this pair was inspired by a poem",Gilbert & Sullivan,NA
2010-10-12,NA,NA,NA,NA,NA,NA,NA
2010-10-12,DJ,FLAGS & ANTHEMS,,2000,Bosnia's constitutional court banned the anthem of this other former Yugoslav republic,Serbia,NA
2010-10-12,DJ,BEFORE & AFTER AT THE MOVIES,,2000,Julia Roberts escapes from getting married to an evil doll boy,Runaway Bride of Chucky,NA
2010-10-12,NA,NA,NA,NA,NA,NA,NA
2010-10-12,DJ,SPANISH TO ENGLISH,,2000,In computer lingo: the 4-letter equivalent of correo basura,spam,NA
2010-10-12,DJ,PRINCESS,,NA,"This ""flowery"" J.M. Barrie princess was called ""the most beautiful of the dusky Dianas""",Tiger Lily,NA
2010-10-12,NA,NA,NA,NA,NA,NA,NA
2010-10-12,FJ,SHAKESPEARE,,NA,"These 2 ""King Lear"" characters, 1 male, 1 female, both represent truthfulness; one disappears when the other returns",Cordelia and the Fool,NA
