date,round,category,comment,value,clue,response,link
2010-11-18,J,IT HAPPENED IN THE PAST,,200,"On Feb. 10, 1985 this African man said, ""Only free men can negotiate; prisoners cannot enter into contracts""",Nelson Mandela,NA
2010-11-18,J,WIDE WORLD OF WEIRD SPORTS,,200,"In kabbadi, one team member tries to tag out as many of the opposing team while holding this as long as possible",one\'s breath,NA
2010-11-18,J,RAW FOOD,,200,This food tartare originated in medieval Russia,steak,NA
2010-11-18,J,"PLANES, TRAINS & AUTOMOBILES",,200,"16th Street Mission is a station in this city on the rail system called BART, or Bay Area Rapid Transit",San Francisco,NA
2010-11-18,J,OFFICIAL STATE STUFF,,200,West Virginia's state tree is sugar type of this,the maple,NA
2010-11-18,J,THAT'S JUST WRONG,,200,A Freudian this is said to be when you mean one thing but say your mother,slip,NA
2010-11-18,J,IT HAPPENED IN THE PAST,,400,"A Senate report showed his govt., deposed in 2003, stole billions from the U.N.'s Oil-for-Food program",(Saddam) Hussein,NA
2010-11-18,J,WIDE WORLD OF WEIRD SPORTS,,400,"Doing it in unusual places turns this household task into an ""extreme"" sport for some; got spray starch?",ironing,NA
2010-11-18,J,RAW FOOD,,400,A restaurant called Que Seraw Seraw makes this with organic buckwheat crust & macadamia cheese,pizza,NA
2010-11-18,J,"PLANES, TRAINS & AUTOMOBILES",,400,The Silver Cloud & The Silver Ghost are classic models from this alliterative luxury automaker,Rolls-Royce,NA
2010-11-18,J,OFFICIAL STATE STUFF,,400,The state bird of Indiana is this red bird,the cardinal,NA
2010-11-18,J,THAT'S JUST WRONG,,400,2 missed serves in tennis will get you a double this,fault,NA
2010-11-18,J,IT HAPPENED IN THE PAST,,600,"On March 3, 1873, amid pre-inaugural festivity, Congress quietly passed a law increasing these by 50%, retroactive 2 years",salaries,NA
2010-11-18,J,WIDE WORLD OF WEIRD SPORTS,,600,"Up for a game of sepak takraw? Popular in Asia, it's basically this beach team game but using only the feet",volleyball,NA
2010-11-18,J,RAW FOOD,,600,"We don't have any food ideas for raw Yukon Gold or other types of these, but they're supposed to help with warts",potatoes,NA
2010-11-18,J,"PLANES, TRAINS & AUTOMOBILES",,600,"In the Disney film of the same name, the ""Love Bug"" was a Beetle from this automaker",Volkswagen,NA
2010-11-18,J,OFFICIAL STATE STUFF,,600,Georgia's official state vegetable is the vidalia sweet this,onion,NA
2010-11-18,J,THAT'S JUST WRONG,,600,"From the Latin for ""to deceive"", it can precede teeth or sense of security",false,NA
2010-11-18,J,IT HAPPENED IN THE PAST,,800,"On Sept. 3, 1658 this Lord Protector of England stopped breathing (& protecting)",Oliver Cromwell,NA
2010-11-18,J,WIDE WORLD OF WEIRD SPORTS,,800,"The ""charming"" of these annelids from the ground has evolved into an annual world championship in Cheshire, England",worms,NA
2010-11-18,J,RAW FOOD,,800,The danger of eating unbaked cookie dough is mainly due to this ingredient,eggs,NA
2010-11-18,J,"PLANES, TRAINS & AUTOMOBILES",,800,This supersonic transport made its last flights in 2003 after British Airways & Air France canceled service,the Concorde,NA
2010-11-18,J,OFFICIAL STATE STUFF,,800,"Alabama's motto is ""We dare maintain our"" these",rights,NA
2010-11-18,J,THAT'S JUST WRONG,,800,"Children's author Mo Willems penned ""Knuffle Bunny Too: A Case of"" this ""identity""",Mistaken,NA
2010-11-18,J,IT HAPPENED IN THE PAST,,NA,"On July 26, 1956 Egypt seized control of this geographic feature from its French & British owners",the Suez Canal,NA
2010-11-18,J,WIDE WORLD OF WEIRD SPORTS,,1000,"Also called noodling, the grabbing or grabbling of these large fish is popular in Mississippi",catfish,NA
2010-11-18,J,RAW FOOD,,1000,"Some sushi restaurants also serve this similar food, from the Japanese for ""stab the body""",sashimi,NA
2010-11-18,J,"PLANES, TRAINS & AUTOMOBILES",,1000,In 1967 the Douglas Aircraft Company merged with this aircraft company,McDonnell,NA
2010-11-18,J,OFFICIAL STATE STUFF,,1000,"Native to Idaho, the cutthroat type of this is the state fish",trout,NA
2010-11-18,J,THAT'S JUST WRONG,,1000,"Proverbially, when you find you're wrong, you ""see the"" this 5-letter word ""of your ways""",error,NA
2010-11-18,DJ,PEOPLE & PLACES,,400,"5-letter word for the leader of an African (as well as an Indian) tribe, like the moro-naba of Ouagadougou",a chief,NA
2010-11-18,DJ,MUSIC ALIASES,,400,"Alecia Moore got this nickname as a child, years before she dyed her hair accordingly",Pink,NA
2010-11-18,NA,NA,NA,NA,NA,NA,NA
2010-11-18,DJ,MATH SYMBOLS,,400,"(Jimmy of the Clue Crew explains an equation on the monitor.) The big ""E"" is actually the Greek letter sigma; in math, it means to do this to a series of terms--here, from 1 to 3",sum them (or add them),http://www.j-archive.com/media/2010-11-18_DJ_17.jpg
2010-11-18,DJ,19th CENTURY LITERARY CHARACTERS,,400,This character from an 1819 tale missed the American revolution; he was asleep,Rip Van Winkle,NA
2010-11-18,DJ,LONG ONE-SYLLABLE WORDS,,400,"(8 letters) Overtwisted, like an injured knee",strained,NA
2010-11-18,NA,NA,NA,NA,NA,NA,NA
2010-11-18,DJ,MUSIC ALIASES,,800,"""The Fame Monster"" has struck for Stefani Germanotta, now better known as this",Lady Gaga,NA
2010-11-18,NA,NA,NA,NA,NA,NA,NA
2010-11-18,DJ,MATH SYMBOLS,,800,"The symbol here says ""A"" is this with respect to ""B""; more than 2 words",less than or equal to,http://www.j-archive.com/media/2010-11-18_DJ_16.jpg
2010-11-18,DJ,19th CENTURY LITERARY CHARACTERS,,800,Cassy & Emmeline escape from this slave owner after the 2 convince him his house is haunted,Simon Legree,NA
2010-11-18,DJ,LONG ONE-SYLLABLE WORDS,,800,"(8 letters) What the mouse said, or, with ""by"", describing narrow victory",squeaked,NA
2010-11-18,DJ,PEOPLE & PLACES,,1200,"The Circassians are among the many peoples of this region, Kavkaz in Russian",the Caucasus,NA
2010-11-18,DJ,MUSIC ALIASES,,1200,The rapper born Bobby Ray Simmons goes by these 3 letters,B.o.B.,NA
2010-11-18,DJ,THE AGE OF CHIVALRY,,1200,"A peasant might play his cards close to his jerkin, a type of this",a vest,NA
2010-11-18,DJ,MATH SYMBOLS,,1200,"(Kelly of the Clue Crew explains an expression on the monitor.) The vertical bars around the negative 3 indicate this, also known as numerical value",absolute value,http://www.j-archive.com/media/2010-11-18_DJ_15.jpg
2010-11-18,DJ,19th CENTURY LITERARY CHARACTERS,,1200,"Alphabetically last of the 3 musketeers, he has a ""somewhat vainglorious strength""",Porthos,NA
2010-11-18,DJ,LONG ONE-SYLLABLE WORDS,,1200,(8 letters) Injuriously long periods of low precipitation,droughts,NA
2010-11-18,DJ,PEOPLE & PLACES,,1600,"The Lao Loum live in the lowlands; the Lao Theung, on the slopes; Lao Soung means people of here",mountain tops,NA
2010-11-18,DJ,MUSIC ALIASES,,1600,"To avoid confusion with Davy Jones of The Monkees, British singer Davey Jones took this last name for his ""Golden Years""",Bowie,NA
2010-11-18,DJ,THE AGE OF CHIVALRY,,1600,"To become skilled using this long spear, a squire would practice against a wooden dummy called a quintain",a lance,NA
2010-11-18,DJ,MATH SYMBOLS,,1600,We're pretty sure you can give us the name of this symbol that denotes a range of uncertainty,plus or minus,http://www.j-archive.com/media/2010-11-18_DJ_13.jpg
2010-11-18,DJ,19th CENTURY LITERARY CHARACTERS,,1600,"Alice questions reality after these 2 say she's only a character in the Red King's dream; ooo, 19th century ""Inception""!",Tweedledee and Tweedledum,NA
2010-11-18,DJ,LONG ONE-SYLLABLE WORDS,,1600,"(7 letters) German for ""German""",deutsch,NA
2010-11-18,DJ,PEOPLE & PLACES,,2000,"For at least the sixth time, the Al-Houthis are revolting along this country's northern border with Saudi Arabia",Yemen,NA
2010-11-18,DJ,MUSIC ALIASES,,2000,"William Bailey used this stage name when he sang on hits like ""Welcome to the Jungle""",Axl Rose,NA
2010-11-18,DJ,THE AGE OF CHIVALRY,,2000,"The term ""chivalry"" comes from this French word meaning ""one who rides a horse""",chevalier,NA
2010-11-18,DJ,MATH SYMBOLS,,NA,"(Sarah of the Clue Crew explains an equation on the monitor.)  In math, an exclamation mark is called a factorial symbol; it means to do this with every positive integer of equal or lesser value--in this case, equal to 120",multiply it,http://www.j-archive.com/media/2010-11-18_DJ_14.jpg
2010-11-18,DJ,19th CENTURY LITERARY CHARACTERS,,2000,"This ""obscure"" guy marries Arabella but really wants to revisit Sue Bridehead",Jude the Obscure,NA
2010-11-18,DJ,LONG ONE-SYLLABLE WORDS,,2000,(8 letters) Vigor,strength,NA
2010-11-18,FJ,EUROPEAN COUNTRIES,,NA,"German is its official national language; Croatian, Slovene & Hungarian are each official in one of its states",Austria,NA
