date,round,category,comment,value,clue,response,link
1989-09-28,J,TRANSPORTATION,,100,"In Manhattan, most of these outdoor train lines have been torn down to eliminate noise & dirt",EL,NA
1989-09-28,J,"""STREET""S",,100,One is said to be on this street if he's financially independent,"""Easy Street""",NA
1989-09-28,J,MEXICO,,100,"The name for this hat comes from ""sombra"" the Spanish word for shade",Sombrero,NA
1989-09-28,J,MEDICINE,,100,Malocclusion is a problem with these body parts,Teeth,NA
1989-09-28,J,MONTHS,,100,"Though they come 4th & 8th in the order of months, they're 1st & 2nd alphabetically",April & August,NA
1989-09-28,J,MARILYN MONROE,,100,Marilyn claimed to be a direct descendant of this U.S. president,James Monroe,NA
1989-09-28,J,TRANSPORTATION,,200,Chrysler executive who developed the Ford Mustang,Lee Iacocca,NA
1989-09-28,J,"""STREET""S",,200,"Although nominated 4 times, Karl Malden never won an Emmy for this TV police series","""The Streets of San Francisco""",NA
1989-09-28,J,MEXICO,,200,Mexico City is home to the world's largest arena devoted to this sport,Bullfighting,NA
1989-09-28,J,MEDICINE,,200,Lack of coordination between these matching organs is called strabismus,Eyes,NA
1989-09-28,J,MONTHS,,200,All Hallows' Eve & All Saints Day fall in these 2 months,October & November,NA
1989-09-28,J,MARILYN MONROE,,200,"In the fall of 1953 Marilyn made her TV debut on this ""stingy"" comedian's program",Jack Benny,NA
1989-09-28,J,TRANSPORTATION,,300,"The 1st type of this railroad car was the ""Delmonico"" built by Pullman in 1868",Restaurant/Dining Car,NA
1989-09-28,J,"""STREET""S",,300,"At the age of 61, this actor made his film debut as the ponderous Kasper Gutman in ""The Maltese Falcon""",Sydney Greenstreet,NA
1989-09-28,J,MEXICO,,300,"""Joy of Cooking"" calls this strong liquor ""The Gulp of Mexico""",Tequila,NA
1989-09-28,J,MEDICINE,,300,Studies show patients treated with TPA rarely need an angioplasty after this event,Heart Attack,NA
1989-09-28,J,MONTHS,,300,The 2 months that fit in a 4-letter word category,June & July,NA
1989-09-28,J,MARILYN MONROE,,300,In 1956 Marilyn converted to Judaism before she married this playwright,Arthur Miller,NA
1989-09-28,J,TRANSPORTATION,,400,Directional axis of odd-numbered interstate highways,North-South,NA
1989-09-28,J,"""STREET""S",,400,"In this song you should ""Grab your coat & get your hat, leave your worry on the doorstep""","""On the Sunny Side of the Street""",NA
1989-09-28,J,MEXICO,,400,The 2 countries in the western hemisphere whose populations are larger than Mexico's,Brazil & USA,NA
1989-09-28,J,MEDICINE,,400,"The common name for urticaria, a rash characterized by small red bumps",Hives,NA
1989-09-28,J,MONTHS,,400,These 2 months refer to a younger person - older person relationship,May & December,NA
1989-09-28,J,MARILYN MONROE,,400,"At Marilyn's funeral, this director of The Actors Studio, with whom she once studied, gave the eulogy",Lee Strasberg,NA
1989-09-28,NA,NA,NA,NA,NA,NA,NA
1989-09-28,J,"""STREET""S",,500,"Irene Dunne, Margaret Sullavan & Susan Hayward have all been in film versions of this Hurst novel","""Backstreet""",NA
1989-09-28,J,MEXICO,,500,Mexico leads the world in the production of this precious metal,Silver,NA
1989-09-28,J,MEDICINE,,500,"Also called cephalagia, these can be caused by pressure on the cranial or cervical nerves",Headaches,NA
1989-09-28,J,MONTHS,,NA,The 2 months in which the sun is directly above the equator for part of a day,March & September,NA
1989-09-28,J,MARILYN MONROE,,500,"Marilyn sang a sexy rendition of ""Heat Wave"" in this 1954 movie musical","""There\'s No Business Like Show Business""",NA
1989-09-28,DJ,THE QUEEN'S ENGLISH,,200,England's monetary system no longer uses the penny; the smallest denomination is now called this,New Pence,NA
1989-09-28,DJ,CLASSICAL MUSIC,,200,"Richard Horowitz, a timpanist with the Met, makes these sticks that a conductor uses",Batons,NA
1989-09-28,DJ,PEOPLE,,200,"""Today"" Show weatherman Willard Scott was the 1st to play this clown for McDonald's",Ronald McDonald,NA
1989-09-28,DJ,FURNITURE,,200,The Bible says this wise king had a throne of ivory overlaid with gold & decorated with lions,Solomon,NA
1989-09-28,DJ,U.S. HISTORY,,200,"This receiving station for immigrants in New York Bay opened January 1, 1892",Ellis Island,NA
1989-09-28,DJ,LITERARY ISLANDS,,200,"Jay Gatsby lived at West Egg on this, New York's largest island",Long Island,NA
1989-09-28,DJ,THE QUEEN'S ENGLISH,,400,"This mild interjection is from a contraction of ""God Blind Me!""","""Blimey!""",NA
1989-09-28,DJ,CLASSICAL MUSIC,,400,"Indian-born music director of the Israel Philharmonic, he also conducts the New York Philharmonic",Zubin Mehta,NA
1989-09-28,DJ,PEOPLE,,400,This movie star left his wife down under for actress Linda Kozlowski,Paul Hogan,NA
1989-09-28,DJ,FURNITURE,,400,"The French word for ""chair"", it can be followed by ""courante"", ""volante"" or ""longue""",Chaise,NA
1989-09-28,DJ,U.S. HISTORY,,400,"On March 3, 1847 Congress authorized the 1st ones of these, & with adhesive backs to boot",Postage Stamps,NA
1989-09-28,DJ,LITERARY ISLANDS,,400,"While on Jackson's Island, he met Jim, Miss Watson's runaway slave",Huck Finn,NA
1989-09-28,DJ,THE QUEEN'S ENGLISH,,600,"British TV's ""Steptoe & Son"" was about a rag-and-bone man; U.S. equivalent ""Sanford & Son"", was about this",Junk Dealers,NA
1989-09-28,DJ,CLASSICAL MUSIC,,600,A Ft. Worth piano contest is named for this winner of the 1958 Int'l Tchaikovsky Competition,Van Cliburn,NA
1989-09-28,DJ,PEOPLE,,600,"A Yankee broadcaster for 18 yrs., this former Cardinal player became president of the N.L. in 1989",Bill White,NA
1989-09-28,DJ,FURNITURE,,600,Rustic style of American furniture named for mountains in upstate New York,Adirondack,NA
1989-09-28,DJ,U.S. HISTORY,,600,"In December 1962, this country agreed to let 1,113 POWs go in exchange for over $50 mil. in U.S. supplies",Cuba,NA
1989-09-28,DJ,LITERARY ISLANDS,,600,Norman Mailer novel in which a platoon invades the Japanese-held island of Anopopei,"""The Naked and the Dead""",NA
1989-09-28,NA,NA,NA,NA,NA,NA,NA
1989-09-28,DJ,CLASSICAL MUSIC,,NA,"For the 1991-2 bicentennial of this composer's death, 800 of his works will be performed at Lincoln Center",W.A. Mozart,NA
1989-09-28,DJ,PEOPLE,,800,The Kennedy who announced he & wife Sheila would separate & he would not run for Mass. governor in 1990,Joseph Kennedy II,NA
1989-09-28,DJ,FURNITURE,,NA,"The practice of weaving long strips of rattan or other material to make seats, backs of chairs, etc.",Caning,NA
1989-09-28,DJ,U.S. HISTORY,,800,An 1886 labor rally in this city's Haymarket Square turned into a riot,Chicago,NA
1989-09-28,DJ,LITERARY ISLANDS,,800,"A coral island, probably in the South China Sea, was the setting for this book by William Golding","""Lord of the Flies""",NA
1989-09-28,NA,NA,NA,NA,NA,NA,NA
1989-09-28,DJ,CLASSICAL MUSIC,,1000,"If Beethoven rolled over in his grave, he'd find this composer of the Incidental Music to Rosamunde",Franz Schubert,NA
1989-09-28,DJ,PEOPLE,,1000,"The books ""In God's Name"" & ""A Thief in the Night"" investigated his 1978 death",Pope John Paul I (Albino Luciani),NA
1989-09-28,DJ,FURNITURE,,1000,"He popularized his furniture style in his 1754 book ""The Gentleman & Cabinetmaker's Director""",Thomas Chippendale,NA
1989-09-28,DJ,U.S. HISTORY,,1000,"A presidential order got her released from jail February 1, 1979",Patricia Hearst,NA
1989-09-28,DJ,LITERARY ISLANDS,,1000,William LeGrand & his servant found buried treasure on Sullivan's Island in this 19th C. detective story,"""The Gold Bug""",NA
1989-09-28,FJ,LEGENDS,,NA,She abducted Lancelot when he was a baby & kept him on an island,the Lady of the Lake (or Vivien or Nimue),NA
