date,round,category,comment,value,clue,response,link
2011-09-28,J,INVENTORS & INVENTIONS,,200,In 1949 Ed Seymour invented paint dispensed this way; aluminum was the first color,spray paint,NA
2011-09-28,J,IF THEY MARRIED,,200,"If ""Twilight"" actress Fanning married a Marine lt. col. known from Iran-Contra, she'd be known as...",Dakota North,NA
2011-09-28,J,TRIPLE THE FUN,,200,The home-building materials of the 3 Little Pigs in the Disney version,"straw, wood & brick",NA
2011-09-28,J,BLANK VERSE,,200,"John Keats:""Beauty is ____,  ____ beauty,--that is all / Ye know on earth, and all ye need to know""",truth,NA
2011-09-28,J,BEHIND BARS,,200,"The smallest bartender's measurement, it can also refer to a short foot race",a dash,NA
2011-09-28,J,2-LETTER RESPONSES,,200,George Clooney actually starred in 2 TV series with this title--the earlier one was a comedy,ER,NA
2011-09-28,J,INVENTORS & INVENTIONS,,400,"As a newsboy on the Grand Trunk Railway in 1862, he ""saw the light"" & published the first newspaper printed on a train",Thomas Edison,NA
2011-09-28,J,IF THEY MARRIED,,400,"If Miss Q of ""Nikita"" fame wed Queen guitarist Brian, Rod Stewart would sing to her as...",Maggie May,NA
2011-09-28,J,TRIPLE THE FUN,,400,Columbus' 3 ships in 1492,"the Niña, the Pinta & the Santa María",NA
2011-09-28,J,BLANK VERSE,,400,"Ogden Nash ""The cow is of the bovine ilk; one end is moo, the other, ____""",milk,NA
2011-09-28,J,BEHIND BARS,,400,"Bartenders ask, ""straight"" or this 3-word opposite",on the rocks,NA
2011-09-28,J,2-LETTER RESPONSES,,400,It's a symbol of pharmacy & an abbreviation for prescription,Rx,NA
2011-09-28,J,INVENTORS & INVENTIONS,,600,In 1810 England's Peter Durand patented the idea of using this metal to coat cans for food preservation,tin,NA
2011-09-28,J,IF THEY MARRIED,,600,Mike Tyson's first wife marries Chicago Cub great Ernie & begins a life of crime as...,Robin Banks,NA
2011-09-28,J,TRIPLE THE FUN,,600,The 3 types of events in the Ironman Triathlon,"swimming, running & bicycling",NA
2011-09-28,J,BLANK VERSE,,600,"Robert Frost:""Two roads diverged in a yellow ____""",wood,NA
2011-09-28,J,BEHIND BARS,,600,This directional term refers to a nonalcoholic drink placed at the side of the booze in a separate glass,a back,NA
2011-09-28,J,2-LETTER RESPONSES,,600,This 2-letter Korean company makes a sweet cell phone called the Chocolate Touch,LG,NA
2011-09-28,J,INVENTORS & INVENTIONS,,800,"Ann Moore invented this ""cozy"" baby carrier after seeing women in Togo carry their babies in fabric slings",a Snugli,NA
2011-09-28,J,IF THEY MARRIED,,800,"The ""House of the Spirits"" author gets hitched to a circus sibling who bought out Barnum in 1907 & becomes...",Isabel Ringling,NA
2011-09-28,J,TRIPLE THE FUN,,800,"On the East Coast ""Tri-State Area"" often refers to this trio, the 3rd, 5th & 11th to join the Union","Connecticut, New York & New Jersey",NA
2011-09-28,J,BLANK VERSE,,800,"Alexander Pope:""Fools rush in where angels ____ ____ ____""",fear to tread,NA
2011-09-28,J,BEHIND BARS,,800,"""Dry"" in bartending can pertain to the use of this fortified liquid that also has a ""sweet"" type",vermouth,NA
2011-09-28,J,2-LETTER RESPONSES,,800,"Lifebuoy soap once promised to stop this ""from head to toe""",B.O.,NA
2011-09-28,J,INVENTORS & INVENTIONS,,1000,Juan de la Cierva invented this rotary-wing aircraft that taxied for takeoff & was replaced by the helicopter,the autogiro,http://www.j-archive.com/media/2011-09-28_J_16.jpg
2011-09-28,J,IF THEY MARRIED,,1000,"""Criminal"" singer Fiona weds Steve, author of legal thrillers like ""Double Tap"", & hyphenates to get this potable name",Fiona Apple-Martini,NA
2011-09-28,J,TRIPLE THE FUN,,1000,"The ""triple bottom line"" concept urges companies to be successful, caring & green: ""profit, people"" & this ""P""",planet,NA
2011-09-28,J,BLANK VERSE,,NA,"Thomas Gray:""The paths of glory lead but to the ____""",grave,NA
2011-09-28,J,BEHIND BARS,,1000,"This term for the maceration of fruit in a bar using a pestle can also mean ""to make unclear""",muddle,NA
2011-09-28,J,2-LETTER RESPONSES,,1000,It's this pair of chromosomes that make a man a man,XY,NA
2011-09-28,DJ,DAMN YANKEES,,400,In 1864 General Benjamin Butler appointed her superintendent of the Department of Nurses for the Army of the James,Clara Barton,NA
2011-09-28,DJ,"HELLO, DOLLY!",,400,"For the 60th anniversary of Pearl Harbor, Hasbro introduced a special line of this military action figure",G.I. Joe,NA
2011-09-28,DJ,"KISS ME, KATE",,400,She & Leo were nominated for a 1998 MTV Movie Award for Best Kiss,Winslet,NA
2011-09-28,DJ,AVENUE QUEUE,(Alex: And you have to name the city where these streets are found.),400,"O'Connell Street,Parnell Street,Pearse Avenue",Dublin,NA
2011-09-28,DJ,KISMET,,400,"In a common expression, you may be ""out of"" this; there's also this ""of the draw""",luck,NA
2011-09-28,DJ,BROADWAY MUSICALS,,400,Tim Hatley won a 2009 Tony for Best Costume Design for the musical about this green ogre,Shrek,NA
2011-09-28,DJ,DAMN YANKEES,,800,"Lincoln called this cartoonist ""our best recruiting sergeant""",Thomas Nast,NA
2011-09-28,DJ,"HELLO, DOLLY!",,800,"Not surprisingly, this woman's line of collectible dolls includes Baby Donny Little Bit Rock-n-Roll seen here",Marie Osmond,http://www.j-archive.com/media/2011-09-28_DJ_18.jpg
2011-09-28,DJ,"KISS ME, KATE",,800,"In ""How to Lose a Guy in 10 Days"" she & Matthew McConaughey end up on the kiss cam at Madison Square Garden",(Kate) Hudson,NA
2011-09-28,DJ,AVENUE QUEUE,(Alex: And you have to name the city where these streets are found.),800,"Cobb Place,Chrysler Freeway,Lansing Avenue",Detroit,NA
2011-09-28,DJ,KISMET,,800,"In Indian religion, this causal law explains the existence of evil; in a Culture Club title, it precedes ""Chameleon""",karma,NA
2011-09-28,DJ,BROADWAY MUSICALS,,800,"""Sleep Tite"" is a number from this musical with sleepwear in the title",The Pajama Game,NA
2011-09-28,DJ,DAMN YANKEES,,1200,"3 days after graduating from West Point, this future ""Boy General"" took part in the First Battle of Bull Run",George Armstrong Custer,NA
2011-09-28,DJ,"HELLO, DOLLY!",,1200,"Because they fit one inside the other, Russian matryoshka dolls are also called these",nesting dolls,NA
2011-09-28,DJ,"KISS ME, KATE",,1200,"At the end of ""Temple of Doom"" Indy snaps his whip around Willie (this actress) & lays a kiss on her",Capshaw,NA
2011-09-28,DJ,AVENUE QUEUE,(Alex: And you have to name the city where these streets are found.),1200,"Quezon Boulevard,United Nations Avenue,Imelda (just ""Imelda"")",Manila,NA
2011-09-28,DJ,KISMET,,1200,"This word can be used for one's riches as well as one's lot in life; Twain (& others) have called it ""outrageous""",fortune,NA
2011-09-28,DJ,BROADWAY MUSICALS,,1200,"A 2010 musical about this family revolves around daughter Wednesday dating a ""normal"" boy",the Addams Family,NA
2011-09-28,DJ,DAMN YANKEES,,NA,By the end of 1862 this newly appointed rear admiral controlled the entire Gulf Coast except for Mobile,David Farragut,NA
2011-09-28,DJ,"HELLO, DOLLY!",,1600,"Turning 25 in 2011 is this line of dolls that includes Josefina Montoya, a youngster growing up in 1824",American Girl,NA
2011-09-28,DJ,"KISS ME, KATE",,1600,Kate Walsh (Dr. Addison Montgomery) got to kiss Tim Daly (Dr. Pete Wilder) on this TV drama,Private Practice,NA
2011-09-28,DJ,AVENUE QUEUE,(Alex: And you have to name the city where these streets are found.),NA,"Hull Street,Revere Street,Shawmut Avenue",Boston,NA
2011-09-28,DJ,KISMET,,1600,"Regulating each person's life, mythological sisters Atropos, Clotho & Lachesis were known as these",the Fates,NA
2011-09-28,DJ,BROADWAY MUSICALS,,1600,A 2006 musical named for this Anne Rice character featured songs by Elton John & Bernie Taupin,Lestat,NA
2011-09-28,DJ,DAMN YANKEES,,2000,"This Maine seascape painter traveled with the Army of the Potomac, sending sketches back to Harper's Weekly",Winslow Homer,NA
2011-09-28,DJ,"HELLO, DOLLY!",,2000,"This actress who played Marcia on ""The Brady Bunch"" voiced many of Mattel's talking dolls, including Chatty Cathy",Maureen McCormick,NA
2011-09-28,DJ,"KISS ME, KATE",,2000,"As Ethel Thayer in a 1981 film, she was asked, ""Wanna dance or would you rather just suck face?""",(Katharine) Hepburn,NA
2011-09-28,DJ,AVENUE QUEUE,(Alex: And you have to name the city where these streets are found.),2000,"Louis Botha Avenue,Miriam Makeba Street,Jan Smuts Avenue",Johannesburg,NA
2011-09-28,DJ,KISMET,,2000,"John Gast's 1872 ""American Progress"" is an allegorical depiction of ""manifest"" this",destiny,http://www.j-archive.com/media/2011-09-28_DJ_26a.jpg
2011-09-28,DJ,BROADWAY MUSICALS,,2000,"This show created by the minds behind ""South Park"" is very different from the same-named religious text",Book of Mormon,NA
2011-09-28,FJ,THE CHANGING U.S.A.,,NA,"(Kelly of the Clue Crew shows a map on the monitor.)  According to the Census, this point has progressed westward since the U.S. was founded & has moved southwest since the 1960s",the mean center of population,http://www.j-archive.com/media/2011-09-28_FJ.wmv
