date,round,category,comment,value,clue,response,link
2011-11-21,J,HERE'S THE PITCH,"(Alex: We'll give you the pitch, you ID the product.)",200,"(I'm not singing it, you'll just have to imagine that part) ""Meowmeow meowmeow, meowmeow meowmeow...""",Meow Mix,NA
2011-11-21,J,TAKING A PEAK AT THE STATE,,200,"Disappointment Peak,Laramie Peak",Wyoming,NA
2011-11-21,J,"NEED A ""LIFT""?",,200,A kleptomaniac in a department store,a shoplifter,NA
2011-11-21,J,COMIC STRIP DOGS,,200,He was born at the Daisy Hill Puppy Farm & has a mustache-wearing brother named Spike,Snoopy,NA
2011-11-21,J,PICK A CARD,,200,In early European decks what's now this lady was the upper viceroy,the queen,NA
2011-11-21,J,AUSTRALIAN ANIMALS,,200,"(Sarah of the Clue Crew reports from the Taronga Zoo in Sydney, Australia.)  Koalas have adapted their diet with an extra long gut to break down poisons in these leaves & sleep 20 hours a day due to a lack of nutrition in the leaves",eucalyptus,http://www.j-archive.com/media/2011-11-21_J_16.wmv
2011-11-21,J,HERE'S THE PITCH,"(Alex: We'll give you the pitch, you ID the product.)",400,"""Raise your hand if you're"" this deodorant",Sure,NA
2011-11-21,J,TAKING A PEAK AT THE STATE,,400,"Baby Mountain,Hoosier Hill",Indiana,NA
2011-11-21,J,"NEED A ""LIFT""?",,400,A truck with 2 long metal bars at the front for moving heavy objects,a forklift,NA
2011-11-21,J,COMIC STRIP DOGS,,400,Jim Davis named this faithful friend of Garfield after a character he created for a car commercial,Odie,NA
2011-11-21,J,PICK A CARD,,400,The addition of a fifth suit to the medieval Italian deck produced this deck used for fortune telling,tarot,NA
2011-11-21,J,AUSTRALIAN ANIMALS,,400,"(Kelly of the Clue Crew reports from the Taronga Zoo in Sydney, Australia.)  The eastern gray kangaroo can cover 25 feet in a single leap, & they're widespread in this, the country's smallest state",Tasmania,http://www.j-archive.com/media/2011-11-21_J_18.wmv
2011-11-21,J,HERE'S THE PITCH,"(Alex: We'll give you the pitch, you ID the product.)",600,"""Wanna get away?""  Fly this airline",Southwest,NA
2011-11-21,J,TAKING A PEAK AT THE STATE,,600,"Matchless Mountain, Aspen Mountain",Colorado,NA
2011-11-21,J,"NEED A ""LIFT""?",,600,You perform the snatch & the clean & jerk in this sport,weightlifting,NA
2011-11-21,J,COMIC STRIP DOGS,,600,Cartoonist Brad Anderson based the personality of this canine on a dog named Bruno,Marmaduke,http://www.j-archive.com/media/2011-11-21_J_23.jpg
2011-11-21,J,PICK A CARD,,600,"In the 19th century initial letters were added to cards' corners; to avoid confusion with the king, the knave became this",a jack,NA
2011-11-21,J,AUSTRALIAN ANIMALS,,600,"(Kelly of the Clue Crew reports from the Taronga Zoo in Sydney, Australia.)  It's the world's largest burrowing animal & can make a destructive tunnel complex 650 feet long, so farmers don't find it as cute as zoo-goers might",a wombat,http://www.j-archive.com/media/2011-11-21_J_19.wmv
2011-11-21,J,HERE'S THE PITCH,"(Alex: We'll give you the pitch, you ID the product.)",800,"""The things we make, make us"", including this rugged vehicle turning 70",Jeep,NA
2011-11-21,J,TAKING A PEAK AT THE STATE,,800,"Box Elder Peak,Deseret Peak",Utah,NA
2011-11-21,J,"NEED A ""LIFT""?",,800,"He played Private Prewitt in ""From Here to Eternity""",Montgomery Clift,NA
2011-11-21,J,COMIC STRIP DOGS,,800,Arf!  Little Orphan Annie found this furry friend as a pup behind Mrs. Bottle's store,Sandy,NA
2011-11-21,J,PICK A CARD,,800,"In Spanish & Italian card games, this international trumper is merely a one",an ace,NA
2011-11-21,J,AUSTRALIAN ANIMALS,,800,"(Sarah of the Clue Crew reports from the Taronga Zoo in Sydney, Australia.)  The arrival of foxes in Western Australia in the 1920s was bad news for the quokka, a type of this kangaroo relative",a wallaby,http://www.j-archive.com/media/2011-11-21_J_20.wmv
2011-11-21,J,HERE'S THE PITCH,"(Alex: We'll give you the pitch, you ID the product.)",1000,"This resort chain is ""The antidote for civilization""",Club Med,NA
2011-11-21,J,TAKING A PEAK AT THE STATE,,1000,"Mount Disappointment,Mount Muir",California,NA
2011-11-21,J,"NEED A ""LIFT""?",,1000,"At 9:32 A.M. on July 16, 1969, Jack King declared, ""We have"" this ""on Apollo 11""",liftoff,NA
2011-11-21,J,COMIC STRIP DOGS,,1000,The little dog Snert wears a Viking helmet with horns just like this warrior owner,Hagar the Horrible,NA
2011-11-21,J,PICK A CARD,,NA,"In a standard international deck, he's the only one-eyed king",the king of diamonds,NA
2011-11-21,J,AUSTRALIAN ANIMALS,,1000,"(Sarah of the Clue Crew reports from the Taronga Zoo in Sydney, Australia.)  This egg-laying mammal has no teeth with which to eat; its taxonomic name is Tachyglossidae, or ""fast tongue""",the echidna,http://www.j-archive.com/media/2011-11-21_J_21.wmv
2011-11-21,DJ,THE U.S. AIR FORCE,,400,"The song most commonly associated with the Air Force begins, ""Off we go into"" this","""the wild blue yonder""",NA
2011-11-21,DJ,TV THEME LYRICS,,400,"""They're creepy & they're kooky, mysterious & spooky, they're altogether ooky""",The Addams Family,NA
2011-11-21,DJ,NICKNAMES,,400,"This courageous aviator was known as ""the Lone Eagle""",Lindbergh,NA
2011-11-21,DJ,"THE THEAT-""R""",,400,Roger is HIV-positive & Mimi is a heroin addict in this musical,Rent,NA
2011-11-21,DJ,5 CONSONANTS IN A ROW,,400,"Depending on the month, it can be a peridot or a diamond",a birthstone,NA
2011-11-21,DJ,TAKE THE DAY OFF,,400,April 22 is Earth Day & the birthday of this leader of the 1917 Russian Revolution,Lenin,NA
2011-11-21,DJ,THE U.S. AIR FORCE,,NA,This European operation that began in 1948 was the independent USAF's first major international challenge,the Berlin Airlift,NA
2011-11-21,DJ,TV THEME LYRICS,,800,"""Woke up this mornin', got yourself a gun; mama always said you'd be the chosen one""",The Sopranos,NA
2011-11-21,DJ,NICKNAMES,,800,"To track & field fans, she was simply ""Flo Jo""",Florence Griffith Joyner,NA
2011-11-21,DJ,"THE THEAT-""R""",,800,"According to the title of a Tom Stoppard play, these 2 attendant lords ""are Dead""",Rosencrantz & Guildenstern,NA
2011-11-21,DJ,5 CONSONANTS IN A ROW,,NA,Sad songs may tug at these internal strands,heartstrings,NA
2011-11-21,DJ,TAKE THE DAY OFF,,800,"Occurring the first new moon after the sun enters Aquarius, it's Vietnamese new year",Tet,NA
2011-11-21,DJ,THE U.S. AIR FORCE,,1200,"By the end of the Vietnam War, the USAF was guiding bombs with this acronymic technology dating from around 1960",laser,NA
2011-11-21,DJ,TV THEME LYRICS,,1200,"""Till the one day when the lady met this fellow, & they knew that it was much more than a hunch""",The Brady Bunch,NA
2011-11-21,DJ,NICKNAMES,,1200,Old West personality Martha Jane Cannary was known by this misfortunate handle,Calamity Jane,NA
2011-11-21,DJ,"THE THEAT-""R""",,1200,This Terrence McNally musical is based on a novel by E.L. Doctorow,Ragtime,NA
2011-11-21,DJ,5 CONSONANTS IN A ROW,,1200,An event that happens in a movie but that the audience doesn't see is said to have taken place here,offscreen,NA
2011-11-21,DJ,TAKE THE DAY OFF,,1200,"This ""Thursday"" before Easter commemorates the Last Supper",Maundy Thursday,NA
2011-11-21,DJ,THE U.S. AIR FORCE,,1600,The continental U.S.-based interceptor force is provided by this homefront body formed the same day as the USAF,the Air National Guard,NA
2011-11-21,DJ,TV THEME LYRICS,,1600,"""Who are you?  Who, who, who, who?""",CSI,NA
2011-11-21,DJ,NICKNAMES,,1600,"Shakespeare was ""the Bard of Avon""; this Scotsman was ""the Bard of Ayrshire""",Robert Burns,NA
2011-11-21,DJ,"THE THEAT-""R""",,1600,Ionesco's play named for this pachyderm is about totalitarianism,rhinoceros,NA
2011-11-21,DJ,5 CONSONANTS IN A ROW,,1600,The vertical section of tile behind the sink,a backsplash,NA
2011-11-21,DJ,TAKE THE DAY OFF,,1600,"Held on March 3, Japan's Hinamatsuri festival celebrates young girls & these toys popular with them",dolls,NA
2011-11-21,DJ,THE U.S. AIR FORCE,,2000,The A-10 Thunderbolt II is less glamorously nicknamed for this hideous animal,the warthog,http://www.j-archive.com/media/2011-11-21_DJ_10.jpg
2011-11-21,DJ,TV THEME LYRICS,,2000,"""We don't get fooled again, don't get fooled again.  No, no""",CSI: Miami,NA
2011-11-21,DJ,NICKNAMES,,2000,"Diminutive chanteuse Edith Piaf was known as ""the Little"" this bird",a sparrow,NA
2011-11-21,DJ,"THE THEAT-""R""",,2000,"It's the 3-letter name of Karel Capek's play from which we get the word ""robot""",R.U.R.,NA
2011-11-21,DJ,5 CONSONANTS IN A ROW,,2000,"""Deadly"" herb also known as belladonna",nightshade,NA
2011-11-21,DJ,TAKE THE DAY OFF,,2000,"In Texas April 21 is a day to remember this battle, Sam Houston's 1836 victory over a passel of Mexicans",San Jacinto,NA
2011-11-21,FJ,MOVIE CHARACTERS,,NA,"900 years old when he died, he spoke in OSV syntax, object-subject-verb",Yoda,NA
