date,round,category,comment,value,clue,response,link
1986-10-10,J,BIRTHSTONES,,100,"The idea of birthstones can be traced to ancient Israel, where 12 different gems stood for these",12 tribes of Israel,NA
1986-10-10,J,THE 1970s,,100,Simultaneous take-offs from London & Paris in 1976 provided 1st passenger service of this kind,super sonic,NA
1986-10-10,J,CARS,,100,The names of most Toyota models begin with this letter,C,NA
1986-10-10,J,TV ANIMALS,,100,"The really small mouse on ""a really big shew""",Topo Gigio,NA
1986-10-10,J,BETTE MIDLER,,100,Her heavenly nickname,The Divine Miss M,NA
1986-10-10,J,CRAZY TALK,,100,Crazy like a Christmas loaf,nutty as a fruitcake,NA
1986-10-10,J,BIRTHSTONES,,200,"September birthstone or wife of George ""Kingfish"" Stevens",sapphire,NA
1986-10-10,J,THE 1970s,,200,A '70s hair style was named for this Olympic skaing champion,Dorothy Hamill,NA
1986-10-10,J,CARS,,200,A U.S. car was named this out of admiration for endurance & strength of the Pilgrims,Plymouth,NA
1986-10-10,J,TV ANIMALS,,200,"Pookie the Lion, Marilyn Monwolf, White Fang & Black Tooth were ingredients in his comedy stew",Soupy Sales,NA
1986-10-10,J,BETTE MIDLER,,200,"""A View From a Broad"" & ""The Saga of Baby Divine""",her books,NA
1986-10-10,J,CRAZY TALK,,200,Nocturnal flying mammals enclosed by a church tower,bats in the belfry,NA
1986-10-10,J,BIRTHSTONES,,300,"1 of 3 birthstones for June, it's the only one derived from an animal source",pearl,NA
1986-10-10,J,THE 1970s,,300,"In 1975, Mozambique & Angola were granted independence from this country",Portugal,NA
1986-10-10,J,CARS,,300,"New on the American market, the Hyundai is imported from this country",Korea,NA
1986-10-10,J,TV ANIMALS,,300,1-man zoo Simon MacCorkindale showed lots of animal magnetism in this short-lived series,Manimal,NA
1986-10-10,J,BETTE MIDLER,,300,"In her first all-comedy album, this ""Will Be Flung Tonight!""",mud,NA
1986-10-10,J,CRAZY TALK,,300,Enunciation of a Black Forest clock bird,"cuckoo, cuckoo",NA
1986-10-10,J,BIRTHSTONES,,400,"This '69 Hitchcock thriller was released in December, though its title is November's birthstone",Topaz,NA
1986-10-10,J,THE 1970s,,400,"Year in which the Shah left Iran, Margaret Thatcher became P.M., & the Soviets invaded Afghanistan",\'79,NA
1986-10-10,J,CARS,,NA,Make of model mentioned in this song:,Pontiac,NA
1986-10-10,J,TV ANIMALS,,400,Howdy Doody show pet who was a combination of 8 animals,Flub-A-Dub,NA
1986-10-10,NA,NA,NA,NA,NA,NA,NA
1986-10-10,J,CRAZY TALK,,400,Hauling 999 baked & molded blocks of clay when you should have 1000,not carrying a full load,NA
1986-10-10,J,BIRTHSTONES,,500,Flawless specimens of this May birthstone fetch higher prices than diamonds of equal weight,emerald,NA
1986-10-10,J,THE 1970s,,500,"In 1972, a human skull 2,500,000 years old was found in Kenya by this famous anthropologist",(Richard) Leakey,NA
1986-10-10,J,CARS,,500,"In the Ford Edsel, the transmission controls took this form",push buttons,NA
1986-10-10,J,TV ANIMALS,,500,The brave stallion of the Broken Wheel Ranch,Fury,NA
1986-10-10,NA,NA,NA,NA,NA,NA,NA
1986-10-10,J,CRAZY TALK,,500,The penthouse is unserviced by the lift,the elevator doesn\'t go all the way to the top,NA
1986-10-10,DJ,ANCIENT WORLDS,,200,"By 240 B.C., Halley's Comet had been observed by astronomers in this oriental country",China,NA
1986-10-10,DJ,NUTRITION,,200,"Simply roasted & ground, it has almost 50% more caffeine than instant types",fresh ground coffee,NA
1986-10-10,DJ,ODD SPORTS,,200,Top bowling pro Walter Ray Williams Jr. has been scoring ringers in this other game,horseshoes,NA
1986-10-10,DJ,LITERATURE,,200,"In Hartford, Conn., Mark Twain lived next to this author of ""Uncle Tom's Cabin""",Harriet Beecher Stowe,NA
1986-10-10,DJ,U.S. STATES,,200,"Spanish for ""snow clad"", this state is best known for its desert gambling resort",Nevada,NA
1986-10-10,DJ,SPIRITUAL SONGS,,200,"""Swing low, sweet chariot, comin' for to"" do this",carry me home,NA
1986-10-10,DJ,ANCIENT WORLDS,,400,"Shared ideas like ""eye for an eye"" indicate both the Mosaic code & this Babylonian's have a common source",Hammurabi,NA
1986-10-10,DJ,NUTRITION,,400,"About 7 times as much of this, C27H45OH, is found in egg yolks than in butter",cholesterol,NA
1986-10-10,DJ,ODD SPORTS,,400,Surface on which a boogie board is used,ocean (water),NA
1986-10-10,DJ,LITERATURE,,400,"Captain of the ""Nautilus"", his name in Latin means ""no one""",Captain Nemo,NA
1986-10-10,DJ,U.S. STATES,,NA,"The only 2 U.S. states to begin with the letter ""T"", they both have the mockingbird as state bird",Tennessee and Texas,NA
1986-10-10,DJ,SPIRITUAL SONGS,,400,"Both a Jewish & Christian hymn sing of this ""Rock""",Rock of Ages,NA
1986-10-10,DJ,ANCIENT WORLDS,,600,"""Running"" battle where ancient Greeks defeated Darius I of Persia",Battle of  Marathon,NA
1986-10-10,DJ,NUTRITION,,600,"Ironically, taking megadoses of this vitamin when pregnant can cause scurvy in the newborn",vitamin C,NA
1986-10-10,DJ,ODD SPORTS,,600,Klutz Press started in 1977 with a how to book complete with 3 bean bags for you to learn this art,juggling,NA
1986-10-10,DJ,LITERATURE,,600,"Author of ""Wuthering Heights"", who died of consumption at 30",Emily Bront&euml,NA
1986-10-10,DJ,U.S. STATES,,600,State with the highest percentage of population age 65 or older,Florida,NA
1986-10-10,DJ,SPIRITUAL SONGS,,600,"""You may talk about your kings of Gideon, you may talk about your men of Saul, but there's none like"" him",Joshua,NA
1986-10-10,DJ,ANCIENT WORLDS,,NA,The Aztecs had no wagons or beasts of burden & used these only on toys,wheels,NA
1986-10-10,DJ,NUTRITION,,800,Lack of this vitamin causes night-blindness but an excess causes blurred vision,vitamin A,NA
1986-10-10,DJ,ODD SPORTS,,800,"The Chicago Knockers, an all-girl team, hit the road to perform 250 shows a year of this ""earthy"" sport",mud wrestling,NA
1986-10-10,DJ,LITERATURE,,800,"The travellers in Chaucer's ""Canterbury Tales"" are on a pilgrimage to shrine of this 12th c. martyr",Thomas &agrave Becket,NA
1986-10-10,DJ,U.S. STATES,,800,"Admitted on same day in 1889, it's said N. Dakota was called 39th state, S. Dakota 40th for this reason",South Dakota comes alphabetically after North Dakota,NA
1986-10-10,DJ,SPIRITUAL SONGS,,800,"It's believed he wrote the hymn, ""A Mighty Fortress is Our God""",Martin Luther,NA
1986-10-10,DJ,ANCIENT WORLDS,,1000,"The name of this country noted for its sailing is merely Greek for ""Canaan""",Phoenicia,NA
1986-10-10,DJ,NUTRITION,,1000,"Though low in quantity, the quality of protein  in this grain, ""oryza sativa"", is higher than beef",rice,NA
1986-10-10,DJ,ODD SPORTS,,1000,"While the Indianapolis 500 uses cars, the Iditarod 1100 uses these",dog sleds,NA
1986-10-10,DJ,LITERATURE,,1000,"Probably the 19th c.'s largest single royalty check went to this president's widow in 1886 for his ""Memoirs""",Ulysses S. Grant,NA
1986-10-10,DJ,U.S. STATES,,1000,This state's capital was named in honor of Princess Anne of England,Annapolis,NA
1986-10-10,DJ,SPIRITUAL SONGS,,1000,"Query that's answered ""must be the children that Moses led""",Who\'s that yonder dressed red?,NA
1986-10-10,FJ,THE CIVIL WAR,,NA,The southernmost point in the Union was in this state west of the Mississippi,California,NA
