date,round,category,comment,value,clue,response,link
2012-07-04,J,ROYAL DYNASTIES,"(Alex: We'll give you the ruler, and you identify the dynasty for us.)",200,France's Louis XIII (1610-1643),Bourbon,NA
2012-07-04,J,LONG RUNS IN PRIME TIME,,200,"Steve Zirnkilton read the opening on this series that ran from 1990 to 2010: ""In the criminal justice system...""",Law & Order,NA
2012-07-04,J,THE BEST OF DEAR ABBY,,200,"My son ""has been paying a psychiatrist $50.00 an hour every week for two-and-a-half years. He must be"" this",crazy,NA
2012-07-04,J,SEAPORTS,,200,It's Egypt's busiest seaport & second-largest city,Alexandria,NA
2012-07-04,J,ANCHORS AWEIGH,,200,This 4-letter traditional greeting for hailing other vessels may be from the name of a type of boat,ahoy,NA
2012-07-04,J,"""FUL"" STEAM AHEAD",,200,A dress or mirror that goes down to the feet,full-length,NA
2012-07-04,J,ROYAL DYNASTIES,"(Alex: We'll give you the ruler, and you identify the dynasty for us.)",400,China's Jiajing (1521-1566),Ming,NA
2012-07-04,J,LONG RUNS IN PRIME TIME,,400,"No pelvic gyrations allowed, but this hosts's really big shew did run from 1948 to 1971",Ed Sullivan,NA
2012-07-04,J,THE BEST OF DEAR ABBY,,400,"""I was married to Bill for three months and I didn't know he drank until one night he came home"" this",sober,NA
2012-07-04,J,SEAPORTS,,400,San Juan is this commonwealth's chief seaport & capital,Puerto Rico,NA
2012-07-04,J,ANCHORS AWEIGH,,400,These wide pants were made to roll up above the knee when swabbing the decks & to remove easily when you fall overboard,bell-bottoms,NA
2012-07-04,J,"""FUL"" STEAM AHEAD",,400,"Pivot point, from the Latin for ""couch foot""",a fulcrum,NA
2012-07-04,J,ROYAL DYNASTIES,"(Alex: We'll give you the ruler, and you identify the dynasty for us.)",600,England's Charles I (1625-1649),Stuart,NA
2012-07-04,J,LONG RUNS IN PRIME TIME,,600,"It's now on Sunday mornings, but this news show ran from 1947 to 1965 in prime time",Meet the Press,NA
2012-07-04,J,THE BEST OF DEAR ABBY,,600,"""My mother is mean and short tempered--I think she is going through her mental"" this",pause,NA
2012-07-04,J,SEAPORTS,,600,"Hammerfest, a seaport in this country, calls itself the northernmost city in Europe",Norway,NA
2012-07-04,J,ANCHORS AWEIGH,,600,"This name for a heavy garment worn by sailors in cold weather comes from a word for cloth, not a vegetable",a peacoat,http://www.j-archive.com/media/2012-07-04_J_09.jpg
2012-07-04,J,"""FUL"" STEAM AHEAD",,600,Endowed with a pure pedigree,full-blooded,NA
2012-07-04,J,ROYAL DYNASTIES,"(Alex: We'll give you the ruler, and you identify the dynasty for us.)",800,Iran's Reza Shah & Mohammad Reza Shah,Pahlavi,NA
2012-07-04,J,LONG RUNS IN PRIME TIME,,800,"""Guess the occupation"" was the concept on this prime-time game show that ran from 1950 to 1967",What\'s My Line?,NA
2012-07-04,J,THE BEST OF DEAR ABBY,,800,"""Are"" these ""pills deductible?"" ""Only if they don't work""",birth control pills,NA
2012-07-04,J,SEAPORTS,,NA,"21 miles from Dover, this French seaport is closer to England than any other city in mainland Europe",Calais,NA
2012-07-04,J,ANCHORS AWEIGH,,800,This punishment involved dragging a person under a ship from one side to the other,keelhauling,NA
2012-07-04,J,"""FUL"" STEAM AHEAD",,800,Giving excessive praise,fulsome,NA
2012-07-04,J,ROYAL DYNASTIES,"(Alex: We'll give you the ruler, and you identify the dynasty for us.)",1000,Frederick III of Germany (1440-1493),Hapsburg,NA
2012-07-04,J,LONG RUNS IN PRIME TIME,,1000,"What's that, girl? Jimmy's in the well & you starred in this TV show that lasted from 1954 to 1974?",Lassie,NA
2012-07-04,J,THE BEST OF DEAR ABBY,,1000,"To someone asking if a 10-pound baby born 5 mos. after a marriage could be premature: ""The baby was on time."" This ""was late""",the wedding,NA
2012-07-04,J,SEAPORTS,,1000,In 1905 sailors from the Battleship Potemkin staged a mutiny in this port on the Black Sea,Odessa,NA
2012-07-04,J,ANCHORS AWEIGH,,1000,"Now a term for small high-tech devices, it was originally a sailors' equivalent of ""doohickey""",gadget,NA
2012-07-04,J,"""FUL"" STEAM AHEAD",,1000,"In 2005, after 183 years in Lower Manhattan, this fish market moved to the Bronx",Fulton,NA
2012-07-04,DJ,PEOPLE WITH BRADY KID NAMES,,400,"Known as The Shark, he was the first PGA Tour player to surpass $10 million in earnings",Greg Norman,NA
2012-07-04,DJ,RAIDERS OF THE LOST ARCHAEOLOGY,,400,In 1870 Heinrich Schliemann began his excavation of Troy following the descriptions in this epic poem,the Iliad,NA
2012-07-04,DJ,SPIRITUALS,,400,"A low-swinging, sweet one is ""comin' for to carry me home""",a sweet chariot,NA
2012-07-04,DJ,"ISN'T IT AN -""ISM""?",,400,"If you said someone ""went into the fertilizing business"" instead of saying he died, you used this noun",a euphemism,NA
2012-07-04,DJ,TITLE CHARACTERS,,400,"In a 1937 novel, Bilbo Baggins",The Hobbit,NA
2012-07-04,DJ,HALLEY'S CATEGORY,,400,"Halley calculated that one of these sighted in 1682 would reappear in 1758; it did, & his name was forever attached to it",a comet,NA
2012-07-04,DJ,PEOPLE WITH BRADY KID NAMES,,800,He founded the Black Panther Party with Huey Newton in 1966,Bobby Seale,NA
2012-07-04,DJ,RAIDERS OF THE LOST ARCHAEOLOGY,,800,Archaeologists have found some remains of this structure mentioned in Genesis 11 (but it only had 7 stories),the Tower of Babel,NA
2012-07-04,DJ,SPIRITUALS,,800,"He ""fit the battle of Jericho""",Joshua,NA
2012-07-04,DJ,"ISN'T IT AN -""ISM""?",,800,"If my daughter ever hosts the show, it won't be because of this, from the Latin for ""nephew""; the girl is a natural!",nepotism,NA
2012-07-04,DJ,TITLE CHARACTERS,,800,"In the first book of a bestselling trilogy, superhacker Lisbeth Salander",The Girl with the Dragon Tattoo,NA
2012-07-04,DJ,HALLEY'S CATEGORY,,800,"The Royal Society said that Halley should pay to have this man's ""Principia"" published, so Halley ponied up",Newton,NA
2012-07-04,DJ,PEOPLE WITH BRADY KID NAMES,,1200,His father was the first anchor of a nightly news program in Canada; he came south & anchored at ABC,Peter Jennings,NA
2012-07-04,DJ,RAIDERS OF THE LOST ARCHAEOLOGY,,1200,"In 1978 she found at Laetoli, south of Olduvai Gorge, footprints in volcanic ash made by hominins living 3.5 mil. years ago",Mary Leakey,NA
2012-07-04,DJ,SPIRITUALS,,1200,"""Lord I want to be in that number when"" this happens",when the saints go marching in,NA
2012-07-04,DJ,"ISN'T IT AN -""ISM""?",,1200,"A term originating from Greek myth, it's an inordinate fascination with oneself",narcissism,NA
2012-07-04,DJ,TITLE CHARACTERS,,NA,"In a 17th century French comedy, mankind hater Alceste",The Misanthrope,NA
2012-07-04,DJ,HALLEY'S CATEGORY,,1200,"In 1720 Halley became Astronomer Royal at this observatory, a post he held until his death in 1742",the Greenwich Observatory,NA
2012-07-04,DJ,PEOPLE WITH BRADY KID NAMES,,1600,She & Christopher Darden headed up the prosecution team in the O.J. murder case,Marcia Clark,NA
2012-07-04,DJ,RAIDERS OF THE LOST ARCHAEOLOGY,,1600,Beginning in 1900 Sir Arthur Evans uncovered the Palace of Minos at Knossos on this island,Crete,NA
2012-07-04,NA,NA,NA,NA,NA,NA,NA
2012-07-04,DJ,"ISN'T IT AN -""ISM""?",,1600,"Holland Carter won a 2009 Pulitzer in this category ""for his wide ranging reviews of art""",criticism,NA
2012-07-04,DJ,TITLE CHARACTERS,,1600,Edward Tudor of Wales & street urchin Tom Canty,The Prince and the Pauper,NA
2012-07-04,DJ,HALLEY'S CATEGORY,,NA,"(Kelly of the Clue Crew shows an astronomical animation on the monitor.)  In 1677 Edmond Halley observed one of these rare astronomical events--the passage of a planet across the Sun's bright disk; in his case, it was Mercury",a transit,http://www.j-archive.com/media/2012-07-04_DJ_13.wmv
2012-07-04,NA,NA,NA,NA,NA,NA,NA
2012-07-04,DJ,RAIDERS OF THE LOST ARCHAEOLOGY,,2000,"In 1923 this British archaeologist published ""The Tomb of Tut-ankh-Amen""; fitting, 'cause he found it",(Howard) Carter,NA
2012-07-04,NA,NA,NA,NA,NA,NA,NA
2012-07-04,DJ,"ISN'T IT AN -""ISM""?",,2000,"A thing that belongs to an earlier time; we'll give you an ""A"" for effort if you get it",an anachronism,NA
2012-07-04,DJ,TITLE CHARACTERS,,2000,"In a Shakespeare play, Mistress Page & Mistress Ford",The Merry Wives of Windsor,NA
2012-07-04,DJ,HALLEY'S CATEGORY,,2000,The development of these tables used in life insurance was influenced by mortality tables Halley made for the city of Breslau,actuarial tables,NA
2012-07-04,FJ,NUCLEAR NATIONS,,NA,"On May 18, 1974 this country tested its first nuclear device, nicknamed ""Smiling Buddha""",India,NA
