date,round,category,comment,value,clue,response,link
1994-10-27,J,ANCIENT TIMES,,100,"Known in ancient times as Berytus, this Middle Eastern seaport is now a world capital",Beirut,NA
1994-10-27,J,TELEVISION,,100,"""It's Howdy Doody time, it's Howdy Doody time, Bob Smith and Howdy too say"" this ""to you""",howdy do,NA
1994-10-27,J,OCCUPATIONS,,100,"It's the former term for a male flight attendant, or one who oversees the food & drink at a club or hotel",steward,NA
1994-10-27,J,COLORFUL GEOGRAPHY,,100,The city of Santa Ana is the seat of this southern California county,Orange County,NA
1994-10-27,J,MONTHS,,100,The first Monday of this month is Labor Day in the U.S.,September,NA
1994-10-27,J,"NUMBER, PLEASE",,100,It's ten hundreds,"1,000",NA
1994-10-27,J,ANCIENT TIMES,,200,"A great temple was built at Ur to honor Nannar, the Sumerian god of this heavenly body",moon,NA
1994-10-27,J,TELEVISION,,200,Nancy Marchand won a 1978 Emmy for playing publisher Margaret Pynchon on this Ed Asner series,Lou Grant,NA
1994-10-27,J,OCCUPATIONS,,200,"It's someone who stuffs or mounts animals, usually for a museum",taxidermist,NA
1994-10-27,J,COLORFUL GEOGRAPHY,,200,No rivers flow into this sea between Africa & the Arabian Peninsula,Red Sea,NA
1994-10-27,J,MONTHS,,200,Since 1946 the Kentucky Derby has been run on the first Saturday of this month,May,NA
1994-10-27,J,"NUMBER, PLEASE",,200,Triskaidekaphobia is the fear of this number,13,NA
1994-10-27,J,ANCIENT TIMES,,300,"Euripides' satyr play ""The Cyclops"" satirizes an episode from book 9 of this Homeric work",The Odyssey,NA
1994-10-27,J,TELEVISION,,300,"Owners of this animal included Jeff Miller, Timmy Martin & forest ranger Corey Stuart",Lassie,NA
1994-10-27,J,OCCUPATIONS,,NA,"While this professional makes & fits eyeglasses, he can neither prescribe them nor give exams",optician,NA
1994-10-27,J,COLORFUL GEOGRAPHY,,300,A 1951 agreement with Denmark gave the U.S. rights to military bases on this island,Greenland,NA
1994-10-27,J,MONTHS,,300,St. John's Day & Midsummer Day fall on the 24th of this month,June,NA
1994-10-27,J,"NUMBER, PLEASE",,300,"When you reverse direction, you're said to ""do"" this number",180,NA
1994-10-27,J,ANCIENT TIMES,,400,A type of this potent potable made from barley was the favorite beverage of ancient Egypt,beer,NA
1994-10-27,J,TELEVISION,,400,"Rod Serling's ""Requiem for a Heavyweight"" aired live Oct. 11, 1956 on this 90-minute anthology",Playhouse 90,NA
1994-10-27,J,OCCUPATIONS,,400,"This person, often a nurse, is trained to deliver babies in a hospital, clinic or home",midwife,NA
1994-10-27,J,COLORFUL GEOGRAPHY,,400,"At 5,729 feet, Mt. Rogers in this range is Virginia's highest point",Blue Ridge Mountains,NA
1994-10-27,J,MONTHS,,400,"In English this month has a ""p"", in French it has a ""v""",April (Avril),NA
1994-10-27,J,"NUMBER, PLEASE",,400,It's the number of items in a gross,144,NA
1994-10-27,J,ANCIENT TIMES,,500,The Harappan civilization is another name for the ancient civilization of this Asian river valley,Indus River valley,NA
1994-10-27,J,TELEVISION,,500,"For this ""Mary Tyler Moore"" newsman ""It all started in a 5,000 watt radio station in Fresno, California...""",Ted Baxter,NA
1994-10-27,J,OCCUPATIONS,,500,One of the highest-paid insurance professionals is this person who calculates the premium rates,actuary,NA
1994-10-27,J,COLORFUL GEOGRAPHY,,500,This southern-most Texas city grew out of a fort whose establishment led to the Mexican War,Brownsville,NA
1994-10-27,J,MONTHS,,500,"Once called Quintilis, this month was renamed in 44 B.C. for someone born during it",July,NA
1994-10-27,J,"NUMBER, PLEASE",,500,It's the number of lines in a sonnet,14,NA
1994-10-27,DJ,WORLD HISTORY,,200,In 1988 this country's new parliament building was dedicated in Canberra,Australia,NA
1994-10-27,DJ,COLLEGES & UNIVERSITIES,,200,This university in East Lansing was the first state school to offer agriculture courses for credit,Michigan State,NA
1994-10-27,DJ,MUSIC APPRECIATION,,200,This term for a Christmas carol is also the French word for Christmas,noel,NA
1994-10-27,DJ,LANGUAGES,,200,A standard form of Portuguese is based on the dialect of this national capital,Lisbon,NA
1994-10-27,DJ,WOMEN AUTHORS,,200,"She was 65 years old when she published her first ""Little House"" book in",Laura Ingalls (Wilder),NA
1994-10-27,DJ,ALL THE MARBLES,,200,It's the color of pure marble,white,NA
1994-10-27,DJ,WORLD HISTORY,,400,In 1957 this country physician was elected president of Haiti,Francois Duvalier,NA
1994-10-27,DJ,COLLEGES & UNIVERSITIES,,400,The university of this U.S. territory has campuses on St. Thomas & St. Croix,Virgin Islands,NA
1994-10-27,DJ,MUSIC APPRECIATION,,400,It's a 16th century wind instrument with a snakelike shape as well as a synonym for snake,serpent,NA
1994-10-27,DJ,LANGUAGES,,400,"Most of this island, the world's 2nd largest is occupied by speakers of the Papuan languages",New Guinea,NA
1994-10-27,DJ,WOMEN AUTHORS,,400,"""Murder in the White House"", her first mystery novel, concerned the death of a corrupt Sec'y of State",Margaret Truman,NA
1994-10-27,DJ,ALL THE MARBLES,,400,This 180-foot-tall marble landmark is now over 13 feet out of perpendicular,Leaning Tower of Pisa,NA
1994-10-27,DJ,WORLD HISTORY,,600,This region of France that juts into the Atlantic was conquered by Julius Caesar in 56 B.C.,Normandy (or Brittany),NA
1994-10-27,DJ,COLLEGES & UNIVERSITIES,,600,"Founded in 1769, it's New Hampshire's oldest college",Dartmouth,NA
1994-10-27,DJ,MUSIC APPRECIATION,,600,"On scores ""f"" is an abbreviation for forte & ""ff"" is an abbreviation for this",fortissimo,NA
1994-10-27,DJ,LANGUAGES,,600,Languages spoken on this U.S. territory in the Pacific include Charmorro & English,Guam,NA
1994-10-27,DJ,WOMEN AUTHORS,,600,"This woman who co-founded the Algonquin Round Table won an O. Henry Award for her story ""Big Blonde""",Dorothy Parker,NA
1994-10-27,DJ,ALL THE MARBLES,,NA,This marble statue was carved between 1501-1504 as a symbol of the independent Florentine Republic,David,NA
1994-10-27,DJ,WORLD HISTORY,,800,This Scottish fur trader explored the river in Canada's Northwest Territories later named for him,(Sir Alexander) Mackenzie,NA
1994-10-27,DJ,COLLEGES & UNIVERSITIES,,800,This Charleston school is known as the Military College of South Carolina,Citadel,NA
1994-10-27,DJ,MUSIC APPRECIATION,,800,It's also called the violin clef,treble clef,NA
1994-10-27,DJ,LANGUAGES,,800,Ladin is a language spoken in the northern sections of Venetia in this country,Italy,NA
1994-10-27,DJ,WOMEN AUTHORS,,800,"Her book ""The Proud Tower"" describes the world that led to ""The Guns of August""",Barbara Tuchman,NA
1994-10-27,DJ,ALL THE MARBLES,,800,"Though found on a Greek isle in 1820, this statue is usually called by the name of the Roman love goddess",Venus de Milo,NA
1994-10-27,DJ,WORLD HISTORY,,1000,In 1669 the last meeting of the Diet of this confederation of German cities took place,Hanseatic League,NA
1994-10-27,DJ,COLLEGES & UNIVERSITIES,,1000,"This Ivy League school was founded in Warren, R.I. in 1764, but moved to Providence in 1770",Brown,NA
1994-10-27,DJ,MUSIC APPRECIATION,,1000,"Dutch for ""concert building"", it's the name of a famous concert hall in Amsterdam",Concertgebouw,NA
1994-10-27,DJ,LANGUAGES,,NA,There are still a few thousand speakers of Welsh in areas of Patagonia in this country,Argentina,NA
1994-10-27,DJ,WOMEN AUTHORS,,1000,"This author of ""Ethan Frome"" met Henry James in Europe & he became her friend & mentor",(Edith) Wharton,NA
1994-10-27,DJ,ALL THE MARBLES,,1000,"Of the 7 Ancient Wonders, this one was a marble tomb",Mausoleum at Halicarnassus,NA
1994-10-27,FJ,1994,,NA,In July 1994 these 2 foreign leaders became the first to address the same joint session of Congress,Rabin and King Hussein,NA
