date,round,category,comment,value,clue,response,link
2012-10-10,J,35 YEARS AGO: 1977,,200,"With freezing temperatures, this was officially recorded in Miami, Florida for the first time ever",snow,NA
2012-10-10,J,YOU KNOW THE RULES!,,200,Some say you have to be outside & wearing shoes before you claim the front seat by saying the name of this weapon,shotgun,NA
2012-10-10,J,WORD ORIGINS,,200,"This form of big-guy wrestling takes its name from the Japanese for ""mutual strike""",sumo,NA
2012-10-10,J,TRAVEL TEXAS,,200,At this landmark you can see Davy Crockett's buckskin vest & a hunting knife like the one wielded by Jim Bowie,the Alamo,NA
2012-10-10,J,IT'S GETTING WARM,,200,"It can reach 800 degrees during the day on this planet (Venus is a little hotter), but the night's a bit brisk at -275",Mercury,NA
2012-10-10,J,SHEDDING THEIR CLOTHES,,200,"It was a nice night for a naked walk in 1984 at Griffith Observatory for this actor, on the hunt for Sarah Connor",(Arnold) Schwarzenegger,NA
2012-10-10,J,35 YEARS AGO: 1977,,400,"This blockbuster set in ""a galaxy far, far away"" hit theaters just before Memorial Day weekend",Star Wars,NA
2012-10-10,J,YOU KNOW THE RULES!,,400,"""Colorful"" 2-word term for the do-unto-others precept found in Matthew 7:12",the Golden Rule,NA
2012-10-10,J,WORD ORIGINS,,400,"(Kelly of the Clue Crew presents the clue.)  From the Latin for ""piece of felt"", it's the process of separating a solid out of a liquid using a membrane",filter (or filtration),http://www.j-archive.com/media/2012-10-10_J_18.wmv
2012-10-10,J,TRAVEL TEXAS,,400,"Say howdy to 52-foot Big Tex at the state fair of Texas, a stone's throw from this college football stadium",the Cotton Bowl,http://www.j-archive.com/media/2012-10-10_J_27.jpg
2012-10-10,J,IT'S GETTING WARM,,400,"Temperatures in a traditional home this, which often uses dry rather than steam heat, range from 150 to 190",a home sauna,NA
2012-10-10,J,SHEDDING THEIR CLOTHES,,400,"This actor streaked to glory as Frank the Tank in ""Old School""",(Will) Ferrell,NA
2012-10-10,J,35 YEARS AGO: 1977,,600,The world's last known natural case of this disease was reported in Somalia,smallpox,NA
2012-10-10,J,YOU KNOW THE RULES!,,600,"""The strong shall not oppress the weak"" was a principle in the ""code"" of this Babylonian king",Hammurabi,NA
2012-10-10,J,WORD ORIGINS,,600,"This adjective meaning ""evil"" comes from the Latin for ""left hand""",sinister,NA
2012-10-10,NA,NA,NA,NA,NA,NA,NA
2012-10-10,J,IT'S GETTING WARM,,600,In 1913 this California low point had 5 straight days of at least 129 degrees,Death Valley,NA
2012-10-10,J,SHEDDING THEIR CLOTHES,,600,"In ""The Proposal"", Sandra Bullock is shocked to see this actor's ""Green Lantern"", so to speak",Ryan Reynolds,NA
2012-10-10,J,35 YEARS AGO: 1977,,NA,"In November it began regular service between New York & Europe, about a 3 1/2 hour trip",the SST (or the Concorde),NA
2012-10-10,J,YOU KNOW THE RULES!,,800,"No. 11 in this man's rules for boxing, first published in 1867: no shoes or boots with springs allowed",(The Marquess of) Queensberry,NA
2012-10-10,J,WORD ORIGINS,,800,"This word meaning an hour to be home comes from the French for ""cover the fire""",a curfew,NA
2012-10-10,NA,NA,NA,NA,NA,NA,NA
2012-10-10,J,IT'S GETTING WARM,,800,"During an eruption, the water at the opening of this ""loyal"" Wyoming geyser is about 204 degrees",Old Faithful,NA
2012-10-10,J,SHEDDING THEIR CLOTHES,,800,"In ""Failure to Launch"", this Hall of Fame Steeler QB & Fox pregame host bared more than his soul to the camera",(Terry) Bradshaw,NA
2012-10-10,J,35 YEARS AGO: 1977,,1000,"Completed by Christopher Tolkien, this history of Middle-earth was published in 1977",The Silmarillion,NA
2012-10-10,J,YOU KNOW THE RULES!,,1000,"""Secondary Motions"" & ""Putting the Question and Announcing the Vote"" are sections in one edition of this text",Robert\'s Rules of Order,NA
2012-10-10,J,WORD ORIGINS,,1000,"This condiment gets its name from the Chinese for ""pickled fish brine""",ketchup,NA
2012-10-10,NA,NA,NA,NA,NA,NA,NA
2012-10-10,J,IT'S GETTING WARM,,1000,"Sunstroke is likely with prolonged exposure to over 105 degrees on the H.I., short for this",heat index,NA
2012-10-10,J,SHEDDING THEIR CLOTHES,,1000,"In 2003 she played Chris, a leader of the (tastefully) naked ""Calendar Girls""; 3 years later, she was ""The Queen""",Helen Mirren,NA
2012-10-10,DJ,GREAT MEN & WOMEN OF MEDICINE,,400,"(Dr. Oz presents the clue.)  Frederick Banting, an orthopedic surgeon, went into research & won a Nobel Prize for his work extracting insulin from the pancreas, the first effective treatment for this disorder",diabetes,http://www.j-archive.com/media/2012-10-10_DJ_11.jpg
2012-10-10,DJ,POP CULTURE BEFORE & AFTER,,400,"Surely you know the ""Airplane!"" co-star who's a system of measuring the audience of TV shows",Leslie Nielsen ratings,NA
2012-10-10,DJ,"GEOGRAPH""IA""",(Alex: each correct response will end in the letters I-A.),400,This Italian island is the second-largest island in the Mediterranean,Sardinia,NA
2012-10-10,DJ,THAT BOOK WAS A HORROR!,,400,"Anne Rice, 1976: ""Interview with"" him",the Vampire,NA
2012-10-10,DJ,STOPS,,400,In 1920 the first 4-way 3-color one of these was placed at Woodward & Michigan Avenues in Detroit,stop light (a traffic light accepted),NA
2012-10-10,DJ,ONE LETTER DIFFERENCE,(Alex: We need two words in your response.),400,To linger & to deflect the blow of a sword,tarry & parry,NA
2012-10-10,DJ,GREAT MEN & WOMEN OF MEDICINE,,800,"Working for NYC's Health Dept., Dr. Sara Josephine Baker helped track down Mary Mallon, a carrier of this infectious disease",typhoid,NA
2012-10-10,DJ,POP CULTURE BEFORE & AFTER,,800,"TV drama set at an advertising agency that had the No. 1 hits ""Down Under"" & ""Who Can It Be Now?""",Mad Men at Work,NA
2012-10-10,DJ,"GEOGRAPH""IA""",(Alex: each correct response will end in the letters I-A.),800,"Forming a great crescent across Northern China is the autonomous region called ""Inner"" this",Mongolia,NA
2012-10-10,DJ,THAT BOOK WAS A HORROR!,,800,"Ira Levin, 1967: her ""Baby""",Rosemary,NA
2012-10-10,DJ,STOPS,,800,On I-80 in Iowa you'll find what claims to be the world's largest this; it has a 300-seat restaurant & 24 private showers,a truck stop,NA
2012-10-10,DJ,ONE LETTER DIFFERENCE,(Alex: We need two words in your response.),800,"To cushion or shield & a ""serve yourself"" type of meal",buffer & buffet,NA
2012-10-10,DJ,GREAT MEN & WOMEN OF MEDICINE,,1200,"(Dr. Oz presents the clue.)  Dr. Dorothy Andersen named this disease, CF for short, & also helped create a test to diagnose it",cystic fibrosis,http://www.j-archive.com/media/2012-10-10_DJ_13.jpg
2012-10-10,DJ,POP CULTURE BEFORE & AFTER,,1200,"""Teenage Dream"" singer who also had hits with ""Catch A Falling Star"" & ""Round And Round""",Katy Perry Como,NA
2012-10-10,DJ,"GEOGRAPH""IA""",(Alex: each correct response will end in the letters I-A.),1200,"Tradition says Menelik I, son of King Solomon & the Queen of Sheba, was this African country's first emperor",Ethiopia,NA
2012-10-10,DJ,THAT BOOK WAS A HORROR!,,1200,"Stephen King, 2009: ""Under"" this",the Dome,NA
2012-10-10,NA,NA,NA,NA,NA,NA,NA
2012-10-10,DJ,ONE LETTER DIFFERENCE,(Alex: We need two words in your response.),1200,An excavation for coal & a silent clown,mine & mime,NA
2012-10-10,DJ,GREAT MEN & WOMEN OF MEDICINE,,NA,"Her work as an obstetrical nurse for poor women made her an advocate of birth control, a term she coined",Margaret Sanger,NA
2012-10-10,DJ,POP CULTURE BEFORE & AFTER,,1600,"TV show in which Fred MacMurray raises Chip, Robbie & Ernie, who are part of Ron Perlman's biker gang",My Three Sons of Anarchy,NA
2012-10-10,DJ,"GEOGRAPH""IA""",(Alex: each correct response will end in the letters I-A.),NA,"Until it declared its independence in 1991, it was the southernmost of the republics that made up Yugoslavia",Macedonia,NA
2012-10-10,DJ,THAT BOOK WAS A HORROR!,,1600,"Shirley Jackson, 1959: ""The Haunting of"" this ""House""",Hill,NA
2012-10-10,NA,NA,NA,NA,NA,NA,NA
2012-10-10,DJ,ONE LETTER DIFFERENCE,(Alex: We need two words in your response.),1600,Solitary & to make amends for your sins,alone & atone,NA
2012-10-10,DJ,GREAT MEN & WOMEN OF MEDICINE,,2000,"(Dr. Oz presents the clue.)  This South African performed the first kidney transplant in his homeland in 1959 & in 1967 performed the first ever human heart transplant, catapulting him to worldwide fame",(Dr. Christiaan) Barnard,http://www.j-archive.com/media/2012-10-10_DJ_15a.jpg
2012-10-10,DJ,POP CULTURE BEFORE & AFTER,,2000,"""Party Rock Anthem"" group that is a renowned toy store on Fifth Avenue in New York City",LMFAO Schwarz,NA
2012-10-10,DJ,"GEOGRAPH""IA""",(Alex: each correct response will end in the letters I-A.),2000,Paul's fourth epistle is to the churches of this Roman province now in central Turkey,Galatia,NA
2012-10-10,DJ,THAT BOOK WAS A HORROR!,,2000,"John Wyndham, 1951: ""The Day of"" these invading plants",the Triffids,NA
2012-10-10,NA,NA,NA,NA,NA,NA,NA
2012-10-10,DJ,ONE LETTER DIFFERENCE,(Alex: We need two words in your response.),2000,A musical ending & a state of prolonged unconsciousness,a coda & a coma,NA
2012-10-10,FJ,HISTORIC RULERS,,NA,This ruler of a New World country was born in Vienna's Schonbrunn Palace in 1832 & executed far from home in 1867,Maximilian I,NA
