date,round,category,comment,value,clue,response,link
2012-10-25,J,THE 5 SENSES,,200,"Though it sounds like an aged building for assembling goods, this system is just the sense of smell",the olfactory system,NA
2012-10-25,J,HEARING,,200,"A removal hearing is a step toward this, sending an illegal alien back to his or her homeland",deportation,NA
2012-10-25,J,SMELL,,200,Your nose knows it can mean a bunch of flowers as well as the characteristic smell of wines,bouquet,NA
2012-10-25,J,TASTE,,200,I show my exquisite taste by collecting this genre of oil painting seen here,a still life,http://www.j-archive.com/media/2012-10-25_J_02.jpg
2012-10-25,J,SITE,,200,"An FAQ on this agency's .gov website asks, ""What is a split refund?""",the IRS,NA
2012-10-25,J,TOUCHÉ,,200,In a 1998 film Antonio Banderas as this swordsman wreaks havoc on Catherine Zeta-Jones' clothing,Zorro,NA
2012-10-25,J,THE 5 SENSES,,400,"Vision occurs when an image focuses on this inner layer of the eyeball, actually an extension of the brain",the retina,NA
2012-10-25,J,HEARING,,400,"In criminal cases, a Jackson-Denno hearing usually determines whether this type of statement was voluntary",confession,NA
2012-10-25,J,SMELL,,400,"This 5-letter word for a good scent precedes ""therapy"" in a treatment using good smells",aroma,NA
2012-10-25,J,TASTE,,400,"Keep your hot jazz; I prefer this opposite type, a word found in a 1957 Miles Davis album title",cool (jazz),NA
2012-10-25,J,SITE,,400,"This news website that lets you share ""top news"" sounds like it's trying to get to China the hard way",Digg,NA
2012-10-25,J,TOUCHÉ,,400,"Split into two parts, this film finds the bride imploring Hattori Hanzo to make her a sword so she can get revenge",Kill Bill,NA
2012-10-25,J,THE 5 SENSES,,600,"In humans, taste receptors are not just on the tongue but also on this, the roof of the mouth",the palate,NA
2012-10-25,J,HEARING,,600,"This word that follows ""bail"" is also the type of hearing that sets the amount of a defendant's bail",bond,NA
2012-10-25,J,SMELL,,600,The National Rotten Sneaker Contest is sponsored by the brand called this-eaters,odor,NA
2012-10-25,J,TASTE,,600,"Why yes, it is an authentic Gobelin one of these woven wall hangings (imitations are so tawdry)",tapestry,NA
2012-10-25,NA,NA,NA,NA,NA,NA,NA
2012-10-25,J,TOUCHÉ,,600,In this 1986 film Sean Connery as Juan Sanchez Villa-Lobos Ramirez instructs Connor MacLeod in swordplay,Highlander,NA
2012-10-25,J,THE 5 SENSES,,800,The eardrum is also called this membrane,the tympanic membrane,NA
2012-10-25,J,HEARING,,800,"If you share one of these with another defendant in the same trial, a Garcia hearing makes sure you know you can trade him in",lawyer,NA
2012-10-25,J,SMELL,,800,The Paris Hilton men collection includes this type of scent named for a German city,cologne,NA
2012-10-25,J,TASTE,,800,Simple yet elegant--I only drink tea from china cups made by this pottery master born in 1730,Wedgwood,NA
2012-10-25,J,SITE,,800,"Insider content on this website can get you NBA Rumor Central or NFL draft analysis by Mel Kiper, Jr.",ESPN,NA
2012-10-25,J,TOUCHÉ,,800,"Swordplay in movies like 1926's ""The Black Pirate"" earned this ""senior"" actor the title ""king of the swashbucklers""","Douglas Fairbanks, Sr.",NA
2012-10-25,J,THE 5 SENSES,,1000,"On animals these, also known as vibrissae, act as tactile organs",whiskers,NA
2012-10-25,J,HEARING,,NA,This 10-letter type of hearing figures out whether someone has the mental capacity to stand trial,competence,NA
2012-10-25,J,SMELL,,1000,"Add a letter to ""acid"" & you get this adjective for an irritating smell",acrid,NA
2012-10-25,J,TASTE,,1000,No one sings the role of Norma like this Greek-American soprano who died in 1977,(Maria) Callas,NA
2012-10-25,J,SITE,,1000,"The front page of this ""database"", an Amazon company, lists box office tallies & tells you what's opening this week",imdb,NA
2012-10-25,J,TOUCHÉ,,1000,"Christopher Guest prepares to die as this actor avenges his dad's death in ""The Princess Bride""",Mandy Patinkin,NA
2012-10-25,DJ,NAME THAT CENTURY,,400,The USA's Free Soil Party peaks in popularity,the 19th century,NA
2012-10-25,DJ,MTV VIDEO MUSIC AWARDS,(Alex: We'll give you clues about [*]. You identify the artist.),400,"1984, at the first VMAs, Best Cinematography: this group's ""Every Breath You Take""",The Police,NA
2012-10-25,DJ,BOOKS & AUTHORS,,400,Norman Mailer was one of the founders of this alternative NYC tabloid in 1955,The Village Voice,NA
2012-10-25,DJ,EURO COINS,,400,"This man, the father of Spanish literature, is on Spain's 50-cent coins",Cervantes,NA
2012-10-25,NA,NA,NA,NA,NA,NA,NA
2012-10-25,DJ,"A ""HA""!",,400,Hyphenated term for an article of clothing passed on from one person who's outgrown it to the next,a hand-me-down,NA
2012-10-25,DJ,NAME THAT CENTURY,,800,Robespierre sends many to their deaths & meets his own,the 18th century,NA
2012-10-25,DJ,MTV VIDEO MUSIC AWARDS,(Alex: We'll give you clues about [*]. You identify the artist.),800,"2005, Best Male Video: ""Jesus Walks"" (No one interrupted his speech)",Kanye West,NA
2012-10-25,DJ,BOOKS & AUTHORS,,800,"To finance a move to Jamaica in 1786, this Scotsman began selling a book of his poems that became a huge hit; he didn't move",Robert Burns,NA
2012-10-25,DJ,EURO COINS,,800,"This gate, a symbol of German division & reunification, is on Germany's 10-, 20-, & 50-cent coins",the Brandenburg Gate,NA
2012-10-25,NA,NA,NA,NA,NA,NA,NA
2012-10-25,DJ,"A ""HA""!",,800,"Something for sale at an auction is said to be ""under"" this",the hammer,NA
2012-10-25,DJ,NAME THAT CENTURY,,1200,Gallipoli becomes an epic disaster for Britain's military,the 20th century,NA
2012-10-25,DJ,MTV VIDEO MUSIC AWARDS,(Alex: We'll give you clues about [*]. You identify the artist.),1200,"2000, Best Pop Video: ""Bye Bye Bye"" (a boy band)",\'N Sync,NA
2012-10-25,DJ,BOOKS & AUTHORS,,1200,"Margaret Wise Brown, author of this 1947 book about a bunny's bedtime, loved to hunt rabbits",Goodnight Moon,NA
2012-10-25,DJ,EURO COINS,,1200,This 3-word motto of the French Republic is on France's 1- & 2-euro coins,"liberté, égalité & fraternité",NA
2012-10-25,DJ,"ONE MAN, ONE BOAT",,1200,"In 1969 Robin Knox-Johnston sailed around the world solo & nonstop, earning a trophy called this, like an acting award",Golden Globe,NA
2012-10-25,DJ,"A ""HA""!",,1200,"A shrewish woman is sometimes called this, after a mythical monster that was part woman & part vulture",a harpy,NA
2012-10-25,DJ,NAME THAT CENTURY,,1600,Cortez conquers the Aztecs,the 16th century,NA
2012-10-25,DJ,MTV VIDEO MUSIC AWARDS,(Alex: We'll give you clues about [*]. You identify the artist.),1600,"2003, Best Group Video: ""The Scientist"" (those Brits give us chills)",Coldplay,NA
2012-10-25,DJ,BOOKS & AUTHORS,,NA,"The title of this E. M. Forster novel refers to a country house, not to someone's death",Howards End,NA
2012-10-25,DJ,EURO COINS,,1600,This queen is seen in profile on all of the Netherlands' euro coins,Queen Beatrix,NA
2012-10-25,DJ,"ONE MAN, ONE BOAT",,NA,"Edward Miles took the short way around, sailing solo through this canal completed in 1869",the Suez Canal,NA
2012-10-25,DJ,"A ""HA""!",,1600,Hot enough for you? These peppers named for a Caribbean capital definitely will be,habaneros,http://www.j-archive.com/media/2012-10-25_DJ_16.jpg
2012-10-25,DJ,NAME THAT CENTURY,,2000,Muhammad's forces conquer Mecca,the 7th century,NA
2012-10-25,DJ,MTV VIDEO MUSIC AWARDS,(Alex: We'll give you clues about [*]. You identify the artist.),2000,"2011, Best Pop Video: ""Till The World Ends"" (the fans didn't leave her alone)",Britney Spears,NA
2012-10-25,DJ,BOOKS & AUTHORS,,2000,"To disprove rumors of body-stealing after his 1778 death, his grave in Paris' Panthéon was opened in 1897; he's in there",Voltaire,NA
2012-10-25,NA,NA,NA,NA,NA,NA,NA
2012-10-25,DJ,"ONE MAN, ONE BOAT",,2000,"(Sarah of the Clue Crew shows a map on the monitor.)  The Panama Canal hadn't been built in 1895, so Joshua Slocum, the first man to sail solo around the world, took the long way, passing through this strait on his three-year voyage",the Strait of Magellan,http://www.j-archive.com/media/2012-10-25_DJ_27.jpg
2012-10-25,DJ,"A ""HA""!",,2000,"From the 13th to the 15th centuries, commercial activity in northern Europe was dominated by this league",the Hanseatic League,NA
2012-10-25,FJ,WORLD LANGUAGES,,NA,"Of the Romance languages, it has the greatest number of native speakers in a single country",Portuguese,NA
