date,round,category,comment,value,clue,response,link
2012-10-26,J,EXIT THROUGH THE GIFT SHOP,,200,The gift shop at this attraction on Cannery Row in Monterey sells a plush blue shark,the Monterey Bay Aquarium,NA
2012-10-26,J,A SPANISH INQUISITION,(Alex: You have to translate the Spanish word in the clue.),200,Those 2 people are inseparable; think they're joined at the cadera?,the hip,NA
2012-10-26,J,THE GREAT & POWERFUL OZ,,200,"Dorothy asks the Great Oz to send her back home to this place, ""where my Aunt Em and Uncle Henry are""",Kansas,NA
2012-10-26,J,MIKHAILS,,200,He was the last president of the Soviet Union,Gorbachev,NA
2012-10-26,J,NAVY,,200,Students at the Naval Academy have this rank,midshipman,NA
2012-10-26,J,REMEMBERING ERNEST BORGNINE,,200,"When this game show premiered in 1966, it was Ernest Borgnine, not Paul Lynde, in the center",Hollywood Squares,NA
2012-10-26,J,EXIT THROUGH THE GIFT SHOP,,400,"The California National Park named for these trees related to redwoods sells seeds, so you can grow your own",sequoia,NA
2012-10-26,J,A SPANISH INQUISITION,(Alex: You have to translate the Spanish word in the clue.),400,May I have just one more piece of platano cream pie?,banana,NA
2012-10-26,NA,NA,NA,NA,NA,NA,NA
2012-10-26,J,MIKHAILS,,400,Soon after WWII Mikhail Kalashnikov designed the assault rifle known by this alphanumeric name,the AK-47,NA
2012-10-26,J,NAVY,,400,"For Navy personnel, this decoration for heroism is second only to the Medal of Honor",the Navy Cross,NA
2012-10-26,J,REMEMBERING ERNEST BORGNINE,,400,In recent years Borgnine was the voice of Mermaid Man on this beloved Nick cartoon,SpongeBob SquarePants,NA
2012-10-26,J,EXIT THROUGH THE GIFT SHOP,,600,The gift shop at this author's home sells a china shepherdess just like the one Ma loved in the books,Laura Ingalls Wilder,http://www.j-archive.com/media/2012-10-26_J_12.jpg
2012-10-26,J,A SPANISH INQUISITION,(Alex: You have to translate the Spanish word in the clue.),600,Did the alguacil physically step in & keep order in the court?,the bailiff,NA
2012-10-26,NA,NA,NA,NA,NA,NA,NA
2012-10-26,J,MIKHAILS,,NA,"In 2005 after disbanding his White Oak Dance Project, he established an arts center in New York City",Baryshnikov,NA
2012-10-26,J,NAVY,,600,"""The only easy day was yesterday"" is the motto of these Navy Special Ops warriors",the SEALs,NA
2012-10-26,J,REMEMBERING ERNEST BORGNINE,,600,You might say Borgnine really butchered this 1955 film & won a Best Actor Oscar for the effort,Marty,NA
2012-10-26,J,EXIT THROUGH THE GIFT SHOP,,800,Pick up a video at the gift shop of Gaudi's masterpiece La Sagrada Familia in this city in Spain,Barcelona,NA
2012-10-26,J,A SPANISH INQUISITION,(Alex: You have to translate the Spanish word in the clue.),800,"Do you feel bad for Mike, now that he's a two-time perdedor?",a loser,NA
2012-10-26,J,THE GREAT & POWERFUL OZ,,800,"To give the Scarecrow brains, Oz mixed bran with these 2 types of pointy objects, a synonym for a tingly sensation",pins & needles,NA
2012-10-26,J,MIKHAILS,,800,In 1613 Czar Michael (or Mikhail) started this dynasty that ruled Russia until 1917,Romanov,NA
2012-10-26,NA,NA,NA,NA,NA,NA,NA
2012-10-26,J,REMEMBERING ERNEST BORGNINE,,800,Everything didn't come up roses for Borgnine & this Broadway powerhouse who were married for a month in 1964,Ethel Merman,NA
2012-10-26,J,EXIT THROUGH THE GIFT SHOP,,1000,"(Kelly of the Clue Crew delivers the clue from the Louvre in Paris, France.) The Louvre gift shop sells a 1,000-piece puzzle of Veronese's ""The Wedding Feast at"" this village... almost done!",Cana,http://www.j-archive.com/media/2012-10-26_J_21a.jpg
2012-10-26,J,A SPANISH INQUISITION,(Alex: You have to translate the Spanish word in the clue.),1000,Do you remember when we were kids going to the zoo to see the oso pit?,bear,NA
2012-10-26,J,THE GREAT & POWERFUL OZ,,1000,"Oz is not a wizard, just a common man; the Scarecrow calls him this 6-letter word for a pretender",humbug,NA
2012-10-26,J,MIKHAILS,,1000,"For most of the 1950s, Mikhail Botvinnik was the world champion of this",chess,NA
2012-10-26,J,NAVY,,1000,"It makes sense that this U.S. Navy fleet is the world's largest, patrolling 100 million square miles",the Pacific Fleet,NA
2012-10-26,J,REMEMBERING ERNEST BORGNINE,,1000,"After a bar fight, Borgnine threatens Sinatra in a scene from this war flick""Someday when you walk in, I'll be waitin'.  I'll show you a couple of things.""",From Here to Eternity,http://www.j-archive.com/media/2012-10-26_J_19.wmv
2012-10-26,DJ,100 YEARS AGO--1912,,400,Harriet Quimby became the first woman to fly across this European body of water,the English Channel,NA
2012-10-26,DJ,BEAUTY QUEENS,,400,"Currently the anchor of ""ABC World News"", she served as America's Junior Miss of 1963",Diane Sawyer,NA
2012-10-26,DJ,GEOGRAPHIC NICKNAMES,,400,"""The Land of the Tulip""",the Netherlands,NA
2012-10-26,DJ,BUSINESS & INDUSTRY,,400,"Talk about ""big"" this--Saudi Aramco is sitting on 260 billion barrels of it, 10 times more than Exxon Mobil",oil,NA
2012-10-26,DJ,"THANKS FOR THE TITLE, SHAKESPEARE",,400,"A sonnet says ""When to the sessions of sweet silent thought I summon up"" this, the English title of a Proust work",Remembrance of Things Past,NA
2012-10-26,DJ,"LET'S HAVE A ""BALL""",,400,"In a kids' song, ""I lost my poor"" this ""when somebody sneezed""",meatball,NA
2012-10-26,DJ,100 YEARS AGO--1912,,800,He won the pentathlon & the decathlon at the summer Olympics in Stockholm,Jim Thorpe,NA
2012-10-26,DJ,BEAUTY QUEENS,,800,"Later one of the ""Desperate Housewives"", she was 1998's Miss Corpus Christi, Texas",Eva Longoria,NA
2012-10-26,DJ,GEOGRAPHIC NICKNAMES,,800,"State capital that's ""the Mormon Metropolis""",Salt Lake City,NA
2012-10-26,DJ,BUSINESS & INDUSTRY,,800,"Lockheed Martin is big in security & I.T. but is still better known for making these, like its C-5",airplanes,NA
2012-10-26,DJ,"THANKS FOR THE TITLE, SHAKESPEARE",,800,"The title of this 2011 novel about the 3 daughters of a Shakespeare professor gets its title from a trio in ""Macbeth""",The Weird Sisters,NA
2012-10-26,DJ,"LET'S HAVE A ""BALL""",,800,"To put something into long-term storage, perhaps with small spheres of naphthalene",mothball,NA
2012-10-26,DJ,100 YEARS AGO--1912,,1200,"Later revealed to be a hoax, this fossilized man was presented at the Geological Society of London",Piltdown Man,http://www.j-archive.com/media/2012-10-26_DJ_04.jpg
2012-10-26,DJ,BEAUTY QUEENS,,1200,"Movie roles of this former Miss Teen All American include Catwoman & Leticia Musgrove in ""Monster's Ball""",Halle Berry,NA
2012-10-26,DJ,GEOGRAPHIC NICKNAMES,,NA,"Sicily's ""Mountain of Fire""",Mount Etna,NA
2012-10-26,DJ,BUSINESS & INDUSTRY,,1200,"This 3-letter drugstore comes before ""Caremark"" in the name of a giant company",CVS,NA
2012-10-26,DJ,"THANKS FOR THE TITLE, SHAKESPEARE",,1200,"This collection of Hawthorne ""Tales"" probably got its title from a line in ""King John"":  ""Life is as tedious as"" these",Twice-Told Tales,NA
2012-10-26,DJ,"LET'S HAVE A ""BALL""",,1200,To prevent someone from joining a group by voting against him,blackball,NA
2012-10-26,DJ,100 YEARS AGO--1912,,1600,In November Albania declared its independence from this crumbling empire,the Ottoman Empire,NA
2012-10-26,DJ,BEAUTY QUEENS,,1600,"This movie star who appeared in 2012's ""Dark Shadows"" was a sun bunny who became Miss Orange County",Michelle Pfeiffer,NA
2012-10-26,DJ,GEOGRAPHIC NICKNAMES,,1600,"""The Bay of Giant Tides""",the Bay of Fundy,NA
2012-10-26,DJ,BUSINESS & INDUSTRY,,1600,"A downloadable app called this company's ""Greatest Hits"" features Asteroids & Missile Command",Atari,NA
2012-10-26,DJ,"THANKS FOR THE TITLE, SHAKESPEARE",,NA,"Steinbeck didn't have to read much of ""Richard III"" to get the title of this 1961 novel",The Winter of Our Discontent,NA
2012-10-26,DJ,"LET'S HAVE A ""BALL""",,1600,Fungus that discharges a cloud of spores when mature,a puffball,NA
2012-10-26,DJ,100 YEARS AGO--1912,,2000,"The United Kingdom established the forerunner to the R.A.F.-- the R.F.C., short for this",Royal Flying Corps,NA
2012-10-26,DJ,BEAUTY QUEENS,,2000,"She played former Miss Georgia World Suzanne Sugarbaker on ""Designing Women"" but in real life was 1974 Miss Florida",Delta Burke,NA
2012-10-26,DJ,GEOGRAPHIC NICKNAMES,,2000,"A world capital since 1780, it's ""The Venice of the East""","Bangkok, Thailand",NA
2012-10-26,DJ,BUSINESS & INDUSTRY,,2000,"This user review website made a ""noise of pain"" in March 2012 when its stock dropped after a promising IPO",Yelp,NA
2012-10-26,DJ,"THANKS FOR THE TITLE, SHAKESPEARE",,2000,This title of David Foster Wallace's second novel comes from Hamlet's description of Yorick,Infinite Jest,NA
2012-10-26,DJ,"LET'S HAVE A ""BALL""",,2000,"Named for a famous engineer & inventor, it's a round molecule with 60 carbon atoms",a buckyball,NA
2012-10-26,FJ,21st CENTURY GAMES,,NA,The villains in this game were inspired by the swine flu epidemic scare,Angry Birds,NA
