date,round,category,comment,value,clue,response,link
2013-01-21,J,FILL THE PRESCRIPTION,,200,"Used to combat OCD as well as depression, it preceded ""nation"" in the title of a bestselling memoir",Prozac,NA
2013-01-21,J,"""T"" TIME",,200,None dare accuse me of wearing one of these headdresses,a tiara,http://www.j-archive.com/media/2013-01-21_J_01.jpg
2013-01-21,J,SWANS,,200,"Fully black swans are native only to this country, & the Sydney Swans sports team is only found there, too",Australia,NA
2013-01-21,J,RUNNING INTO THE FURNITURE TERMS,,200,It's a part of an elephant & a part of a tree,a trunk,NA
2013-01-21,J,TV THEME SONGS,,200,"This reality series' theme ""Ancient Voices"" is remixed each season to reflect the current locale",Survivor,NA
2013-01-21,J,TABLE OF CONTENTS,,200,"""The metropolis of Lilliput described, together with the emperor's palace""",Gulliver\'s Travels,NA
2013-01-21,J,FILL THE PRESCRIPTION,,400,2 Xs mark the spot in the trade name of this anti-anxiety drug brought to market in 1981,Xanax,NA
2013-01-21,J,"""T"" TIME",,400,This eastern U.S. location was much in the news in March of 1979,Three Mile Island,http://www.j-archive.com/media/2013-01-21_J_03.jpg
2013-01-21,J,SWANS,,400,In Greek myth the beautiful Leda is ravished by this god in the form of a swan,Zeus,NA
2013-01-21,J,RUNNING INTO THE FURNITURE TERMS,,400,"4-letter word for a newspaper department, such as the ""city"" or ""foreign"" one",a desk,NA
2013-01-21,J,TV THEME SONGS,,400,"""Book 'em!"" 3 musicians who played on the original theme of this police series played on the current theme",Hawaii Five-0,NA
2013-01-21,J,TABLE OF CONTENTS,,400,"From 1995, ""The birth of a witch"" & ""City of emeralds""",Wicked,NA
2013-01-21,J,FILL THE PRESCRIPTION,,600,This extremely addictive pain-relieving drug was isolated from opium around 1804,morphine,NA
2013-01-21,J,"""T"" TIME",,600,This monarchy of Asia was never colonized by Europeans,Thailand,http://www.j-archive.com/media/2013-01-21_J_05.jpg
2013-01-21,J,SWANS,,600,Most swans are in this genus,Cygnus,NA
2013-01-21,J,RUNNING INTO THE FURNITURE TERMS,,600,"When you preside over a meeting, you ""take"" this; when sentenced to death, sometimes you ""got"" this",a chair,NA
2013-01-21,J,TV THEME SONGS,,600,"This cartoon's theme begins with mom Lois singing, ""It seems today that all you see is violence in movies & sex on TV""",Family Guy,NA
2013-01-21,J,TABLE OF CONTENTS,,600,"""The Boy Who Lived"" & ""Diagon Alley""",Harry Potter and the Sorceror\'s Stone,NA
2013-01-21,J,FILL THE PRESCRIPTION,,800,Ask your doctor if this cholesterol-lowering drug aka atorvastatin is right for you; do not use it if you have liver disease,Lipitor,NA
2013-01-21,J,"""T"" TIME",,800,It's a swine-like mammal of Asia,a tapir,http://www.j-archive.com/media/2013-01-21_J_06.jpg
2013-01-21,J,SWANS,,800,"A male swan is called a cob & a female swan is called this, where you might keep one on a farm",a pen,NA
2013-01-21,J,RUNNING INTO THE FURNITURE TERMS,,800,"Someone trying artful deception is said to be using ""smoke &"" these",mirrors,NA
2013-01-21,J,TV THEME SONGS,,800,"The catchy lyrics for this sitcom include, ""men men men men, manly men men men""",Two and a Half Men,NA
2013-01-21,J,TABLE OF CONTENTS,,NA,"""Eliza's escape"" & ""Topsy""",Uncle Tom\'s Cabin,NA
2013-01-21,J,FILL THE PRESCRIPTION,,1000,This end-of-the-alphabet antidepressant from Pfizer is also called sertraline,Zoloft,NA
2013-01-21,J,"""T"" TIME",,1000,"Boxing or wrestling ring fixture seen here, used for tightening",a turnbuckle,http://www.j-archive.com/media/2013-01-21_J_07.jpg
2013-01-21,J,SWANS,,1000,"Despite its name, this least vocal swan species can make soft grunting sounds",a mute swan,NA
2013-01-21,J,RUNNING INTO THE FURNITURE TERMS,,1000,"Francis Blair, editor of the Washington Globe, was part of Andrew Jackson's ""kitchen"" one",cabinet,NA
2013-01-21,J,TV THEME SONGS,,1000,"This composer of the ""Simpsons"" theme won an Emmy in 2005 for his theme to ""Desperate Housewives""",Danny Elfman,NA
2013-01-21,J,TABLE OF CONTENTS,,1000,"""I am born"" & ""Mr. Micawber's gauntlet""",David Copperfield,NA
2013-01-21,DJ,THE COSSACKS,,400,"The shapka, this fur item worn by the cossacks, sometimes could be 2 feet tall",a hat,NA
2013-01-21,DJ,OSCARS FOR MAKEUP,,400,"2003:This last of the ""Lord of the Rings"" trilogy",Return of the King,NA
2013-01-21,DJ,MOST POPULOUS COUNTRIES,,400,The 2 in the top 10 found in the Americas,Brazil & the United States,NA
2013-01-21,DJ,"""AN"" THE BEGINNING",,400,An iron block on which metals are hammered into shapes; it also hammers roadrunner-chasing coyotes,an anvil,NA
2013-01-21,DJ,CAPE TOWN,,400,"(Kelly of the Clue Crew reports from Greenmarket Square in Cape Town, South Africa.)  Once the site of slave trading, greenmarket square is now a bustling market where you can buy souvenirs from all over Africa; a popular one is the painted eggs of this big African bird",an ostrich,http://www.j-archive.com/media/2013-01-21_DJ_30a.jpg
2013-01-21,DJ,CONTENTS OF TABLES,,400,"This Middle Eastern salad is made of bulgur wheat, tomatoes, parsley, olive oil & lemon juice",tabbouleh,NA
2013-01-21,DJ,THE COSSACKS,,800,In the 16th century the cossacks defeated the Tatars & gained control of this vast eastern region for Russia,Siberia,NA
2013-01-21,DJ,OSCARS FOR MAKEUP,,800,1984:This period drama about an 18th century composer,Amadeus,NA
2013-01-21,DJ,MOST POPULOUS COUNTRIES,,800,India ranks No. 2 & these 2 countries that straddle it come in at 6 & 8,Pakistan & Bangladesh,NA
2013-01-21,DJ,"""AN"" THE BEGINNING",,800,"With the stress on the first syllable, a building add-on; on the second, to incorporate another country's territory",an annex,NA
2013-01-21,DJ,CAPE TOWN,,800,"(Kelly of the Clue Crew reports from St. George's Cathedral in Cape Town, South Africa.)  St. George's is known in Cape Town as the people's cathedral; in the 1980s, the weekly sermons of this archbishop made it a center of resistance to apartheid",Desmond Tutu,http://www.j-archive.com/media/2013-01-21_DJ_17a.jpg
2013-01-21,DJ,CONTENTS OF TABLES,,800,This rich & creamy potato & leek soup is served cold & garnished with chives,vichyssoise,NA
2013-01-21,DJ,THE COSSACKS,,1200,In 1995 this Russian president announced he was restoring Cossack units to the Russian army,Yeltsin,NA
2013-01-21,DJ,OSCARS FOR MAKEUP,,1200,1996:This Eddie Murphy remake of a Jerry Lewis film,The Nutty Professor,NA
2013-01-21,DJ,MOST POPULOUS COUNTRIES,,1200,"A population of 81 million makes this nation No. 16, & No. 1 in western Europe",Germany,NA
2013-01-21,DJ,"""AN"" THE BEGINNING",,1200,"A collection of writings by various authors, often from a specific period",an anthology,NA
2013-01-21,DJ,CAPE TOWN,,1200,"(Sarah of the Clue Crew delivers the clue from St. George's Cathedral, in Cape Town, South Africa.)  In Cape Town's celebrated west window of St. George's cathedral, one panel depicts this man of peace, who first espoused the doctrine of nonviolence while living in South Africa",Gandhi,http://www.j-archive.com/media/2013-01-21_DJ_01a.jpg
2013-01-21,DJ,CONTENTS OF TABLES,,1200,"This type of crab, the pride of the Pacific coast, is named for a place in Washington State",Dungeness,NA
2013-01-21,DJ,THE COSSACKS,,1600,"Tolstoy wrote that for Cossacks being in this state is ""a rite, the non-fulfillment of which would be... apostasy""",drunkenness,NA
2013-01-21,DJ,OSCARS FOR MAKEUP,,1600,1985:This Cher film about a boy with craniodiaphyseal dysplasia,Mask,NA
2013-01-21,DJ,MOST POPULOUS COUNTRIES,,NA,It represents Africa in the top 10,Nigeria,NA
2013-01-21,DJ,"""AN"" THE BEGINNING",,1600,The runner who goes last for a team in a relay race,the anchor leg,NA
2013-01-21,DJ,CAPE TOWN,,NA,"(Sarah of the Clue Crew reports from Cape Town, South Africa.)  Released after 27 years in prison, Nelson Mandela gave his first public speech from Cape Town's city hall; he began by leading the crowd in the chant ""amandla ngawethu""--""power is ours""--the rallying cry of this party",the ANC (African National Congress),http://www.j-archive.com/media/2013-01-21_DJ_02a.jpg
2013-01-21,DJ,CONTENTS OF TABLES,,1600,"The Brits call this pungent salad green ""rocket""",arugula,NA
2013-01-21,DJ,THE COSSACKS,,2000,"The city of Kharkiv, founded by cossacks to protect Russia's borders, is now in this former SSR",the Ukraine,NA
2013-01-21,DJ,OSCARS FOR MAKEUP,,2000,2006:This Guillermo del Toro fantasy,Pan\'s Labyrinth,NA
2013-01-21,DJ,MOST POPULOUS COUNTRIES,,2000,"No. 15, the largest Arab country by population is this North African country with 84 million",Egypt,NA
2013-01-21,DJ,"""AN"" THE BEGINNING",,2000,"A sometimes fatal allergic reaction to bee venom is this type of ""shock""",anaphylactic,NA
2013-01-21,DJ,CAPE TOWN,,2000,"(Sarah of the Clue Crew reports from Cape Town, South Africa.)  What's now Cape Town's vibrant Victoria & Alfred Waterfront began as a single jetty built for this Dutch company, whose name tells you it used South Africa as a stopover en route to Asia",the Dutch East India Company,http://www.j-archive.com/media/2013-01-21_DJ_03.jpg
2013-01-21,DJ,CONTENTS OF TABLES,,2000,Prosciutto is Italian ham; this is Italian bacon from the pork belly,pancetta,NA
2013-01-21,FJ,MUSEUMS,,NA,"Opened in 2012, the Belfast museum seen here commemorates this, also constructed there",the Titanic,http://www.j-archive.com/media/2013-01-21_FJ.jpg
