date,round,category,comment,value,clue,response,link
2013-01-29,J,MINT MARKS,,200,"""S"" is for this city where giants dwell",San Francisco,NA
2013-01-29,J,RECENT BOOKS,,200,"In this man's bio: ""The enterprise he started in his parents' garage became the world's most valuable company""",Steve Jobs,NA
2013-01-29,J,AMERICAN KNIGHTS,,200,This evangelist was knighted in 2001 by the British ambassador on behalf of the queen,Billy Graham,NA
2013-01-29,J,THE RACE IS ON,,200,"Held at Churchill Downs, it's popularly known as the ""Run for the Roses""",the Kentucky Derby,NA
2013-01-29,J,NATURE,,200,"Sharks can have as many as 5 rows of these, which fall out & grow back",teeth,NA
2013-01-29,J,WE'RE PULLING 3 Gs,"(Alex: Each correct response has three ""G""s in it.)",200,Many airlines now charge a fee to check any amount of this,baggage,NA
2013-01-29,J,MINT MARKS,,400,"""P"" is for this city, brother",Philadelphia,NA
2013-01-29,J,RECENT BOOKS,,400,"You must remember Eric van Lustbader's ""The Bourne Imperative"" is based on a character created by this man",(Robert) Ludlum,NA
2013-01-29,J,AMERICAN KNIGHTS,,400,"In 2001 the queen's list of new knights included this director of ""Schindler's List""",Spielberg,NA
2013-01-29,J,THE RACE IS ON,,400,"It's held over a 3-week period in July & covers more than 2,000 miles before ending in Paris",the Tour de France,NA
2013-01-29,J,NATURE,,400,These large North American snakes get their name from their habit of feeding on other snake species; long live the...,a king snake,http://www.j-archive.com/media/2013-01-29_J_08a.jpg
2013-01-29,J,WE'RE PULLING 3 Gs,"(Alex: Each correct response has three ""G""s in it.)",400,"Mary, Mary why you doing this to a room by putting in a hidden microphone?",bugging,NA
2013-01-29,J,MINT MARKS,,600,"""CC"" is for this state capital",Carson City,NA
2013-01-29,J,RECENT BOOKS,,600,"From this novel: ""'I've killed him,' 'More will come,' Abe had already begun to walk away, 'Then I shall need more stakes""'",Abraham Lincoln: Vampire Hunter,NA
2013-01-29,J,AMERICAN KNIGHTS,,600,"In 2009, 6 months before his death, this giant of Massachusetts politics got a knighthood",Teddy Kennedy,NA
2013-01-29,J,THE RACE IS ON,,600,"Held annually in Florida, it was the first NASCAR race to be televised nationally from start to finish",the Daytona 500,NA
2013-01-29,J,NATURE,,600,"The world's largest flower, the Rafflesia, which has no stems or leaves, is this type of plant that lives off a host",a parasite,http://www.j-archive.com/media/2013-01-29_J_13a.jpg
2013-01-29,J,WE'RE PULLING 3 Gs,"(Alex: Each correct response has three ""G""s in it.)",600,Large spectacles with protective rims used to prevent eye injuries,goggles,NA
2013-01-29,J,MINT MARKS,,800,"""W"" is for this home of cadets",West Point,NA
2013-01-29,J,RECENT BOOKS,,800,"In 2012 these 2 words preceded ""Darker"" & ""Freed"" on The New York Times bestseller list",Fifty Shades,NA
2013-01-29,J,AMERICAN KNIGHTS,,NA,"For his ""outstanding contribution to global economic stability"", he was honored in 2002",Greenspan,NA
2013-01-29,J,THE RACE IS ON,,800,"This ""All-American"" competition was inspired by 3 boys in the 1930s racing homemade engineless cars down an incline",the Soapbox Derby,NA
2013-01-29,J,NATURE,,800,"Growing up to two feet long, this desert dweller is the largest lizard native to the United States",a gila monster,http://www.j-archive.com/media/2013-01-29_J_14.jpg
2013-01-29,J,WE'RE PULLING 3 Gs,"(Alex: Each correct response has three ""G""s in it.)",800,2-word term for a woman who weds chiefly for financial gain; now I ain't sayin' she's one,a gold digger,NA
2013-01-29,J,MINT MARKS,,1000,"A ""C"" on gold coins stands for this city named for George III's queen",Charlotte,NA
2013-01-29,J,RECENT BOOKS,,1000,"In addition to ""A Feast of Crows"", this novelist penned the short story collection ""Songs the Dead Men Sing""",George R.R. Martin,NA
2013-01-29,J,AMERICAN KNIGHTS,,1000,This American who helped find the double helix of DNA was double tapped,Watson,NA
2013-01-29,J,THE RACE IS ON,,1000,A world famous yacht race takes place annually from Sydney to this capital of Tasmania,Hobart,NA
2013-01-29,J,NATURE,,1000,"In trees such as pines & firs, the seeds form in these",cones,NA
2013-01-29,J,WE'RE PULLING 3 Gs,"(Alex: Each correct response has three ""G""s in it.)",1000,Alton Brown's recipe for this Christmastime beverage includes Bourbon,eggnog,NA
2013-01-29,DJ,MINT MARKS,,400,The tins that house these mints are repurposed to hold all sorts of curious things,Altoids,http://www.j-archive.com/media/2013-01-29_DJ_24.jpg
2013-01-29,DJ,THE ARTIST,,400,"The influence of Toulouse-Lautrec & Gauguin can be seen in this Norwegian's ""The Scream""",(Edvard) Munch,NA
2013-01-29,DJ,FOREIGN WORDS & PHRASES,,400,"This Jewish drinking toast means ""to life""",l\'chaim,NA
2013-01-29,DJ,THE 1940s,,400,"In 1949 Moscow set up a council for economic mutual assistance to rival this ""plan"" of U.S. aid to Europe",the Marshall plan,NA
2013-01-29,DJ,HONORARY ACADEMY AWARDS,,400,"2001:To this ""actor, director, producer, creator of Sundance""",Robert Redford,NA
2013-01-29,DJ,"""E""-OGRAPHY","(Each correct response will begin with the letter ""E"".)",400,A country in South America,Ecuador,NA
2013-01-29,DJ,MINT MARKS,,800,Looking at its logo you can almost hear the name of the Swiss minty cough drops echo through the Alps,Ricola,http://www.j-archive.com/media/2013-01-29_DJ_27.jpg
2013-01-29,DJ,THE ARTIST,,800,"His 1883-84 ""Une Baignade, Asnières"" is seen here. Get the pointillism?",Seurat,http://www.j-archive.com/media/2013-01-29_DJ_02.jpg
2013-01-29,DJ,FOREIGN WORDS & PHRASES,,800,"This Latin motto of the U.S. Marine Corps means ""always faithful""",semper fidelis,NA
2013-01-29,DJ,THE 1940s,,800,"Seems odd, but in the 1940s this man's act with Charlie McCarthy was a smash on radio",Edgar Bergen,NA
2013-01-29,DJ,HONORARY ACADEMY AWARDS,,800,"1927:""To Warner Bros. for producing"" this movie, ""the pioneer outstanding talking picture""",The Jazz Singer,NA
2013-01-29,DJ,"""E""-OGRAPHY","(Each correct response will begin with the letter ""E"".)",800,"The bard called it ""this scepter'd isle""",England,NA
2013-01-29,DJ,MINT MARKS,,1200,"These alliterative breath fresheners are ""less than 2 calories per mint""",Tic-Tacs,http://www.j-archive.com/media/2013-01-29_DJ_28a.jpg
2013-01-29,DJ,THE ARTIST,,1200,Artist Jan Brueghel was the son & the brother of artists with   this first name,Pieter,NA
2013-01-29,DJ,FOREIGN WORDS & PHRASES,,1200,"ABBA can thank the Italians for this phrase used to express surprise, sorrow,  happiness, you name it",Mamma Mia,NA
2013-01-29,DJ,THE 1940s,,1200,"Created in 1942, this ""project"" was commanded by general Leslie Groves",the Manhattan Project,NA
2013-01-29,DJ,HONORARY ACADEMY AWARDS,,NA,"1966:To Yakima Canutt ""for achievements as"" one of these & ""for developing safety devices to protect"" them",a stuntman,NA
2013-01-29,DJ,"""E""-OGRAPHY","(Each correct response will begin with the letter ""E"".)",1200,Uganda city of commando raid fame,Entebbe,NA
2013-01-29,DJ,MINT MARKS,,1600,It's always time for one of these British mint chocolates,an After Eight,http://www.j-archive.com/media/2013-01-29_DJ_29a.jpg
2013-01-29,DJ,THE ARTIST,,1600,"Some of his paintings include ""Jew in Green"" & ""The Praying Jew"" (also called ""The Rabbi of Vitebsk"")",(Marc) Chagall,NA
2013-01-29,DJ,FOREIGN WORDS & PHRASES,,1600,"In Japanese konbanwa means ""good evening""; this means ""good afternoon""",konichiwa,NA
2013-01-29,DJ,THE 1940s,,NA,In 1948 Ilona Elek retained her Olympic fencing title--pretty impressive as the previous title was in this year,1936,NA
2013-01-29,DJ,HONORARY ACADEMY AWARDS,,1600,"1948:Give a hand & a foot to this iconic theater owner ""who raised the standard of exhibition of motion pictures""",Sid Grauman,NA
2013-01-29,DJ,"""E""-OGRAPHY","(Each correct response will begin with the letter ""E"".)",1600,Cape Columbia on this island is Canada's northernmost point,Ellesmere,NA
2013-01-29,DJ,MINT MARKS,,2000,These mints have round containers; talk to her about that if you can't think of anything to say,Icebreakers,http://www.j-archive.com/media/2013-01-29_DJ_30.jpg
2013-01-29,DJ,THE ARTIST,,2000,"This impressionist's ""Le Moulin de la Galette"" shows ordinary people in an open-air dance hall",Renoir,NA
2013-01-29,DJ,FOREIGN WORDS & PHRASES,,2000,"German word for a political union, like the one that joined Germany & Austria in 1938",Anschluss,NA
2013-01-29,DJ,THE 1940s,,2000,He subbed in conducting the New York Philharmonic in November of 1943 and shot to fame,Leonard Bernstein,http://www.j-archive.com/media/2013-01-29_DJ_15.jpg
2013-01-29,DJ,HONORARY ACADEMY AWARDS,,2000,"1989:To this Asian director who has ""influenced filmmakers throughout the world""",(Akira) Kurosawa,NA
2013-01-29,DJ,"""E""-OGRAPHY","(Each correct response will begin with the letter ""E"".)",2000,Title Kentucky city of an Orlando Bloom movie,Elizabethtown,NA
2013-01-29,FJ,METEOROLOGICAL TERMS,,NA,In the 1940s an anemometer aided Antarctic experiments that 1st determined this measurement heard in weather reports,wind chill,NA
