date,round,category,comment,value,clue,response,link
2005-06-22,J,AUSTRALIAN WILDLIFE,,200,The male platypus has a spur on its heel connected to a gland that delivers a type of this,poison,NA
2005-06-22,J,EMMY-WINNING ROLES,"(Alex: You have to name the role, not the show.)",200,For 2000-2001:James Gandolfini,Tony Soprano,NA
2005-06-22,J,"GEE, YOU SMELL TERRIFIC",,200,"""Forget your troubles, come on get"" this fragance from Clinique with a hint of citrus & a wealth of flowers",Happy,NA
2005-06-22,J,2004 NEW YORK TIMES BESTSELLERS,,200,"This ""Simple Life""r's ""Confessions of an Heiress"" made the list",Paris Hilton,NA
2005-06-22,J,POPULATIONS,,200,"In both area & population, this continent is the largest",Asia,NA
2005-06-22,J,"TO ""EACH"" HIS OWN",,200,"It can precede  ""of contract"", ""of faith"", ""of promise"" or ""of trust""",breach,NA
2005-06-22,J,AUSTRALIAN WILDLIFE,,400,"Brought to Australia c. 3000 B.C., this canine is the continent's largest hunting mammal, besides man",the dingo,NA
2005-06-22,J,EMMY-WINNING ROLES,"(Alex: You have to name the role, not the show.)",400,For 1976-77:Lindsay Wagner,the Bionic Woman (Jaime Sommers),NA
2005-06-22,J,"GEE, YOU SMELL TERRIFIC",,400,"Hats off, cowboys, to Coty, which makes both ""Lady"" and manly versions of this cologne",Stetson,NA
2005-06-22,J,2004 NEW YORK TIMES BESTSELLERS,,400,Lots of people forked over $35 to read this autobiography of Bill Clinton,My Life,NA
2005-06-22,J,POPULATIONS,,400,The Earth's population hit this landmark figure around 1800,one billion,NA
2005-06-22,J,"TO ""EACH"" HIS OWN",,400,"Try to convince someone who's already on yours side & you're doing this ""to the choir""",preach,NA
2005-06-22,J,AUSTRALIAN WILDLIFE,,600,This furry cutie spends most of its daylight hours sleeping in the fork of a eucalyptus tree,a koala bear,NA
2005-06-22,J,EMMY-WINNING ROLES,"(Alex: You have to name the role, not the show.)",600,For 1960-61:Raymond Burr,Perry Mason,NA
2005-06-22,J,"GEE, YOU SMELL TERRIFIC",,600,This classic men's cologne shares its name with a musketeer,Aramis,NA
2005-06-22,J,2004 NEW YORK TIMES BESTSELLERS,,600,"In book 10, ""The Slippery Slope"", this author's Baudelaire siblings are at it again",Lemony Snicket,NA
2005-06-22,J,POPULATIONS,,NA,This New England state has the smallest population of any state east of the Mississippi River,Vermont,NA
2005-06-22,J,"TO ""EACH"" HIS OWN",,600,"To challenge the credibility of a witness, or to accuse a public official of misconduct in office",impeach,NA
2005-06-22,J,AUSTRALIAN WILDLIFE,,800,North Australia is a habitat of the saltwater species of this reptile that has reached 30 feet in length,a crocodile,NA
2005-06-22,J,EMMY-WINNING ROLES,"(Alex: You have to name the role, not the show.)",800,For 1983-84:John Ritter,Jack Tripper,NA
2005-06-22,J,"GEE, YOU SMELL TERRIFIC",,800,In 1973 Revlon launched this top-selling perfume reportedly named for one of the company's founders,Charlie,NA
2005-06-22,J,2004 NEW YORK TIMES BESTSELLERS,,800,"""Today"" we'll tell you this in ""Skywriting"" this TV personality told of her struggle with bipolar disorder",Jane Pauley,NA
2005-06-22,J,POPULATIONS,,800,About 1/3 of this Himalayan monarchy's population is Nepalese; most of the rest is of Tibetan ancestry,Bhutan,NA
2005-06-22,J,"TO ""EACH"" HIS OWN",,800,"A person who lives by gathering saleable articles of jetsam, refuse & the like from the seashore",beachcomber,NA
2005-06-22,J,AUSTRALIAN WILDLIFE,,1000,The long-beaked species of this monotreme lives in New Guinea; the short-beaked lives in Australia,an echidna,NA
2005-06-22,J,EMMY-WINNING ROLES,"(Alex: You have to name the role, not the show.)",1000,For 1967-68:Werner Klemperer,Colonel Klink,NA
2005-06-22,J,"GEE, YOU SMELL TERRIFIC",,1000,"This earthy scent from Demeter is described as ""a nice potting soil mixed with the citrus smell of fresh grass""",Dirt,NA
2005-06-22,J,2004 NEW YORK TIMES BESTSELLERS,,1000,"This former presidential candidate & TV commentator made the list with ""Where the Right Went Wrong""",Patrick Buchanan,NA
2005-06-22,J,POPULATIONS,,1000,The population of Saudi Arabia is about 90 percent this branch of Islam,Sunni,NA
2005-06-22,J,"TO ""EACH"" HIS OWN",,1000,This 11-letter adjective can mean untrustworthy or hazardous,treacherous,NA
2005-06-22,DJ,MARCH MADNESS,,400,"March 29, 1792:King Gustav III of this nation is assassinated at a masquerade ball",Sweden,NA
2005-06-22,DJ,WHAT A BROADWAY CHARACTER!,,400,The verdict is in: a dozen unnamed & notably indignant jurors gave this drama its title,Twelve Angry Men,NA
2005-06-22,DJ,ALSO A BODY PART,,400,"An inlet or cove, or to equip with weapons",arm,NA
2005-06-22,DJ,& NEVER THE TWAINS SHALL MEET,,400,"Shania Twain was born on Aug. 28, 1965 in Windsor, Canada; Mark Twain, on Nov. 30, 1835 in this state",Missouri,NA
2005-06-22,DJ,CRIME,,400,"Of first, second or third degree, murder by poison usually falls under this designation",first degree,NA
2005-06-22,DJ,THE THINGS YOU SAY!,,400,"It's what you do when casually offering ""a hint"" or ""a name"", hoping someone picks it up",drop,NA
2005-06-22,DJ,MARCH MADNESS,,800,"March 5, 1770:British troops gun down 5 American colonists in the event that would become known as this",the Boston Massacre,NA
2005-06-22,DJ,WHAT A BROADWAY CHARACTER!,,800,"(Jimmy of the Clue Crew reports from the set of the Majestic Theatre, New York.) The Phantom of the Opera calls Christine a little viper when she does this to him here in his underground lair",unmasks him,http://www.j-archive.com/media/2005-06-22_DJ_03.jpg
2005-06-22,DJ,ALSO A BODY PART,,800,One of the stretches in a relay race,a leg,NA
2005-06-22,DJ,& NEVER THE TWAINS SHALL MEET,,800,Shania's given name is Eilleen Regina Edwards; Mark's was this (including his middle name),Samuel Langhorne Clemens,NA
2005-06-22,DJ,CRIME,,800,"Since 1993, rape by this person has been a crime in all 50 states; it isn't one in most other countries",a husband (or spouse),NA
2005-06-22,DJ,THE THINGS YOU SAY!,,800,"Powerful people may be surrounded by these ""men"" named for the syllable they often utter",yes men,NA
2005-06-22,DJ,MARCH MADNESS,,1200,"March 16, 1935:Hitler orders Germany to rearm itself in violation of this treaty",the Treaty of Versailles,NA
2005-06-22,DJ,WHAT A BROADWAY CHARACTER!,,1200,"Yikes!  A flame device that uses liquid butane is part of this ""Beauty and the Beast"" character's costume",Lumiere,NA
2005-06-22,DJ,ALSO A BODY PART,,1200,"A card game participant, as in ""Sir Nigel, we need a fourth"" one ""at whist""",hand,NA
2005-06-22,DJ,& NEVER THE TWAINS SHALL MEET,,1200,Mark first visited this city in 1872; in 1999 Shania played the Prince's Trust concert in Hyde Park there,London,NA
2005-06-22,DJ,CRIME,,NA,"Two-word name for the crime seen here in a Goya painting, or an informal term for overcharging",highway robbery,http://www.j-archive.com/media/2005-06-22_DJ_10.jpg
2005-06-22,DJ,THE THINGS YOU SAY!,,1200,"It's a 5-letter archaic word for ""the truth""; a ""sayer"" of it speaks truth about the future",sooth,NA
2005-06-22,DJ,MARCH MADNESS,,1600,"March 28, 1854:The U.K. & France declare war on Russia, beginning this war",the Crimean War,NA
2005-06-22,DJ,WHAT A BROADWAY CHARACTER!,,1600,"This musical features vaudeville cutie Baby June, who, in real life, grew up to be actress June Havoc",Gypsy,NA
2005-06-22,DJ,ALSO A BODY PART,,1600,"10 penny, 16 penny or 20 penny, for example",a nail,NA
2005-06-22,DJ,& NEVER THE TWAINS SHALL MEET,,1600,"In 1870 Mark married the lovely Olivia Langdon; in 1993 Shania wed this adorable ""mutt""",Robert Mutt Lange,NA
2005-06-22,DJ,CRIME,,1600,In 2004 the U.S. government announced the first capital prosecution in a case involving smuggling these,immigrants (into the U.S.),NA
2005-06-22,DJ,THE THINGS YOU SAY!,,NA,"""Make a clean breast"" & ""go to pot"" are in the ""American Heritage Dictionary of"" these, which give ESL students fits",idioms,NA
2005-06-22,DJ,MARCH MADNESS,,2000,"March 1967:She, Joseph Stalin's last surviving child, asks for asylum at the U.S. embassy in New Delhi",Svetlana Stalin,NA
2005-06-22,DJ,WHAT A BROADWAY CHARACTER!,,2000,"(Sarah of the Clue Crew reports from the set of the Gershwin Theatre, New York.)  The name ""Elphaba"", the leading character in ""Wicked"", is derived from the initials of this famous author",L. Frank Baum,http://www.j-archive.com/media/2005-06-22_DJ_06.jpg
2005-06-22,DJ,ALSO A BODY PART,,2000,"To tease, or a primary vein of a leaf",a rib,NA
2005-06-22,DJ,& NEVER THE TWAINS SHALL MEET,,2000,"Shania's self-titled debut went gold in 1996; in 1873 Mark's first novel had this ""golden""-sounding title",The Gilded Age,NA
2005-06-22,DJ,CRIME,,2000,It's a form of extortion or blackmail under the guise of keeping you or your business safe,protection,NA
2005-06-22,DJ,THE THINGS YOU SAY!,,2000,Solipsism says that the self is the only reality; this -ism is a general term for a verbal impropriety,solecism,NA
2005-06-22,FJ,HISTORIC NAMES,,NA,"The first name of this man born February 15, 1564 was derived from his parents' surname, a common Tuscan habit at that time",Galileo Galilei,NA
