date,round,category,comment,value,clue,response,link
2013-03-07,J,THE 18th CENTURY,,200,1701 saw Captain William Kidd hanged for this crime,piracy,NA
2013-03-07,J,SINGERS PORTRAYED ON FILM,,200,Jamie Foxx won an Oscar for playing this soulful legend,Ray Charles,NA
2013-03-07,J,OYSTER STEW,,200,Special oyster knives are available to make this process of opening the shell & removing the meat easier,shucking,NA
2013-03-07,J,LONDON TRANSPORTATION,,200,This largest airport serving London has 4 holding areas over southern England for aircraft waiting to land,Heathrow,NA
2013-03-07,J,LETTERS & WORDS,,200,It's the first U.S. state alphabetically,Alabama,NA
2013-03-07,J,MARYLAND,,200,"This river forms part of Maryland's border with West Virginia, then flows on to Chesapeake Bay",Potomac,NA
2013-03-07,J,THE 18th CENTURY,,400,"The first country to do so, Denmark decreed in 1792 it would abolish trade in these",slaves,NA
2013-03-07,J,SINGERS PORTRAYED ON FILM,,400,"""Oh, boy!"" Gary Busey played this early rocker whose fame will ""not fade away""",Buddy Holly,NA
2013-03-07,J,OYSTER STEW,,400,The Puget Sound area is famous for these small oysters that rarely exceed 1 1/2 inches,Olympia oysters,NA
2013-03-07,J,LONDON TRANSPORTATION,,400,"Until Westminster Bridge opened in 1750, London Bridge was the city's only crossing over this river",Thames,NA
2013-03-07,J,LETTERS & WORDS,,400,"At 10 points apiece, these 2 letters have the highest value in Scrabble",Q and Z,NA
2013-03-07,J,MARYLAND,,400,"It was founded at Fort Severn, on a river in Annapolis, in 1845",United States Naval Academy,NA
2013-03-07,J,THE 18th CENTURY,,600,"1780s Americans who advocated a strong central government used this name, today associated with states' rights",Federalists,NA
2013-03-07,J,SINGERS PORTRAYED ON FILM,,600,J.Lo's career exploded when she played this slain Tejano singer,Selena,NA
2013-03-07,J,OYSTER STEW,,600,"Comedy in which Pistol says to Falstaff, ""why then the world's mine oyster, which I with sword will open""",The Merry Wives of Windsor,NA
2013-03-07,J,LONDON TRANSPORTATION,,600,The Underground has been known by this shorter nickname since 1890 when the first deep-level electric railway line opened,The Tube,NA
2013-03-07,J,LETTERS & WORDS,,600,"From Quechua, it's the word for bats' or birds' droppings",guano,NA
2013-03-07,J,MARYLAND,,600,This Maryland university was named for an investor in the B&O railroad who died Christmas Eve 1873,Johns Hopkins,NA
2013-03-07,J,THE 18th CENTURY,,800,"From 1701 to 1714 much of Europe was drawn into the war of this ""succession""",Spanish,NA
2013-03-07,J,SINGERS PORTRAYED ON FILM,,800,"Marion Cotillard showed us life wasn't so rosy as this chanteuse in ""La Vie en Rose""",Édith Piaf,NA
2013-03-07,J,OYSTER STEW,,800,"As its name indicates, this bird is a natural enemy of the oyster",oystercatcher,http://www.j-archive.com/media/2013-03-07_J_19.jpg
2013-03-07,J,LONDON TRANSPORTATION,,800,"To do their job, they must pass an exam known as ""The Knowledge"" to show they know all of London's streets",cab drivers,NA
2013-03-07,J,LETTERS & WORDS,,800,The 2 lowercase letters of the English alphabet that have a tittle,I & J,NA
2013-03-07,J,MARYLAND,,800,A house in St. Michaels is named for one of these spheres fired at it in the War of 1812,cannonball,NA
2013-03-07,J,THE 18th CENTURY,,NA,"Working with Peter the Great's navy, this explorer went ""strait"" to the water routes between Siberia & North America",Bering,NA
2013-03-07,J,SINGERS PORTRAYED ON FILM,,1000,"In ""Nowhere Boy"" Aaron Johnson played him as a teenaged lad",John Lennon,NA
2013-03-07,J,OYSTER STEW,,1000,"This dish of oysters on the half shell topped with spinach, butter & bread-crumbs was named for its richness",Oysters Rockefeller,NA
2013-03-07,J,LONDON TRANSPORTATION,,1000,"In 2012 a redesigned, hybrid, but still red version of this iconic London transport hit the roads",double-decker bus,NA
2013-03-07,J,LETTERS & WORDS,,1000,It's the human sex chromosome women don't have,Y,NA
2013-03-07,J,MARYLAND,,1000,"To watch the Redskins play, head to this county named for Queen Anne's husband",Prince George\'s County,NA
2013-03-07,DJ,"STARTING ""EN""",,400,"""Close"" or not, it's an unplanned or unexpected meeting",encounter,NA
2013-03-07,DJ,LAWYER/ AUTHORS NOT JOHN GRISHAM,,400,"Royall Tyler's ""The Contrast"", the 1st professionally produced American comedy, opened April 16, 1787 in this city",New York City,NA
2013-03-07,DJ,THAT '80s SHOW,,400,"In 1986 his ""playhouse"" premiered on Saturday morning television",Pee-wee (Herman),NA
2013-03-07,DJ,SHARP (& FLAT) INSTRUMENTS,,400,"Don't tell Weird Al, but Ambrose Bierce called this ""an instrument in harmony with the sentiments of an assassin""",accordion,NA
2013-03-07,DJ,A HORSE OF A DIFFERENT COLOR,,400,"A nut roasted at Christmastime, or a horse with red as a base color",chestnut,NA
2013-03-07,DJ,MARRY LAND,(Alex: You have to identify the country where the marriage took place.),400,"Rainier & Grace, April 19, 1956",Monaco,NA
2013-03-07,DJ,"STARTING ""EN""",,800,Deep-seated hatred,enmity,NA
2013-03-07,DJ,LAWYER/ AUTHORS NOT JOHN GRISHAM,,800,"With the success of novels like ""Treasure Island"" for this author, the law would have to wait; he never practiced",(Robert Louis) Stevenson,NA
2013-03-07,DJ,THAT '80s SHOW,,800,"During the run of this show, Robert Guillaume rose through the ranks from butler to lieutenant governor",Benson,NA
2013-03-07,DJ,SHARP (& FLAT) INSTRUMENTS,,800,"According to Fortune magazine, ""nothing says 'dropping out of society' like learning"" this 5-string twanger",banjo,NA
2013-03-07,DJ,A HORSE OF A DIFFERENT COLOR,,800,"Roy Rogers' Trigger was this type of horse, with a golden coat and a white mane and tail",palomino,http://www.j-archive.com/media/2013-03-07_DJ_02.jpg
2013-03-07,DJ,MARRY LAND,(Alex: You have to identify the country where the marriage took place.),800,"Nicole Kidman & Keith Urban, June 25, 2006",Australia,NA
2013-03-07,DJ,"STARTING ""EN""",,1200,"Lipase, which breaks down fats in the small intestine, is one of these proteins",enzyme,NA
2013-03-07,DJ,LAWYER/ AUTHORS NOT JOHN GRISHAM,,1200,"Elmer Rice must have aced Constitution class, as he titled a 1933 play these first 3 words of the Preamble",We the People,NA
2013-03-07,DJ,THAT '80s SHOW,,1200,"This series starred Pernell Roberts as a character also seen on ""M*A*S*H""","Trapper John, M.D.",NA
2013-03-07,DJ,SHARP (& FLAT) INSTRUMENTS,,1200,An old joke says that golf was invented by the same people who think that music comes out of these,bagpipes,NA
2013-03-07,DJ,A HORSE OF A DIFFERENT COLOR,,1200,"Tan or brown horses with black points on the mane, tail & ears are this type, like a coastal indentation",bay,NA
2013-03-07,DJ,MARRY LAND,(Alex: You have to identify the country where the marriage took place.),1200,"Maria Augusta Kutschera & Georg Von Trapp, November 26, 1927",Austria,NA
2013-03-07,DJ,"STARTING ""EN""",,1600,It's a letter from the pope to Catholic churches worldwide,encyclical,NA
2013-03-07,DJ,LAWYER/ AUTHORS NOT JOHN GRISHAM,,1600,This book by lawyer Louis Begley was about a retiring lawyer; the Jack Nicholson movie made him an insurance man,About Schmidt,NA
2013-03-07,DJ,THAT '80s SHOW,,1600,This sitcom starred Mark Linn-Baker & Bronson Pinchot as distant cousins Larry & Balki,Perfect Strangers,NA
2013-03-07,DJ,SHARP (& FLAT) INSTRUMENTS,,1600,"(Kelly of The Clue Crew presents the clue.)The sound of this symbol of South African soccer can hit 127 decibels, louder than a jet engine; there were thousands at the 2010 FIFA World Cup",vuvuzela,http://www.j-archive.com/media/2013-03-07_DJ_16.jpg
2013-03-07,DJ,A HORSE OF A DIFFERENT COLOR,,1600,"The ""strawberry"" type of this horse has white hairs interspersed throughout a base coat of red",roan,NA
2013-03-07,DJ,MARRY LAND,(Alex: You have to identify the country where the marriage took place.),1600,"Pierre Trudeau & Margaret Sinclair, March 4, 1971",Canada,NA
2013-03-07,DJ,"STARTING ""EN""",,NA,The measure of disorder or randomness in a closed system,entropy,NA
2013-03-07,DJ,LAWYER/ AUTHORS NOT JOHN GRISHAM,,2000,"This 3-named poet maintained his successful Chicago law practice while penning works like ""Spoon River Anthology""",Edgar Lee Masters,NA
2013-03-07,DJ,THAT '80s SHOW,,2000,"Glenn Frey's song ""You Belong to the City"" was written specially for this show",Miami Vice,NA
2013-03-07,DJ,SHARP (& FLAT) INSTRUMENTS,,NA,"Mark Twain complained of ""the snorting of an unholy"" one of these; lucky for him there weren't 75 more",trombone,NA
2013-03-07,DJ,A HORSE OF A DIFFERENT COLOR,,2000,"A sandy or tan horse with all-black points is this type, like a deer hide worn by a frontiersman",buckskin,NA
2013-03-07,DJ,MARRY LAND,(Alex: You have to identify the country where the marriage took place.),2000,"Albert Einstein & Milena Maric, January 6, 1903",Switzerland,NA
2013-03-07,FJ,THE WESTERN HEMISPHERE,,NA,One of the 2 Central American countries never under military rule in the last 50 years,Costa Rica or Belize,NA
