date,round,category,comment,value,clue,response,link
2013-03-22,J,WE PUT CHARACTERS ON TRIAL,,200,"Your honor, this lad aka Jack Dawkins was clearly in cahoots with Fagin",the Artful Dodger,NA
2013-03-22,J,IVY LEAGUE ALMA MATERS,,200,John F. Kennedy & brother Ted,Harvard,NA
2013-03-22,J,TRACK & FIELD,,200,James Connolly was the 1st modern Olympic champion; in 1896 he won this event that then consisted of 2 hops & a jump,the triple jump,NA
2013-03-22,J,LOOKING GOOD!,,200,"You've lost 60 pounds!  What's your secret?  Oh, this alliterative group founded in the '70s by Jean Nidetch",Weight Watchers,NA
2013-03-22,J,THINK GLOBAL,,200,About 27% of the area of the Netherlands is below this level,sea level,NA
2013-03-22,J,"""ACT"" LOCAL",,200,It's not a doll!  My G.I. Joe is known by this 2-word term,an action figure,NA
2013-03-22,J,WE PUT CHARACTERS ON TRIAL,,NA,It's no surprise that this Thomas Hardy title stonemason gives unclear responses on the witness stand,Jude the Obscure,NA
2013-03-22,J,IVY LEAGUE ALMA MATERS,,400,Queen Noor of Jordan & Brooke Shields,Princeton,NA
2013-03-22,J,TRACK & FIELD,,400,"Over the past 100 years, the record in this field event has increased from 50' 11 3/4"" to 75' 10 1/4""",shot put,NA
2013-03-22,J,LOOKING GOOD!,,400,"Who made that $2,665 limited-edition fuchsia quilted denim Linda bag?  Oh, I see the ""LV""-- it's this brand",Louis Vitton,NA
2013-03-22,J,THINK GLOBAL,,400,"In Brazil, only Sao Paulo has more people than this city",Rio de Janeiro,NA
2013-03-22,J,"""ACT"" LOCAL",,400,"It's someone working for political or social change, often with an organized group",an activist,NA
2013-03-22,J,WE PUT CHARACTERS ON TRIAL,,600,"On trial for jewelry theft, this creature who sometimes goes by Smeagol took a plea agreement",Gollum,NA
2013-03-22,J,IVY LEAGUE ALMA MATERS,,600,"Arlen Specter, for his B.A., & Donald Trump, for business school",University of Pennsylvania,NA
2013-03-22,J,TRACK & FIELD,,600,"At distances of 50, 60 & 110 meters, these are 3 feet 6 inches high",the hurdles,NA
2013-03-22,J,LOOKING GOOD!,,600,"That little black dress from this French designer!  It's so 1926, the year the dress was introduced",(Coco) Chanel,NA
2013-03-22,J,THINK GLOBAL,,600,"Ah, the sights & smells of the world's largest camel fair, held annually in Rajasthan in this country",India,NA
2013-03-22,J,"""ACT"" LOCAL",,600,4-word title of the 5th book of the New Testament,Acts of the Apostles,NA
2013-03-22,J,WE PUT CHARACTERS ON TRIAL,,800,The Ministry of Love was the scene of the trial of this main character; his lawyer is appealing-- after 29 years,Winston Smith,NA
2013-03-22,J,IVY LEAGUE ALMA MATERS,,800,Jodie Foster & Garry Trudeau,Yale,NA
2013-03-22,J,TRACK & FIELD,,800,"In the ""Iliad"" & the ""Odyssey"" Homer mentioned these 2 throwing sports, both part of the decathlon",javelin & discus,NA
2013-03-22,J,LOOKING GOOD!,,800,That Dermablend face makeup is magnifique!  This company that makes the stuff was right:  you're worth it!,L\'Oreal,NA
2013-03-22,J,THINK GLOBAL,,800,In 1659 France & Spain signed a treaty named for this mutual mountain range,the Pyrenees,NA
2013-03-22,J,"""ACT"" LOCAL",,800,"Symbol Ac, this radioactive element is found in uranium ores",actinium,NA
2013-03-22,J,WE PUT CHARACTERS ON TRIAL,,1000,"Yes, this Indian lad had to kill those endangered sea turtles, but he was shipwrecked, with a tiger in the boat",Pi,NA
2013-03-22,J,IVY LEAGUE ALMA MATERS,,1000,Maggie Gyllenhaal & Anna Paquin,Columbia,NA
2013-03-22,J,TRACK & FIELD,,1000,"Flo Jo's sister-in-law, in the 1988 Olympics she set the world record for most total points in the heptathlon",Jackie Joyner-Kersee,NA
2013-03-22,J,LOOKING GOOD!,,1000,"Your shawl jacket from this American ""Project Runway"" judge may be $2,500 but Miss Thang, you look like a million in it!",Michael Kors,NA
2013-03-22,J,THINK GLOBAL,,1000,It's the country where Muscat is located,Oman,NA
2013-03-22,J,"""ACT"" LOCAL",,1000,Someone who uses statistics to figure out when you're likely to die & thus whether you're worth insuring,an actuary,NA
2013-03-22,DJ,WE'RE ON MARS!,,400,The NASA video seen here shows this SUV-sized rover as it nears its landing in Gail Crater in August of 2012,Curiosity,http://www.j-archive.com/media/2013-03-22_DJ_24.wmv
2013-03-22,DJ,"ABBREVIATION""Z""",,400,ZOD:It has12 signs,the Zodiac,NA
2013-03-22,DJ,IT WAS THE '60s,,400,"This Civil Rights leader convinced Nichelle Nichols to stay on ""Star Trek"", citing her as a positive inspiration","Martin Luther King, Jr.",NA
2013-03-22,DJ,COMPASS POINT MOVIES,,400,"Mitzi Gaynor sang Rodgers & Hammerstein's ""I'm Gonna Wash That Man Right Out Of My Hair"" in this movie musical",South Pacific,NA
2013-03-22,DJ,IN THE BOY SCOUT HANDBOOK,,400,"The Scout motto ain't be-bop-a-lula, it's ""be"" this; let's see if you are",prepared,NA
2013-03-22,DJ,STATE SONG LYRICS,(Alex: We want you to name the state as we present...),400,"""It was Brigham Young who led the pioneers across the plains.  They suffered with the trials they had to face""",Utah,NA
2013-03-22,DJ,WE'RE ON MARS!,,NA,Valerie Ambroise won an essay contest & named this rover for a 19th-century African-American woman,Sojourner,http://www.j-archive.com/media/2013-03-22_DJ_25.wmv
2013-03-22,DJ,"ABBREVIATION""Z""",,800,Zech:an Old Testamentbook,Zechariah,NA
2013-03-22,DJ,IT WAS THE '60s,,800,"At 1968's Miss America Pageant, these were symbolically put in a trash can--but despite the legend were not burned",bras,NA
2013-03-22,DJ,COMPASS POINT MOVIES,,800,A giant mechanical spider plays a key role in this 1999 Will Smith movie set in the 19th Century,Wild Wild West,NA
2013-03-22,DJ,IN THE BOY SCOUT HANDBOOK,,800,"Originally, this highest rank was called Wolf",an Eagle Scout,NA
2013-03-22,DJ,STATE SONG LYRICS,(Alex: We want you to name the state as we present...),800,"""I love you, Catalina, you are very dear to me, I love you, Tamalpais, and I love Yosemite""",California,NA
2013-03-22,DJ,WE'RE ON MARS!,,1200,Mars's color is from being covered in this which may have been caused by water starting the oxidation of iron,rust,http://www.j-archive.com/media/2013-03-22_DJ_28.jpg
2013-03-22,DJ,"ABBREVIATION""Z""",,1200,ZPG:A balance where the number of people neither increases nor decreases,zero population growth,NA
2013-03-22,DJ,IT WAS THE '60s,,1200,"In 1967 Time magazine ran the oxymoronic-sounding headline ""San Francisco: Love on"" this street",Haight Street,NA
2013-03-22,DJ,COMPASS POINT MOVIES,,1200,"Hitchcock couldn't film inside the U.N. for this 1959 thriller, so he re-created its rooms on a soundstage",North By Northwest,NA
2013-03-22,DJ,IN THE BOY SCOUT HANDBOOK,,1200,"Merit badge types include Indian lore, dentistry, motorboating & this, making a record of one's ancestry",genealogy,NA
2013-03-22,DJ,STATE SONG LYRICS,(Alex: We want you to name the state as we present...),1200,"""It's the spirit of friendship, it's the spirit of hope.  It's the Razorbacks every game they play""",Arkansas,NA
2013-03-22,DJ,WE'RE ON MARS!,,1600,"In 2005 Opportunity found heat-shield rock, an iron-rich one of these space rocks, the first ever seen on another planet",a meteorite,http://www.j-archive.com/media/2013-03-22_DJ_29.jpg
2013-03-22,DJ,"ABBREVIATION""Z""",,1600,Zr:Metallic element used for laboratory crucibles,zirconium,NA
2013-03-22,DJ,IT WAS THE '60s,,1600,"On April 27, 1967 Canadian Prime Minister Pearson was in this city to open an expo",Montreal,NA
2013-03-22,DJ,COMPASS POINT MOVIES,,1600,"Nick Nolte has the best hands in football but a ""bad attitude"" in this satire on the business of football",North Dallas Forty,NA
2013-03-22,DJ,IN THE BOY SCOUT HANDBOOK,,1600,"This subdivision of a Boy Scout troop ""is a team of six to eight boys who make things happen""",a patrol,NA
2013-03-22,DJ,STATE SONG LYRICS,(Alex: We want you to name the state as we present...),NA,"""Your freeborn single star sends out its radiance to nations near and far""",Texas,NA
2013-03-22,DJ,WE'RE ON MARS!,,2000,"Seen here in a model, on July 20th, 1976, this first U.S. Mars lander successfully soft-landed",Viking,http://www.j-archive.com/media/2013-03-22_DJ_30.jpg
2013-03-22,DJ,"ABBREVIATION""Z""",,2000,ZL:Polish unit of currency,zloty,NA
2013-03-22,DJ,IT WAS THE '60s,,2000,Future Pope John Paul II was part of this 1962-65 council & helped draft its constitution on the church & the modern world,Vatican II,NA
2013-03-22,DJ,COMPASS POINT MOVIES,,2000,Viggo Mortensen was nominated for an Oscar for his role as a Russian Mafioso in this 2007 film,Eastern Promises,NA
2013-03-22,DJ,IN THE BOY SCOUT HANDBOOK,,2000,"This founder of scouting said, ""I don't consider a boy is a real scout till he has passed his First Class Scout""",Lord Robert Baden-Powell,NA
2013-03-22,DJ,STATE SONG LYRICS,(Alex: We want you to name the state as we present...),2000,"""The whole day through just an old sweet song...""",Georgia,NA
2013-03-22,FJ,SCIENCE WORDS,,NA,This biological term for cell division was borrowed in 1939 to describe a form of energy release,fission,NA
