date,round,category,comment,value,clue,response,link
1994-12-22,J,POLAND,,100,"He took office as President December 22, 1990",Lech Walesa,NA
1994-12-22,J,WOMEN ON ICE,,100,Training 6 days a week on her camels & other moves won her the Gold at the '76 Olympics,Dorothy Hamill,NA
1994-12-22,J,FOOD,,100,This seedless type of orange is named for the protuberance at its blossom end,navel,NA
1994-12-22,J,GRAMMAR,,100,This part of speech can be transitive or intransitive,verb,NA
1994-12-22,J,ARCHITECTURE,,100,Italian high-tech architect Renzo Piano co-designed this city's celebrated Pompidou Center,Paris,NA
1994-12-22,J,POLISH,,100,"This ""and polish"" refers to a smart & orderly appearance",spit,NA
1994-12-22,J,POLAND,,200,"A real potent potable is the 180 proof Polish Plain Spirit, a type of this liquor",vodka,NA
1994-12-22,J,WOMEN ON ICE,,200,"At age 10 in 1924, she won the 1st of 6 straight Norwegian figure skating championships",Sonja Henie,NA
1994-12-22,J,FOOD,,200,Nova is a cold-smoked type of this fish originally from Nova Scotia,salmon,NA
1994-12-22,J,GRAMMAR,,200,Tradition has it that this type of noun is capitalized,proper noun,NA
1994-12-22,J,ARCHITECTURE,,200,Terrazzo flooring is usually composed of chips of this stone in cement mortar,marble,NA
1994-12-22,J,POLISH,,200,It's a goatlike antelope of the high mountains in Europe whose skin makes a soft leather polishing cloth,chamois,NA
1994-12-22,J,POLAND,,300,The city of Torun is famous for its honey cakes & as the birthplace of this astronomer,Copernicus,NA
1994-12-22,J,WOMEN ON ICE,,300,In 1984 she  & partner Christopher Dean earned 6.0s for artistic impression across the Olympic board,(Jane) Torvill,NA
1994-12-22,J,FOOD,,300,Coffee is often the liquid used to make the redeye type of this,gravy,NA
1994-12-22,J,GRAMMAR,,300,"In ""Discovering English Grammar"", Richard Veit says it's okay to sometimes split these",infinitives,NA
1994-12-22,J,ARCHITECTURE,,300,"Pavilion, saddleback & mansard are types of this part of a building",roof,NA
1994-12-22,J,POLISH,,300,In 1958 Johnson Wax introduced this aerosol furniture polish,Pledge,NA
1994-12-22,J,POLAND,,400,"Treaty of friendship, cooperation & mutual assistance signed by Poland & 7 others in 1955",Warsaw Pact,NA
1994-12-22,J,WOMEN ON ICE,,400,"At the '94 Olympics, this German placed 7th in her attempt to win a 3rd Gold",Katarina Witt,NA
1994-12-22,J,FOOD,,400,"These warmed, sweet treats are traditionally served on Good Friday",(hot) cross buns,NA
1994-12-22,J,GRAMMAR,,400,The 2 prepositions that are common to all crossword puzzles,down and across,NA
1994-12-22,J,ARCHITECTURE,,400,"The Union Tank Car Company in Baton Rouge, Louisiana is one of his best known geodesic domes",Buckminster Fuller,NA
1994-12-22,J,POLISH,,400,For Hillary Clinton it's Jessica Custom No. 129,nail polish,NA
1994-12-22,J,POLAND,,NA,Pope John II once attended this city's Jagiellonian Univ. founded in 1364,Krakow,NA
1994-12-22,J,WOMEN ON ICE,,500,"Though she fell on a triple loop in the 1992 Olympics, she still took the Gold",Kristi Yamaguchi,NA
1994-12-22,J,FOOD,,500,"This Middle Eastern dish is made by frying balls of mashed, spiced chickpeas",falafel,NA
1994-12-22,J,GRAMMAR,,500,In the 1800s Alonzo Reed & Brainerd Kellogg devised an artistic way to do this to a sentence,diagram,NA
1994-12-22,J,ARCHITECTURE,,500,"The Turkish style of these Islamic prayer towers is slender, pencil-shaped & girded with balconies",minaret,NA
1994-12-22,J,POLISH,,500,"From the middle French for ""to make brown"", it's to make shiny by rubbing",burnish,NA
1994-12-22,DJ,AMERICAN HISTORY,,200,"On Jan. 1, 1902 Michigan defeated Stanford in this, the first post-season football game",Rose Bowl,NA
1994-12-22,DJ,BOTANY,,200,It's the main stem of a tree,trunk,NA
1994-12-22,DJ,NEWSPAPERS,,200,"Founded in 1813, the Mobile Register is this state's oldest newspaper",Alabama,NA
1994-12-22,DJ,CIVIL WARS,,200,A civil war began in this country in 1871 when Diaz rebelled against Juarez,Mexico,NA
1994-12-22,DJ,RELIGION,,200,In 630 he conquered Mecca & smashed hundreds of idols in the city's sanctuary,Muhammad,NA
1994-12-22,DJ,NOVEL FILMS,,200,"The Paul Newman film ""Hud"" was based ""Horseman, Pass By"", this ""Lonesome Dove"" author's 1st novel",Larry McMurtry,NA
1994-12-22,DJ,AMERICAN HISTORY,,400,"In 1961 JFK proposed ""The Alliance for"" this to give economic assistance to Latin America",Progress,NA
1994-12-22,DJ,BOTANY,,400,"On a tuber such as a potato, these tiny swellings are called the eyes",buds,NA
1994-12-22,DJ,NEWSPAPERS,,400,2 of the 4 U.S. newspapers with circulation exceeding 1 million are published in this city,New York,NA
1994-12-22,DJ,CIVIL WARS,,400,Spain's civil war began with a military uprising in Spanish Morocco led by this general,Franco,NA
1994-12-22,DJ,RELIGION,,400,"The name of this Jewish ceremony is Hebrew for ""son of the commandment""",bar mitzvah,NA
1994-12-22,DJ,NOVEL FILMS,,400,"Vivien Leigh's last film, it was adapted from the Katherine Anne Porter novel of the same name",Ship of Fools,NA
1994-12-22,DJ,AMERICAN HISTORY,,600,The 1806 edition of this parson's life of George Washington was the 1st with the cherry tree tale,Parson Weems,NA
1994-12-22,DJ,BOTANY,,600,Maidenhair & moonwort are types of this nonflowering plant,fern,NA
1994-12-22,DJ,NEWSPAPERS,,600,Dave Barry & Liz Balmaseda have won Pulitzer Prizes for Commentary while with this Florida newspaper,Miami Herald,NA
1994-12-22,DJ,CIVIL WARS,,600,Gaucho troops supported the Federalists against the Unitarians in this country's 19th c. strife,Argentina,NA
1994-12-22,DJ,RELIGION,,600,"In 1863 the prophet Baha'ullah, whose name means ""glory of God"", founded this faith in Baghdad",Baha\'i,NA
1994-12-22,DJ,NOVEL FILMS,,600,Charles Laughton was originally set to play Mr. Micawber in this 1935 film but W.C. Fields replaced him,David Copperfield,NA
1994-12-22,DJ,AMERICAN HISTORY,,NA,"Pallbearers at this General & President's July 13, 1850 funeral included Henry Clay & Daniel Webster",Zachary Taylor,NA
1994-12-22,DJ,BOTANY,,800,"It's the common name for aquatic plants of the genus nymphaea, including the Egyptian lotus",water lily,NA
1994-12-22,DJ,NEWSPAPERS,,800,"Before being expelled from the Italian socialist party, he edited its newspaper, Avanti!",Mussolini,NA
1994-12-22,DJ,CIVIL WARS,,800,Syria's June 1976 intervention in this Mideast country's civil war was endorsed in October by the Arab League,Lebanon,NA
1994-12-22,DJ,RELIGION,,800,In 1953 this Catholic Bishop won an Emmy as TV's Most Outstanding Personality,Bishop Sheen,NA
1994-12-22,DJ,NOVEL FILMS,,800,"""Cimarron"", the 1st western to win the ""Best Picture"" Oscar, was based on a novel by this author of ""Giant""",Edna Ferber,NA
1994-12-22,DJ,AMERICAN HISTORY,,1000,In 1949 this future gen. of the army became the 1st permanent Chairman of the Joint Chiefs of Staff,Omar Bradley,NA
1994-12-22,DJ,BOTANY,,NA,"The pileus which has gills on its underside, is the upper part of this type of plant",mushroom,NA
1994-12-22,DJ,NEWSPAPERS,,1000,"Phoenix has 2 daily papers, ""The Phoenix Gazette"" & this one",Arizona Republic,NA
1994-12-22,DJ,CIVIL WARS,,1000,"In a devastating 1960s civil war, this country recaptured the breakaway state of Biafra",Nigeria,NA
1994-12-22,DJ,RELIGION,,1000,It's the belief that God is all things,pantheism,NA
1994-12-22,DJ,NOVEL FILMS,,1000,Anthony Perkins played Josef K. in the 1963 film version of this unfinished Kafka novel,The Trial,NA
1994-12-22,FJ,COUNTRIES OF THE WORLD,,NA,"With over 55 million visitors, this country is the world's most popular tourist destination",France,NA
