date,round,category,comment,value,clue,response,link
2005-07-04,J,LITERARY QUOTES,(Alex: You have to identify the literary work.  We'll provide the quote for you.),200,"(1883)""Fifteen men on the dead man's chest--yo-ho-ho, and a bottle of rum""",Treasure Island,NA
2005-07-04,J,SMELLS LIKE TEAM SPIRIT,,200,"Often called ""football in the water"", this sport is played by teams of 7",water polo,NA
2005-07-04,J,BANK SHOTS,,200,"From the Latin for ""the back"", it's to sign the back of a check to transfer rights",endorse,NA
2005-07-04,J,STATE NICKNAMES,,200,"The ""Quaker State""",Pennsylvania,NA
2005-07-04,J,MAGAZINES & NEWSPAPERS,,200,This charge card giant owns both Travel & Leisure and Food & Wine magazines,American Express,NA
2005-07-04,J,PARDON MY ADJECTIVE,,200,"He's the only one of Disney's dwarfs in ""Snow White"" whose name is not an adjective",Doc,NA
2005-07-04,J,LITERARY QUOTES,(Alex: You have to identify the literary work.  We'll provide the quote for you.),400,"(1952)""Then the fish came alive, with his death in him, and rose high out of the water...""",The Old Man and the Sea,NA
2005-07-04,J,SMELLS LIKE TEAM SPIRIT,,400,"(Hi, I'm Matt Hasselbeck of the NFL.)  Playing QB for Boston College, I threw a school record 14 straight completions against this team's Fighting Irish",Notre Dame,http://www.j-archive.com/media/2005-07-04_J_17.jpg
2005-07-04,J,BANK SHOTS,,400,"An EFT stands for an ""electronic"" one of these",a funds transfer,NA
2005-07-04,J,STATE NICKNAMES,,400,"The ""Hawkeye State""",Iowa,NA
2005-07-04,J,MAGAZINES & NEWSPAPERS,,400,"Sylvester Stallone said he favored ""History's Mysteries"" in ""What I'm Watching"", a column in this weekly magazine",TV Guide,NA
2005-07-04,J,PARDON MY ADJECTIVE,,400,This adjective means relating to a 200th anniversary,bicentennial,NA
2005-07-04,J,LITERARY QUOTES,(Alex: You have to identify the literary work.  We'll provide the quote for you.),600,"(1870s)""In a flash she remembered the man who had been run down by the train the day she first met Vronsky""",Anna Karenina,NA
2005-07-04,J,SMELLS LIKE TEAM SPIRIT,,600,"This baseball team was honored with ticker-tape parades in 1962, 1969 & 1986",the New York Mets,NA
2005-07-04,J,BANK SHOTS,,600,"You don't get this type of CD from a music store, you get it from a bank",a certificate of deposit,NA
2005-07-04,J,STATE NICKNAMES,,600,"The ""Goober State""",Georgia,NA
2005-07-04,J,MAGAZINES & NEWSPAPERS,,600,"(Hello, I'm Peggy Noonan.)  I write a weekly column for opinionjournal.com, which is the editorial website of this business-oriented newspaper",The Wall Street Journal,http://www.j-archive.com/media/2005-07-04_J_28.jpg
2005-07-04,J,PARDON MY ADJECTIVE,,600,"""Game of Death"" fans know the adjective ""chopsocky"" refers to this kind of action film",martial arts,NA
2005-07-04,J,LITERARY QUOTES,(Alex: You have to identify the literary work.  We'll provide the quote for you.),800,"(1300s)""Turn, Beatrice!...O turn thy saintly sight on this thy faithful one""",The Divine Comedy,NA
2005-07-04,J,SMELLS LIKE TEAM SPIRIT,,800,Lynette Woodard played from 1985 to 1987 with this otherwise all-male basketball team,the Globetrotters,NA
2005-07-04,J,BANK SHOTS,,800,"In the U.S., the discount rate is the rate of interest on loans these banks make to commercial banks",Federal Reserve Banks,NA
2005-07-04,J,STATE NICKNAMES,,800,"The ""Land of 10,000 Lakes""",Minnesota,NA
2005-07-04,J,MAGAZINES & NEWSPAPERS,,800,"Magazine names that apply to a charismatic person include Glamour & this one, ""The Beauty Expert""",Allure,NA
2005-07-04,J,PARDON MY ADJECTIVE,,800,"This adjective can be used to describe river rapids, a lion or the 1920s",roaring,NA
2005-07-04,J,LITERARY QUOTES,(Alex: You have to identify the literary work.  We'll provide the quote for you.),NA,"(1818)""Cursed (although I curse myself) be the hands that formed you!""",Frankenstein,NA
2005-07-04,J,SMELLS LIKE TEAM SPIRIT,,1000,The stars shine bright in this city for Major League Soccer's Galaxy,Los Angeles,NA
2005-07-04,J,BANK SHOTS,,1000,"Part of the 1968 Consumer Credit Protection Act, this law says banks must clearly state credit terms",the Truth in Lending Law,NA
2005-07-04,J,STATE NICKNAMES,,1000,"The ""Old Line State""",Maryland,NA
2005-07-04,J,MAGAZINES & NEWSPAPERS,,1000,"This Minneapolis-based magazine reprints articles from alternative media sources to offer ""a different read on life""",Utne,NA
2005-07-04,J,PARDON MY ADJECTIVE,,1000,It's the 10-letter adjective for a creature that eats both animals & plants,omnivorous,NA
2005-07-04,DJ,POETRY SLAM,,400,"(Jimmy of the Clue Crew recites ""poetry."")A dream crackedAnd I awokeFrozen tears risingLike this calcium carbonate depositOn a cave floor",a stalagmite,NA
2005-07-04,DJ,'60s POP MUSIC,,400,"The Beach Boys' Brian Wilson provided backing vocals on this duo's 1963 No. 1 hit ""Surf City""",Jan & Dean,NA
2005-07-04,DJ,ELEMENTAL LATIN,,400,Aurum,gold,NA
2005-07-04,DJ,EXPLORERS,,400,"After his circumnavigation of the world he was made mayor of Plymouth, England",Sir Francis Drake,NA
2005-07-04,DJ,A_O_L,"(Alex: Those three letters will come up in each correct response in that order, and there will be consonants and other things around them.)",400,Easy-Off Oven & Grill Cleaner comes in this type of can,aerosol,NA
2005-07-04,DJ,YOU'VE GOT MAIL,,400,"It brought its last shipment of mail into Sacramento November 20, 1861",the Pony Express,NA
2005-07-04,DJ,POETRY SLAM,,800,"(Jimmy of the Clue Crew recites ""poetry."")And still we wield our rageBrother against brotherWhen all around us is the sweet fleshOf the Jonathan type of this fruit",an apple,NA
2005-07-04,DJ,'60s POP MUSIC,,NA,"What's it all about?  Well... Cher had the original release of this movie theme, but Dionne Warwick had the bigger hit","""Alfie"" (""What\'s It All About, Alfie?"" accepted)",NA
2005-07-04,DJ,ELEMENTAL LATIN,,800,Plumbum,lead,NA
2005-07-04,DJ,EXPLORERS,,800,Dutchman Jakob Roggeveen was the first European to report on the giant stone statues of this South Pacific isle,Easter Island,NA
2005-07-04,DJ,A_O_L,"(Alex: Those three letters will come up in each correct response in that order, and there will be consonants and other things around them.)",800,This synonym for horrible is often used to describe the creature also known as the Yeti,abominable,NA
2005-07-04,DJ,YOU'VE GOT MAIL,,800,"At Christmastime a small town near Fairbanks, Alaska mails out letters from Santa postmarked this",the North Pole,NA
2005-07-04,DJ,POETRY SLAM,,1200,"(Jimmy of the Clue Crew recites ""poetry."")No chemist,No furrowed doctor of lawCan say why Love sounds likeThe kotoA 13-string zither of this country",Japan,NA
2005-07-04,DJ,'60s POP MUSIC,,1200,This 1967 movie theme by Lulu remained at No. 1 for 5 weeks,"""To Sir, With Love""",NA
2005-07-04,DJ,ELEMENTAL LATIN,,1200,Natrium,sodium,NA
2005-07-04,DJ,EXPLORERS,,1200,In 1823 James Weddell sailed into Antarctic waters in search of this mammal; one species is now named for him,a seal,NA
2005-07-04,DJ,A_O_L,"(Alex: Those three letters will come up in each correct response in that order, and there will be consonants and other things around them.)",1200,This friendly bacterium produces fermented milk (but doesn't change the taste),acidophilus,NA
2005-07-04,DJ,YOU'VE GOT MAIL,,1200,"It's the cost per ounce after the first one to send a letter, or the rate to mail a postcard",23 cents,NA
2005-07-04,DJ,POETRY SLAM,,1600,"(Sarah of the Clue Crew recites ""poetry."")Some day, true,There will be no more second baseNo streams, no hymnalsNo this service that runs Yosemite",(National) Park (Service),NA
2005-07-04,DJ,'60s POP MUSIC,,1600,"The 1965 film ""Ferry Cross"" this starring Gerry & the Pacemakers featured 9 songs written by Gerry",the Mersey,NA
2005-07-04,DJ,ELEMENTAL LATIN,,1600,Kalium,potassium,NA
2005-07-04,DJ,EXPLORERS,,1600,In 1776 Francisco Garces became the first European since this Spanish conquistador's men to reach the Grand Canyon,Coronado,NA
2005-07-04,DJ,A_O_L,"(Alex: Those three letters will come up in each correct response in that order, and there will be consonants and other things around them.)",1600,It's the scientific study of bees,apiology,NA
2005-07-04,DJ,YOU'VE GOT MAIL,,1600,In 1926 he was hired as chief pilot to carry airmail between Chicago & St. Louis,Lindbergh,NA
2005-07-04,DJ,POETRY SLAM,,2000,"(Jimmy of the Clue Crew recites ""poetry."")Around me, anguish and painPain and despairThis area, equal to 10,000Square meters of anguish, and pain and despair",a hectare,NA
2005-07-04,DJ,'60s POP MUSIC,,2000,"After this group's first album, both Denny Laine & Clint Warwick left; Justin Hayward & John Lodge filled the void",The Moody Blues,NA
2005-07-04,DJ,ELEMENTAL LATIN,,2000,Stannum,tin,NA
2005-07-04,DJ,EXPLORERS,,2000,"On July 16, 1789 this Scot reached the Arctic Ocean & the mouth of the 2,635-mile-long river now named for him",(Alexander) MacKenzie,NA
2005-07-04,DJ,A_O_L,"(Alex: Those three letters will come up in each correct response in that order, and there will be consonants and other things around them.)",2000,These microscopic air sacs in the lungs are the site of gas exchange,alveoli,NA
2005-07-04,DJ,YOU'VE GOT MAIL,,NA,In 1958 Harry Winston mailed this priceless treasure to the Smithsonian in a brown paper parcel,the Hope Diamond,NA
2005-07-04,FJ,TERMS IN SCIENCE,,NA,"Sky & Telescope magazine's contest to replace this term for a single event got 13,000 entries, but chose none",the Big Bang,NA
