date,round,category,comment,value,clue,response,link
1987-05-25,NA,NA,NA,NA,NA,NA,NA
1987-05-25,J,ANIMALS,,100,"Skunks develop this ability before they're one month old, so watch out!",spraying foul-smelling stuff,NA
1987-05-25,J,SPACE & AVIATION,,100,"On its historic flight in December 1986, number of times Voyager stopped for gas",none,NA
1987-05-25,J,GAME SHOWS,,100,"The ""Chance of a Lifetime"" is to win this prize",million dollars,NA
1987-05-25,J,FACTS & FIGURES,,100,Experts say it takes an intake of 3500 extra calories to gain this much weight,a pound,NA
1987-05-25,J,WOOD ON THE MAP,,100,"Just ask Reggie Jackson, & he'll tell you the A's are from this city",Oakland,NA
1987-05-25,NA,NA,NA,NA,NA,NA,NA
1987-05-25,J,ANIMALS,,200,"The most recent member of the ""ursus"", or bear, line is this species which headed north",polar bear,NA
1987-05-25,J,SPACE & AVIATION,,200,"In 1986, besides the U.S., 1 of 2 countries whose airports were among the 10 busiest in the world",England or Japan,NA
1987-05-25,J,GAME SHOWS,,200,Major network which currently airs the greatest number of daytime game shows,NBC,NA
1987-05-25,J,FACTS & FIGURES,,200,"59' tall & from California, it was put up on the U.S. Capitol ground December 1, 1986",Christmas tree,NA
1987-05-25,J,WOOD ON THE MAP,,200,Colorado resort city named in 1879 for the trees in the region,Aspen,NA
1987-05-25,NA,NA,NA,NA,NA,NA,NA
1987-05-25,J,ANIMALS,,300,"Of the higher primates, the pygmy marmoset is smallest in size & this is the largest",gorilla,NA
1987-05-25,J,SPACE & AVIATION,,NA,Testor Corp. is selling a model kit for this plane the government won't even admit exists,Stealth,NA
1987-05-25,J,GAME SHOWS,,300,"Bob Eubanks hosts the daytime network version; Bill Rafferty, the syndicated",Card Sharks,NA
1987-05-25,J,FACTS & FIGURES,,300,"After 27 years, he's the current NFL coach who has served the longest with 1 team",Landry,NA
1987-05-25,J,WOOD ON THE MAP,,300,Cities in Iowa are named for the falls & rapids of this river,Cedar,NA
1987-05-25,NA,NA,NA,NA,NA,NA,NA
1987-05-25,J,ANIMALS,,400,"Of the civet, otter, & badger, the mammal that's considered aquatic",otter,NA
1987-05-25,J,SPACE & AVIATION,,400,"Of a Boeing 727, 737, 747, 757, or 767, one with the most engines",747,NA
1987-05-25,J,GAME SHOWS,,400,"In Italy, this show is called ""Il Prezzo et Justo""",The Price is Right,NA
1987-05-25,J,FACTS & FIGURES,,400,"Officials in Rome estimate that there are 50,000 too many of these in the capital each day",automobiles,NA
1987-05-25,J,WOOD ON THE MAP,,400,"The General Sherman tree, most massive living thing in the world, is in this nat'l park",Sequoia,NA
1987-05-25,NA,NA,NA,NA,NA,NA,NA
1987-05-25,J,ANIMALS,,500,Lemurs live chiefly on The Comoros & this other island country off Africa's southeast coast,Madagascar,NA
1987-05-25,J,SPACE & AVIATION,,500,"American who launched the 1st successful liquid-propelled rocket on March 16, 1926",(Robert) Goddard,NA
1987-05-25,J,GAME SHOWS,,500,"The difference between the number of game board monitors on ""Tic Tac Dough"" & ""Jeopardy!""",21,NA
1987-05-25,J,FACTS & FIGURES,,500,"In 1985-86, this character's dream accounted for 31 hours of television programming",Pam Ewing,NA
1987-05-25,J,WOOD ON THE MAP,,500,Wild Bill Hickok met his end in this appropriately named South Dakota town,Deadwood,NA
1987-05-25,DJ,EXODUS,,200,Jewish holiday established in Exodus 12,Passover,NA
1987-05-25,DJ,THE 1930s,,200,"When dedicated on May 1, 1931, it was the world's tallest building",Empire State Building,NA
1987-05-25,DJ,HAIL TO THE CHIEF,,200,His mother's name was Jessie Janet Woodrow,Woodrow Wilson,NA
1987-05-25,DJ,PUBLISHING,,200,Newspaper whose reporters originally broke the Watergate story,The Washington Post,NA
1987-05-25,DJ,ONE SONG,,200,"Heard here, it's the title of the song this category is based on: You never close your eyes any more When I kiss your lips","""You\'ve Lost that Lovin\' Feeling""",NA
1987-05-25,DJ,2-LETTER WORDS,,200,Direction in which you'd have to look right now to see a catwalk,up,NA
1987-05-25,DJ,EXODUS,,400,"Moses set desert rations for the ""bread of the Lord"" at 1 omer each day except Sat., 2 on Friday",manna,NA
1987-05-25,DJ,THE 1930s,,400,"Of ""Dracula"", ""The Wolf Man"" or ""Frankenstein"", film which didn't premiere in the 1930s",The Wolf Man,NA
1987-05-25,DJ,HAIL TO THE CHIEF,,400,John Quincy Adams named his 1st-born after this man famous for being a 1st,George Washington,NA
1987-05-25,DJ,PUBLISHING,,400,"Gertrude the kangaroo is the symbol of this company, the USA's pioneer paperback book publisher",Pocketbook,NA
1987-05-25,DJ,ONE SONG,,400,Under this group name Bill Medley & Bobby Hatfield took the song to #1 in 1965,The Righteous Brothers,NA
1987-05-25,DJ,2-LETTER WORDS,,400,"Printer's measure, or Dorothy's Auntie",Em,NA
1987-05-25,DJ,EXODUS,,600,"In the 1960 film ""Exodus"", he played Ari Ben Canaan",Paul Newman,NA
1987-05-25,DJ,THE 1930s,,600,"On May 9, 1936, it landed successfully at Lakehurst, New Jersey",Hindenburg,NA
1987-05-25,DJ,HAIL TO THE CHIEF,,600,"Bob Hope said ""When I play (golf) with this president, I...bring a special caddy--he's my blood type!""",Ford,NA
1987-05-25,DJ,PUBLISHING,,600,This city's Free Press was rebuked by readers for revealing our T of C winner's name early,Detroit,NA
1987-05-25,DJ,ONE SONG,,600,"Actress to whom the song was sung in ""Top Gun""",Kelly McGillis,NA
1987-05-25,DJ,2-LETTER WORDS,,600,"Proper title of the ""Sound of Music"" song which begins ""Do a deer"", it's 3 2-letter words","""Do-Re-Mi""",NA
1987-05-25,DJ,EXODUS,,800,"After all the rods became serpents, his rod ate them all",Aaron,NA
1987-05-25,DJ,THE 1930s,,800,Japan's 8-year war against this country began at the Marco Polo Bridge in July 1937,China,NA
1987-05-25,DJ,HAIL TO THE CHIEF,,NA,2 of the 3 men who were president in 1881,(2 of) Garfield & Arthur & Rutherford B. Hayes,NA
1987-05-25,DJ,PUBLISHING,,800,"This head of Random House was a regular panelist on ""What's My Line?""",Bennett Cerf,NA
1987-05-25,DJ,ONE SONG,,800,"According to the lyrics, ""Girl, you're startin' to criticize"" these",little things I do,NA
1987-05-25,DJ,2-LETTER WORDS,,800,"Spelled out, it's a blood type; pronounced, it's a month of the Jewish calendar",AB,NA
1987-05-25,DJ,EXODUS,,1000,"Moses' father-in-law, he shares name with a ""Beverly Hillbilly""",Jethro,NA
1987-05-25,DJ,THE 1930s,,1000,"In October 1935, Roosevelt said ""A state of war unhappily exists"" between Italy & this country",Ethiopia,NA
1987-05-25,DJ,HAIL TO THE CHIEF,,1000,"In the 1856 election, this ex-president was candidate of both the Whigs & Know-Nothings",Millard Fillmore,NA
1987-05-25,DJ,PUBLISHING,,1000,"This pair was Row, Peterson & Company's most successful equivalent to ""Dick & Jane""",Alice & Jerry,NA
1987-05-25,DJ,ONE SONG,,1000,This pop pair had a Billboard top 20 hit in 1980 with a remake of the song,(Daryl) Hall & (John) Oates,NA
1987-05-25,DJ,2-LETTER WORDS,,NA,2 of the 4 Greek letters that are 2-letter words,"(2 of) pi, mu, nu & xi",NA
1987-05-25,FJ,GEOLOGY,,NA,3 of the 5 U.S. states with volcanoes active within the last two centuries,"(3 of) Hawaii, Alaska, Washington, Oregon & California",NA
