date,round,category,comment,value,clue,response,link
2013-10-09,J,TAKE IN (ALPHABETICAL) ORDER,"(Alex: The first correct response will begin with the letter ""A,"" the next one down with the letter ""B,"" and so on.)",200,"If the clue fits, you must say this word, meaning to declare not guilty",acquit,NA
2013-10-09,J,PARTS OF THE WHOLE,,200,"Safety pin,pull ring,explosive",a grenade,NA
2013-10-09,J,THE CELEBRITY BOOK AISLE,,200,"In 1986 he was the subject of Kitty Kelley's ""His Way""",Frank Sinatra,NA
2013-10-09,J,THE STATE DEPT. SUGGESTS YOU STAY HOME,,200,Khartoum & the rest of this African nation are under a travel warning,Sudan,NA
2013-10-09,J,VARIETY OF VEG,,200,"Moth,fava",bean,NA
2013-10-09,J,BIOSPHERE 2,(Kelly: Biosphere 2--an enclosure once used to study human survival in space. Now it's helping us understand the Earth.),200,"(Jimmy of the Clue Crew reports from Biosphere 2 at the University of Arizona.)  The rainforest is key to getting feedback of tropical ecosystems and the atmosphere under climate change. In the canopy, we're using the LI-COR 6400 to measure the  effectiveness of this energy process in green leaves",photosynthesis,http://www.j-archive.com/media/2013-10-09_J_26.wmv
2013-10-09,J,TAKE IN (ALPHABETICAL) ORDER,"(Alex: The first correct response will begin with the letter ""A,"" the next one down with the letter ""B,"" and so on.)",400,"Proverbially, the most beautiful woman amongst many ""of the ball""",belle,NA
2013-10-09,J,PARTS OF THE WHOLE,,400,"Cap,gills,stem",a mushroom,NA
2013-10-09,J,THE CELEBRITY BOOK AISLE,,400,"In ""celebraTORI"" she shares how to unleash ""your inner party planner""",(Tori) Spelling,NA
2013-10-09,J,THE STATE DEPT. SUGGESTS YOU STAY HOME,,400,"Forget about ""Benghazi, Bani Walid...Sabha and Kufra"" in this country",Libya,NA
2013-10-09,J,VARIETY OF VEG,,400,"Bermuda,Maui",onion,NA
2013-10-09,J,BIOSPHERE 2,(Kelly: Biosphere 2--an enclosure once used to study human survival in space. Now it's helping us understand the Earth.),400,"(Kelly of the Clue Crew reports from Biosphere 2 at the University of Arizona.)  Rain and  temperature are varied to see how they impact subterranean productivity in rainforests. Root observation devices give researchers new understanding of the flow of this element, atomic number 6, in the ecosystem",carbon,http://www.j-archive.com/media/2013-10-09_J_27.jpg
2013-10-09,J,TAKE IN (ALPHABETICAL) ORDER,"(Alex: The first correct response will begin with the letter ""A,"" the next one down with the letter ""B,"" and so on.)",600,"""Life is"" this type of restaurant with a dance floor, music & a show, old chum",cabaret,NA
2013-10-09,J,PARTS OF THE WHOLE,,600,"Visor,pauldron,gauntlets",armor,NA
2013-10-09,J,THE CELEBRITY BOOK AISLE,,600,"His books include ""Dirt on My Shirt"" for kids & the ""Complete Redneck Dictionary""",(Jeff) Foxworthy,NA
2013-10-09,J,THE STATE DEPT. SUGGESTS YOU STAY HOME,,NA,"Hezbollah's ""strong presence"" & ""shelling...from Syria"" are reasons to avoid this country",Lebanon,NA
2013-10-09,J,VARIETY OF VEG,,600,"Banana,bell",pepper,NA
2013-10-09,J,BIOSPHERE 2,(Kelly: Biosphere 2--an enclosure once used to study human survival in space. Now it's helping us understand the Earth.),600,"(Jimmy of the Clue Crew reports from Biosphere 2 at the University of Arizona.)  The site where the first Biospherians grew food now houses the world's biggest earth-science experiment, which will show how our land forms over time. It's called ""L.E.O."", the Landscape this Observatory -- Darwin would be proud",evolution,http://www.j-archive.com/media/2013-10-09_J_28.jpg
2013-10-09,J,TAKE IN (ALPHABETICAL) ORDER,"(Alex: The first correct response will begin with the letter ""A,"" the next one down with the letter ""B,"" and so on.)",800,"A loose, colorfully patterned pullover African garment for men",a dashiki,NA
2013-10-09,J,PARTS OF THE WHOLE,,800,"Handrails,belt & flywheel,display console",a treadmill,NA
2013-10-09,J,THE CELEBRITY BOOK AISLE,,800,"In ""Lucky Man"" he talks about dealing with the ""reality of mortality, maturity and Parkinson's disease""",(Michael J.) Fox,NA
2013-10-09,J,THE STATE DEPT. SUGGESTS YOU STAY HOME,,800,"In Somalia the group al-this has ""merged with al-Qaida"" to wreak joint terror",al-Shabab,NA
2013-10-09,J,VARIETY OF VEG,,800,"Smooth-leaf,baby,semi-savoy",spinach,NA
2013-10-09,J,BIOSPHERE 2,(Kelly: Biosphere 2--an enclosure once used to study human survival in space. Now it's helping us understand the Earth.),800,"A million-gallon ""ocean"" helps test how changes affect the zoo- & phyto- types of this basis of the sea's food chain",plankton,NA
2013-10-09,J,TAKE IN (ALPHABETICAL) ORDER,"(Alex: The first correct response will begin with the letter ""A,"" the next one down with the letter ""B,"" and so on.)",1000,11-letter word meaning to spit,expectorate,NA
2013-10-09,J,PARTS OF THE WHOLE,,1000,"F holes,scroll,12-inch endpin",a cello,NA
2013-10-09,J,THE CELEBRITY BOOK AISLE,,1000,"Who better to pen the foreword to her 2013 memoir ""Unsinkable"" than daughter Carrie Fisher",Debbie Reynolds,NA
2013-10-09,J,THE STATE DEPT. SUGGESTS YOU STAY HOME,,1000,"Just north of Nicaragua, it has the world's highest murder rate",Honduras,NA
2013-10-09,J,VARIETY OF VEG,,1000,"Imperator,Chantenay,little fingers",carrots,NA
2013-10-09,J,BIOSPHERE 2,(Kelly: Biosphere 2--an enclosure once used to study human survival in space. Now it's helping us understand the Earth.),1000,"The biomes used to study biodiversity have names like desert, rainforest & this African grassland with scattered trees",the savanna,NA
2013-10-09,DJ,MASTERS OF TEXT,,400,"Stopped off for a Venti here, S$",Starbucks,NA
2013-10-09,DJ,IRISH LITERATURE,,400,"The narrator of this satire says, ""I found my arms and legs were strongly fastened on each side to the ground""",Gulliver\'s Travels,NA
2013-10-09,DJ,THE AMERICAN FRONTIER,,400,"With wood costly, ranchers turned to this new ""thorny fence"" in the 1870s to keep livestock from roaming",barbed wire,NA
2013-10-09,DJ,WEIRD TOP 40 HITS,,400,"Richard Harris & others sang of this L.A. space ""melting in the dark, all the sweet, green icing flowing down""",MacArthur Park,NA
2013-10-09,DJ,BUSINESS,,400,"This phone company took its name from its origin within the ""S""outhern ""P""acific ""R""ailroad",Sprint,NA
2013-10-09,DJ,"""AZ"" USUAL",,400,"A grand public space, like NYC's Rockefeller one",plaza,NA
2013-10-09,DJ,MASTERS OF TEXT,,800,I hope to make you laugh-- I'm texting you something FYA,for your amusement,NA
2013-10-09,DJ,IRISH LITERATURE,,800,"This ""Waiting for Godot"" playwright wrote a novel trilogy that included ""Molloy"", ""Malone Dies"" & ""The Unnamable""",(Samuel) Beckett,NA
2013-10-09,DJ,THE AMERICAN FRONTIER,,800,"Nearly everyone on the frontier was affected by ague, basically this disease borne by mosquitos",malaria,NA
2013-10-09,DJ,WEIRD TOP 40 HITS,,800,"It wasn't ""Blue Velvet"", but the song ""The Days Of Sand & Shovels"" also charted for this singer",Bobby Vinton,NA
2013-10-09,DJ,BUSINESS,,800,Ferdinand Porsche designed the first model for this German company whose cars often move slower than Porsches,Volkswagen,NA
2013-10-09,DJ,"""AZ"" USUAL",,800,"The name of this Mesoamerican group is Nahuatl for ""near the cranes""",the Aztecs,NA
2013-10-09,DJ,MASTERS OF TEXT,,1200,"I can't tell you everything, you'll just have to FITB",fill in the blanks,NA
2013-10-09,DJ,IRISH LITERATURE,,1200,This Irish-born writer's most famous novel is partly narrated by Jonathan Harker in the form of a journal,(Bram) Stoker,NA
2013-10-09,NA,NA,NA,NA,NA,NA,NA
2013-10-09,DJ,WEIRD TOP 40 HITS,,1200,"In a top 40 classic from 1966 this ""king of the road"" warned us that ""You Can't Roller Skate In A Buffalo Herd""",Roger Miller,NA
2013-10-09,DJ,BUSINESS,,NA,"If it used the founder's daughter's given name, this restaurant chain would be called Melinda's",Wendy\'s,NA
2013-10-09,DJ,"""AZ"" USUAL",,1200,It's the color of the skyseen here,azure,http://www.j-archive.com/media/2013-10-09_DJ_03.jpg
2013-10-09,DJ,MASTERS OF TEXT,,1600,On a positive note: DWBH (shall I sing it to you?),"don\'t worry, be happy",NA
2013-10-09,DJ,IRISH LITERATURE,,1600,Prolific short story writer Frank O'Connor once served in the I.R.A. & on the board of directors of this playhouse,the Abbey Playhouse,NA
2013-10-09,NA,NA,NA,NA,NA,NA,NA
2013-10-09,DJ,WEIRD TOP 40 HITS,,1600,"In 1967 ""Don't Go Out Into The Rain (You're Going To Melt)"" charted for this ""I'm Henry The Eighth I Am"" band",Herman\'s Hermits,NA
2013-10-09,DJ,BUSINESS,,1600,In 2013 this news network acquired Current TV & took its spot on U.S. cable; salaam aleikum,Al Jazeera,NA
2013-10-09,DJ,"""AZ"" USUAL",,1600,North Carolina has held a festival of these flowers since 1948,azaleas,NA
2013-10-09,DJ,MASTERS OF TEXT,,2000,"& on a final note, all I can say is, GR2BR",good riddance to bad rubbish,NA
2013-10-09,DJ,IRISH LITERATURE,,NA,"""The Boarding House"" & ""The Sisters"" are 2 of the 15 stories appearing in this 1914 James Joyce collection",Dubliners,NA
2013-10-09,NA,NA,NA,NA,NA,NA,NA
2013-10-09,DJ,WEIRD TOP 40 HITS,,2000,You'll be nibbling on bacon & chewing on cheese if you can name this beastly 1976 hit from the Captain & Tennille,"""Muskrat Love""",NA
2013-10-09,NA,NA,NA,NA,NA,NA,NA
2013-10-09,DJ,"""AZ"" USUAL",,2000,"The dudy, or Polish bagpipes, once accompanied this dance",the mazurka,NA
2013-10-09,FJ,LITERARY LOCALES,,NA,The creator of this title place said its name came from the letters labeling the last drawer of his file cabinet,Oz,NA
