date,round,category,comment,value,clue,response,link
2013-12-19,J,MAP QUEST,,200,"Incorporated as a city in 1853, it's on the shores of Lake Winnebago b'gosh",Oshkosh,http://www.j-archive.com/media/2013-12-19_J_01.jpg
2013-12-19,J,HODGEPODGE,,200,"1,742,400 square feet gets you this many acres (mule not included)",40,NA
2013-12-19,J,ANAGRAMS,,200,Anthem ender:BEHAVE HOME FORT,home of the brave,NA
2013-12-19,J,LIBRARIES,,200,America's poet laureate is officially called a consultant in poetry to this library,The Library of Congress,NA
2013-12-19,J,THE BEST DEFENSE,,200,"World war I warships often haddazzle painting as this, from the French for ""disguise""",camouflage,NA
2013-12-19,J,A GOOD OFFENSE,,200,"Tom Brady tossed 50 TD passes in 2007, leading this team to an NFL record 589 points in a season",New England Patriots,NA
2013-12-19,J,MAP QUEST,,400,"But will it play in this city, originally a settlement called Fort Crevecoeur?",Peoria,http://www.j-archive.com/media/2013-12-19_J_02.jpg
2013-12-19,J,HODGEPODGE,,400,"Translate from Esperanto: in January 2009 there was a new resident at the blanka domo, this place",the White House,NA
2013-12-19,J,ANAGRAMS,,400,Relative by marriage:MENIAL WORTH,mother-in-law,NA
2013-12-19,J,LIBRARIES,,400,A small library named for this man at Cambridge's Magdalene College contains his 17th century diary,Samuel Pepys,NA
2013-12-19,J,THE BEST DEFENSE,,400,"In 14th c. Europe, plate armor sent this less protective ""chain"" material on its way",mail,NA
2013-12-19,NA,NA,NA,NA,NA,NA,NA
2013-12-19,J,MAP QUEST,,600,"Antelope Island, oddly home to a herd of wild buffalo,is the largest islandin this U.S. body of water",Great Salt Lake,http://www.j-archive.com/media/2013-12-19_J_03.jpg
2013-12-19,J,HODGEPODGE,,600,"This small blonde Oklahoma-born dynamo has been ""Wicked"" on stage & full of ""Glee"" on television",Kristin Chenoweth,NA
2013-12-19,J,ANAGRAMS,,600,Serious injury:BAKER NORM,broken arm,NA
2013-12-19,J,LIBRARIES,,600,"This university's Hesburgh Library is famous for its 134-foot-high ""Touchdown Jesus"" mural",Notre Dame,NA
2013-12-19,J,THE BEST DEFENSE,,600,"(Kelly of the Clue Crew presents the clue from Switzerland.)  Known as the Toblerone Trail, because they look like the chocolates, the Swiss built fortifications in the 1930s to stop invasion by these, such as Germany's Panzers",tanks,http://www.j-archive.com/media/2013-12-19_J_23.mov
2013-12-19,NA,NA,NA,NA,NA,NA,NA
2013-12-19,J,MAP QUEST,,800,"A-squared equals good times in this city, home to a 40,000-studentuniversity",Ann Arbor,NA
2013-12-19,J,HODGEPODGE,,800,"This woman of myth could've foreseen Agamemnon taking her to Mycenae as a slave, but no one would have believed her",Cassandra,NA
2013-12-19,J,ANAGRAMS,,800,In cartoons she gets slipped a Mickey:NOISE IMMUNE,Minnie Mouse,NA
2013-12-19,J,LIBRARIES,,800,"Milan's Ambrosiana Library has the Codex Atlanticus, a collection of manuscripts & drawings by this Renaissance man",da Vinci,NA
2013-12-19,J,THE BEST DEFENSE,,800,"During the U.S. Civil War, increased firepower forced soldiers into these defenses that crisscrossed Europe in 1918",trenches,NA
2013-12-19,J,A GOOD OFFENSE,,800,"In the 2008-09 season, this univ.'s Huskies outscored their women's basketball opponents by double digits in every game",UConn,NA
2013-12-19,J,MAP QUEST,,1000,"Named for a Spanish duke, it's the county seat of Bernalillo County",Albuquerque,http://www.j-archive.com/media/2013-12-19_J_05.jpg
2013-12-19,J,HODGEPODGE,,1000,This capital of Sierra Leone was founded as a home for liberated slaves,Freetown,NA
2013-12-19,J,ANAGRAMS,,1000,"A small, out-of-the-way restaurant:LOW ETHANE HILL",hole in the wall,NA
2013-12-19,J,LIBRARIES,,NA,"The National Library of Medicine in Bethesda, MD began with the collection Dr. Joseph Lovell, this official",Surgeon General,NA
2013-12-19,J,THE BEST DEFENSE,,1000,The USA's cold war-era Skysweeper was this kind of artillery weapon,anti-aircraft,NA
2013-12-19,J,A GOOD OFFENSE,,1000,"For the 1927 Yankees, Babe Ruth batted in the third spot & this other lefty slugger batted fourth--not bad at all!",Lou Gehrig,NA
2013-12-19,DJ,"HERE COMES BOO BOO, HONEY",,400,"For kids, the Mayo Clinic says symptoms of this head injury include irritability & lack of interest in favorite toys",concussion,NA
2013-12-19,DJ,LITERARY LANDMARKS,,400,"This author's boyhood home in Hannibal, Missouri is on the national register of historic places",Mark Twain,NA
2013-12-19,DJ,THAT MOVIE DID A NUMBER ON ME,,400,"Jane, Lily, Dolly, Dabney, this 1980 film",9 to 5,NA
2013-12-19,DJ,HISTORIC NAMES,,400,"On Dec.15, 1812 he wrote his ""Cartagena Manifesto"" seeking support to oust the Spanish from Venezuela",Simón Bolívar,NA
2013-12-19,NA,NA,NA,NA,NA,NA,NA
2013-12-19,DJ,"""'YS"" WORDS",,400,"An organized or connected group of things; you have a ""nervous"" one",system,NA
2013-12-19,DJ,"HERE COMES BOO BOO, HONEY",,800,Turns out backhand is the stroke most often implicated in this affliction,tennis elbow,NA
2013-12-19,DJ,LITERARY LANDMARKS,,800,The modest home at 4646 N. Hermitage in the Ravenswood area of Chicago is where he wrote his famous poem about the city,Carl Sandburg,NA
2013-12-19,DJ,THAT MOVIE DID A NUMBER ON ME,,800,"Selleck, Guttenberg, Danson, kid, this 1987 film",Three Men and a Baby,NA
2013-12-19,DJ,HISTORIC NAMES,,800,"One of the early items printed by him in his shop in Mainz, Germany was a calendar for the year 1448",Gutenberg,NA
2013-12-19,NA,NA,NA,NA,NA,NA,NA
2013-12-19,DJ,"""'YS"" WORDS",,800,Annual (let's hope) exam by a doctor,physical,NA
2013-12-19,DJ,"HERE COMES BOO BOO, HONEY",,1200,Try not to pull or tear one of these 3 long muscles that run down each leg from the bottom of the pelvis,hamstring,NA
2013-12-19,DJ,LITERARY LANDMARKS,,1200,"In the late 1920s Dashiell Hammett lived in an apt. at 891 Post St. in San Francisco, also this detective's address",Sam Spade,NA
2013-12-19,DJ,THAT MOVIE DID A NUMBER ON ME,,1200,(Morgan Freeman presents the clue.) I played Detective Somerset in this 1995 film where Kevin Spacey left Brad Pitt a very unwanted gift,Seven,http://www.j-archive.com/media/2013-12-19_DJ_18.mov
2013-12-19,DJ,HISTORIC NAMES,,1200,"This Austrian ruling family was known for its hereditary peculiarity, a protruding lower lip",Hapsburgs,NA
2013-12-19,NA,NA,NA,NA,NA,NA,NA
2013-12-19,DJ,"""'YS"" WORDS",,1200,"Aberrant or maladjusted, like some families",dysfunctional,NA
2013-12-19,DJ,"HERE COMES BOO BOO, HONEY",,1600,Inflammation of the thick tissue on the bottom of the foot that creates the arch is plantar this. & just...ouch,fasciitis,NA
2013-12-19,DJ,LITERARY LANDMARKS,,1600,Louis L'Amour wrote many of his western novels in room 222 of the Strater hotel in Durango in this state,Colorado,NA
2013-12-19,DJ,THAT MOVIE DID A NUMBER ON ME,,1600,"In this 1996 movie, Cruella de Vil says, ""You beasts!...you've won the battle, but I'm about to win the wardrobe""",101 Dalmatians,NA
2013-12-19,DJ,HISTORIC NAMES,,1600,"Although Catherine of Aragon had several children with Henry VIII, only this daughter survived infancy",Mary Tudor,NA
2013-12-19,NA,NA,NA,NA,NA,NA,NA
2013-12-19,DJ,"""'YS"" WORDS",,1600,"Fathomless, or really, really bad",abysmal,NA
2013-12-19,DJ,"HERE COMES BOO BOO, HONEY",,2000,"In 2013 Giants FB Henry Hynoski, ""The Hynoceros"", injured his MCL, this collateral ligament, in his knee",medial,NA
2013-12-19,DJ,LITERARY LANDMARKS,,2000,"In 1923 Henry Ford bought this Sudbury, Mass. inn popularized by Longfellow to make it a museum of American history",Wayside Inn,NA
2013-12-19,DJ,THAT MOVIE DID A NUMBER ON ME,,2000,Walter Matthau played Garber in this 1974 subway caper; Denzel played the role in its 2009 remake,The Taking of Pelham 123,NA
2013-12-19,DJ,HISTORIC NAMES,,NA,"In 1861, 4 years after being selected to preside over Mexico's supreme court, he was elected president",Benito Juárez,NA
2013-12-19,DJ,LOOK ON THE UNION LABEL,,2000,"More than 70% of the members of this union, the CWA, work on the information highway",Communications Workers of America,NA
2013-12-19,DJ,"""'YS"" WORDS",,2000,The systematic investigation of something complex; you might see a shrink for it,analysis,NA
2013-12-19,FJ,TV  CHARACTERS,,NA,"Jerry Jones, Mark Cuban & Mayor Mike Rawlings were 3 of the real folks at the 2013 memorial for this TV character",J. R. Ewing,NA
