date,round,category,comment,value,clue,response,link
1988-05-05,J,MATHEMATICS,,100,"It's a geometric solid; the $100,000 one on TV is just a plane triangle",a pyramid,NA
1988-05-05,J,MUSEUMS,,100,"The Craddock-Terry Shoe Museum in Lynchburg, Va. boasts a pair of her ""heels of fortune""",Vanna White,NA
1988-05-05,J,MOVIE CLASSICS,,100,"In ""Road to Morocco"", this duo sang, ""Like Webster's Dictionary, we're Morocco-bound""",Hope & Crosby,NA
1988-05-05,J,ACRONYMS,,100,"If you belong to SAG you belong to this, & may be ineligible to be a game show contestant",the Screen Actors Guild,NA
1988-05-05,J,HISTORY,,100,"She restored Charles VII to the throne, but he didn't lift a finger to save her from the stake",Joan of Arc,NA
1988-05-05,J,BREAKFAST CEREAL,,100,"If you wake up with Kellogg's Corn Flakes, you'll see this farm animal on the front of the box",a rooster,NA
1988-05-05,NA,NA,NA,NA,NA,NA,NA
1988-05-05,J,MUSEUMS,,200,The Heard Museum in Phoenix displays Hopi Indian dolls collected by this senator,Barry Goldwater,NA
1988-05-05,J,MOVIE CLASSICS,,200,"At the end of ""Now, Voyager"", Bette Davis says, ""Oh, Jerry, don't let's ask for the moon.  We have"" these",the stars,NA
1988-05-05,J,ACRONYMS,,200,"Since it also means animal droppings, the Santa Clara Co. area transit decided against using this acronym",SCAT,NA
1988-05-05,J,HISTORY,,200,It's said this royal grandmother of Kaiser Wilhelm II wouldn't let him visit Ireland,Queen Victoria,NA
1988-05-05,J,BREAKFAST CEREAL,,200,"Lucky Charms, Freakies, & Circus Fun all have oddly-shaped bits made of this",marshmallow,NA
1988-05-05,NA,NA,NA,NA,NA,NA,NA
1988-05-05,J,MUSEUMS,,300,"Appropriately, Louisville, Kentucky's Derby Museum is adjacent to this racetrack",Churchill Downs,NA
1988-05-05,J,MOVIE CLASSICS,,300,"In ""A Day at the Races"", he told Margaret Dumont, ""Marry me, & I'll never look at any other horse!""",Groucho Marx,NA
1988-05-05,J,ACRONYMS,,300,"The ""E"" in ""CARE"" no longer stands for Europe, but this",Everywhere,NA
1988-05-05,J,HISTORY,,300,"In 1881, despite a $10,000 reward for the arrest of these brothers, the posters left out ""dead or alive""",the James Brothers (Frank & Jesse),NA
1988-05-05,NA,NA,NA,NA,NA,NA,NA
1988-05-05,NA,NA,NA,NA,NA,NA,NA
1988-05-05,J,MUSEUMS,,400,This S.D. city where Wild Bill Hickok died also boasts a Chinese tunnel museum with opium den,Deadwood,NA
1988-05-05,J,MOVIE CLASSICS,,400,"The only Alfred Hitchcock film to win an Oscar as Best Picture, it was partially set in Monte Carlo",Rebecca,NA
1988-05-05,J,ACRONYMS,,400,"Now headquartered in the Big Apple, ""CORE"" is the ""Congress of"" this",Racial Equality,NA
1988-05-05,J,HISTORY,,400,"Darius I ruled this vast empire from 2 capitals, Susa & Persepolis",the Persian Empire,NA
1988-05-05,J,BREAKFAST CEREAL,,400,This cereal inspired by a cartoon show can be used to make Yabba-Dabba-Doo Squares,(Cocoa & Fruity) Pebbles,NA
1988-05-05,J,MATHEMATICS,,500,"In Roman numerals, the largest number represented by a single letter with no markings","1,000 (the letter M)",NA
1988-05-05,J,MUSEUMS,,500,"Her farmhouse in Kenya, now a museum, is in Karen, the Nairobi suburb named for her",Isak Dinesen (Karen Blixen),NA
1988-05-05,J,MOVIE CLASSICS,,NA,"In ""Gone with the Wind"", these 2 relatives of Scarlett's died from falling off horses","her daughter & her father (Gerald O\'Hara & ""Bonnie Blue"" Butler)",NA
1988-05-05,J,ACRONYMS,,500,The North American Air Defense Command,NORAD,NA
1988-05-05,J,HISTORY,,500,"In 1858, the Brittish government took over the rule of India from this company",the East India Company,NA
1988-05-05,J,BREAKFAST CEREAL,,500,"If regular Shredded Wheat is too big for you, you can get it in this ""Size""",Spoon Size,NA
1988-05-05,DJ,MAMMALS,,200,A white Persian with orange eyes is a popular breed of these,a cat,NA
1988-05-05,DJ,GOVERNMENT,,200,"In Louisiana, the equivalent of this local unit of government is called a parish",a county,NA
1988-05-05,DJ,"""T"" ON THE MAP",,200,The city on Honshu that shares its name with the cars made there,Toyota,NA
1988-05-05,DJ,RUSSIAN COMPOSERS,,200,"Famous for aquatic operatic scenes, Rimsky-Korsakov was an officer in this Russian service",the navy,NA
1988-05-05,DJ,PLACES OF WORSHIP,,200,"It can be any room with 2 candelabra, an ark to hold the Scriptures, & a platform to read them from",a synagogue,NA
1988-05-05,DJ,LAST WORDS,,200,"Founder of Communism, he said, ""last words are for fools who haven't said enough""",Karl Marx,NA
1988-05-05,DJ,MAMMALS,,400,"Ambergris, a substance formed in the intestines of sperm whales, is used in this beauty product",perfume,NA
1988-05-05,DJ,GOVERNMENT,,400,"If no candidate has a majority of electoral votes, this body selects the U.S. vice president",the U.S. Senate,NA
1988-05-05,DJ,"""T"" ON THE MAP",,400,"Since 1578, it's been ""Shroud City""",Turin,NA
1988-05-05,DJ,RUSSIAN COMPOSERS,,NA,"Composer of following, it's now believed he poisoned himself in 1893 to avoid a sex scandal:",Tchaikovsky,http://www.j-archive.com/media/1988-05-05_DJ_27.mp3
1988-05-05,DJ,PLACES OF WORSHIP,,400,"A stained-glass window at Wash. Cathedral contains a piece of this, presented by Apollo 11 astronauts",the Moon,NA
1988-05-05,DJ,LAST WORDS,,400,"This silent screen swashbuckler's last words, in 1939, were ""I've never felt better""",Douglas Fairbanks,NA
1988-05-05,DJ,MAMMALS,,600,"In 1799, the 1st complete specimen of one of these was found in a block of ice in Siberia",a mammoth,NA
1988-05-05,DJ,GOVERNMENT,,600,The Bureau of Customs is part of this Cabinet department,Treasury,NA
1988-05-05,DJ,"""T"" ON THE MAP",,NA,"In 1888, these 2 ""T"" islands in the West Indies merged into a single British colony",Trinidad & Tobago,NA
1988-05-05,NA,NA,NA,NA,NA,NA,NA
1988-05-05,DJ,PLACES OF WORSHIP,,600,"The holiest of all objects of this religion, a mirror, is at Ise, a shrine in Japan",Shinto,NA
1988-05-05,DJ,LAST WORDS,,600,"When her husband Robert asked her how she felt, this poet replied, ""Beautiful""",Elizabeth Barrett Browning,NA
1988-05-05,DJ,MAMMALS,,800,"The giant panda is at home in this type of forest, where lunch is always at hand",bamboo,NA
1988-05-05,DJ,GOVERNMENT,,800,"Adopted by Congress in 1913, this act completely reorganized the U.S. banking system",the Owen-Glass Act (the Federal Reserve Act of 1913),NA
1988-05-05,DJ,"""T"" ON THE MAP",,800,It's the largest of the Canary Islands,Tenerife,NA
1988-05-05,NA,NA,NA,NA,NA,NA,NA
1988-05-05,DJ,PLACES OF WORSHIP,,800,"Many call this city's Episcopal Cathedral, under construction since 1892, St. John the Unfinished",New York City,NA
1988-05-05,DJ,LAST WORDS,,800,"He died during the Battle of Trafalgar; his last words were, ""Thank God I have done my duty""",Lord Nelson,NA
1988-05-05,DJ,MAMMALS,,1000,"Really a rodent, the jerboa looks like a tiny one of these",a kangaroo,NA
1988-05-05,DJ,GOVERNMENT,,1000,Monetary phrase for a government official or employee who accepts the minimum salary required by law,a dollar-a-year man,NA
1988-05-05,DJ,"""T"" ON THE MAP",,1000,This island country in the South Pacific is the only country in Polynesia still ruled by a king,Tonga,NA
1988-05-05,NA,NA,NA,NA,NA,NA,NA
1988-05-05,DJ,PLACES OF WORSHIP,,1000,"Their typical place of worship is a stupa, a circular mound of earth covered with bricks & plaster",Buddhists,NA
1988-05-05,DJ,LAST WORDS,,1000,"Dying in 1950, this 94-year-old playwright reportedly said, ""Well, it will be a new experience, anyway""",George Bernard Shaw,NA
1988-05-05,FJ,19th C. AMERICANS,,NA,Sam Houston served under Andrew Jackson in this war,the War of 1812,NA
