date,round,category,comment,value,clue,response,link
2014-02-19,J,DORM ROOM CHECKLIST,,200,"To enjoy TV or music without disturbing your roommate, bring along a pair of noise-canceling these",headphones,NA
2014-02-19,J,WEBSITES,,200,"You'll need an exclamation point to spell this website, America's largest e-mail provider",Yahoo!,NA
2014-02-19,J,RECENTLY BANNED OR CHALLENGED BOOKS,,200,"A North Carolina county board made this 1952 Ralph Ellison classic disappear, saying it didn't have ""any literary value""",Invisible Man,NA
2014-02-19,J,STATE LINES,,200,"Stephen Foster:""I've come from ____ with my banjo on my knee""",Alabama,NA
2014-02-19,J,"""FOR"" WORDS & ""BACK"" WORDS",,200,"In a movie, it's the narrative that supplies a character's past",a backstory,NA
2014-02-19,J,THE MOVIE SUPERHERO WHO...,,200,kneels before Zod... momentarily,Superman,NA
2014-02-19,J,DORM ROOM CHECKLIST,,400,"For your dining pleasure, this tool will come in quite handy",a pizza cutter,http://www.j-archive.com/media/2014-02-19_J_07.jpg
2014-02-19,J,WEBSITES,,400,"Watch ""Glee"" or ""Nashville"" on this rhyming online video service that has a ""Plus"" subscription",Hulu,NA
2014-02-19,J,RECENTLY BANNED OR CHALLENGED BOOKS,,400,"A Florida county pulled this 2011 E.L. James book from libraries, but it came back ""in response to public demand""",Fifty Shades of Grey,NA
2014-02-19,J,STATE LINES,,400,"""I am from ____.  You have got to show me""",Missouri,NA
2014-02-19,J,"""FOR"" WORDS & ""BACK"" WORDS",,400,"One could be ""rainy with a chance of hail""",a forecast,NA
2014-02-19,J,THE MOVIE SUPERHERO WHO...,,400,married Elastigirl & entered the superhero protection program,Mr. Incredible,NA
2014-02-19,J,DORM ROOM CHECKLIST,,600,"Mom will loan you a broom, but you can't take her Dyson one of these cleaning appliances",a vacuum,NA
2014-02-19,J,WEBSITES,,600,"Troopers & Jake & Amir are original features on this ""college"" website",CollegeHumor,NA
2014-02-19,J,RECENTLY BANNED OR CHALLENGED BOOKS,,600,"This 1985 Margaret Atwood novel was challenged in N.C. as ""sexually explicit, violently graphic and morally corrupt""",The Handmaid\'s Tale,NA
2014-02-19,J,STATE LINES,,600,"Woody Guthrie:""From California to the ____ ____ Island""",New York,NA
2014-02-19,J,"""FOR"" WORDS & ""BACK"" WORDS",,600,What's called Obamacare is formally the Patient Protection & this type of Care Act,Affordable,NA
2014-02-19,J,THE MOVIE SUPERHERO WHO...,,600,"advises local cop John Blake, ""If you're working alone, wear a mask""",Batman,NA
2014-02-19,J,DORM ROOM CHECKLIST,,800,"Don't forget raingear--umbrella, boots & this blanketlike cloak with a hole in the middle",a poncho,NA
2014-02-19,J,WEBSITES,,800,"The web radio site with this mythic name asks you to ""enter artist, genre or composer to create a station""",Pandora,NA
2014-02-19,J,RECENTLY BANNED OR CHALLENGED BOOKS,,800,"A beef with his ""Electric Kool-Aid Acid Test"" on a Penn. reading list: ""sexual content &... there is nothing good about it""",Tom Wolfe,NA
2014-02-19,J,STATE LINES,,NA,"From the pen of screenwriter Noel Langley:""I've a feeling we're ____ ____ ____ ____""",not in Kansas anymore,NA
2014-02-19,J,"""FOR"" WORDS & ""BACK"" WORDS",,800,Type of workplaceseen here,a forge,http://www.j-archive.com/media/2014-02-19_J_29.mp4
2014-02-19,J,THE MOVIE SUPERHERO WHO...,,800,"is asked, ""You've been called the da Vinci of our time.  What do you say to that?""  ""Ridiculous.  I don't paint""",Tony Stark (Iron Man),NA
2014-02-19,J,DORM ROOM CHECKLIST,,1000,Your first aid kit should include an antibiotic ointment like this popular brand from Johnson & Johnson,Neosporin,NA
2014-02-19,J,WEBSITES,,1000,Need a ride?  Go to the site called this to schedule your pickup & look for the pink carstache,Lyft,NA
2014-02-19,J,RECENTLY BANNED OR CHALLENGED BOOKS,,1000,"A Katy, Texas school district didn't have a Jane Smiley face after complaints about this numerically titled book",A Thousand Acres,NA
2014-02-19,J,STATE LINES,,1000,"""So we sang the chorus from Atlanta to the sea, while we were marching ____ ____""",through Georgia,NA
2014-02-19,J,"""FOR"" WORDS & ""BACK"" WORDS",,1000,"A screen behind the catcher in baseball, or a term for the catcher himself",a backstop,NA
2014-02-19,J,THE MOVIE SUPERHERO WHO...,,1000,got his powers from a ring in 2011,the Green Lantern,NA
2014-02-19,DJ,SORORITY SISTERS,,400,"We can see this 3-named Supreme Court justice, a Cornell AEPhi, just trashing a frat house at a kegger",Ruth Bader Ginsburg,NA
2014-02-19,DJ,ISLANDS OF THE PACIFIC,,400,"A brand of water named for this Pacific island nation is bottled at the source, the Yaqara Valley on Viti Levu",Fiji,NA
2014-02-19,DJ,SCIENCE IN THE WORLD,,400,"If cirrostratus ones are replaced by lower altostratus ones, rethink the picnic",clouds,NA
2014-02-19,DJ,21st CENTURY MUSIC,,400,"""Otherside"" was an early hit for the team of Macklemore & him",Ryan Lewis,NA
2014-02-19,DJ,FRENCH HISTORY,,400,A hunting lodge begun by Louis XIII in 1624 eventually became this elaborate royal residence,Versailles,NA
2014-02-19,DJ,CIVIL WAR SLANG,,400,"From the Latin for ""life"", vittles meant this",food,NA
2014-02-19,DJ,SORORITY SISTERS,,800,FSU Tri Delt Sara Blakely became a billionaire by inventing this tight-fitting undergarment line,Spanx,NA
2014-02-19,DJ,ISLANDS OF THE PACIFIC,,800,"A big tourist activity in Tonga is whale watching, & since the whales are mainly this singing species, whale listening too",humpback whales,NA
2014-02-19,DJ,SCIENCE IN THE WORLD,,800,"If you're doing this colorful cooking action to meat, you're making use of the Maillard reaction of sugars & amino acids",browning,NA
2014-02-19,DJ,21st CENTURY MUSIC,,800,"""Apologize"" if you get this Ryan Tedder band mixed up with One Direction",OneRepublic,NA
2014-02-19,DJ,FRENCH HISTORY,,NA,"At Castillon in 1453, French troops defeated the English in the final great battle of this war",the Hundred Years\' War,NA
2014-02-19,DJ,CIVIL WAR SLANG,,800,A picket was someone on this duty,guard duty,NA
2014-02-19,DJ,SORORITY SISTERS,,1200,"Margaret Brewer, this service's first woman general, was ""always faithful"" to the Michigan ZTA Alpha Gammas",the Marines,NA
2014-02-19,DJ,ISLANDS OF THE PACIFIC,,1200,"Called by some the most beautiful place on Earth, Moorea is just 12 miles from this largest island in French Polynesia",Tahiti,NA
2014-02-19,DJ,SCIENCE IN THE WORLD,,1200,"(Jimmy of the Clue Crew shows a javelin on the monitor.)  In 1984, for safety reasons, after one was thrown a staggering 343 feet, the javelin was redesigned to underperform by moving this point, ""CM"" for short, by 4 centimeters, which keeps the nose down",the center of mass,http://www.j-archive.com/media/2014-02-19_DJ_03a.jpg
2014-02-19,DJ,21st CENTURY MUSIC,,1200,"2012's ""Blunderbuss"" is the first official solo album by this ""Jack"" of many trades",Jack White,NA
2014-02-19,DJ,FRENCH HISTORY,,1200,"In the 2012 election for president, Francois Hollande defeated this incumbent",(Nicolas) Sarkozy,NA
2014-02-19,DJ,CIVIL WAR SLANG,,1200,"A Confederate soldier could be called by this first name whether he was ""marching home"" or not",Johnny,NA
2014-02-19,DJ,SORORITY SISTERS,,NA,"This George W. Bush Cabinet member was Alpha Chi Omega, a sorority with musical origins, at the University of Denver",Condoleezza Rice,NA
2014-02-19,DJ,ISLANDS OF THE PACIFIC,,1600,Anthropologists study the island of Yap for its use of 12-foot stone wheels not for transport but as this,currency (or money),NA
2014-02-19,DJ,SCIENCE IN THE WORLD,,1600,"An eco-issue is protection of creatures that act as these for plants--honeybees of course, but also beetles & birds",pollinators,NA
2014-02-19,DJ,21st CENTURY MUSIC,,1600,"""Love Don't Live Here"" was a hit by this country group of 2 guys & Hillary Scott",Lady Antebellum,NA
2014-02-19,DJ,FRENCH HISTORY,,1600,In Feb. of this year France hosted the Grenoble Winter Olympics; in May protests nearly led to a leftist revolution,1968,NA
2014-02-19,DJ,CIVIL WAR SLANG,,1600,"A Union soldier could be called this, now found before ""Trade Commission""",Federal,NA
2014-02-19,DJ,SORORITY SISTERS,,2000,Chi O! & Roll Tide!  This author won a Pulitzer for fiction in 1961,Harper Lee,NA
2014-02-19,DJ,ISLANDS OF THE PACIFIC,,2000,"Thor Heyerdahl believed this island was once colonized by a redheaded race from South America, possibly Peru",Easter Island,NA
2014-02-19,DJ,SCIENCE IN THE WORLD,,2000,"An example of this ""meta""term from information science is phone call times & recipients without the content",metadata,NA
2014-02-19,DJ,21st CENTURY MUSIC,,2000,"Pleading, ""fathers, be good to"" them earned John Mayer a Song of the Year Grammy",daughters,NA
2014-02-19,DJ,FRENCH HISTORY,,2000,"To grant religious freedom to Protestants, in 1598 King Henry IV issued the Edict of this city",Nantes,NA
2014-02-19,DJ,CIVIL WAR SLANG,,2000,Now it's slang for any bad situation; back then it was a foraging soldier,a bummer,NA
2014-02-19,FJ,SHAKESPEARE CHARACTERS,,NA,"He has the most speeches of any character with 471 in 3 plays, of which 2 are histories & 1 is a comedy",Falstaff,NA
