date,round,category,comment,value,clue,response,link
2014-03-03,J,STEPHEN KING,,200,The inspiration for this novel came when King's daughter's cat was killed by a passing truck,Pet Sematary,NA
2014-03-03,J,ROLE IN COMMON,,200,"Sean Connery,George Lazenby,Timothy Dalton",(James) Bond,NA
2014-03-03,J,"ON THE ""GO""",(Alex: That will come up at the end of each response.),200,Chronic or recurring pain in the lower back,lumbago,NA
2014-03-03,J,THE 90s,,200,"The 91st one says, ""he that dwelleth in the secret place of the most high shall abide under the shadow of the almighty""",a psalm,NA
2014-03-03,J,DOT COM,,200,"wordpress.com bills itself as ""a better way to"" keep one of these Internet diaries",a blog,NA
2014-03-03,J,BOOM!,,200,"This word for a massive explosion is Latin for ""new""",a nova,NA
2014-03-03,J,STEPHEN KING,,400,"Like ""The Shining"", ""Misery"" deals with a writer stuck in this U.S. state during winter",Colorado,NA
2014-03-03,J,ROLE IN COMMON,,400,"Sean Connery,Kevin Costner,Errol Flynn",Robin Hood,NA
2014-03-03,J,"ON THE ""GO""",(Alex: That will come up at the end of each response.),400,"Another name for graphite, it's also the name of several garden plants",plumbago,NA
2014-03-03,J,THE 90s,,400,"93 is the atomic number of this element, the first transuranium one",Neptunium,NA
2014-03-03,J,DOT COM,,400,"See houses before they hit the market, or zestimate the value of your home at this website",zillow,NA
2014-03-03,J,BOOM!,,400,"In 1924 a lava lake in this single-named Hawaiian volcano sank away, & major steam explosions occurred",Kilauea,NA
2014-03-03,J,STEPHEN KING,,600,"""The Wizard and Glass"" is one entry in this series",The Dark Tower,NA
2014-03-03,J,ROLE IN COMMON,,600,"Sean Connery,Clive Owen,Graham Chapman",King Arthur,NA
2014-03-03,J,"ON THE ""GO""",(Alex: That will come up at the end of each response.),600,"Ze plane, boss, ze plane--our faith in this kind of cult is being proved true!",a cargo cult,NA
2014-03-03,J,THE 90s,,600,Geeks rejoiced when the 95 version of this replaced version 3.1,Windows,NA
2014-03-03,J,DOT COM,,600,"This site sums itself up as ""real people, real reviews""",yelp.com,NA
2014-03-03,J,BOOM!,,600,"Twinkle, twinkle... boom! in 2007 in Vegas, this hotel went down; as Sinatra sang, ""love is now the"" this ""of yesterday""",Stardust,NA
2014-03-03,J,STEPHEN KING,,800,"It's the full name of the town visited by vampires in ""'Salem's Lot""",Jerusalem\'s Lot,NA
2014-03-03,J,ROLE IN COMMON,,NA,"Sean Connery,Patrick Stewart,Richard Harris",Richard the Lionheart (Richard I),NA
2014-03-03,J,"ON THE ""GO""",(Alex: That will come up at the end of each response.),800,"This one-word Latin motto of the state of Maine means ""I lead""",Dirigo,NA
2014-03-03,J,THE 90s,,800,"On Space Shuttle mission STS-97, Marc Garneau, this nation's first astronaut in space, operated a giant robotic arm",Canada,NA
2014-03-03,J,DOT COM,,800,"The first online-only show to win a Golden Globe was ""House of Cards"" from this dot com",Netflix,NA
2014-03-03,J,BOOM!,,800,"1907's Monongah mine explosion in this state buckled streets, collapsed buildings & claimed 362 lives",West Virginia,NA
2014-03-03,J,STEPHEN KING,,1000,These spirits of dead miners who try to warn the living of cave-ins may have inspired King's 1987 novel of the same name,The Tommyknockers,NA
2014-03-03,J,ROLE IN COMMON,,1000,"Sean Connery,Richard Chamberlain,Patrick Swayze",Allan Quatermain,NA
2014-03-03,J,"ON THE ""GO""",(Alex: That will come up at the end of each response.),1000,The coat of soft hair that covers a newborn baby,lanugo,NA
2014-03-03,J,THE 90s,,1000,"Manufactured between 1941 & 1996, the full-sized ""98"" was the flagship model of this General Motors division",Oldsmobile,NA
2014-03-03,J,DOT COM,,1000,"""Got a tip?"" asks this celeb news site founded by Harvey Levin",TMZ,NA
2014-03-03,J,BOOM!,,1000,Henry was this man's first name; his artillery shell contained balls & a powder charge to burst the shell,Shrapnel,NA
2014-03-03,DJ,2014 ANNIVERSARIES,,400,"50 years ago, February 9, it was live from New York as the Beatles played this TV show",The Ed Sullivan Show,NA
2014-03-03,DJ,ON THE MAP,,400,Mount Mansfield in Vermont is the highest peak in these mountains,the Green Mountains,NA
2014-03-03,DJ,THE LAST CENTURY,,400,"""The most trusted man in America"", he ended his tenure as anchor of the CBS Evening News in 1981",Walter Cronkite,NA
2014-03-03,DJ,THE ELEMENTS,,400,"Until it was phased out, antiknock gasoline contained this toxic metal",lead,NA
2014-03-03,DJ,1990s NO. 1 HITS,,400,"""Wild Wild West"" was a chart-topper performed by this star of the 1999 movie",Will Smith,NA
2014-03-03,DJ,"CRYPTIC CROSSWORD CLUES ""L""",,400,Toy company whose employees are always train-ing(6),Lionel,NA
2014-03-03,DJ,2014 ANNIVERSARIES,,800,2014 marks the 25th anniversary of this tanker's catastrophic oil spill in Prince William Sound,the Exxon Valdez,NA
2014-03-03,DJ,ON THE MAP,,800,Beersheba is the largest city in this southern desert region of Israel,the Negev,NA
2014-03-03,DJ,THE LAST CENTURY,,800,"In 1989 Ayatollah Khomeini called this book blasphemous & condemned Salman Rushdie, its author, to death",The Satanic Verses,NA
2014-03-03,DJ,THE ELEMENTS,,800,About four-fifths of the earth's atmosphere is this gas,nitrogen,NA
2014-03-03,DJ,1990s NO. 1 HITS,,800,Right Said Fred hit No. 1 with this 3-word title,"""I\'m Too Sexy""",NA
2014-03-03,DJ,"CRYPTIC CROSSWORD CLUES ""L""",,800,Make up artist(4),liar,NA
2014-03-03,DJ,2014 ANNIVERSARIES,,NA,Happy 400th anniversary to this interracial couple who tied the knot in Jamestown,Pocahontas & John Rolfe,NA
2014-03-03,DJ,ON THE MAP,,1200,Azerbaijan borders this country on the east; an enclave of Azerbaijan also borders it to the southwest,Armenia,NA
2014-03-03,DJ,THE LAST CENTURY,,1200,In may 1969 he got within 10 miles of the lunar surface; in 1972 he was the last to walk on the moon,(Eugene) Cernan,NA
2014-03-03,DJ,THE ELEMENTS,,1200,"The 2 elements that are liquid at room temperature are mercury & this one, symbol Br",bromine,NA
2014-03-03,DJ,1990s NO. 1 HITS,,1200,"""I'd Do Anything For Love (But I Won't Do That)"" by this singer was tops for 5 weeks in 1993",Meat Loaf,NA
2014-03-03,DJ,"CRYPTIC CROSSWORD CLUES ""L""",,1200,Book that settles accounts(6),a ledger,NA
2014-03-03,DJ,2014 ANNIVERSARIES,,1600,"August 2014 is the 150th anniversary of his order, ""Damn the torpedoes--full speed ahead!""",Farragut,NA
2014-03-03,DJ,ON THE MAP,,1600,It connects the Black Sea & the Sea of Marmara,the Bosphorus,NA
2014-03-03,DJ,THE LAST CENTURY,,1600,"The nationalist party, which came to power in China in the 1920s, was also called this, KMT for short",Kuomintang,NA
2014-03-03,DJ,THE ELEMENTS,,1600,"The name of this element is from the Greek word for ""moon""",selenium,NA
2014-03-03,DJ,1990s NO. 1 HITS,,1600,"The record co. wanted to lose the vocal effect as she sang, ""Do You Believe In Life After Love?""; she said no & hit No. 1",Cher,NA
2014-03-03,DJ,"CRYPTIC CROSSWORD CLUES ""L""",,1600,Mass medium(5),Latin,NA
2014-03-03,DJ,2014 ANNIVERSARIES,,2000,"It was 200 years ago that he published the first of his ""Waverley"" novels",Sir Walter Scott,NA
2014-03-03,DJ,ON THE MAP,,2000,This city on the Arabian Sea is the capital of Pakistan's sindh province,Karachi,NA
2014-03-03,DJ,THE LAST CENTURY,,2000,In 1924 Wyoming made her the first woman elected governor of a U.S. state,Nellie Tayloe Ross,NA
2014-03-03,DJ,THE ELEMENTS,,NA,This element is named for a mythological king for whom food was always just out of reach,tantalum,NA
2014-03-03,DJ,1990s NO. 1 HITS,,2000,"The first song to hit No. 1 in the '90s was ""How Am I Supposed To Live Without You"", emoted by this singer",Michael Bolton,NA
2014-03-03,DJ,"CRYPTIC CROSSWORD CLUES ""L""",,2000,Rhine rock singer(7),the Lorelei,NA
2014-03-03,FJ,PRESIDENTS,,NA,He is the only 19th century president to serve 2 complete terms with the same vice president,James Monroe,NA
