date,round,category,comment,value,clue,response,link
2014-05-19,J,THE QUOTABLE TUBE,,200,"From the BBC: ""And now for something completely different""",The Monty Python Show,NA
2014-05-19,J,MARINE BIOLOGY,,200,(Sarah of the Clue Crew presents the clue from Baja California.)  Baja's sea lions can dive deep because they have the ability to store substantial amounts of this gas in their blood & muscle,oxygen,http://www.j-archive.com/media/2014-05-19_J_09.wmv
2014-05-19,J,GUYS NAMED BARRY,,200,This senator from way out west was the Republican candidate for president in 1964,Barry Goldwater,NA
2014-05-19,J,THE MOST POPULOUS COUNTRY,,200,"Peru,Pakistan,Poland",Pakistan,NA
2014-05-19,J,_____ OF _____,,200,"You've opened ""a whole new"" this, a source of invertebrates &, proverbially, of unexpected problems",a can of worms,NA
2014-05-19,J,MAKING THE GRADE,,200,"The more than 3,000 grades of this metal can be categorized into carbon, alloy & stainless varieties",steel,NA
2014-05-19,J,THE QUOTABLE TUBE,,400,"On Fox: ""Are you this rude to all your patients?"" ""Yes. Don't think you're special""",House,NA
2014-05-19,J,MARINE BIOLOGY,,400,"These polyps come in several varieties including thorny, gorgonian & mushroom",coral,NA
2014-05-19,J,GUYS NAMED BARRY,,400,"Sir Charles Barry wasthe chief architect of this government edifice,finished around 1860",the Houses of Parliament,NA
2014-05-19,J,THE MOST POPULOUS COUNTRY,,400,"Iran,Israel,Italy",Iran,NA
2014-05-19,J,_____ OF _____,,400,A plan that's insubstantial & subject to collapse is this wobbly structure,a house of cards,NA
2014-05-19,J,MAKING THE GRADE,,400,"Some schools use the ""A-F"" grading system & some use ""P"" , ""F"" & ""IN"", these 3 grades","pass, fail, & incomplete",NA
2014-05-19,J,THE QUOTABLE TUBE,,600,"Hannibal Smith, on an NBC show: ""I love it when a plan comes together""",The A-Team,NA
2014-05-19,J,MARINE BIOLOGY,,600,"The name of this tusked whale comes from the Old Norse for ""corpse whale"", referring to its whitish color",a narwhal,NA
2014-05-19,J,GUYS NAMED BARRY,,600,"""Can't get enough of"" this singer who led the Love Unlimited Orchestra",Barry White,NA
2014-05-19,J,THE MOST POPULOUS COUNTRY,,600,"France,Germany,Spain",Germany,NA
2014-05-19,J,_____ OF _____,,600,"""I'll never be your"" ox or mule, this type of animal",beast of burden,NA
2014-05-19,J,MAKING THE GRADE,,600,"Something too important for you to decide is ""above your"" this, a level of salary in the military",a pay grade,NA
2014-05-19,J,THE QUOTABLE TUBE,,800,"On Showtime: lockhart is ""the head of the Senate intelligence committee, not some civilian... monkey""",Homeland,NA
2014-05-19,J,MARINE BIOLOGY,,NA,This small fish of the genus hippocampus has no stomach & must eat almost constantly to stay alive,a seahorse,NA
2014-05-19,J,GUYS NAMED BARRY,,800,This media mogul who helped launch Fox TV started his career in the mail room at the William Morris agency,Barry Diller,NA
2014-05-19,J,THE MOST POPULOUS COUNTRY,,800,"Austria,Australia,Argentina",Argentina,NA
2014-05-19,J,_____ OF _____,,800,This term for weakness in the character of an admired person includes lower extremities,feet of clay,NA
2014-05-19,J,MAKING THE GRADE,,800,"One of these is below investment grade if it is rated ""BB+"" or lower by Standard & Poor's",a bond,NA
2014-05-19,J,THE QUOTABLE TUBE,,1000,"On CBS: ""As god is my witness, I thought turkeys could fly""",WKRP in Cincinnati,NA
2014-05-19,J,MARINE BIOLOGY,,1000,"Each fall silver eels migrate to this ""sea"" within the North Atlantic to breed, some traveling across land",the Sargasso Sea,NA
2014-05-19,J,GUYS NAMED BARRY,,1000,"Under publisher Barry Bingham Jr., this southern city's Courier-Journal won 3 Pulitzer prizes",Louisville,NA
2014-05-19,J,THE MOST POPULOUS COUNTRY,,1000,"Bosnia,Belgium,Belize",Belgium,NA
2014-05-19,J,_____ OF _____,,1000,A distribution of forces so no single nation is strong enough to dominate (& tip it),balance of power,NA
2014-05-19,J,MAKING THE GRADE,,1000,"Factors such as amnesia & loss of consciousness help grade this injury as mild, moderate or severe",a concussion,NA
2014-05-19,DJ,"YOU LIKE KABUKI, NOH?",,400,The Japanese theatrical form of noh derives its name from a word meaning this type of ability America ostensibly has,talent,NA
2014-05-19,DJ,DISNEY FILM VOICES,,400,"A Tony winner for ""Miss Saigon"", Lea Salonga provided the singing voice for ""Mulan"" & for Princess Jasmine in this film",Aladdin,NA
2014-05-19,DJ,"""ROUND"" 'EM UP",,400,It was originally made for Uther Pendragon,the Round Table,NA
2014-05-19,DJ,LITERARY CHARACTERS,,400,"He based ""stately, plump Buck Mulligan"" in ""Ulysses"" on his friend Oliver Gogarty",James Joyce,NA
2014-05-19,DJ,COME AT THE KING,,400,This king who lends his name to a costly type of victory was killed in a 272 B.C. battle to capture Argos,Pyrrhus,NA
2014-05-19,DJ,YOU BEST NOT MISS,,400,"First Response offers this type of test--which has only 2 responses--& says it's ""over 99% accurate""",a pregnancy test,NA
2014-05-19,DJ,"YOU LIKE KABUKI, NOH?",,800,"The 5 types of noh play include the kami play, about the deities of this religion",Shinto,NA
2014-05-19,DJ,DISNEY FILM VOICES,,800,"This ""G.I. Jane"" played Esmeralda to Tom Hulce's Quasimodo in 1996's ""The Hunchback of Notre Dame""",(Demi) Moore,NA
2014-05-19,DJ,"""ROUND"" 'EM UP",,800,A journey there & back again,a round trip,NA
2014-05-19,DJ,LITERARY CHARACTERS,,800,This Joseph Conrad character receives the title of lord from natives on the remote island of Patusan,Lord Jim,NA
2014-05-19,DJ,COME AT THE KING,,800,"Talk about wanting a recount! On Jan. 19, 1793, this king was condemned to death by 380 votes to 310",Louis XVI,NA
2014-05-19,DJ,YOU BEST NOT MISS,,800,In a 1992 game Dominique Wilkins set an NBA record by making 23 of these shots without missing,free throws,NA
2014-05-19,DJ,"YOU LIKE KABUKI, NOH?",,NA,Kuroko are kabuki stagehands whose traditional black dressIs believed to give themthis quality,invisibility,http://www.j-archive.com/media/2014-05-19_DJ_28a.jpg
2014-05-19,DJ,DISNEY FILM VOICES,,1200,"Idina Menzel voiced the snow queen in 2013's ""Frozen"", while this ""Veronica Mars"" actress played her sister Anna",Kristen Bell,NA
2014-05-19,DJ,"""ROUND"" 'EM UP",,1200,This sweeping punch is kind of the side-to-side version of an uppercut,a roundhouse,NA
2014-05-19,DJ,LITERARY CHARACTERS,,1200,"P.G. Wodehouse introduced this valet in a Saturday Evening Post story, ""Extricating Young Gussie""",Jeeves,NA
2014-05-19,DJ,COME AT THE KING,,1200,"In 1975 King Faisal of this country was shot to death by his nephew, Prince Faisal",Saudi Arabia,NA
2014-05-19,DJ,YOU BEST NOT MISS,,1200,This Swiss legend put an arrow in the heart of a local bailiff after not putting one in his son's head,William Tell,NA
2014-05-19,DJ,"YOU LIKE KABUKI, NOH?",,1600,"At a climactic moment, a kabuki actor strikes a pose called a mie, usually characterized by this ocular action",crossing the eyes,NA
2014-05-19,DJ,DISNEY FILM VOICES,,1600,"Bandleader & longtime Jack Benny associate Phil Harris voiced this bear in 1967's ""The Jungle Book""",Baloo,NA
2014-05-19,DJ,"""ROUND"" 'EM UP",,1600,English pastime that was a forerunner of baseball,rounders,NA
2014-05-19,DJ,LITERARY CHARACTERS,,1600,"It's never clear why Joseph K. is arrested in this Kafka novel, but he's executed anyway",The Trial,NA
2014-05-19,DJ,COME AT THE KING,,NA,In 336 B.C. a young Macedonian noble named Pausanias killed this king but was killed on the spot himself,King Philip,NA
2014-05-19,DJ,YOU BEST NOT MISS,,1600,Lockheed-Martin says a satellite launching in 2014 as part of this system will be able to track objects within 3 feet,GPS,NA
2014-05-19,DJ,"YOU LIKE KABUKI, NOH?",,2000,"The only noh instrument that plays melodies is the no-kan, one of these made of bamboo",flute,NA
2014-05-19,DJ,DISNEY FILM VOICES,,2000,In a 1995 film Oscar winner Linda Hunt played this title heroine's grandmother willow,Pocahontas,NA
2014-05-19,DJ,"""ROUND"" 'EM UP",,2000,"2 crucial hills in the Battle of Gettysburg were ""Big"" & ""Little"" this",Round Top,NA
2014-05-19,DJ,LITERARY CHARACTERS,,2000,"The novel ""Trilby"" is mostly remembered for this character who hypnotizes & controls the title singer",Svengali,NA
2014-05-19,DJ,COME AT THE KING,,2000,"In 1485 he wasn't horsing around when his forces killed Richard III; for him, it was really good to be king",Henry VII,NA
2014-05-19,DJ,YOU BEST NOT MISS,,2000,"At 30 paces, she could split a playing card held edge on and hit dimestossed into the air",Annie Oakley,NA
2014-05-19,FJ,BOARD GAMES,,NA,"In the classic version of Monopoly, the only 2 improvable properties without Avenue or Place in their names",Boardwalk & Marvin Gardens,NA
