date,round,category,comment,value,clue,response,link
2014-07-03,J,BORN IN THE USA,,200,"Drawn up in Wisconsin in 1867, this architect was a real Prairie Style home companion",Frank Lloyd Wright,NA
2014-07-03,J,GLORY DAYS,,200,This religion's festival of colors is celebrated by throwing colored powder & water to honor the god Krishna,Hinduism,NA
2014-07-03,J,COVER ME,,200,"A bandage covering a wound, or a preparation covering a salad",dressing,NA
2014-07-03,J,THE GHOST OF TOM JOAD,,200,"...knows this state is in the first line of Steinbeck's ""The Grapes of Wrath""",Oklahoma,NA
2014-07-03,J,BRUCE SPRINGSTEEN,,200,"Despite 2 suicide mentions & ""we gotta get out while we're young"", this was proposed as N.J.'s state song in 1980","""Born To Run""",NA
2014-07-03,J,"THE ""E"" STREET BAND",,200,Don't take this word meaning infinite time to respond,eternity,NA
2014-07-03,J,BORN IN THE USA,,400,In 2012 this Ala.-born ex-Sec. of State was one of the first 2 female members of Augusta National Golf Club,Condoleezza Rice,NA
2014-07-03,J,GLORY DAYS,,400,"On New Year's Eve the Dutch hold bonfires of these, which were a centerpiece of the home just a week before",Christmas trees,NA
2014-07-03,J,COVER ME,,400,"Used to prevent soil erosion, rye & buckwheat are alliteratively planted as ""cover"" these",crops,NA
2014-07-03,J,THE GHOST OF TOM JOAD,,400,"...remembers that when we meet Tom, he's just finished 4 years here, & it ain't college",prison,NA
2014-07-03,J,BRUCE SPRINGSTEEN,,400,"""I didn't know my own face, oh brother are you gonna leave me wastin' away on the streets of"" this city",Philadelphia,NA
2014-07-03,J,"THE ""E"" STREET BAND",,400,Adjective meaning pertaining to horseback riding,equestrian,NA
2014-07-03,J,BORN IN THE USA,,600,"He turned on, tuned in & dropped out of college before becoming a Harvard lecturer in 1959",Timothy Leary,http://www.j-archive.com/media/2014-07-03_J_13a.jpg
2014-07-03,J,GLORY DAYS,,600,"The Texas Cavaliers River Parade is a centerpiece of this annual San Antonio event, ""party"" in Spanish",the fiesta,NA
2014-07-03,J,COVER ME,,600,"""Easy, breezy, beautiful..."" is a pitch of this makeup brand",Cover Girl,NA
2014-07-03,J,THE GHOST OF TOM JOAD,,600,"...thinks this actor did a fine job as Tom in the 1940 ""Grapes of Wrath"" movie",Henry Fonda,NA
2014-07-03,J,BRUCE SPRINGSTEEN,,600,"Bruce donned some old duds to sing ""Whip My Hair"" with ""Neil Young"" (actually this TV host, doing a great impression)",Jimmy Fallon,NA
2014-07-03,J,"THE ""E"" STREET BAND",,600,"An enterprising type of businessman who says, yes, start up with me",entrepreneur,NA
2014-07-03,J,BORN IN THE USA,,800,"A N.Y. congressman from 1903 to 1907, this newspaper magnate returned to California & got into castle building",(William Randolph) Hearst,NA
2014-07-03,J,GLORY DAYS,,NA,"April 9 is Bataan Day, aka Day of Valor, on the Bataan Peninsula & in the rest of this nation",the Philippines,NA
2014-07-03,J,COVER ME,,800,"An independent record label of yore, or a pupal covering for butterflies",a chrysalis,NA
2014-07-03,J,THE GHOST OF TOM JOAD,,800,"...recalls traveling with Jim Casy, who talks about the ""holy sperit"" & is called this, similar to a minister",preacher,NA
2014-07-03,J,BRUCE SPRINGSTEEN,,800,"Springsteen's 1973 debut, ""Greetings from"" this New Jersey resort city, initially sold only 25,000 copies",Asbury Park,NA
2014-07-03,J,"THE ""E"" STREET BAND",,800,To disembowel,eviscerate,NA
2014-07-03,J,BORN IN THE USA,,1000,This Chicago law man who enforced Prohibition ran for Cleveland mayorin 1947; here endeth the lesson,(Eliot) Ness,NA
2014-07-03,J,GLORY DAYS,,1000,"Jamhuri is Swahili for ""republic"", & this country's Jamhuri Day celebrates its independence from Great Britain",Kenya,NA
2014-07-03,J,COVER ME,,1000,"In military slang, your ""cover"" refers to this article of clothing",a helmet (or hat),NA
2014-07-03,J,THE GHOST OF TOM JOAD,,1000,"...was told, ""They's a grove of"" these--& ""a guy with a gun that got the right to kill you if you touch one""",oranges,NA
2014-07-03,J,BRUCE SPRINGSTEEN,,1000,"""Everybody's got"" this body part, a song Bruce first intended to give to The Ramones",a hungry heart,NA
2014-07-03,J,"THE ""E"" STREET BAND",,1000,An arm of the sea at the lower end of a river,estuary,NA
2014-07-03,DJ,MR. SECRETARY,,400,"In the 1980s, William Bennett monitored the halls of this Cabinet department as its secretary",Education,NA
2014-07-03,DJ,DOUBLE LETTERS,,400,"It's a disorderly crowd waiting for its ""rouser""",rabble,NA
2014-07-03,DJ,CLIFFS,,400,A cave at the bottom of the cliffs below Tintagel Castle in Cornwall is said to be the home of this Arthurian wizard,Merlin,NA
2014-07-03,DJ,COLLEGES & UNIVERSITIES,,400,In 1996 Michelle Obama became an associate dean at this school in her hometown,the University of Chicago,NA
2014-07-03,DJ,SCIENTIFIC NON-AMERICAN,,400,In 1714 this Dutch physicist made the first working mercury-in-glass thermometer,Fahrenheit,NA
2014-07-03,DJ,NAME THE NETWORK,,400,"""Ace of Cakes"",""Chopped"",""Everyday Italian""",Food Network,NA
2014-07-03,DJ,MR. SECRETARY,,800,(Vice President Biden reads the clue.)  The idea of a vice president was proposed at the Constitutional Convention by this first Secretary of the Treasury,Alexander Hamilton,http://www.j-archive.com/media/2014-07-03_DJ_13a.jpg
2014-07-03,DJ,DOUBLE LETTERS,,800,"Term for a young child; you're one letter off, Kermit",moppet,NA
2014-07-03,DJ,CLIFFS,,800,"The La Quebrada cliff divers at this Mexican resort city perform daily shows, diving from more than 100' into a shallow inlet",Acapulco,NA
2014-07-03,DJ,COLLEGES & UNIVERSITIES,,800,Elizabeth Dole received the distinguished alumni award from this North Carolina school,Duke,NA
2014-07-03,DJ,SCIENTIFIC NON-AMERICAN,,800,In a 1758 work this Swedish botanist applied his binomial system to animal classification,Linnaeus,NA
2014-07-03,DJ,NAME THE NETWORK,,800,"""Modern Family"",""Agents of S.H.I.E.L.D."",""Shark Tank""",ABC,NA
2014-07-03,DJ,MR. SECRETARY,,1200,This father of a recent presidential candidate was HUD secretary under Nixon,George Romney,NA
2014-07-03,DJ,DOUBLE LETTERS,,1200,"An importer of illegal goods, without payment of legal duty (of course)",smuggler,NA
2014-07-03,DJ,CLIFFS,,1200,"More than 700 years ago, Puebloan people lived in the caves of this state's Gila Cliff Dwellings National Monument",New Mexico,NA
2014-07-03,DJ,COLLEGES & UNIVERSITIES,,NA,"The campus of the University of this state is in Orono, named for a Penobscot chief",Maine,NA
2014-07-03,DJ,SCIENTIFIC NON-AMERICAN,,1200,Last name of the man who took the image seen here in the 1890s,Roentgen,http://www.j-archive.com/media/2014-07-03_DJ_18.jpg
2014-07-03,DJ,NAME THE NETWORK,,1200,"""Fashion Police"",""Rich Kids of Beverly Hills"",""Chelsea Lately""",the E! network,NA
2014-07-03,DJ,MR. SECRETARY,,1600,"On April 4, 1996 the NYSE closed for a minute in memory of Ron Brown, who was this Cabinet secretary",Secretary of Commerce,NA
2014-07-03,DJ,DOUBLE LETTERS,,1600,A prairie one was similar to but smaller than a Conestoga wagon,schooner,NA
2014-07-03,DJ,CLIFFS,,1600,"2,000-foot sea cliffs are on this island's Kalaupapa Peninsula near Father Damien's leper colony",Molokai,NA
2014-07-03,DJ,COLLEGES & UNIVERSITIES,,1600,"Minnesota's Northfield College got this name in 1871, honoring a benefactor",Carleton,NA
2014-07-03,DJ,SCIENTIFIC NON-AMERICAN,,NA,"This English astronomer died on Jan. 14, 1742 at age 85; that's 9 years longer than than we might have expected",(Edmond) Halley,NA
2014-07-03,DJ,NAME THE NETWORK,,1600,"""Newshour"",""Foyle's War"",""Great Performances""",PBS,NA
2014-07-03,DJ,MR. SECRETARY,,2000,"Serving until 1975, Rogers Morton of Maryland was the last secretary of this department to come from east of the Mississippi",Interior,NA
2014-07-03,DJ,DOUBLE LETTERS,,2000,"According to Vatican I of 1870, the pope has this quality when speaking ex cathedra",infallible,NA
2014-07-03,DJ,CLIFFS,,2000,This Venezuelan waterfall plunges uninterrupted for a half mile down a cliff,Angel Falls,NA
2014-07-03,DJ,COLLEGES & UNIVERSITIES,,2000,"A sportswriter used the term ""ivy colleges"" in 1933 to describe 9 schools--the 8 current Ivies & this school in New York State",the U.S. Military Academy at West Point,NA
2014-07-03,DJ,SCIENTIFIC NON-AMERICAN,,2000,"A continuous loop of material with a half-twist is the ""strip"" named for this 19th century German",(August) Möbius,NA
2014-07-03,DJ,NAME THE NETWORK,,2000,"""Bar Rescue"",""Ink Master"",lots of mixed martial arts",Spike,NA
2014-07-03,FJ,FAMOUS OBJECTS,,NA,In 1950 the England-Scotland border was closed for the first time in 400 years to try to recover this stolen item,the Stone of Scone,NA
