date,round,category,comment,value,clue,response,link
2001-02-01,J,THE HISTORY CHANNEL,,100,"The program on this country ""& Iraq"" includes the 1997 election of moderate Mohammed Khatami as president",Iran,NA
2001-02-01,J,DIANA ROSS,,100,"Diana played a fashion designer in this 1975 film & also sang its theme, ""Do You Know Where You're Going To""","""Mahogany""",NA
2001-02-01,J,THE COMPUTER AGE,,100,"According to Moore's Law, named for a founder of Intel, these double in power roughly every 18 months",computer chips,NA
2001-02-01,J,CONSTELLATIONS,,100,Dutch astronomer Petrus Plancius named Columba for the dove sent out by this Biblical character,Noah,NA
2001-02-01,J,EAT YOUR VEGGIES,,100,Paris Silverskins are the small ones of these used in Gibson cocktails,onions,NA
2001-02-01,J,"CROSSWORD CLUES ""K""",,100,Tissue trademark(7),Kleenex,NA
2001-02-01,J,THE HISTORY CHANNEL,,200,"From the ""Founding Fathers"" series, the following is a look at the composition of this document:""He's got a copy of the draft of the Virginia constitution and old writings for the Continental Congress and puts them together""",the Declaration of Independence,NA
2001-02-01,J,DIANA ROSS,,200,In March 2000 Diana inducted this lady who sang the blues into the Rock & Roll Hall of Fame,Billie Holiday,NA
2001-02-01,J,THE COMPUTER AGE,,200,"Dan Bricklin developed VISICALC, the first of these programs, similar to an accounting ledger",spreadsheet,NA
2001-02-01,J,CONSTELLATIONS,,200,"With this constellation winding around it, Ursa Minor must hope it isn't fire-breathing",Draco,NA
2001-02-01,J,EAT YOUR VEGGIES,,200,"Yes, they were named after the capital of Peru",lima beans,NA
2001-02-01,J,"CROSSWORD CLUES ""K""",,200,Kith's partner(3),Kin,NA
2001-02-01,J,THE HISTORY CHANNEL,,300,The channel's website tells us that this country's King Carlos was assassinated on Feb. 1 in 1908,Portugal,NA
2001-02-01,J,DIANA ROSS,,300,This No. 1 hit that Diana sang with the Supremes was later recorded by Phil Collins in a 1982 hit,"""You Can\'t Hurry Love""",NA
2001-02-01,J,THE COMPUTER AGE,,300,"Coherent & Xenix are 2 of these, part of the abbreviation in the better-known MS-DOS",operating systems,NA
2001-02-01,J,CONSTELLATIONS,,300,The brightest star in Bootes is this color giant & is 100 times more luminous than the sun,red,NA
2001-02-01,J,EAT YOUR VEGGIES,,300,"In Asian cuisine, sprouts are from beans & shoots are usually from this",bamboo,NA
2001-02-01,J,"CROSSWORD CLUES ""K""",,300,"Granny, or Gordian(4)",Knot,NA
2001-02-01,J,THE HISTORY CHANNEL,,400,"The show on the transatlantic cable was subtitled ""2500 Miles of"" this elemental metal",Copper,NA
2001-02-01,J,DIANA ROSS,,400,The most successful duet of the '80s was this ballad that Diana recorded with Lionel Richie,"""Endless Love""",NA
2001-02-01,J,THE COMPUTER AGE,,400,This programming language was named for calculating-machine inventor Blaise,PASCAL,NA
2001-02-01,J,CONSTELLATIONS,,NA,The Pup is the companion to this star in Canis Major,Sirius (the Dog Star),NA
2001-02-01,J,EAT YOUR VEGGIES,,400,"The Dutch type of this is white, as it's grown underground; the American is green, as the spears are grown above",asparagus,NA
2001-02-01,J,"CROSSWORD CLUES ""K""",,400,"A medieval foot soldier, or composer Jerome(4)",Kern,NA
2001-02-01,J,THE HISTORY CHANNEL,,500,"One show covered this Vietnam battle where Springsteen ""had a brother"" in ""Born In The U.S.A.""",Khe Sanh,NA
2001-02-01,J,DIANA ROSS,,500,"The 1985 hit heard here was a tribute to this singer:""Oooh, ooh, I'm missing you /Tell me where the road turns...""",Marvin Gaye,NA
2001-02-01,J,THE COMPUTER AGE,,500,"Among Internet users, the World Wide Web has surpassed the system named for this burrowing rodent",gopher,NA
2001-02-01,NA,NA,NA,NA,NA,NA,NA
2001-02-01,J,EAT YOUR VEGGIES,,500,"Antoine-Auguste Parmentier pushed this tuber on Louis XVI; now Parmentier in a recipe means ""with"" it",potato,NA
2001-02-01,J,"CROSSWORD CLUES ""K""",,500,Pakistan's principal port(7),Karachi,NA
2001-02-01,DJ,THE CHANNEL HISTORY,(Alex: Not THE HISTORY CHANNEL.),200,"4 English Channel lighthouses have been built on the Eddystone Rocks, famed cause of these disasters",shipwrecks,NA
2001-02-01,DJ,ART MUSEUMS,,200,2 old palaces in Barcelona house a museum of this cubist's works,Pablo Picasso,NA
2001-02-01,DJ,POETS WHO RHYME,(Alex: Example: Canterbury Tales author who rhymes with a dish: Chaucer (Saucer).),200,19th century lord whose last name rhymes with deer meat,Tennyson (Venison),NA
2001-02-01,DJ,DISNEY FILM VOICES,,200,Buddy Hackett played Scuttle the Seagull in this seagoing fairy tale in 1989,The Little Mermaid,NA
2001-02-01,DJ,QUOTATIONS,,200,"At the 1988 Democratic Convention he said, ""We are all precious in God's sight--the real Rainbow Coalition""",Jesse Jackson,NA
2001-02-01,DJ,"""CAN"" IT!",,200,In 1973 Cape Kennedy's name reverted to this,Cape Canaveral,NA
2001-02-01,DJ,THE CHANNEL HISTORY,(Alex: Not THE HISTORY CHANNEL.),400,"The Cinque Ports, an 11th century confederation, were Sandwich, Dover, Hythe, Romney & this 1066 battle site",Hastings,NA
2001-02-01,DJ,ART MUSEUMS,,400,This prestigious art museum in London recently opened a new & separate gallery of modern art,Tate Gallery,NA
2001-02-01,DJ,POETS WHO RHYME,(Alex: Example: Canterbury Tales author who rhymes with a dish: Chaucer (Saucer).),400,Irish poet who rhymes with wooden boxes for packing,Yeats (Crates),NA
2001-02-01,DJ,DISNEY FILM VOICES,,400,"Rosie O'Donnell went ""ape"" as the voice of Terk in this 1999 adventure",Tarzan,NA
2001-02-01,DJ,QUOTATIONS,,400,"Advice from this American author:  ""When angry, count four; when very angry, swear""",Mark Twain,NA
2001-02-01,DJ,"""CAN"" IT!",,400,"Served as an appetizer, they're crackers or pieces of bread garnished with tasty toppings",canapes,NA
2001-02-01,DJ,THE CHANNEL HISTORY,(Alex: Not THE HISTORY CHANNEL.),600,"These air-cushion vehicles that were ""full of eels"" in a Monty Python sketch first crossed the Channel in 1959",hovercraft,NA
2001-02-01,DJ,ART MUSEUMS,,600,It houses the largest collection of art in the Netherlands,The Rijksmuseum,NA
2001-02-01,DJ,POETS WHO RHYME,(Alex: Example: Canterbury Tales author who rhymes with a dish: Chaucer (Saucer).),600,Ode-acious poet who rhymes with red root vegetables,Keats (Beets),NA
2001-02-01,DJ,DISNEY FILM VOICES,,600,"Seen here, Charles Kimbrough was Jim Dial on ""Murphy Brown"" when he won the role of a gargoyle in this film",The Hunchback of Notre Dame,http://www.j-archive.com/media/2001-02-01_DJ_07.jpg
2001-02-01,DJ,QUOTATIONS,,600,"In 1939 Churchill said the action of Russia ""is a riddle wrapped in a mystery inside"" this",an enigma,NA
2001-02-01,DJ,"""CAN"" IT!",,600,"""Sweet"" term for a teen girl who does volunteer work at a hospital",candy-striper,NA
2001-02-01,DJ,THE CHANNEL HISTORY,(Alex: Not THE HISTORY CHANNEL.),800,"Victor Hugo lived for 15 years on this Channel Island, the largest after Jersey",Guernsey,NA
2001-02-01,DJ,ART MUSEUMS,,NA,"If you get a chance, visit the Munch Museum in this world capital; it's a real scream!","Oslo, Norway",NA
2001-02-01,DJ,POETS WHO RHYME,(Alex: Example: Canterbury Tales author who rhymes with a dish: Chaucer (Saucer).),800,"""Gunga Din"" author who rhymes with habitual drinking",Kipling (Tippling),NA
2001-02-01,DJ,DISNEY FILM VOICES,,800,"(Hi, I'm Donny Osmond.)  I provided the singing voice of Captain Shang for this 1998 animated Disney film",Mulan,http://www.j-archive.com/media/2001-02-01_DJ_08.jpg
2001-02-01,DJ,QUOTATIONS,,NA,"This innovative American director said, ""Everybody denies I am a genius--but nobody ever called me one!""",Orson Welles,NA
2001-02-01,DJ,"""CAN"" IT!",,800,"""Sweet Thursday"" is John Steinbeck's sequel to this novel",Cannery Row,NA
2001-02-01,DJ,THE CHANNEL HISTORY,(Alex: Not THE HISTORY CHANNEL.),1000,"On Aug. 19, 1942 an Allied force took heavy casualties in an attack on this fort fortified by Germans",Dieppe,NA
2001-02-01,NA,NA,NA,NA,NA,NA,NA
2001-02-01,DJ,POETS WHO RHYME,(Alex: Example: Canterbury Tales author who rhymes with a dish: Chaucer (Saucer).),1000,New Englander who rhymes with a price or sacrifice,Frost (Cost),NA
2001-02-01,DJ,DISNEY FILM VOICES,,1000,"Young Kathryn Beaumont was so good as the voice of this title girl in 1951 that she got to play Wendy in ""Peter Pan"", too",Alice in Wonderland,NA
2001-02-01,DJ,QUOTATIONS,,1000,"In ""The Power of Myth"" he says, ""Follow your bliss""",Joseph Campbell,NA
2001-02-01,DJ,"""CAN"" IT!",,1000,He painted the view of Venice seen here:,Canaletto (The Grand Canal),http://www.j-archive.com/media/2001-02-01_DJ_10.jpg
2001-02-01,FJ,WORLD GEOGRAPHY,,NA,"The promotional slogan of this territory is ""Where America's Day Begins""",Guam,NA
