date,round,category,comment,value,clue,response,link
2003-11-24,J,OGDEN NASH,,200,"""Candy is dandy but"" this ""is quicker""",liquor,NA
2003-11-24,J,ALBUMS,,200,"Michael Jackson followed ""Thriller"" with this LP that produced 5 No. 1 hits; ""Thriller"" couldn't ""Beat It""",Bad,NA
2003-11-24,J,VARIETY PACK,,200,In 1956 this Brynner played King Mongkut on screen,Yul Brynner,NA
2003-11-24,J,CATCHPHRASES,,200,"Referring to the action of an ungrateful pet, it means to act with hostility to a benefactor",to bite the hand that feeds you,NA
2003-11-24,J,"TURN AROUND, I'M DRESSING",,200,Orange-ya glad they didn't rename it freedom dressing during the last war with Iraq,French dressing,NA
2003-11-24,J,YOU'RE A BEAST!,,200,The fisher is one of the few predators that will kill & eat these quilled mammals,porcupines,NA
2003-11-24,J,OGDEN NASH,,400,"This bird ""has such long and lofty legs, I'm glad it sits to lay its eggs""",ostrich,NA
2003-11-24,J,ALBUMS,,400,"Billboard reports in 1963 this trio's ""In the Wind"" album blew to No. 1, bumping its own debut album from the top spot","Peter, Paul and Mary",NA
2003-11-24,J,VARIETY PACK,,400,This log traditionally goes into the fireplace at Christmas,yule log,NA
2003-11-24,J,CATCHPHRASES,,400,"A slogan for women's political representation goes, ""A woman's place is in the house... and"" here",in the Senate,NA
2003-11-24,J,"TURN AROUND, I'M DRESSING",,400,"It must have been a favorite in silent westerns; there was that ""Meanwhile, back at"" this dressing title card",the ranch,NA
2003-11-24,J,YOU'RE A BEAST!,,NA,Nebraska's dominant terrestrial predator is this canine,coyote,NA
2003-11-24,J,OGDEN NASH,,600,"""The cow is of the bovine ilk; one end is moo, the other"" this",milk,NA
2003-11-24,J,ALBUMS,,600,"(Hey, this is Brad Paisley.)  The title of my ""Part II"" CD was inspired by this movie Part II starring Steve Martin & my wife Kimberly Williams as his daughter",Father of the Bride,http://www.j-archive.com/media/2003-11-24_J_09.jpg
2003-11-24,J,VARIETY PACK,,600,In the '70s this Gibbons became the spokesman for the health benefits of Grape-Nuts cereals,Euell Gibbons,NA
2003-11-24,J,CATCHPHRASES,,600,"In ""42nd Street"", Warner Baxter tells Ruby Keeler, ""You're going out a youngster, but you've got to"" do this",come back a star,NA
2003-11-24,J,"TURN AROUND, I'M DRESSING",,600,Vladimir Putin's wife sees it every morning right after her husband gets up,Russian dressing,NA
2003-11-24,J,YOU'RE A BEAST!,,600,An old wives' tale about these bugs crawling into your head gave them this name,earwig,NA
2003-11-24,J,OGDEN NASH,,800,"Nash wrote that this garnish ""Is gharsely""",parsley,NA
2003-11-24,J,ALBUMS,,800,"This ""electrical"" group's ""Back in Black"" album has sold over 19 million copies",AC/DC,NA
2003-11-24,J,VARIETY PACK,,800,It's the first word in the title of the original name of the show on which Phil Silvers played Sgt. Bilko,You\'ll (Never Get Rich),NA
2003-11-24,J,CATCHPHRASES,,800,Rhyming phrase that means a nap can lead to a missed opportunity,"if you snooze, you lose",NA
2003-11-24,J,"TURN AROUND, I'M DRESSING",,800,Fermat's last theorem was on a simple dressing of oil & this,vinegar,NA
2003-11-24,NA,NA,NA,NA,NA,NA,NA
2003-11-24,J,OGDEN NASH,,1000,"This veggie, ""raw, develops the jaw""",celery,NA
2003-11-24,J,ALBUMS,,1000,"His second album contained 3 ""cruel"" songs: ""Cruel Prelude"", ""Don't Be Cruel"" & ""Cruel Reprise""",Bobby Brown,NA
2003-11-24,J,VARIETY PACK,,1000,"Off Detroit, you'll find Belle this",Isle,NA
2003-11-24,J,CATCHPHRASES,,1000,"The ""hole"" in this phrase meaning an explosive device is about to go off may have originally been a mine",fire in the hole,NA
2003-11-24,J,"TURN AROUND, I'M DRESSING",,1000,"This ""colorful"" play by William Archer has taken on mythic proportions & salad portions",Green Goddess,NA
2003-11-24,J,YOU'RE A BEAST!,,1000,The hairy-nosed variety of this burrowing marsupial of south Australia can reach 4 feet in length,wombat,NA
2003-11-24,NA,NA,NA,NA,NA,NA,NA
2003-11-24,DJ,MOVIE GROUPS,,400,Title group formed by Frank Sinatra's character in 1960 & George Clooney's in 2001,Ocean\'s 11/Eleven,NA
2003-11-24,DJ,"THE SEVEN ""C""s",,400,The oceanic type of this layer of the Earth is thinner & younger than the continental type,crust,NA
2003-11-24,DJ,NAME THAT CENTURY,,400,The first ship passes through the Panama Canal,20th century,NA
2003-11-24,DJ,BELOVED BELARUS,,400,In 1922 Belarus was one of the 4 founding republics of this political union,the Soviet Union,NA
2003-11-24,DJ,NEW IN BARTLETT'S,"(Alex: We're dealing with quotations from their 17th edition, which was published in 2002.)",400,"In 1995 she told the BBC, ""There were three of us in the marriage, so it was a bit crowded""",Princess Diana,NA
2003-11-24,DJ,ART EXHIBITS,,800,In 2003 the Getty brightened the L.A. scene with an exhibit on these decorated manuscripts,illuminated manuscripts,NA
2003-11-24,DJ,MOVIE GROUPS,,800,"This star of ""Air Force One"" was part of the group in ""Force 10 from Navarone""",(Harrison) Ford,NA
2003-11-24,DJ,"THE SEVEN ""C""s",,800,"One of these, known as the West Wind Drift, moves around Antarctica",current,NA
2003-11-24,DJ,NAME THAT CENTURY,,800,Ben Franklin dies,18th century (1790),NA
2003-11-24,DJ,BELOVED BELARUS,,800,"The present borders of Belarus date from 1939, when this Russian leader annexed eastern Poland",(Joseph) Stalin,NA
2003-11-24,DJ,NEW IN BARTLETT'S,"(Alex: We're dealing with quotations from their 17th edition, which was published in 2002.)",800,"This 4-word phrase written by Cameron Crowe was spoken by Cuba Gooding, Jr. on film","""Show Me the Money!""",NA
2003-11-24,DJ,ART EXHIBITS,,NA,In 1999 this U.S. city's Museum of Art mounted a show of the work Edgar Degas did when he visited relatives there,"New Orleans, Louisiana",NA
2003-11-24,DJ,MOVIE GROUPS,,1200,Jack Klugman & Jack Warden were Jurors 5 & 7 in this '57 classic,12 Angry Men,NA
2003-11-24,DJ,"THE SEVEN ""C""s",,1200,These marine snails with whorled shells include the largest living snail,conchs,NA
2003-11-24,DJ,NAME THAT CENTURY,,1200,The Irish Potato Famine takes its deadly toll,19th century,NA
2003-11-24,DJ,BELOVED BELARUS,,1200,"With a population of about 1.7 million, it's the capital",Minsk,NA
2003-11-24,DJ,NEW IN BARTLETT'S,"(Alex: We're dealing with quotations from their 17th edition, which was published in 2002.)",NA,"According to John Guare, ""Everybody on this planet is separated by only"" this many ""other people""",6,NA
2003-11-24,DJ,ART EXHIBITS,,1600,A recent blockbuster show paired Picasso with this French master who died in 1954,Henri Matisse,NA
2003-11-24,DJ,MOVIE GROUPS,,1600,This title group was led by William Holden as Pike Bishop,The Wild Bunch,NA
2003-11-24,DJ,"THE SEVEN ""C""s",,1600,Fish-loving sea birds seen here:,cormorants,NA
2003-11-24,DJ,NAME THAT CENTURY,,1600,The English Civil War is waged,17th century,NA
2003-11-24,DJ,BELOVED BELARUS,,1600,"Ending a long history of domination by foreign occupiers, Belarus declared its independence in this year",1991,NA
2003-11-24,DJ,NEW IN BARTLETT'S,"(Alex: We're dealing with quotations from their 17th edition, which was published in 2002.)",1600,"""Big sisters are the crabgrass in the lawn of life"" was added to this late cartoonist's entry",Charles Schulz,NA
2003-11-24,DJ,ART EXHIBITS,,2000,The Impressionists held their own show after trying to crack this official French exhibit dating from 1667,the Salon,NA
2003-11-24,DJ,MOVIE GROUPS,,2000,"He's the only actor to be included in both ""The Magnificent Seven"" & ""The Dirty Dozen""",Charles Bronson,NA
2003-11-24,DJ,"THE SEVEN ""C""s",,2000,"36,198' down in the Marianas Trench, the deepest point on Earth is named this ""Deep"" after the ship that located it",Challenger Deep,NA
2003-11-24,DJ,NAME THAT CENTURY,,2000,The Koran is written,7th century,NA
2003-11-24,DJ,BELOVED BELARUS,,2000,The work of this Belarus-born artist is seen here:,Marc Chagall,NA
2003-11-24,DJ,NEW IN BARTLETT'S,"(Alex: We're dealing with quotations from their 17th edition, which was published in 2002.)",2000,"Her number of entries doubled from the 16th edition to the 17th with 2 quotations from her ""Song of Solomon""",Toni Morrison,NA
2003-11-24,FJ,WOMEN IN BUSINESS,,NA,"In 1963 she founded her company with a sales force of 9; today that number is over 950,000",Mary Kay,NA
