date,round,category,comment,value,clue,response,link
2003-12-12,J,AMERICAN WOMAN,,200,Her maiden name was Fitzgerald when she married into the fabled Kennedy family in 1914,Rose Kennedy,NA
2003-12-12,J,"MOVIE CROSSWORD CLUES ""G""",,200,Dolls' title partners (4),guys,NA
2003-12-12,J,PHOBIAS,,200,"Bad dreams at night can lead to hypnophobia, the fear of doing this",falling asleep,NA
2003-12-12,J,GEORGIA ON MY MIND,,200,"Oglethorpe is the seat of this county whose ""line"" was featured in a 1974 film",Macon,NA
2003-12-12,J,CEREMONIES,,200,Every U. of British Columbia graduating class ceremonially does this; you can still see 1949's dogwood,plants a tree,NA
2003-12-12,J,A LITTLE LATIN,,200,"Rene Descartes made famous the phrase ""Cogito ergo sum"", which means this",I think therefore I am,NA
2003-12-12,J,AMERICAN WOMAN,,400,"U.S. Ambassador to Ghana from 1974 to 1976, she was once Hollywood's biggest star",Shirley Temple Black,NA
2003-12-12,J,"MOVIE CROSSWORD CLUES ""G""",,400,"Ms. Close, to you (5)",Glenn,NA
2003-12-12,J,PHOBIAS,,400,"One of the most common of all, glossophobia is the fear of doing this in public",speaking,NA
2003-12-12,J,GEORGIA ON MY MIND,,400,"Visiting the Callaway Plantation in Washington, Georgia you can ""jump down, turn around"" & do this","""pick a bale of cotton""",NA
2003-12-12,J,CEREMONIES,,400,"In 2001, at Ellis Island, the President led the Pledge of Allegiance at this type of ceremony",a citizenship ceremony,NA
2003-12-12,J,A LITTLE LATIN,,400,"Meaning ""always faithful"", it's the motto of the Marine Corps",semper fidelis,NA
2003-12-12,J,AMERICAN WOMAN,,600,"(Sofia of the Clue Crew presents from the  U.S.S. Missouri in Pearl Harbor, HI)On January 29, 1944, this 19-year-old daughter of Harry Truman christened the U.S.S. Missouri at the ship's launching in New York City",Margaret Truman,NA
2003-12-12,J,"MOVIE CROSSWORD CLUES ""G""",,600,"Disney dwarf, or ""Old Men"" adjective (6)",Grumpy,NA
2003-12-12,J,PHOBIAS,,600,"If you've got amathophobia, a fear of this, you might also fear Genesis 3:19, which tells us we'll all return to it",dust,NA
2003-12-12,J,GEORGIA ON MY MIND,,600,"Cleveland, Georgia is home to these dolls, adopted out of its ""Babyland General Hospital""",Cabbatch Patch Kids,NA
2003-12-12,J,CEREMONIES,,600,"If a priest comes to your hospital room to perform the Anointing of the Sick, you may want to know it's also called this",last rites,NA
2003-12-12,J,A LITTLE LATIN,,600,"If you're not of sound mind, you're this 3-word phrase, literally",non compos mentis,NA
2003-12-12,J,AMERICAN WOMAN,,800,"Clotilde Bowen was the first black woman to receive her ""eagles"" by promotion to this U.S. Army rank",colonel,NA
2003-12-12,J,"MOVIE CROSSWORD CLUES ""G""",,800,"""Spirited"" Swayze saga (5)",Ghost,NA
2003-12-12,J,PHOBIAS,,800,"A nebulaphobe is frightened of this, even when it ""comes on little cat feet""",fog,NA
2003-12-12,J,GEORGIA ON MY MIND,,800,The first steamship to sail across the Atlantic sailed from Georgia & was named for this city,Savannah,NA
2003-12-12,J,CEREMONIES,,800,"In Branson, Missouri, the nation's largest celebration of this day includes a parade at 11:00 on 11/11",Veterans Day,NA
2003-12-12,J,A LITTLE LATIN,,800,"""In wine there is truth"" or so says this phrase",in vino veritas,NA
2003-12-12,J,AMERICAN WOMAN,,1000,In 1990 Joan Finney became the first Kansas woman elected to this post,governor,NA
2003-12-12,J,"MOVIE CROSSWORD CLUES ""G""",,1000,Oddjob's master (10),Goldfinger,NA
2003-12-12,J,PHOBIAS,,NA,Hippophobia isn't the fear of hippopotami but of these,horses,NA
2003-12-12,J,GEORGIA ON MY MIND,,1000,"Georgia's state motto is ""Wisdom, justice and"" this, something you should have ""in all things""",moderation,NA
2003-12-12,J,CEREMONIES,,1000,The ritual smoke seen here indicates a new one of these,a Pope,http://www.j-archive.com/media/2003-12-12_J_09.jpg
2003-12-12,J,A LITTLE LATIN,,1000,"When he crossed the Rubicon, Julius Caesar supposedly said, ""Iacta alea est"", which translates to this",the die is cast,NA
2003-12-12,DJ,EXPLORERS,,400,"In 1811 Thomas Manning, disguised in Chinese garb, became the first Englishman to enter this Tibetan capital",Lhasa,NA
2003-12-12,DJ,BEATLES REMAKES,,400,"With over 2,500 versions, it's been listed in Guinness as the most recorded song in history","""Yesterday""",NA
2003-12-12,DJ,QUOTATIONS,,400,"For radio's ""Family Theater"", Al Scalpone wrote, ""The family that prays together"" does this",stays together,NA
2003-12-12,DJ,FISH,,400,"Let's see, there's one fish, not two fish, and it's not a red fish, it's this",a bluefish,http://www.j-archive.com/media/2003-12-12_DJ_26.jpg
2003-12-12,DJ,RHYME,,400,It's when a spacecraft passes a planet to observe it,a flyby,NA
2003-12-12,DJ,REASON,,400,This event happens because of the pressure on gas-filled magma from the solid rock around it,a volcanic eruption,NA
2003-12-12,DJ,EXPLORERS,,800,This Venetian's accounts of the Roc of Arabian myth may have been based on the Elephant Bird of Madagascar,Marco Polo,NA
2003-12-12,DJ,BEATLES REMAKES,,800,They're the trio heard here in a rather animated remake of a Beatles hit,Alvin and the Chipmunks,http://www.j-archive.com/media/2003-12-12_DJ_02.jpg
2003-12-12,DJ,QUOTATIONS,,800,"His first inaugural address gave us the phrase ""the better angels of our nature""",Abrahama Lincoln,NA
2003-12-12,DJ,FISH,,800,It's also the name of a wholesome snack that smiles back until you bite their heads off,a goldfish,http://www.j-archive.com/media/2003-12-12_DJ_27.jpg
2003-12-12,DJ,RHYME,,800,It's when unionized police officers call in sick en masse,the blue flu,NA
2003-12-12,DJ,REASON,,800,It's why Sampson's Pearly Mussel & the Santa Barbara Song Sparrow were taken off the endangered species list,they became extinct,NA
2003-12-12,DJ,EXPLORERS,,1200,In April 1874 this Scottish missionary & African explorer was buried at a state funeral at Westminster Abbey,Dr. Livingstone,NA
2003-12-12,DJ,BEATLES REMAKES,,1200,"In George Martin's farewell album ""In My Life"", Jim Carrey does this song (Goo goo goo joob)","""I Am the Walrus""",NA
2003-12-12,DJ,QUOTATIONS,,1200,"Paul Erdos was famous as one of these, which he defined as a machine ""for turning coffee into theorems""",a mathematician,NA
2003-12-12,DJ,FISH,,1200,"Complain, complain, complain, that's all it does is complain",a carp,NA
2003-12-12,DJ,RHYME,,1200,It's the lottery option that lets the computer randomly select some numbers,a quick pick,NA
2003-12-12,DJ,REASON,,1200,In 1654 Queen Christina of Sweden abdicated because she wanted to practice this religion,Catholicism,NA
2003-12-12,DJ,EXPLORERS,,NA,"On Sept. 12, 1609 he sailed into New York harbor & then proceeded north to the site of present-day Albany",Henry Hudson,NA
2003-12-12,DJ,BEATLES REMAKES,,NA,"Under the name Dr. Winston O'Boogie, John Lennon played guitar on Elton John's 1974 remake of this gem","""Lucy in the Sky with Diamonds""",NA
2003-12-12,DJ,QUOTATIONS,,1600,"Samuel Johnson rhymed, ""Let observation with extensive view / Survey mankind from China to"" this country",Peru,NA
2003-12-12,DJ,FISH,,1600,"It's named for the insects that spread malaria, because it eats the insects",a mosquito fish,http://www.j-archive.com/media/2003-12-12_DJ_29.jpg
2003-12-12,DJ,RHYME,,1600,"In nuclear imaging, it's an area with an accumulation of radioactivity",a hot spot,NA
2003-12-12,DJ,REASON,,1600,"Washington attacked at this N.J. city Dec. 26, 1776 because many of his soldiers' enlistments ended Dec. 31",Trenton,NA
2003-12-12,DJ,EXPLORERS,,2000,"This Grand Canyon explorer wrote ""Explorations of the Colorado River of the West and its Tributaries"" in 1875",John Wesley Powell,NA
2003-12-12,DJ,BEATLES REMAKES,,2000,"It's the song covered here by Earth, Wind & Fire","""Got to Get You Into My Life""",http://www.j-archive.com/media/2003-12-12_DJ_10.jpg
2003-12-12,DJ,QUOTATIONS,,2000,"These ""Prairie Home Companion"" biscuits give ""shy persons the strength to get up and do what needs to be done""",powdermilk biscuits,NA
2003-12-12,DJ,FISH,,2000,"It's named for the decorative pattern on its skin. As you can see, it's not slimming",a striped bass,http://www.j-archive.com/media/2003-12-12_DJ_30.jpg
2003-12-12,DJ,RHYME,,2000,3-word proverb meaning that the strong create their own rules,might makes right,NA
2003-12-12,DJ,REASON,,2000,"This double-reed instrument's pitch rarely changes, so the rest of the orchestra tunes to it",the oboe,NA
2003-12-12,FJ,19th CENTURY BUSINESS,,NA,"Frederic Tudor became wealthy marketing this, which he took from a pond called Fresh Pond in Massachusetts",ice,NA
