date,round,category,comment,value,clue,response,link
2003-12-26,J,ENGINEERING,,200,The Old London Bridge was first built in the 13th century over this river,the Thames,NA
2003-12-26,J,WHICH TV SHOW CAME FIRST?,,200,"""Here's Lucy"",""The Lucy Show"",""I Love Lucy""",I Love Lucy,NA
2003-12-26,J,COLLEGES & UNIVERSITIES,,200,"As the top-ranked university for 2003 by U.S. News & World Report, this New Jersey school rules",Princeton,NA
2003-12-26,J,PATRON SAINTS,,200,"Julian the hospitaller is the patron saint of these musicians, a favorite of Old King Cole",fiddlers,NA
2003-12-26,J,TOPLESS JEOPARDY!,,200,It's no stretch of the imagination for you to tell us the name of this animal,a giraffe,http://www.j-archive.com/media/2003-12-26_J_08.jpg
2003-12-26,J,"""O"" MY!",,200,"The only person to play for both the NL's Dodgers & the NHL's Rangers, Gladys Gooding played this instrument",the organ,NA
2003-12-26,J,ENGINEERING,,400,This man's World Tower in New York was once the world's tallest residential development,Donald Trump,NA
2003-12-26,J,WHICH TV SHOW CAME FIRST?,,400,"""How the West Was Won"",""How to Marry a Millionaire"",""Howdy Doody""",Howdy Doody,NA
2003-12-26,J,COLLEGES & UNIVERSITIES,,400,Universities in Columbia & in Los Angeles share this 3-letter abbreviation,USC,NA
2003-12-26,J,PATRON SAINTS,,400,"As patron saint of Quebec & for makers of these, Anne should help the Expos to a clean sweep of any series",brooms,NA
2003-12-26,J,TOPLESS JEOPARDY!,,400,Important adviser to President Bush seen here,Condoleezza Rice,http://www.j-archive.com/media/2003-12-26_J_09.jpg
2003-12-26,J,"""O"" MY!",,400,"(Hey, this is Wayne Brady and this is your clue.)  This city, my hometown, is home to Sea World of Florida & college football's annual Citrus Bowl",Orlando,http://www.j-archive.com/media/2003-12-26_J_19.jpg
2003-12-26,J,ENGINEERING,,600,The widest cable-stayed bridge is the Leonard P. Zakim Bunker Hill Bridge in this city,Boston,NA
2003-12-26,J,WHICH TV SHOW CAME FIRST?,,600,"""The Today Show"",""The Tonight Show"",""The Tomorrow Show""",The Today Show,NA
2003-12-26,J,COLLEGES & UNIVERSITIES,,600,Emily Dickinson's grandfather was one of the founders of this Massachusetts college,Amherst,NA
2003-12-26,J,PATRON SAINTS,,600,"For protection against these, call on Gertrude of Nivelles, or call a pied piper",rats,NA
2003-12-26,J,TOPLESS JEOPARDY!,,600,Asian poet & dictator seen here,Mao Tse Tung,http://www.j-archive.com/media/2003-12-26_J_10.jpg
2003-12-26,J,"""O"" MY!",,600,"In WWII, the U.S. estimated the number of enemy soldiers on Pacific islands by counting these from the air",outhouses,NA
2003-12-26,J,ENGINEERING,,800,In 2002 the first line in this country's Oporto Light Rail System opened,Portugal,NA
2003-12-26,J,WHICH TV SHOW CAME FIRST?,,800,"""Gilligan's Island"",""Hogan's Heroes"",""Charlie's Angels""",Gilligan\'s Island,NA
2003-12-26,J,COLLEGES & UNIVERSITIES,,NA,The Grotto of Our Lady of Lourdes is a well-known landmark at this midwestern school,Notre Dame,NA
2003-12-26,J,PATRON SAINTS,,800,"Zita is the patron saint you invoke in the search for these items, also a symbol of St. Peter's power",keys,NA
2003-12-26,J,TOPLESS JEOPARDY!,,800,He's the multi-marrying man seen here,Henry VIII,http://www.j-archive.com/media/2003-12-26_J_11.jpg
2003-12-26,J,"""O"" MY!",,800,"Lewis Grizzard mused on marriage in ""If Love Were"" this ""I'd Be About a Quart Low""",oil,NA
2003-12-26,J,ENGINEERING,,1000,The only contemporaneous man-made objects taller than the Pharos of Alexandria Lighthouse,the Pyramids,NA
2003-12-26,J,WHICH TV SHOW CAME FIRST?,,1000,"""Phyllis"",""Rhoda"",""Lou Grant""",Rhoda,NA
2003-12-26,J,COLLEGES & UNIVERSITIES,,1000,"Founded in 1842, Willamete University in this state is the oldest university west of the Rockies",Oregon,NA
2003-12-26,J,PATRON SAINTS,,1000,Being shot with dozens of these helped make Sebastian a patron of fletchers,arrows,NA
2003-12-26,J,TOPLESS JEOPARDY!,,1000,He's the great world leader seen here in his usual simple garb,Mahatma Gandhi,http://www.j-archive.com/media/2003-12-26_J_12.jpg
2003-12-26,J,"""O"" MY!",,1000,"Elected to the Hall of Fame in 1951, this N.Y. Giant hit a career 511 home runs",Mel Ott,NA
2003-12-26,DJ,SHAKESPEAREANA,,400,Oscar Wilde asked whether the critics who'd written on this play were mad or only pretending to be,Hamlet,NA
2003-12-26,DJ,POTENTATES,,400,"Thutmose III, who lived in the 1400s B.C., is called the Napoleon of this ancient country",Egypt,NA
2003-12-26,DJ,THE EMPIRE STATE BUILDING,,400,The mast on top of the Empire State Building was originally designed as a mooring for these rigid airships,zeppelins,NA
2003-12-26,DJ,ROCK & ROLL BOOKSTORE,,400,"""Nowhere Man"" is Robert Rosen's take on ""The Final Days of"" this Beatle",John Lennon,NA
2003-12-26,DJ,PEAKING AT NAMES,,400,"The Surveyor General of India from 1830, he lent his name to Nepal's highest peak",Everest,NA
2003-12-26,DJ,5-LETTER WORDS,,400,It's to brush your fingers on the strings of a guitar,strum,NA
2003-12-26,DJ,SHAKESPEAREANA,,800,"Will's shortest play, its title has become an expression meaning a ridiculous series of events",The Comedy of Errors,NA
2003-12-26,DJ,POTENTATES,,800,"When the Central African Republic's Pres. Bokassa declared himself Emperor, he renamed the country this",Central African Empire,NA
2003-12-26,DJ,THE EMPIRE STATE BUILDING,,800,"The building was bathed with blue lights on Dec. 12, 1995 to match this man's eyes on his 80th birthday",Frank Sinatra,NA
2003-12-26,DJ,ROCK & ROLL BOOKSTORE,,800,"""Last Train to Memphis"" tells of the first part of this man's life up to the death of his mother",Elvis Presley,NA
2003-12-26,DJ,PEAKING AT NAMES,,800,The highest peak in this island nation bears the name of Captain James Cook,New Zealand,NA
2003-12-26,DJ,5-LETTER WORDS,,800,Your carpal tunnel passes through this joint,the wrist,NA
2003-12-26,DJ,SHAKESPEAREANA,,1200,"Shakespeare's mother Mary shares her maiden name with this idyllic forest in ""As You Like It""",Arden,NA
2003-12-26,DJ,POTENTATES,,1200,"In November 1918 the New York Times headlined, This ruler ""and Crown Prince abdicate""",Kaiser Wilhelm II,NA
2003-12-26,DJ,THE EMPIRE STATE BUILDING,,NA,"At the Empire State Building's 60th anniversary celebration in 1991, this 83-year-old actress was guest of honor",Fay Wray,NA
2003-12-26,DJ,ROCK & ROLL BOOKSTORE,,1200,"The title of Robert Shelton's bio ""No Direction Home"" about this performer comes from a line in one of his hits",Bob Dylan,NA
2003-12-26,DJ,PEAKING AT NAMES,,1200,"The director of Canada's geological survey from 1842 to 1869, he lent his name to the 2nd-highest peak in N. America",Logan,NA
2003-12-26,DJ,5-LETTER WORDS,,1200,To make amends; it sounds like what you hear when you pick up a phone,atone,NA
2003-12-26,DJ,SHAKESPEAREANA,,1600,"Coined by George Bernard Shaw, this adaptation of ""idolatry"" is the worship of Shakespeare",Bardolatry,NA
2003-12-26,DJ,POTENTATES,,1600,"Historic rulers of this name were nicknamed the Upright, the Wise & Barbarossa",Frederick,NA
2003-12-26,DJ,THE EMPIRE STATE BUILDING,,1600,In 1931 the building opened on the former site of this hotel with a hyphenated name,the Waldorf-Astoria,NA
2003-12-26,DJ,ROCK & ROLL BOOKSTORE,,1600,"Danny Sugerman has written 2 biographies about The Doors & one called ""Appetite for Destruction"" about this group",Guns N\' Roses,NA
2003-12-26,DJ,PEAKING AT NAMES,,NA,"Appropriately, Pico Cristobal Colon is the highest peak in this South American country",Colombia,NA
2003-12-26,DJ,5-LETTER WORDS,,1600,"It can mean ""before"" or be the rank before abbot in a monastery",prior,NA
2003-12-26,DJ,SHAKESPEAREANA,,2000,"Many plays first appeared in these books, smaller than folios, made from sheets folded twice to make 4 leaves",quartos,NA
2003-12-26,NA,NA,NA,NA,NA,NA,NA
2003-12-26,DJ,THE EMPIRE STATE BUILDING,,2000,He made an 8-hour film about the Empire State Building in 1964 in which the camera never moved,Andy Warhol,NA
2003-12-26,DJ,ROCK & ROLL BOOKSTORE,,2000,"""The Rose that Grew from Concrete"" is the title of a book of this slain rapper's poetry",Tupac Shakur,NA
2003-12-26,DJ,PEAKING AT NAMES,,2000,"With peaks named for Washington & Adams, the Presidential Range is found in this state's White Mountains",New Hampshire,NA
2003-12-26,DJ,5-LETTER WORDS,,2000,Sport that uses the ball seen here,rugby,http://www.j-archive.com/media/2003-12-26_DJ_21.jpg
2003-12-26,FJ,SEASONAL CHARACTERS,,NA,In late 1939 Chicago adman Robert May considered Rollo & Reginald before settling on this name,Rudolph,NA
