date,round,category,comment,value,clue,response,link
2003-09-29,J,NURSERY RHYMES,,200,Rowley Powley seems to be an early aka for this kiss & run guy,Georgie Porgie,NA
2003-09-29,J,"HICKORY, DICKORY OR DOC",,200,In 1999 this Rivers became head coach of the Orlando Magic,Doc (Rivers),NA
2003-09-29,J,THE MOUSE,,200,"Like the house cat, the house mouse uses these facial appendages to feel its way around in the dark",whiskers,NA
2003-09-29,J,WREN,,200,Young Christopher Wren translated into Latin William Oughtred's book on these clocks that don't work at night,sundials,NA
2003-09-29,J,"""UP THE""",,200,"It means ""in a difficult situation"" & you don't want to be there without a paddle",up the creek,NA
2003-09-29,J,CLOCKED,,200,Encarta reports that some of these mammals have been clocked flying at 60 mph,bats,NA
2003-09-29,J,NURSERY RHYMES,,400,Dame Dob whipped her for causing Jack's disaster,Jill,NA
2003-09-29,J,"HICKORY, DICKORY OR DOC",,400,Farms famous for beef stick summer sausage,Hickory (Farms),NA
2003-09-29,J,THE MOUSE,,400,"Grasshopper mice are known to do this, like a coyote or a Ginsberg",howl,NA
2003-09-29,J,WREN,,400,"In physiology, Wren devised a way to transfuse this from one animal to another",blood,NA
2003-09-29,J,"""UP THE""",,400,"To raise the stakes, as in a poker game",up the ante,NA
2003-09-29,J,CLOCKED,,400,"In 1992 Iniki, one of these, had gusts clocked at 175 mph",a hurricane,NA
2003-09-29,J,NURSERY RHYMES,,600,She's the subject who sat for the John Everett Millais painting seen here,Little Miss Muffet,http://www.j-archive.com/media/2003-09-29_J_14.jpg
2003-09-29,J,"HICKORY, DICKORY OR DOC",,600,The one who was a participant in the famous gunfight at the O.K. Corral,Doc (Holliday),NA
2003-09-29,J,THE MOUSE,,600,"Bambi might know that when deer mice get excited they do this with their feet, like his rabbit friend",thump,NA
2003-09-29,J,WREN,,NA,Wren's first design for this church's new dome was accepted the week before the great fire,St. Paul\'s Cathedral,NA
2003-09-29,J,"""UP THE""",,600,"It's where the itsy bitsy spider went, again & again",up the water spout,NA
2003-09-29,J,CLOCKED,,600,"When he retired from the Rangers in 1993, his fastballs were still being clocked at over 90 mph",Nolan Ryan,NA
2003-09-29,J,NURSERY RHYMES,,800,"""And so the teacher turned"" it ""out, but still it lingered near""",Mary\'s little lamb,NA
2003-09-29,J,"HICKORY, DICKORY OR DOC",,800,It's a member of the walnut family,hickory,NA
2003-09-29,J,THE MOUSE,,800,"For most of a mouse's life, these teeth keep growing",the incisors,NA
2003-09-29,J,WREN,,800,Wren designed the observatory in this London borough in 1675,Greenwich,NA
2003-09-29,J,"""UP THE""",,800,"Come in last & you're said to do this, like a plastic surgeon does to a droopy bottom",bring up the rear,NA
2003-09-29,J,CLOCKED,,800,In 1988 Flo Jo clocked a time of 10.49 seconds in this event,the 100 meters,NA
2003-09-29,J,NURSERY RHYMES,,1000,Town on the Cornish coast a traveler was heading to when he met a man with 7 wives,St. Ives,NA
2003-09-29,J,"HICKORY, DICKORY OR DOC",,1000,"First name of Daniel Defoe's Mr. Cronke, the Dumb Philosopher",Dickory,NA
2003-09-29,J,THE MOUSE,,1000,"f you eat like a harvest mouse you prefer to eat these, probably before they germinate",seeds,NA
2003-09-29,J,WREN,,1000,"For William & Mary, Wren redid 2 palaces: Kensington & this ""court"", Henry VIII's favorite residence",Hampton Court,NA
2003-09-29,J,"""UP THE""",,1000,Sandy Dennis starred in the film version of this Bel Kaufman tale set in a high school,Up the Down Staircase,NA
2003-09-29,J,CLOCKED,,1000,He clocked in with a record time with each of the 7 Olympic gold medals he won at the 1972 Munich games,Mark Spitz,NA
2003-09-29,DJ,RUSSIAN GEOGRAPHY,,400,"Of north, south, east or west, the primary direction from Moscow to St. Petersburg",north,NA
2003-09-29,DJ,HISTORY ON FILM,,400,"A tagline for ""Thirteen Days"" is: This island. ""1962. You'll never believe how close we came""",Cuba,NA
2003-09-29,DJ,LET'S GO LOBSTERING,,400,"(Jimmy of the Clue Crew presents from a boat in Portland, Maine.)  To determine this on a lobster, check whether the first pair of swimmerets are hard or feathery",the sex,http://www.j-archive.com/media/2003-09-29_DJ_26.jpg
2003-09-29,DJ,THIS YEAR'S HEADLINE!,,400,Hanging chads hold up presidential election results!,2000,NA
2003-09-29,DJ,WILLIAMS,,400,"(Alex presents from Mount Kenya Safari Club.)  This Oscar-winning actor, who made Kenya a second home, was a founder of the Mount Kenya Safari Club",William Holden,http://www.j-archive.com/media/2003-09-29_DJ_11.jpg
2003-09-29,DJ,FOREIGN LANGUAGES,,400,In French:Chinois,Chinese,NA
2003-09-29,DJ,RUSSIAN GEOGRAPHY,,800,The first Soviet atom bomb was produced at the Mayak Complex in this range running from the Arctic to Kazakhstan,the Urals,NA
2003-09-29,DJ,HISTORY ON FILM,,800,In 1932 Ethel Barrymore played Empress Alexandra & her brother Lionel had power over her as this man,Rasputin,NA
2003-09-29,DJ,LET'S GO LOBSTERING,,800,The American lobster is basically differentiated from Pacific ones by having these big enough to eat,claws,NA
2003-09-29,DJ,THIS YEAR'S HEADLINE!,,800,Paris falls to the Nazis!,1940,NA
2003-09-29,DJ,WILLIAMS,,800,"This orator who unsuccessfully ran for U.S. President 3 times was known as ""The Great Commoner""",William Jennings Bryan,NA
2003-09-29,DJ,FOREIGN LANGUAGES,,800,In Portuguese:Coreano,Korean,NA
2003-09-29,DJ,RUSSIAN GEOGRAPHY,,1200,An island off the north coast is named for this majority group in revolutionary circles,the Bolsheviks,NA
2003-09-29,DJ,HISTORY ON FILM,,1200,"Before ""Dragonheart"" there was this movie in which Eric Stoltz looks for King Richard I",Lionheart,NA
2003-09-29,DJ,LET'S GO LOBSTERING,,1200,"(Jimmy of the Clue Crew presents from a boat in Portland, Maine.)  In a standard trap, a lobster finds the bait in this aptly named room, moves on to the parlor, and can't leave",the kitchen,http://www.j-archive.com/media/2003-09-29_DJ_28.jpg
2003-09-29,DJ,THIS YEAR'S HEADLINE!,,1200,Olympic Games begin in Montreal!,1976,NA
2003-09-29,DJ,WILLIAMS,,1200,"""The Great Commoner"" & ""The British Cicero"" were nicknames of this ""elder"" statesman",William Pitt,NA
2003-09-29,DJ,FOREIGN LANGUAGES,,1200,In Norwegian:Nederlansk,Dutch,NA
2003-09-29,DJ,RUSSIAN GEOGRAPHY,,1600,"Siberia is bordered on its east by the Bering Sea, Sea of Okhotsk & Sea of this country",Japan,NA
2003-09-29,DJ,HISTORY ON FILM,,1600,"In ""Max"", this ""Say Anything"" actor has to say, ""You're an awfully hard man to like, Hitler, but I'm going to try""",John Cusack,NA
2003-09-29,DJ,LET'S GO LOBSTERING,,1600,"Term for a tidal area used to store live lobsters, or where a stray dog might end up",the pound,NA
2003-09-29,DJ,THIS YEAR'S HEADLINE!,,1600,Chernobyl reactor explodes!,1986,NA
2003-09-29,DJ,WILLIAMS,,1600,"This 18th & 19th C. poet & illustrator called one work ""Oh, How I Dreamt of Things Impossible""",William Blake,NA
2003-09-29,DJ,FOREIGN LANGUAGES,,NA,In Spanish:Aleman,German,NA
2003-09-29,DJ,RUSSIAN GEOGRAPHY,,2000,Most of this capital city of a Russian republic has been destroyed by Russian-Chechen fighting,Grozny,NA
2003-09-29,DJ,HISTORY ON FILM,,NA,"Alec Guinness is seen here as this monarch:""Democracy, Mr. Cromwell, was a Greek drollery, based on the foolish notion that there are extraordinary possibilities in very ordinary people.""",Charles I,NA
2003-09-29,DJ,LET'S GO LOBSTERING,,2000,"(Sofia of the Clue Crew presents from a boat in Portland, Maine.)  A legal Maine lobster must measure at least 3-1/4 inches along this, the bony back shell",the carapace,http://www.j-archive.com/media/2003-09-29_DJ_30.jpg
2003-09-29,DJ,THIS YEAR'S HEADLINE!,,2000,Spanish Civil War erupts!,1936,NA
2003-09-29,DJ,WILLIAMS,,2000,He's the journalist and abolitionist seen here,William Lloyd Garrison,http://www.j-archive.com/media/2003-09-29_DJ_15.jpg
2003-09-29,DJ,FOREIGN LANGUAGES,,2000,In Latvian:Ungaru Valoda,Hungarian,NA
2003-09-29,FJ,AWARDS,,NA,"Created as a Pulitzer Prize for broadcasting, it was named for a Georgia philanthropist",the Peabody Award,NA
