date,round,category,comment,value,clue,response,link
1988-01-28,J,ISLANDS,,100,The island of Sumatra in the Indian Ocean was visited by this Italian explorer in about 1292,Marco Polo,NA
1988-01-28,J,MOVIE TRIVIA,,100,...,...,NA
1988-01-28,J,DRUG STORE,,100,"For most of its 100 plus years, it's been the world's best-selling mouthwash",Listerine,NA
1988-01-28,J,FOOTBALL,,100,...,...,NA
1988-01-28,J,FLOWERS,,100,"The name of this popular patio flower comes from Greek ""geranos"" meaning crane",geranium,NA
1988-01-28,J,"""M.B.""",,100,The World Book says most of these have from 72-96 members & sometimes feature baton twirlers,marching bands,NA
1988-01-28,J,ISLANDS,,200,"Baffin, Victoria, & Ellesmere Islands, 5th, 9th, and 10th largest in world, all belong to this country",Canada,NA
1988-01-28,J,MOVIE TRIVIA,,200,...,...,NA
1988-01-28,J,DRUG STORE,,200,The best-selling brand of children's vitamins in the U.S. is named for these cartoon characters,the Flintstones,NA
1988-01-28,J,FOOTBALL,,200,...,...,NA
1988-01-28,J,FLOWERS,,200,This Asian variety of lily is aptly named since it's orange splashed with black,a tiger lily,NA
1988-01-28,J,"""M.B.""",,200,"What the ""M.B."" stands for in your M.B.A. degree",masters of business,NA
1988-01-28,J,ISLANDS,,300,"For a while in 1814, this 86-square-mile island was Napoleon's total domain",Elba,NA
1988-01-28,J,MOVIE TRIVIA,,300,...,...,NA
1988-01-28,J,DRUG STORE,,300,People spray Chloraseptic to relieve this pain,a sore throat,NA
1988-01-28,J,FOOTBALL,,300,...,...,NA
1988-01-28,J,FLOWERS,,300,"In March of 1987, a Van Gogh painting featuring these flowers sold for $39,921,750",sunflowers,NA
1988-01-28,J,"""M.B.""",,300,This small round object made of naphthalene can keep your Dior from disintegrating,a moth ball,NA
1988-01-28,J,ISLANDS,,400,The Act of Union in 1707 united 2 kingdoms into this island nation named for the island it was on,Great Britain,NA
1988-01-28,J,MOVIE TRIVIA,,400,An ex-slave was hired to sit on a porch & tell folk tales for 1946 Georgia premiere of this Disney film,Song of the South,NA
1988-01-28,J,DRUG STORE,,400,"It's said a Sumerian clay tablet from 2000 B.C., calling for plant materials, is the oldest one known",prescription,NA
1988-01-28,J,FOOTBALL,,400,...,...,NA
1988-01-28,J,FLOWERS,,400,"From the French ""pensee"", it's pansy's pensive meaning, even though yours may be far away",thought,NA
1988-01-28,J,"""M.B.""",,400,Colorful title of Melissa Manchester's 1st Billboard top 40 hit,Midnight Blue,NA
1988-01-28,J,ISLANDS,,500,"If you hold you family reunion on Reunion, you're on an island which belongs to this country",France,NA
1988-01-28,J,MOVIE TRIVIA,,NA,He was Judy Garland's companion on the road to Oz & later became her daughter's father-in-law,Jack Haley,NA
1988-01-28,J,DRUG STORE,,500,"In the '50s, ads for this hair product warned guys not to use ""that greasy kids stuff""",Vitalis,NA
1988-01-28,J,FOOTBALL,,500,...,...,NA
1988-01-28,NA,NA,NA,NA,NA,NA,NA
1988-01-28,J,"""M.B.""",,500,"Overwhelming, as with wonder or perplexity",mind boggling,NA
1988-01-28,DJ,AMERICAN HISTORY,,200,The first permanent English settlement in the American colonies,Jamestown,NA
1988-01-28,DJ,WORLD LITERATURE,,200,"Upton Sinclair set ""The Jungle"" not in the third world but in this Second City",Chicago,NA
1988-01-28,DJ,EQUIVALENCIES,,200,"Britain's Chancellor of the Exchequer is equivalent of this U.S, cabinet secretary",Secretary of the Treasury,NA
1988-01-28,DJ,COMPOSERS,,200,"He was born Ferenc Liszt, but known by this German version of his 1st name",Franz,NA
1988-01-28,DJ,FAMOUS AMOS's,,200,John Amos got an Emmy nomination for playing this character as an adult in,Kunta Kinte,NA
1988-01-28,DJ,PALINDROMES,,200,Not tilted,level,NA
1988-01-28,DJ,AMERICAN HISTORY,,400,"In 1773, Ben Franklin tested this form of execution & knocked off chickens, a 10-lb. turkey & a lamb",electrocution,NA
1988-01-28,DJ,WORLD LITERATURE,,400,"It's the beloved country in Alan Paton's ""Cry the Beloved Country""",South Africa,NA
1988-01-28,DJ,EQUIVALENCIES,,400,"While Canada is divided into provinces, Australia has 6 of these",states,NA
1988-01-28,DJ,COMPOSERS,,NA,"Songwriter who emigrated from Russia to New York in the 1890s, which may have inspired the following",Irving Berlin,http://www.j-archive.com/media/1988-01-28_DJ_23.mp3
1988-01-28,DJ,FAMOUS AMOS's,,400,"This comedian of Lebanese descent, aka Amos Jacobs, was awarded a Congressional Gold Medal for humanitarianism",Danny Thomas,NA
1988-01-28,DJ,PALINDROMES,,400,"As the last word in a palindromic phrase, it's what owls might say it's ""too hot to"" do",hoot,NA
1988-01-28,DJ,AMERICAN HISTORY,,600,"In 1843, Mexico said annexation of this as a U.S. state would be equal to a declaration of war",Texas,NA
1988-01-28,DJ,WORLD LITERATURE,,600,"Subtitled ""The Memoirs of a Woman of Pleasure"", in 1821 it became 1st book tried for sexual obscenity in U.S.",Fanny Hill,NA
1988-01-28,DJ,EQUIVALENCIES,,600,"While ""Venus"" was a #1 hit for Frankie Avalon, no one's had a hit about this, her Greek equivalent",Aphrodite,NA
1988-01-28,DJ,COMPOSERS,,600,"Black composer James A. Bland, born in NYC in 1854, wrote this state song of Virginia","""Carry Me Back To Old Virginny""",NA
1988-01-28,DJ,FAMOUS AMOS's,,600,"On ""The Real McCoys"", he was Grandpappy Amos ""Head of the clan, he roars like a lion, but he's gentle as a lamb""",Walter Brennan,NA
1988-01-28,DJ,PALINDROMES,,600,"French pronoun or French magazine, both concerned with women",elle,NA
1988-01-28,DJ,AMERICAN HISTORY,,800,"Napoleon's grand-nephew, Attorney General Charles Bonaparte, established this U.S. agency in 1908",the Federal Bureau of Investigation,NA
1988-01-28,DJ,WORLD LITERATURE,,800,"He died in 1824, leaving unfinished his only 3 novels, ""The Trial"", ""The Castle"" & ""Amerika""",(Franz) Kafka,NA
1988-01-28,DJ,EQUIVALENCIES,,NA,"JFK's equivalent of FDR's ""New Deal"" and Truman's ""Fair Deal""",the New Frontier,NA
1988-01-28,DJ,COMPOSERS,,800,"This native of Washington, D.C. wrote several novels & an autobiography called ""Marching Along""",(John Philip) Sousa,NA
1988-01-28,DJ,FAMOUS AMOS's,,800,"While Andy's occupation was trying to get rich quick, Amos of ""Amos & Andy"" did this for a living",drove a cab,NA
1988-01-28,DJ,PALINDROMES,,800,"For Mae West, this ""diamond"" was a theatrical gem",Lil,NA
1988-01-28,DJ,AMERICAN HISTORY,,1000,"His 16-minute flight on July 21, 1961 made him the 2nd American in space","(Virgil ""Gus"") Grissom",NA
1988-01-28,DJ,WORLD LITERATURE,,1000,1941 Arthur Koestler novel which showed his disillusionment with Communism,Darkness at Noon,NA
1988-01-28,DJ,EQUIVALENCIES,,1000,"In most Islamic countries, it's the equivalent of the Red Cross",the Red Crescent,NA
1988-01-28,NA,NA,NA,NA,NA,NA,NA
1988-01-28,NA,NA,NA,NA,NA,NA,NA
1988-01-28,DJ,PALINDROMES,,1000,"Jahan of India and Mohammad Reza Pahlavi, for example",shahs,NA
1988-01-28,FJ,STATE CAPITALS,,NA,"1 of 2 letters that begins the names of 6 state capitals, more than any other",C or S,NA
