date,round,category,comment,value,clue,response,link
2015-01-19,J,LABOR,,200,In October 2014 Labor Secretary Thomas Perez called for the raising of this to $10.10 an hour,the minimum wage,NA
2015-01-19,J,& THE EMMY GOES TO...,,200,"this comedy in 2001:Sarah Jessica Parker, producer",Sex and the City,NA
2015-01-19,J,THE SPANISH-AMERICAN WAR,,200,"Fitzhugh Lee, U.S. Consul General in Havana, advised President McKinley not to send this ship to the city; he was ignored",the Maine,NA
2015-01-19,J,LITTLE WEASELS,,200,The black-footed species of this weasel of the Great Plains feeds on prairie dogs,a ferret,http://www.j-archive.com/media/2015-01-19_J_16.wmv
2015-01-19,J,"ATTA BOY, TOM!",,200,"In 2011 he starred in his fourth ""Mission: Impossible"" film, ""Ghost Protocol""",Tom Cruise,NA
2015-01-19,J,"VO""CH""ABULARY","(Alex: The ""C-H"" will not have a ""C-H"" sound in each correct response, but a ""C"" or ""K"" sound.)",200,"A repeated part of a song, or a group that sings it",a chorus,NA
2015-01-19,J,LABOR,,400,Time-of-year adjective for temporary workers like those on farms or in ski resorts,seasonal workers,NA
2015-01-19,J,& THE EMMY GOES TO...,,400,this Claire Danes drama in 2012,Homeland,NA
2015-01-19,J,THE SPANISH-AMERICAN WAR,,400,This Assistant Secretary of the Navy resigned his office to fight the war on horseback,Theodore Roosevelt,NA
2015-01-19,J,LITTLE WEASELS,,400,"The wolverine is a member of the weasel family & is also known by this name that means ""overeater""",the glutton,NA
2015-01-19,J,"ATTA BOY, TOM!",,400,Tom Wolfe worked for six years on this bestseller about the early space program,The Right Stuff,NA
2015-01-19,J,"VO""CH""ABULARY","(Alex: The ""C-H"" will not have a ""C-H"" sound in each correct response, but a ""C"" or ""K"" sound.)",400,"Per its constitution, Denmark is a constitutional one of these",a monarchy,NA
2015-01-19,J,LABOR,,600,"To protest job conditions, these public servants may threaten an outbreak of ""blue flu""",the police,NA
2015-01-19,J,& THE EMMY GOES TO...,,600,"this lead actor in a comedy in 2004, for ""Frasier""",Kelsey Grammer,NA
2015-01-19,J,THE SPANISH-AMERICAN WAR,,600,"This ""Red Badge of Courage"" author covered the war in Cuba as a reporter for Pulitzer's New York World newspaper",Stephen Crane,NA
2015-01-19,J,LITTLE WEASELS,,600,"Also known as the striped weasel, the zorilla of this continent feeds at night on insects & small rodents",Africa,NA
2015-01-19,J,"ATTA BOY, TOM!",,600,In 2005 he ended his tenure as the first head of the Department of Homeland Security,Tom Ridge,NA
2015-01-19,J,"VO""CH""ABULARY","(Alex: The ""C-H"" will not have a ""C-H"" sound in each correct response, but a ""C"" or ""K"" sound.)",600,"Abraham's burial chamber is said to be in the West Bank city of Hebron in the ""Cave of"" these Biblical leaders",the Patriarchs,NA
2015-01-19,J,LABOR,,800,"Founding members of their guild, the J.G., include Eddie Arcaro, Johnny Longden & John Pollard",the Jockeys\' Guild,NA
2015-01-19,J,& THE EMMY GOES TO...,,800,"this lead actress in a drama in 2003, for ""The Sopranos""",Edie Falco,NA
2015-01-19,J,THE SPANISH-AMERICAN WAR,,800,General Nelson Miles captured this future U.S. commonwealth & served as civilian administrator after the war,Puerto Rico,NA
2015-01-19,J,LITTLE WEASELS,,800,"Pelts of weasels, especially of stoats, are known by this name in the fur trade",ermine,NA
2015-01-19,J,"ATTA BOY, TOM!",,800,"As its creative director from 1994 to 2004, Tom Ford transformed this Italian fashion house",Gucci,NA
2015-01-19,J,"VO""CH""ABULARY","(Alex: The ""C-H"" will not have a ""C-H"" sound in each correct response, but a ""C"" or ""K"" sound.)",800,"Far out, man--this word from Greek for ""soul made visible"" describes the artwork seen here",psychedelic,http://www.j-archive.com/media/2015-01-19_J_04.jpg
2015-01-19,J,LABOR,,1000,"In 1981 nearly 13,000 members of PATCO, a union of these workers, went on strike but most were soon fired",air traffic controllers,NA
2015-01-19,J,& THE EMMY GOES TO...,,1000,this supporting actor in a comedy in 2008,Jeremy Piven,http://www.j-archive.com/media/2015-01-19_J_29.jpg
2015-01-19,J,THE SPANISH-AMERICAN WAR,,1000,"During the Battle of Manila Bay, this captain of the Olympia was told by Dewey to fire ""when you are ready""",Charles Gridley,NA
2015-01-19,J,LITTLE WEASELS,,NA,"As its name indicates, this member of the weasel family has the same favorite food as Winnie-the-Pooh",a honey badger,NA
2015-01-19,J,"ATTA BOY, TOM!",,1000,Last name of U.S. Senators Tom from New Mexico & Mark from Colorado,Udall,NA
2015-01-19,J,"VO""CH""ABULARY","(Alex: The ""C-H"" will not have a ""C-H"" sound in each correct response, but a ""C"" or ""K"" sound.)",1000,"Holden Caufield uses the phrase of praise ""a gentleman and"" this",a scholar,NA
2015-01-19,DJ,FRENCH CITIES & TOWNS,,400,A decree from Louis XIV created this palatial city about 15 miles southwest of Paris,Versailles,NA
2015-01-19,DJ,THE TRANSPORTER,,400,"Time magazine, on an ""arrogantly huge"" 21st c. model of this: ""Maybe we all shouldn't be driving tanks that get 10 mpg""",a Hummer,NA
2015-01-19,DJ,SAME FIRST & LAST LETTER,,400,Palindromic canoe,kayak,NA
2015-01-19,DJ,TOP 30 TO 40 HITS,(Alex: ...on the Billboard pop chart.),400,"Kazaam!  In 1993 this NBA superstar hit for 35 (on the charts, not the court) with ""(I Know I Got) Skillz""",Shaquille O\'Neal,NA
2015-01-19,DJ,POWERFUL BOOKS,,400,This 1859 book posited the controversial idea of natural selection,The Origin of Species,NA
2015-01-19,DJ,ANAGRAMMED CURRENT WORLD LEADERS,,400,Russian around:RIVAL DUMP IN IT,Vladimir Putin,NA
2015-01-19,DJ,FRENCH CITIES & TOWNS,,800,This city has 2 racing circuits: the Circuit de la Sarthe & the Bugatti Circuit,Le Mans,NA
2015-01-19,DJ,THE TRANSPORTER,,800,We call it a streetcar; the Brits use this 4-letter term,a tram,NA
2015-01-19,DJ,SAME FIRST & LAST LETTER,,800,This archaic word is--keep up now!--the 3rd person singular present indicative of have,hath,NA
2015-01-19,DJ,TOP 30 TO 40 HITS,(Alex: ...on the Billboard pop chart.),800,"Now on ""NCIS: Los Angeles"", he rapped his way to No. 36 in 2003 with ""Paradise""; we hear ladies love him",LL Cool J,NA
2015-01-19,DJ,POWERFUL BOOKS,,800,"Conflict is inevitable, according to this ancient work by Sun-Tzu, so prepare for it",The Art of War,NA
2015-01-19,DJ,ANAGRAMMED CURRENT WORLD LEADERS,,800,Think of England:RANDOM ADVICE,David Cameron,NA
2015-01-19,DJ,FRENCH CITIES & TOWNS,,1200,"(Sarah of the Clue Crew shows a map on the monitor.)  After France surrendered to the Nazis in June 1940, the country was divided into a German-occupied area & an unoccupied zone with an administrative center in this spa town, by whose name the region would be known",Vichy,http://www.j-archive.com/media/2015-01-19_DJ_04a.jpg
2015-01-19,DJ,THE TRANSPORTER,,1200,"On July 20, 1969 the world held its breath as 2 guys finally found a parking spot for this transport at 4:17 P.M. EDT",the Eagle,NA
2015-01-19,DJ,SAME FIRST & LAST LETTER,,1200,"This 5-letter word means ""implied"", like a type of approval that's given without speaking",tacit,NA
2015-01-19,DJ,TOP 30 TO 40 HITS,(Alex: ...on the Billboard pop chart.),1200,"This actress-singer ""from the block"" was 32nd-best in 2003 with ""I'm Glad""",Jennifer Lopez,NA
2015-01-19,DJ,POWERFUL BOOKS,,1200,"Upton Sinclair's ""The Jungle"" depicted the gory world of this city's meatpacking industry",Chicago,NA
2015-01-19,DJ,ANAGRAMMED CURRENT WORLD LEADERS,,1200,Boss in Berlin:MAKE ALLERGEN,Angela Merkel,NA
2015-01-19,DJ,FRENCH CITIES & TOWNS,,1600,"Known for its wine, this major southwestern port once belonged to the English & was their main port on the continent",Bordeaux,NA
2015-01-19,DJ,THE TRANSPORTER,,1600,"Every year, 22 million ride this ferry 5.2 miles between the St. George Terminal & Manhattan's Whitehall Terminal",the Staten Island Ferry,NA
2015-01-19,DJ,SAME FIRST & LAST LETTER,,1600,Type of horse altered to never have a chance to be father of the year,gelding,NA
2015-01-19,DJ,TOP 30 TO 40 HITS,(Alex: ...on the Billboard pop chart.),1600,"In 1978 this Jeff Lynne group took ""Mr. Blue Sky"" to No. 35",ELO,NA
2015-01-19,DJ,POWERFUL BOOKS,,NA,"Published in 1513, it was dedicated ""to the magnificent Lorenzo di Piero de' Medici""",The Prince,NA
2015-01-19,DJ,ANAGRAMMED CURRENT WORLD LEADERS,,1600,"Oh, Canada:PERHAPS RENT, EH",Stephen Harper,NA
2015-01-19,DJ,FRENCH CITIES & TOWNS,,2000,This city at the juncture of the Rhone & Saone Rivers is famous for its cooked dishes prepared with onions,Lyon,NA
2015-01-19,DJ,THE TRANSPORTER,,2000,"From one of the materials visible, it's the word for classic cars like the one seen here",a woody,http://www.j-archive.com/media/2015-01-19_DJ_24.jpg
2015-01-19,DJ,SAME FIRST & LAST LETTER,,NA,Temporary cessation of breathing; asphyxia is when it's not so temporary,apnea,NA
2015-01-19,DJ,TOP 30 TO 40 HITS,(Alex: ...on the Billboard pop chart.),2000,"After discovering ""Your Body Is A Wonderland"", this singer/guitarist made it to No. 33 with ""Bigger Than My Body"" in 2003",John Mayer,NA
2015-01-19,DJ,POWERFUL BOOKS,,2000,"Subtitled ""Another Testament of Jesus Christ"", it is a record of God's dealings with ancient inhabitants of the Americas",the Book of Mormon,NA
2015-01-19,DJ,ANAGRAMMED CURRENT WORLD LEADERS,,2000,Havana bad time:RURAL COAST,Rául Castro,NA
2015-01-19,FJ,BRITISH BUSINESS NAMES,,NA,"Still around, these 2 rival companies began with a 1744 sale of ""scarce & valuable books"" & a 1766 sale of chamber pots",Christie\'s & Sotheby\'s,NA
