date,round,category,comment,value,clue,response,link
2015-04-29,J,THE NEXT CHEMICAL ELEMENT ALPHABETICALLY,,200,After platinum,plutonium,NA
2015-04-29,J,LIQUEURS,,200,"It was Paris hotelier Cesar Ritz who suggested the ""Grand"" for the name of this cognac-based liqueur brand",(Grand) Marnier,NA
2015-04-29,J,THE ATHLETE WHO...,,200,announced he was taking his talents back to Cleveland in 2014,LeBron James,NA
2015-04-29,J,"""VO""CABULARY",,200,A vacuum or gap,a void,NA
2015-04-29,J,INDIANAPOLIS,,200,"Known as ""Circle City"", Indianapolis is laid out in a wheel pattern inspired by the pattern of this eastern U.S. city","Washington, D.C.",NA
2015-04-29,J,500,,200,An ancient Roman would write 500 with this letter,D,NA
2015-04-29,J,THE NEXT CHEMICAL ELEMENT ALPHABETICALLY,,400,After copernicium,copper,NA
2015-04-29,J,LIQUEURS,,400,It takes 7 years to go from coffee bean to a bottle of this Mexican liqueur brand,Kahlúa,NA
2015-04-29,J,THE ATHLETE WHO...,,400,won the Heisman in 2005 & forfeited it in 2010,Reggie Bush,NA
2015-04-29,J,"""VO""CABULARY",,400,"(Jimmy of the Clue Crew reports from the sound recording booth while femme fatale Kelly walks into frame in the studio.)  Big in film noir, it's the sound technique we're using here""I knew Kelly was trouble the minute she walked into the room.""",a voiceover,NA
2015-04-29,J,INDIANAPOLIS,,400,"This downtown stadium features over 1,000 flat-screen TVs & the NFL's largest retractable roof",Lucas Oil Stadium,NA
2015-04-29,J,500,,400,"On July 12, 2013 this Ira Glass show celebrated its 500th episode",This American Life,NA
2015-04-29,J,THE NEXT CHEMICAL ELEMENT ALPHABETICALLY,,600,After zinc,zirconium,NA
2015-04-29,J,LIQUEURS,,600,This Italian liqueur has the flavor of almonds but is often made with the kernels of apricot pits,amaretto,NA
2015-04-29,J,THE ATHLETE WHO...,,600,"scored the ""Hand of God"" goal for Argentina",Diego Maradona,NA
2015-04-29,J,"""VO""CABULARY",,600,It's your calling or profession,a vocation,NA
2015-04-29,J,INDIANAPOLIS,,600,"Except for 4 small communities, Indianapolis was expanded in 1970 to include all of this county named for the ""Swamp Fox""",Marion,NA
2015-04-29,J,500,,600,"In this library system, 500 is natural sciences & mathematics",the Dewey decimal system,NA
2015-04-29,J,THE NEXT CHEMICAL ELEMENT ALPHABETICALLY,,800,After argon,arsenic,NA
2015-04-29,J,LIQUEURS,,800,"Here, Manet depicted a drinker of this liqueur, made from wormwood",absinthe,http://www.j-archive.com/media/2015-04-29_J_04a.jpg
2015-04-29,J,THE ATHLETE WHO...,,800,"at age 22, entered the record books with his 16-under-par winning score at the 2011 U.S. Open",(Rory) McIlroy,NA
2015-04-29,J,"""VO""CABULARY",,800,"Originally applied to birds, it refers to something that flits about or changes rapidly, like some stock markets",volatile,NA
2015-04-29,J,INDIANAPOLIS,,800,Crown Hill Cemetery is the final resting place of John Dillinger & this 23rd president,Benjamin Harrison,NA
2015-04-29,J,500,,800,"Popularized in the movie ""Breaking Away"", the Little 500 is a collegiate race of these transports",bicycles,NA
2015-04-29,J,THE NEXT CHEMICAL ELEMENT ALPHABETICALLY,,NA,After silicon,silver,NA
2015-04-29,J,LIQUEURS,,1000,French monks have made this brightly colored herbal liqueur since 1737,Chartreuse,NA
2015-04-29,J,THE ATHLETE WHO...,,1000,in 1996 helped the American female gymnasts win gold by sticking her second vault while injured,Kerri Strug,NA
2015-04-29,J,"""VO""CABULARY",,1000,Adjective for a curvaceous woman or anything that gives sensual pleasure,voluptuous,NA
2015-04-29,J,INDIANAPOLIS,,1000,"The library named for this author has first editions of all his novels back to the first, ""Player Piano""",Vonnegut,NA
2015-04-29,J,500,,1000,The S&P of the S&P 500 index stands for this; half of it sounds like something a businessman tries to avoid,Standard & Poor\'s,NA
2015-04-29,DJ,LARGE & IN CHARGE,,400,"After her husband Albert's death in 1861, she put on weight & ballooned up to a 46-inch waist",Queen Victoria,NA
2015-04-29,DJ,AMERICAN HERITAGE DICTIONARY PERFERRED PLURALS,,400,Louse (the bug),lice,NA
2015-04-29,DJ,OCCUPATIONS,,400,"An apiarist breeds these, please",bees,NA
2015-04-29,DJ,"NICOLAS CAGE, YOU COMPLETE ME",,400,"1986:""____ ____ Got Married""",Peggy Sue,NA
2015-04-29,DJ,CAPES,,400,"On July 24, 1950 a 2-stage rocket called Bumper 8 became the first rocket launched from this cape",Cape Canaveral,NA
2015-04-29,DJ,ELEMENTARY,"(Jonny Lee Miller as Holmes: Putting a new twist on classic tales as Sherlock Holmes, with my partner Joan Watson.)",400,"(Lucy Liu reads from the set of Elementary.)  Like the original John Watson character, my character has this profession before she takes up with Sherlock Holmes",a doctor,http://www.j-archive.com/media/2015-04-29_DJ_06.jpg
2015-04-29,DJ,LARGE & IN CHARGE,,800,"This Australian state didn't add an ""H"" to the last word in its name when the obese Sir George Reid was premier",New South Wales,NA
2015-04-29,DJ,AMERICAN HERITAGE DICTIONARY PERFERRED PLURALS,,800,Nucleus,nuclei,NA
2015-04-29,DJ,OCCUPATIONS,,800,Mapmaker has 8 letters; this synonym has 12 & sounds fancier,cartographer,NA
2015-04-29,DJ,"NICOLAS CAGE, YOU COMPLETE ME",,800,"1998:""Snake ____""",Eyes,NA
2015-04-29,DJ,CAPES,,800,"Normandy's Cap Gris-Nez, which means ""gray nose cape"", sticks its nose into this body of water",the English Channel,NA
2015-04-29,DJ,ELEMENTARY,"(Jonny Lee Miller as Holmes: Putting a new twist on classic tales as Sherlock Holmes, with my partner Joan Watson.)",800,"(Jonny Lee Miller reads from the set of Elementary.)  Conan Doyle's Holmes described him as ""curiously reptilian"" & ""His two eyes are deeply sunken""; on ""Elementary"" Natalie Dormer provided a very different version of this villain",Moriarty,http://www.j-archive.com/media/2015-04-29_DJ_11a.jpg
2015-04-29,DJ,LARGE & IN CHARGE,,1200,"At over 6'5"", Filip Vujanovic is large & in charge of this Balkan nation whose name means ""black mountain""",Montenegro,NA
2015-04-29,DJ,AMERICAN HERITAGE DICTIONARY PERFERRED PLURALS,,1200,That,those,NA
2015-04-29,DJ,OCCUPATIONS,,1200,"Sextons, or parish officers who keep order during services; meet the...",beadles,NA
2015-04-29,DJ,"NICOLAS CAGE, YOU COMPLETE ME",,1200,"2005:""Lord of ____""",War,NA
2015-04-29,DJ,CAPES,,1200,Tourists flock to this cape or cabo where Baja California comes to a point,Cabo San Lucas,NA
2015-04-29,DJ,ELEMENTARY,"(Jonny Lee Miller as Holmes: Putting a new twist on classic tales as Sherlock Holmes, with my partner Joan Watson.)",1200,"(Jonny Lee Miller reads from the set of Elementary.)  Our Holmes on ""Elementary"" is recovering from his drug use; not so the original, who on the first page of ""The Sign of Four"" injects a 7% solution of this",cocaine,http://www.j-archive.com/media/2015-04-29_DJ_12.jpg
2015-04-29,DJ,LARGE & IN CHARGE,,1600,"Tupou IV, king of this ""friendly"" South Pacific island nation from 1965 to 2006, tipped the scales at 440 pounds",Tonga,NA
2015-04-29,DJ,AMERICAN HERITAGE DICTIONARY PERFERRED PLURALS,,1600,Matrix,matrices,NA
2015-04-29,DJ,OCCUPATIONS,,1600,Applying gel to pregnant ladies' tummies is part of the job of the technician with this 1-word job,a sonographer,NA
2015-04-29,DJ,"NICOLAS CAGE, YOU COMPLETE ME",,1600,"1992:""____ in Vegas""",Honeymoon,NA
2015-04-29,DJ,CAPES,,NA,The boundary line between the South Atlantic & the South Pacific is the meridian of this cape,Cape Horn,NA
2015-04-29,DJ,ELEMENTARY,"(Jonny Lee Miller as Holmes: Putting a new twist on classic tales as Sherlock Holmes, with my partner Joan Watson.)",NA,"(Lucy Liu reads from the set of Elementary.)  In a story, Holmes surprises Watson by revealing the existence of this brother & says he even ""has better powers of observation than I""; when he turns up on ""Elementary"", sparks fly with Joan Watson",Mycroft,http://www.j-archive.com/media/2015-04-29_DJ_15.jpg
2015-04-29,DJ,LARGE & IN CHARGE,,2000,"William Wallace should've known better than to pick a fight with Edward I, nicknamed this for his height & stature",the Longshanks,NA
2015-04-29,DJ,AMERICAN HERITAGE DICTIONARY PERFERRED PLURALS,,2000,Opus,opera,NA
2015-04-29,DJ,OCCUPATIONS,,2000,"A jongleur was a medieval type of this musician/entertainer; Gilbert & Sullivan wrote of ""A Wandering"" one",a minstrel,NA
2015-04-29,DJ,"NICOLAS CAGE, YOU COMPLETE ME",,2000,"1994:""Guarding ____""",Tess,NA
2015-04-29,NA,NA,NA,NA,NA,NA,NA
2015-04-29,DJ,ELEMENTARY,"(Jonny Lee Miller as Holmes: Putting a new twist on classic tales as Sherlock Holmes, with my partner Joan Watson.)",2000,"(Lucy Liu reads from the set of Elementary.)  On ""Elementary"" a detective who knew Holmes in London & turns up in New York is named for this original Scotland Yard man who Holmes says ""is as tenacious as a bulldog""",Lestrade,http://www.j-archive.com/media/2015-04-29_DJ_16.jpg
2015-04-29,FJ,CHAIN STORE NAMES IN THE NEWS,,NA,"The 1917 first use of what became its name said this 2-word small room ""called up the tube that the steamer... was torpedoed""",Radio Shack,NA
