date,round,category,comment,value,clue,response,link
2015-05-01,J,BOOKS BY CELEBS,,200,"For his 98th birthday in 2014, this rugged-chinned actor & father of Michael released ""Life Could be Verse""",Kirk Douglas,NA
2015-05-01,J,TRAVELING,,200,"In Bali, this luxury hotel chain calls its suites ""Royal Villas"", Winter, Spring, Summer or Fall",Four Seasons,NA
2015-05-01,J,CARD TRICKS,,200,"When drumming up new business, leave this alliterative item with your contact info",a calling card,NA
2015-05-01,J,TECHNOLOGY & STUFF,,200,"The 2014 World Series MVP got a Colorado from this car brand, whose rep noted its ""technology & stuff""",Chevy,NA
2015-05-01,J,"""OLO""",,200,It can be a punctuation mark or a part of your digestive system,the colon,NA
2015-05-01,J,THE VOYAGE OF THE BOUNTY,"(Sarah: We're taking you on [*], both before and after the infamous mutiny.)",200,"(Sarah of the Clue Crew reports.)  The purpose of the Bounty's epic journey was to collect the seedlings from this tree that could be planted in the West Indies & grow tall to provide a staple food for slaves; the mutineers threw the carefully selected 1,015 specimens overboard",breadfruit plants,http://www.j-archive.com/media/2015-05-01_J_03a.jpg
2015-05-01,J,BOOKS BY CELEBS,,400,"Naturally, TV's Barbara Eden dreamed up a memoir called this name ""Out of the Bottle""",Jeannie,NA
2015-05-01,J,TRAVELING,,400,"Twice the size of Manhattan, this Colorado facility opened February 28, 1995 to replace Stapleton",Denver International Airport,NA
2015-05-01,J,CARD TRICKS,,400,"Library item of yore, seen here",a card catalog,http://www.j-archive.com/media/2015-05-01_J_02.jpg
2015-05-01,J,TECHNOLOGY & STUFF,,400,8 adjacent bits processed as a unit by a computer is one of these,a byte,NA
2015-05-01,J,"""OLO""",,400,Instrument heard here,a piccolo,http://www.j-archive.com/media/2015-05-01_J_10.mp3
2015-05-01,J,THE VOYAGE OF THE BOUNTY,"(Sarah: We're taking you on [*], both before and after the infamous mutiny.)",400,"(Sarah of the Clue Crew reports.)  Waiting for the plants to mature & avoiding monsoons, the Bounty was stuck for five months on this lush tropical island",Tahiti,http://www.j-archive.com/media/2015-05-01_J_05.jpg
2015-05-01,J,BOOKS BY CELEBS,,600,"Retired Yankee Mariano Rivera called his memoir this, the kind of relief pitcher he was",Closer,NA
2015-05-01,J,TRAVELING,,600,"For her cabin on this type of Cunard vessel, a Victorian-era traveler packed this type of ""trunk""",a steamer,NA
2015-05-01,J,CARD TRICKS,,600,A team that made the playoffs without winning the division,the wild card,NA
2015-05-01,NA,NA,NA,NA,NA,NA,NA
2015-05-01,J,"""OLO""",,600,Ball under & dry pass are terms from this sport,water polo,NA
2015-05-01,J,THE VOYAGE OF THE BOUNTY,"(Sarah: We're taking you on [*], both before and after the infamous mutiny.)",600,"(Sarah of the Clue Crew reports.)  After living the lush life in the South Pacific, the Bounty's crew found it difficult to return to the ship & this oppressive captain",Bligh,http://www.j-archive.com/media/2015-05-01_J_06a.jpg
2015-05-01,NA,NA,NA,NA,NA,NA,NA
2015-05-01,J,TRAVELING,,NA,A cold beer is just the thing to quench your thirst when cruising along this river in the capital of the Netherlands,the Amstel River,NA
2015-05-01,J,CARD TRICKS,,800,Oscar-winning director Steven Soderbergh had an early job holding up these for a TV show,cue cards,NA
2015-05-01,J,TECHNOLOGY & STUFF,,800,"This ""colorful"" format gave a new option when popping in a video; the first product of its kind came out in Japan in 2003",Blu-ray,NA
2015-05-01,J,"""OLO""",,800,A man supported by a woman in return for his attentions,a gigolo,NA
2015-05-01,J,THE VOYAGE OF THE BOUNTY,"(Sarah: We're taking you on [*], both before and after the infamous mutiny.)",800,"(Sarah of the Clue Crew reports.)  A long-time friend of the captain, this first mate had planned an escape by raft, but several of the crew begged him to take the ship, and the mutiny began",Fletcher Christian,http://www.j-archive.com/media/2015-05-01_J_07a.jpg
2015-05-01,NA,NA,NA,NA,NA,NA,NA
2015-05-01,J,TRAVELING,,1000,"Finding guidebooks of his time boring, this Hungarian started his own travel series with 1936's ""On the Continent""",Eugene Fodor,NA
2015-05-01,J,CARD TRICKS,,1000,"The .gov dedicated to this card says, ""Do not carry your card with you.  Keep it in a safe place with your other important papers""",your Social Security card,NA
2015-05-01,J,TECHNOLOGY & STUFF,,1000,In 1994 Marc Andreessen offered this web browser based on Mosaic commercially to the world,Netscape,NA
2015-05-01,J,"""OLO""",,1000,"Similar to vibrato, it's the rapid repetition of a single tone",tremolo,NA
2015-05-01,J,THE VOYAGE OF THE BOUNTY,"(Sarah: We're taking you on [*], both before and after the infamous mutiny.)",1000,"(Sarah of the Clue Crew reports.)  The mutineers first lived on Tubuai Island, but fights with the natives forced them to flee; some risked capture by returning to Tahiti, while the rest ended up hiding here on this island",Pitcairn Island,http://www.j-archive.com/media/2015-05-01_J_08a.jpg
2015-05-01,DJ,"TV ""NIGHT""",,400,"""Clear eyes.  Full hearts.  Can't lose"" was a motto on this series about high school football",Friday Night Lights,NA
2015-05-01,DJ,SCALY CRITTERS,,400,"The tartaruga da Amazonia is a species of this; it can weigh 130 pounds, with 35-inch shells & strong scaly legs",a turtle,NA
2015-05-01,DJ,RELIGION,,400,"Despite recent evidence of a 13th-century origin, the Vatican has encouraged scientific study of this religious relic",the Shroud of Turin,http://www.j-archive.com/media/2015-05-01_DJ_21.jpg
2015-05-01,DJ,"NICE ENDING, SHAKESPEARE!",(Alex: We want you to name the play in...),400,"Lucentio:""'Tis a wonder, by your leave, she will be tamed so""",The Taming of the Shrew,NA
2015-05-01,DJ,WARSAW PACT ALUMNI NATIONS,,400,This member nation hosted the 1955 meeting that produced the agreement,Poland,NA
2015-05-01,DJ,RHYME SCHOOL,"(Alex: Because each correct response in that category will rhyme with the word ""school"".)",400,To let saliva come out of the mouth,drool,NA
2015-05-01,DJ,"TV ""NIGHT""",,800,"In 1980 Ted Koppel was hosting the nightly update ""The Iran Crisis"" when it became this show",Nightline,NA
2015-05-01,NA,NA,NA,NA,NA,NA,NA
2015-05-01,DJ,RELIGION,,800,"1 of the Borgias, Duke Francisco, was made a saint for his work in expanding & reforming this religious order",the Jesuits,NA
2015-05-01,DJ,"NICE ENDING, SHAKESPEARE!",(Alex: We want you to name the play in...),800,"""Give me your hands, if we be friends: And Robin shall restore amends""",A Midsummer Night\'s Dream,NA
2015-05-01,DJ,WARSAW PACT ALUMNI NATIONS,,800,In November 1956 it said it was leaving the pact; enter Soviet tanks,Hungary,NA
2015-05-01,NA,NA,NA,NA,NA,NA,NA
2015-05-01,DJ,"TV ""NIGHT""",,1200,Harry Anderson played the presiding judge on this '80s comedy,Night Court,NA
2015-05-01,NA,NA,NA,NA,NA,NA,NA
2015-05-01,DJ,RELIGION,,1200,"Although it's unlikely they built the monument where they're operating, it's the religious group seen here",the Druids,http://www.j-archive.com/media/2015-05-01_DJ_09.jpg
2015-05-01,DJ,"NICE ENDING, SHAKESPEARE!",(Alex: We want you to name the play in...),NA,"Caesar:""No grave upon the earth shall clip in it A pair so famous... see High order in this great solemnity""",Antony and Cleopatra,NA
2015-05-01,DJ,WARSAW PACT ALUMNI NATIONS,,1200,This onetime Warsaw Pact member has since split into 2 countries,Czechoslovakia,NA
2015-05-01,DJ,RHYME SCHOOL,"(Alex: Because each correct response in that category will rhyme with the word ""school"".)",1200,Silk or nylon netting used to make veils & gowns,tulle,NA
2015-05-01,DJ,"TV ""NIGHT""",,1600,Peter Krause & Josh Charles played co-anchors on this show set at the CSC Network,Sports Night,NA
2015-05-01,DJ,SCALY CRITTERS,,1600,This type of lizard likes to puff up the scaled membrane around its head when it gets scared,a frilled lizard,http://www.j-archive.com/media/2015-05-01_DJ_27.wmv
2015-05-01,DJ,RELIGION,,1600,The 10 traditional gurus of this religion include Guru Nanak & Guru Singh,Sikhism,NA
2015-05-01,DJ,"NICE ENDING, SHAKESPEARE!",(Alex: We want you to name the play in...),1600,"Benedick:""Strike up, pipers!""",Much Ado About Nothing,NA
2015-05-01,DJ,WARSAW PACT ALUMNI NATIONS,,1600,This Balkan country was ruled by former college professor Enver Hoxha for 40 years,Albania,NA
2015-05-01,DJ,RHYME SCHOOL,"(Alex: Because each correct response in that category will rhyme with the word ""school"".)",1600,Unit of work or energy equivalent to a newton-meter,a joule,NA
2015-05-01,DJ,"TV ""NIGHT""",,2000,"After ""The Twilight Zone"", Rod Serling had this 1970s supernatural anthology series",Night Gallery,NA
2015-05-01,DJ,SCALY CRITTERS,,NA,"Due to microscopic scales, the name of this order, including moths & butterflies, means ""scaly winged"" in Greek",Lepidoptera,NA
2015-05-01,DJ,RELIGION,,2000,"In 1959, the religious leader seen here brought this influential technique to the West",Transcendental Meditation,http://www.j-archive.com/media/2015-05-01_DJ_11.jpg
2015-05-01,DJ,"NICE ENDING, SHAKESPEARE!",(Alex: We want you to name the play in...),2000,"Lucius:""As for that ravenous tiger, Tamora... Her life was beastly... And being dead, let birds on her take pity""",Titus Andronicus,NA
2015-05-01,DJ,WARSAW PACT ALUMNI NATIONS,,2000,Its citizens called it the DDR; we called it this,East Germany,NA
2015-05-01,DJ,RHYME SCHOOL,"(Alex: Because each correct response in that category will rhyme with the word ""school"".)",2000,English mathematician who created a branch of algebra,(George) Boole,NA
2015-05-01,FJ,VICE PRESIDENTS,,NA,"Of the 5 former vice presidents still living, he held the office the earliest",Walter Mondale,NA
