date,round,category,comment,value,clue,response,link
2015-05-04,J,MAY THE 4th BE WITH YOU,,200,"May 4, 1904:Charles Rolls meets this man at a Manchester hotel; their first car will boost 10 horsepower",(Henry) Royce,NA
2015-05-04,J,INTERNET SHORTHAND,,200,"E2EG:This kind of ""grin""",ear-to-ear,NA
2015-05-04,J,NEWS ANCHORS,,200,"""The View"" of her career in ""20/20"" hindsight shows she started as a news writer before her historic anchoring job",Barbara Walters,NA
2015-05-04,J,THE MIDWEST,,200,Hold on to your stomachs!  One of these at Cedar Point in Ohio reaches a speed of 120 miles per hour,a roller coaster,NA
2015-05-04,J,I SAY IT'S SPINACH,,200,I don't care if the first recorded description of these dates to 1587; take them back to Belgium!,Brussels sprouts,NA
2015-05-04,J,"THE ""L"" WITH IT",,200,It's a tennis stroke lofted over an opponent's head,a lob,NA
2015-05-04,J,MAY THE 4th BE WITH YOU,,400,"May 4, 1626:This Dutchman arrives in Manhattan; he likes what he sees & buys it for $24",(Peter) Minuit,NA
2015-05-04,J,INTERNET SHORTHAND,,400,"QAP:At this speed, please",quickly as possible,NA
2015-05-04,J,NEWS ANCHORS,,400,"After leaving the NBC anchor chair in 2004, he briefly hosted ""Meet the Press""",Tom Brokaw,NA
2015-05-04,J,THE MIDWEST,,400,"You'd be hard-pressed to find one in the state, but the critter seen here gave a nickname to this state",Michigan,http://www.j-archive.com/media/2015-05-04_J_12.jpg
2015-05-04,J,I SAY IT'S SPINACH,,400,"You can tell me it's this dark green vegetable with edible florets & an Italian name, but I'm still not gonna eat it",broccoli,NA
2015-05-04,J,"THE ""L"" WITH IT",,400,"Before ""car"", it means a vehicle for hire, such as a limo",livery,NA
2015-05-04,J,MAY THE 4th BE WITH YOU,,600,"1932:After getting 11 years for income tax evasion, he enters prison",Al Capone,NA
2015-05-04,J,INTERNET SHORTHAND,,600,"NIFOC:In this condition ""in front of computer""",naked,NA
2015-05-04,J,NEWS ANCHORS,,600,"This ex-anchor of Fox News' ""Special Report"" is now the network's senior political analyst",Brit Hume,NA
2015-05-04,J,THE MIDWEST,,600,The Telegraph Herald in Dubuque traces its beginnings to 1836 & this state's first newspaper,Iowa,NA
2015-05-04,J,I SAY IT'S SPINACH,,600,"So James Beard said this ""chilly"" lettuce has a ""wonderfully crisp texture"", so what--put it back in the freezer!",iceberg,NA
2015-05-04,J,"THE ""L"" WITH IT",,600,"A plumber knows this item preceded ""cinch"" to denote a certainty",a lead pipe,NA
2015-05-04,J,MAY THE 4th BE WITH YOU,,800,"1961:The start of the first freedom ride, organized by the civil rights group ""CORE"", the Congress of this",Racial Equality,NA
2015-05-04,J,INTERNET SHORTHAND,,800,"FHO:""Friends"" doing this",hanging out,NA
2015-05-04,J,NEWS ANCHORS,,800,In 2011 he stepped down after 36 years anchoring or co-anchoring PBS' newscast,(Jim) Lehrer,NA
2015-05-04,J,THE MIDWEST,,800,"Once known as ""America's Air Capital"", this city in Kansas is the base of Koch Industries",Wichita,NA
2015-05-04,J,I SAY IT'S SPINACH,,800,"You can call it ""liberty cabbage"" & tell me they ate it in ancient Rome, but I'm not touching that fermented slop",sauerkraut,NA
2015-05-04,J,"THE ""L"" WITH IT",,800,"In the end, a good shoemaker sticks to this wooden model of a foot",a last,NA
2015-05-04,J,MAY THE 4th BE WITH YOU,,1000,"May 4, 1886:7 policemen die in this riot in Chicago after someone throws a bomb",the Haymarket Riot (Haymarket Square accepted),NA
2015-05-04,J,INTERNET SHORTHAND,,1000,"YGTI:""You get"" this",the idea,NA
2015-05-04,J,NEWS ANCHORS,,1000,"(I'm David Muir.)  When I became the anchor of ABC's ""World News Tonight"", I was the youngest network news anchor since this man, a hero of mine; he first got the same gig in 1965",Peter Jennings,http://www.j-archive.com/media/2015-05-04_J_30.jpg
2015-05-04,J,THE MIDWEST,,NA,"In a 2013 article Milwaukee's mayor protested the term this ""Belt"", saying ""Our industry isn't... dying""",Rust Belt,NA
2015-05-04,J,I SAY IT'S SPINACH,,1000,"They may be these ""greens"", kale's cousins with different leaf structure; they're still going in the trash",collard greens,NA
2015-05-04,J,"THE ""L"" WITH IT",,1000,"My dearest Millicent, if you take this alcoholic tincture of opium for your neuralgia, use just a drop",a laudanum,NA
2015-05-04,DJ,PAINT BY NUMBERS,,400,"""Three Dancers"" & ""Three Musicians"" are both Cubist works of the 1920s by him",Picasso,NA
2015-05-04,DJ,GAMBLING WORDS,,400,A metal rod for stirring a fire,poker,NA
2015-05-04,DJ,LAKES & RIVERS,,400,"According to Maori legend, this country's Lake Manapouri was formed by the tears of dying sisters",New Zealand,NA
2015-05-04,DJ,STAMPS,,400,The Winter Fun series includes making a snowman & making one of these by lying on the ground,a snow angel,NA
2015-05-04,DJ,CHARACTERS FROM AMERICAN LIT,,400,He is Scarlett O'Hara's third husband,Rhett Butler,NA
2015-05-04,DJ,GRAMMY WINNERS,,400,"The leader in egg-shaped travel, she fed ""The Fame Monster"" to win 2010's Best Pop Vocal Album",Lady Gaga,NA
2015-05-04,DJ,PAINT BY NUMBERS,,800,"This pop artist's ""Orange Disaster #5"" is actually 15 repeated images of an electric chair",Warhol,NA
2015-05-04,DJ,GAMBLING WORDS,,800,"Fritos, for example",chips,NA
2015-05-04,DJ,LAKES & RIVERS,,800,"The Ravi, as in Shankar, is a major tributary of this river that winds from Tibet to Pakistan",the Indus,NA
2015-05-04,DJ,STAMPS,,800,The songbirds series includes this state bird seen here,the Baltimore oriole,http://www.j-archive.com/media/2015-05-04_DJ_12a.jpg
2015-05-04,DJ,CHARACTERS FROM AMERICAN LIT,,800,"The first word in ""Tom Sawyer"" is uttered by this woman, his aunt & guardian",Aunt Polly,NA
2015-05-04,DJ,GRAMMY WINNERS,,800,"2000's Best Dance Recording went to the Baha Men, for (repeatedly!) asking this musical question--did we ever find out?","""Who Let The Dogs Out?""",NA
2015-05-04,DJ,PAINT BY NUMBERS,,1200,Here's her take on three zinnias,Georgia O\'Keeffe,http://www.j-archive.com/media/2015-05-04_DJ_26.jpg
2015-05-04,DJ,GAMBLING WORDS,,1200,"A type of ""viper"" with heat-sensing indentations",pit,NA
2015-05-04,DJ,LAKES & RIVERS,,1200,"(Kelly of the Clue Crew reports from Switzerland.)  Europe's palace of nations, the UN's second biggest facility, stands in the 46 hectare Ariana Park with amazing views of this lake",Lake Geneva,http://www.j-archive.com/media/2015-05-04_DJ_09a.jpg
2015-05-04,DJ,STAMPS,,1200,"4 circular stamps depict different designs of this, the spotlight Commissioner Gordon used in Gotham's night sky",the Bat-Signal,NA
2015-05-04,DJ,CHARACTERS FROM AMERICAN LIT,,1200,"Natty Bumppo, a character in ""The Leatherstocking Tales"", was partly based on this Kentucky frontiersman",Daniel Boone,NA
2015-05-04,DJ,GRAMMY WINNERS,,1200,"To Kanye West's dismay, this man's ""Morning Phase"" was named Album of the Year in 2015",Beck,NA
2015-05-04,DJ,PAINT BY NUMBERS,,1600,"His ""Autumn Rhythm (Number 30)"" is on display at the Met in New York City",Jackson Pollock,NA
2015-05-04,DJ,GAMBLING WORDS,,1600,"This container can be found after ""lobster"" or ""chamber""",pot,NA
2015-05-04,DJ,LAKES & RIVERS,,1600,"Drought has depleted this lake, the USA's largest man-made reservoir & a major source of Las Vegas' water",Lake Mead,NA
2015-05-04,DJ,STAMPS,,1600,"The stamp seen here commemorates the Battle of Mobile Bay, so that's the fleet of this Union admiral",Farragut,http://www.j-archive.com/media/2015-05-04_DJ_29a.jpg
2015-05-04,DJ,CHARACTERS FROM AMERICAN LIT,,NA,"Seen here, MGM executive Irving Thalberg was the basis for Monroe Stahr in this F. Scott Fitzgerald novel",The Last Tycoon,http://www.j-archive.com/media/2015-05-04_DJ_16.jpg
2015-05-04,DJ,GRAMMY WINNERS,,1600,"Kimbra & this man were 2012's Best Pop Duo; remember him?  Or is he ""Somebody That I Used To Know""?",Gotye,NA
2015-05-04,DJ,PAINT BY NUMBERS,,2000,"Here's ""No. 8, 1952"", an oil painting by this Russian-born American painter",(Mark) Rothko,http://www.j-archive.com/media/2015-05-04_DJ_28.jpg
2015-05-04,DJ,GAMBLING WORDS,,2000,"A hill with a steep face, such as Coogan's",bluff,NA
2015-05-04,DJ,LAKES & RIVERS,,2000,"Inuvik, Northwest Territories, Canada, 2 degrees above the Arctic Circle, lies on this river's delta",the MacKenzie River,NA
2015-05-04,DJ,STAMPS,,NA,The colors of the gay pride flag adorn the stamp featuring this slain politician,(Harvey) Milk,NA
2015-05-04,DJ,CHARACTERS FROM AMERICAN LIT,,2000,"In ""The Good Earth"", O-lan is married to this peasant farmer",Wang Lung,NA
2015-05-04,DJ,GRAMMY WINNERS,,2000,"2006's Best Pop Collaboration with Vocals went to Tony Bennett & this other music legend for ""For Once In My Life""",Stevie Wonder,NA
2015-05-04,FJ,CONSERVATION ORGANIZATIONS,,NA,Harriet Hemenway's boycott of the feathered hats of her social circle inspired the 1905 founding of this,the Audubon Society,NA
