date,round,category,comment,value,clue,response,link
1990-02-28,J,EARLY AMERICA,,100,In 1790 the 1st of these was issued; it went to Samuel Hopkins of Vermont for a new method of making potash,a patent,NA
1990-02-28,J,THE COMICS,,100,"From 1913-45 Arthur ""Pop"" Momand drew a comic strip called ""Keeping Up with"" them",the Joneses,NA
1990-02-28,J,"""H"" ON THE MAP",,100,This section of San Francisco was a hotbed of the hippie movement in the late 1960s,Haight-Ashbury,NA
1990-02-28,J,PERFUME,,100,"In a woman's perfume, this word precedes ""Secret""; in a man's cologne, it comes before ""Copenhagen""",Royal,NA
1990-02-28,J,WORDS,,100,"Vinyl & vintage are both derived from ""vinum"", the Latin word for this",grape,NA
1990-02-28,J,THE SPORT PLAYED,"(Alex: We'll give you the names of individuals, you have to identify the sport.)",100,"Isiah Thomas,Patrick Ewing &Manute Bol",basketball,NA
1990-02-28,J,EARLY AMERICA,,200,"It's ""Common Sense"" that he was the 1st to write an article regarding women's rights in America, in 1775",Thomas Paine,NA
1990-02-28,J,THE COMICS,,200,Jerome Siegel & Joe Shuster created this superhero when they were teenagers,Superman,NA
1990-02-28,J,"""H"" ON THE MAP",,200,"The name of this mountain range comes from the Sanskrit word for ""abode of snow""",Himalayas,NA
1990-02-28,J,PERFUME,,200,A huge pair of lips adorns bottles of this late Spanish surrealist's perfume,Salvador Dalí,NA
1990-02-28,J,WORDS,,200,"Meaning ""light bringer"", it was originally the Latin name for the Morning Star, not Satan",Lucifer,NA
1990-02-28,J,THE SPORT PLAYED,"(Alex: We'll give you the names of individuals, you have to identify the sport.)",200,"John Elway,Lawrence Taylor &Marcus Allen",football,NA
1990-02-28,J,EARLY AMERICA,,300,"Folk hero who became widely known thru the book ""Discovery, Settlement & Present State of Kentucky""",Daniel Boone,NA
1990-02-28,J,THE COMICS,,300,"This expression for newspaper sensationalism came from ""The Yellow Kid"" which ran in the N.Y. World",yellow journalism,NA
1990-02-28,J,"""H"" ON THE MAP",,300,"Also called the Yellow River, it flows over 3,000 miles to the Gulf of Chihli",Hwang-Ho,NA
1990-02-28,J,PERFUME,,NA,"This singer's new perfume is called ""Only"" & he might dedicate it by singing the following:""To all the girls who cared for me, and filled my nights with ecstasy...""",Julio Iglesias,NA
1990-02-28,J,WORDS,,300,"This English cry probably comes from the French cry ""taiaut"", used to excite the hounds when deer hunting",Tally-ho!,NA
1990-02-28,J,THE SPORT PLAYED,"(Alex: We'll give you the names of individuals, you have to identify the sport.)",300,"Mike Schmidt,Christy Mathewson &Ernie Banks",baseball,NA
1990-02-28,J,EARLY AMERICA,,400,"In the 18th c. William Savery, John Goddard & Duncan Phyfe became famous in this field",furniture making,NA
1990-02-28,J,THE COMICS,,400,The Dale Messick strip about this red-haired reporter came with cut-out paper doll outfits for her,Brenda Starr,NA
1990-02-28,J,"""H"" ON THE MAP",,400,It's the southernmost & westernmost major city in the U.S.,"Honolulu, Hawaii",NA
1990-02-28,J,PERFUME,,400,"Geoffrey Beene's perfume named for this color didn't succeed, but now Giorgio is selling 1 with the same name",red,NA
1990-02-28,J,WORDS,,400,"This type of tree from the Greek kalyptein, to cover, covers over 500 species",eucalyptus,NA
1990-02-28,J,THE SPORT PLAYED,"(Alex: We'll give you the names of individuals, you have to identify the sport.)",400,"Rick Mears,Darrell Waltrip &Al Unser",auto racing,NA
1990-02-28,J,EARLY AMERICA,,500,"New Yorker who wrote at least 50 of the 85 ""Federalist Papers""",Alexander Hamilton,NA
1990-02-28,J,THE COMICS,,500,A 1960 No. 1 hit song was based on this V.T. Hamlin cave man strip,Alley Oop,NA
1990-02-28,J,"""H"" ON THE MAP",,500,"This N. American lake is said to have more islands than any other lake in the world, some 30,000",Lake Huron,NA
1990-02-28,J,PERFUME,,500,These 2 mammals are pictured on boxes of Lauren perfume,horse & man,NA
1990-02-28,J,WORDS,,500,"A Savoyard is a fan of this duo's works, which were 1st presented at the Savoy Theater",Gilbert & Sullivan,NA
1990-02-28,J,THE SPORT PLAYED,"(Alex: We'll give you the names of individuals, you have to identify the sport.)",500,"Mark Roth,Marshall Holman &Nelson Burton Jr.",bowling,NA
1990-02-28,DJ,MYTHS & LEGENDS,,200,"Our word museum came from places associated with this group that included Erato, Calliope & Clio",the Muses,NA
1990-02-28,DJ,MAMMALS,,200,"These flying mammals aren't really ""blind""; most have small eyes concealed by fur",bats,NA
1990-02-28,DJ,ARCHITECTURE,,200,Politician Andrew Hamilton designed this building that housed the Liberty Bell,the Old Philadelphia State House,NA
1990-02-28,DJ,WASHINGTON STATE,,200,The country's 1st municipal monorail line was built for this 1962 event,the 1962 Seattle World\'s Fair,NA
1990-02-28,DJ,ACTORS & ACTRESSES,,200,"In jr. high school this ""Rambo"" star was voted the student most likely to end up in the electric chair",Sylvester Stallone,NA
1990-02-28,DJ,REFERENCE BOOKS,,200,"Her granddaughter-in-law, Elizabeth, has updated her book on etiquette",Emily Post,NA
1990-02-28,DJ,MYTHS & LEGENDS,,400,This Phrygian king who had the power to turn all into gold was later given donkey ears by an angry Apollo,King Midas,NA
1990-02-28,DJ,MAMMALS,,400,"These ""river"" mammals secrete a pinkish fluid that makes them appear to be sweating blood",hippos,NA
1990-02-28,DJ,ARCHITECTURE,,400,"Metal beams, electric motors & this invention made the construction of skyscrapers possible",the elevator,NA
1990-02-28,DJ,WASHINGTON STATE,,400,"Carbon, one of these on Mt. Ranier, is over 6 miles long",a glacier,NA
1990-02-28,DJ,ACTORS & ACTRESSES,,400,"His son Patrick appeared with him in ""The Searchers"" & ""The Comancheros""",John Wayne,NA
1990-02-28,DJ,REFERENCE BOOKS,,400,Flemish cartographer Gerardus Mercator was the 1st to call a book of maps this,an atlas,NA
1990-02-28,DJ,MYTHS & LEGENDS,,NA,"He was the Greek equivalent of Cupid, the Roman god of love",Eros,NA
1990-02-28,DJ,MAMMALS,,600,This most complex of mammalian sense organs sits in a bony socket,eyes,NA
1990-02-28,DJ,ARCHITECTURE,,600,In 1947 architects from 5 countries were engaged to design this complex,the United Nations headquarters,NA
1990-02-28,DJ,WASHINGTON STATE,,600,"This pres. may not be famous for much, but he did sign the 1853 bill creating the Washington Territory",Millard Fillmore,NA
1990-02-28,DJ,ACTORS & ACTRESSES,,600,He was a trapeze artist & a model before he played the Lone Ranger on TV,Clayton Moore,NA
1990-02-28,DJ,REFERENCE BOOKS,,600,Collier's calls it the most quoted of Shakespeare's plays & it fills almost 8 pages in Bartlett's,Hamlet,NA
1990-02-28,DJ,MYTHS & LEGENDS,,800,"Roman goddess of crafts & war, she was identified with the Greek Athena, but was probably native to Italy",Minerva,NA
1990-02-28,DJ,MAMMALS,,800,Anteaters feed mainly on ants & these other insects,termites,NA
1990-02-28,DJ,ARCHITECTURE,,NA,"The world's largest church, newly opened in the Ivory Coast, is said to resemble this 1, now 2nd largest",St. Peter\'s Basilica,NA
1990-02-28,DJ,WASHINGTON STATE,,800,"Its state tree, the western hemlock, helps give Washington this nickname","""The Evergreen State""",NA
1990-02-28,DJ,ACTORS & ACTRESSES,,800,"Kate Hepburn said of this dance team's mystique, ""He gives her class and she gives him sex""",Fred Astaire & Ginger Rogers,NA
1990-02-28,DJ,REFERENCE BOOKS,,800,Webster's Elementary Spelling Book was better known by this more colorful name,"""The Blue-Back Speller""",NA
1990-02-28,DJ,MYTHS & LEGENDS,,1000,The killing of the god of sunlight by this Norse god of mischief caused long winter nights,Loki,NA
1990-02-28,DJ,MAMMALS,,1000,"Despite their incredibly long necks, giraffes have only this many neck bones, the same as humans",7,NA
1990-02-28,DJ,ARCHITECTURE,,1000,Few examples remain of China's early architecture because most of it was made of this material,wood,NA
1990-02-28,DJ,WASHINGTON STATE,,1000,"Named for the nearby mountains, this city has an oyster named for it",Olympia (named for the Olympic Mountains),NA
1990-02-28,DJ,ACTORS & ACTRESSES,,1000,"On TV he's played RFK in ""The Missiles of October"" & JFK in the miniseries ""Kennedy""",Martin Sheen,NA
1990-02-28,DJ,REFERENCE BOOKS,,1000,Sir George Grove is most famous for his massive dictionary on this subject,music & musicians,NA
1990-02-28,FJ,WORLD TRADE,,NA,3 of the 5 founding members of OPEC,"(3 of) Iran, Iraq, Kuwait, Saudi Arabia & Venezuela",NA
