date,round,category,comment,value,clue,response,link
2015-06-04,J,HOW TO DRAIN YOUR FLAGON,,200,"This ""King of Beers"" says it has ""a delicate malt sweetness and balanced bitterness""",Budweiser,NA
2015-06-04,J,WRITERS FIRST NAME'S THE SAME,,200,Eliot &Sand,George,NA
2015-06-04,J,"""ICE"" PACK",,200,"It can precede admiral, squad or versa",vice,NA
2015-06-04,J,SOURCE OF THE LATE NIGHT BIT,(Alex: You name the late night host who is responsible for those bits.),200,"""Jaywalking""",Jay Leno,NA
2015-06-04,J,FUN WITH COLORS,,200,"Possibly from the Latin for ""sky"", cerulean is a shade of this color",blue,NA
2015-06-04,J,THE SOUTH PACIFIC,,200,"(Sarah of the Clue Crew reports from off the coast of Mangareva Island.)  Mangareva Island was part of a volcano that blew its top & collapsed, allowing a lagoon to form in this central part of the volcano, Spanish for cauldron",caldera,http://www.j-archive.com/media/2015-06-04_J_21.jpg
2015-06-04,J,HOW TO DRAIN YOUR FLAGON,,400,"Alsace produces yummy pinot gris; in northern Italy, the same grape is called this",pinot grigio,NA
2015-06-04,J,WRITERS FIRST NAME'S THE SAME,,400,Sitwell &Wharton,Edith,NA
2015-06-04,J,"""ICE"" PACK",,400,In social gatherings this type of opening line is used to ease tension,an icebreaker,NA
2015-06-04,J,SOURCE OF THE LATE NIGHT BIT,(Alex: You name the late night host who is responsible for those bits.),400,"""Freestylin' with the Roots""",Jimmy Fallon,NA
2015-06-04,J,FUN WITH COLORS,,400,It can also mean a place that's extremely putt upon,a green,NA
2015-06-04,J,THE SOUTH PACIFIC,,400,"(Sarah of the Clue Crew reports from the South Pacific, wearing flowers on her head and around her neck.)  As in Hawaii, flowers are a symbol of welcome in this capital of Tahiti",Papeete,http://www.j-archive.com/media/2015-06-04_J_22.jpg
2015-06-04,J,HOW TO DRAIN YOUR FLAGON,,600,The two most popular types of port are the tawny & this sweeter one named for its color,ruby,http://www.j-archive.com/media/2015-06-04_J_13a.jpg
2015-06-04,J,WRITERS FIRST NAME'S THE SAME,,600,McCullough &Sedaris,David,NA
2015-06-04,J,"""ICE"" PACK",,600,3 times,thrice,NA
2015-06-04,J,SOURCE OF THE LATE NIGHT BIT,(Alex: You name the late night host who is responsible for those bits.),600,"""Celebrities Read Mean Tweets""",Jimmy Kimmel,NA
2015-06-04,J,FUN WITH COLORS,,600,"The Cincinnati Bengals have used black, white & this as their team colors since 1968",orange,NA
2015-06-04,J,THE SOUTH PACIFIC,,600,"(Sarah of the Clue Crew reports from off the coast of Bora Bora.)  The wide-spreading fins of this ray that's common in Polynesian waters led to its name, a Spanish word for blanket",manta,http://www.j-archive.com/media/2015-06-04_J_23.wmv
2015-06-04,J,HOW TO DRAIN YOUR FLAGON,,800,It took a while to drain your flagon after pouring a 25.4-ounce can of this Australian beer that hit U.S. shelves in 1972,Foster\'s,NA
2015-06-04,J,WRITERS FIRST NAME'S THE SAME,,800,Wise Brown &Atwood,Margaret,NA
2015-06-04,J,"""ICE"" PACK",,800,"This verb means to join at the ends: film or rope, for example",splice,NA
2015-06-04,J,SOURCE OF THE LATE NIGHT BIT,(Alex: You name the late night host who is responsible for those bits.),800,"""Carnac the Magnificent""",Johnny Carson,NA
2015-06-04,J,FUN WITH COLORS,,800,"The color with the shortest wavelength in the visible spectrum, it appears next to indigo in a rainbow",violet,NA
2015-06-04,J,THE SOUTH PACIFIC,,800,"(Sarah of the Clue Crew reports from Tahiti.)  In 1891, this artist left France seeking a tropical paradise where he could paint and live on fish & fruit; he eventually arrived in Tahiti, living in a bamboo hut near here where he painted the sea, the landscape & the people around him",Gauguin,http://www.j-archive.com/media/2015-06-04_J_24a.jpg
2015-06-04,J,HOW TO DRAIN YOUR FLAGON,,1000,"It got a bad rap in the film ""Sideways"", but wine.com says it's the top grape for the Right Bank of Bordeaux",Merlot,NA
2015-06-04,J,WRITERS FIRST NAME'S THE SAME,,1000,Chopin &DiCamillo,Kate,NA
2015-06-04,J,"""ICE"" PACK",,1000,"It was so-named because its flavor resembles a combination of cloves, cinnamon & nutmeg",allspice,NA
2015-06-04,J,SOURCE OF THE LATE NIGHT BIT,(Alex: You name the late night host who is responsible for those bits.),1000,"""Will It Float?""",Letterman,NA
2015-06-04,J,FUN WITH COLORS,,1000,"A great horned owl has large eyes with irises of this color, which helps amplify incoming light",yellow,NA
2015-06-04,J,THE SOUTH PACIFIC,,NA,(Sarah of the Clue Crew reports from the South Pacific.)  These stone statues seen throughout the islands may represent deified ancestors in Tahitian mythology & are often placed outside of temples as protection,tikis,http://www.j-archive.com/media/2015-06-04_J_25.jpg
2015-06-04,DJ,SAME FIRST & LAST LETTER,,400,"Sadly, Mrs. McKinley became one September 14, 1901",widow,NA
2015-06-04,DJ,MYTHOLOGY,,400,"Norse goddesses called norns include 3 who decide men's fates, each in charge of one of these 3 aspects of time","past, present, future",NA
2015-06-04,DJ,IN SO MANY WORDS,,400,"3 words:George Mallory's 1923 reply to ""Why did you want to climb Mt. Everest?""","""Because it\'s there""",NA
2015-06-04,DJ,LET'S DUKE IT OUT,,400,"In the early 17th c. the Duke de Lerma helped expel the Moriscos, or Christian Moors, from this country",Spain,NA
2015-06-04,DJ,A FIFTH OF (COLIN) FIRTH,,400,Colin emerged as a bona fide heartrhrob after his wet shirt scene in this BBC adaptation,Pride & Prejudice,NA
2015-06-04,DJ,"GEOGRAPH-""E""","(Alex: That ""E"" will come at the end of each correct response.)",400,The North Pole is above this 2-word delineator of Earth's northern frigid zone,the Arctic Circle,NA
2015-06-04,DJ,SAME FIRST & LAST LETTER,,800,"Unburnable, like some safes",fireproof,NA
2015-06-04,DJ,MYTHOLOGY,,800,This father of Icarus was hired to construct the Labyrinth & was then held prisoner,Daedalus,NA
2015-06-04,DJ,IN SO MANY WORDS,,800,5 words:2002 Rock & Roll Hall of Fame inductees seen here,Tom Petty & the Heartbreakers,http://www.j-archive.com/media/2015-06-04_DJ_22.jpg
2015-06-04,DJ,LET'S DUKE IT OUT,,800,"In 1880, 1886 & 1887 British statesman the Duke of Devonshire turned this job down--who needs the headaches?",the prime minister,NA
2015-06-04,NA,NA,NA,NA,NA,NA,NA
2015-06-04,DJ,"GEOGRAPH-""E""","(Alex: That ""E"" will come at the end of each correct response.)",800,A meridian is a line of this,longitude,NA
2015-06-04,DJ,SAME FIRST & LAST LETTER,,1200,"From the Greek for ""time"", this adjective can describe a medical disorder of long duration",chronic,NA
2015-06-04,DJ,MYTHOLOGY,,NA,This Egyptian god's evil brother Set tricked him into lying down in a box that was thrown into the river,Osiris,NA
2015-06-04,DJ,IN SO MANY WORDS,,1200,3 words:Classic Avis slogan extolling the company work ethic,"""We try harder""",NA
2015-06-04,DJ,LET'S DUKE IT OUT,,1200,"Second Consul of the French Empire, the Duke de Parme helped draft this egalitarian (for males) 1804 code",the Napoleonic Code,NA
2015-06-04,NA,NA,NA,NA,NA,NA,NA
2015-06-04,DJ,"GEOGRAPH-""E""","(Alex: That ""E"" will come at the end of each correct response.)",1200,Scottsbluff & Fort Robinson are in this western extension of Nebraska,the panhandle,NA
2015-06-04,DJ,SAME FIRST & LAST LETTER,,1600,"It's a German word for a beer hall, often in a basement",Ratskeller,NA
2015-06-04,DJ,MYTHOLOGY,,1600,Athena gave this Gorgon slayer a shield to use as a mirror when confronting Medusa,Perseus,NA
2015-06-04,DJ,IN SO MANY WORDS,,1600,"2 words:""Silent Cal"" Coolidge's reply to a woman who'd bet she could get him to say at least 3 words","""You lose""",NA
2015-06-04,DJ,LET'S DUKE IT OUT,,NA,The Duke of Northumberland (1504-1553) arranged for his son to marry this unfortunate lady in 1553; oops,Lady Jane Grey,NA
2015-06-04,DJ,A FIFTH OF (COLIN) FIRTH,,1600,Colin Firth played Vermeer in this film with the name of a Vermeer painting,The Girl with the Pearl Earring,NA
2015-06-04,DJ,"GEOGRAPH-""E""","(Alex: That ""E"" will come at the end of each correct response.)",1600,Don't slip into this glacial fissure,a crevasse,NA
2015-06-04,DJ,SAME FIRST & LAST LETTER,,2000,"Not only are the three inner circles congruent, they're also this trig term to each other",tangent,http://www.j-archive.com/media/2015-06-04_DJ_15b.jpg
2015-06-04,DJ,MYTHOLOGY,,2000,The Romans equated this god with the Norse god Wotan; both lent their names to the same day of the week,Mercury,NA
2015-06-04,DJ,IN SO MANY WORDS,,2000,One word:The motto of ever-optimistic Rhode Island,"""Hope""",NA
2015-06-04,DJ,LET'S DUKE IT OUT,,2000,"Henry IV was just Henry Bolingbroke, Duke of Hereford, when he pushed this cousin off his throne",Richard II,NA
2015-06-04,DJ,A FIFTH OF (COLIN) FIRTH,,2000,"Amanda Bynes figures out that Colin Firth is her dad in this movie, also the name of a Christina Aguilera song",What a Girl Wants,NA
2015-06-04,DJ,"GEOGRAPH-""E""","(Alex: That ""E"" will come at the end of each correct response.)",2000,"A deep ravine or gulch, like the one mentioned in the name of a water impeder in Washington State",a coulee,NA
2015-06-04,FJ,NOTORIOUS 20th CENTURY NAMES,,NA,"Morton Sobell, a co-defendant with these 2, was also convicted but received a lighter sentence: 30 years in prison",Julius & Ethel Rosenberg,NA
