date,round,category,comment,value,clue,response,link
2015-06-23,J,NEW YORK POLITICIANS,,200,"As senator, she was appointed to the Armed Services panel, the first New Yorker to serve on the committee",Hillary Clinton,NA
2015-06-23,J,DISCOGRAPHIES,,200,"""Sonic Highways"":This Dave Grohl band",the Foo Fighters,NA
2015-06-23,J,6-LETTER WORDS,,200,Take stock--it's slang for both a watch & your heart,a ticker,NA
2015-06-23,J,TOOLS,,200,The crosscut type of this tool works best at a 45-degree angle using as much of the blade's length as you can,a saw,NA
2015-06-23,J,LITERARY CHARACTERS,,200,"Stuck in a trap, this Brer begged Brer Fox to hang, drown or skin him, but not to fling him into a briar patch",Brer Rabbit,NA
2015-06-23,J,SPOT THE IM‑PASTA,(Alex: We want you to [*]: the one item in the clue that is not a pasta.),200,"Conchiglie,consigliere,cappelletti",consigliere,NA
2015-06-23,J,NEW YORK POLITICIANS,,400,"Charles is his given name, but come on--who calls him ""Charles""?",Chuck Schumer (Charles Schumer accepted),http://www.j-archive.com/media/2015-06-23_J_04.jpg
2015-06-23,J,DISCOGRAPHIES,,400,"""Private Dancer"":This woman who can really move in high heels",Tina Turner,NA
2015-06-23,J,6-LETTER WORDS,,400,"A pit of slate, or game hunted with hounds",quarry,NA
2015-06-23,J,TOOLS,,400,"Used for cutting grain, it's a hooklike blade on a short handle & was a symbol of the Soviet Union",a sickle,NA
2015-06-23,J,LITERARY CHARACTERS,,400,"In ""The Iliad"" he kills the Trojan hero Hector",Achilles,NA
2015-06-23,J,SPOT THE IM‑PASTA,(Alex: We want you to [*]: the one item in the clue that is not a pasta.),400,"Manicotti,mineola,mostaccioli",Mineola,NA
2015-06-23,J,NEW YORK POLITICIANS,,600,"This 19th century man's ""ring"" plundered NYC of sums estimated between $30 & $200 million","(""Boss"") Tweed",NA
2015-06-23,J,DISCOGRAPHIES,,600,"""It's the Girls!"":This divine singer",Bette Midler,NA
2015-06-23,J,6-LETTER WORDS,,600,Canine term for a loudspeaker designed for low-frequency sounds,a woofer,NA
2015-06-23,J,TOOLS,,600,"When referring to coffee or pepper, a ""mill"" is one of these kitchen tools",a grinder,NA
2015-06-23,J,LITERARY CHARACTERS,,600,Evil Lord Voldemort in the Harry Potter books was originally this Hogwarts student,Tom Riddle,NA
2015-06-23,J,SPOT THE IM‑PASTA,(Alex: We want you to [*]: the one item in the clue that is not a pasta.),600,"Farandole, fideo, farfalloni",farandole,NA
2015-06-23,J,NEW YORK POLITICIANS,,800,"A philosophy of Republicans, or the party of Senator James L. Buckley & his brother, losing mayoral candidate William F. Buckley",conservative,NA
2015-06-23,J,DISCOGRAPHIES,,800,"""Houses of the Holy"":These rockers",Led Zeppelin,NA
2015-06-23,J,6-LETTER WORDS,,800,"From the French for ""to see"", it sounds much classier than its synonym Peeping Tom",voyeur,NA
2015-06-23,J,TOOLS,,800,It'll mean everything to me if you name this tool used to make little holes,an awl,http://www.j-archive.com/media/2015-06-23_J_29.jpg
2015-06-23,J,LITERARY CHARACTERS,,NA,This literary character's father works for Mr. Scrooge,Tiny Tim,NA
2015-06-23,J,SPOT THE IM‑PASTA,(Alex: We want you to [*]: the one item in the clue that is not a pasta.),800,"Tortiglioni,tortellini,tortoni",tortoni,NA
2015-06-23,J,NEW YORK POLITICIANS,,1000,"Nixon offered this ex-gov. who didn't defeat Truman the chief justice job in 1968, but he passed, saying he was too old",Dewey,NA
2015-06-23,J,DISCOGRAPHIES,,1000,"""In the Lonely Hour"":This neo-soul singer",Sam Smith,NA
2015-06-23,J,6-LETTER WORDS,,1000,"Lying on the back, face or front upward",supine,NA
2015-06-23,J,TOOLS,,1000,A treasure of the British Museum is a 1.2 million-year-old stone one of these tools found at Olduvai Gorge,an axe (a hatchet accepted),NA
2015-06-23,J,LITERARY CHARACTERS,,1000,She's the sister of Holden Caulfield & one of the few people he trusts,Phoebe,NA
2015-06-23,J,SPOT THE IM‑PASTA,(Alex: We want you to [*]: the one item in the clue that is not a pasta.),1000,"Campanelle, cavatelli, calamanco",calamanco,NA
2015-06-23,NA,NA,NA,NA,NA,NA,NA
2015-06-23,DJ,HISTORICAL FILMS,,400,"Clint Eastwood told the story of a WWII battle from the Japanese viewpoint in ""Letters from"" here",Iwo Jima,NA
2015-06-23,DJ,A WORLD OF ART,,400,"In the 1970s Australian artist John Olsen painted ""Salute to Five Bells"", a mural for this Sydney landmark",the Sydney Opera House,NA
2015-06-23,DJ,ALPHANUMERICS,,400,A young Anakin Skywalker created this droid to help his mother with household chores,C-3PO,NA
2015-06-23,DJ,U.S. AREAS & TERRITORIES,,400,"Hacienda Buena Vista, a restored 19th c. coffee plantation, is a must-see during a visit to Ponce in this commonwealth",Puerto Rico,NA
2015-06-23,DJ,"3-""SY""LLABLE WORDS","(Alex: Each correct response will begin with ""S-Y"" and contain three syllables.)",400,"Bisect the snowflake, & you'll see it has this quality",symmetry,http://www.j-archive.com/media/2015-06-23_DJ_16.jpg
2015-06-23,NA,NA,NA,NA,NA,NA,NA
2015-06-23,DJ,HISTORICAL FILMS,,800,Former Supreme Court justice Harry Blackmun had a small role in this 1997 film about a mutiny on a slave ship,Amistad,NA
2015-06-23,DJ,A WORLD OF ART,,800,The lesser known St. Roderick of Cordoba is depicted by one of this country's great 17th-century artists,Spain,http://www.j-archive.com/media/2015-06-23_DJ_12a.jpg
2015-06-23,DJ,ALPHANUMERICS,,800,"(Kelly of the Clue Crew reports from the Western Reserve Historical Society in Cleveland, OH.)  While many cars carry a standard V8 engine, the 1932 all-aluminum Peerless would blow them off the road by generating nearly 175 horsepower with this giant of an engine",a V16,http://www.j-archive.com/media/2015-06-23_DJ_19a.jpg
2015-06-23,DJ,U.S. AREAS & TERRITORIES,,800,The annual carnival on St. Thomas in this territory dates back to 1912 during the Danish occupation,the U.S. Virgin Islands,NA
2015-06-23,DJ,"3-""SY""LLABLE WORDS","(Alex: Each correct response will begin with ""S-Y"" and contain three syllables.)",800,A brief outline,a synopsis,NA
2015-06-23,DJ,LINES IN THE SAND,,1200,"""Like sands through"" this, ""so are the days of our lives"", intoned the voice of MacDonald Carey",the hourglass,NA
2015-06-23,DJ,HISTORICAL FILMS,,1200,"""55 Days at Peking"", starring Charlton Heston & David Niven, tells the story of this 1900 insurrection",the Boxer Rebellion,NA
2015-06-23,DJ,A WORLD OF ART,,1200,"The Rockefellers destroyed this Mexican's ""Man at the Crossroads"" mural for the RCA Building because it featured Lenin",Diego Rivera,NA
2015-06-23,DJ,ALPHANUMERICS,,1200,This section of the U.S. Internal Revenue Code sets out the requirements for tax exempt status for charities,501(c)(3),NA
2015-06-23,DJ,U.S. AREAS & TERRITORIES,,NA,In 1988 Congress authorized a natl. park in this territory south of the equator to preserve its rain forest,American Samoa,NA
2015-06-23,DJ,"3-""SY""LLABLE WORDS","(Alex: Each correct response will begin with ""S-Y"" and contain three syllables.)",1200,Name shared by a city in central New York & a city in southeast Sicily,Syracuse,NA
2015-06-23,DJ,LINES IN THE SAND,,1600,"In 1924, this pres. of China said the Chinese people didn't have a national spirit but were ""just a heap of loose sand""",Sun Yat-sen,NA
2015-06-23,DJ,HISTORICAL FILMS,,1600,"Paul Scofield won an Oscar for playing this historical role in ""A Man for All Seasons""",Thomas More,NA
2015-06-23,DJ,A WORLD OF ART,,1600,"He began painting ""The Falling Angel"" in 1923, shortly after emigrating from the Soviet Union; it was completed in 1947",Marc Chagall,NA
2015-06-23,DJ,ALPHANUMERICS,,NA,"The first swine flu, identified in 1930, was caused by this alphanumeric virus; in 2009 it was back",H1N1,NA
2015-06-23,DJ,U.S. AREAS & TERRITORIES,,1600,"Jarvis Island is a national wildlife refuge; so though way out in the Pacific, it's administered by this Cabinet dept.",the Department of the Interior,NA
2015-06-23,DJ,"3-""SY""LLABLE WORDS","(Alex: Each correct response will begin with ""S-Y"" and contain three syllables.)",1600,This person tries to gain an advantage by flattering influential persons,a sycophant,NA
2015-06-23,DJ,LINES IN THE SAND,,2000,"This Shelley poem ends, ""Round the decay of that colossal wreck... the lone and level sands stretch far away""","""Ozymandias""",NA
2015-06-23,DJ,HISTORICAL FILMS,,2000,"In this 1959 film actress Millie Perkins claims, ""I still believe... that people are really good at heart""",The Diary of Anne Frank,NA
2015-06-23,DJ,A WORLD OF ART,,2000,This Swiss-born artist painted camouflage on German airplanes during World War I,Paul Klee,NA
2015-06-23,DJ,ALPHANUMERICS,,2000,"Trainer Tony Horton created this alphanumeric ""Extreme Home Fitness"" regimen",P90X,NA
2015-06-23,DJ,U.S. AREAS & TERRITORIES,,2000,"In 2010 Eddie Baza Calvo, a Chamorro, was elected governor of this island",Guam,NA
2015-06-23,DJ,"3-""SY""LLABLE WORDS","(Alex: Each correct response will begin with ""S-Y"" and contain three syllables.)",2000,The higher number in 120/80 represents this type of blood pressure,systolic,NA
2015-06-23,FJ,FUN & GAMES,,NA,A standard chessboard has this many perimeter squares,28,NA
