date,round,category,comment,value,clue,response,link
1989-01-20,J,SCIENCE,,100,"If you want to hard-boil this bird's egg, set your timer for about 2 hours",ostrich,NA
1989-01-20,J,FOOTBALL,,100,In 1961 this Ohio city was chosen as the site for the Pro Football Hall of Fame,Canton,NA
1989-01-20,J,FASHION,,100,"Of short, long or just about anything, the 1 that's the ""in"" skirt length according to Paris",just about anything,NA
1989-01-20,J,AMERICAN REVOLUTION,,100,"New Jerseyites disguised as Indians burned this, unlike the Bostonians who dumped it in the harbor",tea,NA
1989-01-20,J,COUNTRY CROONERS,,100,"A top race car driver, he also raced to the top of the charts with ""El Paso"" in 1959",Marty Robbins,NA
1989-01-20,J,MORTAL MATTERS,,100,This ring buoy personal flotation device can prevent drowning; the candy of the same name can't,lifesaver,NA
1989-01-20,J,SCIENCE,,200,"Pollen grains are made in the anther of this, the male part of a flower",stamen,NA
1989-01-20,J,FOOTBALL,,200,"Christy Mathewson, a fullback for the Pittsburgh Stars in 1902, is better known as a star in this sport",baseball,NA
1989-01-20,J,FASHION,,200,"Neoprene is the newest fabric for female swimwear, tho it's long been used in this other water wear",scuba diving,NA
1989-01-20,J,AMERICAN REVOLUTION,,200,"By the time this country fought in our revolution, it was already at war with Britain",France,NA
1989-01-20,J,COUNTRY CROONERS,,200,"Though she's had 4 divorces, her 1968 ""D-I-V-O-R-C-E"" was the biggest one",Tammy Wynette,NA
1989-01-20,J,MORTAL MATTERS,,200,His preserved body lies in a glass casket that's viewed by 1000s each day in Moscow,Lenin,NA
1989-01-20,J,SCIENCE,,300,It's an alloy that contains 7.5% copper & 92.5% silver,sterling silver,NA
1989-01-20,J,FOOTBALL,,300,"NFL team which plays its home games in suburban Orchard Park, New York",Buffalo Bills,NA
1989-01-20,J,FASHION,,300,"If you're wearing British Knights, you're wearing a new brand of this type of shoe",athletic shoes,NA
1989-01-20,J,AMERICAN REVOLUTION,,300,He was the losing general in the Battles of Long Island & White Plains,George Washington,NA
1989-01-20,J,COUNTRY CROONERS,,300,"""Accidental"" nickname of Billy Craddock who's often called ""Mr. Country Rock""",Crash,NA
1989-01-20,J,MORTAL MATTERS,,NA,"Oath that includes the line ""I will give no deadly medicine to anyone if asked""",Hippocratic Oath,NA
1989-01-20,J,SCIENCE,,400,"1 of the 1st devices used to store an electric charge, this jar was named for a Dutch city",Leyden jar,NA
1989-01-20,J,FOOTBALL,,400,"Spanning 4 decades, the career of this former Oakland QB was the longest in pro football",George Blanda,NA
1989-01-20,J,FASHION,,400,"With discovery of America & its riches, this country replaced Italy as Europe's fashion center",Spain,NA
1989-01-20,J,AMERICAN REVOLUTION,,400,"The 1st American act of aggression was the capture of this fort by 100 of Ethan Allen's ""Boys""",Ticonderoga,NA
1989-01-20,J,COUNTRY CROONERS,,400,"If you ask him how long he plans to be on top of country music, he might say, ""Forever & Ever, Amen""",Randy Travis,NA
1989-01-20,J,MORTAL MATTERS,,400,"1988 Bruce Willis film with the line ""Would you like to go for D.J. where the scores can really change?""",Die Hard,NA
1989-01-20,J,SCIENCE,,500,This steel-making process involved blowing air through molten iron to oxidize impurities,(Sir Henry) Bessemer,NA
1989-01-20,J,FOOTBALL,,500,1 of the original members of the Pro Football Hall of Fame,George Halas,NA
1989-01-20,J,FASHION,,500,"Named for the baggage used, these road shows give customers 1st crack at a designer's line",trunk show,NA
1989-01-20,J,AMERICAN REVOLUTION,,500,The military post which Benedict Arnold planned to betray to the British,West Point,NA
1989-01-20,J,COUNTRY CROONERS,,500,"Singer/songwriter Rodney Crowell married ""money"" when he married this successful singer",Rosanne Cash,NA
1989-01-20,J,MORTAL MATTERS,,500,"""On the Feelings of"" this ""In Youth"", William Hazlitt wrote, ""No young man believes he shall ever die""",immortality,NA
1989-01-20,DJ,20th CENTURY PERSONALITIES,,200,In 1907 he escaped from chains after being underneath in San Francisco Bay for 2 min.,Harry Houdini,NA
1989-01-20,DJ,ACTRESSES & ROLES,,200,"She played her own mother in the TV movie ""Side By Side"": The True Story of the Osmond Family""",Marie Osmond,NA
1989-01-20,DJ,EGYPT,,200,"99% of Egypt's people live along the Suez Canal, the Mediterranean or this body of water",Nile,NA
1989-01-20,DJ,AVIATION,,200,The shortest flight you can take on American Airlines goes from Ft. Lauderdale to this nearby city,Miami,NA
1989-01-20,DJ,POETS,,200,He was a poet & a playwright as well as a Victorian minister,Disraeli,NA
1989-01-20,DJ,IN THE DICTIONARY,,200,"Originally a nickname for Robert, a ""dobbin"" is 1 of these animals",horse,NA
1989-01-20,DJ,20th CENTURY PERSONALITIES,,400,"1987 Current Biography listed this helicopter pilot's address as ""Buckingham Palace, London SW 1, England""",Prince Andrew (Duke of York),NA
1989-01-20,DJ,ACTRESSES & ROLES,,400,"In this movie musical, Eva Gabor was Louis Jourdan's mistress before he fell for Leslie Caron",Gigi,NA
1989-01-20,DJ,EGYPT,,400,Egypt became a republic in 1953 after army officers forced this king to give up the throne,Farouk,NA
1989-01-20,DJ,AVIATION,,400,In August 1988 the USSR freed Mathias Rust who had landed his plane here in 1987,Red Square,NA
1989-01-20,DJ,POETS,,400,"In ""Tales of a Wayside Inn"", he wrote about ""Ships that pass in the night""",Henry Wadsworth Longfellow,NA
1989-01-20,DJ,IN THE DICTIONARY,,400,"An intense feeling of repugnance & fear, or the genre of film that makes you experience it",horror,NA
1989-01-20,DJ,20th CENTURY PERSONALITIES,,600,Watergate Judge John Sirica was once a friend of this controversial Wisconsin senator,Joseph McCarthy,NA
1989-01-20,DJ,ACTRESSES & ROLES,,600,Karen Allen said she spent 2 weeks in a pit with thousands of snakes to make this 1981 adventure film,Raiders of the Lost Ark,NA
1989-01-20,DJ,EGYPT,,NA,1 of 3 men who each built one of the pyramids of Giza,(1 of) Cheops (Khufu) or (Khefren and Mykerinos),NA
1989-01-20,DJ,AVIATION,,600,Technical name for the main body of a plane to which the wings & tail are attached,fuselage,NA
1989-01-20,DJ,POETS,,600,This poet's great 14th century masterpiece helped establish Italian as a national language,Dante,NA
1989-01-20,DJ,IN THE DICTIONARY,,600,This verb can refer too preparing sodas or drying strips of meat,jerking,NA
1989-01-20,DJ,20th CENTURY PERSONALITIES,,NA,In 1949 this Gen. resigned as Sec'y of State but returned to the cabinet the next year as Sec'y of Defense,George Marshall,NA
1989-01-20,DJ,ACTRESSES & ROLES,,800,"In the 1953 film that won her an Oscar, Audrey Hepburn was on vacation in this city",Rome,NA
1989-01-20,DJ,EGYPT,,800,"According to World Book, this part of Egypt is in Asia",Sinai,NA
1989-01-20,DJ,AVIATION,,800,This city is planning to build a new airport to replace Stapleton,Denver,NA
1989-01-20,DJ,POETS,,800,This poet known for his odes was only 25 when he died of tuberculosis in 1821,Keats,NA
1989-01-20,DJ,IN THE DICTIONARY,,800,"From the Latin ""fuscare"", to darken, this verb means to confuse or make obscure",obfuscate,NA
1989-01-20,DJ,20th CENTURY PERSONALITIES,,1000,In 1962 he resigned as head of American Motors to successfully run for governor of Mich.,George Romney,NA
1989-01-20,DJ,ACTRESSES & ROLES,,1000,"She was one of ""The Witches of Eastwick"" before she was ""Married to the Mob""",Michelle Pfeiffer,NA
1989-01-20,DJ,EGYPT,,1000,"A popular way to see Cairo by night is to rent a felucca, which is this, & ask for one with a BBQ",boat,NA
1989-01-20,DJ,AVIATION,,1000,In 1927 Lindbergh ended his historic 33 1/2 hour flight at this field near Paris,La Bourget,NA
1989-01-20,DJ,POETS,,1000,"As a soldier he used alias Silas Tomkyn Comberbache, so he didn't have to change his monogram",Samuel Taylor Coleridge,NA
1989-01-20,DJ,IN THE DICTIONARY,,1000,"From the Turkish word for room ""odah"", it's a female slave or concubine",odalisque,NA
1989-01-20,FJ,U.S. STATES,,NA,This state's current license plate has a biplane pictured on it,North Carolina,NA
