date,round,category,comment,value,clue,response,link
2015-07-27,J,STATE OF THE ESTATE,(Alex: We'll give you the estate.),200,Hearst Castle,California,NA
2015-07-27,J,MY LITTLE PONY NAMES,,200,Nickname of Charles Luciano,Lucky,NA
2015-07-27,J,FOOD & DRINK,,200,"Served as appetizers, usually with a dip, crudites are raw these",vegetables,NA
2015-07-27,J,TECH SAVVY,,200,"If this happens to your cell phone, try leaving the frame & battery in uncooked rice",it getting wet,NA
2015-07-27,J,BIOGRAPHIES,,200,"He was the subject of a 2013 biography called ""A Curious Man""; believe it or not",(Robert) Ripley,NA
2015-07-27,J,IN B__W,,200,It's the sweet treat seen here,a bear claw,http://www.j-archive.com/media/2015-07-27_J_15.jpg
2015-07-27,J,STATE OF THE ESTATE,(Alex: We'll give you the estate.),400,George Washington's Mount Vernon,Virginia,NA
2015-07-27,J,MY LITTLE PONY NAMES,,400,"A player who hits the ball very hard, or the Louisville bat he uses",Slugger,NA
2015-07-27,J,FOOD & DRINK,,400,One story of how this fruit drink got its pink version involves a circus vendor & a pair of red tights soaking in water,lemonade,NA
2015-07-27,J,TECH SAVVY,,400,"If you'd prefer your buddy's Facebook photos not I.D. you as his wingman, turn off this feature",tagging (or auto-tagging),NA
2015-07-27,J,BIOGRAPHIES,,400,"This artist ""and the Pope's Ceiling"" tells the drama behind the making of a masterpiece",Michelangelo,NA
2015-07-27,J,IN B__W,,400,Familial relationship of Stanley Kowalski to Blanche DuBois,brother-in-law,NA
2015-07-27,J,STATE OF THE ESTATE,(Alex: We'll give you the estate.),600,Theodore Roosevelt's Sagamore Hill,New York,NA
2015-07-27,J,MY LITTLE PONY NAMES,,600,"In a fairy tale, she breaks into a house & sleeps on some beds",Goldilocks,NA
2015-07-27,J,FOOD & DRINK,,600,In this 2004 film Miles & Jack sip Pinot noir & wander the California wine country,Sideways,NA
2015-07-27,J,TECH SAVVY,,600,"This word also meaning ""an equal"" is the P in P2P file sharing",peer,NA
2015-07-27,J,BIOGRAPHIES,,600,"Chris Matthews chronicled the relationship between a Speaker of the House & Pres. Reagan in him ""and the Gipper""",Tip O\'Neill,NA
2015-07-27,J,IN B__W,,600,It's the architectural feature of the room seen here,bay window,http://www.j-archive.com/media/2015-07-27_J_18.jpg
2015-07-27,J,STATE OF THE ESTATE,(Alex: We'll give you the estate.),800,"Built by Alfred I. DuPont, Nemours Mansion",Delaware,NA
2015-07-27,J,MY LITTLE PONY NAMES,,800,Sea creature that adheres firmly to rocks & to the bottom of ships,Barnacle,NA
2015-07-27,J,FOOD & DRINK,,800,"By definition, in Italy it's what is served in a gelateria",ice cream (gelato accepted),NA
2015-07-27,J,TECH SAVVY,,800,"National Park fans will know that Apple's 2015 operating system is known as ""OS X"" this",Yosemite,NA
2015-07-27,J,BIOGRAPHIES,,800,"""The Secret History of"" this comics heroine is a bio of her creator William Marston, inventor of the lie detector",Wonder Woman,NA
2015-07-27,J,IN B__W,,800,"To confer upon, as a gift",bestow,NA
2015-07-27,J,STATE OF THE ESTATE,(Alex: We'll give you the estate.),1000,"The Vanderbilts' summer ""cottage"", The Breakers",Rhode Island,NA
2015-07-27,J,MY LITTLE PONY NAMES,,1000,Spinal Tap had several of these; one spontaneously combusted,Drummer,NA
2015-07-27,J,FOOD & DRINK,,1000,"During Hoover's 1928 presidential campaign, the Republicans promised one of these offerings",a chicken in every pot,NA
2015-07-27,J,TECH SAVVY,,1000,"It can mean to parody in a goofy way, or to deceptively send an email from someone else's address",spoof,NA
2015-07-27,J,BIOGRAPHIES,,NA,A biography of this nobleman goes beyond the boxing rules he devised & his accusations against Oscar Wilde,the Marquess of Queensberry,NA
2015-07-27,J,IN B__W,,1000,"As a noun, it's a surge of the sea; as a verb it means to puff out",billow,NA
2015-07-27,DJ,THE KNIGHTS TEMPLAR,,400,The Templars were formed in this city around 1120 to protect pilgrims left defenseless after crusaders went home,Jerusalem,NA
2015-07-27,DJ,COMPOUND WORDS,,400,On social media the abbreviation TBT means it's this kind of Thursday,throwback Thursday,NA
2015-07-27,DJ,GERMAN LIT,,400,A 13th century Gottfried von Strassburg story retells a Celtic tale of the doomed lovers Tristan & her,Isolde,NA
2015-07-27,DJ,"GEOGRAPHER'S ""D""ICTIONARY",,400,"To find this figure for Trebekistan, divide the population by the area",density,NA
2015-07-27,DJ,POP MUSIC,,400,"This first No. 1 hit by ABBA says ""Young and sweet, only 17""","""Dancing Queen""",NA
2015-07-27,DJ,IN COLOR,,400,"Ignored for almost 150 years, this U.S. military award was reintroduced on February 22, 1932",the Purple Heart,NA
2015-07-27,DJ,THE KNIGHTS TEMPLAR,,800,In the 1140s this was added to the Knights' white mantle as a symbol of Christian martyrdom,a (red) cross,NA
2015-07-27,DJ,COMPOUND WORDS,,800,Chris Christie gave this kind of address at the 2012 Republican National Convention,keynote,NA
2015-07-27,DJ,GERMAN LIT,,800,"He was original in extolling ""The Sorrows of Young Werther"", a novel in the form of letters, in 1774",Goethe,NA
2015-07-27,DJ,"GEOGRAPHER'S ""D""ICTIONARY",,800,"Down, down into this type of area in an ocean, like the 5,900-fathom Emden one near the Philippines",the deep,NA
2015-07-27,DJ,POP MUSIC,,800,"""Everything Has Changed"" is by Taylor Swift & this redheaded Brit",Ed Sheeran,NA
2015-07-27,DJ,IN COLOR,,800,"The Bible's ""Whatsoever ye would that men should do to you, do ye even so to them"" is known as this",the Golden Rule,NA
2015-07-27,DJ,THE KNIGHTS TEMPLAR,,1200,"Like an expert in chess, the highest authority in the Templars was called this; Jacques de Molay was the last",a Grand Master,NA
2015-07-27,DJ,COMPOUND WORDS,,1200,"Dale Evans' horse was named this, like a dairy drink",Buttermilk,NA
2015-07-27,DJ,GERMAN LIT,,1200,Oskar Matzerath is the musician who never grew up in this 1959 Gunter Grass book,The Tin Drum,NA
2015-07-27,DJ,"GEOGRAPHER'S ""D""ICTIONARY",,1200,"Yes, Chip, this term is used is used mainly in Northern England for a broad open valley",a dale,NA
2015-07-27,DJ,POP MUSIC,,1200,"Cat on ""Sam & Cat"", she had a Top 5 hit in 2014 with ""Break Free""",Ariana Grande,NA
2015-07-27,DJ,IN COLOR,,1200,"This animal was once thought to bear the Devil's mark in its wool, which is perhaps why it came to symbolize disgrace",the black sheep,NA
2015-07-27,DJ,THE KNIGHTS TEMPLAR,,1600,The Templars helped out 12th c. King Alfonso I against these invaders & he bequeathed them Aragon,the Moors,NA
2015-07-27,DJ,COMPOUND WORDS,,1600,"Eisenhower said, ""The search for"" this animal of blame ""is the easiest of all hunting expeditions""",a scapegoat,NA
2015-07-27,DJ,GERMAN LIT,,1600,"We bring in 'da noise, we bring in 'da Cornelia Funke, whose novels include this""heart"" & this""spell""",inkheart & inkspell,NA
2015-07-27,DJ,"GEOGRAPHER'S ""D""ICTIONARY",,NA,1/360th of the Earth's circumference,a degree,NA
2015-07-27,DJ,POP MUSIC,,1600,"In 1994 this trio had its second No. 1 album, ""Ill Communication""",the Beastie Boys,NA
2015-07-27,DJ,IN COLOR,,1600,"Notorious name of a herbicide mixture of 2,4-D & 2,4,5-T, used in Vietnam",Agent Orange,NA
2015-07-27,DJ,THE KNIGHTS TEMPLAR,,2000,"After the fall of Acre in 1291, the Knights Templar moved their headquarters to this large island west of Syria",Cyprus,NA
2015-07-27,DJ,COMPOUND WORDS,,2000,"Poet William Carlos Williams wrote that ""so much depends on a red"" one of these conveyances",a wheelbarrow,NA
2015-07-27,DJ,GERMAN LIT,,2000,"1815 is the estimated time of arrival of ""The Devil's Elixer"" by this author",E.T.A. Hoffmann,NA
2015-07-27,DJ,"GEOGRAPHER'S ""D""ICTIONARY",,2000,Natural process by which arid lands become even less fertile; it happens a lot in Africa,desertification,NA
2015-07-27,DJ,POP MUSIC,,2000,"Will you remember this Canadian woman who sang ""I Will Remember You""",Sarah McLachlan,NA
2015-07-27,DJ,IN COLOR,,NA,"These, now meaning ""Credit for deeds done"", may have come from a measure of young Girl Scouts' achievements",brownie points,NA
2015-07-27,FJ,CLASSICAL MUSIC,,NA,"The first movement of the 1888 suite named for her is titled ""The Sea and Sindbad's Ship""",Scheherazade,NA
