date,round,category,comment,value,clue,response,link
2015-10-27,J,"""P""s ON EARTH",,200,A groundhog named Phil is the center of attention on February 2 here,Punxsutawney,NA
2015-10-27,J,TOYS & GAMES,,200,The first toy advertised on national TV was this spud,Mr. Potato Head,NA
2015-10-27,J,SPORTS HALL OF FAMERS,,200,"A 2012 inductee to the World Golf Hall of Fame, he's been nicknamed ""Phil the Thrill""",Mickelson,NA
2015-10-27,J,MOVERS & SHAKERS,,200,"In 1821 William Becknell left Missouri & made it to New Mexico, thus blazing this trail",the Santa Fe Trail,NA
2015-10-27,J,PARTS OF THE WHOLE,,200,"Crown, cementum, root",a tooth,NA
2015-10-27,J,"2 CONSONANTS, ONE VOWEL",,200,"A statute, or a division in a play",an act,NA
2015-10-27,J,"""P""s ON EARTH",,400,The Atlantic islands known as the Azores belong to this country,Portugal,NA
2015-10-27,J,TOYS & GAMES,,400,This card game named for a suit is also called Black Maria,hearts,NA
2015-10-27,J,SPORTS HALL OF FAMERS,,400,The International Swimming Hall of Fame's first class of inductees had 2 movie Tarzans: Buster Crabbe & this man,(Johnny) Weissmuller,NA
2015-10-27,J,MOVERS & SHAKERS,,400,"In 1922 Stephen Poplawski introduced this appliance, putting milkshakes within easy reach",a blender,NA
2015-10-27,J,PARTS OF THE WHOLE,,400,"Agitator, tub, drain hose",a washing machine,NA
2015-10-27,J,"2 CONSONANTS, ONE VOWEL",,400,It's haw's proverbial partner when you hesitate,hem,NA
2015-10-27,J,"""P""s ON EARTH",,600,It was founded in 1434 to succeed Angkor Thom as the Khmer capital,Phnom Penh,NA
2015-10-27,J,TOYS & GAMES,,600,"It was introduced in 1969 as ""the world's first indoor ball""",the Nerf ball,NA
2015-10-27,J,SPORTS HALL OF FAMERS,,600,Between them 2015  Baseball Hall inductees Randy Johnson & Pedro Martinez won 8 of these awards,the Cy Young Award,NA
2015-10-27,J,MOVERS & SHAKERS,,600,In September 1993 Yitzhak Rabin unenthusiastically shook this foe's hand to seal a peace deal on the White House lawn,(Yasser) Arafat,NA
2015-10-27,J,PARTS OF THE WHOLE,,600,"Reservoir, filter basket, carafe",a coffeemaker,NA
2015-10-27,J,"2 CONSONANTS, ONE VOWEL",,600,A mongrel dog,a cur (or a mutt),NA
2015-10-27,J,"""P""s ON EARTH",,800,"In 1945 Churchill, Truman & Stalin met in this city near Berlin to determine the structure of a post-Nazi Europe",Potsdam,http://www.j-archive.com/media/2015-10-27_J_22.jpg
2015-10-27,J,TOYS & GAMES,,800,"You'll find Sweetie Potamus & Veggie Potamus as 2 of the 4 characters in this ""frenzied marble chomping game""",Hungry Hungry Hippos,NA
2015-10-27,J,SPORTS HALL OF FAMERS,,800,"This Tennis Hall of Famer earned greater fame for his 1973 ""Battle of the Sexes"" match than for his 3 Wimbledon titles",Bobby Riggs,NA
2015-10-27,J,MOVERS & SHAKERS,,800,"(Kelly of the Clue Crew shows a map on the monitor.)  From Baffin Bay, here is the 1908-1909 North Pole route, on which this man led a fellow American & four Inuit",(Robert) Peary,http://www.j-archive.com/media/2015-10-27_J_24a.jpg
2015-10-27,J,PARTS OF THE WHOLE,,800,"Random number generator, reels, payout tray",a slot machine,NA
2015-10-27,J,"2 CONSONANTS, ONE VOWEL",,800,"An area of wet, spongy ground with soil mainly of decayed vegetable matter",bog,NA
2015-10-27,J,"""P""s ON EARTH",,NA,This city on the Arno River is known for a 12th century campanile,Pisa,NA
2015-10-27,J,TOYS & GAMES,,1000,A mooshroom is a kind of cow found only in the mushroom biome in this video game,Minecraft,NA
2015-10-27,J,SPORTS HALL OF FAMERS,,1000,"This Bulls forward, second fiddle to Michael Jordan, made the Hall of Fame 1 year after Mike",(Scottie) Pippen,NA
2015-10-27,J,MOVERS & SHAKERS,,1000,The Franks' big one of these shook & opened the walls of Jerusalem during the First Crusade in July 1099,a battering ram,NA
2015-10-27,J,PARTS OF THE WHOLE,,1000,"Myelin sheath, dendrite, axon",a nerve,NA
2015-10-27,J,"2 CONSONANTS, ONE VOWEL",,1000,"Pallid, or lacking color",wan,NA
2015-10-27,DJ,U.S. FESTIVALS,,400,The Satchmo Summerfest in New Orleans pays tribute to this native son & jazz great,(Louis) Armstrong,NA
2015-10-27,DJ,THAT'S OLD STUFF,,400,The British Museum displays an iron one of these with a gilded bronze scabbard from the Roman emperor Tiberius,a sword,NA
2015-10-27,DJ,TIMELY LIT,,400,"The story of a scandal-disgraced minister, ""A Month of Sundays"" by John Updike is a takeoff on this Hawthorne work",The Scarlet Letter,NA
2015-10-27,DJ,"PLACE YOUR ""BET""",,400,Your present spouse is your this 2-word phrase,better half,NA
2015-10-27,DJ,MASTERPIECE,,400,"There were 4 seasons of the Wodehouse pair known as ""Jeeves and"" this employer of his",Wooster,NA
2015-10-27,DJ,DOWNTOWN CABBIE,,400,"Take you from your loft in Soho to a gallery across Houston in this ""village""? Tell ya the truth, it'd be faster to walk",Greenwich Village (or the West Village),NA
2015-10-27,DJ,U.S. FESTIVALS,,800,"""In the mood"" for a festival honoring this bandleader? Drop by Clarinda, Iowa the second week in June",(Glenn) Miller,NA
2015-10-27,DJ,THAT'S OLD STUFF,,800,"Crystallized some 4.4 billion years ago, zircons found in Australia are the Earth's oldest known of these rock constituents",minerals,NA
2015-10-27,DJ,TIMELY LIT,,800,This 1975 E.L. Doctorow novel captured the spirit of the U.S. from the turn of the 20th century to World War I,Ragtime,NA
2015-10-27,DJ,"PLACE YOUR ""BET""",,800,Your future spouse is your this word,betrothed,NA
2015-10-27,DJ,MASTERPIECE,,800,"3 decades after the original, this tale of British masters & household servants returned in 2011","Upstairs, Downstairs",NA
2015-10-27,DJ,DOWNTOWN CABBIE,,800,"Sure, I can take you to this L.A. sports arena where Kobe plays; you know it doesn't sell office supplies, right?",the Staples Center,NA
2015-10-27,DJ,U.S. FESTIVALS,,1200,"""Leaving no trace"" of 50,000 people camping in the Nevada desert is a principle of this late summer festival",Burning Man,NA
2015-10-27,DJ,THAT'S OLD STUFF,,1200,"Since the 8th century, a 230-foot-tall statue of this man has loomed over China's Sichuan Province",Buddha,http://www.j-archive.com/media/2015-10-27_DJ_14a.jpg
2015-10-27,DJ,TIMELY LIT,,1200,"""Son of the Morning Star"" is Evan S. Connell's study of this lt. col.'s death in June 1876 in Montana",Custer,NA
2015-10-27,DJ,"PLACE YOUR ""BET""",,1200,To hurt someone who trusts you,betrayal,NA
2015-10-27,DJ,MASTERPIECE,,NA,Keira Knightley played Lara Antipova in an adaptation of this Russian tale,Doctor Zhivago,NA
2015-10-27,DJ,DOWNTOWN CABBIE,,1200,"Oui, we are at 27 Rue de Fleurus, Paris, where this writer lived with Alice B. Toklas! We are not a lost generation!",Gertrude Stein,NA
2015-10-27,NA,NA,NA,NA,NA,NA,NA
2015-10-27,DJ,THAT'S OLD STUFF,,1600,"Homo naledi, a 2-million-year-old discovery announced in 2015, is notable for a long, powerful this digit",thumb,NA
2015-10-27,DJ,TIMELY LIT,,1600,This day of the week is the title of a 2005 Ian McEwan novel about a surgeon named Henry,Saturday,NA
2015-10-27,DJ,"PLACE YOUR ""BET""",,1600,It designates any constellation's second-brightest star,beta,NA
2015-10-27,DJ,MASTERPIECE,,1600,"Bring your whole entourage to see this actor play the title role in Masterpiece's ""Mr. Selfridge""",(Jeremy) Piven,NA
2015-10-27,DJ,DOWNTOWN CABBIE,,NA,"Maggie Daley Park to Soldier Field, sure--we'll take da 41, aka this ""Drive"" with a water view",Lakeshore Drive,NA
2015-10-27,NA,NA,NA,NA,NA,NA,NA
2015-10-27,DJ,THAT'S OLD STUFF,,2000,Mad King Ludwig began construction of this fairy-tale castle in 1869,Neuschwanstein,http://www.j-archive.com/media/2015-10-27_DJ_17.jpg
2015-10-27,DJ,TIMELY LIT,,2000,"Mark Haddon's novel, ""The Curious Incident of"" this came to Broadway in 2014 with Alex Sharp as the teen sleuth",the Dog in the Night-Time,http://www.j-archive.com/media/2015-10-27_DJ_05.jpg
2015-10-27,DJ,"PLACE YOUR ""BET""",,2000,"Pair it with ""between"" to mean in an awkward middle position",betwixt,NA
2015-10-27,DJ,MASTERPIECE,,2000,"In Masterpiece's ""Wolf Hall"", this actor of ""Homeland"" fame portrays a young Henry VIII",Damian Lewis,http://www.j-archive.com/media/2015-10-27_DJ_20.jpg
2015-10-27,DJ,DOWNTOWN CABBIE,,2000,"Pall Mall? Sure, guv, but it might get slow at this intersection of Regent & Haymarket-- it's a real circus",Piccadilly Circus,NA
2015-10-27,FJ,THE FOUNDING FATHERS,,NA,"On an alphabetical list of Declaration of Independence signers, he comes between Lyman Hall & Benjamin Harrison",John Hancock,NA
