date,round,category,comment,value,clue,response,link
2015-11-24,J,WHERE IS THAT?,,200,The Kaaba:This holy city,Mecca,NA
2015-11-24,J,COOKING METHODS,,200,To pass dry ingredients like flour through a fine-meshed sieve; doing so removes large pieces & incorporates air,to sift,NA
2015-11-24,J,NEWSPAPERS & MAGAZINES,,200,"This magazine edited by Anna Wintour is known as ""high fashion's Bible""",Vogue,NA
2015-11-24,J,LEADER OF THE PACK,,200,"In 1959 this new coach of the Packers said, ""Dancing is a contact sport; football is a hitting sport""",(Vince) Lombardi,NA
2015-11-24,J,"""OFF"" WE GO",,200,It's when the puck gets dropped,a face-off,NA
2015-11-24,J,INTO THE WILD BLUE YONDER,,200,"Bully for this man, who took a ride at an airshow in 1910, becoming the first president aloft",Teddy Roosevelt,http://www.j-archive.com/media/2015-11-24_J_23.mp4
2015-11-24,J,WHERE IS THAT?,,400,The Mariana Trench:This ocean,the Pacific Ocean,NA
2015-11-24,J,COOKING METHODS,,400,"Highly seasoned meat is seared so that the surface forms a crust in this ""colorful"" Cajun technique",blackening,NA
2015-11-24,J,NEWSPAPERS & MAGAZINES,,NA,"This newspaper's 1889 first issue promised ""to get the news, to publish it instantly, whether bull or bear""",The Wall Street Journal,NA
2015-11-24,J,LEADER OF THE PACK,,400,Mike Holmgren left Green Bay in 1999 to coach this team in the Northwest,the Seattle Seahawks,NA
2015-11-24,J,"""OFF"" WE GO",,400,"At a distance from the coast, like certain oil rigs",offshore,NA
2015-11-24,J,INTO THE WILD BLUE YONDER,,400,"In 1910 Walter Brookins broke this altitude barrier with 895' to spare, though he didn't join the ""club"" there",the mile-high,NA
2015-11-24,J,WHERE IS THAT?,,600,Tivoli Gardens:This country,Italy (or Denmark),NA
2015-11-24,J,COOKING METHODS,,600,This synonym for perspire is also a method of cooking over low heat to soften ingredients without browning,sweating,NA
2015-11-24,J,NEWSPAPERS & MAGAZINES,,600,"Ralph Gleason, a critic for the San Francisco Chronicle, co-founded this music magazine that debuted in 1967",Rolling Stone,NA
2015-11-24,J,LEADER OF THE PACK,,600,"The Packers' home field is named for him, the team's coach for its first 30 seasons",Curly Lambeau,NA
2015-11-24,J,"""OFF"" WE GO",,600,"Insulting, or a military campaign of attack",an offensive,NA
2015-11-24,NA,NA,NA,NA,NA,NA,NA
2015-11-24,J,WHERE IS THAT?,,800,"The Old Vic:This ""End"" of London",the West End,NA
2015-11-24,J,COOKING METHODS,,800,"To cook fish en papillote, you'll need this type of paper to seal in the flavor & juices",parchment paper,NA
2015-11-24,J,NEWSPAPERS & MAGAZINES,,800,"This magazine's ""tested and approved"" seal debuted in the December 1909 issue",Good Housekeeping,NA
2015-11-24,NA,NA,NA,NA,NA,NA,NA
2015-11-24,J,"""OFF"" WE GO",,800,"""Give"" this to rebuff someone or to remove a piece of lint",the brush-off,NA
2015-11-24,J,INTO THE WILD BLUE YONDER,,800,"Otto Lilienthal, 1848-1896, made some 2000 flights in these--he could have really used an engine in 1896",a glider,http://www.j-archive.com/media/2015-11-24_J_27a.jpg
2015-11-24,J,WHERE IS THAT?,,1000,The Buffalo Bill Center of the West:This Wyoming city,Cody,NA
2015-11-24,J,COOKING METHODS,,1000,"From the Latin for ""to make soft"", it's soaking food, usually fruit, in a liquid in order to infuse it with the liquid's flavor",macerate,NA
2015-11-24,J,NEWSPAPERS & MAGAZINES,,1000,"With the merger of a morning paper & an evening one, Marshall Field III created this Chicago newspaper",the Chicago Sun-Times,NA
2015-11-24,NA,NA,NA,NA,NA,NA,NA
2015-11-24,J,"""OFF"" WE GO",,1000,Boil butter & sugar together to make this,toffee,NA
2015-11-24,J,INTO THE WILD BLUE YONDER,,1000,This Benz partner suggested using an engine with an open-flame ignition in hydrogen airships; not such a good idea,Daimler,NA
2015-11-24,DJ,ANCIENT NAMES,,400,Aristotle described him as a great physician & implied he was small in stature,Hippocrates,NA
2015-11-24,DJ,MIAMI,,400,"Miami's port calls itself this type of vacation trip ""capital of the world""",cruise,NA
2015-11-24,DJ,WEARABLES' OTHER MEANINGS,,400,"Breathes heavily, like a dog",pants,NA
2015-11-24,DJ,LITERARY VILLAINS,,400,"This villain said a crocodile has followed him ""from sea to sea... licking its lips for the rest of me""",Captain Hook,NA
2015-11-24,DJ,THE AUSSIE INVASION,,400,"In 1985 this ""Back In Black"" group played the Rock in Rio festival before a fairly big crowd of 342,000",AC/DC,NA
2015-11-24,DJ,MOTTOES & SLOGANS,,400,This defiant motto was launched 30 years ago as a Lone Star State anti-littering slogan,"""Don\'t mess with Texas""",NA
2015-11-24,DJ,ANCIENT NAMES,,800,Hamilcar Barca put the hand of this 9-year-old son on a sacrificed animal & made him swear hatred of Rome,Hannibal,NA
2015-11-24,DJ,MIAMI,,800,Barack Obama marked Earth Day 2015 in this swampy national park that borders greater Miami,the Everglades,NA
2015-11-24,DJ,WEARABLES' OTHER MEANINGS,,800,To neither win nor lose a contest,tie,NA
2015-11-24,DJ,LITERARY VILLAINS,,800,"Sherlock Holmes called him ""a genius"" & ""the organizer of half that is evil"" in London",Moriarty,NA
2015-11-24,DJ,THE AUSSIE INVASION,,800,"This band topped the charts for 4 weeks in 1983 with the perfect-for-the-category song ""Down Under""",Men at Work,NA
2015-11-24,DJ,MOTTOES & SLOGANS,,800,"A recent slogan for New York's lottery was ""What will you think about when you don't have to think about"" this",money,NA
2015-11-24,DJ,ANCIENT NAMES,,NA,Around 60 A.D. this emperor began giving public performances playing the lyre & later appeared on stage as a actor,Nero,NA
2015-11-24,DJ,MIAMI,,1200,"In 2009 this singer of the easy life rewrote his tune ""Fins"" with new words for the Miami Dolphins",Jimmy Buffett,NA
2015-11-24,DJ,WEARABLES' OTHER MEANINGS,,NA,In blackjack it holds multiple decks of cards,shoe,NA
2015-11-24,DJ,LITERARY VILLAINS,,1200,"This James Bond villain shows his accomplices a map of Fort Knox, including Bullion Boulevard",Goldfinger,NA
2015-11-24,DJ,THE AUSSIE INVASION,,1200,"Hope at least 1 of you has a toddler!  This Sydney group entertains the tots with songs like ""Hot Potato"" & ""Fruit Salad""",The Wiggles,NA
2015-11-24,DJ,MOTTOES & SLOGANS,,1200,In 2015 this 3-word motto was coined by French art director Joachim Roncin after a terrorist attack,Je suis Charlie,NA
2015-11-24,DJ,ANCIENT NAMES,,1600,DNA analysis suggests that King Tut may have been the son of Akhenaten & this main wife,Nefertiti,NA
2015-11-24,DJ,MIAMI,,1600,The color-filled Miami Beach architectural district is also known as the this architectural style District,Art Deco,NA
2015-11-24,DJ,WEARABLES' OTHER MEANINGS,,1600,To put money away in savings,sock,NA
2015-11-24,DJ,LITERARY VILLAINS,,1600,"Bald, pale & homicidal, Judge Holden is the monstrous nemesis in this author's ""Blood Meridian""",Cormac McCarthy,NA
2015-11-24,DJ,THE AUSSIE INVASION,,1600,"In 1988 this group hit the Top 5 with both ""Devil Inside"" & ""New Sensation""",INXS,NA
2015-11-24,DJ,MOTTOES & SLOGANS,,1600,"""Blood and fire"" is the motto of this ""Army""; the blood comes from Jesus & the fire from the Holy Spirit",the Salvation Army,NA
2015-11-24,DJ,ANCIENT NAMES,,2000,"This Persian prophet founded a religion based on a supreme god named Ahura Mazda, the ""wise lord""",Zoroaster,NA
2015-11-24,DJ,MIAMI,,2000,"Called a bay on the map, this large estuary separates Miami from Miami Beach",Biscayne Bay,http://www.j-archive.com/media/2015-11-24_DJ_25.jpg
2015-11-24,DJ,WEARABLES' OTHER MEANINGS,,2000,Gives someone less than all the money he is due,shorts,NA
2015-11-24,DJ,LITERARY VILLAINS,,2000,"Ray Bradbury wrote ""The Illustrated Man"" & this novel about the sinister tattoo-covered Mr. Dark",Something Wicked This Way Comes,NA
2015-11-24,DJ,THE AUSSIE INVASION,,2000,"The Little River Band sang, ""We'll go dancing in the dark, walking through the park &"" doing this title","""Reminiscing""",NA
2015-11-24,DJ,MOTTOES & SLOGANS,,2000,"""Destroy foreigners"" was part of the slogan of this secret Chinese organization around 1900",the Boxers,NA
2015-11-24,FJ,THE OSCARS,,NA,"For films of 2005 through 2012, he received nominations for Best Picture, Director, Writing & Acting",George Clooney,NA
