date,round,category,comment,value,clue,response,link
1990-04-02,J,FICTIONAL CHARACTERS,,100,This F. Scott Fitzgerald character was born James Gatz,The Great Gatsby,NA
1990-04-02,J,NAMESAKES,,100,Some authorities believe it was actually Jim Bowie's brother Rezin who designed this weapon,Bowie Knife,NA
1990-04-02,J,ANDREW JACKSON,,100,Jackson was the first president to use this form of transportation while in office,Railroad,NA
1990-04-02,J,SONGS OF THE '60S,,100,"Louis Armstrong's only No. 1 hit, it hit the charts for 19 weeks in 1964","""Hello, Dolly!""",NA
1990-04-02,J,ABBREVIATIONS,,100,You take the SAT exam to get into college & the LSAT to get into one of these schools,Law School,NA
1990-04-02,J,SUDDEN DEATH,,100,"After death, this faith's devout members get houris, celestial handmaidens",Islam,NA
1990-04-02,J,FICTIONAL CHARACTERS,,200,"In ""Ivanhoe"" the black knight who rescues Wilfred & Rowena is really this king in disguise",Richard the Lionhearted,NA
1990-04-02,J,NAMESAKES,,200,This measure of sound intensity is named for Alexander Graham Bell,Decibel,NA
1990-04-02,J,ANDREW JACKSON,,200,In 1804 & again in 1837 Jackson retired from public life to this estate,The Hermitage,NA
1990-04-02,J,SONGS OF THE '60S,,200,"Sonny & Cher's only No. 1 hit, they used to sing it at the close of their TV show","""I Got You Babe""",NA
1990-04-02,J,ABBREVIATIONS,,200,Nickname formed from the initials of the Government National Mortgage Association,Ginnie Mae,NA
1990-04-02,J,SUDDEN DEATH,,200,"The last words of this first president to die were, ""It is well I die hard, but I am not afraid to go.""",George Washington,NA
1990-04-02,J,FICTIONAL CHARACTERS,,300,"For saving this little girl from the waters of the Mississippi, Uncle Tom was bought by her father",Little Eva,NA
1990-04-02,J,NAMESAKES,,300,What Michael Begon & J.G. Zinn had named after them,Flowers (begonias & zinnias),NA
1990-04-02,J,ANDREW JACKSON,,300,It's what Jackson had in common with Lewis Robards from Aug. 1791 to Sept. 1793,Same Wife (they both thought they were married to the same woman),NA
1990-04-02,J,SONGS OF THE '60S,,300,"Group whose first No. 1 hit, ""Cherish"", was recorded in a garage that was converted to a studio",The Association,NA
1990-04-02,J,ABBREVIATIONS,,300,"You could see one of them write down ""q.i.d."", but you might find it hard to read",Doctors (they write that down on your prescription; take it 4 times a day),NA
1990-04-02,J,SUDDEN DEATH,,300,Romeo commits suicide by drinking poison whereas Juliet kills herself using this,A Dagger,NA
1990-04-02,J,FICTIONAL CHARACTERS,,400,John D. MacDonald used colors in the titles of all the adventures of this private investigator,Travis McGee,NA
1990-04-02,J,NAMESAKES,,400,Two foods named for opera singer Dame Nellie Melba,Melba Toast & Peach Melba,NA
1990-04-02,J,ANDREW JACKSON,,400,Jackson's choice for minister to Great Britain; after the Senate turned him down he became VP & then president,Martin Van Buren,NA
1990-04-02,J,SONGS OF THE '60S,,400,"The Beatles' 8th No. 1 hit, it begins ""I think I'm gonna be sad""","""Ticket To Ride""",NA
1990-04-02,J,ABBREVIATIONS,,400,It's an editor's abbreviation for more than one manuscript,MSS,NA
1990-04-02,J,SUDDEN DEATH,,400,"In 1984 this author of ""The Complete Book of Running"" died while running",Jim Fixx,NA
1990-04-02,NA,NA,NA,NA,NA,NA,NA
1990-04-02,J,NAMESAKES,,500,"Educated at Rennsselaer Polytechnic, he built railroads & bridges before his amusement park ride",George Washington Gale Ferris,NA
1990-04-02,J,ANDREW JACKSON,,500,Collective term for Jackson's unofficial group of presidential advisors,"""Kitchen Cabinet""",NA
1990-04-02,J,SONGS OF THE '60S,,500,"They had No. 1 hits with Bob Dylan's ""Mr. Tambourine Man"" & Pete Seeger's ""Turn, Turn, Turn""",The Byrds,NA
1990-04-02,J,ABBREVIATIONS,,500,"A cousin to the R.A.F., the R.A.A.F. is this",Royal Australian Air Force,NA
1990-04-02,NA,NA,NA,NA,NA,NA,NA
1990-04-02,DJ,PUBLISHING,,200,"By custom, books printed in the U.S. carry this library's card catalogue number on the copyright page",Library of Congress,NA
1990-04-02,DJ,SCIENCE,,200,A simple one of these consists of a small weight swinging to & fro on the end of a string,Pendulum,NA
1990-04-02,DJ,ANCIENT HISTORY,,200,"Paris was known by its Celtic name ""Lutetia"", when he took it from the Parisii tribe in 52 B.C.",Julius Caesar,NA
1990-04-02,DJ,U.S. STATES,,200,Providence County is this state's largest county in both area & population,Rhode Island,NA
1990-04-02,DJ,PROVERBS,,200,"It ""makes all men equal"" & ""makes the world go round""",Love,NA
1990-04-02,DJ,PALACES,,200,"He fled the Potala, his palace in Tibet, when Chinese forces invaded Lhasa in 1959",The Dalai Lama,NA
1990-04-02,DJ,PUBLISHING,,400,"Of 4-6 pages, 14-20 pages or 40-60 pages, the size of the typical Soviet daily newspaper",4-6 pages,NA
1990-04-02,DJ,SCIENCE,,400,The process by which a substance changes from liquid to a gas is called this,Vaporization,NA
1990-04-02,DJ,ANCIENT HISTORY,,400,"Cleopatra had 4 children out of wedlock, 3 fathered by this Roman",Marc Antony,NA
1990-04-02,DJ,U.S. STATES,,NA,"Symbols of the Cherokee, Chickasaw, Creek, Choctaw & Seminole Indian nations are on its seal",Oklahoma,NA
1990-04-02,DJ,PROVERBS,,400,"He coined the saying, Early to bed & early to rise makes a man healthy, wealthy & wise""",Benjamin Franklin,NA
1990-04-02,DJ,PALACES,,400,"From 1561-1567, Holyrood Palace in Edinburgh was the home of this queen of Scotland",Mary Stuart,NA
1990-04-02,DJ,PUBLISHING,,600,"""The Talk Of The Town"" is a weekly feature of this magazine also known for its drawings",The New Yorker,NA
1990-04-02,DJ,SCIENCE,,600,"The planets that are smaller than Earth are Mercury, Venus & these two",Mars & Pluto,NA
1990-04-02,DJ,ANCIENT HISTORY,,600,"The earliest known civilization, it was home to the Sumerians & Akkadians",Mesopotamia,NA
1990-04-02,DJ,U.S. STATES,,600,"State whose motto ""Eureka"", meaning ""I have found it"" is attributed to Archimedes",California,NA
1990-04-02,DJ,PROVERBS,,600,"They're the ""Windows of the Soul""",The Eyes,NA
1990-04-02,DJ,PALACES,,600,King of Bavaria whose Neuschwanstein Castle might be called a monument to his madness,Ludwig II,NA
1990-04-02,DJ,PUBLISHING,,800,"""The Budget"" is a weekly paper published nationally for members of this Mennonite sect",Amish,NA
1990-04-02,DJ,SCIENCE,,800,An LED; it's used for displaying readings on digital watches & calculators,Light Emitting Diode,NA
1990-04-02,DJ,ANCIENT HISTORY,,800,The Hebrew kingdom split into Judah & Israel after the death of this king,Solomon,NA
1990-04-02,DJ,U.S. STATES,,800,"This ""Tree Planters State"" in the midwest has the only 2 man-made national forests in the U.S.",Nebraska,NA
1990-04-02,DJ,PROVERBS,,800,Proverb that was the title of a Kaufman/Hart play about an unconventional family,"""You Can\'t Take It With You""",NA
1990-04-02,DJ,PALACES,,800,"Huis Ten Bosch Palace, home of Holland's Queen Beatrix, is in this city",The Hague,NA
1990-04-02,DJ,PUBLISHING,,1000,"""News You Can Use"" & ""Worldgram"" are registered trademarks of this magazine",U.S. News & World Report,NA
1990-04-02,DJ,SCIENCE,,1000,"When this scientist discovered oxygen, he called it dephlogisticated air",Joseph Priestley,NA
1990-04-02,DJ,ANCIENT HISTORY,,1000,"The ruins of Ur are in a desert because this river, which once ran near it, changed course",Euphrates,NA
1990-04-02,DJ,U.S. STATES,,1000,The Great Serpent Mound near Hillsboro in this state is an ancient Indian burial site,Ohio,NA
1990-04-02,DJ,PROVERBS,,NA,"In a Thomas Gray poem this precedes "" 'Tis folly to be wise""",Where Ignorance Is Bliss,NA
1990-04-02,DJ,PALACES,,1000,Hiram Bingham claimed he found a castle of the Incas in this remote fortress city he excavated,Machu Picchu,NA
1990-04-02,FJ,ACTORS & THEIR ROLES,,NA,This actor won a 1952 Tony and a 1956 Oscar for playing the same ruler,Yul Brynner (The King and I),NA
