date,round,category,comment,value,clue,response,link
2015-12-01,J,THE CALDECOTT MEDAL,,200,"1955's medal went to Marcia Brown for the illustrations of this tale subtitled ""Or, the Little Glass Slipper""",Cinderella,NA
2015-12-01,J,WARS,,200,The ROKA & the KPA were initial combatants in this 1950s war,the Korean War,NA
2015-12-01,J,ECON 101,,200,Governments deal with monopolies by using these sorts of laws that sound like they literally don't have faith,antitrust laws,NA
2015-12-01,J,"HEY ""EU""!",,200,It's a speech or tribute usually given during a funeral,a eulogy,NA
2015-12-01,J,BREAKUP,,200,In 2015 it was game over for him & Lindsey Vonn after nearly 3 years of dating,Tiger Woods,NA
2015-12-01,J,MAKEUP,,200,"Another term for rouge, or what you might do if you don't know the correct response",blush,NA
2015-12-01,J,THE CALDECOTT MEDAL,,400,"Ed Young's Caldecott winner ""Lon Po Po"", which means ""granny wolf"", is a Chinese version of this fairy tale",Little Red Riding Hood,NA
2015-12-01,J,WARS,,400,"In 1973 the fourth Arab-Israeli War, sometimes called the Yom Kippur War, occurred during this Islamic month",Ramadan,NA
2015-12-01,J,ECON 101,,400,The monetary system called this standard allows holders to exchange currency for No. 79 on the periodic table,the gold standard,NA
2015-12-01,J,"HEY ""EU""!",,400,Aha!  You'll find that this word is used to express triumph at a discovery,eureka,NA
2015-12-01,J,BREAKUP,,400,She & husband of 10 years Chris Martin consciously uncoupled in 2014,Gwyneth Paltrow,NA
2015-12-01,J,MAKEUP,,400,"""Maybe she's born with it. Maybe it's"" this makeup brand that celebrated its 100th anniversary in 2015",Maybelline,NA
2015-12-01,J,THE CALDECOTT MEDAL,,600,This 1963 Maurice Sendak book won the Caldecott as well as the Lewis Carroll Shelf Award,Where the Wild Things Are,NA
2015-12-01,J,WARS,,600,The Forty Years' War in Burma began in 1385; 233 years later began this somewhat shorter European war,the Thirty Years\' War,NA
2015-12-01,J,ECON 101,,600,A strongly free-market school of economics is named for the University of this Midwestern city,Chicago,NA
2015-12-01,J,"HEY ""EU""!",,600,Seen here with mom Sarah Ferguson are princesses Beatrice & her,Eugenie,http://www.j-archive.com/media/2015-12-01_J_08a.jpg
2015-12-01,J,BREAKUP,,600,"Singer Seal thought he sealed the deal when he married her in 2005, but they've since divorced",Heidi Klum,NA
2015-12-01,J,MAKEUP,,600,"As its name implies, one of these, often in stick or cream form, is used especially to cover up dark circles & blemishes",concealer,NA
2015-12-01,J,THE CALDECOTT MEDAL,,800,"""Chanticleer and the Fox"", the 1959 winner, was adapted by Barbara Cooney from this 14th century work",The Canterbury Tales,NA
2015-12-01,J,WARS,,800,The first of the wars named for these locals started in New Zealand in 1845,Maori,NA
2015-12-01,J,ECON 101,,800,"Russia after the fall of Communism was called a ""kleptocracy"" by some, meaning politicians did this a lot",steal,NA
2015-12-01,J,"HEY ""EU""!",,800,"This controversial act is from the Greek for ""good death""",euthanasia,NA
2015-12-01,J,BREAKUP,,800,"In a very expensive breakup, his divorce from Heather Mills cost him more than $48 million",Paul McCartney,NA
2015-12-01,J,MAKEUP,,800,"Some brands of this cosmetic now have a vibrating brush to give volume, length & curl during application",mascara,NA
2015-12-01,J,THE CALDECOTT MEDAL,,NA,"In the 1980s Chris Van Allsburg won 2 Caldecotts: for ""Jumanji"" & this story of a northbound train",The Polar Express,NA
2015-12-01,NA,NA,NA,NA,NA,NA,NA
2015-12-01,J,ECON 101,,1000,"""Diminutive"" term for selling unowned stock shares on the gamble that the price will fall",short sale,NA
2015-12-01,J,"HEY ""EU""!",,1000,It's the cousin of the tuba being played here,a euphonium,http://www.j-archive.com/media/2015-12-01_J_07.mp3
2015-12-01,J,BREAKUP,,1000,"After 13 years together, Helena Bonham Carter & this director called it quits in 2014",Tim Burton,NA
2015-12-01,J,MAKEUP,,1000,"This line of loose powder makeup urges you to ""Be original.  Be natural.  Be good""",bareMinerals,NA
2015-12-01,DJ,"WHAT ""IA"" COUNTRY",,400,It borders Turkey & Greece,Bulgaria,NA
2015-12-01,DJ,COLLECTORS,,400,"An avid collector of these, Jay Leno has written about them for Popular Mechanics magazine",cars,NA
2015-12-01,DJ,THERE'S AN ANIMAL ON THE BILLBOARD CHART,,400,"Culture Club's ""Karma ____""",Chameleon,NA
2015-12-01,DJ,WOMEN OF MYTH,,400,"Courtesy of Perseus, her snaky severed head was placed on the shield of Athena",Medusa,NA
2015-12-01,DJ,LOUD NOISES,,400,This porcine sound also means to inform on someone,a squeal,NA
2015-12-01,NA,NA,NA,NA,NA,NA,NA
2015-12-01,DJ,"WHAT ""IA"" COUNTRY",,NA,The Netherlands relinquished sovereignty over it in 1949,Indonesia,NA
2015-12-01,DJ,COLLECTORS,,NA,In 2011 this rock legend auctioned off part of his guitar collection to benefit his Crossroads Centre rehab clinic,Eric Clapton,NA
2015-12-01,DJ,THERE'S AN ANIMAL ON THE BILLBOARD CHART,,800,"Elton's John's ""____ Rock""",Crocodile,NA
2015-12-01,DJ,WOMEN OF MYTH,,800,This daughter of Zeus & Leda was considered to be the most beautiful woman in the world,Helen of Troy,NA
2015-12-01,DJ,LOUD NOISES,,800,"A description of a shrill scream, or something done to adolescent girls' ears",pierce,NA
2015-12-01,NA,NA,NA,NA,NA,NA,NA
2015-12-01,DJ,"WHAT ""IA"" COUNTRY",,1200,Skopje is its capital,Macedonia,NA
2015-12-01,DJ,COLLECTORS,,1200,"(Hi, I'm Mo Rocca.)  My collection  of presidential memorabilia includes a framed ticket to his 1868 impeachment trial",Andrew Johnson,http://www.j-archive.com/media/2015-12-01_DJ_23a.jpg
2015-12-01,DJ,THERE'S AN ANIMAL ON THE BILLBOARD CHART,,1200,"From Ylvis, ""The ____ (What Does The ____ Say?)""",Fox,NA
2015-12-01,DJ,WOMEN OF MYTH,,1200,"After she died of a snakebite, her husband Orpheus tried to rescue her from Hades",Eurydice,NA
2015-12-01,DJ,LOUD NOISES,,1200,It can be a loud noise or a long arm holding a mic to record it,a boom,NA
2015-12-01,DJ,SUTTER'S FORT,"(Jimmy: Even before the discovery of gold nearby, it was a landmark of California history.)",1200,"(Sarah of the Clue Crew makes candles at Sutter's Fort in Sacramento, CA.)  Although John Sutter probably had a whale oil lamp, most of the lighting at the fort was provided by candles; occasionally, special candles were made from the lighter, less aromatic top layer of this cattle fat",tallow,http://www.j-archive.com/media/2015-12-01_DJ_26a.jpg
2015-12-01,DJ,"WHAT ""IA"" COUNTRY",,1600,Quechua is one of its official languages,Bolivia,NA
2015-12-01,DJ,COLLECTORS,,1600,"Steve Martin has an impressive art collection that includes works by Seurat, Picasso & this ""Nighthawks"" artist",(Edward) Hopper,NA
2015-12-01,DJ,THERE'S AN ANIMAL ON THE BILLBOARD CHART,,1600,"""Shake Me Down"" by Cage the ____",Elephant,NA
2015-12-01,DJ,WOMEN OF MYTH,,1600,"According to Ovid, this jealous goddess turned the nymph Callisto into a bear for being Jupiter's lover",Juno,NA
2015-12-01,DJ,LOUD NOISES,,1600,"Ma claims you made enough noise to do this 3-word phrase, hence the zombies",wake the dead,NA
2015-12-01,DJ,SUTTER'S FORT,"(Jimmy: Even before the discovery of gold nearby, it was a landmark of California history.)",1600,"(Sarah of the Clue Crew reports from Sutter's Fort in Sacramento, CA.)  The porcelain doll belonged to little Patty Reed, one of 81 members of this party that was trapped in the Sierra Nevadas in the winter of 1846-1847; Sutter's rescue team was shocked to find that some of them resorted to cannibalism to stay alive",the Donner party,http://www.j-archive.com/media/2015-12-01_DJ_27-2.jpg
2015-12-01,DJ,"WHAT ""IA"" COUNTRY",,2000,Bizerte is one of its Mediterranean ports,Tunisia,NA
2015-12-01,DJ,COLLECTORS,,2000,Steve Soboroff's typewriter collection includes a Braille one that belonged to this blind Italian tenor,Andrea Bocelli,http://www.j-archive.com/media/2015-12-01_DJ_25.jpg
2015-12-01,DJ,THERE'S AN ANIMAL ON THE BILLBOARD CHART,,2000,"""Time Of Our Lives"" by him & Ne-Yo",Pitbull,NA
2015-12-01,DJ,WOMEN OF MYTH,,2000,"After she spurned Apollo, he made sure no one would believe her prophecies",Cassandra,NA
2015-12-01,DJ,LOUD NOISES,,2000,The first 4 letters of this loud word spell the name of a bivalve mollusk,a clamor,NA
2015-12-01,NA,NA,NA,NA,NA,NA,NA
2015-12-01,FJ,THE MOVIES,,NA,The title of this 2009 Best Picture Oscar nominee alludes to the left tackle's job in a football game,The Blind Side,NA
