date,round,category,comment,value,clue,response,link
1986-09-11,J,THE NAVY,,100,"In the early 19th c., the U.S. Navy built the very 1st warship powered by this",steam,NA
1986-09-11,J,SWEETS,,100,"Though really a legume, it's the most popular ""nut"" used in U.S. candy",the peanut,NA
1986-09-11,J,"""LITTLE"" SONGS",,100,"Sam the Sham & the Pharaohs told her, ""You're everything a big bad wolf could want, owww""","""Little Red Riding Hood""",NA
1986-09-11,J,BEAR FACTS,,100,"Bears usually give birth to this many cubs, which stage-bear moms might push to get into Doublemint ads",2,NA
1986-09-11,J,MOUNTAINS,,100,A 1659 peace treaty made this chain the boundary between Spain & France,the Pyrenees,NA
1986-09-11,J,____ THE ____,"(Alex: And what that means, of course, is that in your response, you'll be expected to put a word in front of ""the"", and a word after it.  For example, if we said, ""A film about the destruction of a World War II German battleship"", you would say ""What is Sink the Bismarck!?"")",100,Title of game show hosted by Joe Farago. or what you hope to do in Monte Carlo,Break the Bank,NA
1986-09-11,J,THE NAVY,,200,"Little damaged in its many battles, it was nicknamed ""Old Ironsides""",the USS Constitution,NA
1986-09-11,J,SWEETS,,200,It's said a choirmaster shaped this candy in honor of shepherds who visited the baby Jesus,the candy cane,NA
1986-09-11,J,"""LITTLE"" SONGS",,200,"It was Jan & Dean, not the Beach Boys, who made it a hit in 1964","""The Little Old Lady From Pasadena""",NA
1986-09-11,J,BEAR FACTS,,200,"From French ""gris"", meaning gray, its name means ""streaked with gray"", not gruesome",grizzly,NA
1986-09-11,J,MOUNTAINS,,200,South Sea country whose south island features the Southern Alps,New Zealand,NA
1986-09-11,J,____ THE ____,"(Alex: And what that means, of course, is that in your response, you'll be expected to put a word in front of ""the"", and a word after it.  For example, if we said, ""A film about the destruction of a World War II German battleship"", you would say ""What is Sink the Bismarck!?"")",200,"Sen. Joseph McCarthy was the 1st guest on this CBS News interview show, Nov. 7,1954",Face the Nation,NA
1986-09-11,J,THE NAVY,,300,Bartlett's says this naval motto is actually a misquote of Capt. James Lawrence's dying command,"""Don\'t give up the ship""",NA
1986-09-11,J,SWEETS,,300,Candy makers in this N.E. Italian city were 1st Europeans to purify sugar into crystals,Venice,NA
1986-09-11,J,"""LITTLE"" SONGS",,300,"In a '60s song sung by Seeger, they were ""all made out of ticky-tacky""","""Little Boxes""",NA
1986-09-11,J,BEAR FACTS,,300,"Traveling at over 5 miles an hour, this is the best swimmer of all bears",the polar bear,NA
1986-09-11,J,MOUNTAINS,,300,"Of volcanic action, crustal uplift, or differential erosion, how Kilimanjaro was formed",volcanic action,NA
1986-09-11,J,____ THE ____,"(Alex: And what that means, of course, is that in your response, you'll be expected to put a word in front of ""the"", and a word after it.  For example, if we said, ""A film about the destruction of a World War II German battleship"", you would say ""What is Sink the Bismarck!?"")",300,"Written the night before it was recorded in 1962, it was Ray Stevens' 1st major hit","""Ahab The Arab""",NA
1986-09-11,J,THE NAVY,,400,The former home of the Chief of Naval Operations is now official residence of this elected official,the vice president of the United States,NA
1986-09-11,J,SWEETS,,400,"In early 20th c., combination candy bars were consumer-tested on crowds at these U.S. athletic events",baseball games,NA
1986-09-11,J,"""LITTLE"" SONGS",,400,"In 1958, the Elegants climbed high by asking it, ""Where are you""","""Little Star""",NA
1986-09-11,J,BEAR FACTS,,400,"In their structure & tooth formation, bears are most closely related to this family of animals",dogs,NA
1986-09-11,J,MOUNTAINS,,NA,"2 of the 3 high-speed ""Mountain"" rides in Disneyland","(2 of) Space Mountain, Big Thunder Mountain Railroad, & Matterhorn Bobsled",NA
1986-09-11,J,____ THE ____,"(Alex: And what that means, of course, is that in your response, you'll be expected to put a word in front of ""the"", and a word after it.  For example, if we said, ""A film about the destruction of a World War II German battleship"", you would say ""What is Sink the Bismarck!?"")",400,Jimmy Durante would yell it to bring a song to a grinding & funny halt,"""Stop the music!""",NA
1986-09-11,J,THE NAVY,,500,"Navy detail drawn by Jack Nicholson in ""The Last Detail""",shore patrol,NA
1986-09-11,NA,NA,NA,NA,NA,NA,NA
1986-09-11,J,"""LITTLE"" SONGS",,500,"Neil Sedaka told her, ""I'm gonna make an angel out of you""","""Little Devil""",NA
1986-09-11,NA,NA,NA,NA,NA,NA,NA
1986-09-11,J,MOUNTAINS,,500,The Pindus Mountains in this country separate Thessaly from Epirus,Greece,NA
1986-09-11,J,____ THE ____,"(Alex: And what that means, of course, is that in your response, you'll be expected to put a word in front of ""the"", and a word after it.  For example, if we said, ""A film about the destruction of a World War II German battleship"", you would say ""What is Sink the Bismarck!?"")",500,Biblical dunker often represented as wearing a camel's hair suit,John the Baptist,NA
1986-09-11,DJ,BROADCAST POLITICS,,200,"Stints as a radio sportscaster for WOC & WHO helped train this ""Great Communicator""",Ronald Reagan,NA
1986-09-11,DJ,NOTORIOUS,,200,His sister said he survived the bolivian shoot out & was reunited in Mexico w/Harry Longbaugh,Butch Cassidy,NA
1986-09-11,NA,NA,NA,NA,NA,NA,NA
1986-09-11,DJ,SPORTS STADIUMS,,200,"Though it's named Exhibition Stadium, this Toronto AL team plays its regular games there",the Blue Jays,NA
1986-09-11,DJ,1957,,200,August 19; that'll be the day Buddy Holly hits the charts with this group,the Crickets,NA
1986-09-11,DJ,ASTROLOGY,,200,"The zodiac is influenced by the ""elements"" water, fire, air & this",earth,NA
1986-09-11,DJ,BROADCAST POLITICS,,400,"""Imprisoned island"" which was the subject of presidential address televised on October 22, 1962",Cuba,NA
1986-09-11,DJ,NOTORIOUS,,400,"When President Carter commuted her prison term, she met the press wearing a T-shirt which read ""pardon me""",Patty Hearst,NA
1986-09-11,NA,NA,NA,NA,NA,NA,NA
1986-09-11,DJ,SPORTS STADIUMS,,400,"Football stadium with the greatest seating capacity in America, it's the UCLA Bruins' home field",the Rose Bowl,NA
1986-09-11,DJ,1957,,400,"Learning how one of these infamous '50s weapons is handled helped ""12 Angry Men"" reach a verdict",a switchblade knife,NA
1986-09-11,NA,NA,NA,NA,NA,NA,NA
1986-09-11,DJ,BROADCAST POLITICS,,600,"When radio was our media hearth, his Fireside Chats comforted a troubled nation",Franklin Roosevelt,NA
1986-09-11,DJ,NOTORIOUS,,600,"Reason the 1919 Chicago White Sox received the nickname ""Black Sox""",a cheating scandal (they fixed the World Series),NA
1986-09-11,NA,NA,NA,NA,NA,NA,NA
1986-09-11,DJ,SPORTS STADIUMS,,600,The Hubert H. Humphrey Metrodome was built to keep this NFL team from moving to warmer climes,the Minnesota Vikings,NA
1986-09-11,DJ,1957,,600,Federal court orders & troops integrated Little Rock's Central High School against wishes of this governor,Faubus,NA
1986-09-11,NA,NA,NA,NA,NA,NA,NA
1986-09-11,DJ,BROADCAST POLITICS,,800,His speech to the Japanese peace treaty conference in 9/51 was TV's 1st coast-to-coast broadcast,Harry S. Truman,NA
1986-09-11,DJ,NOTORIOUS,,800,"Red revisionist who predicted ""In the third year of Soviet rule in America you will no longer chew gum""",Leon Trotsky,NA
1986-09-11,DJ,LATIN,,800,"2 of 3 letters of our English alphabet which, in classical times, Latin lacked","the J, the U, & the W",NA
1986-09-11,DJ,SPORTS STADIUMS,,800,"The major league ballpark, Braves Field, was located in this city",Boston,NA
1986-09-11,DJ,1957,,NA,"He left the following major hit on the charts when he died in June, 6 mos. after his brother:",Jimmy Dorsey,http://www.j-archive.com/media/1986-09-11_DJ_15.mp3
1986-09-11,DJ,ASTROLOGY,,800,"1st published in 1968, over 4½ million copies of her ""Sun Signs"" are now in print",Linda Goodman,NA
1986-09-11,DJ,BROADCAST POLITICS,,1000,"The first series of these were televised May 17-Aug. 7, 1973",the Watergate hearings,NA
1986-09-11,DJ,NOTORIOUS,,1000,"He said, ""We only kill each other,"" & in Beverly Hills in 1947, the mob killed him",Bugsy Siegel,NA
1986-09-11,DJ,LATIN,,1000,"Motto seen on sundials, in Latin it's ""Horas non numero nisi serenas""","""I count none but the sunny hours""",NA
1986-09-11,DJ,SPORTS STADIUMS,,NA,"Only major league stadiums with ""River"" in their names, these 2 NL parks both overlook the Ohio",Three Rivers Stadium & Riverfront Stadium,NA
1986-09-11,DJ,1957,,1000,"His cover as a Brooklyn photographer exposed, this Soviet master spy was finger-printed in 1957",Rudolf Abel,NA
1986-09-11,DJ,ASTROLOGY,,1000,"This 20th c. pres. was the only one born under sign of Gemini, characterized by eloquence, wit & charm",John F. Kennedy,NA
1986-09-11,FJ,ACTORS & ROLES,,NA,"In a 3-year period, 2 actors won Oscars for playing this character in different films",The Godfather,NA
