date,round,category,comment,value,clue,response,link
2015-12-18,J,FILL IN THE BLANK CANVAS,"(Alex: We're talking about paintings, obviously.)",200,"Van Gogh's ""Self-Portrait with Pipe and Bandaged ____""",ear,NA
2015-12-18,J,MOVIE CAMEOS,,200,"(Dan Patrick reads the clue.)  My good friend Adam Sandler has cast me in 9 of his films, including ""Grown Ups 2"" in which I played a gym teacher dressed as this 1980s Celtics legend",Larry Bird,http://www.j-archive.com/media/2015-12-18_J_11a.jpg
2015-12-18,J,ANAGRAMMED FORMER WORLD LEADERS,,200,"A sari wearer:HI, GRAND INDIA!",Indira Gandhi,NA
2015-12-18,J,NUT-TRITION,,200,Almonds are an excellent source of fiber & this bone-building element--got milk?,calcium,NA
2015-12-18,J,CEREMONIES,,200,"This Christian sacrament, a holy ceremony, is also called Eucharist",communion,NA
2015-12-18,J,THE NEW YORK TIMES CROSSWORD,"(Will Shortz: In honor of Crossword Puzzle Day on Monday, I'm puzzle editor Will Shortz.  You'll do better at home in this category if you worked on our crosswords this week.)",200,"(Will Shortz delivers the clue.)  Monday had a presidential theme; one clue was to this ""supply-side fiscal policy popularized in the 1980s""",Reaganomics,http://www.j-archive.com/media/2015-12-18_J_26.jpg
2015-12-18,J,FILL IN THE BLANK CANVAS,"(Alex: We're talking about paintings, obviously.)",400,"Jonathan Buttall is thought to be Gainsborough's model for ""The ____ Boy""",Blue,NA
2015-12-18,J,MOVIE CAMEOS,,400,"In ""Twilight"" this author has a cameo as a customer in a diner with a veggie plate",(Stephenie) Meyer,NA
2015-12-18,J,ANAGRAMMED FORMER WORLD LEADERS,,400,In Italy:VIRILE SLOB COUSIN,Silvio Berlusconi,NA
2015-12-18,J,NUT-TRITION,,400,"These biggies from the Amazon basin have many health benefits, but with their high selenium content, too many can be harmful",Brazil nuts,NA
2015-12-18,J,CEREMONIES,,NA,"A ceremony on November 19, 1863 dedicated a cemetery in this town",Gettysburg,NA
2015-12-18,J,THE NEW YORK TIMES CROSSWORD,"(Will Shortz: In honor of Crossword Puzzle Day on Monday, I'm puzzle editor Will Shortz.  You'll do better at home in this category if you worked on our crosswords this week.)",400,"(Will Shortz delivers the clue.)  On Tuesday we had some hidden Bobs; you'll find Dylan in this ""classic board game with a peppermint forest""",Candy Land,http://www.j-archive.com/media/2015-12-18_J_27.jpg
2015-12-18,J,FILL IN THE BLANK CANVAS,"(Alex: We're talking about paintings, obviously.)",600,"Seurat got to the point in ""A ____ Afternoon on the Island of La Grande Jatte""",Sunday,NA
2015-12-18,J,MOVIE CAMEOS,,600,"(Al Michaels delivers the clue.)  Well, I didn't win an Oscar playing myself in this 1996 movie but Cuba Gooding Jr. did for his performance as a wide receiver for the Cardinals",Jerry Maguire,http://www.j-archive.com/media/2015-12-18_J_13.jpg
2015-12-18,J,ANAGRAMMED FORMER WORLD LEADERS,,600,Uh oh!  Panama!:GENUINE AMORAL,Manuel Noriega,NA
2015-12-18,J,NUT-TRITION,,600,"A key ingredient in pesto, these nuts are an excellent source of vitamin E",pine nuts,http://www.j-archive.com/media/2015-12-18_J_08.jpg
2015-12-18,J,CEREMONIES,,600,Vice presidents are often sent to this type of ceremony overseas; Al Gore attended Mitterrand's in 1996,funerals,NA
2015-12-18,J,THE NEW YORK TIMES CROSSWORD,"(Will Shortz: In honor of Crossword Puzzle Day on Monday, I'm puzzle editor Will Shortz.  You'll do better at home in this category if you worked on our crosswords this week.)",600,"(Will Shortz delivers the clue.)  On Wednesday you had to know compound words where each half could also have ""dead"" before it--there was airline, seahorse & this response to ""top on official stationery""",letterhead,http://www.j-archive.com/media/2015-12-18_J_28.jpg
2015-12-18,J,FILL IN THE BLANK CANVAS,"(Alex: We're talking about paintings, obviously.)",800,"Duchamp caused a scandal with his ""Nude Descending a ____, No. 2""",staircase,NA
2015-12-18,J,MOVIE CAMEOS,,800,Julia Roberts played this title crusader in a 2000 film while the real woman had a cameo as a waitress,Erin Brockovich,NA
2015-12-18,J,ANAGRAMMED FORMER WORLD LEADERS,,800,He Laboured over Britain:BRAINY LOT,Tony Blair,NA
2015-12-18,J,NUT-TRITION,,800,"Pistachios get their green color mostly from lutein, which is essential to this one of the 5 senses",vision,NA
2015-12-18,J,CEREMONIES,,800,Giant scissors are mainly used for this type of ceremony at the grand opening of a new facility,a ribbon cutting,NA
2015-12-18,J,THE NEW YORK TIMES CROSSWORD,"(Will Shortz: In honor of Crossword Puzzle Day on Monday, I'm puzzle editor Will Shortz.  You'll do better at home in this category if you worked on our crosswords this week.)",800,"(Will Shortz delivers the clue.)  On Thursday we rolled the D-I-C-E, as in these, ""racy books named after a Victorian garment""",bodice ripper,http://www.j-archive.com/media/2015-12-18_J_29.jpg
2015-12-18,J,FILL IN THE BLANK CANVAS,"(Alex: We're talking about paintings, obviously.)",1000,"Dali gave it a name that stuck: ""The Persistence of ____""",memory,NA
2015-12-18,J,MOVIE CAMEOS,,1000,"From ""Rebecca"" on, this director appeared in all of his films; he sat next to Cary Grant on a bus in ""To Catch a Thief""",(Alfred) Hitchcock,NA
2015-12-18,J,ANAGRAMMED FORMER WORLD LEADERS,,1000,Late Israeli leader:SOLAR HERNIA,Ariel Sharon,NA
2015-12-18,J,NUT-TRITION,,1000,Have some hazelnuts before bed; they're high in this sleep-aiding amino acid that's also found in turkey,tryptophan,NA
2015-12-18,J,CEREMONIES,,1000,"An accolade, a ceremonial tap on the shoulder with a sword, is followed by the words ""I dub thee"" this",knight,NA
2015-12-18,J,THE NEW YORK TIMES CROSSWORD,"(Will Shortz: In honor of Crossword Puzzle Day on Monday, I'm puzzle editor Will Shortz.  You'll do better at home in this category if you worked on our crosswords this week.)",1000,"(Will Shortz delivers the clue.)  On Friday there's no theme, so you just have to know this 10-letter ""TV host who followed Jimmy Fallon on late night""",Seth Meyers,http://www.j-archive.com/media/2015-12-18_J_30.jpg
2015-12-18,DJ,THE ROMANTIC POETS,,400,This title character of a Coleridge poem must wander the world recounting the tale of his days at sea,the Ancient Mariner,NA
2015-12-18,DJ,"HONEST ""ABE""",,400,To mark a product incorrectly,mislabel,NA
2015-12-18,DJ,PALACES,,400,"This ""seasonal"" palace has been called ""St. Petersburg's most famous building""",the Winter Palace for the Romanovs,NA
2015-12-18,DJ,INTERNATIONAL SWIMMING HALL OF FAMERS,,400,"Inducted in 1977, this American who'd been laden with gold at Munich 5 years earlier",Mark Spitz,NA
2015-12-18,DJ,MINNEAPOLIS,,400,"In 2001 General Mills bought this other Minneapolis-based baking giant for $10.5 billion; that's a lot of dough, boy",Pillsbury,NA
2015-12-18,DJ,ST. PAUL,,400,In Acts 9 Paul gets a call from the Lord near this Syrian city,Damascus,NA
2015-12-18,DJ,THE ROMANTIC POETS,,800,Keats was inspired to write an ode to this bird by the song of one that nested in Charles Brown's garden,a nightingale,NA
2015-12-18,DJ,"HONEST ""ABE""",,800,"William Blackstone called it ""the great and efficacious writ, in all manner of illegal confinement""",habeas corpus,NA
2015-12-18,DJ,PALACES,,800,"Lhasa's Potala Palace would be a nice place for this religious leader, who fled in 1959, to come home to, if he ever can",the Dalai Lama,http://www.j-archive.com/media/2015-12-18_DJ_10.jpg
2015-12-18,DJ,INTERNATIONAL SWIMMING HALL OF FAMERS,,NA,"This oceanographer & inventor, 1910-1997",(Jacques) Cousteau,NA
2015-12-18,DJ,MINNEAPOLIS,,800,Minneapolis is the home town of this pop icon; his Paisley Park Studios are about a half hour away,Prince,NA
2015-12-18,DJ,ST. PAUL,,800,"Paul & Barnabas preached to big crowds in Antioch, where Acts 11 says the Disciples were first called these",Christians,NA
2015-12-18,DJ,THE ROMANTIC POETS,,1200,"After part of ""Childe Harold's Pilgrimage"" was published, this lord ""awoke one morning and found myself famous""",Lord Byron,NA
2015-12-18,DJ,"HONEST ""ABE""",,1200,A young pine or fir stem tossed in Highland Games,the caber,NA
2015-12-18,DJ,PALACES,,1200,"Istana Nurul Iman, the palace of the sultan of this country, features an air conditioned stable & a mosque for 1,500 people",Brunei,NA
2015-12-18,DJ,INTERNATIONAL SWIMMING HALL OF FAMERS,,1200,1993:This 4-time Olympic gold medalist who did much of his swimming following a dive,Greg Louganis,NA
2015-12-18,DJ,MINNEAPOLIS,,1200,"Foshay Tower was Minneapolis' tallest when opened in this year; Mr. Foshay's business promptly collapsed, but the tower stands",1929,http://www.j-archive.com/media/2015-12-18_DJ_28a.jpg
2015-12-18,DJ,ST. PAUL,,1200,Paul's New Testament letters include 2 to these Greeks who gave their name to an order of classical architecture,the Corinthians,NA
2015-12-18,DJ,THE ROMANTIC POETS,,1600,"His first major work was ""The Lay of the Last Minstrel"", a poem set on & north of England's northern border",Sir Walter Scott,NA
2015-12-18,DJ,"HONEST ""ABE""",,1600,This word for the science of baseball analytics comes from the name of a research society,sabermetrics,NA
2015-12-18,DJ,PALACES,,NA,Ponder the tragic life of Crown Prince Rudolf in his lavish suite in this capital's Schonbrunn Palace,Vienna,NA
2015-12-18,DJ,INTERNATIONAL SWIMMING HALL OF FAMERS,,1600,"This prince shown as a young man, later chairman of the Monegasque Swimming Federation",(Prince) Albert,http://www.j-archive.com/media/2015-12-18_DJ_26.jpg
2015-12-18,DJ,MINNEAPOLIS,,1600,Drive your toy truck to this 12-mile-long lake in the western suburbs,Minnetonka,NA
2015-12-18,DJ,ST. PAUL,,1600,"The lord calls Paul a ""chosen vessel... to bear my name before"" these non-Jews",gentiles,NA
2015-12-18,DJ,THE ROMANTIC POETS,,2000,"The play in verse about this Greek god ""Unbound"" is often regarded as Shelley's greatest work",Prometheus,NA
2015-12-18,DJ,"HONEST ""ABE""",,2000,Early scientific instrument used to measure the altitude of celestial objects,an astrolabe,NA
2015-12-18,DJ,PALACES,,2000,"Overlooking Granada, Spain, it has a name from Arabic for ""Red"", probably from the bricks of the outer walls",the Alhambra,NA
2015-12-18,DJ,INTERNATIONAL SWIMMING HALL OF FAMERS,,2000,"This U.S. champ who helped bring the swimming movie to Hollywood with films like ""Bathing Beauty""",Esther Williams,NA
2015-12-18,DJ,MINNEAPOLIS,,2000,"Before the Twins, fans rooted for this minor league team named for the many locals who worked grinding flour",the Millers,NA
2015-12-18,DJ,ST. PAUL,,2000,Paul was born Saul in this Asia minor city around 4 B.C.,Tarsus,NA
2015-12-18,FJ,AMERICANA,,NA,"While working for a plastics company, Don Featherstone created this iconic lawn decor, basing it on photos in National Geographic",a pink flamingo,NA
