date,round,category,comment,value,clue,response,link
1988-03-25,J,REPTILES,,100,Funk & Wagnalls says this is the principal activity of both sexes of alligators in the spring,mating,NA
1988-03-25,J,SAINTS,,100,"Boy Scouts in England know that this man, their patron saint, also holds that post for the country",Saint George,NA
1988-03-25,J,EASY SONGS,,100,"In 1982, country crooner Janie Fricke sang that despite appearances, ""It Ain't Easy Bein'"" this",Easy,NA
1988-03-25,J,FORECASTERS,,100,"Celebrity Register calls her ""America's foremost psychic""; the tabloids called her for predictions",Jeane Dixon,NA
1988-03-25,J,LANDMARKS,,100,This complex includes the Conference & Secretariat Buildings & the General Assembly Hall,the United Nations complex,NA
1988-03-25,J,A.K.A.,,100,"Tho he's really from Brooklyn, Edward Thomas hopped to the top as a country singer with this name",Eddie Rabbitt,NA
1988-03-25,J,REPTILES,,200,It's reported Capt. Cook gave one of these to the King of Tonga in the 1770s & it lived into the 1960s,a tortoise,NA
1988-03-25,J,SAINTS,,200,Saint who got his name from giving Jesus a piggyback ride across a river,Saint Christopher,NA
1988-03-25,NA,NA,NA,NA,NA,NA,NA
1988-03-25,J,FORECASTERS,,200,"For ""Good Morning America"", it's Spencer Christian",the weather forecaster,NA
1988-03-25,J,LANDMARKS,,200,"In a June 1987 speech, Reagan challenged Gorbachev to ""tear down this wall""",the Berlin Wall,NA
1988-03-25,J,A.K.A.,,200,His real name is Michael J. Pollack,Michael J. Pollard,NA
1988-03-25,J,REPTILES,,300,Only when a snake is at rest does it stop its constant extending & withdrawing of this,the tongue,NA
1988-03-25,J,SAINTS,,300,This saint's feast day is December 6; St. Anastasia got the 25th,Saint Nicholas,NA
1988-03-25,NA,NA,NA,NA,NA,NA,NA
1988-03-25,J,FORECASTERS,,300,"She, according to legend, forecast the fall of Troy, but, alas, was not believed",Cassandra,NA
1988-03-25,J,LANDMARKS,,300,Site of the U.S.S. Arizona Memorial,Pearl Harbor,NA
1988-03-25,J,A.K.A.,,300,"Some say his real name was George Brewer, some say George Beselo, but all say he was ""Superman""",George Reeves,NA
1988-03-25,J,REPTILES,,NA,The St. Louis Zoo clocked a lizard-like male tuatara doing this only 4 times in 1 minute,breathing,NA
1988-03-25,J,SAINTS,,400,The patron saint who stands against atheistic communism & for children's aspirin,Saint Joseph,NA
1988-03-25,NA,NA,NA,NA,NA,NA,NA
1988-03-25,J,FORECASTERS,,400,"Spatulamancers divine the future by ""reading"" this specific bone of an animal",the shoulder blade,NA
1988-03-25,J,LANDMARKS,,400,The original Hull House founded by Jane Addams & Ellen Starr is on the campus of this city's U.,Chicago,NA
1988-03-25,J,A.K.A.,,400,One source says Suzanne Bruce so admired this leading man that she changed her name to Jane Powell,Dick Powell,NA
1988-03-25,J,REPTILES,,500,A baby green mamba loses this off the tip of its snout soon after breaking out of its shell,its egg tooth,NA
1988-03-25,J,SAINTS,,500,"In the Roman Church, beatification is the step before this, which makes one a saint",canonization,NA
1988-03-25,NA,NA,NA,NA,NA,NA,NA
1988-03-25,NA,NA,NA,NA,NA,NA,NA
1988-03-25,J,LANDMARKS,,500,If you want to see where the Medici skeletons are buried go to this city's Church of San Lorenzo,Florence,NA
1988-03-25,J,A.K.A.,,500,This co-founder of the United Artists studio was born Douglas Ullman,Douglas Fairbanks,NA
1988-03-25,DJ,U.S. HISTORY,,200,"In 1903, the U.S. & U.K. settled their old dispute over the boundary between Canada & this U.S. territory",Alaska,NA
1988-03-25,DJ,9-LETTER WORDS,,NA,"9-letter word found in the title of the following:""Spider Murphy played the tenor saxophone /Little Joe was blowin' on the slide trombone /The drummer boy from Illinois went crash, boom, bang...""","jailhouse (""Jailhouse Rock"" by Elvis Presley)",NA
1988-03-25,DJ,SHIPS,,200,"In October 1987, in the S. Pacific, one of these erupted 130' beneath the research ship Melville",a volcano,NA
1988-03-25,DJ,WOMEN IN FICTION,,200,Both Rebecca & Rowena love this title hero of a Sir Walter Scott romance,(Wilfred of) Ivanhoe,NA
1988-03-25,DJ,THE MOUNTIES,,200,"Mounties must have a Canadian driver's license & no criminal record, & speak either of these 2 languages",English & French,NA
1988-03-25,DJ,GOING FOR BAROQUE,,200,"Antonio Vivaldi dies in poverty & obscurity in this Austrian city, not his native Venice",Vienna,NA
1988-03-25,DJ,U.S. HISTORY,,400,"It was the colonial capital of Virginia in 1700 & when you visit it today, you'll swear it still is",Williamsburg,NA
1988-03-25,DJ,9-LETTER WORDS,,400,"Traditionally, hay fever sufferers have blamed this for their misery, but ragweed is the real culprit",goldenrod,NA
1988-03-25,DJ,SHIPS,,400,In Sept. 1987 the Walt Disney Company announced plans to buy this Calif. tourist attraction,the Queen Mary,NA
1988-03-25,DJ,WOMEN IN FICTION,,400,"Esmeralda, a lovely gypsy accused of witchcraft, finds a genuine protector in him",The Hunchback of Notre-Dame,NA
1988-03-25,DJ,THE MOUNTIES,,400,These people have been recruited as Mounties only since 1974,women,NA
1988-03-25,DJ,GOING FOR BAROQUE,,400,"Like many notable Baroque composers, Couperin held this instrumental post in a church",organist,NA
1988-03-25,DJ,U.S. HISTORY,,600,This was finally ratified 3/4 of the states & went into force in December 1791,the Bill of Rights,NA
1988-03-25,NA,NA,NA,NA,NA,NA,NA
1988-03-25,DJ,SHIPS,,600,"For clipper ships, this attribute was the top priority",speed,NA
1988-03-25,DJ,WOMEN IN FICTION,,600,"The nickname of Annie P. Miller, heroine of a Henry James novella",Daisy Miller,NA
1988-03-25,DJ,THE MOUNTIES,,600,The Mounties are the only police force in these 2 Canadian territories,the Yukon Territory & the Northwest Territories,NA
1988-03-25,DJ,GOING FOR BAROQUE,,600,Most authorities recognize the beginning of this century as the start of the Baroque period,the 17th century,NA
1988-03-25,DJ,U.S. HISTORY,,800,"Though the 4th, not the 1st, chief justice, he did more than any other to shape the Supreme Court",John Marshall,NA
1988-03-25,NA,NA,NA,NA,NA,NA,NA
1988-03-25,DJ,SHIPS,,800,"Mississippi riverboat named for the outlet of the Sacramento River, where it originally ran",the Delta Queen,NA
1988-03-25,DJ,WOMEN IN FICTION,,800,She was the object of Heathcliff's obsessive desire,Cathy (Earnshaw),NA
1988-03-25,DJ,THE MOUNTIES,,800,"The Mounties weren't ""Royal"" until 1904, by this monarch's decree",Edward VII,NA
1988-03-25,NA,NA,NA,NA,NA,NA,NA
1988-03-25,DJ,U.S. HISTORY,,1000,"Usually known by name of a Maryland creek, this 1862 battle is known as the bloodiest day of the Civil War",Antietam,NA
1988-03-25,NA,NA,NA,NA,NA,NA,NA
1988-03-25,DJ,SHIPS,,1000,The 1st nuclear submarine was produced in this state's shipyards,Connecticut,NA
1988-03-25,DJ,WOMEN IN FICTION,,1000,"Supposedly, Tolstoy got the idea for this book after seeing a woman who had jumped in front of a train",Anna Karenina,NA
1988-03-25,DJ,THE MOUNTIES,,NA,"Besides Quebec, the only Canadian province not policed by the Mounties",Ontario,NA
1988-03-25,NA,NA,NA,NA,NA,NA,NA
1988-03-25,FJ,CENTRAL AMERICA,,NA,"Some 18 years before starting Panama Canal, the U.S. began a canal in this country but abandoned it",Nicaragua,NA
