date,round,category,comment,value,clue,response,link
2016-06-10,NA,NA,NA,NA,NA,NA,NA
2016-06-10,J,WORD ORIGINS,,200,"This place where alcoholic drinks are sold is derived from a slightly shorter, ""fashionable"" French word",saloon,NA
2016-06-10,J,JAPANESE CITIES,,200,"Yes, that's a roller coaster passing through the centerless Big O Ferris wheel in this capital of Japan",Tokyo,http://www.j-archive.com/media/2016-06-10_J_22.jpg
2016-06-10,J,AWARDS,,200,"(I'm Lin-Manuel Miranda.)  In 2008 I won a Tony for Best Original Score for my musical ""In the Heights""; that is, Washington Heights, far uptown in this borough",Manhattan,http://www.j-archive.com/media/2016-06-10_J_17a.jpg
2016-06-10,J,HERE'S TO 50 GREAT YEARS,,200,1650:The 787-carat Great Mogul Diamond is found in a mine in this country,India,NA
2016-06-10,J,THAT'S MY DEPARTMENT!,,200,"Cordell Hull,John Kerry,George P. Shultz",State,NA
2016-06-10,NA,NA,NA,NA,NA,NA,NA
2016-06-10,J,WORD ORIGINS,,400,"From Latin for ""cleanse"", it's the place where one's soul is cleansed before entering heaven",purgatory,NA
2016-06-10,NA,NA,NA,NA,NA,NA,NA
2016-06-10,J,AWARDS,,400,"2012's Best Original Screenplay Oscar went to him for ""Django Unchained""",Quentin Tarantino,NA
2016-06-10,J,HERE'S TO 50 GREAT YEARS,,400,"1350:In the great battle of Les Espagnols sur Mer, an English fleet defeats one from this nation",Spain,NA
2016-06-10,J,THAT'S MY DEPARTMENT!,,400,"Andrew W. Mellon,Henry M. Paulson,George P. Shultz",Treasury,NA
2016-06-10,NA,NA,NA,NA,NA,NA,NA
2016-06-10,J,WORD ORIGINS,,600,"Often eaten with eggs at breakfast, it comes from Latin for ""dry"" or ""parch""",toast,NA
2016-06-10,NA,NA,NA,NA,NA,NA,NA
2016-06-10,J,AWARDS,,600,In 1962 Don Drysdale won the Cy Young Award; the next year it was this Dodgers teammate,Sandy Koufax,NA
2016-06-10,J,HERE'S TO 50 GREAT YEARS,,600,"1850:Henry Clay, the ""Great"" this-""er"", gets Congress to adopt this",Compromise,NA
2016-06-10,J,THAT'S MY DEPARTMENT!,,600,"Robert Reich,Elaine Chao,George P. Shultz",Labor,NA
2016-06-10,J,BASKET WEAVING,,800,This ancient Basque sport uses a weaved basketlike glove called a cesta & a ball called a pelota,jai alai,NA
2016-06-10,J,WORD ORIGINS,,800,"From a word for ""apple"", it's a bag of aromatic substances placed in a dresser drawer",pomander,NA
2016-06-10,J,JAPANESE CITIES,,800,"Koromo got this new name in 1959 to reflect the importance of its major employer, an auto manufacturer",Toyota,NA
2016-06-10,J,AWARDS,,800,"From 2000 through 2003 this fast-moving, fast-talking political drama won the Drama Series Emmy",The West Wing,NA
2016-06-10,J,HERE'S TO 50 GREAT YEARS,,800,"1950:In Boston ""Fats"" Pino & 10 accomplices pull off the ""Great"" this company ""Robbery""",Brink\'s,NA
2016-06-10,J,THAT'S MY DEPARTMENT!,,800,"Shirley Hufstedler,William Bennett,Margaret Spellings",Education,NA
2016-06-10,J,BASKET WEAVING,,1000,"(Jimmy of the Clue Crew presents.)  In basket weaving, the weft is a moving horizontal fiber; & this other 4-letter word refers to a vertical stationary fiber",warp,http://www.j-archive.com/media/2016-06-10_J_25a.jpg
2016-06-10,J,WORD ORIGINS,,1000,"In Dutch it meant ""household effects""; its meaning as goods taken by force during a war dates to the 1640s",plunder,NA
2016-06-10,J,JAPANESE CITIES,,NA,"This city was home to the royal family for 1,074 years, from the Heian Period to the Meiji Restoration",Kyoto,NA
2016-06-10,J,AWARDS,,1000,"This stammering comedian with ""new"" in his name won the 1960 Best New Artist Grammy",Bob Newhart,NA
2016-06-10,J,HERE'S TO 50 GREAT YEARS,,1000,"1250:The death of Frederick II ushers in the ""Great"" this, from the Latin for ""between"" & ""reign""",Interregnum,NA
2016-06-10,J,THAT'S MY DEPARTMENT!,,1000,"J. Sterling Morton,Earl Butz,Mike Espy",Agriculture,NA
2016-06-10,DJ,THESPIANISTS,,400,"Dude!  He played Jack Baker, one half of ""The Fabulous"" piano-playing ""Baker Boys""",Jeff Bridges,NA
2016-06-10,DJ,RELIGIOUS LANDMARKS,,400,"Salt Lake City structure where you'll find an 11,000-pipe organ",Tabernacle,NA
2016-06-10,DJ,ITALIAN FOOD,,400,"Caprino, usually made from the milk of this animal, is a soft cheese that will highlight your spinach omelet",a goat,NA
2016-06-10,DJ,"""OO"" IN THE MIDDLE, SORRY","(Alex: Each correct response will have a double ""O"" in exactly the center of the word.)",400,Chess piece that fits the category,a rook,NA
2016-06-10,DJ,VICTORIAN VERSE,,400,"""Though I've belted you an' flayed you, by the livin' Gawd that made you, you're a better man than I am"", this character",Gunga Din,NA
2016-06-10,DJ,LADIES & GENTLEMEN... THE BEETLES!,"(Alex: Notice the spelling there, though.)",400,"In the late 1800s this ""fly away home"" beetle was brought in to save California's citrus crops from insect pests",ladybug,NA
2016-06-10,DJ,THESPIANISTS,,800,"Goodness, gracious, Dennis Quaid pounded the ivories in this 1989 biopic; catch Alec Baldwin as Jimmy Swaggart",Great Balls of Fire!,NA
2016-06-10,DJ,RELIGIOUS LANDMARKS,,800,The chimeras have a great view of Paris from this cathedral that they decorate,Notre Dame,http://www.j-archive.com/media/2016-06-10_DJ_14.jpg
2016-06-10,DJ,ITALIAN FOOD,,800,This Italian ice cream is denser than regular ice cream & has less butterfat,gelato,NA
2016-06-10,DJ,"""OO"" IN THE MIDDLE, SORRY","(Alex: Each correct response will have a double ""O"" in exactly the center of the word.)",800,Time to give us this time of day,noon,NA
2016-06-10,DJ,VICTORIAN VERSE,,NA,"This musician character claimed to have a secret charm that he chiefly used ""on creatures that do people harm""",the Pied Piper of Hamelin,NA
2016-06-10,DJ,LADIES & GENTLEMEN... THE BEETLES!,"(Alex: Notice the spelling there, though.)",NA,"This type of beetle with a biblical name is one of the largest, growing about 5 inches long & weighing 3 1/2 oz.",a Goliath beetle,NA
2016-06-10,DJ,THESPIANISTS,,1200,"Adrien Brody's performance as ""The Pianist"" helped this controversial director win an Oscar",(Roman) Polanski,NA
2016-06-10,DJ,RELIGIOUS LANDMARKS,,1200,"This small shrine, the cube-shaped structure towards which Muslims orient themselves & pray, is in the Great Mosque",the Kaaba,NA
2016-06-10,DJ,ITALIAN FOOD,,1200,"This tiny rice-shaped pasta whose name means ""barley"" is often used in soups",orzo,http://www.j-archive.com/media/2016-06-10_DJ_21a.jpg
2016-06-10,DJ,"""OO"" IN THE MIDDLE, SORRY","(Alex: Each correct response will have a double ""O"" in exactly the center of the word.)",1200,To secure a ship by cables,moor,NA
2016-06-10,DJ,VICTORIAN VERSE,,1200,"""In silver armour"", this Tennyson knight ""saw the grail, the Holy Grail, descend upon the shrine""",Galahad,NA
2016-06-10,DJ,LADIES & GENTLEMEN... THE BEETLES!,"(Alex: Notice the spelling there, though.)",1200,"Consisting of 3 segments, each with a pair of legs, this forms the middle of a beetle's body",the thorax,NA
2016-06-10,DJ,THESPIANISTS,,1600,"As the mute Ada McGrath, this actress went to New Zealand with ""The Piano"" in 1993",Holly Hunter,NA
2016-06-10,DJ,RELIGIOUS LANDMARKS,,1600,"On a trip to Yangon in this country, visit the Shwedagon Pagoda, said to enshrine strands of Buddha's hair",Myanmar (Burma accepted),http://www.j-archive.com/media/2016-06-10_DJ_17.jpg
2016-06-10,DJ,ITALIAN FOOD,,1600,Spaghetti alle vongole is spaghetti served with these shellfish,clams,NA
2016-06-10,DJ,"""OO"" IN THE MIDDLE, SORRY","(Alex: Each correct response will have a double ""O"" in exactly the center of the word.)",1600,"If you're ""in"" this furrow, you're doing very well",the groove,NA
2016-06-10,NA,NA,NA,NA,NA,NA,NA
2016-06-10,DJ,LADIES & GENTLEMEN... THE BEETLES!,"(Alex: Notice the spelling there, though.)",1600,"The male of the American this beetle is a dark brown scarab, about 1 inch long, with a single upright horn",a rhinoceros,NA
2016-06-10,DJ,THESPIANISTS,,2000,"He played Bobby Dupea, a classical pianist turned oil rigger, a man who ordered a chicken salad sandwich, hold the chicken",Jack Nicholson,NA
2016-06-10,DJ,RELIGIOUS LANDMARKS,,2000,"Sri Harmandir Sahib, or the Golden Temple, in the Punjab city of Amritsar, is a holy site in this religion",Sikh,NA
2016-06-10,DJ,ITALIAN FOOD,,2000,"This bread salad is made with bread soaked in water, onions, tomatoes, basil, olive oil, vinegar & seasonings",panzanella,NA
2016-06-10,DJ,"""OO"" IN THE MIDDLE, SORRY","(Alex: Each correct response will have a double ""O"" in exactly the center of the word.)",2000,"Profession of J.P.F. Blanchard, the first man to see Philadelphia from the air",a balloonist,NA
2016-06-10,DJ,VICTORIAN VERSE,,2000,A.E. Housman hadn't visited Shropshire when he used it in the title of this 1896 collection,A Shropshire Lad,NA
2016-06-10,DJ,LADIES & GENTLEMEN... THE BEETLES!,"(Alex: Notice the spelling there, though.)",2000,"Totaling about 8,000 species, this beetle gets its name from the sound it makes when it jumps",click,NA
2016-06-10,FJ,FAMOUS AMERICANS,,NA,"Of his greatest accomplishment, he humbly remarked, ""Pilots... take pride in a good landing, not in getting out of the vehicle""",Neil Armstrong,NA
