date,round,category,comment,value,clue,response,link
1995-02-16,J,JAPAN,,100,From Gogome station it's about a 5-hour climb to the top of this mountain,Mt. Fuji,NA
1995-02-16,J,TV PERSONALITIES,,100,"In June 1994 this ""Wheel of Fortune"" star gave birth to son Nicholas John Santo Pietro",Vanna White,NA
1995-02-16,J,THE 1970s,,100,In April 1970 protests against pollution & other threats to the planet marked the 1st observance of this,Earth Day,NA
1995-02-16,J,NUTRITION,,100,Generally a saturated one of these is solid at room temperature,a fat,NA
1995-02-16,J,SHAKESPEARE,,100,This play's famous balcony scene takes place in a garden after a ball,Romeo and Juliet,NA
1995-02-16,J,COMMON BONDS,,100,"Goose,straw,huckle",berries,NA
1995-02-16,J,JAPAN,,200,The A-bomb dome is the only structural ruin left standing in this city,Hiroshima,NA
1995-02-16,J,TV PERSONALITIES,,200,"On Oct. 23, 1994 this talk show hostess ran the Marine Corps marathon in under 4 1/2 hours",Oprah,NA
1995-02-16,J,THE 1970s,,200,In a 1972 report the person in this post warned of the danger of secondhand smoke,the Surgeon General,NA
1995-02-16,J,NUTRITION,,200,This part of an egg is rich in pantothenic acid,the yolk,NA
1995-02-16,J,SHAKESPEARE,,200,"The queen who says, ""Go tell him I have slain myself; say that the last I spoke was 'Antony'""",Cleopatra,NA
1995-02-16,J,COMMON BONDS,,200,"Nurse,loan,hammerhead",shark,NA
1995-02-16,J,JAPAN,,300,The earliest recorded matches in this Japanese wrestling form were held around 23 B.C.,sumo,NA
1995-02-16,J,TV PERSONALITIES,,300,"In addition to playing lovable loser George Costanza on ""Seinfeld"", he's the cartoon voice of Duckman",Jason Alexander,NA
1995-02-16,J,THE 1970s,,300,"In 1971 this country's dictator ""Papa Doc"" Duvalier died & was succeeded by his son ""Baby Doc""",Haiti,NA
1995-02-16,J,NUTRITION,,300,The average person consumes 18% of calories in refined or processed forms of this simple carbohydrate,sugar,NA
1995-02-16,J,SHAKESPEARE,,300,"This title character says, ""Iago is most honest""--what a mistake",Othello,NA
1995-02-16,J,COMMON BONDS,,300,"Chain,business,Dear John",letter,NA
1995-02-16,J,JAPAN,,400,"Each May Shimoda, Japan holds the Black Ship Festival to commemorate this commodore's arrival in 1854",Commodore Perry,NA
1995-02-16,J,TV PERSONALITIES,,400,"This star of ""Frasier"" sings the show's closing theme, ""Tossed Salads And Scrambled Eggs""",Kelsey Grammer,NA
1995-02-16,J,THE 1970s,,400,This American resigned his World Chess Championship in 1974,Bobby Fischer,NA
1995-02-16,J,NUTRITION,,400,"All of the ""essential"" ones of these protein building blocks can be obtained by combining grains and legumes",amino acids,NA
1995-02-16,J,SHAKESPEARE,,400,"Rosencrantz & Guildenstern don't appear in this play until Act II, scene II",Hamlet,NA
1995-02-16,J,COMMON BONDS,,400,"Magnetic,Space,darning",needles,NA
1995-02-16,J,JAPAN,,500,"This, the Japanese parliament, is housed in a pyramid-topped building completed in 1936",the Diet,NA
1995-02-16,J,TV PERSONALITIES,,500,"In November 1994 this TV ""Superman"" star showed his athletic prowess on ""American Gladiators""",Dean Cain,NA
1995-02-16,J,THE 1970s,,NA,"As a follow-up to the Camp David Accords, these two countries signed a formal peace treaty March 26, 1979",Egypt and Israel,NA
1995-02-16,J,NUTRITION,,500,"A food's dietary amount of this, also called roughage, may be several times the ""crude"" amount",fiber,NA
1995-02-16,J,SHAKESPEARE,,500,"Ovid's ""Metamorphoses"" inspired the play-within-a-play about Pyramus & Thisbe in this comedy",A Midsummer Night\'s Dream,NA
1995-02-16,J,COMMON BONDS,,500,"Hair,tooth,pastry",brushes,NA
1995-02-16,DJ,CONSTITUTIONAL AMENDMENTS,,200,"This amendment says no person ""shall be compelled in any criminal case to be a witness against himself""",the fifth amendment,NA
1995-02-16,DJ,ART CLASS,,200,"""Motionless"" term for the type of painting that the Dutch call stilleven",still life,NA
1995-02-16,DJ,MAMMALS,,200,"The name of this huge mammal is from 2 Greek words meaning ""nose-horned""",a rhinoceros,NA
1995-02-16,DJ,NOTORIOUS,,200,The October 1881 gunfight at this corral didn't end the feud between the Earps & the Clantons,the OK Corral,NA
1995-02-16,DJ,ITALIAN SCIENCE,,200,"Giovanni Schiaparelli first described the canali, Italian for channels, of this planet",Mars,NA
1995-02-16,DJ,"""G""EOGRAPHY",(Alex: Each correct response will begin with that letter of the alphabet.),200,"Only about 5% of this desert, Asia's largest is covered by sand dunes",the Gobi,NA
1995-02-16,DJ,CONSTITUTIONAL AMENDMENTS,,400,"Ratified in 1913, the 16th amendment reduced net pay by authorizing this",an income tax,NA
1995-02-16,DJ,ART CLASS,,400,"This technique often involves the hands & arms too, not just the digits as its name implies",finger-painting,NA
1995-02-16,DJ,MAMMALS,,400,It's the first four-legged mammal listed in the World Book Encyclopedia,the aardvark,NA
1995-02-16,DJ,NOTORIOUS,,400,"""The Lodger"", a novel about this legendary London murderer, has been made into 4 movies",Jack the Ripper,NA
1995-02-16,DJ,ITALIAN SCIENCE,,400,He won a 1919 Nobel Physics Prize for his work in wireless telegraphy,Marconi,NA
1995-02-16,DJ,"""G""EOGRAPHY",(Alex: Each correct response will begin with that letter of the alphabet.),400,"The name of this Scottish city is Gaelic for ""dear green place""",Glasgow,NA
1995-02-16,DJ,CONSTITUTIONAL AMENDMENTS,,NA,"The 15th, 19th & 26th amendments are concerned with who is allowed to do this",vote,NA
1995-02-16,DJ,ART CLASS,,600,Aquarelle is another name for this kind of painting noted for its transparent qualities,watercolor,NA
1995-02-16,DJ,MAMMALS,,600,"There are only about 2,000 of these largest cats left in India",Bengal tigers,NA
1995-02-16,DJ,NOTORIOUS,,600,In May 1994 a Tennessee board rejected parole for this convicted assassin of Martin Luther King,James Earl Ray,NA
1995-02-16,DJ,ITALIAN SCIENCE,,600,Luigi Galvani is known for studying the effects of this stimulus on the muscles of frog legs,electricity,NA
1995-02-16,DJ,"""G""EOGRAPHY",(Alex: Each correct response will begin with that letter of the alphabet.),600,"Australia has made it illegal to collect coral from this 1,250-mile-long formation",the Great Barrier Reef,NA
1995-02-16,DJ,CONSTITUTIONAL AMENDMENTS,,800,It's apropos that this amendment set the January date for the presidential inauguration,the 20th,NA
1995-02-16,DJ,ART CLASS,,800,"Though these colored chalklike sticks are synonymous with soft colors, many come in brilliant hues",pastels,NA
1995-02-16,DJ,MAMMALS,,800,"While experimenting with this species of monkey, scientists discovered the Rh factor",the rhesus monkey,NA
1995-02-16,DJ,NOTORIOUS,,800,"In 1994 this terrorist also known as ""The Jackal"" was seized in Sudan & sent to France for trial",Carlos,NA
1995-02-16,DJ,ITALIAN SCIENCE,,NA,"Evangelista Torricelli, who invented the barometer, was this scientist's secretary in 1641 & 1642",Galileo,NA
1995-02-16,DJ,"""G""EOGRAPHY",(Alex: Each correct response will begin with that letter of the alphabet.),800,"At 13,843 square miles, Peten is by far the largest department of this Central American republic",Guatemala,NA
1995-02-16,DJ,CONSTITUTIONAL AMENDMENTS,,1000,"Ratified in 1992, this amendment sets the procedure for Congressional pay raises",the 27th,NA
1995-02-16,DJ,ART CLASS,,1000,"Rockwell Kent's bold, angular black-and-white illustrations exemplify this style of the 1920s & '30s",Art Deco,NA
1995-02-16,DJ,MAMMALS,,1000,"Known as Orcinus orca, it's the largest of the aquatic mammalian family Delphinidae",the killer whale,NA
1995-02-16,DJ,NOTORIOUS,,1000,He was using the alias Jimmy Lawrence when killed at Chicago's Biograph Theater in 1934,John Dillinger,NA
1995-02-16,DJ,ITALIAN SCIENCE,,1000,"He found that different gases, at equal volumes, temperatures & pressures, have an equal number of molecules",Amedeo Avogadro,NA
1995-02-16,DJ,"""G""EOGRAPHY",(Alex: Each correct response will begin with that letter of the alphabet.),1000,This area off the coast of Newfoundland is the greatest cod-fishing region in the world,the Grand Banks,NA
1995-02-16,FJ,AMERICAN HISTORY,,NA,"This South Dakota community was the site of 2 clashes between the U.S. gov't & Indians, in 1890 & 1973",Wounded Knee,NA
