date,round,category,comment,value,clue,response,link
1990-05-04,J,WORLD LITERATURE,,100,"Li Po, who lived over 1,000 years ago, was one of this country's greatest poets",China,NA
1990-05-04,J,AMERICAN HISTORY,,100,"3 months after Congress authorized the Department of Foreign Affairs, it changed its name to this",Department of State,NA
1990-05-04,J,NAMES THAT ARE VERBS,,100,"Silent screen cowboy Tom, or what many people do at cocktail parties",Mix,NA
1990-05-04,J,COLLEGES & UNIVERSITIES,,100,JFK outlined his idea for the Peace Corps during a 1960 campaign speech on this school's Ann Arbor campus,University of Michigan,NA
1990-05-04,J,IRON,,100,"It's also called the Drinker Respirator, after Philip Drinker, who invented it",Iron Lung,NA
1990-05-04,J,CURTAINS,,100,The appearance of a performer at the end of a show in response to applause,Curtain Call,NA
1990-05-04,J,WORLD LITERATURE,,200,"""Shadows On The Grass"" is a collection of African vignettes by this Danish baroness",Isak Dinesen,NA
1990-05-04,J,AMERICAN HISTORY,,200,He died in 1804 the day after his duel with Aaron Burr,Alexander Hamilton,NA
1990-05-04,J,NAMES THAT ARE VERBS,,200,"Mr. Martindale, or what he might do if he likes you",Wink,NA
1990-05-04,J,COLLEGES & UNIVERSITIES,,200,"Nixon & Khrushchev sang this school's song, ""The Ramblin' Wreck"", during Nixon's '59 visit to Moscow",Georgia Tech,NA
1990-05-04,J,IRON,,200,The iron first used by man was probably taken from these that fell to Earth,Meteors/meteorites,NA
1990-05-04,J,CURTAINS,,200,"1939 movie that included the line ""Pay no attention to that man behind the curtain....""",The Wizard of Oz,NA
1990-05-04,J,WORLD LITERATURE,,300,"In German, the title of this Thomas Mann novella is ""Der Tod in Venedig""","""Death In Venice""",NA
1990-05-04,J,AMERICAN HISTORY,,300,In 1945-46 the number of these government employees dropped from 12 million to less than 3 million,Armed Forces/Servicemen & women,NA
1990-05-04,J,NAMES THAT ARE VERBS,,300,"Mr. Owens, or what his horse might do to throw him",Buck,NA
1990-05-04,J,COLLEGES & UNIVERSITIES,,300,"Tulane & Loyola, both on St. Charles Ave. in this city, are an average of 4 feet below sea level",New Orleans,NA
1990-05-04,J,IRON,,300,Spike-lined medieval torture device that had a deadly hug,Iron Maiden,NA
1990-05-04,J,CURTAINS,,300,"Game show that asked ""Would you like the box or what's behind the curtain Carol's pointing to?""",Let\'s Make A Deal,NA
1990-05-04,J,WORLD LITERATURE,,400,"Virginia Woolf wrote about one ""of one's own""; E.M. Forster wrote about one ""with a view""",Room,NA
1990-05-04,J,AMERICAN HISTORY,,400,In 1932 Hattie Caraway of Arkansas became the first woman elected to this body,U.S. Senate,NA
1990-05-04,J,NAMES THAT ARE VERBS,,400,"E. Howard, or what he'd do stalking game",Hunt,NA
1990-05-04,J,COLLEGES & UNIVERSITIES,,400,"McGill University in this Canadian city is known as the ""Harvard of the North""",Montreal,NA
1990-05-04,J,IRON,,400,Most iron ore is reduced to pig iron in this type of furnace,Blast Furnace,NA
1990-05-04,J,CURTAINS,,400,"Song that begins ""And now the end is near, and so I face the final curtain""","""My Way""",NA
1990-05-04,J,WORLD LITERATURE,,500,Nationality of the woman who created Hans Brinker,American (Mary Mapes Dodge),NA
1990-05-04,J,AMERICAN HISTORY,,500,"After the original 13 colonies, this was the first state to enter the Union",Vermont,NA
1990-05-04,J,NAMES THAT ARE VERBS,,500,"TV ""Avenger"" Emma, or what she could do in a burlesque show",Peel,NA
1990-05-04,J,COLLEGES & UNIVERSITIES,,NA,This land grant university operates joint campuses with Indiana U. at Indianapolis & Ft. Wayne,Purdue,NA
1990-05-04,J,IRON,,500,"By definition, steel is an alloy of iron & this element",Carbon,NA
1990-05-04,J,CURTAINS,,500,"This popular detective died in the 1975 best seller ""Curtain""",Hercule Poirot,NA
1990-05-04,DJ,THE RENAISSANCE,,200,"In the beginning of the 17th C. the ""."" & the ""x"" were introduced as signs for this & both are still used today",Multiplication,NA
1990-05-04,DJ,IN THE NEWS,,200,"Garry Kasparov recently beat a computer program, Deep Thought, in a game of this",Chess,NA
1990-05-04,DJ,ENGLAND,,200,"Legendary tax protester whose real name was probably Godgifu, meaning ""Gift of God""",Lady Godiva,NA
1990-05-04,DJ,ODDS & ENDS,,200,"Chapultepec Park, 1st used by Aztec emperors, is the largest park in this Latin American capital",Mexico City,NA
1990-05-04,DJ,PLANTS & TREES,,200,2 varieties of this desert plant are named for holidays: Christmas & Easter,Cactus,NA
1990-05-04,DJ,EPITAPHS,,200,"""Free at last, free at last, thank God almighty, I'm free at last!""","Dr. Martin Luther King, Jr.",NA
1990-05-04,DJ,THE RENAISSANCE,,400,Philologists of the Renaissance most commonly studied these 2 classical languages,Greek & Latin,NA
1990-05-04,DJ,IN THE NEWS,,400,This evangelist who has personally preached to over 100 mil. now has his own star on Hollywood Blvd.,Rev. Billy Graham,NA
1990-05-04,DJ,ENGLAND,,400,He's the primate of all England,Archbishop of Canterbury,NA
1990-05-04,DJ,ODDS & ENDS,,400,"Drugs that the FDA approves as safe for self-medication are termed ""OTC"", which stands for this",Over-the-Counter,NA
1990-05-04,DJ,PLANTS & TREES,,400,Term for the cutting of plants & trees to enhance growth & improve appearance,Pruning,NA
1990-05-04,DJ,EPITAPHS,,400,"A statue at the Will Rogers Memorial bears this epitaph, his most famous line","""I never met a man I didn\'t like""",NA
1990-05-04,DJ,THE RENAISSANCE,,600,"In 1414 the Council of Constance condemned Jan Hus, who was burned at the stake for this ""crime""",Heresy,NA
1990-05-04,DJ,IN THE NEWS,,600,Leftist guerrillas are in their 10th yr. of trying to overthrow this country's gov't now led by Alfredo Cristiani,El Salvador,NA
1990-05-04,DJ,ENGLAND,,600,"He's the patron saint of The Order of the Garter, the highest order of English knighthood",St. George,NA
1990-05-04,DJ,ODDS & ENDS,,600,The steel drum was developed in the 1940s in this Caribbean island nation near Venezuela,Trinidad,NA
1990-05-04,DJ,PLANTS & TREES,,600,It can mean any umbrella-shaped fungus or inedible mushroom,Toadstool,NA
1990-05-04,DJ,EPITAPHS,,600,"The epitaph on his footstone reads, ""Truth & history.  21 men.  The boy bandit king -- he died as he lived.""",Billy the Kid (William H. Bonney),NA
1990-05-04,DJ,THE RENAISSANCE,,NA,"The word ""renaissance"" comes from the Old French ""renaistre"", meaning to be this",Reborn,NA
1990-05-04,DJ,IN THE NEWS,,800,"This oil company announced it is moving its hdqrs. from Rockefeller Center in NYC to Irving, Texas",Exxon,NA
1990-05-04,DJ,ENGLAND,,NA,The last of Henry VIII's children to rule England,Queen Elizabeth I,NA
1990-05-04,DJ,ODDS & ENDS,,800,This planet was named for the father of Saturn & the grandfather of Jupiter,Uranus,NA
1990-05-04,DJ,PLANTS & TREES,,800,One way to recognize poison ivy is to know its leaves always come in clusters of this many,3,NA
1990-05-04,DJ,EPITAPHS,,800,"This New Englander's ""I had a lover's quarrel with the world"" is from his poem ""The Lesson For Today""",Robert Frost,NA
1990-05-04,DJ,THE RENAISSANCE,,1000,Field in which Brunelleschi & Palladio worked during the Renaissance,Architecture,NA
1990-05-04,DJ,IN THE NEWS,,1000,Relics of this culture found at Nimrud in Iraq's Nineveh region were called the greatest find since King Tut,Assyrian,NA
1990-05-04,DJ,ENGLAND,,1000,"Walter Tyler, who led a 1381 rebellion, was better known by this nickname","""Wat"" Tyler",NA
1990-05-04,DJ,ODDS & ENDS,,1000,Every 4 years Dixville Notch in upstate New Hampshire holds this distinction,first primary voting for president of the U.S.,NA
1990-05-04,DJ,PLANTS & TREES,,1000,Spruces have drooping cones & angular leaves while these have upright cones & flat leaves,Firs,NA
1990-05-04,DJ,EPITAPHS,,1000,"His tombstone says, ""He gave to man control over that dreadful scourge, yellow fever""",Walter Reed,NA
1990-05-04,FJ,THE SENATE,,NA,The 2 astronauts who went on to become U.S. senators,John Glenn (Ohio) & Harrison Schmitt (New Mexico),NA
