date,round,category,comment,value,clue,response,link
1987-06-26,J,AMERICAN MUSIC,,100,"Some say the song was originally ""I can't give you anything but love, Lindy"", in this man's honor",Charles Lindbergh,NA
1987-06-26,J,RUBBER,,100,"It's what the ""Absent Minded Professor"" named his invention which he 1st called ""flying rubber""",flubber,NA
1987-06-26,J,GUAM,,100,The official language of Guam,English,NA
1987-06-26,J,POTENT POTABLES,,100,"Wine chills quickest, many times faster than in a refrigerator, when immersed in this",ice cold water,NA
1987-06-26,J,MOVIE DETECTIVES,,100,Calling all crimestoppers: This comic strip cop was 1st caught on celluloid in a 1937 serial,Dick Tracy,NA
1987-06-26,J,N.E.W.S.,"(Alex: Those letters stand for north, south, east & west.)",100,"Of North, East, West, or South, one who played ""Batman"" on TV",Adam West,NA
1987-06-26,J,AMERICAN MUSIC,,200,"In a song title, this is the Southern food ""Mammy's little babies love""","""Shortnin\' Bread""",NA
1987-06-26,J,RUBBER,,200,"Through vulcanization process, which he discovered, made others wealthy, he died in poverty",Goodyear,NA
1987-06-26,J,GUAM,,200,Japan attacked Guam same day it attacked Pearl Harbor & took it on this date 3 days later,"December 10, 1941",NA
1987-06-26,J,POTENT POTABLES,,200,"A ""twist"" refers to this part of a citrus fruit",the rind (peel),NA
1987-06-26,J,MOVIE DETECTIVES,,200,"Movie detective known for such sage comments as ""Hen squats with caution on thin eggs""",Charlie Chan,NA
1987-06-26,J,N.E.W.S.,"(Alex: Those letters stand for north, south, east & west.)",200,"Of North, East, West, or South, one who played ""Dennis the Menace"" on TV",Jay North,NA
1987-06-26,J,AMERICAN MUSIC,,300,A poem written for a Montgomery Ward promotion became the words of this Yuletide animal song,"""Rudolph the Red-Nosed Reindeer""",NA
1987-06-26,J,RUBBER,,NA,"C.W. McCall's ""handle"" in the following No. 1 hit:""Well, we rolled up Interstate 44 /Like a rocket sled on rails /We tore up all of our swindle sheets...""","""Rubber Duck""",NA
1987-06-26,J,GUAM,,300,80 to 110 inches a year,the rainfall,NA
1987-06-26,J,POTENT POTABLES,,300,Drambuie is made from Scotch whiskey & this natural sweetener,honey,NA
1987-06-26,J,MOVIE DETECTIVES,,300,"In 1964's ""The Girl Hunters"", Mickey Spillane played this tough private eye",Mike Hammer,NA
1987-06-26,J,N.E.W.S.,"(Alex: Those letters stand for north, south, east & west.)",300,"Of North, East, West, or South, one who sang ""Walk a Mile in My Shoes""",Joe South,NA
1987-06-26,J,AMERICAN MUSIC,,400,"When 1st presented, July 4th, 1831, the song ""America"" went by this title, its 1st liine","""My Country, Tis of Thee""",NA
1987-06-26,J,RUBBER,,400,"The world's largest rubber plantation, in Liberia, is owned by this #3 U.S. tire maker",Firestone,NA
1987-06-26,J,GUAM,,400,Agana,the capital of Guam,NA
1987-06-26,J,POTENT POTABLES,,400,"Even in Russia, vodka is more commonly made from this than potatoes",grain,NA
1987-06-26,J,MOVIE DETECTIVES,,400,"Go ahead, make my day: Tell me how many movies ""Dirty Harry"" has been in",4,NA
1987-06-26,J,N.E.W.S.,"(Alex: Those letters stand for north, south, east & west.)",400,"Of Norther, Easter, Wester, or Souther, the singer of 1979's ""You're Only Lonely""",J.D. Souther,NA
1987-06-26,J,AMERICAN MUSIC,,500,"Composer of ""Alexander's Ragtime Band"", he said it was a song about ragtime not a ragtime song",Irving Berlin,NA
1987-06-26,NA,NA,NA,NA,NA,NA,NA
1987-06-26,NA,NA,NA,NA,NA,NA,NA
1987-06-26,J,POTENT POTABLES,,500,"From Latin for ""heart"", it's the heart-warming synonym for ""liqueurs""",cordials,NA
1987-06-26,J,MOVIE DETECTIVES,,500,It's said Peter Lorre used little makeup other than a pair of glasses to play this Oriental sleuth,Mr. Moto,NA
1987-06-26,J,N.E.W.S.,"(Alex: Those letters stand for north, south, east & west.)",500,"Of Norther, Easter, Wester, or Souther, the holiday",Easter,NA
1987-06-26,DJ,PRESIDENTIAL AUTHORS,,200,"""Rough Riders""",Teddy Roosevelt,NA
1987-06-26,DJ,METALS,,200,"Don't take any wooden millerite, an ore of this metal",nickel,NA
1987-06-26,DJ,BY THE NUMBERS,,200,Number of days there were in 1984,366,NA
1987-06-26,NA,NA,NA,NA,NA,NA,NA
1987-06-26,DJ,TRAVEL & TOURISM,,200,"If you're traveling by Sampan in Hong Kong, you're traveling this way",by boat,NA
1987-06-26,DJ,"""BALL"" 2",,200,Last surviving star of the early '50s top-rated TV sitcom,Lucille Ball,NA
1987-06-26,DJ,PRESIDENTIAL AUTHORS,,400,"""Crusade in Europe""",Dwight David Eisenhower,NA
1987-06-26,DJ,METALS,,400,"Electrum, or argentiferous gold,, is gold containing a high % of this other precious metal",silver,NA
1987-06-26,DJ,BY THE NUMBERS,,400,"To a European, it's what ""31.12.86"" would mean",last New Year\'s Eve,NA
1987-06-26,DJ,SPORTS TRIVIA,,400,"'86 tournament limited to Zoeller, Palmer, Nicklaus & Trevino",the Skins Game (Skins Tournament accepted),NA
1987-06-26,DJ,TRAVEL & TOURISM,,400,"In 1880, he published ""A Tramp Abroad"", sort of a sequel to ""Innocents Abroad""",Mark Twain,NA
1987-06-26,DJ,"""BALL"" 2",,400,This 1970 book by pitcher Jim Bouton has been called the most popular sports book in history,Ball Four,NA
1987-06-26,DJ,PRESIDENTIAL AUTHORS,,600,"""Notes on the State of Virginia""",Thomas Jefferson,NA
1987-06-26,DJ,METALS,,600,The element in common table salt that is technically a metal,sodium,NA
1987-06-26,DJ,BY THE NUMBERS,,600,"What the numerals refer to in ""Numbers 6:24""",a verse & chapter of the Bible,NA
1987-06-26,DJ,SPORTS TRIVIA,,600,Games held every 4 years for members of the grouping of Britain & some of its former colonies,the Commonwealth Games,NA
1987-06-26,DJ,TRAVEL & TOURISM,,600,"Even though Greece doesn't fully recognize this country, it will do joint advertising with it",Israel,NA
1987-06-26,DJ,"""BALL"" 2",,600,"Kind of hammer you'd ask for if you wanted 1 with a round hemisphere on 1 side, for bending material",a ball-peen hammer,NA
1987-06-26,DJ,PRESIDENTIAL AUTHORS,,800,"""Principles of Mining"" & ""American Individualism""",Herbert Hoover,NA
1987-06-26,DJ,METALS,,800,"It is on ""record"" that this rare precious metal is sometimes magnetic",platinum,NA
1987-06-26,DJ,BY THE NUMBERS,,NA,"If you bought a CD player in ancient Rome for ""CD"" denarii, you spent this many",400,NA
1987-06-26,DJ,SPORTS TRIVIA,,800,Since 1930 a team from this city has made the Stanley Cup playoffs 27 times & won 21 times,Montreal,NA
1987-06-26,DJ,TRAVEL & TOURISM,,800,"Now with 139 titles, his travel guide line began 50 years ago with ""1936...On the Continent""",Eugene Fodor,NA
1987-06-26,DJ,"""BALL"" 2",,NA,An antifriction rolling machine contact,a ball bearing,NA
1987-06-26,DJ,PRESIDENTIAL AUTHORS,,1000,"""Our Chief Magistrate & His Powers""",William Howard Taft,NA
1987-06-26,DJ,METALS,,1000,"If you buy a pewter tankard today, you'd be buying a mug of mostly this metal",tin,NA
1987-06-26,DJ,BY THE NUMBERS,,1000,"If you want to double a number in the binary system, you just add this digit on the right",zero,NA
1987-06-26,DJ,SPORTS TRIVIA,,1000,"In '86 A.B. Giamatti replaced Chub Feeney, a former ""Jeopardy!"" contestant, in this post",president of the National League,NA
1987-06-26,DJ,TRAVEL & TOURISM,,1000,A stop in this capital city's Illum department store can get you Lego sets you've never seen before,Copenhagen,NA
1987-06-26,DJ,"""BALL"" 2",,1000,"Undersecretary of State under JFK, LBJ made him U.N. Ambassador",George Ball,NA
1987-06-26,FJ,SOUTH AMERICA,,NA,1 of 2 South American countries whose name & capital's name have the same # of letters,(1 of) Peru & Paraguay,NA
