date,round,category,comment,value,clue,response,link
2016-09-14,J,INTERJECTING IN INTERJECTIONS,,200,Add a letter to alas! & you get this word for an alternate name,alias,NA
2016-09-14,J,ERAS OF HISTORY,,200,Around 1200 B.C. this period followed the Bronze Age & provided more lethal weapons to more people,the Iron Age,NA
2016-09-14,J,THE STARS OF FRIENDS: UPDATE,,200,You can bet Justin Theroux was on hand when she received her star on the Hollywood Walk of Fame,Jennifer Aniston,NA
2016-09-14,J,SOMETHING TO EAT,,200,Meat or fish presented tartare means it's served this way,raw,NA
2016-09-14,J,THE ORGANIZATION'S MISSION,,200,"Among its goals: ""To end drunk driving... and prevent underage drinking""",Mothers Against Drunk Driving,NA
2016-09-14,J,"GEOGRAPH""E""",(Alex: Each correct response will begin with the letter E.),200,It has a 440-mile border with Colombia,Ecuador,NA
2016-09-14,J,INTERJECTING IN INTERJECTIONS,,400,Drat! gets an interjected letter & turns into this preliminary version of a speech,draft,NA
2016-09-14,J,ERAS OF HISTORY,,400,"This decade was both ""naughty"" & ""gay""",the 1890s,NA
2016-09-14,J,THE STARS OF FRIENDS: UPDATE,,400,"For 6 seasons she starred as Jules Cobb on ""Cougar Town""",Courteney Cox,NA
2016-09-14,J,SOMETHING TO EAT,,400,These Sunshine Biscuits snack crackers have been around since 1921,Cheez-Its,http://www.j-archive.com/media/2016-09-14_J_07.jpg
2016-09-14,J,THE ORGANIZATION'S MISSION,,400,"""Brings people together to build homes, communities and hope""",Habitat for Humanity,NA
2016-09-14,J,"GEOGRAPH""E""",(Alex: Each correct response will begin with the letter E.),400,Seen here is the view from Queens looking over this body of water,the East River,http://www.j-archive.com/media/2016-09-14_J_12.jpg
2016-09-14,J,INTERJECTING IN INTERJECTIONS,,600,"Amen! with 2 letters interjected becomes this medication, to help you sleep",Ambien,NA
2016-09-14,J,ERAS OF HISTORY,,600,The Cold War is often said to have begun in this year when a war ended & the cubs played in the World Series,1945,NA
2016-09-14,J,THE STARS OF FRIENDS: UPDATE,,600,"In 2016's ""The People v. O.J. Simpson"", he played defense attorney Robert Kardashian",(David) Schwimmer,NA
2016-09-14,J,SOMETHING TO EAT,,600,"Cremini, a variety of this edible, are intentionally harvested when they're immature",mushrooms,NA
2016-09-14,J,THE ORGANIZATION'S MISSION,,600,"The society named for this Frenchman: ""Educating people... to protect the water systems of the planet""",the Cousteau Society,NA
2016-09-14,J,"GEOGRAPH""E""",(Alex: Each correct response will begin with the letter E.),600,You can attend the Sun City Music Festival out in this West Texas town,El Paso,NA
2016-09-14,J,INTERJECTING IN INTERJECTIONS,,800,Bam! gets hit with another letter & becomes this ethereal shaft,beam,NA
2016-09-14,J,ERAS OF HISTORY,,800,"The Ancien Regime, or ""old order"", refers to the period up to this event",the French Revolution,NA
2016-09-14,J,THE STARS OF FRIENDS: UPDATE,,800,"She's one of the executive producers of the TLC genealogy series ""Who Do You Think You Are?""",(Lisa) Kudrow,NA
2016-09-14,J,SOMETHING TO EAT,,800,The Monterey Jack jalapeno stuffed pretzels seem like they wouldn't fit in this lower-fat line from Stouffer's,Lean Cuisine,NA
2016-09-14,J,THE ORGANIZATION'S MISSION,,800,"""To provide year-round sports training & athletic competition... for children & adults with intellectual disabilities """,the Special Olympics,NA
2016-09-14,J,"GEOGRAPH""E""",(Alex: Each correct response will begin with the letter E.),800,It's the longest river of Spain,Ebro,NA
2016-09-14,J,INTERJECTING IN INTERJECTIONS,,1000,"With an interjection, dang! becomes this German literary word",Drang,NA
2016-09-14,J,ERAS OF HISTORY,,1000,"Instead of B.C. some prefer the less religious B.C.E., for ""before"" this ""Era""",the Common Era,NA
2016-09-14,J,THE STARS OF FRIENDS: UPDATE,,1000,Matthew Perry recently starred as Oscar Madison in a reboot of this sitcom,The Odd Couple,NA
2016-09-14,J,SOMETHING TO EAT,,1000,Chocolate & cherries team up in this dessert named for a region of Germany,a Black Forest cake,NA
2016-09-14,J,THE ORGANIZATION'S MISSION,,NA,"Named in memory of Nancy Brinker's sister: ""To save lives and end breast cancer forever""",the Susan G. Komen Foundation,NA
2016-09-14,J,"GEOGRAPH""E""",(Alex: Each correct response will begin with the letter E.),1000,"It rises 18,510 feet in the Caucasus",Mount Elbrus,NA
2016-09-14,DJ,EXIT THROUGH THE GIFT SHOP,,400,"(Sarah of the Clue Crew holds up a toy at Walt Disney Studios in Burbank, CA.)  At the studio store on the Walt Disney lot, you can buy a singing Elsa doll singing ""Let It Go"" voiced by this actress",Idina Menzel,http://www.j-archive.com/media/2016-09-14_DJ_01b.jpg
2016-09-14,DJ,FOLKS OF SCIENCE,,400,"The first American woman in space, she later became a professor of physics at UC San Diego",Sally Ride,NA
2016-09-14,DJ,LANGUAGES,,400,"Maltese, which developed from a dialect of Arabic, is the only form of Arabic written in this alphabet",the Latin alphabet (or Roman alphabet),NA
2016-09-14,DJ,AWARDS FOR WRITING,,400,"Won in 2015 by Svetlana Alexievich, it's handed out annually by the Swedish Academy",the Nobel Prize in Literature,NA
2016-09-14,DJ,"""MENTO""S",,400,It's home to the California state railroad museum,Sacramento,NA
2016-09-14,DJ,THE HITMAKER,,400,"1984:""Wake Me Up Before You Go-Go""",Wham!,NA
2016-09-14,DJ,EXIT THROUGH THE GIFT SHOP,,800,"(Jimmy of the Clue Crew holds a framed jersey at the College Football Hall of Fame in Atlanta, GA.)  One of the sweet buys at the College Football Hall of Fame is a signed Tim Tebow jersey from his days at this school",the University of Florida,http://www.j-archive.com/media/2016-09-14_DJ_02.jpg
2016-09-14,DJ,FOLKS OF SCIENCE,,800,This Missouri man who loved to work for peanuts also developed a type of synthetic marble made from wood shavings,George Washington Carver,NA
2016-09-14,DJ,LANGUAGES,,800,"(I'm Lara Logan of CBS News.)  As a reporter I find it helpful to know many languages, so I speak English, French, Portuguese & this Germanic language of my homeland, South Africa",Afrikaans,http://www.j-archive.com/media/2016-09-14_DJ_12.jpg
2016-09-14,DJ,AWARDS FOR WRITING,,800,"The Newbery Medal goes to writers in this genre; Eleanor Estes won for 1952 with ""Ginger Pye""",children\'s writing,NA
2016-09-14,DJ,"""MENTO""S",,800,One who inflicts suffering or annoyance,a tormentor,NA
2016-09-14,DJ,THE HITMAKER,,800,"2016:""Formation""",Beyoncé,NA
2016-09-14,DJ,EXIT THROUGH THE GIFT SHOP,,1200,"(Jimmy of the Clue Crew reports from the gift shop of the Brookfield Zoo in Chicago.)  At the Brookfield Zoo, gifts such as these are certified this 2-word term, meaning its makers in another country are justly compensated",fair trade,http://www.j-archive.com/media/2016-09-14_DJ_03b.jpg
2016-09-14,DJ,FOLKS OF SCIENCE,,1200,"This ancient Greek who loved the lever established statics, the study of a body at equilibrium",Archimedes,NA
2016-09-14,DJ,LANGUAGES,,1200,Computer fonts are now available to writers of this most widely spoken Native American language in the United States,Navajo,NA
2016-09-14,DJ,AWARDS FOR WRITING,,1200,"Named for a 16th century luminary, this prize is awarded by the Spanish ministry of culture",the Cervantes Award,NA
2016-09-14,NA,NA,NA,NA,NA,NA,NA
2016-09-14,DJ,THE HITMAKER,,1200,"2004:""She Will Be Loved""",Maroon 5,NA
2016-09-14,DJ,EXIT THROUGH THE GIFT SHOP,,1600,"(Sarah of the Clue Crew holds a model car at the Daytona Int'l Speedway in Daytona Beach, FL.)  Before leaving the Daytona 500, stop by the gift shop & buy a scale model of Austin Dillon's No. 3 car, an SS model of this make",a Chevy,http://www.j-archive.com/media/2016-09-14_DJ_04a.jpg
2016-09-14,DJ,FOLKS OF SCIENCE,,1600,"This American woman's 1974 dissertation was titled ""The Behaviour of the Mountain Gorilla""",(Dian) Fossey,NA
2016-09-14,DJ,LANGUAGES,,NA,Mam is a Mayan language spoken in Mexico's Chiapas state & by around a half million in this country,Guatemala,NA
2016-09-14,DJ,AWARDS FOR WRITING,,NA,This science fiction award is named for an interstellar gas cloud,the Nebula Award,NA
2016-09-14,NA,NA,NA,NA,NA,NA,NA
2016-09-14,DJ,THE HITMAKER,,1600,"1966:""Rainy Day Women #12 & 35""",Bob Dylan,NA
2016-09-14,DJ,EXIT THROUGH THE GIFT SHOP,,2000,"(Jimmy of the Clue Crew holds a model plan at the Delta Flight Museum in Atlanta, GA.)  You can finish your tour of Atlanta's Delta Flight Museum by taking home a model of this classic plane, the world's first successful commercial airliner",the DC-3,http://www.j-archive.com/media/2016-09-14_DJ_05a.jpg
2016-09-14,DJ,FOLKS OF SCIENCE,,2000,This 17th c. British scientist's law states in part that volume increases as pressure decreases,(Robert) Boyle,NA
2016-09-14,DJ,LANGUAGES,,2000,"Enets, a Samoyedic language of Siberia, has 2 dialects: Forest Enets & this type named for a permafrost region",Tundra,NA
2016-09-14,DJ,AWARDS FOR WRITING,,2000,"The Poetry Society of America's gold medal was renamed for this man; as he wrote, ""Nothing gold can stay""",Robert Frost,NA
2016-09-14,NA,NA,NA,NA,NA,NA,NA
2016-09-14,DJ,THE HITMAKER,,2000,"2015:""Tennessee Whiskey""",Chris Stapleton,NA
2016-09-14,FJ,20th CENTURY SCIENCE TERMS,,NA,This 4-letter word was introduced in London in 1905 by Dr. H.A. des Voeux of the Coal Smoke Abatement Society,smog,NA
