date,round,category,comment,value,clue,response,link
2016-12-14,J,MUCH BIGGER THAN A BREADBOX,,200,"Weighing up to 200 tons & growing to nearly 100 feet long, some spend their summers off the California coast",a blue whale,NA
2016-12-14,J,LITERARY LINES,"(Alex: We will give you the [*], you give us the literary work they are from.)",200,"""I beheld the wretch--the miserable monster whom I had created""",Frankenstein,NA
2016-12-14,J,THE BROADWAY MUSICAL'S CHARACTERS,,200,"Max Bialystock,Franz Liebkind,Hold-Me Touch-Me",The Producers,NA
2016-12-14,J,REPRESENTIN',,200,"This Speaker of the House helped draft the ""Contract with America""",Newt Gingrich,NA
2016-12-14,NA,NA,NA,NA,NA,NA,NA
2016-12-14,NA,NA,NA,NA,NA,NA,NA
2016-12-14,J,MUCH BIGGER THAN A BREADBOX,,400,"The most powerful mobile artillery piece to that time, ""Big Bertha"" was a long-range German cannon first used in this conflict",World War I,NA
2016-12-14,J,LITERARY LINES,"(Alex: We will give you the [*], you give us the literary work they are from.)",400,"""If I make any mistakes, there'll be nothing left but the 'Mark Watney Memorial Crater'""",The Martian,NA
2016-12-14,J,THE BROADWAY MUSICAL'S CHARACTERS,,400,"Kenickie,Frenchie,Betty Rizzo",Grease,NA
2016-12-14,J,REPRESENTIN',,400,In 2014 John Conyers won his 26th term for this state & is the first black rep. to be the senior member of Congress,Michigan,NA
2016-12-14,J,TREES,,400,The desert-dwelling smoke tree depends on the flash type of these to spread its seeds,flood,NA
2016-12-14,NA,NA,NA,NA,NA,NA,NA
2016-12-14,J,MUCH BIGGER THAN A BREADBOX,,600,In 1626 for 60 guilders you could have purchased all 23 square miles of this NYC borough,Manhattan,NA
2016-12-14,J,LITERARY LINES,"(Alex: We will give you the [*], you give us the literary work they are from.)",600,"A Pulitzer Prize-winning book: ""You better not never tell nobody but God""",The Color Purple,NA
2016-12-14,J,THE BROADWAY MUSICAL'S CHARACTERS,,600,"Nick Massi,Mary Delgado,Frankie Valli",Jersey Boys,NA
2016-12-14,J,REPRESENTIN',,600,"In late 1880 he was a congressman, a senator-elect & president-elect, all at the same time",James Garfield,NA
2016-12-14,J,TREES,,600,"Pecans are the largest of these, a type of walnut tree, whose wood is popularly used in barbecues",hickory,NA
2016-12-14,J,"A TIME FOR ""US""",,600,Seen here in a museum is an ancient stone one of these,a sarcophagus,http://www.j-archive.com/media/2016-12-14_J_27.jpg
2016-12-14,J,MUCH BIGGER THAN A BREADBOX,,800,The largest known of these Greek sacrificial platforms was found at Syracuse & measures 650 by 74 feet,an altar,NA
2016-12-14,J,LITERARY LINES,"(Alex: We will give you the [*], you give us the literary work they are from.)",NA,"""In the interior you will no doubt meet Mr. Kurtz""",Heart of Darkness,NA
2016-12-14,J,THE BROADWAY MUSICAL'S CHARACTERS,,800,"Glinda,Fiyero,Nessarose",Wicked,NA
2016-12-14,J,REPRESENTIN',,800,This state has 1 representative in Congress; it has also sent a grand total of 4 men to fill that seat,Alaska,NA
2016-12-14,J,TREES,,800,"The leaves of the Sydney peppermint, a type of this gum tree from New South Wales, are used in Aboriginal remedies",eucalyptus,NA
2016-12-14,J,"A TIME FOR ""US""",,800,"The line ""thou shalt love thy neighbor as thyself"" first appears in this Biblical book",Leviticus,NA
2016-12-14,J,MUCH BIGGER THAN A BREADBOX,,1000,"The addition of the palazzo made this Vegas hotel the world's largest under one roof, with more than 7,000 suites",the Venetian,http://www.j-archive.com/media/2016-12-14_J_06.jpg
2016-12-14,J,LITERARY LINES,"(Alex: We will give you the [*], you give us the literary work they are from.)",1000,"""My name was Salmon, like the fish; first name, Susie.  I was fourteen when I was murdered...""",The Lovely Bones,NA
2016-12-14,J,THE BROADWAY MUSICAL'S CHARACTERS,,1000,"Mungojerrie,Mistoffelees,Grizabella",Cats,NA
2016-12-14,J,REPRESENTIN',,1000,Her four terms representing Minnesota in Congress included a presidential run,(Michele) Bachmann,http://www.j-archive.com/media/2016-12-14_J_24.jpg
2016-12-14,J,TREES,,1000,Native Americans used the inner bark of the sugar type of this tree to make a tea to treat coughs,maple,NA
2016-12-14,J,"A TIME FOR ""US""",,1000,What's black & white & furry all over?  This monkey,the colobus monkey,http://www.j-archive.com/media/2016-12-14_J_25.mp4
2016-12-14,DJ,DON'T HATE THE PLAYA,,400,"Playa is Spanish for beach & also means a dry lake bed, like the one where Burning Man is held in this Western state",Nevada,NA
2016-12-14,DJ,STICK WITH ME,,400,"After a rugby scrum, you might require what the Brits call a sticking plaster, one of these",a Band-Aid,NA
2016-12-14,DJ,WHAT A TV DRAMA KING,,400,"It seemed like Jack Bauer, played by him, always had the absolute worst day at work",(Kiefer) Sutherland,NA
2016-12-14,DJ,HISTORIC AGREEMENT WORDS,,400,The 1939 Nazi-Soviet deal is usually called a nonaggression this 4-letter word,pact,NA
2016-12-14,DJ,BELOW ZERO,,400,"Oops!  I just wrote a check for $1,100 & my balance is only $522--I'm this far in the red",$578,NA
2016-12-14,DJ,FRANCO FILE,,400,"From 2009 to 2012 this Franco played ""Franco"" on General Hospital",James Franco,NA
2016-12-14,DJ,DON'T HATE THE PLAYA,,800,Racetrack Playa in this very hot California valley is home to 700-pound rocks that mysteriously move,Death Valley,NA
2016-12-14,DJ,STICK WITH ME,,800,This brand was invented in the 1940s by a Swiss engineer after he examined sticky burrs on his dog,Velcro,NA
2016-12-14,DJ,WHAT A TV DRAMA KING,,800,Hugh Bonneville's Lord Grantham had a bloody awful supper & a brush with death on this PBS period piece,Downton Abbey,NA
2016-12-14,DJ,HISTORIC AGREEMENT WORDS,,800,"The USA bonded with Latin America through 1961's AFP, this for Progress",Alliance,NA
2016-12-14,DJ,BELOW ZERO,,800,An anion has negative this,charge,NA
2016-12-14,DJ,FRANCO FILE,,800,"This dictator was nicknamed El Caudillo, ""The Leader""",Francisco Franco,NA
2016-12-14,DJ,DON'T HATE THE PLAYA,,1200,"Playa del Carmen, a luxury resort in this country, offers tours of nearby Chichen Itza",Mexico,NA
2016-12-14,DJ,STICK WITH ME,,NA,More than 1 million fossil bones have been recovered at this sticky but popular L.A. tourist attraction,the La Brea Tar Pits,NA
2016-12-14,DJ,WHAT A TV DRAMA KING,,1200,Jeff Daniels shared a few thoughts on America being the greatest country in the world in the very first scene of this HBO show,The Newsroom,NA
2016-12-14,DJ,HISTORIC AGREEMENT WORDS,,1200,"In a 1941 U.S.-U.K. deal, it follows ""Atlantic""; it's also found before ""school""",charter,NA
2016-12-14,NA,NA,NA,NA,NA,NA,NA
2016-12-14,DJ,FRANCO FILE,,1200,"Franco Nero met Vanessa Redgrave in 1966 when he played Lancelot in this movie musical; in 2006, they wed",Camelot,NA
2016-12-14,DJ,DON'T HATE THE PLAYA,,1600,300 miles off the mainland of this country are muchas playas that are muy lindas en las Islas Malvinas,Argentina,NA
2016-12-14,DJ,STICK WITH ME,,1600,"Cyanoacrylates are a family of fast-acting adhesives commonly known by this ""demented"" name",Krazy Glue,NA
2016-12-14,DJ,WHAT A TV DRAMA KING,,1600,Time is a flat circle?!  Ex-cop Matthew McConaughey blew our minds with the concept on this drama,True Detective,NA
2016-12-14,DJ,HISTORIC AGREEMENT WORDS,,1600,"In 1907 Britain, France & Russia formed the Triple this French word",Entente,NA
2016-12-14,DJ,BELOW ZERO,,NA,"From sea level, it's 400 meters down to the shore of this landlocked Middle Eastern body of water",the Dead Sea,NA
2016-12-14,DJ,FRANCO FILE,,1600,He was still playing Major League Baseball in 2007 at age 49 & was still playing pro ball in Japan in 2015 at 57,Julio Franco,NA
2016-12-14,DJ,DON'T HATE THE PLAYA,,2000,"Beautiful Playa de la Concha brings crowds to San Sebastian in this cultural ""country"" of northern Spain",Basque,NA
2016-12-14,DJ,STICK WITH ME,,2000,The silicone type of this window-sealing material makes an excellent adhesive,caulk,NA
2016-12-14,DJ,WHAT A TV DRAMA KING,,2000,In 2016 Kyle Chandler picked up an Emmy nomination for murdering his black sheep brother in this Netflix series,Bloodline,NA
2016-12-14,DJ,HISTORIC AGREEMENT WORDS,,2000,Concord is agreement; add 2 letters to get this agreement by a state & a pope,concordat,NA
2016-12-14,NA,NA,NA,NA,NA,NA,NA
2016-12-14,DJ,FRANCO FILE,,2000,"The star clients of irreverent '80s designer Franco Moschino included this princess, Grace & Rainier's oldest",(Princess) Caroline (of Monaco),NA
2016-12-14,FJ,AMERICAN AUTHORS,,NA,"Nominated 8 previous times, he finally won a Nobel Prize for Literature in 1962, 6 years before his death",John Steinbeck,NA
