date,round,category,comment,value,clue,response,link
2016-12-28,J,ON SIRIUSXM RADIO,,200,"Get all the latest TV, movie & music news on this magazine's EW channel",Entertainment Weekly,NA
2016-12-28,J,KNOWLEDGE ABOUT COLLEGE,,200,In the 1910s non-medical divisions moved to the Homewood campus of this Baltimore university,Johns Hopkins University,NA
2016-12-28,J,IT'S AN EMERGENCY!,,200,"After an earthquake, coast dwellers, be aware of the possibility of this danger with a Japanese name",a tsunami,NA
2016-12-28,J,THEY SAID IT WITH FLOWERS,,200,"Gertrude Stein:""____ is a ____ is a ____""",a rose is a rose is a rose,NA
2016-12-28,J,HISTORIC HOMES,,200,"His birth home on Auburn Avenue in Atlanta is not far from Ebenezer Baptist Church, where he & his dad preached",Martin Luther King,NA
2016-12-28,J,BLENDED WORDS,,200,A close buddyship between 2 guys,a bromance,NA
2016-12-28,J,ON SIRIUSXM RADIO,,400,Original MTV VJs including Martha Quinn host shows on the channel devoted to music from this decade,the 1980s,NA
2016-12-28,J,KNOWLEDGE ABOUT COLLEGE,,400,You'll have a heck of a Hanover at this Ivy League school founded in 1769,Dartmouth,NA
2016-12-28,J,IT'S AN EMERGENCY!,,400,"(Sarah of the Clue Crew presents.)  In a medical emergency, you need to act fast, & if someone exhibits face drooping, arm weakness, & speech difficulty, it's time to call 9-1-1, because these are the warning signs and symptoms of this",a stroke,http://www.j-archive.com/media/2016-12-28_J_07.jpg
2016-12-28,J,THEY SAID IT WITH FLOWERS,,400,"Thomas Moore:""Her dream of home, steals timidly away, / shrinking as ____ do in summer's ray""",violets,NA
2016-12-28,J,HISTORIC HOMES,,400,A Victorian jewel in Denver is the home of this woman who survived the sinking of the Titanic,Molly Brown,NA
2016-12-28,J,BLENDED WORDS,,400,"This word with a double ""Z"" informally refers to a mayor",hizzoner,NA
2016-12-28,J,ON SIRIUSXM RADIO,,600,The FCC hasn't been an issue since he & Robin Quivers moved to the Sirius network in 2006,Howard Stern,NA
2016-12-28,J,KNOWLEDGE ABOUT COLLEGE,,NA,It's the only Pac-12 school that does not contain the name of a state,Stanford University,NA
2016-12-28,J,IT'S AN EMERGENCY!,,600,The Red Cross reports that 60% of house fire deaths occur in homes where these are not working,a smoke alarm,NA
2016-12-28,J,THEY SAID IT WITH FLOWERS,,600,"1890s songsmith & tandem bicycle enthusiast Harry Dacre:""____, ____, give me your answer, do!""",daisy,NA
2016-12-28,J,HISTORIC HOMES,,600,"This writer's home in Hartford, Connecticut, where he lived beginning in 1874, is often called Steamboat Gothic",Mark Twain,http://www.j-archive.com/media/2016-12-28_J_23.jpg
2016-12-28,J,BLENDED WORDS,,600,"The names of these 2 baseball pitches combined to make ""slurve""",a slider and a curveball,NA
2016-12-28,J,ON SIRIUSXM RADIO,,800,"Hats off to this country star who ""ain't going down 'til the sun comes up"" now that he got his own channel in 2016",Garth Brooks,NA
2016-12-28,J,KNOWLEDGE ABOUT COLLEGE,,800,"Fittingly, there's a large Greek system in this Georgia city",Athens,http://www.j-archive.com/media/2016-12-28_J_14.jpg
2016-12-28,J,IT'S AN EMERGENCY!,,800,"In this emergency operation, an incision is made in the windpipe to open an artificial breathing passage",a tracheotomy,NA
2016-12-28,J,THEY SAID IT WITH FLOWERS,,800,"John McCrae:""In Flanders fields"" these ""blow/ between the crosses, row on row""",poppies,NA
2016-12-28,J,HISTORIC HOMES,,800,"The Hermitage, his Tennessee estate, has a cafe called the Kitchen Cabinet; its ham sandwich is named for Roger Taney",Andrew Jackson,NA
2016-12-28,J,BLENDED WORDS,,800,It's any alcohol-free version of a mixed adult beverage,a mocktail,NA
2016-12-28,J,ON SIRIUSXM RADIO,,1000,"Pull up a chair, grab a cup of joe & enjoy this channel's blend of rare & acoustic performances on 14",The Coffee House,NA
2016-12-28,J,KNOWLEDGE ABOUT COLLEGE,,1000,"Named for a Supreme Court justice, it boasts Pulitzer winners Margo Jefferson & Thomas Friedman as alums",Brandeis University,NA
2016-12-28,J,IT'S AN EMERGENCY!,,1000,A phenomenon called odor fade can make this dangerous home event harder to detect,a natural gas leak,NA
2016-12-28,J,THEY SAID IT WITH FLOWERS,,1000,"Wordsworth:""And then my heart with pleasure fills, / and dances with"" these",daffodils,NA
2016-12-28,J,HISTORIC HOMES,,1000,The home where this man lived until his death in 1791 has a prayer room known as the powerhouse of Methodism,(John) Wesley,NA
2016-12-28,J,BLENDED WORDS,,1000,"This swimming costume suitable for Muslim women covers everything but the face, hands & feet",a burkini,NA
2016-12-28,DJ,U.S. HISTORY,,400,"In 2003 in Ohio, an overgrown tree touched a power line, causing this event that affected 50 million North Americans",a blackout,NA
2016-12-28,DJ,TITLE CHARACTERS,,400,This TV secret agent with great resourcefulness was played by Richard Dean Anderson,MacGyver,NA
2016-12-28,DJ,ITALIAN GEOGRAPHY,,400,"This island's provinces include Enna, Ragusa & Catania",Sicily,NA
2016-12-28,DJ,"ANTE ""BELL"" UM","(Alex: Each correct response will have those four letters--B-E-L-L, and will come before ""bellum"" in the dictionary.)",400,To roar like a bull,to bellow,NA
2016-12-28,DJ,BILLY IDOL,,400,This musician had a sold-out 12-show run at Madison Square Garden in 2014 & keeps filling the place,Billy Joel,NA
2016-12-28,DJ,MANET/MONET,,400,"Manet's ""Battle of the U.S.S. Kearsarge and the C.S.S. Alabama"" shows the battle off France's coast during this U.S. war",the Civil War,NA
2016-12-28,DJ,U.S. HISTORY,,800,"Thomas Jefferson appointed this man, his personal secretary, to lead an expedition to try to find the N.W. Passage",(Meriwether) Lewis,NA
2016-12-28,DJ,TITLE CHARACTERS,,800,"Julianne Moore's 2014 character had Alzheimer's but was ""Still"" this linguistics professor",Alice,NA
2016-12-28,DJ,ITALIAN GEOGRAPHY,,800,The northernmost point is in South Tyrol on the border with this country,Austria,NA
2016-12-28,DJ,"ANTE ""BELL"" UM","(Alex: Each correct response will have those four letters--B-E-L-L, and will come before ""bellum"" in the dictionary.)",800,Ring to get this male hotel page to see to your needs,the bellhop (or bellboy),NA
2016-12-28,DJ,BILLY IDOL,,800,This evangelist had a 16-week crusade at Madison Square Garden in 1957,Billy Graham,NA
2016-12-28,DJ,MANET/MONET,,800,"In 1875, Edouard Manet created the illustration for a French translation of this American poem","""The Raven""",http://www.j-archive.com/media/2016-12-28_DJ_17.jpg
2016-12-28,DJ,U.S. HISTORY,,NA,"Under the 1832 Treaty of Payne's Landing, chiefs in this tribe agreed to removal from Florida to points west",Seminole,NA
2016-12-28,DJ,TITLE CHARACTERS,,1200,"The 2 female-named sitcoms that spun off from ""The Mary Tyler Moore Show""",Rhoda and Phyllis,NA
2016-12-28,DJ,ITALIAN GEOGRAPHY,,1200,"Although this river is 252 miles long, only the 20 miles from Rome to the sea is navigable",the Tiber,NA
2016-12-28,DJ,"ANTE ""BELL"" UM","(Alex: Each correct response will have those four letters--B-E-L-L, and will come before ""bellum"" in the dictionary.)",1200,It's also known as deadly nightshade,belladonna,NA
2016-12-28,DJ,BILLY IDOL,,1200,"In April 1881 he was sentenced to be hanged, but ended up dying that July of bullet-related causes",Billy the Kid,NA
2016-12-28,DJ,MANET/MONET,,1200,"Monet's 1865-66 ""Dejeuner sur l'Herbe"", or ""Luncheon on"" this, was named after an 1863 Manet painting",the grass,NA
2016-12-28,DJ,U.S. HISTORY,,1600,"In 1911 the U.S. signed an agreement with Russia, Japan & the U.K. to protect the seal herds in this sea",the Bering Sea,NA
2016-12-28,DJ,TITLE CHARACTERS,,1600,"The Coen brothers took us ""Inside"" this uncompromising early 1960s folk singer",Llewyn Davis,NA
2016-12-28,DJ,ITALIAN GEOGRAPHY,,NA,"The name of this region in northwest Italy known for its prize-winning wines means ""foot of the mountain""",the Piedmont,NA
2016-12-28,DJ,"ANTE ""BELL"" UM","(Alex: Each correct response will have those four letters--B-E-L-L, and will come before ""bellum"" in the dictionary.)",1600,Hyphenated French term for study of fine literature,belles-lettres,NA
2016-12-28,DJ,BILLY IDOL,,1600,"Herman Melville died in 1891, leaving behind the tale of this sailor, unpublished for another 33 years",Billy Budd,NA
2016-12-28,DJ,MANET/MONET,,1600,It's Monet's 2-word title subject in a work seen here & on view at New York City's Metropolitan Museum of Art,Water Lilies,http://www.j-archive.com/media/2016-12-28_DJ_29.jpg
2016-12-28,DJ,U.S. HISTORY,,2000,In 1944 world powers met beneath the trees of this Georgetown mansion to lay the U.N.'s foundation,Dumbarton Oaks,NA
2016-12-28,DJ,TITLE CHARACTERS,,2000,Jeannie was a genie & we guess this Larry Hagman character was the one who dreamed of her,Captain Tony Nelson,NA
2016-12-28,DJ,ITALIAN GEOGRAPHY,,2000,"Italy's chief seaport, it lies on the northern end of the Ligurian Sea",Genoa,NA
2016-12-28,DJ,"ANTE ""BELL"" UM","(Alex: Each correct response will have those four letters--B-E-L-L, and will come before ""bellum"" in the dictionary.)",2000,"It's a paralysis of the muscles, typically on one side of the face",a Bell\'s palsy,NA
2016-12-28,DJ,BILLY IDOL,,2000,We'd know this evangelist who played Major League Baseball in the 1880s any day of the week,Billy Sunday,NA
2016-12-28,DJ,MANET/MONET,,2000,"The ""Folies"" of Parisian society are depicted vividly in Manet's ""Bar at"" this Paris music hall",the Folies Bergère,NA
2016-12-28,FJ,FICTIONAL PLACES,,NA,"This land is described as ""all that lies between the lamp-post and the great castle of Cair Paravel on the Eastern Sea""",Narnia,NA
