date,round,category,comment,value,clue,response,link
2017-01-23,J,FROM CHUMPS TO CHAMPS,,200,"They went from 29-53 in 1979 to 62-20 & an NBA title in 1981; adding Bird, Parish & McHale will do that",the Boston Celtics,NA
2017-01-23,J,HEALTH & MEDICINE,,200,"If you want to vent this lymphatic organ, you'll find out that it filters old red blood cells out of the bloodstream",the spleen,NA
2017-01-23,J,QUIZINE,,200,"In radio ads back in the day, Kate Smith & Jack Benny both pitched this trademarked jiggly dessert",Jell-O,NA
2017-01-23,J,SHOOTING BLANKS,,200,"Shooting the ____, a ""windy"" term of communication",the breeze,NA
2017-01-23,J,GREEK LETTERS & ROMAN NUMERALS,,200,It went by so fast:CCCLXV,365,NA
2017-01-23,J,AMERICAN WOMEN,,200,In 1961 she topped Clare Boothe Luce & Jackie Kennedy to be named woman most admired by Americans for the 13th time in 14 years,Eleanor Roosevelt,NA
2017-01-23,J,FROM CHUMPS TO CHAMPS,,400,"From 1962 to 1968, they never finished higher than 9th; in 1969, amazingly, they won the World Series",the New York Mets,NA
2017-01-23,J,HEALTH & MEDICINE,,400,"Diverticulitis is common in the U.S., where diets are low in this, AKA roughage",fiber,NA
2017-01-23,J,QUIZINE,,400,"Look up ""calamari"" in the ""Food Lovers Companion"" & it says ""see"" this; (doesn't sound nearly as appetizing)",squid,NA
2017-01-23,J,SHOOTING BLANKS,,400,"Shooting the ____, like the Class III on Oregon's Rogue River",the rapids,NA
2017-01-23,J,GREEK LETTERS & ROMAN NUMERALS,,400,Bruce Banner knows a little something about this letter,gamma,http://www.j-archive.com/media/2017-01-23_J_23.jpg
2017-01-23,J,AMERICAN WOMEN,,400,"Gloria Steinem said, ""A woman has two choices: either she's"" this term ""or a masochist""",a feminist,NA
2017-01-23,J,FROM CHUMPS TO CHAMPS,,600,"After a last-place finish in 2007, they dropped the ""Devil"" from their name; in 2008, they won 31 more games & the A.L. pennant",the Tampa Bay Rays,NA
2017-01-23,J,HEALTH & MEDICINE,,600,"(Sarah of the Clue Crew shows an anatomical animation on the monitor.)  The spine bends forward as the thoracic vertebrae become compressed in a condition called kyphosis, more commonly known as a Dowager's hump, a symptom of this disease of thinning bones",osteoporosis,http://www.j-archive.com/media/2017-01-23_J_09.mp4
2017-01-23,NA,NA,NA,NA,NA,NA,NA
2017-01-23,J,SHOOTING BLANKS,,600,"Shooting ____ in a ____, something pretty easy",fish in a barrel,NA
2017-01-23,J,GREEK LETTERS & ROMAN NUMERALS,,600,One of our favorite primes:MMMMXXVII,4027,NA
2017-01-23,J,AMERICAN WOMEN,,600,In 1967 Kathrine Switzer broke the gender barrier by becoming the first female runner to officially enter this race,the Boston Marathon,NA
2017-01-23,J,FROM CHUMPS TO CHAMPS,,800,"After never making the playoffs in their first 6 years of existence, this Northwest team scouted the way to an NBA title in 1977",the Trail Blazers,NA
2017-01-23,J,HEALTH & MEDICINE,,800,Those who suffer from carpal tunnel or arthritis may get a shot of this 9-letter steroid to reduce inflammation,cortisone,NA
2017-01-23,J,QUIZINE,,800,"This Cajun crayfish stew takes its name from a word meaning ""suffocated""",étouffée,NA
2017-01-23,J,SHOOTING BLANKS,,800,Don't shoot the ____; you'll be taking it out on the wrong person,the messenger,NA
2017-01-23,J,GREEK LETTERS & ROMAN NUMERALS,,800,"No hints, but having been in a fraternity or sorority would help",psi,http://www.j-archive.com/media/2017-01-23_J_24.jpg
2017-01-23,J,AMERICAN WOMEN,,800,"""She guided Post through Pentagon Papers and Watergate"", said the headline of her obituary in her own paper",Katharine Graham,NA
2017-01-23,J,FROM CHUMPS TO CHAMPS,,1000,"The Twins went from last in 1990 to the 1991 World Series, where they beat John Smoltz & this team that did the same thing",the Atlanta Braves,NA
2017-01-23,J,HEALTH & MEDICINE,,NA,"Daltonism is a type of this, a problem with cone receptors",color blindness,NA
2017-01-23,J,QUIZINE,,1000,"Per Islamic dietary laws, ""haram"" refers to forbidden foods & this word refers to permitted ones",halal,NA
2017-01-23,J,SHOOTING BLANKS,,1000,"Shoot the ____, a goal in the card game Hearts",the moon,NA
2017-01-23,J,GREEK LETTERS & ROMAN NUMERALS,,1000,Toronto calling!CDXVI,416,NA
2017-01-23,J,AMERICAN WOMEN,,1000,"This ""Battle Hymn Of The Republic"" author was also the first president of the New England Woman Suffrage Association",Julia Ward Howe,NA
2017-01-23,DJ,PYRAMIDS,,400,"At 42.3 billion candlepower, the light beaming form the top of this Las Vegas pyramid is the strongest in the world",Luxor,NA
2017-01-23,NA,NA,NA,NA,NA,NA,NA
2017-01-23,DJ,NATIONAL PARKS OF THE WORLD,,400,Eucalyptus is common in Southwest National Park on this island state of Australia,Tasmania,NA
2017-01-23,NA,NA,NA,NA,NA,NA,NA
2017-01-23,DJ,"DOUBLE O, 7","(Alex: Each correct response will be a 7-letter word, and it will have a double ""O"" in it.)",400,Job description of a singer like Bing Crosby,crooner,NA
2017-01-23,DJ,OTHER BOND FILM CHARACTERS,,400,"Miss Moneypenny is the personal assistant of this character, the head of MI6",M,NA
2017-01-23,DJ,PYRAMIDS,,800,"In 2016 ABC revived ""The $100,000 Pyramid"", now hosted by this pro football Hall of Famer",(Michael) Strahan,NA
2017-01-23,DJ,BOOKS BY PROFESSORS,,800,W.V. historian Otis K. Rice had a posthumous bestseller on these feudin' families when they became a miniseries,the Hatfields and McCoys,NA
2017-01-23,DJ,NATIONAL PARKS OF THE WORLD,,800,This giant monitor lizard is a must-see on a visit to the Indonesian park located on 3 of the Lesser Sunda Islands,the Komodo dragon,NA
2017-01-23,DJ,RELIGIOUS MATTERS,,800,"The Trimurti, or Hindu trinity, consists of Brahma, Vishnu & this ""destroyer""",Shiva,NA
2017-01-23,DJ,"DOUBLE O, 7","(Alex: Each correct response will be a 7-letter word, and it will have a double ""O"" in it.)",800,A train crew's quarters are usually found in this last car,caboose,NA
2017-01-23,DJ,OTHER BOND FILM CHARACTERS,,800,"First name of American spy Mr. Leiter, who often helped James Bond defeat the bad guys",Felix,NA
2017-01-23,DJ,PYRAMIDS,,1200,Its glass pyramid is composed of 673 triangular & diamond-shaped panes,the Louvre,NA
2017-01-23,DJ,BOOKS BY PROFESSORS,,1200,"This Cornell professor wrote ""English Metres"" but is best known for 1918's ""The Elements of Style""","William Strunk, Jr.",NA
2017-01-23,DJ,NATIONAL PARKS OF THE WORLD,,1200,Tulum National Park in the Yucatan has the ruins of one of the last thriving cities of this civilization,the Mayan civilization,NA
2017-01-23,DJ,RELIGIOUS MATTERS,,NA,"According to legend, this gospel writer's body & relics were transported from Alexandria, Egypt to Venice in 828",Saint Mark,NA
2017-01-23,DJ,"DOUBLE O, 7","(Alex: Each correct response will be a 7-letter word, and it will have a double ""O"" in it.)",1200,"To cheat, or a type of pool game",snooker,NA
2017-01-23,DJ,OTHER BOND FILM CHARACTERS,,1200,Ben Whishaw is the new computer-savvy version of this character,Q,http://www.j-archive.com/media/2017-01-23_DJ_10.jpg
2017-01-23,DJ,PYRAMIDS,,1600,Who says a pyramid has to be pointy & up?  Here's the headquarters of Slovak Radio in this capital city,Bratislava,http://www.j-archive.com/media/2017-01-23_DJ_20.jpg
2017-01-23,DJ,BOOKS BY PROFESSORS,,1600,"Illinois professor & librarian Dee Brown changed the field of Native American history with ""Bury My Heart"" here",Wounded Knee,NA
2017-01-23,DJ,NATIONAL PARKS OF THE WORLD,,NA,Venezuela's Canaima National Park is home to the picturesque Canaima Lagoon  & this other watery icon,Angel Falls,NA
2017-01-23,DJ,RELIGIOUS MATTERS,,1600,"Remove your shoes & cover your head when entering a gurdwara, a temple of this religion founded in northern India",Sikhism,NA
2017-01-23,DJ,"DOUBLE O, 7","(Alex: Each correct response will be a 7-letter word, and it will have a double ""O"" in it.)",1600,"There's an animal in this slang word starting with ""V"" that means ""get outta here""",vamoose,NA
2017-01-23,DJ,OTHER BOND FILM CHARACTERS,,1600,"Supervillain Ernst Stavro Blofeld shows up in ""Thunderball"" as the head of this criminal organization",SPECTRE,NA
2017-01-23,DJ,PYRAMIDS,,2000,The reverse of the Great Seal of the United States features an unfinished pyramid with this right above it,an eye (the Eye of God),NA
2017-01-23,NA,NA,NA,NA,NA,NA,NA
2017-01-23,NA,NA,NA,NA,NA,NA,NA
2017-01-23,DJ,RELIGIOUS MATTERS,,2000,"In 1959 Young Oon Kim, known as Miss Kim, left South Korea to become this church's first missionary in the United States",the Unification Church,NA
2017-01-23,DJ,"DOUBLE O, 7","(Alex: Each correct response will be a 7-letter word, and it will have a double ""O"" in it.)",2000,This woodwind has a doubled tube & a curved metal crook,a bassoon,NA
2017-01-23,DJ,OTHER BOND FILM CHARACTERS,,2000,"The giant metal-mouthed assassin ""Jaws"" chews up the scenery in ""The Spy Who Loved Me"" & this film in space",Moonraker,NA
2017-01-23,FJ,ANIMAL SONGS,,NA,"The title of this hit from a 1933 Disney ""Silly Symphony"" inspired a Tony-winning 1962 drama & an Oscar-nominated 1966 film","\""Who\'s Afraid Of The Big Bad Wolf?\""",NA
