date,round,category,comment,value,clue,response,link
2017-02-14,J,STUDYING ABROAD,,200,Congratulations! You're a Rhodes Scholar! Now pack your bags because you'll be studying at this university,Oxford,NA
2017-02-14,J,SCI-FI BOOKS,,200,"The ""hard rain"" in Neal Stephenson's ""Seveneves"" comes from this natural satellite that's broken up & falling to Earth bit by bit",the moon,NA
2017-02-14,J,THE CLASSIC MARQUEE INGREDIENT,,200,Benedict or over easy,eggs,NA
2017-02-14,J,"""FR""",,200,"At Christmas, some people go nutty for this",fruitcake,http://www.j-archive.com/media/2017-02-14_J_18.jpg
2017-02-14,J,GOTTA CRAM,,200,"The largest crowd for a hockey game came in 2010 when 104,173 fans filled Michigan's ""Big House"" in this city",Ann Arbor,NA
2017-02-14,J,TIME TO PULL AN ALL-NIGHTER,,200,"A song by them says, ""The story of my life, I take her home, I drive all night to keep her warm""",One Direction,NA
2017-02-14,J,STUDYING ABROAD,,400,"If you're interested in Asian culture, spend a semester abroad studying at Mahidol University in this Thai capital",Bangkok,NA
2017-02-14,J,SCI-FI BOOKS,,400,"This Max Brooks novel tells of the drug Phalanx, which failed to stop the undead hordes",World War Z,NA
2017-02-14,J,THE CLASSIC MARQUEE INGREDIENT,,400,Bourguignon or tartare,beef,NA
2017-02-14,J,"""FR""",,400,"Among the crimes Bernie Madoff pled guilty to: securities this, mail this & wire this",fraud,NA
2017-02-14,J,GOTTA CRAM,,400,"Every seat at the play is taken; it's SRO, short for this",standing room only,NA
2017-02-14,J,TIME TO PULL AN ALL-NIGHTER,,400,"We'll be up for a while, so let's watch ""Clubland"" on this channel & then ""Music Feed"" into the wee hours",MTV,NA
2017-02-14,J,STUDYING ABROAD,,600,Your time in Greece would of course include a visit to this ancient temple,the Parthenon,http://www.j-archive.com/media/2017-02-14_J_15.jpg
2017-02-14,J,SCI-FI BOOKS,,NA,"Dubbed ""wildly inaccurate"", it ""supplanted the great Encyclopedia Galactica as the... repository of all knowledge""",The Hitchhiker\'s Guide to the Galaxy,NA
2017-02-14,J,THE CLASSIC MARQUEE INGREDIENT,,600,E fagioli or primavera,pasta,NA
2017-02-14,J,"""FR""",,600,The one seen here appears on the wall of a basilica in Italy,a fresco,http://www.j-archive.com/media/2017-02-14_J_07.jpg
2017-02-14,J,GOTTA CRAM,,600,"If the airplane has too many fliers & you have low priority, you accept this status & hope a seat opens up",standby,NA
2017-02-14,J,TIME TO PULL AN ALL-NIGHTER,,600,"It's gonna be an all-out comic binge, starting with all the DC reboots in their ""New"" this number event",52,NA
2017-02-14,J,STUDYING ABROAD,,800,"A program on Holocaust studies includes a visit to Birkenau, part of this largest concentration camp",Auschwitz,NA
2017-02-14,J,SCI-FI BOOKS,,800,"Thomas in this James Dashner sci-fi book awakens being ""jerked upward like an old lift in a mine shaft""",The Maze Runner,NA
2017-02-14,J,THE CLASSIC MARQUEE INGREDIENT,,800,Kiev or a la king,chicken,NA
2017-02-14,J,"""FR""",,800,Bono for U2 or Eddie Vedder for Pearl Jam,a frontman,NA
2017-02-14,J,GOTTA CRAM,,800,"In 2016 El Pollo Loco introduced new quesadillas that were called this, something you might say about your fluffy sofa",overstuffed,NA
2017-02-14,J,TIME TO PULL AN ALL-NIGHTER,,800,"Except for 1940 to 1948, this 24-hour endurance race has been run in France every year since 1923",Le Mans,NA
2017-02-14,J,STUDYING ABROAD,,1000,Students can work with leading physicists at this center near Geneva that studies subatomic particles,CERN,NA
2017-02-14,J,SCI-FI BOOKS,,1000,"Hiroshi Sakurazaka's ""All You Need Is Kill"" was ""reborn"" in 2014 as this Tom Cruise flick",Edge of Tomorrow,NA
2017-02-14,J,THE CLASSIC MARQUEE INGREDIENT,,1000,Louie or cakes,crab,NA
2017-02-14,J,"""FR""",,1000,"It entered our vocabulary in 1953 when the oil & gas journal called it ""a new exploratory tool""",fracking,NA
2017-02-14,J,GOTTA CRAM,,1000,"It's any condition where things grind to a halt, specifically a traffic jam where cars don't clear an intersection",gridlock,http://www.j-archive.com/media/2017-02-14_J_22.jpg
2017-02-14,J,TIME TO PULL AN ALL-NIGHTER,,1000,This alliterative country singer went bonkers in 2014 playing 10 shows in 10 cities in 24 hours,Hunter Hayes,http://www.j-archive.com/media/2017-02-14_J_24.jpg
2017-02-14,DJ,ALL KINDS OF TV,,400,"The ""Dr.""-ate of this mustached talk show host is in clinical psychology",Dr. Phil,NA
2017-02-14,DJ,CLASSICAL MUSIC,,400,"""Glory to God in the highest"" is one of numerous Biblical verses used in the text of this Handel work",Messiah,NA
2017-02-14,DJ,10-LETTER WORDS,,400,One's partner in crime,accomplice,NA
2017-02-14,DJ,SIX FEET UNDER,,400,"The 6 feet (OK, legs) under an insect are typically attached to this, the middle of its 3 body sections",the thorax,NA
2017-02-14,DJ,A HISTORY LESSON,,400,In 1249 King Alfonso III eliminated the last Moorish stronghold in this neighbor of Spain,Portugal,NA
2017-02-14,DJ,GET A JOB!,,400,"George Balanchine was a renowned one of these, a creator of dances",choreographer,NA
2017-02-14,DJ,ALL KINDS OF TV,,800,"You'll find ""Trisha's Southern Kitchen"" on this network",the Food Network,NA
2017-02-14,DJ,CLASSICAL MUSIC,,800,"""Gran Vals"" by Francisco Tarrega would still be pretty obscure if it hadn't become one of these, courtesy of Nokia",a ringtone,http://www.j-archive.com/media/2017-02-14_DJ_05.mp3
2017-02-14,DJ,10-LETTER WORDS,,800,Name shared by the decorative device & the bird seen here,a nutcracker,http://www.j-archive.com/media/2017-02-14_DJ_13.jpg
2017-02-14,DJ,SIX FEET UNDER,,800,"For these biting pests of the family Culicidae, that annoying whine helps attract mates",mosquitoes,NA
2017-02-14,DJ,A HISTORY LESSON,,800,Czar Alexander II signed the 1867 Treaty of Cession that gave this territory to the United States,Alaska,NA
2017-02-14,DJ,GET A JOB!,,800,"You can use ""person"" instead of ""boy"" in this word for one who clears tables",busboy,NA
2017-02-14,DJ,ALL KINDS OF TV,,1200,"In 2017 Kaitlin Olson of this show set in a Pennsylvania bar got a new sitcom as ""The Mick""",It\'s Always Sunny in Philadelphia,NA
2017-02-14,DJ,CLASSICAL MUSIC,,1200,"Originally, his ""A Little Night Music"" contained an additional minuet, but it has been lost",Mozart,NA
2017-02-14,DJ,10-LETTER WORDS,,NA,"""Madam, I'm Adam"" is a famous one",a palindrome,NA
2017-02-14,DJ,SIX FEET UNDER,,1200,That's no fun! The Indian walking this usually reproduces via parthenogenesis,a stick,http://www.j-archive.com/media/2017-02-14_DJ_04.jpg
2017-02-14,DJ,A HISTORY LESSON,,1200,In 1513 Machiavelli was accused of conspiracy against this Florentine family & was tortured on the rack,the Medicis,NA
2017-02-14,DJ,GET A JOB!,,1200,They get their name from where they might wait for the politicians whose votes they want to influence,lobbyist,NA
2017-02-14,DJ,ALL KINDS OF TV,,1600,"This CBS series about FBI profilers rolls on, Hotch or no Hotch",Criminal Minds,NA
2017-02-14,DJ,CLASSICAL MUSIC,,1600,One of Bartok's last works was a concerto for this instrument that often plays second fiddle to the fiddle,viola,NA
2017-02-14,DJ,10-LETTER WORDS,,1600,It describes the circles seen here,concentric,http://www.j-archive.com/media/2017-02-14_DJ_14.jpg
2017-02-14,DJ,SIX FEET UNDER,,1600,"These social insects use the ""waggle dance"" to communicate the location of distant food sources",bees,NA
2017-02-14,DJ,A HISTORY LESSON,,1600,In 1608 this captain & a few other colonists left Jamestown & explored the Chesapeake Bay & its tributaries,(John) Smith,NA
2017-02-14,DJ,GET A JOB!,,1600,"Put in a little O.T. studying & you could be one of these health professionals, an O.T.",occupational therapist,NA
2017-02-14,DJ,ALL KINDS OF TV,,2000,"MeTV has a pairing of Matlock & this other TV attorney, first name Perry",Perry Mason,NA
2017-02-14,DJ,CLASSICAL MUSIC,,2000,"As choir director for St. Thomas Church in Leipzig, he wrote 6 cantatas known as the ""Christmas Oratorio""",(Johann Sebastian) Bach,NA
2017-02-14,DJ,10-LETTER WORDS,,2000,"Background music for a movie, or a line drawn beneath a word",underscore,NA
2017-02-14,DJ,SIX FEET UNDER,,2000,"Killing weak trees (good) but also healthy ones (not good), the pine engraver is this alliterative type of beetle",a bark beetle,NA
2017-02-14,DJ,A HISTORY LESSON,,NA,"In 1910 Louis Botha became this country's first prime minister, a post he held until 1919",South Africa,NA
2017-02-14,DJ,GET A JOB!,,2000,"This profession takes its name from a Greek word meaning ""chief builder""",an architect,NA
2017-02-14,FJ,WRITERS,,NA,"A New Orleans literary festival in his honor includes various panels, a walking tour & a Stanley & Stella shouting contest",Tennessee Williams,NA
