date,round,category,comment,value,clue,response,link
2017-05-11,J,STRANGER THINGS,,200,The billy goat plum of Australia contains 100 times more of this vitamin than an orange,Vitamin C,NA
2017-05-11,J,ELEMENTARY,,200,"Fe, Fi, Fo, Fum! One of those is the symbol for this element",iron,NA
2017-05-11,J,THE CROWN,,200,"377 steps & a double-helix staircase take visitors to its crown, which has 24 windows",the Statue of Liberty,NA
2017-05-11,J,ONCE UPON A TIME,,200,"Bullied as a youngster over his looks, he grew up to be a beautiful swan",the Ugly Duckling,NA
2017-05-11,J,"THIS IS ""US""",,200,It's the 5-letter acronym for America's chief executive,POTUS,NA
2017-05-11,J,TV DRAMAS,,200,"On ""Elementary"" Jonny Lee Miller plays Sherlock Holmes & Lucy Liu plays her",Watson,NA
2017-05-11,J,STRANGER THINGS,,400,This American's self-written epitaph makes no mention of his years as president from 1801 to 1809,Jefferson,NA
2017-05-11,J,ELEMENTARY,,400,By volume this gas makes up about 78% of Earth's atmosphere,nitrogen,NA
2017-05-11,J,THE CROWN,,400,You can buy a keepsake ornament as well as cards at its Gold Crown stores,Hallmark,NA
2017-05-11,J,ONCE UPON A TIME,,400,"In some versions of the fairy tale, she survives only after the woodsman cuts open the wolf & frees her",Little Red Riding Hood,NA
2017-05-11,J,"THIS IS ""US""",,400,"A network of blood vessels or nerves, like the solar one",the plexus,NA
2017-05-11,J,TV DRAMAS,,400,"""Once Upon a Time"" is set in this fictional New England town",Storybrooke (Maine),NA
2017-05-11,J,STRANGER THINGS,,600,The water-holding species of this amphibian can lie dormant in a desert burrow waiting for rain for up to 5 years,frog,NA
2017-05-11,J,ELEMENTARY,,600,"Since its discovery in 1940, more than 20 isotopes of this transuranium element have been found, including 239",plutonium,NA
2017-05-11,J,THE CROWN,,600,"(Kelly of the Clue Crew shows an arch on the monitor.) In architecture, the crown is the top part of the arch, including this central wedge-shaped piece",the keystone,http://www.j-archive.com/media/2017-05-11_J_15a.jpg
2017-05-11,J,ONCE UPON A TIME,,600,"Disney's ""Tangled"" is based on this fairy tale","""Rapunzel""",NA
2017-05-11,J,"THIS IS ""US""",,NA,Violinist Jascha Heifetz was born in this Baltic capital in 1901,Vilnius,NA
2017-05-11,J,TV DRAMAS,,600,"This actor plays Dr. Brenner on ""Stranger Things""",Matthew Modine,http://www.j-archive.com/media/2017-05-11_J_03.jpg
2017-05-11,J,STRANGER THINGS,,800,"He not only made incredible escapes, but in 1918 made a 10,000-pound elephant vanish from a brightly lit stage",Houdini,NA
2017-05-11,J,ELEMENTARY,,800,"In Japan seaweed is a major source of this element, a lack of which can lead to a goiter",iodine,NA
2017-05-11,J,THE CROWN,,800,"Sainte-Chapelle in Paris was built to house relics, including this crown",Jesus\' crown of thorns,NA
2017-05-11,J,ONCE UPON A TIME,,800,Here's a contemporary vision of this character who was born inside a tulip and also went by the name of Tiny,Thumbelina,http://www.j-archive.com/media/2017-05-11_J_19a.jpg
2017-05-11,J,"THIS IS ""US""",,800,"Hop on, grab a seat & enjoy the reprinted works of your favorite author in this single volume",omnibus,NA
2017-05-11,J,TV DRAMAS,,800,"On the premiere episode of ""This Is Us"", she & Milo Ventimiglia were expecting triplets",Mandy Moore,NA
2017-05-11,J,STRANGER THINGS,,1000,Helium cooled to near absolute zero becomes this type of liquid with a 10-letter name that can flow without friction,a superfluid,NA
2017-05-11,J,ELEMENTARY,,1000,"Alloys of this metallic element, atomic No. 22, are used in artificial hips",titanium,NA
2017-05-11,J,THE CROWN,,1000,The Sahasrara is the crown one of these points of spiritual power in Hinduism,a chakra,http://www.j-archive.com/media/2017-05-11_J_17.jpg
2017-05-11,J,ONCE UPON A TIME,,1000,"This ""poor little girl, with bare head and naked feet"" tries to keep warm on New Year's Eve but ends up freezing to death",the Little Match Girl,NA
2017-05-11,J,"THIS IS ""US""",,1000,"After rescuing Andromeda from a sea monster, he marries her",Perseus,NA
2017-05-11,J,TV DRAMAS,,1000,"Here's this actress who takes the crown on ""The Crown""",Claire Foy,http://www.j-archive.com/media/2017-05-11_J_05.jpg
2017-05-11,DJ,CASTRO'S CUBA: 1959-2016,,400,"Fidel's efforts to export revolution to this continent cost the lives of more than 4,000 Cubans, half in Angola",Africa,NA
2017-05-11,DJ,9-LETTER WORDS,,400,Sodom was destroyed by fire & it,brimstone,NA
2017-05-11,DJ,BESTSELLING NONFICTION,,400,"Published just 2 weeks after his death, ""A Life Well Played"" features stories & anecdotes from this golf legend",(Arnold) Palmer,NA
2017-05-11,DJ,U.S. CITIES,,400,"If you're in front of the former Sears building seen here, you're in this city",Seattle,http://www.j-archive.com/media/2017-05-11_DJ_07a.jpg
2017-05-11,DJ,AKAs,,400,It's the less formal name for table tennis,ping-pong,NA
2017-05-11,DJ,THE SILENT MOVIE ERA,,400,One of the first film versions of this novel was in 1921 with Douglas Fairbanks as  d'Artagnan,The Three Musketeers,NA
2017-05-11,DJ,CASTRO'S CUBA: 1959-2016,,800,"In 2015 in Havana he said, ""Presidents Obama and Castro made a courageous decision to stop being the prisoners of history""",John Kerry,http://www.j-archive.com/media/2017-05-11_DJ_14.jpg
2017-05-11,DJ,9-LETTER WORDS,,800,Fiefs were part of this social system that was a big hit in the Middle Ages,feudalism,NA
2017-05-11,DJ,BESTSELLING NONFICTION,,800,"This Elizabeth Gilbert bestseller is subtitled ""One Woman's Search for Everything Across Italy, India and Indonesia""","Eat, Pray, Love",NA
2017-05-11,DJ,U.S. CITIES,,800,"In this Rhode Island resort town, you can visit such mansions as Rosecliff & the Breakers",Newport,NA
2017-05-11,DJ,AKAs,,800,"""My Country 'Tis Of Thee"" is alternately known by this one-word title","""America""",NA
2017-05-11,DJ,THE SILENT MOVIE ERA,,800,"""The Sheikh"" starred this short-lived heartthrob",(Rudolph) Valentino,http://www.j-archive.com/media/2017-05-11_DJ_29.jpg
2017-05-11,DJ,CASTRO'S CUBA: 1959-2016,,1200,"On January 25, 1998, 300,000 gathered in the Plaza de la Revolución for this man's Mass on the last day of his historic visit",Pope John Paul II,http://www.j-archive.com/media/2017-05-11_DJ_15a.jpg
2017-05-11,DJ,9-LETTER WORDS,,1200,"A city in Iowa, or a type of sofa",a davenport,NA
2017-05-11,DJ,BESTSELLING NONFICTION,,1200,"In ""Making Rounds with Oscar"", Oscar is one of these who comforts dying patients in their final hours",a cat,NA
2017-05-11,DJ,U.S. CITIES,,1200,"Let's head for spring break at this ""Fort"" city known as the ""Venice of America"" for its many inland waterways",Fort Lauderdale,NA
2017-05-11,DJ,AKAs,,1200,"Persian, the official language of Iran, is also known by this 5-letter name",Farsi,NA
2017-05-11,DJ,THE SILENT MOVIE ERA,,1200,"1915's ""The Birth of a Nation"" is controversial today, as it glorified this sheety group",the Ku Klux Klan,NA
2017-05-11,DJ,CASTRO'S CUBA: 1959-2016,,1600,"With new cars scarce, Cubans preserved classic U.S. models like the Bel Air from this automaker",Chevrolet,http://www.j-archive.com/media/2017-05-11_DJ_16.jpg
2017-05-11,DJ,9-LETTER WORDS,,1600,"For normal depth perception, the eyes work together in this type of vision",binocular,NA
2017-05-11,DJ,BESTSELLING NONFICTION,,1600,"In ""The Book of Joy"", the Dalai Lama & this South African archbishop share stories & wisdom on finding happiness in life",Desmond Tutu,NA
2017-05-11,DJ,U.S. CITIES,,NA,"This Soap Box Derby city was co-founded in 1825 by Simon Perkins, an official with the Ohio Canal Fund","Akron, Ohio",NA
2017-05-11,DJ,AKAs,,1600,Varicella is another name for this childhood disease,chicken pox,NA
2017-05-11,DJ,THE SILENT MOVIE ERA,,NA,"Seen here is a still from the 1925 silent version of this film, partly shot here in Culver City",Ben-Hur (A Tale of the Christ),http://www.j-archive.com/media/2017-05-11_DJ_27.jpg
2017-05-11,DJ,CASTRO'S CUBA: 1959-2016,,2000,In 1980 Arnaldo Tamayo Méndez became the first Latin American in orbit aboard one of these Soviet spacecraft,Soyuz,http://www.j-archive.com/media/2017-05-11_DJ_17a.jpg
2017-05-11,DJ,9-LETTER WORDS,,2000,This type of belt worn by gunmen has little slots to hold extra ammunition,bandolier,NA
2017-05-11,DJ,BESTSELLING NONFICTION,,2000,"Before ""Silent Spring"", she had an early 1950s bestseller with ""The Sea Around Us""",Rachel Carson,NA
2017-05-11,DJ,U.S. CITIES,,2000,"This Georgia city is known as the ""Sweet Onion Capital of the World""",Vidalia,NA
2017-05-11,DJ,AKAs,,2000,"From the Greek for ""wolf man"", it's another term for werewolf",lycanthrope,NA
2017-05-11,DJ,THE SILENT MOVIE ERA,,2000,"A thrilling story of WWI pilots, it won the first Academy Award for Best Picture",Wings,NA
2017-05-11,FJ,FOREIGN WORDS & PHRASES,,NA,"Often used to describe artists ahead of their time, it was also the name of a youth militia in WWII Vichy France",avant-garde,NA
