date,round,category,comment,value,clue,response,link
2005-10-19,J,BIBLICAL NAME'S THE SAME,,200,"Neville,Copland,Spelling",Aaron,NA
2005-10-19,J,THEIR FIRST FEATURE FILMS,,200,"This ""Bionic Man"" got his head chopped off by an axe-wielding Joan Crawford in his first film, ""Strait-Jacket""",Lee Majors,NA
2005-10-19,J,STUPID ANSWERS,,200,"L.A.'s Pink's hot dog stand has many fans, incl. this often pink-haired singer, who, by the way, isn't the owner",Pink,NA
2005-10-19,J,FAMILIAR PHRASES,,200,"In war & football, ""The best defense is a good"" this",offense,NA
2005-10-19,J,HAPPY TRAILS TO YOU,,200,"Often used to move large herds of longhorn cattle, the Chisholm Trail ran from this state to Kansas",Texas,NA
2005-10-19,J,UNTIL WE MEAT AGAIN,,200,"From the Old French for ""upper loin"", it's an expensive cut of beef from the upper loin",sirloin,NA
2005-10-19,J,BIBLICAL NAME'S THE SAME,,400,"Manoff,Washington,Shore",Dinah,NA
2005-10-19,J,THEIR FIRST FEATURE FILMS,,400,"Her first album was ""All Hail the Queen""; her first film was Spike Lee's ""Jungle Fever""",Queen Latifah,NA
2005-10-19,J,STUPID ANSWERS,,400,"(Jimmy of the Clue Crew walks the stage of the Majestic Theatre in New York.)  In the musical ""The Phantom of the Opera"", the Phantom writes one of these, called ""Don Juan Triumphant""",an opera,http://www.j-archive.com/media/2005-10-19_J_04.jpg
2005-10-19,J,FAMILIAR PHRASES,,400,"When disappointed, we sometimes say ""There's no joy in"" this town--just like when Casey struck out",Mudville,NA
2005-10-19,J,HAPPY TRAILS TO YOU,,400,Hikers enjoy the 13-mile Barr Trail to the summit of this Colorado peak,Pikes Peak,NA
2005-10-19,J,UNTIL WE MEAT AGAIN,,400,"From the French for ""calf"", it's meat from a calf",veal,NA
2005-10-19,J,BIBLICAL NAME'S THE SAME,,600,"Ward,Weisz &""My Cousin""",Rachel,NA
2005-10-19,J,THEIR FIRST FEATURE FILMS,,600,"Falling off a chair at her audition helped her win the role of the klutzy princess in ""The Princess Diaries""",(Anne) Hathaway,NA
2005-10-19,J,STUPID ANSWERS,,600,This Hugo Boss perfume scented with freesia & vanilla comes in a distinctive deep red bottle,Deep Red,NA
2005-10-19,J,FAMILIAR PHRASES,,600,"With skyrocketing medical costs, remember that this is ""cheaper than treatment"" & ""better than cure""",prevention,NA
2005-10-19,J,HAPPY TRAILS TO YOU,,600,"From beginning to end, the Old Spanish Trail ran between Santa Fe & this West Coast city",Los Angeles,NA
2005-10-19,J,UNTIL WE MEAT AGAIN,,600,"From the Latin for ""ram"", it's the meat of an adult sheep",mutton,NA
2005-10-19,J,BIBLICAL NAME'S THE SAME,,800,"Dalton,Hutton,Leary",Timothy,NA
2005-10-19,J,THEIR FIRST FEATURE FILMS,,800,"Later Rose on ""The Golden Girls"", she blossomed as a senator in the 1962 drama ""Advise and Consent""",Betty White,NA
2005-10-19,J,STUPID ANSWERS,,800,This gemstone is basically an onyx with alternating bands of sard & other minerals,sardonyx,NA
2005-10-19,J,FAMILIAR PHRASES,,800,"Arthur Fletcher coined this ""mind""ful United Negro College Fund motto about living up to one's potential","""A mind is a terrible thing to waste""",NA
2005-10-19,J,HAPPY TRAILS TO YOU,,800,The forced march this Eastern tribe made West during the winter of 1838-39 is known as the Trail of Tears,the Cherokee,NA
2005-10-19,J,UNTIL WE MEAT AGAIN,,800,"From the Latin for ""to hunt"", it's deer meat",venison,NA
2005-10-19,J,BIBLICAL NAME'S THE SAME,,1000,"Watts,Campbell,Judd",Naomi,NA
2005-10-19,J,THEIR FIRST FEATURE FILMS,,1000,Seth Green checked in when he played Egg in this film based on a John Irving novel,The Hotel New Hampshire,NA
2005-10-19,J,STUPID ANSWERS,,1000,"The town that became Orlando, Florida was founded in 1850 by Aaron Jernigan & was given this 1-word name",Jernigan,NA
2005-10-19,J,FAMILIAR PHRASES,,NA,"The phrase ""handwriting on the wall"" goes back to this book of the Old Testament",Daniel,NA
2005-10-19,J,HAPPY TRAILS TO YOU,,1000,The Bozeman Trail took travelers from this Wyoming fort to the gold fields in Montana,Fort Laramie,NA
2005-10-19,J,UNTIL WE MEAT AGAIN,,1000,"From the Old English for ""heel"", it's an animal's lower leg served as a cut of cured meat",hock,NA
2005-10-19,DJ,WORLD WAR I,,400,During the war this future British prime minister served as First Lord of the Admiralty,Churchill,NA
2005-10-19,DJ,OCCUPATIONAL TV,,400,Venus Flytrap & Dr. Johnny Fever both worked at this title location,WKRP in Cincinnati,NA
2005-10-19,DJ,"A WORLD OF ""P""OETS",,400,"This 19th c. Russian was still a student when he began his great Romantic poem ""Ruslan and Ludmila""",Pushkin,NA
2005-10-19,DJ,LANGUAGES & DIALECTS,,400,"Our wood stoop, the one on the front of a house, comes from this language's word spelled S-T-O-E-P",Dutch,NA
2005-10-19,DJ,CATS & DOGS,,400,"The ""MiB"" pug & the ""Legally Blonde"" Chihuahua popularized breeds classified by the AKC in this group",toy dogs,NA
2005-10-19,DJ,ABBREVIATED,,400,"Dangerous creations, as mentioned in a January 29, 2002 presidential speech:WMD",weapons of mass destruction,NA
2005-10-19,DJ,WORLD WAR I,,800,This American flying ace shot down 26 enemy aircraft & received the French Croix de Guerre,Rickenbacker,NA
2005-10-19,DJ,OCCUPATIONAL TV,,800,"Well kiss my grits, Mel's Diner was the place of work on this sitcom",Alice,NA
2005-10-19,DJ,"A WORLD OF ""P""OETS",,NA,"When Alexander the Great burned Thebes to the ground, the only house spared was that of this great lyric poet",Pindar,NA
2005-10-19,DJ,LANGUAGES & DIALECTS,,800,"The oldest known text in this Slavic language is the religious hymn ""Bogurodzica"", which dates back to 1408",Polish,NA
2005-10-19,DJ,CATS & DOGS,,800,"The Sphynx cat is often referred to as this, also following ""Mexican"" in a dog breed name",a hairless (cat),NA
2005-10-19,DJ,ABBREVIATED,,800,A TV & film labor organization:The WGA,the Writers Guild of America,NA
2005-10-19,DJ,WORLD WAR I,,1200,3-word name for the ground between enemy trenches; it could be less than 30 yards or more than a mile wide,no man\'s land,NA
2005-10-19,DJ,OCCUPATIONAL TV,,1200,"On ""Everybody Loves Raymond"", Ray Barone was a sportswriter at this New York newspaper",Newsday,NA
2005-10-19,DJ,"A WORLD OF ""P""OETS",,1200,"This Frenchman who gave us the ""Sleeping Beauty"" story also wrote such poems as ""Le Siecle de Louis le Grand""",Charles Perrault,NA
2005-10-19,DJ,LANGUAGES & DIALECTS,,1200,"Latgalian is a dialect spoken by about 150,000 in this country's province of Latgale",Latvia,NA
2005-10-19,DJ,CATS & DOGS,,1200,"National name of the kitty known affectionately as a ""Wegie""",Norwegian,NA
2005-10-19,DJ,ABBREVIATED,,1200,A movie special-effects company:ILM,Industrial Light & Magic,NA
2005-10-19,DJ,WORLD WAR I,,1600,During the war the Food Admin. headed by this future president controlled the distribution of food,Hoover,NA
2005-10-19,DJ,OCCUPATIONAL TV,,1600,Jim Anderson was an agent at the General Insurance Company on this sitcom,Father Knows Best,NA
2005-10-19,DJ,"A WORLD OF ""P""OETS",,1600,"This 14th century Italian made Scipio Africanus the hero of his poem ""Africa""",Petrarch,NA
2005-10-19,DJ,LANGUAGES & DIALECTS,,1600,Sesotho is a Sotho dialect mainly spoken in the Republic of South Africa & this kingdom,Lesotho,NA
2005-10-19,DJ,CATS & DOGS,,NA,"Dash, a favorite pet of Queen Victoria, was this type of spaniel named for another monarch",a Cavalier King Charles,NA
2005-10-19,DJ,ABBREVIATED,,1600,On a camera:SLR,single lens reflex,NA
2005-10-19,DJ,WORLD WAR I,,2000,This controversial Army officer led the air operations of the AEF & flew many missions deep into enemy territory,(Billy) Mitchell,NA
2005-10-19,DJ,OCCUPATIONAL TV,,2000,"On ""Taxi"" this character was a cab driver & part-time art gallery receptionist",Elaine (Nardo),NA
2005-10-19,DJ,"A WORLD OF ""P""OETS",,2000,"""Peace"" be with this Mexican, who published ""Luna Silvestre"", his first book of poems, when he was 19",(Octavio) Paz,NA
2005-10-19,DJ,LANGUAGES & DIALECTS,,2000,The official languages of this small African kingdom are siSwati & English,Swaziland,NA
2005-10-19,DJ,CATS & DOGS,,2000,Jacqueline Kennedy Onassis was a Bouvier de New York; a fine cattle-herding dog is the Bouvier de this,Bouvier des Flandres,NA
2005-10-19,DJ,ABBREVIATED,,2000,At the library or Barnes & Noble:ISBN,International Standard Book Number,NA
2005-10-19,FJ,AMERICANA,,NA,"(Kelly of the Clue Crew reads the clue from a mail sorting counter at the post office.)  In the '60s, to popularize a new system, the Post Office used ads of Ethel Merman singing this Disney movie tune","\""Zip-A-Dee-Doo-Dah\""",http://www.j-archive.com/media/2005-10-19_FJ.jpg
