date,round,category,comment,value,clue,response,link
2017-09-15,J,THE VIETNAM WAR,"(Alex: The first category will have clues from a new PBS series from Ken Burns and Lynn Novick, The Vietnam War, making its debut this Sunday.)",200,"The origins of the conflict are deeply explored, including a pivotal incident in this body of water in August 1964",the Gulf of Tonkin,http://www.j-archive.com/media/2017-09-15_J_19.jpg
2017-09-15,J,ANIMATED FELINES,,200,Mel Blanc said the voice of this tormentor of Tweety was the closest to his own speaking voice,Sylvester,NA
2017-09-15,J,GOVERNMENT FOLKS WITH 2 FIRST NAMES?,,200,In 2013 he defeated Barbara Buono to win reelection as N.J. governor but later ran into some traffic problems,Chris Christie,NA
2017-09-15,J,HOMOPHONIC PAIRS,,200,Consumed an octet,ate eight,NA
2017-09-15,J,SEAS,,200,"This sea is dotted by more than 1,400 islands with almost all of them belonging to Greece",the Aegean,NA
2017-09-15,J,STOCK SYMBOLS ON THE DOW,"(Alex: The Industrial Average, of course.)",200,WMT is this retailer,Walmart,NA
2017-09-15,J,THE VIETNAM WAR,"(Alex: The first category will have clues from a new PBS series from Ken Burns and Lynn Novick, The Vietnam War, making its debut this Sunday.)",400,Recordings of this 36th U.S. pres. are used to examine his handling of the war & the part it played in his misfortunes,"LBJ, Lyndon Johnson",NA
2017-09-15,J,ANIMATED FELINES,,400,"On ""The Simpsons"", this feline is often brutalized by a blue mouse",Scratchy,NA
2017-09-15,J,GOVERNMENT FOLKS WITH 2 FIRST NAMES?,,NA,"After becoming the literal man who fell to Earth in 1962, he rose to serve Ohio in the Senate from 1974 to 1999",John Glenn,NA
2017-09-15,J,HOMOPHONIC PAIRS,,400,Views salty bodies of water,sees seas,NA
2017-09-15,J,SEAS,,400,The Crimean Mountains slope steeply into this sea,the Black Sea,NA
2017-09-15,J,STOCK SYMBOLS ON THE DOW,"(Alex: The Industrial Average, of course.)",400,CAT is the very hungry for business this company,Caterpillar,NA
2017-09-15,J,THE VIETNAM WAR,"(Alex: The first category will have clues from a new PBS series from Ken Burns and Lynn Novick, The Vietnam War, making its debut this Sunday.)",600,"The series shows North Vietnamese citizens trying to reconcile reality with this type of misinformation, from Latin for ""to spread""",propaganda,http://www.j-archive.com/media/2017-09-15_J_21a.jpg
2017-09-15,J,ANIMATED FELINES,,600,The first TV image produced by RCA in 1928 was a 13-inch papier-mâché model of this cat seen here,Felix,http://www.j-archive.com/media/2017-09-15_J_03.jpg
2017-09-15,J,GOVERNMENT FOLKS WITH 2 FIRST NAMES?,,600,"Following 14 years as governor of Texas, in 2017 he became U.S. Energy Secretary",Rick Perry,NA
2017-09-15,J,HOMOPHONIC PAIRS,,600,Writing paper that isn't going anywhere,stationary stationery,NA
2017-09-15,J,SEAS,,600,"Named for its distinct color, this sea east of China averages less than 150 feet deep",the Yellow Sea,NA
2017-09-15,J,STOCK SYMBOLS ON THE DOW,"(Alex: The Industrial Average, of course.)",600,"We'll give you some credit for this company, AXP",American Express,NA
2017-09-15,J,THE VIETNAM WAR,"(Alex: The first category will have clues from a new PBS series from Ken Burns and Lynn Novick, The Vietnam War, making its debut this Sunday.)",800,"In a 1969 address Richard Nixon characterized war supporters as this quiet, larger part of the U.S. population",the silent majority,NA
2017-09-15,J,ANIMATED FELINES,,800,Lake Bell voiced fat cat Chloe in this 2016 movie about what your animals do when you're not around,The Secret Life of Pets,NA
2017-09-15,J,GOVERNMENT FOLKS WITH 2 FIRST NAMES?,,800,"This White House counsel, in 1973: ""We have a cancer within, close to the presidency, that's growing""",John Dean,NA
2017-09-15,J,HOMOPHONIC PAIRS,,800,A bowl o' red straight from the fridge,chilly chili,NA
2017-09-15,J,SEAS,,800,"This sea's deepest point lies more than 15,000 feet down in the Aleutian Trench",the Bering Sea,NA
2017-09-15,J,STOCK SYMBOLS ON THE DOW,"(Alex: The Industrial Average, of course.)",800,GS is this firm also strongly represented in the Trump administration,Goldman Sachs,NA
2017-09-15,J,THE VIETNAM WAR,"(Alex: The first category will have clues from a new PBS series from Ken Burns and Lynn Novick, The Vietnam War, making its debut this Sunday.)",1000,"Bringing a measure of healing to the nation, the Vietnam Veterans Memorial opened in this year, 7 years after the end of the war",1982,http://www.j-archive.com/media/2017-09-15_J_30.mp4
2017-09-15,J,ANIMATED FELINES,,1000,"After appearing as Geppeto's pet in ""Pinocchio"", this cat with the operatic name became Minnie Mouse's pet",Figaro,NA
2017-09-15,J,GOVERNMENT FOLKS WITH 2 FIRST NAMES?,,1000,"A former Secretary of Education, he became a Tennessee senator in 2003",Lamar Alexander,NA
2017-09-15,J,HOMOPHONIC PAIRS,,1000,A prayer book regarding a launched weapon,a missile missal,NA
2017-09-15,J,SEAS,,1000,This sea off Australia's east coast is named for invertebrate marine organisms,the Coral Sea,NA
2017-09-15,J,STOCK SYMBOLS ON THE DOW,"(Alex: The Industrial Average, of course.)",1000,"PFE, it helps to cure what ails ya",Pfizer,NA
2017-09-15,DJ,THE 14th CENTURY,,400,1397's Kalmar Union united these 3 Scandinavian countries,"Norway, Sweden and Denmark",NA
2017-09-15,DJ,IRISH STEW,,400,This name was originally an Irish pet form of William; just ask Mr. Neeson,Liam,NA
2017-09-15,DJ,2017 BILLBOARD HITS,,400,"When it came to Hot R&B/Hip-Hop Songs, ""Fake Love"" by this Canadian rapper got real love from fans",Drake,NA
2017-09-15,DJ,CHEMISTRY,,400,Hydrated ferric oxide is the scientific name for this,rust,NA
2017-09-15,DJ,"""PEN"" PALS",,400,"In sports, this word can precede box, kick & shot",penalty,NA
2017-09-15,DJ,THE STATE OF LITERATURE,(Alex: Name the state where each work is primarily set.),400,"""Twilight""",Washington state,NA
2017-09-15,DJ,THE 14th CENTURY,,800,"The intellectual Charles the Wise of France founded the Bibliotheque du Roi, which translates to this",the library of the king,NA
2017-09-15,DJ,IRISH STEW,,800,"In the 1840s Phytophthora infestans led to this catastrophe & 2 million Irish emigrating, many to America",the potato famine,NA
2017-09-15,DJ,2017 BILLBOARD HITS,,800,"""Handclap"" got a hearty round of applause on the Hot Rock Songs chart for him & the Tantrums",Fitz,NA
2017-09-15,DJ,CHEMISTRY,,800,"Just like mercury, this element, Br, is a liquid at room temperature",bromine,NA
2017-09-15,DJ,"""PEN"" PALS",,800,Cosmetics include this stick used to extend or darken the eyebrows,a pencil,NA
2017-09-15,DJ,THE STATE OF LITERATURE,(Alex: Name the state where each work is primarily set.),NA,"""Midnight in the Garden of Good and Evil""",Georgia,NA
2017-09-15,DJ,THE 14th CENTURY,,NA,"Adding a word to our language, cities began keeping travelers from leaving plague-infected ships for this many days",40,NA
2017-09-15,DJ,IRISH STEW,,1200,The allure of the Emerald Isle has sold products like Shamrock Shakes & this soap introduced in the U.S. in 1972,Irish Spring,NA
2017-09-15,DJ,2017 BILLBOARD HITS,,1200,"As of April 2017 ""The Fame"" by this woman who puts on a nifty Super Bowl show had spent 160 weeks on the Top Dance Album chart",Lady Gaga,NA
2017-09-15,DJ,CHEMISTRY,,1200,"In 1923 Bronsted & Lowry determined that when an acidic substance loses a proton, it forms this",a base,NA
2017-09-15,DJ,"""PEN"" PALS",,1200,It's the one-word term for the study of prison management & criminal rehabilitation,penology,NA
2017-09-15,DJ,THE STATE OF LITERATURE,(Alex: Name the state where each work is primarily set.),1200,"""Inherent Vice""",California,NA
2017-09-15,DJ,THE 14th CENTURY,,1600,"Between the Mongols & the Manchus, this ""M"" dynasty began its rule of China in the 1300s",the Ming dynasty,NA
2017-09-15,DJ,IRISH STEW,,1600,"Used to accompany marching or pennywhistle tunes, a bodhran is a traditional Irish one of these",a drum,NA
2017-09-15,DJ,2017 BILLBOARD HITS,,1600,"""I just want some ice on my wrist so I look better when I dance"", says the song named for this timekeeping brand",Rolex,NA
2017-09-15,DJ,CHEMISTRY,,1600,"Codeine, methadone & Demerol are all these, a word derived from the name of the drug they come from or mimic",an opiate,NA
2017-09-15,DJ,"""PEN"" PALS",,1600,"This 9-letter adjective can mean ""stingy"" or ""destitute""",penurious,NA
2017-09-15,DJ,THE STATE OF LITERATURE,(Alex: Name the state where each work is primarily set.),1600,"""A Confederacy of Dunces""",Louisiana,NA
2017-09-15,DJ,THE 14th CENTURY,,2000,"Legend says he messed up his knee during a youthful sheep raid, but being lame didn't keep him from a life of conquest",Tamerlane (Timur the Lame),NA
2017-09-15,DJ,IRISH STEW,,2000,"At 1014's Battle of Clontarf, this Irish king with a name common today was killed by the Vikings, but the Irish won anyway",Brian Boru,http://www.j-archive.com/media/2017-09-15_DJ_27.jpg
2017-09-15,DJ,2017 BILLBOARD HITS,,2000,"This ""Out of Sight"" actress was in view on Latin airplay, teaming with Marc Anthony on ""Olvidame Y Pega La Vuelta""",Jennifer Lopez,NA
2017-09-15,DJ,CHEMISTRY,,2000,The closest electron shell to the nucleus of an atom is designated by this letter of the alphabet,a K,NA
2017-09-15,DJ,"""PEN"" PALS",,2000,"(Sarah of the Clue Crew presents the clue.) During a solar eclipse, between areas of complete shadow and complete illumination lies this area of partial shadow",the penumbra,http://www.j-archive.com/media/2017-09-15_DJ_17.jpg
2017-09-15,DJ,THE STATE OF LITERATURE,(Alex: Name the state where each work is primarily set.),2000,"""A River Runs Through It""",Montana,NA
2017-09-15,FJ,GLOBAL ORGANIZATIONS,,NA,"""Connecting police for a safer world"" is the motto of this 190-member organization",Interpol,NA
