date,round,category,comment,value,clue,response,link
2017-09-29,J,SCIENCE FICTION,,200,"Published in 1950, these Ray Bradbury ""Chronicles"" begin in 1999, when men leave Earth to colonize a nearby planet",The Martian Chronicles,NA
2017-09-29,J,WORLD LEADERS,,200,First name of the man who became Cuba's head of state in 2008,Raúl,NA
2017-09-29,J,TRANSPORTATION,,200,The U.S.A.'s oldest continuously operating service of this kind has crossed the Connecticut River since 1665,a ferry,http://www.j-archive.com/media/2017-09-29_J_01.jpg
2017-09-29,J,ROCK & ROLL!,,200,"Rockin' & rollin & mic stand-twirlin' a bit too hard, David Lee Roth cut his nose fronting this band on Kimmel & got 14 stitches",Van Halen,NA
2017-09-29,NA,NA,NA,NA,NA,NA,NA
2017-09-29,J,WHERE ARE YOU WEARING?,,200,An island in the Bay of Naples gave its name to these 3/4-length pants,capris,NA
2017-09-29,J,SCIENCE FICTION,,400,"This British author famous for space travel speculation also wrote ""Deep Range"", in which man has conquered the sea",(Arthur) Clarke,NA
2017-09-29,J,WORLD LEADERS,,400,"She was the daughter of a Pakistani PM & after she was slain in 2007, her husband became president",Benazir Bhutto,NA
2017-09-29,J,TRANSPORTATION,,400,"The name of this mode of transportation was coined in 1868 from Latin & Greek words for ""two"" & ""wheel""",bicycle,NA
2017-09-29,J,ROCK & ROLL!,,400,"We learned that St. Hubbins was ""the patron saint of quality footwear"" in a 1984 mockumentary about this band",Spinal Tap,NA
2017-09-29,NA,NA,NA,NA,NA,NA,NA
2017-09-29,J,WHERE ARE YOU WEARING?,,400,"This state precedes ""hunting shoe"" in the name of the first product introduced by L.L. Bean",Maine,NA
2017-09-29,J,SCIENCE FICTION,,600,"In this William Gibson novel, the title Mona gets involved with a  corporation called Sense/Net",Mona Lisa Overdrive,NA
2017-09-29,J,WORLD LEADERS,,600,"In 2017 Mark Rutte won a third term as this country's PM, defeating a right wing challenge from Geert Wilders",the Netherlands,NA
2017-09-29,J,TRANSPORTATION,,600,"This adjective for less-than-full-size cars later got preceded by ""sub"" and today, sometimes even by ""micro""",compact,http://www.j-archive.com/media/2017-09-29_J_04b.jpg
2017-09-29,J,ROCK & ROLL!,,600,"In 1977 this band topped the charts singing, ""You can check out any time you like, but you can never leave""",The Eagles,NA
2017-09-29,J,"""MENTAL"" ADJECTIVES",,600,"Easily angered, or moody",temperamental,NA
2017-09-29,J,WHERE ARE YOU WEARING?,,600,A wide cuff folded back & fastened with a cuff link,a French cuff,NA
2017-09-29,J,SCIENCE FICTION,,800,"This sci-fi author's story ""We Can Remember It for You Wholesale"" became ""Total Recall"" on the big screen",Philip K. Dick,NA
2017-09-29,J,WORLD LEADERS,,NA,"Also MP for Wentworth, Malcolm Turnbull is PM of this, one of the world's 10 largest countries in area",Australia,NA
2017-09-29,J,TRANSPORTATION,,800,"This numerical NYC avenue's subway line opened in 2017 with stops at East 72nd, 86th & 96th Streets",2nd Avenue,NA
2017-09-29,J,ROCK & ROLL!,,800,"Featured in the movie ""Easy Rider"", this song was Steppenwolf's first Top 40 hit","""Born To Be Wild""",http://www.j-archive.com/media/2017-09-29_J_18.mp3
2017-09-29,J,"""MENTAL"" ADJECTIVES",,800,Added to furnish something missing,supplemental,NA
2017-09-29,J,WHERE ARE YOU WEARING?,,800,This red felt hat is named for a town in Morocco,fez,NA
2017-09-29,J,SCIENCE FICTION,,1000,"She wrote ""The Mists of Avalon"" as well as the ""Darkover"" books about telepathic humans on another planet",Marion Zimmer Bradley,NA
2017-09-29,J,WORLD LEADERS,,1000,His father was purged in the 1960s but he became China's president in 2013,Xi,NA
2017-09-29,J,TRANSPORTATION,,1000,"Jets power propellers in this kind of plane, hence the ""prop"" at the end",a turboprop,http://www.j-archive.com/media/2017-09-29_J_06.jpg
2017-09-29,J,ROCK & ROLL!,,1000,"Few were ""better than"" this man in 2015 when he hit the Top 10 Hot Rock Songs with ""Budapest""",(George) Ezra,NA
2017-09-29,J,"""MENTAL"" ADJECTIVES",,1000,Changing gradually through a series of steps,incremental,NA
2017-09-29,J,WHERE ARE YOU WEARING?,,1000,Dotted patterns are common on the fabric known as this muslin,Swiss muslin,NA
2017-09-29,DJ,AFRICAN-AMERICAN HISTORY,,400,The bus boycott protesting segregation in this Alabama city lasted for more than a year,Montgomery,NA
2017-09-29,DJ,THE RENAISSANCE,,400,"Her father, Rodrigo Borgia, arranged her marriage at age 13 to further his own ambitions",Lucrezia Borgia,NA
2017-09-29,DJ,THAT'S MY JOB!,,400,Mariner (the non-baseball playing variety),a sailor,NA
2017-09-29,NA,NA,NA,NA,NA,NA,NA
2017-09-29,DJ,ASIAN BODIES OF WATER,,400,"According to Hindu myth, this river once flowed in the heavens but was ordered to go down to Earth",the Ganges,NA
2017-09-29,NA,NA,NA,NA,NA,NA,NA
2017-09-29,DJ,AFRICAN-AMERICAN HISTORY,,800,"(Alex presents the clue from the National Museum of African American History and Culture.) The powder horn belonged to one of 10,000 African-Americans who fought at battles like Monmouth in this war; to them, liberty was not just an abstract concept, but something they personally craved and hoped would be granted by the winning side, and in some cases, it was",the American Revolution,http://www.j-archive.com/media/2017-09-29_DJ_17a.jpg
2017-09-29,DJ,THE RENAISSANCE,,NA,After 1516 this royal family had 2 branches: a Spanish line & an Austrian line,the Habsburgs,NA
2017-09-29,DJ,THAT'S MY JOB!,,800,Milliner,a hatmaker,NA
2017-09-29,DJ,NATIONAL SPELLING BEE WINNING WORDS,(Alex: And you have to spell the correct response.),800,In 1948 the winning word was this medical branch that deals with the treatment & prevention of mental illness,P-S-Y-C-H-I-A-T-R-Y,NA
2017-09-29,DJ,ASIAN BODIES OF WATER,,800,Arabs call this river Nahr Al-Urdun; the Hebrew name is Ha-Yarden,the Jordan (River),NA
2017-09-29,DJ,"THE ""KID"" STAYS IN THE PICTURE",,800,"This 1989 title is Rick Moranis' explanation of why his children are 1/4"" tall","Honey, I Shrunk the Kids",NA
2017-09-29,DJ,AFRICAN-AMERICAN HISTORY,,1200,"Abbreviated the CBC, it was formed by 13 African Americans elected to the U.S. House in 1970",the Congressional Black Caucus,NA
2017-09-29,DJ,THE RENAISSANCE,,1200,"In the painting of five Renaissance masters, Uccello is to the left of this artist, whose name rhymes with his",Donatello,http://www.j-archive.com/media/2017-09-29_DJ_03a.jpg
2017-09-29,DJ,THAT'S MY JOB!,,1200,Collier,a coal miner,NA
2017-09-29,DJ,NATIONAL SPELLING BEE WINNING WORDS,(Alex: And you have to spell the correct response.),1200,In 1981 Paige Pipkin buried the competition with this word for an ancient stone coffin,S-A-R-C-O-P-H-A-G-U-S,NA
2017-09-29,DJ,ASIAN BODIES OF WATER,,1200,This Siberian lake contains around 20% of the fresh water on the world's surface,Baikal,NA
2017-09-29,DJ,"THE ""KID"" STAYS IN THE PICTURE",,1200,"2 memorable lines from this 1984 Ralph Macchio movie: ""Sweep the leg"" & ""Get him a body bag!""",The Karate Kid,NA
2017-09-29,DJ,AFRICAN-AMERICAN HISTORY,,1600,This NYC venue where Ella Fitzgerald was discovered opened in 1914 as Hurtig & Seamon's New Burlesque Theater,the Apollo,NA
2017-09-29,DJ,THE RENAISSANCE,,1600,In 1516 this Dutch humanist produced a new Greek edition of the New Testament,Erasmus,NA
2017-09-29,DJ,THAT'S MY JOB!,,1600,Warrener,a rabbit keeper,NA
2017-09-29,DJ,NATIONAL SPELLING BEE WINNING WORDS,(Alex: And you have to spell the correct response.),1600,"No yolk, 1928's winning word was this white part of an egg",A-L-B-U-M-E-N,NA
2017-09-29,DJ,ASIAN BODIES OF WATER,,1600,In 2010 China gained direct access to this sea for the first time in 100 years when it leased a pier in N. Korea's Rajin port,the Sea of Japan,NA
2017-09-29,DJ,"THE ""KID"" STAYS IN THE PICTURE",,1600,"In this 2010 movie whose title is also a song by The Who, Mark Ruffalo learns he's the father of a boy named Laser",The Kids Are All Right,NA
2017-09-29,DJ,AFRICAN-AMERICAN HISTORY,,2000,In 1985 this state elected Lt. Gov. L. Douglas Wilder as its first African-American statewide officeholder,Virginia,NA
2017-09-29,DJ,THE RENAISSANCE,,2000,"The period from 1378 to 1417, when there were 2 & then 3 popes, was known as the ""Great"" this",schism,NA
2017-09-29,DJ,THAT'S MY JOB!,,NA,Flueologist,a chimney sweep,NA
2017-09-29,DJ,NATIONAL SPELLING BEE WINNING WORDS,(Alex: And you have to spell the correct response.),2000,In 1994 it was this 12-letter word meaning before the Biblical flood,A-N-T-E-D-I-L-U-V-I-A-N,NA
2017-09-29,DJ,ASIAN BODIES OF WATER,,2000,"In the southeast corner of Iraq, this main port of the country is on a waterway called the Shatt Al-Arab",Basra,NA
2017-09-29,DJ,"THE ""KID"" STAYS IN THE PICTURE",,2000,Ben Stiller gets married but then meets the girl of his dreams in this 2007 remake,The Heartbreak Kid,NA
2017-09-29,FJ,19th CENTURY PEOPLE,,NA,"On June 28, 1838 an archbishop jammed a ring made for her little finger onto her 4th; she had to soak it in ice water to get it off",Queen Victoria,NA
