date,round,category,comment,value,clue,response,link
2017-10-24,J,ART & MYTHOLOGY,,200,"Commissioned during Louis XIV's reign, the sculpture seen here shows Mercury riding this horse",Pegasus,http://www.j-archive.com/media/2017-10-24_J_01.jpg
2017-10-24,J,FLORIDA CITIES,,200,The code for its airport is JAX,Jacksonville,NA
2017-10-24,J,SULLIVAN AWARD WINNERS,,200,1997: University of Tennessee quarterback,Peyton Manning,NA
2017-10-24,J,HOLD MY BEER,,200,"Boston Lager & a Rebel family of beers are sold by this maker that says it's ""brewing the American dream""",Sam Adams,NA
2017-10-24,J,ROBOTS,,200,"Robotic milkers & strawberry pickers are examples of agbots, short for these",agriculture robots,NA
2017-10-24,J,"""R""2 ""D""2",,200,"Seen here, it needs to do its thing in a timely way, or disaster ensues",a drawbridge,http://www.j-archive.com/media/2017-10-24_J_08.jpg
2017-10-24,J,ART & MYTHOLOGY,,400,"A 16th century painting by Joachim Patinir shows ""Charon Crossing This"" mythical river",Styx,NA
2017-10-24,J,FLORIDA CITIES,,400,"During the Civil War, it was the only Confederate capital east of the Mississippi not captured by Union troops",Tallahassee,NA
2017-10-24,J,SULLIVAN AWARD WINNERS,,400,1965: Princeton basketball player (& future U.S. senator),Bill Bradley,NA
2017-10-24,J,HOLD MY BEER,,400,"A man named Sebastian was actually the 18th c. brewmaster who founded this Belgian ""star"" brand",Stella Artois,NA
2017-10-24,J,ROBOTS,,400,"A 4-legged robot created by Boston Dynamics to deliver packages has been given this name, like Dick & Jane's dog",Spot,NA
2017-10-24,J,"""R""2 ""D""2",,400,"Michelle Obama attended Princeton for this type of education, followed by Harvard Law School",undergraduate,NA
2017-10-24,J,ART & MYTHOLOGY,,600,"On the vase dating from the 5th century B.C., this hero is tied to the mast of his ship to resist the singing of the sirens",Ulysses (or Odysseus),http://www.j-archive.com/media/2017-10-24_J_05a.jpg
2017-10-24,J,FLORIDA CITIES,,600,"A resort-retirement community; its name is from the Spanish for ""mouse's mouth""",Boca Raton,NA
2017-10-24,J,SULLIVAN AWARD WINNERS,,600,"2008:Female gymnast (& future ""Dancing with the Stars"" winner)",Shawn Johnson,NA
2017-10-24,J,HOLD MY BEER,,600,In the 1960s the head of this Dutch co. tried to make its green bottle rectangular so it could be used as building material,Heineken,NA
2017-10-24,J,ROBOTS,,600,"Called Robo-Bees, mini drones sporting sticky horsehair may one day help insects with this vital process",pollination,NA
2017-10-24,J,"""R""2 ""D""2",,600,Term for a registered user of the website that hosts Q&As called AMAs,a Redditor,NA
2017-10-24,J,ART & MYTHOLOGY,,800,"In a painting by Dante Gabriel Rossetti, Persephone holds this fruit that would seal her fate",a pomegranate,NA
2017-10-24,J,FLORIDA CITIES,,800,The Gatornationals is a famous drag racing event in this city,Gainesville,NA
2017-10-24,NA,NA,NA,NA,NA,NA,NA
2017-10-24,J,HOLD MY BEER,,800,Rodney Dangerfield pitched in every way for the Less Filling softball team vs. the Tastes Great one in an ad for this beer,Miller Lite,NA
2017-10-24,J,ROBOTS,,NA,"Used to move equipment & supplies, the 55-foot-long Canadarm2 is a giant robotic arm on this facility",the International Space Station,NA
2017-10-24,J,"""R""2 ""D""2",,800,"Ken Burns' documentary on Prohibition had an episode called ""A Nation of"" these habitual tipplers",drunkards,NA
2017-10-24,J,ART & MYTHOLOGY,,1000,Cheers to you if you know he's the young Roman god depicted in this Caravaggio painting,Bacchus,http://www.j-archive.com/media/2017-10-24_J_07.jpg
2017-10-24,J,FLORIDA CITIES,,1000,This alliterative city in Broward County has been named one of the USA's best cities to live in--the trees in its name help,Pembroke Pines,NA
2017-10-24,NA,NA,NA,NA,NA,NA,NA
2017-10-24,J,HOLD MY BEER,,1000,"Constellation Brands distributes Modelo, Pacifico y this beer that comes in ""Extra"" & ""Light""",Corona,NA
2017-10-24,J,ROBOTS,,1000,Robots don't need goggles to do this job of fusing metal to metal with an electrical charge sparking across a gap,arc welding,http://www.j-archive.com/media/2017-10-24_J_24.mp4
2017-10-24,J,"""R""2 ""D""2",,1000,"In Native American lore, this winged creature is capable of producing severe weather",the thunderbird,NA
2017-10-24,DJ,ORGANIZATIONS,,400,"Founded in London in 1961, it works to free political prisoners & protect human rights",Amnesty International,NA
2017-10-24,DJ,COME SAIL AWAY,,400,"He sailed from China around 1292, arriving back home in Venice in 1295 at about age 41",Marco Polo,NA
2017-10-24,DJ,PROFESSORS,,400,"Before becoming a Massachusetts senator, she was the Leo Gottlieb Professor of Law at Harvard",Elizabeth Warren,NA
2017-10-24,DJ,HIT TV THEME SONGS,,400,"The Rembrandts sang ""I'll Be There For You"", the theme song of this show",Friends,NA
2017-10-24,DJ,THE PLAY'S THE THING,,400,In 2012 people paid attention to Philip Seymour Hoffman as Willy Loman in this Broadway play,Death of a Salesman,NA
2017-10-24,DJ,"IN OTHER WORDS, DEAD",,400,"Uh oh! You ""bought"" this tract of land, silo & all",the farm,NA
2017-10-24,DJ,ORGANIZATIONS,,800,Recent requests granted to sick kids by this org. include sending a teen on a safari & giving a pug puppy to a little girl,Make-A-Wish,NA
2017-10-24,DJ,COME SAIL AWAY,,800,"(Sarah of the Clue Crew shows a map on the monitor.) To show how ancient America's people could colonize Polynesia, in 1947 Thor Heyerdahl sailed 4300 miles in 101 days, on this raft, named for an Incan god",Kon-Tiki,http://www.j-archive.com/media/2017-10-24_DJ_27a.jpg
2017-10-24,DJ,PROFESSORS,,800,This Oxford professor is remembered for fiction writing more than for his expertise in Old and Middle English,J.R.R. Tolkien,http://www.j-archive.com/media/2017-10-24_DJ_17.jpg
2017-10-24,DJ,HIT TV THEME SONGS,,800,Surf band The Ventures had a '60s hit with this show's theme; their re-recording for the reboot got rejected,Hawaii Five-0,NA
2017-10-24,DJ,THE PLAY'S THE THING,,800,"Yalta know this man wrote ""The Cherry Orchard"" during his Yalta period",Chekhov,NA
2017-10-24,DJ,"IN OTHER WORDS, DEAD",,800,"When you're ""in"" them, you're wealthy; cash them in, you're not healthy",chips,NA
2017-10-24,DJ,ORGANIZATIONS,,NA,In 2011 & 2012 it was named the sixth-largest homebuilder in the United States,Habitat for Humanity,NA
2017-10-24,DJ,COME SAIL AWAY,,1200,In 1595 Sir Walter Raleigh sailed up this river in what's now Venezuela in search of a city of gold,the Orinoco,NA
2017-10-24,DJ,PROFESSORS,,1200,"Moderating a 2017 discussion with Charles Murray at this Vt. college, Prof. Allison Stanger ended up concussed",Middlebury,NA
2017-10-24,DJ,HIT TV THEME SONGS,,1200,"John Sebastian had a No. 1 hit with ""Welcome Back"", the theme to ""Welcome Back,"" him",Kotter,NA
2017-10-24,DJ,THE PLAY'S THE THING,,1200,"A familiar TV & movie face, in 2003 she made her Broadway debut as Big Mama in ""Cat on a Hot Tin Roof""",Margo Martindale,http://www.j-archive.com/media/2017-10-24_DJ_11.jpg
2017-10-24,DJ,"IN OTHER WORDS, DEAD",,1200,"""Traded to"" these, Mike Trout's baseball team",Angels,NA
2017-10-24,DJ,ORGANIZATIONS,,1600,A staff with a snake coiled around it appears on the emblem of this U.N. agency that's HQ'd in Geneva,the World Health Organization,NA
2017-10-24,DJ,COME SAIL AWAY,,1600,"Here's Henry Hudson and a full depiction of this ship of his, sailing on the Hudson river",the Half Moon,http://www.j-archive.com/media/2017-10-24_DJ_29a.jpg
2017-10-24,DJ,PROFESSORS,,NA,"A practicing physician, he became professor of botany as well as medicine at the University of Uppsala in 1741",Linnaeus,NA
2017-10-24,DJ,HIT TV THEME SONGS,,1600,"This '90s drama about a quintet of orphans helped boost ""Closer To Free"" on the charts",Party of Five,NA
2017-10-24,DJ,THE PLAY'S THE THING,,1600,"Look! Up in the sky! It's not a bird or a plane, but it is this 1905 George Bernard Shaw play about humanity & God!",Man and Superman,NA
2017-10-24,DJ,"IN OTHER WORDS, DEAD",,1600,"The ""to be or not to be"" speech includes ""shuffled off"" this phrase",this mortal coil,NA
2017-10-24,DJ,ORGANIZATIONS,,2000,The largest U.S. organization advocating for people's rights at the end of life is called Compassion & these,choices,NA
2017-10-24,DJ,COME SAIL AWAY,,2000,He led the 1608 expedition that sailed from France & founded Quebec,Samuel de Champlain,NA
2017-10-24,DJ,PROFESSORS,,2000,"He came out of UC Riverside (not Narnia) to publish ""Zealot"", a 2013 biography of Jesus",(Reza) Aslan,NA
2017-10-24,DJ,HIT TV THEME SONGS,,2000,"Just some ""Good Ol' Boys"" by this country music star was all ""The Dukes of Hazzard"" needed",Waylon Jennings,NA
2017-10-24,DJ,THE PLAY'S THE THING,,2000,"We would attend this playwright's ""Seven Guitars"", about a 1940s blues musician, any month of the year",August Wilson,NA
2017-10-24,DJ,"IN OTHER WORDS, DEAD",,2000,"The Monty Python shop customer says, ""This is a late parrot... it's rung down the curtain & joined"" this singing group",joined the choir invisible,NA
2017-10-24,FJ,ETYMOLOGY,,NA,"This 8-letter word meaning ""cultured"" or ""intellectual"" originated with a phrenology concept",highbrow,NA
