date,round,category,comment,value,clue,response,link
2018-02-28,J,SOME SERIOUS FOREIGN COIN,,200,This ferritic stainless steel coin seen here is a 5 & worth about 8 cents in the U.S.A.,a rupee,http://www.j-archive.com/media/2018-02-28_J_23.jpg
2018-02-28,J,"4 OF THE SAME VOWEL, ONE WORD",,200,A zebra on the gridiron,a referee,NA
2018-02-28,J,FALSE OR MISLEADING,,200,"This '90s sitcom character said, ""Jerry, just remember. It's not a lie... if you believe it""",George (Costanza),NA
2018-02-28,J,MARCH MADNESS CHAMPS,,200,The last team to go undefeated in the regular season & win it all was this Bloomington bunch in 1976,the (Indiana) Hoosiers,NA
2018-02-28,J,TOP SEEDS,,200,"As the picture proves, you don't need the luck of the Irish for this plant; just scatter the seed about",clover,http://www.j-archive.com/media/2018-02-28_J_16.jpg
2018-02-28,NA,NA,NA,NA,NA,NA,NA
2018-02-28,NA,NA,NA,NA,NA,NA,NA
2018-02-28,J,"4 OF THE SAME VOWEL, ONE WORD",,400,"Cajun rice dish with shrimp, chicken & veggies",jambalaya,NA
2018-02-28,J,FALSE OR MISLEADING,,400,"In 2001 this Houston company admitted its ""profitable"" previous 5 years actually brought a $586 million loss",Enron,NA
2018-02-28,J,MARCH MADNESS CHAMPS,,400,It's likely no team will break the record of 7 titles in a row won by this West Coast squad from 1967 to 1973,UCLA,NA
2018-02-28,J,TOP SEEDS,,400,This plant of genus Nicotiana has tiny seeds that use light to germinate so they can grow after top seeding,tobacco,NA
2018-02-28,NA,NA,NA,NA,NA,NA,NA
2018-02-28,J,SOME SERIOUS FOREIGN COIN,,600,"The one is seen here, but the new Israeli  this can also be found in half, 5 & 10 coins",a shekel,http://www.j-archive.com/media/2018-02-28_J_12.jpg
2018-02-28,J,"4 OF THE SAME VOWEL, ONE WORD",,600,A boat with twin hulls in parallel,a catamaran,NA
2018-02-28,J,FALSE OR MISLEADING,,600,"False labor, or these 2-name contractions, may stop when you change position or rest",Braxton Hicks contractions,NA
2018-02-28,J,MARCH MADNESS CHAMPS,,600,"Son of tennis star Yannick & a Miss Sweden, he was the most outstanding player in 2006 as Florida took the title",Joakim Noah,NA
2018-02-28,J,TOP SEEDS,,600,"As Porky Pig's gal knows, seeds of these flowers should stay on top of the soil as they need light to germinate",petunia,http://www.j-archive.com/media/2018-02-28_J_18.jpg
2018-02-28,J,RACKET BUSTERS,,NA,"As a U.S. attorney in this state, Patrick Fitzgerald helped convict ex-governor George Ryan of racketeering",Illinois,NA
2018-02-28,J,SOME SERIOUS FOREIGN COIN,,800,"Redesigned in 1955, this coin was 100% aluminum",a yen,http://www.j-archive.com/media/2018-02-28_J_14.jpg
2018-02-28,J,"4 OF THE SAME VOWEL, ONE WORD",,800,"""The Silver Palate"" one, first published in 1982, is still influential today",a cookbook,NA
2018-02-28,J,FALSE OR MISLEADING,,800,"Matthew 7:15 warns of ""false"" these that ""come to you in sheep's clothing, but inwardly...are ravening wolves""",false prophets,NA
2018-02-28,J,MARCH MADNESS CHAMPS,,800,In the 2012 final Anthony Davis & this team went wild on defense with a record 11 blocks,the Kentucky Wildcats,NA
2018-02-28,J,TOP SEEDS,,800,"The seeds of this edible plant, whether Butterhead or Burgundy Boston, are planted on top",lettuce,NA
2018-02-28,J,RACKET BUSTERS,,800,"Before he ran for president, this man worked to curb organized crime & prosecuted several powerful mobsters",Thomas Dewey,http://www.j-archive.com/media/2018-02-28_J_25.jpg
2018-02-28,J,SOME SERIOUS FOREIGN COIN,,1000,This one-ounce gold coin of South Africa was introduced in 1967,the krugerrand,http://www.j-archive.com/media/2018-02-28_J_24.jpg
2018-02-28,J,"4 OF THE SAME VOWEL, ONE WORD",,1000,"Seen here, the lemur calls this large island home",Madagascar,http://www.j-archive.com/media/2018-02-28_J_22.jpg
2018-02-28,J,FALSE OR MISLEADING,,1000,"In ancient Egypt, one sign of royalty was a postiche, a metal false one of these",a beard,NA
2018-02-28,J,MARCH MADNESS CHAMPS,,1000,Rollie Massimino coached this Philly-area school to a title in 1985 & Jay Wright got them another one in 2016,Villanova,NA
2018-02-28,J,TOP SEEDS,,1000,Just place the seeds of this flower on top of your soil & they'll be sprouting in no time,snapdragons,http://www.j-archive.com/media/2018-02-28_J_20.jpg
2018-02-28,J,RACKET BUSTERS,,1000,Nelson Stamler fought this vice in N.J. in the '50s & would have been dismayed when the state legalized it in the '70s,gambling,NA
2018-02-28,DJ,THE WORLD ALMANAC 2018,,400,"2018's is the 150th anniversary edition; in 1868 the book was named after The World, one of these",a newspaper,NA
2018-02-28,NA,NA,NA,NA,NA,NA,NA
2018-02-28,DJ,THE BRIT'S NO. 1 HIT,,400,"In the '80s: ""Faith"" & ""Father Figure""",George Michael,NA
2018-02-28,DJ,ODD-NUMBERED PHRASES,,400,This timely phrase for stubble on a man's face comes from a 1930s ad campaign,a five o\'clock shadow,NA
2018-02-28,DJ,BOOKS TO BROADWAY,,400,"""Natasha, Pierre & the Great Comet of 1812"" is based on 70 pages of this 1,400-plus page Tolstoy epic",War and Peace,http://www.j-archive.com/media/2018-02-28_DJ_02.mp4
2018-02-28,DJ,"WHERE ""RU""?",,400,Somewhere in the 6.6 million square miles of this country,Russia,NA
2018-02-28,DJ,THE WORLD ALMANAC 2018,,800,"A list of Dow Jones Industrial Average milestones includes first close over this big number, Jan. 25, 2017","20,000",NA
2018-02-28,NA,NA,NA,NA,NA,NA,NA
2018-02-28,DJ,THE BRIT'S NO. 1 HIT,,800,"2012: ""Set Fire To The Rain""",Adele,NA
2018-02-28,DJ,ODD-NUMBERED PHRASES,,800,An orange tabby named Morris the Cat is in commercials for this cat food brand,9Lives,NA
2018-02-28,DJ,BOOKS TO BROADWAY,,800,"The N.Y. Times review of the play of this man's ""1984"" included a trigger warning for the intense torture scenes",(George) Orwell,NA
2018-02-28,DJ,"WHERE ""RU""?",,800,Crossing this river that formed the boundary between Italy & Cisalpine Gaul,the Rubicon,NA
2018-02-28,DJ,THE WORLD ALMANAC 2018,,1200,"""Milestone Birthdays, 2018"" include this ""Sixteen Candles"" actress' 50 candles on February 18",Molly Ringwald,NA
2018-02-28,DJ,NATIVE AMERICAN HISTORY,,1200,The 1851 treaty of this Wyoming fort was an early attempt to resolve conflicts between Native Americans & settlers,Fort Laramie,NA
2018-02-28,DJ,THE BRIT'S NO. 1 HIT,,1200,"1987: ""Mony Mony""",Billy Idol,NA
2018-02-28,DJ,ODD-NUMBERED PHRASES,,1200,It's the numerical name for the star cluster seen here,the Seven Sisters,http://www.j-archive.com/media/2018-02-28_DJ_22.jpg
2018-02-28,DJ,BOOKS TO BROADWAY,,1200,"T.S. Eliot poems that were adapted into this hit show include ""Old Deuteronomy"" & ""Mr. Mistoffelees""",Cats,NA
2018-02-28,DJ,"WHERE ""RU""?",,1200,Atop this monumental memorial known to Native Americans as the Six Grandfathers,Mount Rushmore,NA
2018-02-28,DJ,THE WORLD ALMANAC 2018,,1600,"Named for a Gorgon-killer, in August the brightest meteor showers of the year will be these",the Perseids,NA
2018-02-28,DJ,NATIVE AMERICAN HISTORY,,1600,"On a December day in 1890, about 200 Native Americans were slain by U.S. Army troops at this South Dakota location",Wounded Knee,NA
2018-02-28,DJ,THE BRIT'S NO. 1 HIT,,1600,"A winner of Britain's ""The X Factor"":""Bleeding Love""",Leona Lewis,NA
2018-02-28,DJ,ODD-NUMBERED PHRASES,,1600,"This Christmas carol says, ""O star of wonder, star of night... guide us to thy perfect light""","""We Three Kings""",NA
2018-02-28,DJ,BOOKS TO BROADWAY,,1600,"""Runyonland"" is the opening number to this show based on the stories of Damon Runyon",Guys and Dolls,NA
2018-02-28,DJ,"WHERE ""RU""?",,1600,In this industrial German valley fought over in 2 world wars,the Ruhr Valley,NA
2018-02-28,DJ,THE WORLD ALMANAC 2018,,2000,Senators who need to face the voters in 2018 to keep their jobs include Amy Kobluchar of this state,Minnesota,NA
2018-02-28,DJ,NATIVE AMERICAN HISTORY,,2000,"Brother to ""The Prophet"", this Shawnee leader organized 18th c. Native American resistance in Ohio & Indiana",Tecumseh,NA
2018-02-28,DJ,THE BRIT'S NO. 1 HIT,,2000,"""Caribbean Queen""",Billy Ocean,NA
2018-02-28,DJ,ODD-NUMBERED PHRASES,,NA,"A line from this kids' book: ""Horrid little beasts... I shall like you so much better when you're skins instead of pups""",101 Dalmatians,NA
2018-02-28,DJ,BOOKS TO BROADWAY,,2000,"Turning this man's ""Ragtime"" into a musical won Terrence McNally the Tony for Best Book",(E.L.) Doctorow,NA
2018-02-28,DJ,"WHERE ""RU""?",,NA,Getting a signature in this meadow on the banks of the Thames,Runnymede,NA
2018-02-28,FJ,WOMEN IN MYTHOLOGY,,NA,"Poet & translator Anne Carson addresses her: ""Your name in Greek means something like 'against birth'""",Antigone,NA
