date,round,category,comment,value,clue,response,link
2018-10-15,J,ROOST-ERS,,200,This bird found a roosting spot that fits the bill it's famous for,a pelican,http://www.j-archive.com/media/2018-10-15_J_06.jpg
2018-10-15,J,SOCIAL MEDIA ABBREV.,,200,"On Twitter ""RT"" is short for this, which helps you not get accused of plagiarism",retweet,NA
2018-10-15,J,WHICH STAR WARS?,,200,Obi-Wan sacrifices himself in a duel,A New Hope,NA
2018-10-15,J,I'M GONNA PRAY ON THIS,,200,"If you're alone for minchah, the Jewish afternoon prayer, make sure you're facing this city as you confer with the Almighty",Jerusalem,NA
2018-10-15,J,WHAT HAD HAPPENED WAS,,200,"In 2000 this man won the popular vote for U.S. president by 500,000 but did not get the job",Al Gore,NA
2018-10-15,J,"""BLACK"" JEOPARDY",,200,Extortion,blackmail,NA
2018-10-15,J,ROOST-ERS,,400,"Africa's quelea, whose swarms break branches roosting, is AKA this ""bird"", after a pestilential grasshopper",locust,NA
2018-10-15,J,SOCIAL MEDIA ABBREV.,,400,"The one who started it all, the ""OP"" in a Facebook thread is short for this",the original poster,NA
2018-10-15,J,WHICH STAR WARS?,,400,Kylo Ren commits patricide,The Force Awakens,NA
2018-10-15,J,I'M GONNA PRAY ON THIS,,400,The Church of England's state prayer for the royal family mentions Philip & this man by name,(Prince) Charles,NA
2018-10-15,J,WHAT HAD HAPPENED WAS,,400,"""Guests"" of this fortress who checked out the hard way included Sir Thomas More, Edmund Dudley & Anne Boleyn",the Tower of London,NA
2018-10-15,J,"""BLACK"" JEOPARDY",,400,You'd think they'd make the entire plane out of the material used in a nigh-indestructible flight recorder AKA this,the black box,NA
2018-10-15,J,ROOST-ERS,,600,Abandoned mines provide favorite roosts for about half the USA's 45 species of these non-birds,bats,NA
2018-10-15,J,SOCIAL MEDIA ABBREV.,,600,"Tedious things warrant ""MEGO"", meaning ""my eyes"" do this action",my eyes glaze over,NA
2018-10-15,J,WHICH STAR WARS?,,600,Chewie roasts some porg,The Last Jedi,NA
2018-10-15,J,I'M GONNA PRAY ON THIS,,600,"Fasting, prayer & faithful intention play crucial roles in this month, the 9th on the Muslim calendar",Ramadan,NA
2018-10-15,J,WHAT HAD HAPPENED WAS,,NA,"On this mission Pete Conrad said, ""Whoopee! Man, that may have been a small one for Neil, but that's a long one for me""",Apollo 12,NA
2018-10-15,J,"""BLACK"" JEOPARDY",,600,"A fruit, or a phone",a blackberry,NA
2018-10-15,J,ROOST-ERS,,800,"Seen here, roosting in silhouette, are these birds that share a name with a chess piece",rooks,http://www.j-archive.com/media/2018-10-15_J_09.jpg
2018-10-15,J,SOCIAL MEDIA ABBREV.,,800,"When you want to bump a post up from obscurity, use ""TTT"" for this directional phrase",to the top,NA
2018-10-15,J,WHICH STAR WARS?,,800,Qui-Gon makes the mistake of saving Jar Jar,The Phantom Menace,NA
2018-10-15,J,I'M GONNA PRAY ON THIS,,800,"A popular 20th century prayer begins, ""God grant me"" this calm word ""to accept the things I cannot change""",serenity,NA
2018-10-15,J,WHAT HAD HAPPENED WAS,,800,In 1687 the Ottomans found that storing gunpowder at this Acropolis building was a ridiculously terrible idea,the Parthenon,NA
2018-10-15,J,"""BLACK"" JEOPARDY",,800,"With a vertical drop of 500 feet, the Heathen is a tough ski run with a double this rating",a black diamond,NA
2018-10-15,J,ROOST-ERS,,1000,The chimney type of this swallow-like bird both nests & roosts in chimneys,a swift,NA
2018-10-15,J,SOCIAL MEDIA ABBREV.,,1000,"""WCW"" is short for this, the weekday some groups post images of their favorite actresses",Woman Crush Wednesday,NA
2018-10-15,J,WHICH STAR WARS?,,1000,Young Anakin is assigned to protect Padme,Attack of the Clones,NA
2018-10-15,J,I'M GONNA PRAY ON THIS,,1000,"In the Catholic prayer for the dead, God's ""providence guides our lives, & by your command we return to"" this",dust,NA
2018-10-15,J,WHAT HAD HAPPENED WAS,,1000,In 1989 he succeeded his late father as emperor of Japan,Akihito,NA
2018-10-15,J,"""BLACK"" JEOPARDY",,1000,"A drink, or one of 7,000 British soldiers sent to Ireland in the early 1920s",Black and Tan,NA
2018-10-15,DJ,THE 5 Ws IN THE BOOKSTORE,,400,We expect you might know this Heidi Murkoff & Sharon Mazel pregnancy guide is a perennial seller,What to Expect When You\'re Expecting,NA
2018-10-15,DJ,ISLANDS,,400,"You can't get much more north than tiny Kaffeklubben Island, 20 miles off Cape Morris Jesup on this world's largest island",Greenland,NA
2018-10-15,DJ,10-LETTER WORDS,,400,An annual celebration when graduates return to an old school for parties & football,homecoming,NA
2018-10-15,DJ,OPERA,,400,"Verdi's ""Falstaff"" takes place in this town, where the title character has his eye on some merry wives",Windsor,NA
2018-10-15,DJ,DRIVING,,400,"Cruising around Phoenix--that driver must be awfully short--oh, it's Waymo, Google's version of these",self-driving cars,NA
2018-10-15,DJ,A JOB IN TELEVISION,,400,"Sam Malone on ""Cheers"" & Luke Cage on ""Jessica Jones""",a bartender,NA
2018-10-15,DJ,THE 5 Ws IN THE BOOKSTORE,,800,Maya Angelou's 1969 autobiographical work,I Know Why the Caged Bird Sings,NA
2018-10-15,DJ,ISLANDS,,NA,Income tax evader Al Capone spent a lot of time on this island from 1934 to 1939,Alcatraz,NA
2018-10-15,DJ,10-LETTER WORDS,,800,"A type of ice cream, or a native of a southern Italian city",Neapolitan,NA
2018-10-15,DJ,OPERA,,800,"This composer said everyone called his work tedious & obscure but he loaded up ""Carmen"" with liveliness & melody",(Georges) Bizet,NA
2018-10-15,DJ,DRIVING,,800,"To make driving safer, all new cars sold in the U.S. since 1998 require driver & front passenger ones",air bags,NA
2018-10-15,DJ,A JOB IN TELEVISION,,800,"Tom Kirkman, after he's the ""Designated Survivor""",president,NA
2018-10-15,DJ,THE 5 Ws IN THE BOOKSTORE,,1200,"""When the Game was Ours"" is a co-memoir of pro basketball by this Laker & this Celtic who battled in the 1980s",Larry Bird and Magic Johnson,NA
2018-10-15,DJ,ISLANDS,,1200,"The 4 main regions of Oceania are Australasia, Polynesia, Melanesia & these ""small islands""",Micronesia,NA
2018-10-15,DJ,10-LETTER WORDS,,1200,A tightly encircling bandage used to stop arterial flow,a tourniquet,NA
2018-10-15,DJ,OPERA,,NA,"In 1908 as he sang Canio at the Met in ""Pagliacci"", he wept real tears thinking of how his lover ran off with his chauffeur",Caruso,NA
2018-10-15,DJ,DRIVING,,1200,"To save wear & tear on my car's gearbox, lately I've been using the ""double clutch"" technique to do this",shift gears,NA
2018-10-15,DJ,A JOB IN TELEVISION,,1200,"Mike Brady on ""The Brady Bunch""",an architect,NA
2018-10-15,DJ,THE 5 Ws IN THE BOOKSTORE,,1600,J.K. Rowling kept the magic alive with this book written under the name Newt Scamander,Fantastic Beasts and Where to Find Them,NA
2018-10-15,DJ,ISLANDS,,1600,"Stewart Island, this country's third largest, is also called Rakiura, ""The Land of Glowing Skies""",New Zealand,NA
2018-10-15,DJ,10-LETTER WORDS,,1600,"Christmas may be over, but this plant is still in bloom",poinsettia,http://www.j-archive.com/media/2018-10-15_DJ_04.jpg
2018-10-15,DJ,OPERA,,1600,"The score of this ""Ring"" opera with a ""precious"" title is so elaborate that it took Wagner from Feb. to Sept. 1854 to copy it out",Rheingold,NA
2018-10-15,DJ,DRIVING,,1600,You're in charge of the road maps; we're using ones from this 2-name company that made its first ones in 1904,Rand-McNally,NA
2018-10-15,DJ,A JOB IN TELEVISION,,1600,"Bobby Axelrod on ""Billions"", running this type of financial enterprise",a hedge fund,NA
2018-10-15,DJ,THE 5 Ws IN THE BOOKSTORE,,2000,"John le Carre's operative Alec Leamas goes on one last mission in this ""chilly"" thriller",The Spy Who Came in from the Cold,NA
2018-10-15,DJ,ISLANDS,,2000,"The island of Cyprus has been ruled by Greeks, Romans, Crusaders & Venetians & in 1974 was invaded by this country",Turkey,NA
2018-10-15,DJ,10-LETTER WORDS,,2000,"This chemical element, symbol Mo, is used to harden steel",molybdenum,NA
2018-10-15,DJ,OPERA,,2000,"Amahl plays the same tune on his pipe at the beginning & end, before & after he meets this title group",the night visitors,NA
2018-10-15,DJ,DRIVING,,2000,"For long trips, I'm glad our car has OBD, on-board these to let us know when something goes wrong",on-board diagnostics,NA
2018-10-15,DJ,A JOB IN TELEVISION,,2000,"Barry Berkman on ""Barry""--both his big-money gig & the job he's pursing in class",hit man and actor,NA
2018-10-15,FJ,AMERICA IN THE 1930s,,NA,"In March 1933 CBS Radio's Robert Trout said, ""The president wants to come into your home... for a little"" this",a fireside chat,NA
