date,round,category,comment,value,clue,response,link
2019-03-01,J,NAME THAT TUNA,,200,This tuna character first appeared in a Starkist commercial in 1961,Charlie,NA
2019-03-01,J,20th CENTURY BESTSELLERS,,200,"The concept of a ""whisperer"" who calms animals was popularized by this Nicholas Evans novel",The Horse Whisperer,NA
2019-03-01,J,THEIR IVY LEAGUE ALMA MATER,,200,Teddy Roosevelt & John F. Kennedy,Harvard,NA
2019-03-01,J,TV,,200,"In 1959 there were more than 25 shows in this genre on TV, including ""Rawhide""",a western,NA
2019-03-01,J,VOWEL-POURRI,,200,"Beginning with 4 vowels, Ueueteotl is one spelling for the fire god of these people",the Aztecs,NA
2019-03-01,J,INVENTORS,,200,Nicolas-Jacque Conté mixed graphite & clay to make this writing tool easily produceable for the masses,a pencil (or a crayon),NA
2019-03-01,J,NAME THAT TUNA,,400,It's bigger than the yellowfin & in 2013 a 490-pound one of these colorful tuna sold at auction in Tokyo for $1.8 million,bluefin,NA
2019-03-01,J,20th CENTURY BESTSELLERS,,400,"1916's ""Mr. Britling Sees It Through"" by this author tried to make sense of the madness of WWI; no time travel involved",H.G. Wells,NA
2019-03-01,J,THEIR IVY LEAGUE ALMA MATER,,400,"Emma Watson & John F. Kennedy Jr.--this ""colorful"" school",Brown University,NA
2019-03-01,J,TV,,400,"Currently on TBS, he's been on late night TV since 1993, hosting 3 different shows",Conan O\'Brien,NA
2019-03-01,J,VOWEL-POURRI,,400,"Long words using only the same vowel include numbskull, paragraph & this job of keeping things pretty at Pebble Beach",greenskeeper,NA
2019-03-01,J,INVENTORS,,400,"This German was working in Manchester, England when he made a device to count alpha particles",(Hans) Geiger,NA
2019-03-01,J,NAME THAT TUNA,,600,"""Join the Crew"" & ""Fishin' Friction"" are episode titles of this TV show on the National Geographic Channel",Wicked Tuna,NA
2019-03-01,J,20th CENTURY BESTSELLERS,,600,The disaster movie genre really took off when this 1968 novel about Trans America flight No. 2 out of Chicago came to the screen,Airport,NA
2019-03-01,J,THEIR IVY LEAGUE ALMA MATER,,NA,Brooke Shields (class of '87 with honors) & F. Scott Fitzgerald,Princeton,NA
2019-03-01,J,TV,,600,"This creator of ""Mad Men"" brought us 2018's ""The Romanoffs""",Matthew Weiner,NA
2019-03-01,J,VOWEL-POURRI,,600,"There are 4 consonants in a row in this word for combining 2 vowels in the same syllable, as in ""coin"" or ""loud""",diphthong,NA
2019-03-01,J,INVENTORS,,600,British sea captain John Ward made one of these in the 1850s by combining blocks of cork on a vest,a life jacket,NA
2019-03-01,J,NAME THAT TUNA,,800,"AKA the aku, it's named fro the way it launches itself out of the water",a skipjack,NA
2019-03-01,J,20th CENTURY BESTSELLERS,,800,This Edith Hull bestseller about forbidden love in the desert became a 1921 film starring Rudolph Valentino,The Sheik,NA
2019-03-01,J,THEIR IVY LEAGUE ALMA MATER,,800,"Bill & Hillary Clinton for law school, where they first met",Yale,NA
2019-03-01,J,TV,,800,"On ""Newhart"" Larry was a rural fellow who had 2 brothers, both named this",Darryl,NA
2019-03-01,J,VOWEL-POURRI,,800,"In ""yes"", Y is a consonant, in this 5-letter word for a final resting place, it's a vowel",a crypt,NA
2019-03-01,J,INVENTORS,,800,In 1907 James Spangler invented a portable vacuum cleaner--then sold the rights to this man,(William) Hoover,NA
2019-03-01,J,NAME THAT TUNA,,1000,"The FDA's not involved in rating, so tuna rated sushi grade or this raw fish grade is just what the seller thinks is good",sashimi,NA
2019-03-01,J,20th CENTURY BESTSELLERS,,1000,"In a 1952 book a craftsman fashions ""The Silver"" this title drinking vessel to house the Holy Grail",chalice,NA
2019-03-01,J,THEIR IVY LEAGUE ALMA MATER,,1000,"Dr. Seuss,Shonda Rhimes &Mindy Kaling",Dartmouth,NA
2019-03-01,J,TV,,1000,"A game pie & charlotte russe were featured in a season 3 episode of this ""Great"" show from across the pond",The Great British Bake Off,NA
2019-03-01,J,VOWEL-POURRI,,1000,This adjective meaning inappropriately humorous uses all 5 vowels in alphabetical order,facetious,NA
2019-03-01,J,INVENTORS,,1000,"Alois Senefelder used grease to draw an image onto limestone, inventing this printing technique in the 1790s",lithography,NA
2019-03-01,DJ,HISTORY WITH LESSER-KNOWN PAINTERS,,400,"Jean-Jacques Scherrer painted a 1429 event, ""The Entrance of"" this Frenchwoman ""into Orleans""",Joan of Arc,NA
2019-03-01,DJ,ON THE SOUNDTRACK,,400,"1977: ""Stayin' Alive"", ""More Than a Woman""",Saturday Night Fever,NA
2019-03-01,DJ,REFERENCE WORKS,,400,"Collectors of these can learn their values from the Scott number, listed in an annual catalog",stamps,NA
2019-03-01,DJ,WHAT DO YOU STAND FOR?,,400,"As a grad student, Gordon Gould coined ""laser"", which stands for light amplification by stimulated emission of this",radiation,NA
2019-03-01,DJ,TRAVEL,,400,"A trip to this capital might include a visit to the ABBA Museum & to Skattkammaren, the royal treasury",Stockholm,NA
2019-03-01,DJ,"""E""PONYMOUS",,400,Menlo Park is in this township in New Jersey,Edison,NA
2019-03-01,DJ,HISTORY WITH LESSER-KNOWN PAINTERS,,800,"Robert Colescott expanded African Americans' role in history with works like this peanut scientist ""Crossing the Delaware""",George Washington Carver,NA
2019-03-01,DJ,ON THE SOUNDTRACK,,800,"A 2005 adaptation: ""Along Came Bialy"",""Heil Myself""",The Producers,NA
2019-03-01,DJ,REFERENCE WORKS,,800,"The deities in Facts on File's ""Encyclopedia of Gods"" include Nyakaya, a goddess in the form of this Nile beast",crocodile,NA
2019-03-01,DJ,WHAT DO YOU STAND FOR?,,800,"Per the USPS, ZIP (as in ZIP code) stands for this ""improvement plan""",zone,NA
2019-03-01,DJ,TRAVEL,,800,"Check out one of the last great 19th century hotels, the colonial-style Raffles Hotel in this Asian island country",Singapore,NA
2019-03-01,DJ,"""E""PONYMOUS",,800,A British monarch is the source of this adjective for the first decade of the 20th century,Edwardian,NA
2019-03-01,DJ,HISTORY WITH LESSER-KNOWN PAINTERS,,1200,"When Charles Schreyvogel won fame for a painting of this doomed lt. col., Frederic Remington said he got the horse wrong",Custer,NA
2019-03-01,DJ,ON THE SOUNDTRACK,,1200,"A 1967 film: ""Scarborough Fair"", ""April Come She Will""",The Graduate,NA
2019-03-01,DJ,REFERENCE WORKS,,1200,"Library Journal's best reference books of 2017 include these sites: ""Walking the Trails of History"", like at Chickamauga",Civil War Battlefields,NA
2019-03-01,DJ,WHAT DO YOU STAND FOR?,,1200,"You lie supine for this weightlifting exercise, BP",bench press,NA
2019-03-01,DJ,TRAVEL,,1200,Seen here is an interior view of the main dome of this colorful Istanbul landmark,the Blue Mosque,http://www.j-archive.com/media/2019-03-01_DJ_13a.jpg
2019-03-01,DJ,"""E""PONYMOUS",,1200,This eponymic line of cars debuted in 1957 & departed with its 1960 model,the Edsel,http://www.j-archive.com/media/2019-03-01_DJ_20.jpg
2019-03-01,DJ,HISTORY WITH LESSER-KNOWN PAINTERS,,1600,(Jimmy of the Clue Crew shows a painting on the monitor.) The scepter has symbolically fallen from King Robert's hand in a 19th-century painting by Jean-Paul Laurens titled after this action taken against the king by the pope,excommunication,http://www.j-archive.com/media/2019-03-01_DJ_01a.jpg
2019-03-01,DJ,ON THE SOUNDTRACK,,NA,"1994: ""Son of a Preacher Man"", ""Girl, You'll Be a Woman Soon""",Pulp Fiction,NA
2019-03-01,DJ,REFERENCE WORKS,,1600,The first encyclopedia used by future Wikipedia founder Jimmy Wales was this one aimed at 9- to 18-year-olds,World Book,NA
2019-03-01,DJ,WHAT DO YOU STAND FOR?,,1600,"A way of accounting for inventory, LIFO stands for this","last in, first out",NA
2019-03-01,DJ,TRAVEL,,1600,"Named for a statesman, this largest national park in South Africa offers the chance to see amazing wildlife up close",Kruger,NA
2019-03-01,DJ,"""E""PONYMOUS",,NA,The plane truth is that this 2-word branch of math is named for a Greek who lived around 300 B.C.,Euclidean geometry,NA
2019-03-01,DJ,HISTORY WITH LESSER-KNOWN PAINTERS,,2000,Adolph Menzel painted a concert with this great Prussian king on Flute & C.P.E. Bach at the keyboard,Frederick the Great,NA
2019-03-01,DJ,ON THE SOUNDTRACK,,2000,"A 2018 sequel: ""If I Could Turn Back Time"", ""Mutant Convoy""",Deadpool 2,NA
2019-03-01,DJ,REFERENCE WORKS,,2000,This French Enlightenment man was the mind behind the Encyclopedie & edited it from 1747 to 1772,(Denis) Diderot,NA
2019-03-01,DJ,WHAT DO YOU STAND FOR?,,2000,"In case of missiles from the Soviet Union, the U.S. & Canada had this, the DEW line for short",Distant Early Warning,NA
2019-03-01,DJ,TRAVEL,,2000,"December is a fun time to visit Scotland, especially during this New Year's festival that features torch parades & Vikings!",Hogmanay,NA
2019-03-01,DJ,"""E""PONYMOUS",,2000,"(Jimmy of the Clue Crew swirls some liquids in a flask.) Liquids can be swirled & mixed without danger of spillage in this tapered laboratory flask, named for a 19th-century German chemist",the Erlenmeyer flask,http://www.j-archive.com/media/2019-03-01_DJ_10.jpg
2019-03-01,FJ,PRESIDENTIAL ELECTION YEARS,,NA,Prior to 2016 it was the last election year in which the winning candidate had never held public elected office,1952,NA
