date,round,category,comment,value,clue,response,link
2019-04-09,J,BEER,,200,"In a 2019 Super Bowl ad, we learned about the corn syrup policy of Bud Light, Miller Lite & this Colorado light",Coors,NA
2019-04-09,J,STOUT,,200,Season 7 had this animated TV dad go up to 300 pounds; his body ends up sealing a leak at the nuclear power plant,Homer Simpson,NA
2019-04-09,J,LOGGER,,200,"Also the surname of a Twain character, this term refers to someone who processes wood",a sawyer,NA
2019-04-09,J,PALE AIL,,200,Women of centuries ago were pale & ailing due to this-based paint they used to whiten their skin,lead,NA
2019-04-09,J,LIGHT,,200,"Mitch in ""A Streetcar Named Desire"" knows his classic similes, telling Blanche she's ""light as"" this bird part",a feather,NA
2019-04-09,J,"""PORTER""",,200,It's how Mr. Spock & Captain Kirk get from the ship to a planet's surface,a transporter,NA
2019-04-09,J,BEER,,400,"These bitter buds added for flavor belong to the Cannabaceae family, making them a cousin of marijuana",hops,NA
2019-04-09,J,STOUT,,400,"Augustus Gloop, a finder of a golden ticket in this novel, ""looked as though he had been blown up with a powerful pump""",Charlie and the Chocolate Factory,NA
2019-04-09,J,LOGGER,,400,"Sharing its name with a Beatles tune, it's the title of Lars Mytting's book about chopping trees the ""Scandinavian way""",Norwegian Wood,NA
2019-04-09,J,PALE AIL,,400,Geographic name of this item that can protect the pale from too much sun,a Panama hat,http://www.j-archive.com/media/2019-04-09_J_24.jpg
2019-04-09,J,LIGHT,,400,"For a boxer, to get light enough to compete in a given class is to ""make"" this",the weight,NA
2019-04-09,J,"""PORTER""",,400,Fourth estate occupation of folks like Seymour Hersh,a reporter,NA
2019-04-09,J,BEER,,600,"Instead of only using barley, Weissbier adds this grain into the mix",wheat,NA
2019-04-09,J,STOUT,,600,"In Chapter 1 of this novel, Piggy is described as a fat boy with asthma who wears specs",the Lord of the Flies,NA
2019-04-09,J,LOGGER,,600,One story about this companion of Paul Bunyan says it would take a day for crows to fly from one horn to the other,Babe (the blue ox),NA
2019-04-09,J,PALE AIL,,600,"If you're ""in"" this, defined as a lack of blood flow, perhaps due to trauma, you may be pale; treat by loosening tight clothes",shock,NA
2019-04-09,J,LIGHT,,600,"A motto was born when a boys town boy carrying another boy who had polio said, ""He ain't heavy..., he's"" this",my brother,NA
2019-04-09,J,"""PORTER""",,600,"Want a real Omaha steak in Omaha? Try the 23-ounce one of these at Cascio's, founded in 1946",a porterhouse,NA
2019-04-09,J,BEER,,800,"Because it contains this natural type of alcohol, an antimicrobial, beer can be safer to drink than suspect water",ethanol,NA
2019-04-09,J,STOUT,,800,"In this documentary, Morgan Spurlock gained 5 pounds during a monthlong diet of only McDonald's",Super Size Me,NA
2019-04-09,J,LOGGER,,800,In the 1800s lumberjacks developed this fast-footed sport AKA birling,logrolling,NA
2019-04-09,J,PALE AIL,,800,"Fairer folk rejoice! REI offers UPF clothing, UPF short for this ""protection factor""",ultraviolet,NA
2019-04-09,J,LIGHT,,800,Scientists keep making new materials billed as 100 times lighter than this trademarked polystyrene packing material,Styrofoam,NA
2019-04-09,J,"""PORTER""",,800,"Walmart isn't just the USA's largest retailer, but also the largest of these companies that bring goods into a country",importer,NA
2019-04-09,J,BEER,,1000,"The 1st brewers may have been this Mesopotamian people c. 6000 B.C.; they even had a goddess of beer, Ninkasi",the Sumerians,NA
2019-04-09,J,STOUT,,1000,Here's Herbert Beerbohm Tree as this Shakespeare character,Falstaff,http://www.j-archive.com/media/2019-04-09_J_06.jpg
2019-04-09,J,LOGGER,,1000,"The labor union IWW, known as these, actually was quite firm representing lumberjacks in the Pacific northwest",Wobblies,NA
2019-04-09,J,PALE AIL,,NA,Malarial & iron deficiency are 2 types of this condition that can lead to paleness,anemia,NA
2019-04-09,J,LIGHT,,1000,"In ""First Man"" an angry Janet Armstrong calls NASA ""a bunch of boys making models out of"" this light wood",balsa,NA
2019-04-09,J,"""PORTER""",,1000,"He was the songwriter behind classics like ""Night & Day"" & ""Love For Sale""",Cole Porter,NA
2019-04-09,DJ,ASIAN CITIES,,400,A statue of a seated Genghis Khan graces an entrance to the government palace in Ulaanbaatar in this nation,Mongolia,NA
2019-04-09,DJ,A SHORT STORY CATEGORY,,400,"Surprisingly, a Richard Russo tale about a dismal road trip is titled this happy ""Ride""","""Joy Ride""",NA
2019-04-09,DJ,CAT IDIOMS,,400,"It's from the Latin for ""careful"" but it's what ""killed the cat"" who wasn't careful enough",curiosity,NA
2019-04-09,DJ,INTERNATIONAL ARCHITECTURE & DESIGN,,400,"When entering a Japanese house, you traditionally leave these paired items in the genkan near the door",shoes,NA
2019-04-09,DJ,MUSIC FESTIVALS,,400,"For a 2018 festival Paul McCartney & Metallica were in the ""City Limits"" of this Texas ""Live Music Capital of the World""",Austin,NA
2019-04-09,DJ,AMERICAN HISTORY,,400,"It's believed that Scandinavians built the first log cabins in America on the Delaware River at Nya Sverige, or New this country",Sweden,NA
2019-04-09,DJ,ASIAN CITIES,,800,This Israeli city was founded in 1909 as a suburb of the ancient Mediterranean port of Jaffa,Tel Aviv,NA
2019-04-09,DJ,A SHORT STORY CATEGORY,,800,"Alice Munro set many stories like ""Royal Beatings"" in small towns in this country",Canada,NA
2019-04-09,DJ,CAT IDIOMS,,800,To appear bedraggled is to look like something that arrived this way,like something the cat dragged in,NA
2019-04-09,DJ,INTERNATIONAL ARCHITECTURE & DESIGN,,NA,In Andalusia Arabic calligraphy represents this style named for medieval visitors from Africa,Moorish,NA
2019-04-09,DJ,MUSIC FESTIVALS,,800,"The 2001 edition of this city's Jazz Fest, commemorating Louis Armstrong's centennial, drew 650,000 fans",New Orleans,NA
2019-04-09,DJ,AMERICAN HISTORY,,800,"Proof the U.S. had secretly bombed Cambodia was in these ""Papers"" that were first leaked on June 13, 1971",the Pentagon Papers,NA
2019-04-09,DJ,ASIAN CITIES,,1200,"The only big city in a nation of small towns & villages, this Asian capital is located on the delta of the Chao Phraya River",Bangkok,NA
2019-04-09,DJ,A SHORT STORY CATEGORY,,1200,"""A Boring Story"" is by this Russian playwright/story master",(Anton) Chekhov,NA
2019-04-09,DJ,CAT IDIOMS,,1200,"If a secret has been exposed, it's where ""the cat"" is",out of the bag,NA
2019-04-09,DJ,INTERNATIONAL ARCHITECTURE & DESIGN,,1200,"Former Yankee catcher Jorge could tell you this Spanish word means ""inn""",posada,NA
2019-04-09,DJ,MUSIC FESTIVALS,,1200,"At the Montreux Jazz Festival, you might see smoke on the water of this Swiss lake's shoreline",Lake Geneva,NA
2019-04-09,DJ,AMERICAN HISTORY,,1200,"In 1976, more than 175 years after his death, this man was promoted by Congress to general of the armies of the United States",George Washington,NA
2019-04-09,DJ,ASIAN CITIES,,1600,"Also famous for its textiles, this traditional center of Japanese culture & Buddhism was the capital for 1,000 years",Kyoto,NA
2019-04-09,DJ,A SHORT STORY CATEGORY,,1600,"Competes the title of Susan Glaspell's 1917 tale with a feminist angle, ""A Jury of...""",of her peers,NA
2019-04-09,DJ,CAT IDIOMS,,1600,"A fleeting rise in a stock's price after a fall is this type of ""bounce""",dead cat,NA
2019-04-09,DJ,INTERNATIONAL ARCHITECTURE & DESIGN,,1600,"Isfahan in this country is renowned for its religious architecture, like the Sheikh Lotfollah Mosque",Iran,http://www.j-archive.com/media/2019-04-09_DJ_17.jpg
2019-04-09,DJ,MUSIC FESTIVALS,,1600,"Tame Impala & Lauryn Hill headlined the 2018 edition of this ""pointed"" online music magazine's Chicago festival",Pitchfork,NA
2019-04-09,DJ,AMERICAN HISTORY,,NA,"In 1904 Oklahoma City policeman Joe Burnett killed Ed O'Kelley, who had killed Robert Ford, who had killed this outlaw",Jesse James,NA
2019-04-09,DJ,ASIAN CITIES,,2000,"Bishkek, which began as a fortress in 1825, is today the leading city of this ""stan""",Kyrgyzstan,NA
2019-04-09,DJ,A SHORT STORY CATEGORY,,2000,"J.D. Salinger paired ""Franny"" with a story about him",Zooey,NA
2019-04-09,DJ,CAT IDIOMS,,2000,"Act assertively! ""A cat in gloves"" has this inability",a cat in gloves catches no mice,NA
2019-04-09,DJ,INTERNATIONAL ARCHITECTURE & DESIGN,,2000,Lukovitsa is the Russian name for this vegetable-shaped style of tower dome,onion,NA
2019-04-09,DJ,MUSIC FESTIVALS,,2000,"2018 was a ""fallow year"" for this ""G""iant English festival, skipped to give its fields time to recover from the huge crowds",Glastonbury,NA
2019-04-09,DJ,AMERICAN HISTORY,,2000,"As a young man Frederick Douglass heard if he learned to do this ""it would forever unfit him to be a slave""--so he did",read and write,NA
2019-04-09,FJ,PHYSICS TERMS,,NA,"Ironically, it's a metaphor meaning a huge step forward, but this 2-word process only occurs on a subatomic scale",a quantum leap,NA
