date,round,category,comment,value,clue,response,link
2019-05-06,J,PARENTHETICAL SONGS,,200,"Beyonce: ""(Put A Ring On It)""","""Single Ladies""",NA
2019-05-06,J,OCCUPATIONS,,200,"Roughnecks, roustabouts & drillers all work on these structures",oil rigs,NA
2019-05-06,J,GEOGRAPHY,,200,"In this state, not far from Mount Hood, there's a town that's Boring (that's its name, really)",Oregon,NA
2019-05-06,J,INITIALLY YOURS,,200,"He directed ""Star Wars: The Force Awakens"" & ""Star Trek Into Darkness""",J.J. Abrams,NA
2019-05-06,J,CLASSIC NOVELS,,200,"He wrote that a hobbit-hole ""means comfort""",Tolkien,NA
2019-05-06,J,CLICHES,,200,"To achieve a pair of goals with a single effort is to do this, perhaps using a slingshot",kill two birds with one stone,NA
2019-05-06,J,PARENTHETICAL SONGS,,400,"Rihanna: ""(In The World)""","""Only Girl""",NA
2019-05-06,J,OCCUPATIONS,,400,"No secret handshake required these days to be this professional who uses bricks, blocks or natural stones to build structures",a mason,NA
2019-05-06,J,GEOGRAPHY,,400,"Lahore, this country's second-largest city, is the capital of the Punjab province",Pakistan,NA
2019-05-06,J,INITIALLY YOURS,,400,"In 1879 he founded his first 5-cent stores in Utica, New York & Lancaster, Penn.; the price ceiling was later raised to a dime",F.W. Woolworth,NA
2019-05-06,J,CLASSIC NOVELS,,400,"Mark Twain's childhood sweetheart Laura Hawkins was the basis for Becky Thatcher, beloved of this title character",Tom Sawyer,NA
2019-05-06,J,CLICHES,,400,"Making a wrong assumption is doing this, like when dogs pursuing their prey go to an incorrect oak",barking up the wrong tree,NA
2019-05-06,J,PARENTHETICAL SONGS,,600,"Eurythmics: ""(Are Made Of This)""","""Sweet Dreams""",NA
2019-05-06,J,OCCUPATIONS,,600,"These 2 words come before ""cook"" to describe one in a diner making simple, quick meals",short order,NA
2019-05-06,J,GEOGRAPHY,,600,This Florida lake is the third-largest natural freshwater lake wholly within the United States,Okeechobee,NA
2019-05-06,J,INITIALLY YOURS,,600,"We're sure this author, noted for a 1951 classic, would not have liked to have his picture seen by millions of people",J.D. Salinger,http://www.j-archive.com/media/2019-05-06_J_20.jpg
2019-05-06,J,CLASSIC NOVELS,,600,A Lithuanian immigrant named Jurgis Rudkus works in the Chicago stockyards in this classic novel,The Jungle,NA
2019-05-06,J,CLICHES,,600,This type of message predicting disaster comes from the book of Daniel,the writing\'s on the wall,NA
2019-05-06,J,PARENTHETICAL SONGS,,800,"Otis Redding: ""(Sittin' On)""","""The Dock Of The Bay""",NA
2019-05-06,J,OCCUPATIONS,,800,"U.S. News included this mapmaking occupation one of its 25 Best Jobs of 2019, anticipating a rise in demand",a cartographer,NA
2019-05-06,J,GEOGRAPHY,,800,This Italian region that includes Pisa & Florence gets its name from the Etruscan people,Tuscany,NA
2019-05-06,J,INITIALLY YOURS,,800,This guy started out with a 3-page flyer advertising his Maine hunting shoe; the catalog is bigger now,L.L. Bean,NA
2019-05-06,J,CLASSIC NOVELS,,NA,This Tolstoy title lady has a young son named Sergei,Anna Karenina,NA
2019-05-06,J,CLICHES,,800,"A paper entitling the bearer to food, or a source of financial support, as in ""That rich wife is his ____ ____""",meal ticket,NA
2019-05-06,J,PARENTHETICAL SONGS,,1000,"U2: ""(In The Name Of Love)""","""Pride""",NA
2019-05-06,J,OCCUPATIONS,,1000,"Nurses can be RNs, registered nurses, or LPNs, this type",a licensed practical nurse,NA
2019-05-06,J,GEOGRAPHY,,1000,"Within a former province of South Africa, you'll find the name of this river on its southern edge",the Vaal,http://www.j-archive.com/media/2019-05-06_J_15a.jpg
2019-05-06,J,INITIALLY YOURS,,1000,"Via the White Star Line, the Titanic was owned by this U.S. banking tycoon, who had a private suite he never got to use",J.P. Morgan,NA
2019-05-06,J,CLASSIC NOVELS,,1000,Chapter 1 of this Verne novel informs us that in 1872 Phileas Fogg lived on Saville Row,Around the World in Eighty Days,NA
2019-05-06,J,CLICHES,,1000,"This ""effort"" made in an ultimate attempt to prevent disaster comes from a final military defensive position",last-ditch effort,NA
2019-05-06,DJ,IOWA IN ENTERTAINMENT,,400,"In this film when asked, ""Is this heaven?"", Kevin Costner answers, ""It's Iowa""",Field of Dreams,NA
2019-05-06,DJ,THE PLANETS,,400,"Like Earth, this planet has polar ice caps--the Planum Boreum & the Planum Australe",Mars,NA
2019-05-06,DJ,ARCHAEOLOGY,,400,Evidence suggests that this ancient monument on Salisbury Plain was once a burial site for cremated remains,Stonehenge,NA
2019-05-06,DJ,BALLOONS,,400,The U.S. Balloon Corps was established during this war & observed enemy movements in support of the Army of the Potomac,the Civil War,NA
2019-05-06,DJ,THOSE WHO IGNORE HISTORY,,400,"Ignoring this commander's experience 129 years earlier, in the winter of 1941, the Germans attacked Moscow",Napoleon,NA
2019-05-06,DJ,"DOOMED TO REPEAT ""IT""","(Alex: The letters ""I-T"" will come up twice in a correct response.)",400,"A player who swings from both sides of the plate, like Mickey Mantle",a switch hitter,NA
2019-05-06,DJ,IOWA IN ENTERTAINMENT,,800,"This brotherly duo of ""Bye Bye Love"" fame got their start singing on Iowa radio stations",The Everly Brothers,http://www.j-archive.com/media/2019-05-06_DJ_26.jpg
2019-05-06,DJ,THE PLANETS,,800,It was the first planet discovered in modern times; William Herschel thought it was a comet when he first saw it,Uranus,NA
2019-05-06,DJ,ARCHAEOLOGY,,800,Artifacts & the remains of colonial leaders have been found at the site of this first permanent English settlement in America,Jamestown,NA
2019-05-06,DJ,BALLOONS,,800,"At first, the giant balloons in this 90+year-old parade were set afloat & whoever found them, days later, won a prize",the Macy\'s Thanksgiving Parade,NA
2019-05-06,DJ,THOSE WHO IGNORE HISTORY,,800,"In 1968 Bernard Montgomery said the U.S. had broken the second rule of war: ""Don't go fighting with your land army"" on this continent",Asia,NA
2019-05-06,DJ,"DOOMED TO REPEAT ""IT""","(Alex: The letters ""I-T"" will come up twice in a correct response.)",800,"Uh-oh, my Visa's maxed out--I must've reached this",credit limit,NA
2019-05-06,DJ,IOWA IN ENTERTAINMENT,,1200,Iowa native Fred Grandy played Gopher on this TV show for 9 years & later was a U.S. rep from the state,The Love Boat,NA
2019-05-06,DJ,THE PLANETS,,1200,"Recently, the Hubble Space Telescope captured this phenomenon around the north pole of Jupiter",aurora borealis,http://www.j-archive.com/media/2019-05-06_DJ_03.jpg
2019-05-06,DJ,ARCHAEOLOGY,,NA,"In 2018 it was announced that the world's oldest intact shipwreck was found off the coast of Bulgaria, at the bottom of this sea",the Black Sea,NA
2019-05-06,DJ,BALLOONS,,1200,This high-flying 2009 film took home the Oscar for Best Animated Feature Film,Up,NA
2019-05-06,DJ,THOSE WHO IGNORE HISTORY,,1200,"The Soviet Union invaded this ""graveyard of empires"" in 1979 & suffered 50,000 casualties before withdrawing in 1989",Afghanistan,NA
2019-05-06,DJ,"DOOMED TO REPEAT ""IT""","(Alex: The letters ""I-T"" will come up twice in a correct response.)",1200,"""To boldly go"" is this grammatical construction",a split infinitive,NA
2019-05-06,DJ,IOWA IN ENTERTAINMENT,,1600,"Filmed partly in tornado-prone Iowa, this 1996 film starred Helen Hunt & Bill Paxton",Twister,NA
2019-05-06,DJ,THE PLANETS,,NA,"Some have more than 60, but these 2 planets have no known moons",Mercury and Venus,NA
2019-05-06,DJ,ARCHAEOLOGY,,1600,"Before massive digging began, Sir Arthur Evans bought the site of this Minoan city on the island of Crete",Knossos,NA
2019-05-06,DJ,BALLOONS,,1600,An L.A. government agency says mylar helium balloons that fly free cause around 200 of these in the city every year,power outages,NA
2019-05-06,DJ,THOSE WHO IGNORE HISTORY,,1600,"WWI leaders didn't learn from the terrible effect of these weapons, like the Maxim, in the 1904-1905 Russo-Japanese War",machine guns,NA
2019-05-06,DJ,"DOOMED TO REPEAT ""IT""","(Alex: The letters ""I-T"" will come up twice in a correct response.)",1600,Restaurants like Da Nico & Il Cortile line Mulberry Street in this section of Manhattan,Little Italy,NA
2019-05-06,DJ,IOWA IN ENTERTAINMENT,,2000,"George Reeves from Woolstock, Iowa was a trained boxer & in 1952 became the first actor to play this character on TV",Superman,NA
2019-05-06,DJ,THE PLANETS,,2000,This Italian-born astronomer discovered the gap in Saturn's rings & a probe named for him orbited the planet for 13 years,Cassini,NA
2019-05-06,DJ,ARCHAEOLOGY,,2000,"The body of this 2,000-year-old man was discovered in a bog in Denmark in 1950",the Tollund Man,http://www.j-archive.com/media/2019-05-06_DJ_10.jpg
2019-05-06,DJ,BALLOONS,,2000,"In 1783 these brothers sent a sheep, a duck & a rooster aloft in a hot-air balloon over Versailles",the Montgolfier brothers,NA
2019-05-06,DJ,THOSE WHO IGNORE HISTORY,,2000,"In World War I Italy attacked this northeast neighbor in 12--yes, 12--battles of the Isonzo River & got whupped repeatedly",Austria,NA
2019-05-06,DJ,"DOOMED TO REPEAT ""IT""","(Alex: The letters ""I-T"" will come up twice in a correct response.)",2000,Dissociative identity disorder is more colloquially known as this psychological condition,split personality,NA
2019-05-06,FJ,POETS,,NA,"A poem by him includes, ""It was grassy and wanted wear;/though...the passing there/had worn them really about the same""",Robert Frost,NA
