date,round,category,comment,value,clue,response,link
2019-10-29,J,A STAR-SPANGLED BANNER LYRICAL QUIZ,,200,"They provide a ""red glare"" to the battle scene",rockets,NA
2019-10-29,J,GARGOYLES,,200,On rooftops grotesque statues aren't gargoyles unless they serve as one of these for rain,a downspout (waterspout),NA
2019-10-29,J,BOOK NUMBERS,,200,"By Bret Easton Ellis: ""Less Than ____""",Zero,NA
2019-10-29,J,TONS OF FUN,,200,"It's estimated that some of these, literally ""terrible lizards"", stood about 50 feet tall & weighed as much as 85 tons",dinosaurs,NA
2019-10-29,J,COASTLINES,,200,"This South American country has about 4,600 miles of Atlantic coastline",Brazil,NA
2019-10-29,J,IDIOMS DELIGHT,,200,"If you're a little crazy or foolish, you're ""off your"" this piece of furniture",rocker,NA
2019-10-29,J,A STAR-SPANGLED BANNER LYRICAL QUIZ,,400,"Verse 4 says, ""Then conquer we must, when our cause it is just, And this be our motto--'In God is our'"" this",trust,NA
2019-10-29,J,GARGOYLES,,400,"The singing gargoyles in this 1996 Disney cartoon are named Victor, Hugo & Laverne",The Hunchback of Notre Dame,NA
2019-10-29,J,BOOK NUMBERS,,400,"""The ____ Habits of Highly Effective People""",7,NA
2019-10-29,J,TONS OF FUN,,400,"Mostly copper & weighing just over a ton, it was cast for the Pennsylvania Statehouse in the 1750s",the Liberty Bell,NA
2019-10-29,J,COASTLINES,,400,Cities along this U.S. state's ocean coast include Astoria & Brookings,Oregon,NA
2019-10-29,J,IDIOMS DELIGHT,,400,"(Jimmy of the Clue Crew presents by a display monitor.)  On the interstate, it's 475 miles from Phoenix to Albuquerque. But it's only 330 miles via this bird idiom",as the crow flies,http://www.j-archive.com/media/2019-10-29_J_02a.jpg
2019-10-29,J,A STAR-SPANGLED BANNER LYRICAL QUIZ,,600,"The ""towering steep"" in verse 2 is this edifice that was under attack by the British",Fort McHenry,NA
2019-10-29,J,GARGOYLES,,600,Some of the earliest known gargoyles are these animals on the Temple of Zeus; maybe they're the Nemean type,lions,NA
2019-10-29,J,BOOK NUMBERS,,600,"An international bestseller: ""The ____ -Year-Old Man Who Climbed Out the Window and Disappeared""",100,NA
2019-10-29,J,TONS OF FUN,,600,"Buoys may be anchored in place with these that weigh 9 tons, a bit heavier than the same-named weight on a fishing line",a sinker,NA
2019-10-29,J,COASTLINES,,600,"This nation's 2,100-mile coastline extends from the Gulf of Thailand to the Gulf of Tonkin",Vietnam,NA
2019-10-29,J,IDIOMS DELIGHT,,600,"To view something with skepticism is to ""take it with"" this bit of sodium chloride",a grain of salt,NA
2019-10-29,J,A STAR-SPANGLED BANNER LYRICAL QUIZ,,800,In a kids' book this phrase leads Ramona Quimby to think a lamp is called a dawnzer,dawn\'s early light,NA
2019-10-29,J,GARGOYLES,,800,Paisley Abbey in Scotland added a new gargoyle likely inspired by this 1979 horror film,Alien,NA
2019-10-29,J,BOOK NUMBERS,,800,"From ""The Charge of the Light Brigade"": ""All in the valley of Death rode the ___""",600,NA
2019-10-29,J,TONS OF FUN,,NA,"3,500 years old & weighing 220 tons, one of NYC's oldest artifacts is the Central Park Obelisk known as her Needle",Cleopatra,NA
2019-10-29,J,COASTLINES,,800,"This nation takes its name from the Latin are erythraeum, meaning ""Red Sea"", the body of water the nation borders",Eritrea,NA
2019-10-29,J,IDIOMS DELIGHT,,800,It's one of these elaborate presentations,a dog and pony show,http://www.j-archive.com/media/2019-10-29_J_04a.jpg
2019-10-29,J,A STAR-SPANGLED BANNER LYRICAL QUIZ,,1000,This phrase about liberty in all 4 verses provides the title of a song by The Killers where it has a more ironic meaning,the land of the free,NA
2019-10-29,J,GARGOYLES,,1000,The gargoyles on this Manhattan building named for an auto executive are less earthbound--they're eagles,the Chrysler Building,NA
2019-10-29,J,BOOK NUMBERS,,1000,"A Temperance Brennan novel: ""___ Bones"" (referring to the number of bones in the body)",206,NA
2019-10-29,J,TONS OF FUN,,1000,"She's a hefty 70,327 tons, 963 feet long, and is now a floating hotel in Dubai",the QE2,http://www.j-archive.com/media/2019-10-29_J_30.jpg
2019-10-29,J,COASTLINES,,1000,It's the only Central American country without a coastline on the Pacific Ocean,Belize,NA
2019-10-29,J,IDIOMS DELIGHT,,1000,"To cause trouble or a ruckus is to ""raise"" this biblical person",Cain,NA
2019-10-29,DJ,ELEMENTAL ETYMOLOGY,,400,Indium is named for this deep blue color,indigo,NA
2019-10-29,DJ,TV,,400,"This former ""Daily Show"" correspondent hosts his own news satire, ""Last Week Tonight""",John Oliver,NA
2019-10-29,DJ,"TAKE ""TEN""",,400,An apartment dweller,a tenant,NA
2019-10-29,DJ,GRANT,,400,"Ulysses S. Grant said the story that this general had offered his sword & Grant had returned it was ""the purest romance""",Lee,NA
2019-10-29,DJ,WOOD,,400,1.5 by 3.5 inches is the usual size of this piece of lumber; its name comes from its unprocessed dimensions,a 2x4,NA
2019-10-29,DJ,AMERICAN GOTHIC,,400,"Gothic is common for churches, and, though much less common, was used for these, like the neo-Gothic Mickve Israel in Savannah",a temple (synagogue),http://www.j-archive.com/media/2019-10-29_DJ_22.jpg
2019-10-29,DJ,ELEMENTAL ETYMOLOGY,,800,Palladium honors one of these space objects that's named for Pallas Athena,an asteroid,NA
2019-10-29,DJ,TV,,800,Omar Little on this Baltimore-set series was a big fan of Honey Nut Cheerios,The Wire,NA
2019-10-29,DJ,"TAKE ""TEN""",,800,"In the U.S., it's the most popular form of bowling",ten pin,NA
2019-10-29,DJ,GRANT,,800,"When fellow West Point cadets saw the name U.S. Grant, they mockingly called him this, after a national symbol",Uncle Sam,NA
2019-10-29,DJ,WOOD,,800,"Despite the name, this decaying wood, caused by fungal growth, usually happens in moist, unventilated areas",dry rot,http://www.j-archive.com/media/2019-10-29_DJ_29.jpg
2019-10-29,DJ,AMERICAN GOTHIC,,800,"In 1798's ""Wieland"", the 1st Amer. Gothic novel, a character seems to die from this: ""In a moment, the whole was reduced to ashes""",spontaneous combustion,NA
2019-10-29,DJ,ELEMENTAL ETYMOLOGY,,1200,Swedish chemist Jöns Jacob Berzelius named this element for a thunder god,thorium,NA
2019-10-29,DJ,TV,,1200,"On a '90s nighttime soap, Heather Locklear was a resident of the apartment complex at 4616 this title street",Melrose Place,NA
2019-10-29,DJ,"TAKE ""TEN""",,1200,It's an adjective meaning pertaining to the most popular British poet of the Victorian era,Tennysonian,NA
2019-10-29,DJ,GRANT,,1200,"As a young man, Grant's dad lived with this militant abolitionist & thought he was a man of high morals but a fanatic",John Brown,NA
2019-10-29,DJ,WOOD,,1200,"For easy woodcutting, strike up this 4-letter power saw that uses a continuously looping blade",a band saw,NA
2019-10-29,DJ,AMERICAN GOTHIC,,1200,"Before he he became an Oscar-winning composer, he brought a Gothic feel to '90s hard rock",Trent Reznor,http://www.j-archive.com/media/2019-10-29_DJ_24.jpg
2019-10-29,DJ,ELEMENTAL ETYMOLOGY,,1600,This noble gas is named for an element discovered by the Curies,radon,NA
2019-10-29,DJ,TV,,1600,"Seen here, he plays Abe Weissman, father of the Marvelous Mrs. Maisel",Tony Shalhoub,http://www.j-archive.com/media/2019-10-29_DJ_05.jpg
2019-10-29,DJ,"TAKE ""TEN""",,1600,"In a state of anxiety? You're ""on"" these 11-letter items",tenterhooks,NA
2019-10-29,DJ,GRANT,,1600,"As president, Grant tried to annex this Caribbean ""Republic"", but the Senate rejected his treaty",the Dominican,NA
2019-10-29,DJ,WOOD,,1600,A froe is a woodworking tool; coopers used curved froes to cut these pieces to form the sides of barrels,staves,NA
2019-10-29,DJ,AMERICAN GOTHIC,,1600,The style Collegiate Gothic began with Pembroke Hall & other buildings at this women's college outside Philadelphia,Bryn Mawr,NA
2019-10-29,DJ,ELEMENTAL ETYMOLOGY,,2000,"Symbol Ga, this element is named from the Latin for France & maybe also the Latin for rooster (it was named by M. Lecoq)",gallium,NA
2019-10-29,DJ,TV,,2000,Sanchez & Smith are the last names of the title duo of this adult swim show,Rick and Morty,NA
2019-10-29,DJ,"TAKE ""TEN""",,2000,The khayyam in Omar Khayyam means this profession,tent maker,NA
2019-10-29,DJ,GRANT,,NA,"Grant said, ""I do not think there was ever a more wicked war than"" this one, the first in which he fought",the Mexican-American War,NA
2019-10-29,DJ,WOOD,,2000,Visit Mandalay in Burma & you may come home with a table of this wood from which the city's U Bein Bridge is built,teak,NA
2019-10-29,DJ,AMERICAN GOTHIC,,NA,"This southern Gothic O'author wrote her novel ""Wise Blood"" about a preacher in the church without Christ",Flannery O\'Connor,NA
2019-10-29,FJ,1950s CINEMA,,NA,"Objects of attention in this suspenseful film include a digging dog, a scantily clad dancer & a possible murderer",Rear Window,NA
