date,round,category,comment,value,clue,response,link
2019-12-11,J,THE SECOND-LARGEST CITY IN THE STATE,,200,Yale University helped this city take second behind Bridgeport,New Haven,NA
2019-12-11,NA,NA,NA,NA,NA,NA,NA
2019-12-11,J,IN FULL,,200,"The full Latin name for this 1215 document translates to ""the great charter of freedoms""",the Magna Carta,NA
2019-12-11,J,A HAT TIP TO YOU,,200,"Still popular, this flat, soft cap is named for the bygone professional who said, ""Paper, mister?""",a newsboy,NA
2019-12-11,J,TAKING A VOWEL OF SILENCE,,200,O: In this spotted cat,leopard,NA
2019-12-11,J,THERE ONCE WAS THIS MAN FROM...,,200,"...Brazil / who kicked a ball with some skill / finding the holes / scored 1,200-plus goals / & gave us 2 decades of thrill",Pelé,NA
2019-12-11,J,THE SECOND-LARGEST CITY IN THE STATE,,400,"For those of y'all keepin' score: it's New Orleans, 344,000; this capital city, 230,000",Baton Rouge,NA
2019-12-11,J,TV MOMS,,400,"This character was mom to Marcia, Jan, Cindy, Greg, Peter & Bobby",Carol (Brady),NA
2019-12-11,J,IN FULL,,400,"Despite being part of the name, ""and explosives"" did not make it into the initials for this government bureau",the ATF,NA
2019-12-11,J,A HAT TIP TO YOU,,400,"A survivor at this site ""recognized Col. Crockett lying dead & mutilated"" & remembered seeing his coonskin cap ""lying by his side""",the Alamo,NA
2019-12-11,J,TAKING A VOWEL OF SILENCE,,400,U: In this basketball backcourt position,guard,NA
2019-12-11,J,THERE ONCE WAS THIS MAN FROM...,,400,"...Chicago / his Sen. seat, ""golden"" said Blago / won a Nobel for Peace / his term did cease / don't think he'll stay at Mar-A-Lago",Obama,NA
2019-12-11,NA,NA,NA,NA,NA,NA,NA
2019-12-11,J,TV MOMS,,600,"Tovah Feldshuh had a recurring role as Rachel Bloom's mom, Naomi Bunch, on this musical comedy",Crazy Ex-Girlfriend,NA
2019-12-11,J,IN FULL,,600,"""Borat"" is subtitled ""Cultural Learnings of America for Make Benefit Glorious Nation of"" this",Kazakhstan,NA
2019-12-11,J,A HAT TIP TO YOU,,600,"Here's Teddy Roosevelt on November 16th, 1906, inspecting a massive feat of engineering wearing what would be named this kind of hat",a Panama hat,http://www.j-archive.com/media/2019-12-11_J_03a.jpg
2019-12-11,J,TAKING A VOWEL OF SILENCE,,600,"A: In this 12-letter word that precedes ""involved"" to describe lovers",romantically,NA
2019-12-11,J,THERE ONCE WAS THIS MAN FROM...,,600,...Maine / who made shoes to fight off the rain / his catalog mailed / & clothing detailed / outdoors would be his domain,L.L. Bean,NA
2019-12-11,J,THE SECOND-LARGEST CITY IN THE STATE,,800,Miami is half the size of this seaport city further north,Jacksonville,NA
2019-12-11,J,TV MOMS,,800,"Seen here, Wendi McLendon-Covey plays mom Beverly on this sitcom set in 1980-something",The Goldbergs,http://www.j-archive.com/media/2019-12-11_J_17.jpg
2019-12-11,J,IN FULL,,NA,"""'The Military College of South Carolina"" is in the full name of this school",the Citadel,NA
2019-12-11,J,A HAT TIP TO YOU,,800,Abe Lincoln kept papers & speeches in this type of top hat he wore to Ford's Theatre the night he was shot,stovepipe,NA
2019-12-11,J,TAKING A VOWEL OF SILENCE,,800,"E: In this chance occurrence, which your hole-in-one was, you lucky so-&-so",a fluke,NA
2019-12-11,J,THERE ONCE WAS THIS MAN FROM...,,800,...Iran / who ruled with too firm a hand / according to text / Khomeini was next / he was no longer the king of his land,the Shah,NA
2019-12-11,J,THE SECOND-LARGEST CITY IN THE STATE,,1000,"Boston has a 400,000-plus edge on this city whose pronunciation doesn't match up so well with its spelling",Worcester,NA
2019-12-11,J,TV MOMS,,1000,"During the run of this comedy, actress Debra Jo Rupp & her character Kitty Forman both quit smoking",That \'70s Show,NA
2019-12-11,J,IN FULL,,1000,"This Mideast country is known as the ""Hashemite Kingdom""",Jordan,NA
2019-12-11,J,A HAT TIP TO YOU,,1000,"In the U.S., we call one hat a derby; the Brits stay in their lane & get sportier by calling it this",a bowler,NA
2019-12-11,J,TAKING A VOWEL OF SILENCE,,1000,"I: In this type of school, like UC Berkeley's Haas",business,NA
2019-12-11,J,THERE ONCE WAS THIS MAN FROM...,,1000,"...St. Louis / the ragtime king, I can prove this / wrote ""Maple Leaf Rag"" / with hardly a snag / now say his name, c'mon, do this!",Scott Joplin,NA
2019-12-11,DJ,NAVAL HISTORY,,400,"Launched in 1959, the USS Long Beach was the world's first surface warship powered by this",nuclear power,NA
2019-12-11,DJ,VOCABULARY,,400,It's the structure over the entrance of a theater advertising the upcoming show & its performers,a marquee,NA
2019-12-11,DJ,A CINDERELLA STORY,,400,"In the version compiled by these brothers in the 1800s, bird friends of Cinderella blind her 2 evil stepsisters",Grimm,NA
2019-12-11,NA,NA,NA,NA,NA,NA,NA
2019-12-11,DJ,ITALIAN AUTHORS,,400,"""Divino Poeta"" was a title given to this 14th century Italian writer",Dante,NA
2019-12-11,DJ,COMING OUT OF YOUR SHELL,,400,In 2010 a 718-carat one of these was found inside an abalone shell,a pearl,NA
2019-12-11,DJ,NAVAL HISTORY,,800,Congress presented him a gold medal in 1787 for his naval leadership during the American Revolution,John Paul Jones,http://www.j-archive.com/media/2019-12-11_DJ_11.jpg
2019-12-11,DJ,VOCABULARY,,800,"(Jimmy of the Clue Crew demonstrates using a long pole.) I'm holding a pole that's 7'9"" to illustrate the distance between Utah Jazz center Rudy Gobert's outstretched fingertips, also known by this bird term",wingspan,http://www.j-archive.com/media/2019-12-11_DJ_20.jpg
2019-12-11,DJ,A CINDERELLA STORY,,800,"In the 1998 film ""Ever After"", Dougray Scott plays this key role in the tale",the Prince,NA
2019-12-11,DJ,SCIENCE,,800,It's the splitting of the nucleus of an atom into 2 or more nuclei,fission,NA
2019-12-11,DJ,ITALIAN AUTHORS,,800,"Giovanni Verga turned his own story ""Cavalleria Rusticana"" into a play & it was famously turned into this in 1890",an opera,NA
2019-12-11,DJ,COMING OUT OF YOUR SHELL,,800,Super-hard shell paste is one product from this protective brand for your car,Turtle Wax,NA
2019-12-11,DJ,NAVAL HISTORY,,1200,"Code name Husky, a massive Allied amphibious landing operation was launched on July 10, 1943 against this Mediterranean island",Sicily,NA
2019-12-11,DJ,VOCABULARY,,1200,"The Latin for ""fruit"" gives us this term for the knob on the hilt of a sword or the front part of a saddle",pommel,NA
2019-12-11,DJ,A CINDERELLA STORY,,1200,Stephen Sondheim wove the story into the wider action of this fairy tale musical in 1987,Into the Woods,NA
2019-12-11,DJ,SCIENCE,,1200,"As adults, some of these bloodsucking arthropods believed to cause Lyme disease & Q fever can go over a year without feeding",ticks,NA
2019-12-11,DJ,ITALIAN AUTHORS,,1200,"""It is safer to be feared than loved"", opines Machiavelli in ""The Prince"", dedicated to this man",(Lorenzo de\') Medici,NA
2019-12-11,DJ,COMING OUT OF YOUR SHELL,,1200,"These 2 words precede ""Shell"" in the name of the European parent company of Shell Oil",Royal Dutch,NA
2019-12-11,DJ,NAVAL HISTORY,,1600,"After the Civil War began, this ""Damn the torpedoes!"" naval hero gave up his Virginia home to fight for the Union",(David) Farragut,NA
2019-12-11,DJ,VOCABULARY,,1600,"A short metal-tipped ""stick"" carried by military officers, or to walk with an arrogant air",swagger,NA
2019-12-11,DJ,A CINDERELLA STORY,,1600,"Known for another children's lit reboot, this author sent up Cinderella with ""Confessions of an Ugly Stepsister""",(Gregory) Maguire,NA
2019-12-11,DJ,SCIENCE,,1600,"Symbolized Hf, this element gets its name from a Latin name for Copenhagen, where it was discovered in 1923",hafnium,NA
2019-12-11,DJ,ITALIAN AUTHORS,,NA,"Chapter one of this Umberto Eco novel begins as a sphere ""swayed back and forth with isochronal majesty""",Foucault\'s Pendulum,NA
2019-12-11,DJ,COMING OUT OF YOUR SHELL,,1600,This Los Angeles amphitheater's first 2 bandshells were designed by Frank Lloyd Wright's son Lloyd,the Hollywood Bowl,NA
2019-12-11,DJ,NAVAL HISTORY,,2000,One of the first clashes of modern armored warships was 1905's Battle of the Tsushima Strait during this war in Asia,Russo-Japanese War,NA
2019-12-11,DJ,VOCABULARY,,2000,This plain-woven lightweight cotton fabric is named for an Iraqi city,muslin,NA
2019-12-11,DJ,A CINDERELLA STORY,,2000,The best-known versions of the rags-to-royalty story are based on the one by this French fairy tale author in the 1600s,Charles Perrault,NA
2019-12-11,DJ,SCIENCE,,2000,"Scientists have achieved science fiction-style teleportation, though only with this elementary particle of light",a photon,NA
2019-12-11,DJ,ITALIAN AUTHORS,,2000,"With works like 1877's ""Studies of Women"", Luigi Capuana was a leader of this movement, Italian for ""realism""",verismo,NA
2019-12-11,DJ,COMING OUT OF YOUR SHELL,,NA,"Last name of British officer Henry, who invented a very destructive artillery shell at the beginning of the 19th century",Shrapnel,NA
2019-12-11,FJ,NATIONAL HISTORICAL PARKS,,NA,"Established in 2015, the Manhattan Project National Historical Park has sites in Hanford, Washington; Los Alamos, N.M. & this Tennessee city",Oak Ridge,NA
