date,round,category,comment,value,clue,response,link
2020-01-15,J,FAMOUS & HISTORIC WOMEN,,200,Her grandson said she suggested the use of a 5-pointed star on the flag vs. George Washington's chosen 6-pointer,Betsy Ross,NA
2020-01-15,J,EASY AS A_B_D,"(Alex: Each correct response will begin with an ""A"", end with a ""D"", and there'll be a ""B"" somewhere in between.)",200,Aided & this got you in legal trouble,abetted,NA
2020-01-15,J,TREES,,200,"Unusual for a conifer, larch trees do this each fall like deciduous ones",drop leaves,NA
2020-01-15,J,LITERARY MASHUPS,(Alex: You have to name the two works by the same author that we have managed to mash up.),200,"""The Prince of Santini""",The Prince of Tides & The Great Santini,NA
2020-01-15,J,TEAM AMERICA,,200,"The first Olympic Team USA, in this 19th century year, consisted of 14 athletes, who won 11 events",1896,NA
2020-01-15,J,WORLD POLICE,,200,The star of the clue is the logo of this country's police force,Israel,http://www.j-archive.com/media/2020-01-15_J_27.jpg
2020-01-15,J,FAMOUS & HISTORIC WOMEN,,400,"She got her JD degree from Yale Law in 1979, and we'd say her legal career panned out nicely for her",Sotomayor,http://www.j-archive.com/media/2020-01-15_J_02.jpg
2020-01-15,J,EASY AS A_B_D,"(Alex: Each correct response will begin with an ""A"", end with a ""D"", and there'll be a ""B"" somewhere in between.)",400,Time to get on the ship! All this!,aboard,NA
2020-01-15,J,TREES,,400,"This mighty tree lends its name to a city of about 400,000 on San Francisco Bay",the oak,NA
2020-01-15,J,LITERARY MASHUPS,(Alex: You have to name the two works by the same author that we have managed to mash up.),400,"""The Cat and Ham""",The Cat in the Hat & Green Eggs and Ham,NA
2020-01-15,J,TEAM AMERICA,,400,"There's no ""rock"" in the name of the U.S. team for this sport that includes bouldering & speed disciplines",climbing,NA
2020-01-15,J,WORLD POLICE,,400,"The London Metropolitan Police has licensed this ""New"" name on a forensics kit for kids",New Scotland Yard,NA
2020-01-15,J,FAMOUS & HISTORIC WOMEN,,600,This daughter of Ferdinand & Isabella was Henry VIII's first wife,Catherine of Aragon,NA
2020-01-15,J,EASY AS A_B_D,"(Alex: Each correct response will begin with an ""A"", end with a ""D"", and there'll be a ""B"" somewhere in between.)",600,This fabric worn on an extremity as a tribute is also called a brassard,an armband,NA
2020-01-15,J,TREES,,600,"Perennials like mountain hemlock & lodgepole pine are found near, but not above, this natural boundary at about 9,500 feet",the timberline,NA
2020-01-15,J,LITERARY MASHUPS,(Alex: You have to name the two works by the same author that we have managed to mash up.),600,"""The Iceman Becomes Electra""",The Iceman Cometh & Mourning Becomes Electra,NA
2020-01-15,J,TEAM AMERICA,,600,Chauncey Billups & former Phoenix Suns owner Jerry Colangelo are board members for this sport's governing body in America,basketball,NA
2020-01-15,J,WORLD POLICE,,600,"The Okhrana's function was to stifle leftist activity in this country, at least until 1917",Russia,NA
2020-01-15,J,FAMOUS & HISTORIC WOMEN,,NA,"Let's tell of her & nothing but her--she was born a slave in the 1790s & once freed, sold a book of her ""Narrative""",Sojourner Truth,NA
2020-01-15,J,EASY AS A_B_D,"(Alex: Each correct response will begin with an ""A"", end with a ""D"", and there'll be a ""B"" somewhere in between.)",800,This synonym for ridiculous is derived from Latin: that's completely...,absurd,NA
2020-01-15,J,TREES,,800,"Virginia's state tree is the flowering type of this ""canine"" tree",a dogwood,NA
2020-01-15,J,LITERARY MASHUPS,(Alex: You have to name the two works by the same author that we have managed to mash up.),800,"""Interview with the Damned""",Interview with the Vampire & Queen of the Damned,NA
2020-01-15,J,TEAM AMERICA,,800,"This 4'8"" gymnast carried the flag in the closing ceremonies of the 2016 Rio Olympics",Simone Biles,NA
2020-01-15,J,WORLD POLICE,,800,This Canadian police organization is famous for its musical ride of 32 officers on horseback,the Mounties,NA
2020-01-15,J,FAMOUS & HISTORIC WOMEN,,1000,"Time Magazine named Corazon Aquino, the first female president of this nation, 1986's woman of the year",the Philippines,NA
2020-01-15,J,EASY AS A_B_D,"(Alex: Each correct response will begin with an ""A"", end with a ""D"", and there'll be a ""B"" somewhere in between.)",1000,"To hastily depart to avoid capture, perhaps with the money, too",abscond,NA
2020-01-15,J,TREES,,1000,"Brought to the United States as an ornamental, this spicy-sounding Brazilian tree has red berries and can crowd out native species",the pepper tree,http://www.j-archive.com/media/2020-01-15_J_15a.jpg
2020-01-15,J,LITERARY MASHUPS,(Alex: You have to name the two works by the same author that we have managed to mash up.),1000,"""Death Comes for the Antonia""",Death Comes for the Archbishop & My Antonia,NA
2020-01-15,J,TEAM AMERICA,,1000,"For the Winter Olympics, luge has its own governing body, while bobsled shares a governing body with this similar sport",the skeleton,NA
2020-01-15,J,WORLD POLICE,,1000,In 1991 the German government allowed access to personal files from this East German secret police force,the Stasi,NA
2020-01-15,DJ,U.S. REPRESENTATIVES,,400,Deb Haaland of the Laguna Pueblo & Sharice Davids of the Ho-chunk Nation are the first women of this group in Congress,indigenous women,NA
2020-01-15,DJ,COMPOSERS,,400,"Many of the songs of Elizabethan composer Thomas Morley end with these ""Deck the Halls"" syllables",fa la la la la la la la la,NA
2020-01-15,DJ,WHAT TYPE OF MACHINE AM I?,,400,Hamilton Beach 8-cup with adjustable slicing,a food processor,NA
2020-01-15,DJ,NETFLIX & CHILL,,400,"""Polar"" stars Mads Mikkelsen as a retired one of these professionals, who has relocated to a snowier clime",a hitman (assassin),NA
2020-01-15,DJ,BORDER RIVERS,,400,These 2 rivers form parts of the border between the U.S. & Mexico,the Rio Grande & the Colorado,NA
2020-01-15,DJ,BACKRONYMS,(Alex: These are acronyms where words are chosen to fit the letters.),400,SAD says it all when it comes to being a backronym for this type of depression,Seasonal Affectiveness,NA
2020-01-15,DJ,U.S. REPRESENTATIVES,,800,"Joaquin Castro & Louie Gohmert are both in the House from this state, & that's about as much as the 2 have in common",Texas,NA
2020-01-15,DJ,COMPOSERS,,NA,"If you visit this country, you can enter the room where Edvard Grieg did his composing in the home he built",Norway,http://www.j-archive.com/media/2020-01-15_DJ_15.jpg
2020-01-15,DJ,WHAT TYPE OF MACHINE AM I?,,800,"Wheel of Fortune Five-Reel, a progressive type",a slot machine,NA
2020-01-15,DJ,NETFLIX & CHILL,,800,"What could be more chilling than ""The Chilling Adventures of"" this gal, last name Spellman, of course",Sabrina,NA
2020-01-15,DJ,BORDER RIVERS,,800,The Paz River separates Guatemala & El Salvador before flowing into this body of water,the Pacific,NA
2020-01-15,DJ,BACKRONYMS,(Alex: These are acronyms where words are chosen to fit the letters.),800,"Named for an anesthesiologist, an Apgar score for newborns measures Appearance, Pulse, Grimace, Activity & this",Respiration,NA
2020-01-15,DJ,U.S. REPRESENTATIVES,,1200,1/53 of California's House Delegation is this Intelligence Committee Chairman,Adam Schiff,http://www.j-archive.com/media/2020-01-15_DJ_27.jpg
2020-01-15,DJ,COMPOSERS,,1200,One of England's most beloved tunes is the one by Hubert Parry named for this faraway Mideast city [Listen.],Jerusalem,NA
2020-01-15,DJ,WHAT TYPE OF MACHINE AM I?,,1200,Germany's U-96,a submarine,NA
2020-01-15,DJ,NETFLIX & CHILL,,1200,"When Netflix rebooted this sci-fi show from 1965, the Robinson family got stuck on an icy planet",Lost in Space,NA
2020-01-15,DJ,BORDER RIVERS,,1200,The Romaine River is a small part of Canada's longest provincial boundary between Quebec and this vast mainland region,Labrador,http://www.j-archive.com/media/2020-01-15_DJ_14a.jpg
2020-01-15,DJ,BACKRONYMS,(Alex: These are acronyms where words are chosen to fit the letters.),1200,"This boy-&-tiger team formed the club called ""Get Rid of Slimy Girls"", using the last letter in ""Girls"" to form the backronym ""GROSS""",Calvin & Hobbes,NA
2020-01-15,NA,NA,NA,NA,NA,NA,NA
2020-01-15,DJ,COMPOSERS,,1600,"In 1893 Ruggero Leoncavallo & this other Italian composer had lunch & discovered both were working on ""La Bohème"" operas",Puccini,NA
2020-01-15,DJ,WHAT TYPE OF MACHINE AM I?,,1600,"Vanguard I, Proba-3",satellites,NA
2020-01-15,DJ,NETFLIX & CHILL,,1600,"In ""Frontier"" this ""Aquaman"" actor gets chilly as ruthless trapper Declan Harp",(Jason) Momoa,NA
2020-01-15,DJ,BORDER RIVERS,,NA,The only river that serves as part of a national border in the Caribbean is the Artibonite River on this island,Hispaniola,NA
2020-01-15,DJ,BACKRONYMS,(Alex: These are acronyms where words are chosen to fit the letters.),1600,"Really, 007--SPECTRE is Special Executive for Counter-Intelligence, Terrorism, Revenge & this blackmail synonym",Extortion,NA
2020-01-15,DJ,U.S. REPRESENTATIVES,,2000,This Louisiana Rep. received a standing ovation in 2017 after returning from injuries received from a gunshot wound,Steve Scalise,NA
2020-01-15,DJ,COMPOSERS,,2000,"Composer Georg Philipp Telemann was godfather to this composing son of J.S. Bach, hence the Philipp in the young Bach's name",Carl Philipp Emanuel Bach,NA
2020-01-15,DJ,WHAT TYPE OF MACHINE AM I?,,2000,Chicago Pile-1,a nuclear reactor,NA
2020-01-15,DJ,NETFLIX & CHILL,,2000,This Netflix show is a chilling reworking of Shirley Jackson's gothic horror tale,The Haunting of Hill House,NA
2020-01-15,DJ,BORDER RIVERS,,2000,"With as many sets of double letters as the Mississippi, this river forms about half the Alabama-Georgia border",the Chattahoochee,http://www.j-archive.com/media/2020-01-15_DJ_20.jpg
2020-01-15,DJ,BACKRONYMS,(Alex: These are acronyms where words are chosen to fit the letters.),2000,"Named for a child kidnapped in 1996, an Amber Alert is short for ""America's Missing: Broadcast"" these 2 words",Emergency Response,NA
2020-01-15,FJ,CHILDREN'S LITERATURE,,NA,Einstein's theory of relativity & Max Planck's quantum theory inspired this book that won a 1963 Newbery Medal,A Wrinkle in Time,NA
