date,round,category,comment,value,clue,response,link
2020-03-04,J,CURRENT SPORTS NICKNAMES,,200,Why so serious? Tennis star Novak Djokovic has this villainous nickname,"""The Joker""",NA
2020-03-04,J,NEGATIVE THOUGHTS,,200,9-letter optimist opposite,pessimist,NA
2020-03-04,J,AMERICA'S RICHEST SELF-MADE WOMEN,(Alex: According to Forbes 2019 list.),200,Meg Whitman's bid for No. 2 on the list started when she made this Internet seller a billion-dollar giant,eBay,NA
2020-03-04,J,HOW DOES YOUR GARDEN GROW?,,200,"My garden grows great because I first consulted the hardiness zone map from this organization, USDA for short",U.S. Department of Agriculture,NA
2020-03-04,J,HELLER,,200,The Supreme Court's decision in the case of D.C. v. Heller used this amendment to strike down a gun control law,the Second Amendment,NA
2020-03-04,J,HIGH WATER,,200,"A lake high on Mount Kenya shares its name with this main character in ""The Lion King""",Simba,NA
2020-03-04,J,CURRENT SPORTS NICKNAMES,,400,Italian soccer star Mario Balotelli might earn this video game nickname from the way he unclogs defenses,"""Super Mario""",NA
2020-03-04,J,NEGATIVE THOUGHTS,,400,"To void or close out, like a network does to a failing TV show",cancel,NA
2020-03-04,J,AMERICA'S RICHEST SELF-MADE WOMEN,(Alex: According to Forbes 2019 list.),400,"Sara Blakely, creator of this shaping undergarment brand, has the ultimate mogul cred--guest shark on ""Shark Tank""",Spanx,NA
2020-03-04,J,HOW DOES YOUR GARDEN GROW?,,400,"A couple of weeks before planting, mix in some of this decaying organic matter from the ""heap"" to help stabilize your soil",compost,NA
2020-03-04,J,HELLER,,400,"At one point both of Nevada's sitting senators, Dean Heller & Harry Reid, belonged to this faith",the LDS faith (Mormon Church),NA
2020-03-04,J,HIGH WATER,,400,"One of the highest rivers in the world, the Yarlung Tsangpo starts in this autonomous region of China",Tibet,NA
2020-03-04,J,CURRENT SPORTS NICKNAMES,,600,"Andy Smith, one of the world's best players at this pub game, is nicknamed ""The Pie Man""",darts,NA
2020-03-04,J,NEGATIVE THOUGHTS,,600,"This presidential option is Latin for ""I forbid""",veto,NA
2020-03-04,J,AMERICA'S RICHEST SELF-MADE WOMEN,(Alex: According to Forbes 2019 list.),NA,Pleasant Rowland started this historical brand when she couldn't find suitable dolls for her nieces,American Girl,NA
2020-03-04,J,HOW DOES YOUR GARDEN GROW?,,600,"It pretty much grows whatever I do, as I planted this almost full-proof herb that aromatic and tasty in tea",mint,http://www.j-archive.com/media/2020-03-04_J_07a.jpg
2020-03-04,J,HELLER,,600,"Paul Giamatti played Jerry Heller, manager of rap group NWA, in this 2015 film",Straight Outta Compton,NA
2020-03-04,J,HIGH WATER,,600,"Scuba diving in lakes at high altitudes is more dangerous, as this 5-letter decompression sickness is worse",the bends,NA
2020-03-04,J,CURRENT SPORTS NICKNAMES,,800,The NFL's Tyrann Mathieu doesn't care if you don't know his nickname is this species of fearless carnivore of the weasel family,a honey badger,http://www.j-archive.com/media/2020-03-04_J_21.jpg
2020-03-04,J,NEGATIVE THOUGHTS,,800,"Juliet tells Romeo, ""Deny thy father and"" this ""thy name""",refuse,NA
2020-03-04,J,AMERICA'S RICHEST SELF-MADE WOMEN,(Alex: According to Forbes 2019 list.),800,"Billionaires Kathy Fields & Katie Rodan created this ""forward"" -thinking acne treatment brand often seen on late night TV",Proactiv,NA
2020-03-04,J,HOW DOES YOUR GARDEN GROW?,,800,"Diatomaceous earth is great as one of these, as it damages the cuticles & joints of the invaders",a pesticide (insecticide),NA
2020-03-04,J,HELLER,,800,Want your very own Frank Lloyd Wright home? The Heller house in this city's Hyde Park area was offered for sale for $2.2 million,Chicago,NA
2020-03-04,J,HIGH WATER,,800,A 425-mile river originating in Idaho's Sawtooth mountains is named for this fish known for its upriver journeys,the salmon,NA
2020-03-04,J,CURRENT SPORTS NICKNAMES,,1000,Joel Embiid in 2019 won the trademark for this nickname of his that also describes the 76ers' strategy of improving the team,"""The Process""",NA
2020-03-04,J,NEGATIVE THOUGHTS,,1000,"To disclaim: on ""Mission: Impossible"", ""the secretary will"" do this regarding ""any knowledge of your actions""",disavow,NA
2020-03-04,J,AMERICA'S RICHEST SELF-MADE WOMEN,(Alex: According to Forbes 2019 list.),1000,Part of this author's nearly $400 million fortune came from books she wrote under the J.D. Robb pseudonym,Nora Roberts,NA
2020-03-04,J,HOW DOES YOUR GARDEN GROW?,,1000,"(Sarah of the Clue Crew demonstrate a gardening technique.) To speed this process by which by seeds begin to sprout, rub them on sandpaper in a technique called scarification",germination,http://www.j-archive.com/media/2020-03-04_J_12.mp4
2020-03-04,J,HELLER,,1000,"Like his character Yossarian, ""Catch-22"" author Joseph Heller was this 10-letter type of airman who must be on target",a bombardier,NA
2020-03-04,J,HIGH WATER,,1000,Tradition says that Zoroaster meditated for years at the lake at the summit of Mount Sabalan in this country,Iran,NA
2020-03-04,DJ,THE JEFFERSONIAN ERA,,400,This addition to the nation during Jefferson's tenure included land that would end up being part of 15 states,the Louisiana Purchase,NA
2020-03-04,DJ,FROM SNL TO THE MOVIES,,400,"Alice Cooper breaks down the etymology of ""Milwaukee"" to Mike Myers in this 1992 film",Wayne\'s World,NA
2020-03-04,DJ,SCIENCE,,400,"Some people seem to learn by this process, the flow of a solvent through a semipermeable membrane",osmosis,NA
2020-03-04,DJ,ANCIENT GREEK & ROMAN ARCHITECTURE,,400,"In July & August in ancient Rome, a piscina, one of these, might have proved quite popular",a pool,NA
2020-03-04,DJ,FILL IN THE TONY-WINNING PLAY TITLE,,400,"2018: ""Harry Potter and the ___ ___ , Parts One and Two""","""the Cursed Child""",NA
2020-03-04,DJ,"GIVING OUT ""IOUS""",,400,Able to live both on land & under water,amphibious,NA
2020-03-04,DJ,THE JEFFERSONIAN ERA,,800,"In his 1801 inaugural address, Jefferson tried to mend fences between his Democratic-Republicans & this political party",the Federalists,NA
2020-03-04,DJ,FROM SNL TO THE MOVIES,,800,"""Use of unnecessary violence in the apprehension of"" this 1980 musical title duo ""has been approved""",The Blues Brothers,NA
2020-03-04,DJ,SCIENCE,,800,"This neurotransmitter is the second ""S"" in the class of drugs known as SSRIs",serotonin,NA
2020-03-04,DJ,ANCIENT GREEK & ROMAN ARCHITECTURE,,800,"In ancient Greece, an agalma was a work of art dedicated to one of these",a god,NA
2020-03-04,NA,NA,NA,NA,NA,NA,NA
2020-03-04,DJ,"GIVING OUT ""IOUS""",,800,"""V"" know it precedes ""reader"" in being eager to devour the contents of many books",voracious,NA
2020-03-04,DJ,THE JEFFERSONIAN ERA,,1200,"Predicting an eclipse & decrying the white man's ways, Tenskwatawa was dubbed the Shawnee this",prophet,NA
2020-03-04,DJ,FROM SNL TO THE MOVIES,,1200,"10 seconds, contestants! Will Forte tries to defuse a nuclear warhead as this 2010 title guy",MacGruber,NA
2020-03-04,DJ,SCIENCE,,NA,It's the point in the orbit of the Moon when it is farthest from the Earth,apogee (*apex),NA
2020-03-04,DJ,ANCIENT GREEK & ROMAN ARCHITECTURE,,1200,The Library of Celsus at Ephesus had three big windows to let light into this alliterative space that the British Museum also has,a reading room,http://www.j-archive.com/media/2020-03-04_DJ_23a.jpg
2020-03-04,NA,NA,NA,NA,NA,NA,NA
2020-03-04,DJ,"GIVING OUT ""IOUS""",,1200,"In legal speak, it describes wanton or vicious intent",malicious,NA
2020-03-04,DJ,THE JEFFERSONIAN ERA,,1600,The doctrine of judicial review was established in 1803 by the historic Supreme Court him v. him,Marbury v. Madison,NA
2020-03-04,DJ,FROM SNL TO THE MOVIES,,1600,Dan Aykroyd wants a green card in this 1993 film (but he's not really from France),Coneheads,NA
2020-03-04,DJ,SCIENCE,,1600,"The stamen, the male reproductive organ of a flowering plant, produces pollen in this terminal structure of sacs",the anther,NA
2020-03-04,DJ,ANCIENT GREEK & ROMAN ARCHITECTURE,,1600,"From words meaning ""city of the dead"", it was a large cemetery in ancient Greece",Necropolis,NA
2020-03-04,NA,NA,NA,NA,NA,NA,NA
2020-03-04,DJ,"GIVING OUT ""IOUS""",,1600,"Stevie Wonder sang, ""very"" this, ""ladder's 'bout to fall""; now touch your nose for luck",superstitious,NA
2020-03-04,DJ,THE JEFFERSONIAN ERA,,2000,"In the 1806 edition of his bio of George Washington, this author included the fictional tale of young George & the cherry tree",Parson Weems,NA
2020-03-04,DJ,FROM SNL TO THE MOVIES,,2000,"In a trailer for a 1995 movie as Stuart Smalley, he said, ""My father grew up in the Great Depression... his mother's""",(former Senator) Al Franken,NA
2020-03-04,DJ,SCIENCE,,2000,F can stand for this unit of electrical capacitance,a farad,NA
2020-03-04,DJ,ANCIENT GREEK & ROMAN ARCHITECTURE,,NA,"Similar to a Roman circus, this was an ancient Greek racecourse for horses & chariots",a hippodrome,NA
2020-03-04,NA,NA,NA,NA,NA,NA,NA
2020-03-04,DJ,"GIVING OUT ""IOUS""",,2000,This adjective means incorrect & is more specifically applied to logic with faulty reasoning,fallacious,NA
2020-03-04,FJ,20th CENTURY ARTISTS,,NA,"This artist who lived from 1904 to 1989 had a first name that means ""savior"" in Spanish",(Salvador) Dali,NA
