date,round,category,comment,value,clue,response,link
2020-03-11,J,PUT THAT SINGER'S NAME ON A POST OFFICE!,,200,"This pianist may have had ""Georgia On My Mind"" but the post office named for him is in Los Angeles",(Ray) Charles,NA
2020-03-11,J,HOME DECOR BASICS,,200,"Mix a batch of this 50% lighter than the original, another batch 150% darker--& voila! colors that complement each other",paint,NA
2020-03-11,J,PUNNY JOB LOSS REASONS,,200,"My wife tried to get ahead in eyeglass manufacturing, but failed impressively by ""making"" this ""of herself""",a spectacle,NA
2020-03-11,J,THEIR FINAL NOVEL,(Alex: You have to identify the author for us.),200,"""The Mystery of Edwin Drood""",(Charles) Dickens,NA
2020-03-11,J,GOLD RUSH,,200,This flour brand is named for the top prize that it won at an 1880 exhibition,Gold Medal,NA
2020-03-11,J,REQUIEM FOR A SKYLINE,,200,"In November of 1972, the Kingdome was dedicated in this West Coast city. In March 2000, the Kingdome was demolished in this West Coast city",Seattle,http://www.j-archive.com/media/2020-03-11_J_01a.jpg
2020-03-11,J,PUT THAT SINGER'S NAME ON A POST OFFICE!,,400,"It's not New York, New York but Hoboken, Hoboken that has a P.O. named for this native son & crooning legend",Sinatra,NA
2020-03-11,J,HOME DECOR BASICS,,400,"Associated with the decor of recent college grads, it's a Japanese-style filled mattress used for seating or as a bed",a futon,NA
2020-03-11,J,PUNNY JOB LOSS REASONS,,400,"My cousin wanted to become a hairstylist, but didn't have the skill; she just couldn't do this 2-word idiom",cut it,NA
2020-03-11,J,THEIR FINAL NOVEL,(Alex: You have to identify the author for us.),400,"""Jude the Obscure""",(Thomas) Hardy,NA
2020-03-11,J,GOLD RUSH,,400,"The AKC says this ""is an exceptionally intelligent breed"" & boasted ""the first three dogs to earn AKC Obedience Champion titles""",a golden retriever,NA
2020-03-11,J,REQUIEM FOR A SKYLINE,,400,"In 1978, New Jersey's Marlborough-Blenheim Hotel got checked out to make way for a casino in this city",Atlantic City,http://www.j-archive.com/media/2020-03-11_J_02.jpg
2020-03-11,J,PUT THAT SINGER'S NAME ON A POST OFFICE!,,600,Buck Owens got P.O.ed in 2007 after 17 years hosting this country music show in which an animated donkey brayed the title,Hee Haw,NA
2020-03-11,J,HOME DECOR BASICS,,600,"A recess in a wall often used to display sculpture, the term can also be used for the role an animal plays in nature",a niche,NA
2020-03-11,J,PUNNY JOB LOSS REASONS,,600,"My dad worked for the IRS for a while, but his nerves became shot--the job was ""too"" this 6-letter word",taxing,NA
2020-03-11,J,THEIR FINAL NOVEL,(Alex: You have to identify the author for us.),600,"""Lady Chatterley's Lover""",Lawrence,NA
2020-03-11,J,GOLD RUSH,,600,"The Ohio River begins at the western tip of the ""Golden Triangle"" in this city",Pittsburgh,NA
2020-03-11,J,REQUIEM FOR A SKYLINE,,600,Sunset Boulevard isn't the same since the bulldozer came for the home and playground of many movie stars called the Garden of this,the Garden of Allah,http://www.j-archive.com/media/2020-03-11_J_03.jpg
2020-03-11,NA,NA,NA,NA,NA,NA,NA
2020-03-11,J,HOME DECOR BASICS,,800,Fit the houseplant to the room: the peace lily is suggested for the laundry room as it takes spores of this out of the air,mold,NA
2020-03-11,J,PUNNY JOB LOSS REASONS,,800,"My granddad quit dentistry because he said going to the office was ""like"" this excruciating 2-word idiom",pulling teeth,NA
2020-03-11,J,THEIR FINAL NOVEL,(Alex: You have to identify the author for us.),800,"""Hornblower During the Crisis""",Forester,NA
2020-03-11,J,GOLD RUSH,,800,"Oil is also known by this ""colorful"" 2-word phrase, followed by ""Texas tea"" in an old sitcom theme",black gold,NA
2020-03-11,J,REQUIEM FOR A SKYLINE,,NA,"Northwestern University's old Prentice Women's Hospital, an example of Brutalist architecture, was demoed in 2013-2014 in this big city",Chicago,http://www.j-archive.com/media/2020-03-11_J_04.jpg
2020-03-11,NA,NA,NA,NA,NA,NA,NA
2020-03-11,J,HOME DECOR BASICS,,1000,"The spiraling design known as this work seen here on a wall adds elegance to furniture, too",scrollwork,http://www.j-archive.com/media/2020-03-11_J_26a.jpg
2020-03-11,NA,NA,NA,NA,NA,NA,NA
2020-03-11,J,THEIR FINAL NOVEL,(Alex: You have to identify the author for us.),1000,"""You Can't Go Home Again""",Thomas Wolfe,NA
2020-03-11,J,GOLD RUSH,,1000,These 3 stone-cold sisters of Greek myth who were less than photogenic had bronze hands & golden wings,the Gorgons,NA
2020-03-11,J,REQUIEM FOR A SKYLINE,,1000,"Demolished in 1999, the Jorba Labs near Madrid was often called this general 6-letter term for a sacred building in China",a pagoda,http://www.j-archive.com/media/2020-03-11_J_05.jpg
2020-03-11,DJ,NAME THAT INSECT,,400,"Poets write of the evening ""song"" of this grasshopper relative, as in Archibald Lampman's ""The homely"" this ""gossips at my feet""",a cricket,NA
2020-03-11,DJ,A YEAR ENDING IN 0,,400,It was the first full year of the Great Depression,1930,NA
2020-03-11,DJ,ISLAND NATIONS,,400,"Called ""the fairest isle that eyes have beheld"" by Columbus, this island nation is the birthplace of Usain Bolt",Jamaica,NA
2020-03-11,DJ,FOE PAs,,400,"In a 1980 sequel this bad guy cuts off his son's hand & then says, ""I am your father""",Darth Vader,NA
2020-03-11,DJ,PEOPLE,,400,She was Columbia Law School's first female tenured professor & the Supreme Court's second female justice,Ginsburg,NA
2020-03-11,DJ,SHOULD BE IN THE FOREST,"(Alex: Each response will end with ""T-R-Y"", but will sound like ""tree"".)",400,Quality attributed to a perfectly proportioned face,symmetry,NA
2020-03-11,DJ,NAME THAT INSECT,,800,"In French this insect is a ""coccinelle"" & usually rouge avec points noirs (red with black spots)",a ladybug,NA
2020-03-11,DJ,A YEAR ENDING IN 0,,800,The Boston Massacre left 5 dead & several injured,1770,NA
2020-03-11,DJ,ISLAND NATIONS,,800,The flag of Barbados features the trident of this sea god on a yellow stripe representing the country's beaches,Neptune,NA
2020-03-11,DJ,FOE PAs,,800,"In ""The Great Santini"", this Oscar winner plays a macho dad who menaces his family",Robert Duvall,NA
2020-03-11,DJ,PEOPLE,,800,"This Facebook bigwig wrote ""Option B"" about life after the sudden death of her husband",(Sheryl) Sandberg,NA
2020-03-11,DJ,SHOULD BE IN THE FOREST,"(Alex: Each response will end with ""T-R-Y"", but will sound like ""tree"".)",800,"""Follow Me!"" is a motto of this part of the army that fights on foot",the infantry,NA
2020-03-11,DJ,NAME THAT INSECT,,1200,One variety of this insect from Australia can grow up to 2 feet long,a stick bug,http://www.j-archive.com/media/2020-03-11_DJ_28.jpg
2020-03-11,DJ,A YEAR ENDING IN 0,,NA,The Environmental Protection agency was established,1970,NA
2020-03-11,DJ,ISLAND NATIONS,,1200,"Animals unique to Madagascar include lemurs, tenrecs, and certain species of these reptiles",chameleons,http://www.j-archive.com/media/2020-03-11_DJ_15.jpg
2020-03-11,DJ,FOE PAs,,1200,"In a Wes Anderson movie, it's the last name of Royal, whose brilliant kids have major daddy issues",Tenenbaum,NA
2020-03-11,DJ,PEOPLE,,1200,"(Alex Trebek presents from the Harvard Lampoon Building in Cambridge, Massachusetts.) As editor of the ""Harvard Lampoon"" in the 1970s he had the last word; today he hosts ""The Last Word"" on MSNBC",Lawrence O\'Donnell,http://www.j-archive.com/media/2020-03-11_DJ_08a.jpg
2020-03-11,DJ,SHOULD BE IN THE FOREST,"(Alex: Each response will end with ""T-R-Y"", but will sound like ""tree"".)",1200,The Ten Commandments warn against this type of worship,idolatry,NA
2020-03-11,NA,NA,NA,NA,NA,NA,NA
2020-03-11,DJ,A YEAR ENDING IN 0,,1600,Rome hosted the Summer Olympics,1960,NA
2020-03-11,DJ,ISLAND NATIONS,,NA,Religion is important in Tonga; around 1/3 of the population is of this Christian denomination they call Free Wesleyan,Methodist,NA
2020-03-11,DJ,FOE PAs,,1600,The Overlook Hotel was the site where this actor murderously chased his son around a snowy maze in a 1980 movie,Jack Nicholson,NA
2020-03-11,DJ,PEOPLE,,1600,Katia Beauchamp & Hayley Barna are the co-founders of this monthly beauty subscription service,Birchbox,NA
2020-03-11,DJ,SHOULD BE IN THE FOREST,"(Alex: Each response will end with ""T-R-Y"", but will sound like ""tree"".)",1600,"Completely insufficient, as in a meager sum",paltry,NA
2020-03-11,NA,NA,NA,NA,NA,NA,NA
2020-03-11,DJ,A YEAR ENDING IN 0,,2000,"19 years after his death, Napoleon's remains were returned to France where he was given a state funeral & a new resting place",1840,NA
2020-03-11,DJ,ISLAND NATIONS,,2000,"The red & white of its flag are the colors of the Knights of St. John of Jerusalem, who ruled this country from 1530 to 1798",Malta,NA
2020-03-11,DJ,FOE PAs,,2000,"In this spoof of music biopics, John C. Reilly as Dewey Cox is repeatedly told by his father, ""The wrong kid died!""",Walk Hard,NA
2020-03-11,DJ,PEOPLE,,2000,"This Brit, seen here, invented a little thing called the World Wide Web",Tim Berners-Lee,http://www.j-archive.com/media/2020-03-11_DJ_10.jpg
2020-03-11,DJ,SHOULD BE IN THE FOREST,"(Alex: Each response will end with ""T-R-Y"", but will sound like ""tree"".)",2000,"6 functions of an angle, including sine & cosine, are used in this branch of math",trigonometry,NA
2020-03-11,FJ,BOOK WORDS,,NA,"A 1964 essay coined this 2-word term for ""artistically serious"" comic books & endorsed it over ""illustories"" & ""picto-fiction""",graphic novels,NA
