date,round,category,comment,value,clue,response,link
2005-12-12,J,THE HISTORY OF FLIGHT,,200,In the 1890s Germany's Otto Lilienthal piloted several successful flights in these engineless planes,gliders,NA
2005-12-12,J,TV THEME SONG ENDINGS,(Alex: I'll give you the lyrics.  You have to identify the program for us.),200,"""You're gonna make it after all""",The Mary Tyler Moore Show,NA
2005-12-12,J,INTERNATIONAL DATE LINES,,200,"""Puedo comprarle una bebida"" is Spanish for this happy hour question",Can I buy you a drink?,NA
2005-12-12,J,SIGNS & SYMBOLS,,200,"A symbol of blood, it's ""the blood of the grape""",wine,NA
2005-12-12,J,GETTING HUNGARY?,,200,"Called the ""Queen of the Danube"", this city is home to about one-fifth of the country's population",Budapest,NA
2005-12-12,J,TIME TO EAT,,200,"From the Italian for ""cord"", it's long thin strands of pasta",spaghetti,NA
2005-12-12,J,THE HISTORY OF FLIGHT,,400,In 1903 Samuel Langley attempted to fly an engine-powered plane launched from a houseboat on this D.C. river,the Potomac River,NA
2005-12-12,J,TV THEME SONG ENDINGS,(Alex: I'll give you the lyrics.  You have to identify the program for us.),400,"""Watch out for that tree!""",George of the Jungle,NA
2005-12-12,J,INTERNATIONAL DATE LINES,,400,"In Russian it's ""Ya tebya lyublyu""",I love you,NA
2005-12-12,J,SIGNS & SYMBOLS,,400,"(Kelly of the Clue Crew points to some horizontal line figures on a monitor.)  In the ancient Asian divination system called this, solid & broken lines represent male & femaleness",I Ching,http://www.j-archive.com/media/2005-12-12_J_17.jpg
2005-12-12,J,GETTING HUNGARY?,,400,More than two-thirds of Hungarians are of this Christian denomination,Roman Catholic,NA
2005-12-12,J,TIME TO EAT,,400,"It's the brand of hot dog that ""kids love to bite""",Armour hot dogs,NA
2005-12-12,J,THE HISTORY OF FLIGHT,,600,"On May 6, 1937 Herb Morrison described its demise on the radio saying, ""It's burning, bursting into flames""",the Hindenburg,NA
2005-12-12,J,TV THEME SONG ENDINGS,(Alex: I'll give you the lyrics.  You have to identify the program for us.),600,"""Those were the days""",All in the Family,NA
2005-12-12,J,INTERNATIONAL DATE LINES,,600,"Lines like ""Posso leva-la a casa"", ""May I see you home"", show why Portuguese is this type of Latin-derived language",a Romance language,NA
2005-12-12,J,SIGNS & SYMBOLS,,600,"The wheel, a symbol of this religion, is often depicted with 8 spokes to represent the Eightfold Path",Buddhism,NA
2005-12-12,J,GETTING HUNGARY?,,600,"When it was known as Pannonia, Hungary was incorporated into this empire around 14 A.D.",the Roman Empire,NA
2005-12-12,J,TIME TO EAT,,600,This protein-rich Middle Eastern dish is deep-fried chickpea patties & tahini wrapped in flat bread,falafel,NA
2005-12-12,J,THE HISTORY OF FLIGHT,,800,In 1919 Alcock & Brown made the first nonstop transatlantic flight: St. John's in this province to Ireland,Newfoundland,NA
2005-12-12,J,TV THEME SONG ENDINGS,(Alex: I'll give you the lyrics.  You have to identify the program for us.),800,"""We finally got a piece of the pie""",The Jeffersons,NA
2005-12-12,J,INTERNATIONAL DATE LINES,,800,"Continues Labelle's sexy French invitation, ""Voulez-vous...""",coucher avec moi,NA
2005-12-12,J,SIGNS & SYMBOLS,,NA,One of the 2 back-to-back zodiac signs whose standard symbols usually include an arrow point,Sagittarius (or Scorpio),NA
2005-12-12,J,GETTING HUNGARY?,,800,"In March of 1867, Hungary was joined with this country in a dual monarchy",Austria,NA
2005-12-12,J,TIME TO EAT,,800,The Chicken Po'boy & the Catfish Po'boy are culinary highlights of this fried-chicken chain,Popeyes,NA
2005-12-12,J,THE HISTORY OF FLIGHT,,1000,"In 1943 Clarence Johnson founded this ""stinky"" research arm of Lockheed that produced the F-117A Nighthawk",the Skunk Works,NA
2005-12-12,J,TV THEME SONG ENDINGS,(Alex: I'll give you the lyrics.  You have to identify the program for us.),1000,"""We'll have a gay old time""",The Flintstones,NA
2005-12-12,J,INTERNATIONAL DATE LINES,,1000,"In a German goodbye, it follows ""Auf""; to say ""Can we see each other again"", it follows ""Konnen wir uns""",wiedersehen,NA
2005-12-12,J,SIGNS & SYMBOLS,,1000,Both the staff of Asclepius & this staff of Mercury feature snakes & are symbols of the medical profession,the Caduceus,NA
2005-12-12,J,GETTING HUNGARY?,,1000,A devastating invasion by these Asian warriors in 1241 killed half of Hungary's population,the Mongols,NA
2005-12-12,J,TIME TO EAT,,1000,"Latvian food favorites include unpasteurized beer, herbed potatoes & these long thin fish of the order Apodes",eels,NA
2005-12-12,DJ,MYTHOLOGY,,400,This creature who had the head & wings of an eagle & the body of a lion guarded the Scythians' gold,a griffin,NA
2005-12-12,DJ,ACTORS' ALMA MATERS,,400,"A 1928 graduate of Bryn Mawr, she won her first acting Oscar in 1934",Katharine Hepburn,NA
2005-12-12,DJ,MEN OF RELIGION,,400,"Despite the Edict of Worms, he translated the Bible into German in secret in 1522",Luther,NA
2005-12-12,DJ,HEAD GEAR,,400,"In 1866 this company introduced its ""hat of the west"" also called ""boss of the plains""",Stetson,NA
2005-12-12,DJ,FOR THE BIRDS,,400,"This bird's name can also mean ""to swindle"" & it's found in an ancient board game",rook,NA
2005-12-12,DJ,"""U"" KNOW YOU KNOW",,400,"To avoid bad luck, don't open one of these indoors",an umbrella,NA
2005-12-12,DJ,MYTHOLOGY,,800,Norse name of the dragon slayer called Siegried by the Germans,Sigurd,NA
2005-12-12,DJ,ACTORS' ALMA MATERS,,800,"An Oscar winner for 1940, he's seen here playing his accordion on stage at Princeton in the 1930s",Jimmy Stewart,http://www.j-archive.com/media/2005-12-12_DJ_02a.jpg
2005-12-12,DJ,MEN OF RELIGION,,800,"Because of his Svengali-like control over the Czarina, this ""Mad Monk"" was murdered in 1916",Rasputin,NA
2005-12-12,DJ,HEAD GEAR,,800,"The name of this jeweled coronet worn by princesses is from the Greek for ""turban""",tiara,NA
2005-12-12,DJ,FOR THE BIRDS,,800,"The greater & lesser scaups, unlike the gadwall, are types of these birds that are divers, not dabblers",ducks,NA
2005-12-12,DJ,"""U"" KNOW YOU KNOW",,800,To be moved to first class on an airplane when your original seat was in coach,upgrade,NA
2005-12-12,DJ,MYTHOLOGY,,1200,This trickster accompanied Thor to retrieve Thor's hammer from the giant Thrym,Loki,NA
2005-12-12,DJ,ACTORS' ALMA MATERS,,1200,In the 1950s Jane Fonda attended this New York women's college,Vassar,NA
2005-12-12,DJ,MEN OF RELIGION,,NA,A river linking the Great Lakes & the Atlantic Ocean bears the name of this saint who was martyred by the Romans in 258,St. Lawrence,NA
2005-12-12,DJ,HEAD GEAR,,1200,"It precedes ""rag"" in a term for a scarf or kerchief tied to cover the head",dew,NA
2005-12-12,DJ,FOR THE BIRDS,,NA,The Athene genus of this bird contains 4 species,the owl,NA
2005-12-12,DJ,"""U"" KNOW YOU KNOW",,1200,"It can mean a mischievous child, a hedgehog or a sea creature",an urchin,NA
2005-12-12,DJ,MYTHOLOGY,,1600,"Common group name for Alcyone, Sterope, Celaeno, Electra, Maia, Merope & Taygete",the Pleiades,NA
2005-12-12,DJ,ACTORS' ALMA MATERS,,1600,"Jennifer Jones, Charlton Heston & Patricia Neal all studied at this Illinois university founded in 1851",Northwestern,NA
2005-12-12,DJ,MEN OF RELIGION,,1600,"Knights in the service of Henry II killed this ""troublesome priest"" in 1170 after he refused to obey the king",Becket,NA
2005-12-12,DJ,HEAD GEAR,,1600,"His hat came up in the 1888 pres. campaign of his grandson (some said it fit, some said it was too big)",William Henry Harrison,NA
2005-12-12,DJ,FOR THE BIRDS,,1600,"This ""ruffed"" state bird of Penn. is famous for the drumming sound its wings make when proclaiming its territory",a grouse,NA
2005-12-12,DJ,"""U"" KNOW YOU KNOW",,1600,This vehicle popular with jugglers was developed from the penny-farthing,a unicycle,NA
2005-12-12,DJ,MYTHOLOGY,,2000,Zeus was enamored of this young prince whom he carried off to Olympus to be the cupbearer to the gods,Ganymede,NA
2005-12-12,DJ,ACTORS' ALMA MATERS,,2000,"20 years after attending Gonzaga University in Spokane, Washington, he won an Oscar in 1945",Bing Crosby,NA
2005-12-12,DJ,MEN OF RELIGION,,2000,"By his own account, this notorious Khmer Rouge leader spent 2 years as a Buddhist monk",Pol Pot,NA
2005-12-12,DJ,HEAD GEAR,,2000,"While Prince of Wales, Edward VII vistied this German spa town & brought back a hat",Homburg,NA
2005-12-12,DJ,FOR THE BIRDS,,2000,"This birds, of which the ""great"" one is extinct, are considered the N. hemisphere's counterpart to penguins",auks,NA
2005-12-12,DJ,"""U"" KNOW YOU KNOW",,2000,It's the nation highlighted here,Uganda,http://www.j-archive.com/media/2005-12-12_DJ_19.jpg
2005-12-12,FJ,19th CENTURY LIT,,NA,"This work says, ""Man is not truly one, but truly two...  I learned to recognize the... primitive duality of man""",Dr. Jekyll and Mr. Hyde,NA
