date,round,category,comment,value,clue,response,link
1992-02-28,J,STATE CAPITALS,,100,The U.S. mint in this Rocky Mountain capital is the USA's second-biggest gold depository,Denver,NA
1992-02-28,J,SEWING,,100,This cuplike cover protects your finger when you want to push a needle through material,a thimble,NA
1992-02-28,J,STAR TREK: TNG,,100,"Sarek, an ambassador from this planet, has appeared in both the old & new series",Vulcan,NA
1992-02-28,J,WEATHER,,100,The primary one of these is caused by 2 refractions & 1 reflection of light by each raindrop,a rainbow,NA
1992-02-28,J,WEIGHTS & MEASURES,,100,There are this many items in a score,20,NA
1992-02-28,J,ANIMAL PHRASES,,100,"Someone's breaking point is often referred to as ""the straw that broke"" this animal's ""back""",the camel,NA
1992-02-28,J,STATE CAPITALS,,200,The fort of pioneer settler John A. Sutter has been restored in this capital city,Sacramento,NA
1992-02-28,J,SEWING,,200,"The ""running"" one of these is the most basic; it's used for gathering",a stitch,NA
1992-02-28,J,STAR TREK: TNG,,200,"Middle name of Eugene (Yes, it's Eugene) Roddenberry of 1st name of Wil Wheaton's character",Wesley,NA
1992-02-28,J,WEATHER,,200,It's a glass tube in which a column of mercury changes height with changes in temperature,a thermometer,NA
1992-02-28,J,WEIGHTS & MEASURES,,200,This metric unit of distance is sometimes called a klick,a kilometer,NA
1992-02-28,J,ANIMAL PHRASES,,200,"To something quickly is to do it in ""two shakes of"" this young animal's tail",a lamb,NA
1992-02-28,J,STATE CAPITALS,,300,This Iowa capital is headquarters to more than 50 insurance companies,Des Moines,NA
1992-02-28,J,SEWING,,300,These come in envelopes that contain pieces of paper shaped like sections of a garment,patterns,NA
1992-02-28,J,STAR TREK: TNG,,300,"An associate artist of the Royal Shakespeare Company, he plays Captain Jean-Luc Picard",Patrick Stewart,NA
1992-02-28,J,WEATHER,,300,"""Absolute"" this is the term for the amount of moisture in the air",humidity,NA
1992-02-28,J,WEIGHTS & MEASURES,,300,This unit of measurement is equal to .083 feet,an inch,NA
1992-02-28,J,ANIMAL PHRASES,,300,"To look guilty but smug is to ""Look like the cat that ate"" this",the canary,NA
1992-02-28,J,STATE CAPITALS,,400,The Country Music Hall of Fame & Museum is located in this capital,Nashville,NA
1992-02-28,J,SEWING,,400,"When the ""invisible"" type of this fastener is closed, the teeth are concealed",a zipper,NA
1992-02-28,J,STAR TREK: TNG,,400,This facility aboard the Enterprise can recreate Victorian London or alien planets,the holodeck,NA
1992-02-28,J,WEATHER,,400,"On the Earth, Cu is copper; in the sky, Cu is this type of cloud",cumulus,NA
1992-02-28,J,WEIGHTS & MEASURES,,400,There are 16 tablespoons in one of these,a cup,NA
1992-02-28,J,ANIMAL PHRASES,,400,"One who's clever in a sneaky sort of way is ""Crazy like"" this animal",a fox,NA
1992-02-28,J,STATE CAPITALS,,NA,This capital was named for a British city on the English Channel,"Dover, Delaware",NA
1992-02-28,J,SEWING,,500,Skirtmarkers are used to mark these lines,hemlines,NA
1992-02-28,J,STAR TREK: TNG,,500,"When the current Enterprise met a previous Enterprise in a time rift, she returned to play Tasha Yar",Denise Crosby,NA
1992-02-28,J,WEATHER,,500,More common name for the tropical easterlies,the trade winds,NA
1992-02-28,J,WEIGHTS & MEASURES,,500,"The name of this system of weights & measures comes from Old French meaning ""goods of weight""",avoirdupois,NA
1992-02-28,J,ANIMAL PHRASES,,500,"To be unusually brave is ""To beard"" this animal ""in his den""",the lion,NA
1992-02-28,DJ,19TH CENTURY AMERICA,,200,"William Gillette's plays ""Held by the Enemy"" & ""Secret Service"" were set in this war",the Civil War,NA
1992-02-28,DJ,ASTROLOGY,,200,"As you might expect, the name of this sign means ""bull"" in Latin",Taurus,NA
1992-02-28,DJ,POETS,,200,"""Poems, Chiefly in the Scottish Dialect"" was his first published collection of poems",Robert Burns,NA
1992-02-28,DJ,WORLD GEOGRAPHY,,200,"It's also the capital of Cape Province, South Africa",Cape Town,NA
1992-02-28,DJ,LIBRARIES,,200,"Appropriately, the National Library of Medicine is in this state abbreviated Md.",Maryland,NA
1992-02-28,DJ,LETTER PERFECT,,200,"It precedes ray, rated & marks the spot",X,NA
1992-02-28,DJ,19TH CENTURY AMERICA,,400,"After the Spanish-American war, the U.S. paid Spain $20 million for this Pacific island group",the Philippines,NA
1992-02-28,DJ,ASTROLOGY,,400,"Green is a harmonious color for people born under this sign; wearing it might make them less ""crab""by",Cancer,NA
1992-02-28,DJ,POETS,,400,"Years before his 1st volume of poetry was published in 1913, he was a chicken farmer in Derry, N.H.",Robert Frost,NA
1992-02-28,DJ,WORLD GEOGRAPHY,,400,"Among this country's 9 provinces are Liege, Luxembourg & Antwerp",Belgium,NA
1992-02-28,DJ,LIBRARIES,,400,The Folger Shakespeare Library is on this famous hill,Capitol Hill,NA
1992-02-28,DJ,LETTER PERFECT,,400,"Something done to perfect exactness is said to be ""Done to a"" this",T,NA
1992-02-28,DJ,19TH CENTURY AMERICA,,600,"On May 10,1876 the Centennial Exposition opened in Fairmount Park in this Pennsylvania city",Philadelphia,NA
1992-02-28,DJ,ASTROLOGY,,600,It's the only sign symbolized by a cat,Leo,NA
1992-02-28,DJ,POETS,,600,"Poet & Lincoln biographer who wrote about Lincoln's death in ""Cool Tombs""",Sandburg,NA
1992-02-28,DJ,WORLD GEOGRAPHY,,600,"This country's Great Victoria Desert was first crossed in 1875 by Ernest Giles, who named it",Australia,NA
1992-02-28,DJ,LIBRARIES,,600,"George Bush selected this univ. in College Station, Texas as the site of his presidential library",Texas A&M,NA
1992-02-28,DJ,LETTER PERFECT,,600,"With a line over it, this Roman numeral for 5 turns into 5,000",V,NA
1992-02-28,DJ,19TH CENTURY AMERICA,,NA,In 1852 this party selected General Winfield Scott as its presidential candidate,the Whig Party,NA
1992-02-28,DJ,ASTROLOGY,,800,"Boldness, not sheepishness, is a major characteristic of this sign represented by a ram",Aries,NA
1992-02-28,DJ,POETS,,800,"While England's poet laureate, he wrote ""The Charge of the Light Brigade""",Tennyson,NA
1992-02-28,DJ,WORLD GEOGRAPHY,,800,"At 1550 sq. miles, this country's Lake Nasser is one of the world's largest artificial lakes",Egypt,NA
1992-02-28,DJ,LIBRARIES,,800,"Samuel Pepys left his library to his alma mater, Magdalene College at this university",Cambridge,NA
1992-02-28,DJ,LETTER PERFECT,,800,The only letter not used in spelling any of the 50 states,Q,NA
1992-02-28,DJ,19TH CENTURY AMERICA,,1000,In the War of 1812 the British captured this ship captained by James Lawrence,the Chesapeake,NA
1992-02-28,DJ,ASTROLOGY,,1000,"This sign is connected to the myth of Eros & Aphrodite, who turned into fish to escape a monster",Pisces,NA
1992-02-28,DJ,POETS,,1000,"This Quaker poet's ""Snow-Bound"" tells the story of a family isolated during a blizzard",John Greenleaf Whittier,NA
1992-02-28,DJ,WORLD GEOGRAPHY,,NA,"2 nations occupy this island, the second-largest in the West Indies",Hispaniola,NA
1992-02-28,DJ,LIBRARIES,,1000,"The library of King Ashurbanipal was in Nineveh, the last capital of this empire",the Assyrian,NA
1992-02-28,DJ,LETTER PERFECT,,1000,"With a little circle on top of it, this letter stands for a unit of length for wavelengths of light",A,NA
1992-02-28,FJ,IN THE NEWS,,NA,"In November 1991, 2 people from this country were indicted for the 1988 Pan Am 103 bombing",Libya,NA
