date,round,category,comment,value,clue,response,link
1993-02-18,J,THE 16th CENTURY,,100,This religious movement's name goes back to the fuss they kicked up at the 1529 Diet of Speyer,the Protestants,NA
1993-02-18,J,DISNEYLAND,,100,"The theme song of this ride is ""Yo-Ho, Yo-Ho—A Pirate's Life For Me""",Pirates of the Caribbean,NA
1993-02-18,J,ORGANIZATIONS,,100,Girls 12-14 years of age who belong to this organization are called Cadettes,the Girl Scouts,NA
1993-02-18,J,U.S. CITIES,,100,"It's known as ""The Windy City""",Chicago,NA
1993-02-18,J,COLORS,,100,West point & navy are 2 shades of this color,blue,NA
1993-02-18,J,3-LETTER WORDS,,100,"A style of dance, or something you do with a pencil on a table",tap,NA
1993-02-18,J,THE 16th CENTURY,,200,James Burbage built this famous London theatre in 1599,the Globe,NA
1993-02-18,J,DISNEYLAND,,200,"Those ""dying"" to go through this attraction must do so in a ""Doom Buggy""",the Haunted Mansion,NA
1993-02-18,J,ORGANIZATIONS,,200,VISTA was launched in 1964 as the domestic counterpart of this program,the Peace Corps,NA
1993-02-18,J,U.S. CITIES,,200,"At 630 feet in height, this city's Gateway Arch is the tallest monument in the U.S.",St. Louis,NA
1993-02-18,J,COLORS,,200,"A rich, creamy white hue is named for this prized bony material",ivory,NA
1993-02-18,J,3-LETTER WORDS,,200,"Apply paint with short, poking strokes; just ""a little"" one ""will do ya""",dab,NA
1993-02-18,J,THE 16th CENTURY,,300,"The people of Florence revolted May 17, 1527, driving out this ruling family",the Medici,NA
1993-02-18,J,DISNEYLAND,,300,"The 1st paddle-wheeler built in half a century is the steamboat Mark Twain, found in this ""land""",Frontierland,NA
1993-02-18,J,ORGANIZATIONS,,300,This organization was founded in 1941 to provide American military personnel with social clubs,the USO,NA
1993-02-18,J,U.S. CITIES,,300,"The U.S.S. Constellation, a nat'l historic landmark, is docket at Pier 1 in this Maryland city's harbor",Baltimore,NA
1993-02-18,J,COLORS,,300,It's synonymous with a village or town park,green,NA
1993-02-18,J,3-LETTER WORDS,,300,"In boxing, it's a short, straight blow",a jab,NA
1993-02-18,J,THE 16th CENTURY,,400,Philip II of this country tried to invade England–didn't 'work,Spain,NA
1993-02-18,J,DISNEYLAND,,400,Michael Jackson stars as the commander of a spaceship in this 3-D film featured in Fantasyland,Captain EO,NA
1993-02-18,J,ORGANIZATIONS,,400,In 1990 this organization changed its name back to U.S. Junior Chamber of Commerce,J.C.,NA
1993-02-18,J,U.S. CITIES,,400,This second largest Nevada city was name  for a Union general killed in the Civil War,Reno,NA
1993-02-18,J,COLORS,,400,This reddish-brown color is named for a spice you sometimes sprinkle on your toast,cinnamon,NA
1993-02-18,J,3-LETTER WORDS,,400,"A type of pop music, or to have an informal talk",rap,NA
1993-02-18,J,THE 16th CENTURY,,500,"In 1511, before conquering Mexico, Cortes helped Velasquez conquer this island",Cuba,NA
1993-02-18,J,DISNEYLAND,,500,The voice of Brer Bear on Splash Mountain was provided by the same actor who did it for this 1946 film,Song of the South,NA
1993-02-18,J,ORGANIZATIONS,,500,"The order of de Molay, for young men 13-21, is sponsored by this fraternal organization",the Masons,NA
1993-02-18,J,U.S. CITIES,,NA,The Pacific Science Center in this Northwest city was built for the 1962 world's fair,Seattle,NA
1993-02-18,J,COLORS,,500,"Having the shortest wavelength, it's at one end of the visible spectrum",violet,NA
1993-02-18,J,3-LETTER WORDS,,500,"A light stroke with the open hand, or a way to ""stand""",pat,NA
1993-02-18,DJ,NATURE,,200,This fruit of the oak tree varies in length from less than 1/2 inch to over 2 inches,an acorn,NA
1993-02-18,DJ,CLASSICAL MUSIC,,200,"In 1862 this ""Lullaby"" composer was rejected for a post as conductor in his native Hamburg",(Johannes) Brahms,NA
1993-02-18,DJ,LAW & GOVERNMENT,,200,"Should the president be impeached, this member of the Supreme Court would preside at the trial",the Chief Justice,NA
1993-02-18,DJ,BODIES OF WATER,,200,The Gulf of California is an arm of this ocean,the Pacific,NA
1993-02-18,DJ,NOTABLE WOMEN,,200,Some believe she was on a spy mission for FDR when her plane disappeared in 1937,Amelia Earhart,NA
1993-02-18,DJ,ENGLISH LITERATURE,,200,"This Jonathan Swift satire was 1st titled ""Travels into Several Remote Nations of the World""",Gulliver\'s Travels,NA
1993-02-18,DJ,NATURE,,400,The main purpose of a flower's petals is to attract birds & insects to carry out this process,pollination,NA
1993-02-18,DJ,CLASSICAL MUSIC,,400,"His ""Bolero"" was originally written in 1928 as a ballet",(Maurice) Ravel,NA
1993-02-18,DJ,LAW & GOVERNMENT,,400,In most states you're no longer a minor once you reach this age,18,NA
1993-02-18,DJ,BODIES OF WATER,,400,The Murray River forms much of the border between Victoria & New South Wales in this country,Autralia,NA
1993-02-18,DJ,NOTABLE WOMEN,,400,During WWI this French scientist was rushed to the front lines to X-ray wounded soldiers,Marie Curie,NA
1993-02-18,DJ,ENGLISH LITERATURE,,400,Part of this 1926 A.A. Milne children's book is set in the Hundred Acre Wood,Winnie-the-Pooh,NA
1993-02-18,DJ,NATURE,,600,"Once it closes its leaves, it takes 8 to 10 days for this plant of the Carolinas to digest an insect",the Venus flytrap,NA
1993-02-18,DJ,CLASSICAL MUSIC,,600,"This composer of ""The Four Seasons"" has been accused of writing the same concerto 500 times",Vivaldi,NA
1993-02-18,DJ,LAW & GOVERNMENT,,600,Prior to 1977 this 12-month federal financial period began in July; now it begins in October,the fiscal year,NA
1993-02-18,DJ,BODIES OF WATER,,600,Some believe this sea derives its name from the father of Greek hero Theseus,the Aegean,NA
1993-02-18,DJ,NOTABLE WOMEN,,600,"On one of her last Underground Railroad trips into Maryland, she rescued her own parents",Tubman,NA
1993-02-18,DJ,ENGLISH LITERATURE,,600,"In this Dickens novel, Jack Dawkins is known as the Artful Dodger",Oliver Twist,NA
1993-02-18,DJ,NATURE,,800,"Long-horned grasshoppers, which include katydids, have hearing organs in this unusual place",their leg,NA
1993-02-18,DJ,CLASSICAL MUSIC,,800,"The success of his ""The Marriage of Figaro"" led to a commission for ""Don Giovanni""",Mozart,NA
1993-02-18,DJ,LAW & GOVERNMENT,,800,"Usually a pardon is granted to an individual, while this is granted to a group",an amnesty,NA
1993-02-18,DJ,BODIES OF WATER,,800,It's the largest body of fresh water entirely within the U.S.,Lake Michigan,NA
1993-02-18,DJ,NOTABLE WOMEN,,800,"This woman who guided Lewis & Clark has a river, peak & mountain pass named for her",Sacajawea,NA
1993-02-18,DJ,ENGLISH LITERATURE,,NA,"Mary Ann Evans wrote ""Silas Marner"" & many other novels using this pen name",George Eliot,NA
1993-02-18,DJ,NATURE,,1000,The outer skin of an oyster secretes this iridescent substance that lines the shell,nacre (mother-of-pearl),NA
1993-02-18,DJ,CLASSICAL MUSIC,,1000,As a teen this Polish-French composer was given a diamond ring by Czar Alexander I after a concert,Chopin,NA
1993-02-18,DJ,LAW & GOVERNMENT,,1000,"Using this power, many governors can cancel parts of a bill while signing the rest into power",a line (item) veto,NA
1993-02-18,DJ,BODIES OF WATER,,1000,The maximum depth of this largest Venezuelan lake is only 115 feet,Lake Maracaibo,NA
1993-02-18,DJ,NOTABLE WOMEN,,NA,"Rigoberta Menchu, a Mayan Indian from this country, was the winner of the 1992 Nobel Peace Prize",Guatemala,NA
1993-02-18,DJ,ENGLISH LITERATURE,,1000,This author of the Chronicles of Narnia taught medieval literature at Oxford & Cambridge,C.S. Lewis,NA
1993-02-18,FJ,TELEVISION HISTORY,,NA,"When this service hit the air August 1, 1981, the first act it presented was The Buggles",MTV,NA
