date,round,category,comment,value,clue,response,link
2020-09-21,J,THE SOUND OF MUSIC,,200,"(Jimmy of the Clue Crew is outside the Frohnburg Palace in Salzburg, Austria.) ""The Sound of Music"" takes place in Salzburg, Austria, in 1938, and Frohnburg Palace was used as an exterior for this family's villa, which they fled",the von Trapps,http://www.j-archive.com/media/2020-09-21_J_01.jpg
2020-09-21,J,THE TEMPLETON PRIZE,,200,"The prize is for ""life's spiritual dimension"", but its creator stipulated the monetary award must always exceed this other prize's",the Nobel Prize,NA
2020-09-21,J,MIDDLEWOMAN,(Alex: You have to supply the woman's name in the link of the clue that we give you.),200,Plain____Doe,Jane,NA
2020-09-21,J,THE ROOM WHERE IT HAPPENS,,200,It's where the sub-zero goes,the kitchen,NA
2020-09-21,J,TUNNELS,,200,"Similar to a certain staircase, this type of tunnel in Norway coils its way up the inside of a hill for over a mile",a spiral,NA
2020-09-21,J,GOOD STUFF IN 2020,,200,"Linda Herring of this ""Hawkeye State"" was honored for fostering more than 600 children over the course of nearly 50 years",Iowa,NA
2020-09-21,J,THE SOUND OF MUSIC,,400,"(Sarah of the Clue Crew presents from the Hellbrunn Palace in Salzburg, Austria.) Sung by Maria and the Captain in the gazebo, recreated on a Hollywood stage, ""Something Good"" was one of two new songs written for the movie, the rest coming from the Broadway show, the last collaboration by this pair",Rodgers & Hammerstein,http://www.j-archive.com/media/2020-09-21_J_02a.jpg
2020-09-21,J,THE TEMPLETON PRIZE,,400,Mother Teresa received the inaugural 1973 prize for her work with the children of this Indian city,Calcutta,NA
2020-09-21,J,MIDDLEWOMAN,(Alex: You have to supply the woman's name in the link of the clue that we give you.),400,Saving____period,Grace,NA
2020-09-21,J,THE ROOM WHERE IT HAPPENS,,400,Indoor games like 20 Questions are named for it,the parlor,NA
2020-09-21,J,TUNNELS,,400,South Africa's over 50-mile-long Orange-Fish Tunnel gets its name from 2 of these that it connects,rivers,NA
2020-09-21,J,GOOD STUFF IN 2020,,400,"At the Columbus Zoo, male & female cubs of this fastest land mammal were born via in vitro fertilization for the first time",a cheetah,NA
2020-09-21,J,THE SOUND OF MUSIC,,600,"(Sarah of the Clue Crew is outside the Frohnburg Palace in Salzburg, Austria.) This actress was 28 and a new mom when she came here to Austria to play Maria, a role she says made her career",Julie Andrews,http://www.j-archive.com/media/2020-09-21_J_03a.jpg
2020-09-21,J,THE TEMPLETON PRIZE,,600,"Physicist Bernard d'Espagnat, 2009's winner, explored the philosophical implications of these mysterious ""mechanics""",quantum mechanics,NA
2020-09-21,J,MIDDLEWOMAN,(Alex: You have to supply the woman's name in the link of the clue that we give you.),600,Round____Hood,Robin,NA
2020-09-21,J,THE ROOM WHERE IT HAPPENS,,600,West Wing crisis center since 1961,the Situation Room,NA
2020-09-21,J,TUNNELS,,600,"Dixia Cheng, a sprawling network of tunnels in Beijing, is aka the ""Underground"" this other landmark",Great Wall,NA
2020-09-21,J,GOOD STUFF IN 2020,,600,"After getting an ""R2-D2"" prosthetic that moves fingers via muscle signals, a young fan got a call from Luke himself, this man",(Mark) Hamill,NA
2020-09-21,J,THE SOUND OF MUSIC,,800,"(Sarah of the Clue Crew presents from Mirabell Gardens in Salzburg, Austria.) Shot in several locations, including Mirabell Gardens, where Maria and the kids dance around a fountain and run through a hedge tunnel, this number culminates with the song's final bars being sung right here on these steps","""Do-Re-Mi""",http://www.j-archive.com/media/2020-09-21_J_04b.jpg
2020-09-21,J,THE TEMPLETON PRIZE,,800,"The 2013 prize went to this Cape Town man whose teachings combine Anglicanism with the concept of ubuntu, meaning humanity & kindness",Archbishop Desmond Tutu,NA
2020-09-21,J,MIDDLEWOMAN,(Alex: You have to supply the woman's name in the link of the clue that we give you.),800,Rambling____hip,Rose,NA
2020-09-21,J,THE ROOM WHERE IT HAPPENS,,800,"Highlights for children has been called ""that ubiquitous magazine"" there",a waiting room,NA
2020-09-21,J,TUNNELS,,800,"Honoring a Santa Monica newspaper publisher, the McClure Tunnel takes you north on this scenic highway aka Highway 1",the Pacific Coast Highway,NA
2020-09-21,J,GOOD STUFF IN 2020,,800,"Ex-Sacramento State softball star Alyssa Nakken didn't have to go far to be the first female coach in MLB, with this NL team",the San Francisco Giants,NA
2020-09-21,J,THE SOUND OF MUSIC,,1000,"(Jimmy of the Clue Crew is outside Residenzplatz in Salzburg, Austria.) In ""The Sound of Music"" Nazi banners are hung from the old palace building in Residenzplatz, signifying this forced political union between German and Austria",Anschluss,http://www.j-archive.com/media/2020-09-21_J_05a.jpg
2020-09-21,J,THE TEMPLETON PRIZE,,1000,"1982's winner was this man from N.C. who ""took his message of Christianity into the...world of radio and television""",Billy Graham,NA
2020-09-21,J,MIDDLEWOMAN,(Alex: You have to supply the woman's name in the link of the clue that we give you.),1000,Pretty____dreadful,Penny,NA
2020-09-21,J,THE ROOM WHERE IT HAPPENS,,1000,A sleeveless garment + 2 letters; it's where clergy dress,a vestry,NA
2020-09-21,J,TUNNELS,,NA,"The world's highest vehicular tunnel is on I-70, 60 miles west of this state capital",Denver,NA
2020-09-21,J,GOOD STUFF IN 2020,,1000,"The 3,900 solar panels this ex-govt. employee put on his farm provided more than half the energy for his hometown of Plains, Georgia",Jimmy Carter,NA
2020-09-21,DJ,AMERICAN HISTORY,,400,"On Oct. 22, 1962 JFK announced a naval blockade of this country due to Soviet missiles being discovered there",Cuba,NA
2020-09-21,DJ,ROCK STARS,,400,"(Conan O'Brien presents the clue.) Forced to engage in a guitar battle with the virtuoso Jack Black, I cheated a smidge and employed this curly-haired, top-hatted legend, aka Saul Hudson",Slash,http://www.j-archive.com/media/2020-09-21_DJ_01a.jpg
2020-09-21,DJ,NEW TECHNOLOGY,,400,Dogs take notice: a new A.I. with neuromorphic computing may recognize these emitted by narcotics & explosives,scents,NA
2020-09-21,DJ,4-LETTER WORDS,,400,The name of this bird is from Maori for the shrill cry of the male bird,kiwi,NA
2020-09-21,DJ,THE NATIONAL JEWISH BOOK AWARD FOR FICTION,,400,"2017 winner David Grossman's ""A Horse Walks Into a Bar"" follows one of these funny folks losing it onstage",a comedian,NA
2020-09-21,DJ,"LIL NASDAQ ""X""","(Alex: Each correct response will be a company, a NASDAQ company, that has ""X"" in its name.)",400,"On the NASDAQ this word precedes Biomedica, Industries & Bank Corp, but not comma or dictionary",Oxford,NA
2020-09-21,DJ,AMERICAN HISTORY,,800,"After a historic 1983 mission, this astronaut turned down flowers as her male counterparts weren't given any",Sally Ride,NA
2020-09-21,DJ,ROCK STARS,,800,"In 1975 ""Dreamboat Annie"" was the debut album for this band fronted by a pair of sisters",Heart,NA
2020-09-21,DJ,NEW TECHNOLOGY,,800,"NASA's Parker Probe is the fastest man-made thing ever--it will hit the speed of 430,000 mph en route to this heavenly body",the Sun,NA
2020-09-21,DJ,4-LETTER WORDS,,800,"It's really not that unattractive, but it is the name of the hybrid citrus fruit seen here",an ugli,http://www.j-archive.com/media/2020-09-21_DJ_08.jpg
2020-09-21,DJ,THE NATIONAL JEWISH BOOK AWARD FOR FICTION,,800,"An immigrant is the hero of the title tale of a Mark Helprin collection, this ""Island"" in New York Bay",Ellis Island,NA
2020-09-21,DJ,"LIL NASDAQ ""X""","(Alex: Each correct response will be a company, a NASDAQ company, that has ""X"" in its name.)",800,"This service features channels like Hip-Hop Nation, Ozzy's Boneyard & No Shoes Radio",SiriusXM Radio,NA
2020-09-21,DJ,AMERICAN HISTORY,,1200,"Victoria Woodhull was the first woman to run for pres. in 1872, but couldn't have taken office because she wasn't yet this age",35,NA
2020-09-21,DJ,ROCK STARS,,1200,"One name off from a German composer, this metal front man skidded into pop culture relevance voicing Triton on ""SpongeBob""",Sebastian Bach,http://www.j-archive.com/media/2020-09-21_DJ_03.jpg
2020-09-21,DJ,NEW TECHNOLOGY,,1200,"Using hydrogels, scientists achieved their goal of creating rudimentary versions of the charged organs in these marine animals",(electric) eels,NA
2020-09-21,DJ,4-LETTER WORDS,,1200,"It's the theatrical technique of suggesting emotions without words, using only gesture & movement",mime,NA
2020-09-21,DJ,THE NATIONAL JEWISH BOOK AWARD FOR FICTION,,1200,"1995 winner ""Mazel"" takes its title from the word for luck in this language written in Hebrew letters",Yiddish,NA
2020-09-21,NA,NA,NA,NA,NA,NA,NA
2020-09-21,DJ,AMERICAN HISTORY,,NA,"This president was said to regret his decision ""not to hang John C. Calhoun"" as a traitor",Andrew Jackson,NA
2020-09-21,DJ,ROCK STARS,,1600,"Serjical Strike is the label of Serj Tankian, known for starting this group in 1995",System of a Down,NA
2020-09-21,DJ,NEW TECHNOLOGY,,1600,Airbus' solar-powered unmanned Zephyr aircraft can fly in this area of the atmosphere above the tropopause,the stratosphere,NA
2020-09-21,DJ,4-LETTER WORDS,,1600,"It's someone who sells hot tips at the racetrack, or a verb meaning ""to praise highly""",a tout,NA
2020-09-21,DJ,THE NATIONAL JEWISH BOOK AWARD FOR FICTION,,1600,"A towering story of biblical proportions, this author's ""Exodus"" won for 1959",(Leon) Uris,NA
2020-09-21,NA,NA,NA,NA,NA,NA,NA
2020-09-21,DJ,AMERICAN HISTORY,,2000,"This 1620 document mentions ""our dread sovereign Lord King James"", ""a voyage to plant the first colony"" & ""Cape Cod""",the Mayflower Compact,NA
2020-09-21,DJ,ROCK STARS,,2000,This singer-songwriter helped create the California sound,Jackson Browne,http://www.j-archive.com/media/2020-09-21_DJ_05.jpg
2020-09-21,DJ,NEW TECHNOLOGY,,2000,"Instead of contaminating a burger, this bacterium can now make indigo in a process invented by a biotech company",E. coli,NA
2020-09-21,DJ,4-LETTER WORDS,,2000,"4-letter name for strong black Indian tea combined with milk, sugar & spices",chai,NA
2020-09-21,DJ,THE NATIONAL JEWISH BOOK AWARD FOR FICTION,,2000,"1950 winner ""The Wall"" by John Hersey is about an escape from the ghetto of 400,000 Jews set up by the Nazis in this capital",Warsaw,NA
2020-09-21,NA,NA,NA,NA,NA,NA,NA
2020-09-21,FJ,PIONEERING EDUCATORS,,NA,"Before going into education, she graduated from the University of Rome in 1896 & was named assistant doctor at its psych clinic",(Maria) Montessori,NA
