date,round,category,comment,value,clue,response,link
2020-10-13,J,TREE OF A KIND,,200,"Japanese, silver, sugar",maples,NA
2020-10-13,J,LANGUAGES,,200,"Most of the Coptic language alphabet is adapted from the Greek, but 7 letters evolved from this Ancient Egyptian writing system",Hieroglyphics,NA
2020-10-13,J,THE NOT-SO-ROARING '30s,,200,In November 1930 the this of Tennessee failed; it was one of the first but wouldn't be the last,a bank,NA
2020-10-13,J,WOMEN IN LITERATURE,,200,"In ""Pride & Prejudice"", Mr. Bennet & this daughter discuss her possible engagement to Mr. Darcy",Elizabeth,NA
2020-10-13,J,ANTE POPE,"(Alex Trebek: Each correct response will be a word that comes just before ""pope"" in the dictionary.)",200,This gourmet treat is offered by Orville Redenbacher's,popcorn,NA
2020-10-13,J,NASCAR IN VEGAS,"(Jimmie Johnson: ..., baby.  I'm Jimmie Johnson with clues from the Las Vegas Motor Speedway, one of the regular stops on the NASCAR Cup Series circuit.) (Alex Trebek: Very popular sport.)",200,(William Byron presents from the Las Vegas Motor Speedway.) I'm William Byron; My Number 24 car is a Camaro ZL1 1LE by this automaker,Chevy,http://www.j-archive.com/media/2020-10-13_J_26a.jpg
2020-10-13,J,TREE OF A KIND,,400,"Windmill, sago, date",a palm,NA
2020-10-13,J,LANGUAGES,,400,"In this 2006 comedy film, Sacha Baron Cohen is actually speaking Hebrew, not Kazakh",Borat,NA
2020-10-13,J,THE NOT-SO-ROARING '30s,,400,"A NASA study found that one of these that struck 70% of North America in 1934 was the worst in 1,000 years; no wonder it got dusty",a drought,NA
2020-10-13,J,WOMEN IN LITERATURE,,400,"Charlotte Bronte wrote ""Shirley"" as well as this more famous novel with the heroine's name as the title",Jane Eyre,NA
2020-10-13,J,ANTE POPE,"(Alex Trebek: Each correct response will be a word that comes just before ""pope"" in the dictionary.)",400,"A rubber band can help make this ""equine"" hairstyle",a ponytail,NA
2020-10-13,J,NASCAR IN VEGAS,"(Jimmie Johnson: ..., baby.  I'm Jimmie Johnson with clues from the Las Vegas Motor Speedway, one of the regular stops on the NASCAR Cup Series circuit.) (Alex Trebek: Very popular sport.)",400,"(Kevin Harvick presents from the Las Vegas Motor Speedway.) I'm Kevin Harvick; I might have only won one NASCAR Cup Series points race in 2007, but I sure did make it count, winning this event, the Super Bowl of stock car racing, by .02 seconds",the Daytona 500,http://www.j-archive.com/media/2020-10-13_J_27a.jpg
2020-10-13,J,TREE OF A KIND,,600,"Norway, Serbian, Sitka",spruce,NA
2020-10-13,J,LANGUAGES,,600,"The Afrikaans language is also known as ""Cape"" this European language",Dutch,NA
2020-10-13,J,THE NOT-SO-ROARING '30s,,600,The Smoot-Hawley this type of tax act raised U.S. import duties & stifled world trade,a tariff,NA
2020-10-13,J,WOMEN IN LITERATURE,,600,"Mrs. Whatsit, Mrs. Who & Mrs. Which help Meg Murry & her brother in this 1962 novel by Madeleine L'Engle",A Wrinkle in Time,NA
2020-10-13,J,ANTE POPE,"(Alex Trebek: Each correct response will be a word that comes just before ""pope"" in the dictionary.)",600,"To speak pompously, from another word for that guy in the Holy See",pontificate,NA
2020-10-13,J,NASCAR IN VEGAS,"(Jimmie Johnson: ..., baby.  I'm Jimmie Johnson with clues from the Las Vegas Motor Speedway, one of the regular stops on the NASCAR Cup Series circuit.) (Alex Trebek: Very popular sport.)",600,"(Brad Keselowski presents from the Las Vegas Motor Speedway.) I'm Brad Keselowski; during my run for the NASCAR season title in 2012, I decided I wanted to go fast, just like Will Ferrell, and win the Aaron's 499 at this Alabama superspeedway",Talladega,http://www.j-archive.com/media/2020-10-13_J_28a.jpg
2020-10-13,J,TREE OF A KIND,,800,"Mission, Manzanillo, Kalamata",olive trees,NA
2020-10-13,J,LANGUAGES,,800,"Korean is an S.O.V. language, meaning this part comes after the subject & object in a sentence",a verb,NA
2020-10-13,J,THE NOT-SO-ROARING '30s,,800,"Lakehurst, New Jersey was the scene of this 1937 disaster",the Hindenburg,NA
2020-10-13,J,WOMEN IN LITERATURE,,800,This William Makepeace Thackeray novel deals with the interwoven fortunes of 2 women: the passive Amelia & the scheming Becky,Vanity Fair,NA
2020-10-13,J,ANTE POPE,"(Alex Trebek: Each correct response will be a word that comes just before ""pope"" in the dictionary.)",800,Snooker is played on a type of one,a pool table,NA
2020-10-13,J,NASCAR IN VEGAS,"(Jimmie Johnson: ..., baby.  I'm Jimmie Johnson with clues from the Las Vegas Motor Speedway, one of the regular stops on the NASCAR Cup Series circuit.) (Alex Trebek: Very popular sport.)",800,"(Jimmie Johnson presents from the Las Vegas Motor Speedway.) I'm Jimmie Johnson; I know a little something about coming in first in the First State, having won 11 times at the International Speedway named for this state capital",Dover,http://www.j-archive.com/media/2020-10-13_J_29a.jpg
2020-10-13,J,TREE OF A KIND,,NA,"Rainbow,yellow gum, Tasmanian blue gum",eucalyptus,NA
2020-10-13,J,LANGUAGES,,1000,"English, Mandarin, Tamil & Malay are official languages of this island nation",Singapore,NA
2020-10-13,J,THE NOT-SO-ROARING '30s,,1000,"Italy invaded this country in October 1935, bringing sanctions from the League of Nations",Ethiopia,NA
2020-10-13,J,WOMEN IN LITERATURE,,1000,Rosalind from this comedy has the most lines of any of Shakespeare's women,As You Like It,NA
2020-10-13,J,ANTE POPE,"(Alex Trebek: Each correct response will be a word that comes just before ""pope"" in the dictionary.)",1000,"Great for dipping your sashimi, this sauce contains citrus juice, mirin, soy sauce & bonito flakes",ponzu,NA
2020-10-13,J,NASCAR IN VEGAS,"(Jimmie Johnson: ..., baby.  I'm Jimmie Johnson with clues from the Las Vegas Motor Speedway, one of the regular stops on the NASCAR Cup Series circuit.) (Alex Trebek: Very popular sport.)",1000,(Aric Almirola presents from the Las Vegas Motor Speedway.) I'm Aric Almirola; I won the 2014 Coke Zero 400 at Daytona driving for the Number 43 motor sports team of this NASCAR legend on the 30th anniversary of his 200th win that came on the same track,Richard Petty,http://www.j-archive.com/media/2020-10-13_J_30a.jpg
2020-10-13,DJ,MEDICAL HISTORY,,400,"Today, hearts being moved for transplant are kept pumping, after decades when they were carried on ice in these, like soda to a picnic",coolers,NA
2020-10-13,DJ,OXYMORONS,,400,This computer-generated simulation is abbreviated VR,virtual reality,NA
2020-10-13,DJ,AWARDS & HONORS,,400,In 1895 he received the Rumford Prize for his work in electric lighting,Edison,NA
2020-10-13,DJ,TV THEME SONG LYRICS,(Alex: You identify the show for us.),400,"""Would you be mine? Could you be mine? Won't you be my neighbor?""",Mister Rogers\' Neighborhood,NA
2020-10-13,NA,NA,NA,NA,NA,NA,NA
2020-10-13,DJ,A BUNCH OF SQUARES,,400,"This square is enclosed on 3 sides by Gum Department Store, St. Basil's Cathedral & the Kremlin",Red Square,NA
2020-10-13,DJ,MEDICAL HISTORY,,800,"Why is it called an operating theater? There used to be an audience, like for Dr. Keen, the USA's first of these, also known as neurosurgeons",a brain surgeon,http://www.j-archive.com/media/2020-10-13_DJ_22.jpg
2020-10-13,DJ,OXYMORONS,,800,"Working security for MLK, George Raveling ended up with the original this of the ""I Have a Dream"" speech",the original copy,NA
2020-10-13,DJ,AWARDS & HONORS,,800,A prize honoring work that promotes European unity is named for this Holy Roman Emperor,Charlemagne,NA
2020-10-13,DJ,TV THEME SONG LYRICS,(Alex: You identify the show for us.),800,"""So no one told you life was gonna be this way, your job's a joke, you're broke, your love life's D.O.A.""",Friends,NA
2020-10-13,NA,NA,NA,NA,NA,NA,NA
2020-10-13,DJ,A BUNCH OF SQUARES,,800,Mao Zedong's body lies in state in a crystal coffin in a memorial hall on this square in Beijing,Tiananmen,NA
2020-10-13,DJ,MEDICAL HISTORY,,1200,"For the first time, in 2018 the FDA approved a drug made directly from cannabis using this non-psychoactive compound",CBD,NA
2020-10-13,DJ,OXYMORONS,,NA,This oxymoron refers to dark chocolate often in about the 60% cacao range,bittersweet,NA
2020-10-13,DJ,AWARDS & HONORS,,1200,(Christopher Plummer presents the clue.) I've enjoyed working on projects for children and even won an Emmy for narrating the adventures of this jeune fille Parisienne created by Ludwig Bemelmans,Madeline,http://www.j-archive.com/media/2020-10-13_DJ_18.jpg
2020-10-13,DJ,TV THEME SONG LYRICS,(Alex: You identify the show for us.),1200,"""Men men men men, manly men men men!""",Two and a Half Men,NA
2020-10-13,DJ,THE CUBISTS,,NA,"""Tender buttons"", written by this American expatriate while she was living in Paris, is a book of Cubist still-life prose-poems",Gertrude Stein,NA
2020-10-13,DJ,A BUNCH OF SQUARES,,1200,"St. Mark's Square in this Italian city has been called ""the finest drawing room in Europe""",Venice,NA
2020-10-13,DJ,MEDICAL HISTORY,,1600,"In 1952 Bjorn Ibsen said, let's keep the patient intubated & ventilated like in the O.R., creating the first of these hospital units",the ICUs,NA
2020-10-13,DJ,OXYMORONS,,1600,A pattern of negative attitudes & resistance to demands are criteria for this type of behavior,passive-aggressive,NA
2020-10-13,DJ,AWARDS & HONORS,,1600,"This award for sci-fi or fantasy writing is named for Mr. Gernsback, founder of Amazing Stories magazine",Hugo,NA
2020-10-13,DJ,TV THEME SONG LYRICS,(Alex: You identify the show for us.),1600,"""You're not the boss of me now & you're not so big""",Malcolm in the Middle,NA
2020-10-13,NA,NA,NA,NA,NA,NA,NA
2020-10-13,DJ,A BUNCH OF SQUARES,,1600,"Home to the Palacio Nacional, this Latin American city's large square known as the Zocalo is a public plaza in use since Aztec times",Mexico City,NA
2020-10-13,DJ,MEDICAL HISTORY,,2000,"This gland was thought useless until 1961, when it was found that the T cells that come from it kill tumor cells",the thymus,NA
2020-10-13,DJ,OXYMORONS,,2000,"The Metropolitan Museum once issued a metal button as an admission ticket; the colors changed daily in this oxymoronic ""order""",random order,NA
2020-10-13,DJ,AWARDS & HONORS,,2000,Grand officer & commander are 2 of the 5 ranks of this French military & civilian order,the Legion of Honor,NA
2020-10-13,DJ,TV THEME SONG LYRICS,(Alex: You identify the show for us.),2000,"""Sing me a song of a lass that is gone, say, could that lass be I?""",Outlander,NA
2020-10-13,NA,NA,NA,NA,NA,NA,NA
2020-10-13,DJ,A BUNCH OF SQUARES,,2000,"The name of this Cairo square at the center of Arab Spring protests means ""liberation"" in Arabic",Tahrir Square,NA
2020-10-13,FJ,LITERARY PRONOUNS,,NA,"Thanks to a horror film, this novel returned to the bestseller lists in 2017, some 30 years after reaching No. 1",It,NA
