date,round,category,comment,value,clue,response,link
2020-10-29,J,BLOCKBUSTERS,,200,This 1975 shark-tastic film is considered the first summer blockbuster,Jaws,NA
2020-10-29,J,NATIONAL PARKS,,200,"The national park named for these ""Great"" mountains is shared by North Carolina & Tennessee",the Great Smoky Mountains,NA
2020-10-29,J,WEAPON TYPES,,200,"Tomahawk, hatchet",an ax,NA
2020-10-29,J,4-LETTER SYNONYMS,,200,"When preparing fish, its synonym is smoke; for healthcare, it's remedy or heal",cure,NA
2020-10-29,J,U.S. HOSPITALS,,200,"Touro Infirmary & Tulane Medical Center are in this city; despite what you might think, St. James Infirmary isn't",New Orleans,NA
2020-10-29,J,A SERIOUSLY FLUFFY CATEGORY,,200,"An ingredient in S'mores, it gets its name from a plant found in wet areas near the sea",marshmallow,NA
2020-10-29,J,BLOCKBUSTERS,,400,Beyoncé voiced Nala in the 2019 version of this Disney film,The Lion King,NA
2020-10-29,J,NATIONAL PARKS,,400,"For decades, Firefall at this California national park was an annual pouring of bonfire remnants over Glacier Point",Yosemite,NA
2020-10-29,J,WEAPON TYPES,,400,"Cutlass, falchion",a sword,NA
2020-10-29,J,4-LETTER SYNONYMS,,400,Friar & brother are both synonymous with this religious title,monk,NA
2020-10-29,J,U.S. HOSPITALS,,400,In 1986 this Minnesota clinic merged with Rochester Methodist & St. Mary's hospitals,Mayo Clinic,NA
2020-10-29,J,A SERIOUSLY FLUFFY CATEGORY,,400,"As you can see, the Japanese type of this breakfast item is a bit fluffier than the Yank version",a pancake,http://www.j-archive.com/media/2020-10-29_J_19.jpg
2020-10-29,J,BLOCKBUSTERS,,600,"Subtitled ""Catching Fire"", the second film in this series caught fire with moviegoers",The Hunger Games,NA
2020-10-29,J,NATIONAL PARKS,,600,"You'll see plenty of stalactites & stalagmites at this site, a national park in Kentucky",Mammoth Cave,NA
2020-10-29,J,WEAPON TYPES,,600,"Compound, recurve",a bow,NA
2020-10-29,J,4-LETTER SYNONYMS,,600,"Before ""up"" it's a synonym for cheer; by itself, for a benefit",perk,NA
2020-10-29,J,U.S. HOSPITALS,,600,"In 1961 California's Mount Sinai merged with the hospital known as these ""of Lebanon""",Cedars,NA
2020-10-29,J,A SERIOUSLY FLUFFY CATEGORY,,600,Nephoscopes measure the speed & direction of these fluffy things,clouds,NA
2020-10-29,J,BLOCKBUSTERS,,800,The premise of this 2017 film: 4 teens are sucked into a magical video game where they meet Nick Jonas,Jumanji: Welcome to the Jungle,NA
2020-10-29,J,NATIONAL PARKS,,800,Francis Marion could tell you this wet type of terrain was once in the name of what's now Congaree National Park,a swamp,NA
2020-10-29,J,WEAPON TYPES,,800,"Bolt action; AR, also called modern sporting",rifle,NA
2020-10-29,J,4-LETTER SYNONYMS,,800,This verb means to shed feathers,molt,NA
2020-10-29,J,U.S. HOSPITALS,,800,"After his death in 1873, this Baltimore philanthropist left his fortune to establish a university & hospital",Johns Hopkins,NA
2020-10-29,J,A SERIOUSLY FLUFFY CATEGORY,,800,"Members of this group whose name stands for head, heart, hands and health, help coif fluffy cows like the one seen here",4-H,http://www.j-archive.com/media/2020-10-29_J_12.jpg
2020-10-29,J,BLOCKBUSTERS,,1000,"Based on a novel by Boris Pasternak & clocking in at more than 3 hours, this 1965 film was a hit at the box office",Doctor Zhivago,NA
2020-10-29,J,NATIONAL PARKS,,NA,This drainage line runs northwest-southeast through Rocky Mountain National Park,the Continental Divide,NA
2020-10-29,J,WEAPON TYPES,,1000,"Cudgel, shillelagh",a club,NA
2020-10-29,J,4-LETTER SYNONYMS,,1000,"Manacle, rigid & press are all synonyms for this 4-letter word",iron,NA
2020-10-29,J,U.S. HOSPITALS,,1000,"Fittingly, Tufts Medical Center in Boston uses this biblical parable as inspiration",the Good Samaritan,NA
2020-10-29,J,A SERIOUSLY FLUFFY CATEGORY,,1000,"This alliterative product sounds like a type of explosive, but actually just makes fluffy suds for you to enjoy in your tub",a bath bomb,NA
2020-10-29,NA,NA,NA,NA,NA,NA,NA
2020-10-29,DJ,ANTIQUES,,400,"A semainier was a tall narrow chest traditionally of this many drawers, containing linen for a whole week",seven,NA
2020-10-29,NA,NA,NA,NA,NA,NA,NA
2020-10-29,DJ,ALLITERATIVE AUTHORS,(Alex: We'll need the first and the last name.),400,"Not about zombies, the short story ""The Dead"" is found in this Irish author's collection ""Dubliners""",James Joyce,NA
2020-10-29,NA,NA,NA,NA,NA,NA,NA
2020-10-29,NA,NA,NA,NA,NA,NA,NA
2020-10-29,DJ,SOVIET BLOC BUSTERS,,800,In 1961 Rudolf Nureyev defected to the West as the Kirov Ballet played Paris; this dancer defected in Toronto 13 years later,(Mikhail) Baryshnikov,NA
2020-10-29,DJ,ANTIQUES,,800,"From the Victorian era, the spoonback variety of this piece of furniture came in a comfy, slightly lower nursing version",a chair,NA
2020-10-29,DJ,TRANSLATED GEOGRAPHIC NAMES,,800,"An Algonquian language: people of the point bay, Rhode Island",Narragansett,NA
2020-10-29,DJ,ALLITERATIVE AUTHORS,(Alex: We'll need the first and the last name.),NA,"One of his most famous characters, Harry Haller, has the same initials as the author",Hermann Hesse,NA
2020-10-29,DJ,SCIENCE TV,,800,"When it's a slow space news day, NASA TV may show a view of Earth from this, launched in 1998",the International Space Station,NA
2020-10-29,DJ,"""BE""SOMETHING""ED""","(Alex: ""B-E"" is going to begin each correct response and each response will end with ""E-D"".)",800,Engaged to be married,betrothed,NA
2020-10-29,DJ,SOVIET BLOC BUSTERS,,1200,"Tito, leader of this country that's no longer on the map, chafed against Stalin & pursued a policy of ""nonalignment""",Yugoslavia,NA
2020-10-29,DJ,ANTIQUES,,1200,"Rene Lalique's early 20th century designs in jewelry & this medium, verre in French, are highly prized today",glass,NA
2020-10-29,DJ,TRANSLATED GEOGRAPHIC NAMES,,1200,"French: wooded, Idaho",Boise,NA
2020-10-29,DJ,ALLITERATIVE AUTHORS,(Alex: We'll need the first and the last name.),1200,In Sept. 2018 this Singapore-born man had 3 books in the top 5 on the New York Times fiction bestseller list,Kevin Kwan,NA
2020-10-29,DJ,SCIENCE TV,,1200,"""How It's Made"" shows the manufacture of items from pipe organs to masks for these men in the nets",goalies,NA
2020-10-29,DJ,"""BE""SOMETHING""ED""","(Alex: ""B-E"" is going to begin each correct response and each response will end with ""E-D"".)",1200,"Beleaguered is a synonym for this, whether by soldiers around your castle or by problems",besieged,NA
2020-10-29,DJ,SOVIET BLOC BUSTERS,,1600,"With the goal of easing relations, German chancellor Willy Brandt pursued this type of policy, from the French for ""relaxing""",détente,NA
2020-10-29,DJ,ANTIQUES,,1600,"Seen first from above, is a piece of furniture with both convex and concave edges, an example of this snaky adjective",serpentine,http://www.j-archive.com/media/2020-10-29_DJ_19a.jpg
2020-10-29,DJ,TRANSLATED GEOGRAPHIC NAMES,,NA,"Welsh: high hill, Pennsylvania",Bryn Mawr,NA
2020-10-29,DJ,ALLITERATIVE AUTHORS,(Alex: We'll need the first and the last name.),1600,"He's taken us on ""A Walk in the Woods"" & given us ""A Short History of Nearly Everything""",Bill Bryson,NA
2020-10-29,DJ,SCIENCE TV,,1600,"A followup to Carl Sagan's original show, ""Cosmos: A Spacetime Odyssey"" explored the universe with this host",Neil deGrasse Tyson,NA
2020-10-29,DJ,"""BE""SOMETHING""ED""","(Alex: ""B-E"" is going to begin each correct response and each response will end with ""E-D"".)",1600,It's the state of a sailing ship that can't move because there's no wind,becalmed,NA
2020-10-29,DJ,SOVIET BLOC BUSTERS,,2000,"With a seasonal name, this brief period of Czech liberalization inspired by Alexander Dubcek began in April 1968",Prague Spring,NA
2020-10-29,DJ,ANTIQUES,,2000,Treasured Belleek ware pottery was manufactured starting in the 1850s at Fermanagh on this island,Ireland,NA
2020-10-29,DJ,TRANSLATED GEOGRAPHIC NAMES,,2000,"Spanish: Blood of Christ mountains, Colorado & New Mexico",The Sangre de Cristo Mountains,NA
2020-10-29,DJ,ALLITERATIVE AUTHORS,(Alex: We'll need the first and the last name.),2000,"This ""verdant"" author's ""The Heart of the Matter"" was set in Sierra Leone, where he was once stationed in World War II",Graham Greene,NA
2020-10-29,DJ,SCIENCE TV,,2000,"Focusing on the oceans, ""The Blue Planet"" and ""Blue Planet II"" are both narrated by this Brit",(David) Attenborough,http://www.j-archive.com/media/2020-10-29_DJ_03.jpg
2020-10-29,DJ,"""BE""SOMETHING""ED""","(Alex: ""B-E"" is going to begin each correct response and each response will end with ""E-D"".)",2000,"Lacking knowledge, unenlightened; literally, it refers to a traveler who must stop because it gets dark",benighted,NA
2020-10-29,FJ,LEAD SINGERS,,NA,"The New York Times said this late Brit's multi-octave range & operatic quality made ""even paeans to bicycle riding sound emotional""",Freddie Mercury,NA
