date,round,category,comment,value,clue,response,link
2006-01-12,J,WEATHER,,200,"The highest low temperature of any U.S. state is the 12 degrees F. recorded in this state on May 17, 1979",Hawaii,NA
2006-01-12,J,EASILY IMITATED,,200,"""You're despicable!""",Daffy Duck,http://www.j-archive.com/media/2006-01-12_J_16.mp3
2006-01-12,J,PARACHUTING WITH THE GOLDEN KNIGHTS,,200,"(Jimmy of the Clue Crew reports from Fort Bragg, NC, holding a parachute.)  Packing of all reserve chutes in the United States, even those used by the Army's Golden Knights, is overseen by this federal organization",the FAA,http://www.j-archive.com/media/2006-01-12_J_22.jpg
2006-01-12,J,THE U.S. CONGRESS,,200,Each member of the House of Representatives represents one of these territorial divisions of a state,a congressional district,NA
2006-01-12,J,FAMOUS FOLKS,,200,She was still a teenager when Howard Hughes discovered her in 1940,Jane Russell,http://www.j-archive.com/media/2006-01-12_J_07a.jpg
2006-01-12,J,HIDDEN COUNTRIES,"(Alex: You have to identify the country that is hidden within each clue, and I'll tell you now that the letters are in order.)",200,I go to the spa in the nude,Spain,NA
2006-01-12,J,WEATHER,,400,"On a weather map, 3 horizontal & parallel lines indicate this weather condition",fog,NA
2006-01-12,J,EASILY IMITATED,,400,"""Outside of a dog, a book is man's best friend. Inside of a dog, it's too dark to read""",Groucho Marx,http://www.j-archive.com/media/2006-01-12_J_18.mp3
2006-01-12,J,PARACHUTING WITH THE GOLDEN KNIGHTS,,400,"(Kelly of the Clue Crew holds open a parachute at Fort Bragg, NC.)  Though they may still say ""hit the silk"", the Golden Knights use a ripstop version of this synthetic fabric, created by Dupont in the '30s",nylon,http://www.j-archive.com/media/2006-01-12_J_23.jpg
2006-01-12,J,THE U.S. CONGRESS,,400,She was the first British monarch to address the U.S. Congress,Elizabeth II,NA
2006-01-12,J,FAMOUS FOLKS,,400,"In 1976, this high-flying woman was simply gym-dandy",Nadia Comaneci,http://www.j-archive.com/media/2006-01-12_J_08.jpg
2006-01-12,J,HIDDEN COUNTRIES,"(Alex: You have to identify the country that is hidden within each clue, and I'll tell you now that the letters are in order.)",400,Chair and table,Iran,NA
2006-01-12,J,WEATHER,,600,The Fujita scale that ranks the intensity of these goes from F-0 on up; an F-5 has wind speeds exceeding 261 mph,a tornado,NA
2006-01-12,J,EASILY IMITATED,,600,"""Louis, I think this is the beginning of a beautiful friendship""",Humphrey Bogart,http://www.j-archive.com/media/2006-01-12_J_19.mp3
2006-01-12,J,PARACHUTING WITH THE GOLDEN KNIGHTS,,600,"(Jimmy of the Clue Crew demonstrates with a parachute at Fort Bragg, NC.) Also found on cars,  when these steering lines are used dually, they slow the parachute; singly, they allow turning",brakes,http://www.j-archive.com/media/2006-01-12_J_30.jpg
2006-01-12,J,THE U.S. CONGRESS,,600,"We swear, the very first law passed by Congress concerned how these pledges were to be made",oaths of office,NA
2006-01-12,J,FAMOUS FOLKS,,600,He's the famous Russian seen here in 1961,Yuri Gagarin,http://www.j-archive.com/media/2006-01-12_J_09.jpg
2006-01-12,J,HIDDEN COUNTRIES,"(Alex: You have to identify the country that is hidden within each clue, and I'll tell you now that the letters are in order.)",600,Hype rubber chickens,Peru,NA
2006-01-12,J,WEATHER,,800,"Sadly, in 2005 many learned this alliterative 2-word term for a rise in sea level accompanying fierce winds",storm surge,NA
2006-01-12,J,EASILY IMITATED,,800,"""I'm lookin' at a tin star with a drunk pinned on it""",John Wayne,http://www.j-archive.com/media/2006-01-12_J_20.mp3
2006-01-12,J,PARACHUTING WITH THE GOLDEN KNIGHTS,,800,"(Kelly of the Clue Crew reports from a runway at Fort Bragg, NC.) The Army employs two jumping methods: a static line in which the jumper is tethered to the plane, & this style, reminiscent of a Tom Petty tune",freefalling,http://www.j-archive.com/media/2006-01-12_J_29.jpg
2006-01-12,J,THE U.S. CONGRESS,,800,"Frustrated with his own political party, in 2001 this senator from Vermont switched to indepedent",Jeffords,NA
2006-01-12,J,FAMOUS FOLKS,,NA,"Before her time as a First Lady, this woman was a radio & film actress",Eva Peron,http://www.j-archive.com/media/2006-01-12_J_10.jpg
2006-01-12,J,HIDDEN COUNTRIES,"(Alex: You have to identify the country that is hidden within each clue, and I'll tell you now that the letters are in order.)",800,I've been through analysis,Ghana,NA
2006-01-12,J,WEATHER,,1000,This type of weather radar calculates the speed & direction of a weather system,Doppler,NA
2006-01-12,J,EASILY IMITATED,,1000,"""You're the man now, dog!""",Sean Connery,http://www.j-archive.com/media/2006-01-12_J_21.mp3
2006-01-12,J,PARACHUTING WITH THE GOLDEN KNIGHTS,,1000,"(Sarah of the Clue Crew prepares to jump from an aircraft at Fort Bragg, NC.)  Beginning parachuters usually jump with a partner, referred to as this term from the Latin for ""at length""",tandem,http://www.j-archive.com/media/2006-01-12_J_28.wmv
2006-01-12,J,THE U.S. CONGRESS,,1000,"Former senators are allowed back on the Senate floor, but they're restricted from doing this the first year out of office",lobbying,NA
2006-01-12,J,FAMOUS FOLKS,,1000,He's the World War I military leader & member of royalty seen here,Kaiser Wilhelm II,http://www.j-archive.com/media/2006-01-12_J_15.jpg
2006-01-12,J,HIDDEN COUNTRIES,"(Alex: You have to identify the country that is hidden within each clue, and I'll tell you now that the letters are in order.)",1000,Hug and accept it,Uganda,NA
2006-01-12,DJ,THE CIVIL WAR,,400,George Custer was wounded only once during the war but had 11 of these killed under him,horses,NA
2006-01-12,DJ,ED-UCATION,,400,"The 2005-2006 TV season marks this famous Ed's 25th year on ""60 Minutes""",Ed Bradley,NA
2006-01-12,DJ,CHINESE REGIONAL CAPITALS,,400,This city is the capital of the high-altitude autonomous region that until 1965 was its own country,Lhasa,NA
2006-01-12,DJ,NEW -OLOGIES,"(Alex: These are all based on words that end in ""O-L"".  For instance, if we were saying ""It's the study of pistols,"" that would be ""pistology"".  That's the new kind of -ology.)",400,"""Green Coca-Cola Bottles"" (1962) & other pieces of pop art are part of this science",Warhology,NA
2006-01-12,DJ,NOTIFY,,400,"It was during this war that Lt. Andrew Rowan delivered his famous ""Message to Garcia"" from Pres. McKinley",the Spanish-American War,NA
2006-01-12,DJ,"NEXT OF ""KIN""",,400,Small dry twigs used to start a fire,kindling,NA
2006-01-12,DJ,THE CIVIL WAR,,800,"A young conscript from North Carolina was called this, slang for the peanuts grown there",a goober,NA
2006-01-12,DJ,ED-UCATION,,800,He was nominated for an Oscar for playing an abstract expressionist in a 2000 film that he directed himself,Ed Harris,NA
2006-01-12,DJ,CHINESE REGIONAL CAPITALS,,800,Chengdu is the hot & spicy capital of this province that lends its name to a hot & spicy Chinese food variety,Szechuan,NA
2006-01-12,DJ,NEW -OLOGIES,"(Alex: These are all based on words that end in ""O-L"".  For instance, if we were saying ""It's the study of pistols,"" that would be ""pistology"".  That's the new kind of -ology.)",800,"If you avidly follow Latin American soccer, you're gaining knowledge in this area",futbology,NA
2006-01-12,DJ,NOTIFY,,800,In August 1858 the first transatlantic cable message was sent from this monarch to Pres. Buchanan,Queen Victoria,NA
2006-01-12,DJ,"NEXT OF ""KIN""",,800,Congo capital founded by Henry Stanley,Kinshasa,NA
2006-01-12,DJ,THE CIVIL WAR,,1200,"During the war, this Ozark state had 2 competing governments",Arkansas,NA
2006-01-12,DJ,ED-UCATION,,1200,This conservation-conscious co-star of St. Elsewhere was once L.A.'s environmental affairs commissioner,"Ed Begley, Jr.",NA
2006-01-12,DJ,CHINESE REGIONAL CAPITALS,,1200,This capital of the island province of Hainan sounds like a short Japanese poem of 17 syllables,Haikou,NA
2006-01-12,DJ,NEW -OLOGIES,"(Alex: These are all based on words that end in ""O-L"".  For instance, if we were saying ""It's the study of pistols,"" that would be ""pistology"".  That's the new kind of -ology.)",1200,Get a Ph.D. studying products released in a spray through a nozzle & you're an expert in this,aerosology,NA
2006-01-12,DJ,NOTIFY,,1200,"After defeating a British fleet on Lake Erie, he sent out the message ""We have met the enemy, and they are ours""",Oliver Hazard Perry,NA
2006-01-12,DJ,"NEXT OF ""KIN""",,1200,A film of a transmitted television program,a kinescope,NA
2006-01-12,DJ,THE CIVIL WAR,,1600,This Confederate submarine was recovered in 2000; its crew was buried in Charleston in 2004,the Hunley,NA
2006-01-12,DJ,ED-UCATION,,1600,"He showed off his singing pipes when he played Drew Barrymore's fiance in the film ""Everyone Says I Love You""",Ed Norton,NA
2006-01-12,DJ,CHINESE REGIONAL CAPITALS,,NA,Its former capital was Victoria,Hong Kong,NA
2006-01-12,DJ,NEW -OLOGIES,"(Alex: These are all based on words that end in ""O-L"".  For instance, if we were saying ""It's the study of pistols,"" that would be ""pistology"".  That's the new kind of -ology.)",1600,Need a minty flavoring for candies or cigarettes?  Call someone who knows about this,menthology,NA
2006-01-12,DJ,NOTIFY,,1600,"On May 24, 1844 he sent the famous message, ""What hath God wrought""",(Samuel) Morse,NA
2006-01-12,DJ,"NEXT OF ""KIN""",,1600,"From the Greek for ""movement"", this real -ology studies mechanics with respect to human anatomy",kinesiology,NA
2006-01-12,DJ,THE CIVIL WAR,,2000,"This term that means an ambusher & also inlcudes ""B-U-S-H"" gets that meaning from Civil War guerrillas",a bushwhacker,NA
2006-01-12,DJ,ED-UCATION,,2000,"In 1995 he wrote, directed & starred in his first film, ""The Brothers McMullen""",Edward Burns,NA
2006-01-12,DJ,CHINESE REGIONAL CAPITALS,,2000,This capital of Hubei province lent its name to a deadly flu virus,Wuhan,NA
2006-01-12,DJ,NEW -OLOGIES,"(Alex: These are all based on words that end in ""O-L"".  For instance, if we were saying ""It's the study of pistols,"" that would be ""pistology"".  That's the new kind of -ology.)",2000,"The examination of the Russian tale ""Dead Souls"" & other works by the same author",Gogology,NA
2006-01-12,DJ,NOTIFY,,2000,"Before this battle, Lord Nelson sent the message to his sailors that ""England expects that every man will do his duty""",the Battle of Trafalgar,NA
2006-01-12,DJ,"NEXT OF ""KIN""",,NA,Honey of critter seen here,a kinkajou,http://www.j-archive.com/media/2006-01-12_DJ_15.jpg
2006-01-12,FJ,CLASSIC MOVIE CHARACTERS,,NA,"Appropriately, this villainous movie character's name comes from the Dutch word for ""father""",Darth Vader,NA
