date,round,category,comment,value,clue,response,link
1987-11-09,J,HOLIDAYS & OBSERVANCES,,100,Palm Sunday occurs this number of days before Easter,7,NA
1987-11-09,J,UTAH,,100,"Having saved early Mormon settlers from an invasion of katydids, it's now the state bird",the seagull,NA
1987-11-09,J,SPORTS CUPS,,100,The Davis Cup,tennis,NA
1987-11-09,J,NATURE,,100,"Like whales, manatees have a layer of this fat under their skin",blubber,NA
1987-11-09,J,CLOTHING,,100,"Principal body part covered by a busby, bernoose, or babushka",the head,NA
1987-11-09,J,EUROPE ON FILM,,100,"Life in this city was a ""cabaret"" for Liza Minnelli & Joel Grey","Berlin, Germany",NA
1987-11-09,J,HOLIDAYS & OBSERVANCES,,200,The Jewish 10 Days of Penitence begin & end on these two holy days,Rosh Hashanah & Yom Kippur,NA
1987-11-09,J,UTAH,,200,This river linking the Great Salt & Utah lakes is named for a river linking the Dead Sea & the Sea of Galillee,the River Jordan,NA
1987-11-09,J,SPORTS CUPS,,200,The Stanley Cup,hockey,NA
1987-11-09,J,NATURE,,200,"Species of these include the mouse-eared, disk-winged, and fruit",bats,NA
1987-11-09,J,CLOTHING,,200,"In 1987, New York City imposed a dress code on the 39,000 licensed drivers of these",taxicabs,NA
1987-11-09,J,EUROPE ON FILM,,200,"In a 1974 film, a melange of murderers took this famed train from Istanbul to Calais",the Orient Express,NA
1987-11-09,J,HOLIDAYS & OBSERVANCES,,300,"United Nations Day falls on the anniversary of its founding, the 24th of this month",October,NA
1987-11-09,J,UTAH,,300,The Mormons called the region of Utah this: the Book of Mormon's word for honeybee,Deseret,NA
1987-11-09,J,SPORTS CUPS,,300,The Breeders Cup,thoroughbred racing,NA
1987-11-09,J,NATURE,,300,"On giraffes, this prehensile muscle can be 20 inches long",the tongue,NA
1987-11-09,J,CLOTHING,,300,"In the military, it's clothing designed for work and field duty; you know, the stuff that tires you out",fatigues,NA
1987-11-09,J,EUROPE ON FILM,,300,This 1959 film set in Amsterdam won Shelley Winters herfirst Oscar as Mrs. Van Damme,The Diary of Anne Frank,NA
1987-11-09,J,HOLIDAYS & OBSERVANCES,,NA,The two U.S. federal holidays in November on which there is no mail delivery,Veterans Day & Thanksgiving,NA
1987-11-09,J,UTAH,,400,Brigham Young's famous 4-word quote uttered when he first saw the Great Salt Lake Valley,This is the place,NA
1987-11-09,J,SPORTS CUPS,,400,The Ryder Cup,golf,NA
1987-11-09,J,NATURE,,400,"If you spot a snipe, you've seen this type of creature",a bird,NA
1987-11-09,J,CLOTHING,,400,"Worn by women in Rio, it's called ""floss dental"" or dental floss, cause it's mainly a string",bikini,NA
1987-11-09,J,EUROPE ON FILM,,400,"Country in which Hitchcock's ""Jamaica Inn"" was set",Britain,NA
1987-11-09,J,HOLIDAYS & OBSERVANCES,,500,Mother's Day is in May; Father's Day is in June; and Grandparent's Day is in this month,September,NA
1987-11-09,J,UTAH,,500,"It's the world's largest natural stone arch, though it sounds like it's made from light",Rainbow Bridge,NA
1987-11-09,J,SPORTS CUPS,,500,The Grey Cup,Canadian football,NA
1987-11-09,J,NATURE,,500,"Members of this, genus papio, are the largest of all monkeys",baboons,NA
1987-11-09,J,CLOTHING,,500,"The uniform worn by male servants, its name is from the Old English for ""something given""",livery,NA
1987-11-09,J,EUROPE ON FILM,,500,Parts of this 1958 Kirk Douglas film about icy invaders were filmed on location in Norway,The Vikings,NA
1987-11-09,DJ,ANCIENT TIMES,,200,It was long a mystery how Egyptians cut & erected these tapering monolithic pointed pillars,obelisks,NA
1987-11-09,DJ,ARTISTS,,200,Thomas Nast's caricatures of this corrupt New York City political organization led to its demise,Tammany Hall,NA
1987-11-09,DJ,THE AUTO INDUSTRY,,200,"For 1988, the ""190"" will be the only Mercedes-Benz sold in the U.S. with this type of engine",diesel,NA
1987-11-09,DJ,AMERICAN INDIANS,,200,Tourists can view most of the annual puberty rites of the Mescalero branch of this tribe,Apache,NA
1987-11-09,DJ,WORLD WAR I,,200,"The United States never ratified the Versailles treaty, though this President played a key role in drafting it",Woodrow Wilson,NA
1987-11-09,DJ,TOUGH TV TRIVIA,,NA,"Though the following wasn't one of his biggest hits, this artist used it as the theme for his TV show",Glen Campbell,http://www.j-archive.com/media/1987-11-09_DJ_05.mp3
1987-11-09,DJ,ANCIENT TIMES,,400,"In 55 and 54 B.C., his forces invaded Britain",Julius Caesar,NA
1987-11-09,DJ,ARTISTS,,400,"When he turned 90, the Louvre hung eight of his works in the ""Tribune of Honor"", where the ""Mona Lisa"" has hung",Picasso,NA
1987-11-09,DJ,THE AUTO INDUSTRY,,400,U.S. automaker that owns Lamborghini and 15% of Maserati,Chrysler,NA
1987-11-09,DJ,AMERICAN INDIANS,,400,"The famed memorial to this Indian who fought and defeated Custer is near Custer, SD",Crazy Horse,NA
1987-11-09,DJ,WORLD WAR I,,400,"Sunk by the Germans, the British ship Lusitania belonged to this passenger line",Cunard,NA
1987-11-09,DJ,TOUGH TV TRIVIA,,400,"The 1959 to 1961 western, ""The Rebel"", was produced by this duo better known for game shows",Goodson-Todman,NA
1987-11-09,DJ,ANCIENT TIMES,,600,"The Minoan civilization, named for the mythological King Minos, was centered on this island",Crete,NA
1987-11-09,DJ,ARTISTS,,NA,"Name of the artist and name of the famed statue 16th century Italians called ""Il Gigante""","Michelangelo and ""David""",NA
1987-11-09,DJ,THE AUTO INDUSTRY,,600,GM plans to build Saturn cars in Spring Hill while Nissan has a plant at nearby Smyrna in this state,Tennessee,NA
1987-11-09,DJ,AMERICAN INDIANS,,600,"Usually pulled by a dog, it could have been described as a ""Plains Indians wagon without wheels""",a travois,NA
1987-11-09,DJ,WORLD WAR I,,600,Britain entered the war when Germany marched against France by way of this neutral country,Belgium,NA
1987-11-09,DJ,TOUGH TV TRIVIA,,600,"Rob Petrie, Buddy Sorrell, and Sally Rogers wrote for this TV show",The Alan Brady Show (on Dick Van Dyke),NA
1987-11-09,DJ,ANCIENT TIMES,,800,Ancient Greek philosophy synonymous with hedonism,epicureanism,NA
1987-11-09,DJ,ARTISTS,,800,"In ""Lust for Life"", Anthony Quinn won an Oscar for playing this painter, a close friend of Van Gogh's",Gauguin,NA
1987-11-09,DJ,THE AUTO INDUSTRY,,800,"While Toyotas are made by Toyota, this Japanese car is made by Fuji Heavy Industries",Subaru,NA
1987-11-09,DJ,AMERICAN INDIANS,,800,"""Indian Napoleon"" who led his band on a 1,000 mile retreat, but was caught 40 miles short of his goal, Canada",Chief Joseph (of the Nez Perce),NA
1987-11-09,DJ,WORLD WAR I,,800,"While the Triple Alliance evolved into the Central Powers, this triple group became the Allies","Britain, France, & Russia",NA
1987-11-09,DJ,TOUGH TV TRIVIA,,800,"On ""The Big Payoff"", this, modeled by Bess Myerson, was the big payoff",a mink coat,NA
1987-11-09,DJ,ANCIENT TIMES,,1000,"Many consider this Greek orator's ""On The Crown"" the most nearly-perfect speech in history",Demosthenes,NA
1987-11-09,DJ,ARTISTS,,1000,"Leader of the French Romantics; critics claimed he painted with a ""drunken broom""",Eugene Delacroix,NA
1987-11-09,DJ,THE AUTO INDUSTRY,,1000,Ransom Eli Olds should have felt at home driving these two cars; both were named for him,Oldsmobile and REO Speedwagon,NA
1987-11-09,DJ,AMERICAN INDIANS,,1000,American Indian Movement activist who came in 2nd for the 1988 Libertarian Party Presidential nomination,Russell Means,NA
1987-11-09,DJ,WORLD WAR I,,1000,One of the two British Prime Ministers during the war,David Lloyd George (and Herbert Asquith),NA
1987-11-09,DJ,TOUGH TV TRIVIA,,1000,"Original title of ""The Phil Silvers Show""; it subsequently became its subtitle",You\'ll Never Get Rich,NA
1987-11-09,FJ,FAMOUS WOMEN,,NA,"Both Detroit, her home now, and Montgomery, Alabama, her home in 1955, have streets named for her",Rosa Parks,NA
