date,round,category,comment,value,clue,response,link
2006-03-09,J,ETHNIC GROUPS,,200,New Zealand's ethnicity is about 70% European & 8% this native group,Maori,NA
2006-03-09,J,GAME SHOW CATCHPHRASES,"(Alex: You identify the game show, of course.)",200,"""I'd like to buy a vowel""",Wheel of Fortune,NA
2006-03-09,J,TEDDY ROOSEVELT SPEAKS,,200,"TR told a Progressive Party rally in 1912, ""I am as strong as"" one of these animals ""and you can use me to the limit""",a bull moose,NA
2006-03-09,J,ANOTHER WORD IN THESAURUS,"(Alex: Each correct response will be made up of the letters in the word ""thesaurus"" itself--keep that in mind.)",200,One religion makes up about 65% of this state's population,Utah,NA
2006-03-09,J,GET YOUR KICKS,,200,"In slang, to kick this 6-letter container is to die",the bucket,NA
2006-03-09,J,ON ROUTE 66,,200,"In Anglo-Saxon times, this land measurement referred to a parcel 66 feet wide & 660 feet long",an acre,NA
2006-03-09,J,ETHNIC GROUPS,,400,This country's 2 largest ethnic groups are Javanese & Sundanese,Indonesia,NA
2006-03-09,J,GAME SHOW CATCHPHRASES,"(Alex: You identify the game show, of course.)",400,"""Come on down!""",The Price is Right,NA
2006-03-09,J,TEDDY ROOSEVELT SPEAKS,,400,"Teddy called the White House a ""bully"" one of these",pulpit,NA
2006-03-09,J,ANOTHER WORD IN THESAURUS,"(Alex: Each correct response will be made up of the letters in the word ""thesaurus"" itself--keep that in mind.)",400,"When you ""make"" this, you go with speed",haste,NA
2006-03-09,J,GET YOUR KICKS,,400,These high-kicking honeys are the signature performers at Radio City Music Hall,the Rockettes,NA
2006-03-09,J,ON ROUTE 66,,400,The 66 counties of this northern U.S. state include Custer & Minnehaha,South Dakota,NA
2006-03-09,J,ETHNIC GROUPS,,600,Monegasques are in the minority in Monaco; this is its top ethnic group,the French,NA
2006-03-09,J,GAME SHOW CATCHPHRASES,"(Alex: You identify the game show, of course.)",600,"""I'd like to phone a friend""",Who Wants to Be a Millionaire,NA
2006-03-09,J,TEDDY ROOSEVELT SPEAKS,,600,"In a 1911 speech Teddy declared, ""I took"" this zone ""and let Congress debate""",the Panama Canal Zone,NA
2006-03-09,J,ANOTHER WORD IN THESAURUS,"(Alex: Each correct response will be made up of the letters in the word ""thesaurus"" itself--keep that in mind.)",NA,In 1978 India stopped exporting this type of monkey to scientific labs around the world,Rhesus,NA
2006-03-09,J,GET YOUR KICKS,,600,The longest of these in NFL history was a 98-yarder by Steve O'Neal for the New York Jets in 1969,a punt,NA
2006-03-09,J,ON ROUTE 66,,600,There are 66 books in this version of the Bible first published in 1611,the King James Version,NA
2006-03-09,J,ETHNIC GROUPS,,800,The Azeris in Iran had the rug pulled out from under them because this is the No. 1 ethnic group,Persian,NA
2006-03-09,J,GAME SHOW CATCHPHRASES,"(Alex: You identify the game show, of course.)",800,"""I'll take Paul Lynde to block""",Hollywood Squares,NA
2006-03-09,J,TEDDY ROOSEVELT SPEAKS,,800,"In 1904 TR said, ""If elected, I shall see to it that every man has"" this type of ""deal, no less and no more""",a square deal,NA
2006-03-09,J,ANOTHER WORD IN THESAURUS,"(Alex: Each correct response will be made up of the letters in the word ""thesaurus"" itself--keep that in mind.)",800,A joining of the edges of a wound by a stitch,suture,NA
2006-03-09,J,GET YOUR KICKS,,800,"In official racing events, this swimming stroke traditionally makes use of the frog kick",the breaststroke,NA
2006-03-09,J,ON ROUTE 66,,800,"When Armenian king Tigran II was defeated in 66 B.C., his land became part of this empire",the Roman Empire,NA
2006-03-09,J,ETHNIC GROUPS,,1000,"At around 20% in each country, this ethnic group is the largest minority in both Turkey & Iraq",the Kurds,NA
2006-03-09,J,GAME SHOW CATCHPHRASES,"(Alex: You identify the game show, of course.)",1000,"""Survey said!""",Family Feud,NA
2006-03-09,J,TEDDY ROOSEVELT SPEAKS,,1000,"Teddy Roosevelt reportedly said that this predecessor had ""as much backbone as a chocolate eclair""",William McKinley,NA
2006-03-09,J,ANOTHER WORD IN THESAURUS,"(Alex: Each correct response will be made up of the letters in the word ""thesaurus"" itself--keep that in mind.)",1000,Last name of the Pointillist artist who died in 1891 at age 31,Seurat,NA
2006-03-09,J,GET YOUR KICKS,,1000,"Fast blows & kicks abound in this martial art whose name comes from Japanese words meaning ""empty hand""",karate,NA
2006-03-09,J,ON ROUTE 66,,1000,"As it has an atomic number of 66, the chemical element dysprosium has 66 of these in each atom",protons,NA
2006-03-09,DJ,EUROPEAN HISTORY,,400,"Enticed by a 1915 treaty giving it Trieste, this country joined WWI's Allies",Italy,NA
2006-03-09,DJ,FILMS OF THE '50s,,400,"Jimmy Stewart has a broken leg when this film begins; at the end, his voyeurism gets him a second broken leg",Rear Window (A Rear Window accepted),NA
2006-03-09,DJ,HEMINGWAY WORKS IN OTHER WORDS,,400,"""Grandpa with Ocean""",The Old Man and the Sea,NA
2006-03-09,DJ,"HEY, MUSCLES!",,400,"Of 100, 300 or 600, the one closest to the total number of muscles in the human body",600,NA
2006-03-09,DJ,"IT'S ON ""R"" MAPS",,400,"Embankments have been built on this ""colorful"" 500-mile Vietnamese river to keep rice fields from flooding",the Red River,NA
2006-03-09,DJ,LET'S SPEAK RUSSIAN,,400,"Russian words for drinks include vodka & voda, which means this",water,NA
2006-03-09,DJ,EUROPEAN HISTORY,,800,The 1568 martyrdom of the Comte d'Egmont began the Dutch revolt against Philip II of this country,Spain,NA
2006-03-09,DJ,FILMS OF THE '50s,,800,Frank Sinatra played lovable gambler Nathan Detroit in this 1955 movie musical,Guys & Dolls,NA
2006-03-09,DJ,HEMINGWAY WORKS IN OTHER WORDS,,800,"""So Long, Weaponry""",A Farewell to Arms,NA
2006-03-09,DJ,"HEY, MUSCLES!",,800,"On a cat, the arrector pili muscles along the back cause this response to stress",the hair stand up on the cat\'s back,NA
2006-03-09,DJ,"IT'S ON ""R"" MAPS",,800,"""The Photo Capital of the World"", this city in New York is also the birthplace of American Spiritualism",Rochester,NA
2006-03-09,DJ,LET'S SPEAK RUSSIAN,,800,"Stop the presses--it's the Russian word for ""truth""",pravda,NA
2006-03-09,DJ,EUROPEAN HISTORY,,1200,"He captained the Victory, Lord Nelson's flagship, at Trafalgar (remember the quote)",Hardy,NA
2006-03-09,DJ,FILMS OF THE '50s,,1200,Rich brothers William Holden & Humphrey Bogart vie for the chauffeur's daughter in this 1954 classic,Sabrina,NA
2006-03-09,DJ,HEMINGWAY WORKS IN OTHER WORDS,,1200,"""One Transferable Banquet""",A Moveable Feast,NA
2006-03-09,DJ,"HEY, MUSCLES!",,1200,Inhaling & exhaling result mainly from the contraction & expansion of this dome-shaped muscle,the diaphragm,NA
2006-03-09,DJ,"IT'S ON ""R"" MAPS",,1200,"It's ""The Pretzel City"", Pennsylvania, but you might call it the Monopoly railroad city",Reading,NA
2006-03-09,DJ,LET'S SPEAK RUSSIAN,,1200,"Written out here, it's a familiar way to say ""goodbye""",dosvidanya,http://www.j-archive.com/media/2006-03-09_DJ_09.jpg
2006-03-09,DJ,EUROPEAN HISTORY,,1600,"In the 700s, Pepin's widow Plectrude got hammered by Charles Martel vying for rule over these people",the Franks,NA
2006-03-09,DJ,FILMS OF THE '50s,,NA,Alan Jay Lerner won the Oscar for Best Screenplay for this 1951 musical about an expatriate,An American in Paris,NA
2006-03-09,DJ,HEMINGWAY WORKS IN OTHER WORDS,,1600,"""A Star Ascends As Well""",The Sun Also Rises,NA
2006-03-09,DJ,"HEY, MUSCLES!",,1600,"Eeeeek!  By definition, this muscle of the back of the arm has 3 heads",the triceps,NA
2006-03-09,DJ,"IT'S ON ""R"" MAPS",,NA,It's the East River location of the New York City jail,Riker\'s Island,NA
2006-03-09,DJ,LET'S SPEAK RUSSIAN,,1600,This Russian term for a sled drawn by 3 horses has made its way into English,troika,NA
2006-03-09,DJ,EUROPEAN HISTORY,,2000,"In 1991, republics of the former Soviet Union formed the CIS, which stands for this",the Commonwealth of Independent States,NA
2006-03-09,DJ,FILMS OF THE '50s,,2000,"The 2 1950s films starring Grace Kelly with ""High"" in the title",High Society & High Noon,NA
2006-03-09,DJ,HEMINGWAY WORKS IN OTHER WORDS,,2000,"""Extinction Following Lunch""",Death in the Afternoon,NA
2006-03-09,DJ,"HEY, MUSCLES!",,2000,This post-Hippocratic 2nd century Greek physician was the first to discover that muscles work in pairs,Galen,NA
2006-03-09,DJ,"IT'S ON ""R"" MAPS",,2000,In early 2002 Yasir Arafat was confined to his compound in this West Bank city,Ramallah,NA
2006-03-09,DJ,LET'S SPEAK RUSSIAN,,2000,"(Cheryl of the Clue Crew strolls down a street in Moscow, Russia.)  So that I could be polite in Russia, I made sure to learn puzhalusta for ""please"" & this basic word for ""thank you""",spasiba,http://www.j-archive.com/media/2006-03-09_DJ_11.jpg
2006-03-09,FJ,ISLANDS,,NA,"Despite landmines dating from 1982, penguins use these islands for mating grounds, being too light to set them off",the Falkland Islands,NA
