date,round,category,comment,value,clue,response,link
1998-10-19,J,19th CENTURY AMERICA,,100,"This author's brother, Henry Ward Beecher, was involved in a sex scandal in 1874",Harriet Beecher Stowe,NA
1998-10-19,J,ARTSY FILMS,,100,Playing an artist in this film earned Greg Kinnear an Oscar nomination,As Good as It Gets,NA
1998-10-19,J,SHIPS,,100,"On July 21, 1997 this ""old"" ship celebrated the 200th anniversary of its launch by sailing into Boston harbor","the Constitution (""Old Ironsides"")",NA
1998-10-19,J,ANAGRAMMED U.S. CITIES,,100,"SAY CURSE,New York",Syracuse,NA
1998-10-19,J,KING KRAZY,,100,This multi-decade movie star is Skull Island's favorite son,King Kong,http://www.j-archive.com/media/1998-10-19_J_18.jpg
1998-10-19,J,"""QUEEN"" FOR A DAY",,100,"In Wonderland, she cries ""Off with"" Alice's ""head""!  What a card!",the Queen of Hearts,NA
1998-10-19,J,19th CENTURY AMERICA,,200,"In 1870 he published his ""National Photographic Collection of War Views and Portraits....""",Mathew Brady,NA
1998-10-19,J,ARTSY FILMS,,200,Tim Roth played the artist Van Gogh & Paul Rhys played his brother in this 1990 film,Vincent and Theo,NA
1998-10-19,J,SHIPS,,200,In 1808 this ship's John Adams was found on Pitcairn Island; he was the only adult male still there,the Bounty,NA
1998-10-19,J,ANAGRAMMED U.S. CITIES,,200,"NEDGO,Utah",Ogden,NA
1998-10-19,J,KING KRAZY,,200,"As his many ex-wives could tell you, he's the ""live wire"" seen here",Larry King,http://www.j-archive.com/media/1998-10-19_J_19.jpg
1998-10-19,J,"""QUEEN"" FOR A DAY",,200,"It's the state indicated here, mate",Queensland (in Australia),NA
1998-10-19,J,19th CENTURY AMERICA,,300,"This New York ""boss"" fled to Europe but was captured by Spaniards who recognized him from a cartoon",Boss Tweed,NA
1998-10-19,J,ARTSY FILMS,,300,"In the 1998 film version of this Dickens novel, the hero not only pines for Estella, he sketches her",Great Expectations,NA
1998-10-19,J,SHIPS,,300,In 1960 Johnny Horton had a No. 3 hit with a song about the sinking of this German battleship,the Bismarck,NA
1998-10-19,J,ANAGRAMMED U.S. CITIES,,300,"SNAIL IS OUT,Missouri",Saint Louis,NA
1998-10-19,J,KING KRAZY,,300,"Fierce ""royal"" ready to strike here",a king cobra,http://www.j-archive.com/media/1998-10-19_J_20.jpg
1998-10-19,J,"""QUEEN"" FOR A DAY",,300,"There's no mystery that this sleuth solved ""The Roman Hat Mystery"" & ""The French Powder Mystery""",Ellery Queen,NA
1998-10-19,J,19th CENTURY AMERICA,,400,This lady bandit & her Cherokee husband lived in a cabin that served as a hideout for western outlaws,Belle Starr,NA
1998-10-19,J,ARTSY FILMS,,NA,This 1996 film takes its title from Valerie Solanas' confession of attacking a pop artist,"I Shot Andy Warhol""",NA
1998-10-19,J,SHIPS,,400,"On March 25, 1961 Elvis Presley performed at Honolulu's Bloch Arena to raise money for this ship's memorial",the Arizona,NA
1998-10-19,J,ANAGRAMMED U.S. CITIES,,400,"OLE SAP,Texas",El Paso,NA
1998-10-19,J,KING KRAZY,,400,Clergyman seen here in 1956,Martin Luther King,http://www.j-archive.com/media/1998-10-19_J_21.jpg
1998-10-19,J,"""QUEEN"" FOR A DAY",,400,She's the egg-laying pest seen here,Queen termite,NA
1998-10-19,J,19th CENTURY AMERICA,,500,"The provisional constitution of the Confederacy was adopted on February 8, 1861 in this city","Montgomery, Alabama",NA
1998-10-19,J,ARTSY FILMS,,500,Liv Tyler posed for a sculptor played by Donal McCann in this 1996 Bertolucci film,Stealing Beauty,NA
1998-10-19,J,SHIPS,,500,The arrival of this Cunard liner shortly after the Titanic sank prevented further loss of life,the Carpathia,NA
1998-10-19,J,ANAGRAMMED U.S. CITIES,,500,"PLAINS,Georgia",Plains,NA
1998-10-19,J,KING KRAZY,,500,"The ""belted"" type of this beauty is seen here",a kingfisher,http://www.j-archive.com/media/1998-10-19_J_22.jpg
1998-10-19,J,"""QUEEN"" FOR A DAY",,500,"The 9th man with this title, he was responsible for the laws of left hooks & right jabs",the Marquess of Queensbury,NA
1998-10-19,DJ,EUROPE,,200,This nice principality is 10 miles from Nice,Monaco,NA
1998-10-19,DJ,20th CENTURY WOMEN,,200,This big name in women's fashion launched her DKNY Menswear collection in 1993,Donna Karan,NA
1998-10-19,DJ,NOVEL VOCABULARY,,200,"In ""Sense And Sensibility"", this part of a letter is called the direction",Address,NA
1998-10-19,DJ,TV NICKNAMES,,200,"Aaay!  Fonzie called this character ""Shortcake"" on ""Happy Days""",Joanie Cunningham,NA
1998-10-19,DJ,PLACIDO DOMINGO,,200,In 1968 Placido made his debut at this New York opera house with only 35 minutes notice,Metropolitan Opera House,NA
1998-10-19,DJ,"""QUE"" TIPS",,200,This type of show with broad humor arose in the 1860s; the striptease came about 60 years later,Burlesque,NA
1998-10-19,DJ,EUROPE,,400,Helsinki is situated on the Gulf of this,Finland,NA
1998-10-19,DJ,20th CENTURY WOMEN,,400,"Her gold medal vault at the 1984 Olympics was a perfect ""10""",Mary Lou Retton,NA
1998-10-19,DJ,NOVEL VOCABULARY,,400,"In this novel, Jonathan Harker overhears the word ""vrolok"" & finds out it means ""werewolf or vampire""","""Dracula""",NA
1998-10-19,DJ,TV NICKNAMES,,400,Get intelligent & tell me Barbara Feldon's numerical TV nickname,Agent 99,NA
1998-10-19,DJ,PLACIDO DOMINGO,,400,Placido is associated with the title role of this 1887 Verdi opera based on a Shakespearean tragedy,"""Othello""",NA
1998-10-19,DJ,"""QUE"" TIPS",,400,"In an Edgar Allan Poe story, Prince Prospero gives one in which the Red Death appears",Masque,NA
1998-10-19,DJ,EUROPE,,600,"Catalan cuisine is featured at Set Portes, a 161-year-old restaurant in this Catalonian city",Barcelona,NA
1998-10-19,DJ,20th CENTURY WOMEN,,600,"Born in Tarlac province in 1933, her original name was Maria Corazon Cojuangco",Corazon Aquino,NA
1998-10-19,DJ,NOVEL VOCABULARY,,600,"His novel ""Lord Jim"" uses the term cat's-paws for breezes that ruffle the surface of the sea",Joseph Conrad,NA
1998-10-19,DJ,TV NICKNAMES,,600,"As Sherman Hemsley could tell you, this actress played ""Weezie""",Isabel Sanford,NA
1998-10-19,DJ,PLACIDO DOMINGO,,600,"In the 1984 movie of a Bizet opera, Placido was Don Jose & Julia Migenes-Johnson was this title character",Carmen,NA
1998-10-19,DJ,"""QUE"" TIPS",,600,"Suggestive of impropriety, such as a joke or manner of dress",Risque,NA
1998-10-19,DJ,EUROPE,,800,"When in Prague, this saint's cathedral may make you want to ""dance""",St. Vitus,NA
1998-10-19,DJ,20th CENTURY WOMEN,,NA,"In the 1920s she wrote, ""In soloing....it is far easier to start something than it is to finish it""",Amelia Earhart,NA
1998-10-19,DJ,NOVEL VOCABULARY,,800,"In ""1984"" standard English is known as this, in contrast to newspeak",Oldspeak,NA
1998-10-19,DJ,TV NICKNAMES,,800,"It's the nickname of the ""M*A*S*H"" character from Crabapple Cove, Maine","Benjamin ""Hawkeye"" Pierce",NA
1998-10-19,DJ,PLACIDO DOMINGO,,800,"Placido has conducted this Puccini opera, as well as sung the part of Rodolfo",La bohème,NA
1998-10-19,DJ,"""QUE"" TIPS",,NA,"Tchaikovsky died a few weeks after the debut of this symphony which has been called his ""swan song""",Pathetique Symphony,NA
1998-10-19,DJ,EUROPE,,1000,The Kalamatianos is one of the most popular wedding dances of this country,Greece,NA
1998-10-19,DJ,20th CENTURY WOMEN,,1000,Hanna Suchocka became this eastern European country's first female prime minister in 1992,Poland,NA
1998-10-19,DJ,NOVEL VOCABULARY,,1000,"Cedric spoke of this kind of knife in ""Ivanhoe"" years after Hamlet mentioned a ""bare"" one",Bodkin,NA
1998-10-19,DJ,TV NICKNAMES,,1000,"This actor turned the tables as ""Venus Flytrap""",Tim Reid,NA
1998-10-19,DJ,PLACIDO DOMINGO,,1000,"On a 1984 TV special, Carol Burnett sang ""Be A Clown"" & Placido sang an aria from this clown opera","""Pagliacci""",NA
1998-10-19,DJ,"""QUE"" TIPS",,1000,Medical use of the rhesus species of this monkey declined when India halted its export in 1978,Macaque,NA
1998-10-19,FJ,HISTORIC LEADERS,,NA,"His 1830 last testament read, ""I aspire to no other glory than the consolidation of Colombia""",Simon Bolivar,NA
