date,round,category,comment,value,clue,response,link
1998-01-29,J,LITTLE MOVIES,,100,Edward G. Robinson snarled his way to stardom as Rico Bandello in this 1930 gangster classic,Little Caesar,NA
1998-01-29,J,JIMMY LOVES THAT COMPUTER,,100,"Jimmy swears by Windows, while his pal Ned sticks to this Apple system that Windows mimics",Macintosh,NA
1998-01-29,J,AMERICAN AUTHORS,,100,"He wrote amateur musical comedies at Princeton about 10 years before ""The Great Gatsby""",F. Scott Fitzgerald,NA
1998-01-29,J,FISH,,100,"Like humans, the lungfish has a heart with this many chambers",4,NA
1998-01-29,J,NEW JERSEYITES,,100,"Though he shares his name with a city in Ohio, this president was born in Caldwell, New Jersey",Cleveland,NA
1998-01-29,J,METAPHORICAL INSULTS,,100,Trixie has only one of these propellant devices in the water,an oar,NA
1998-01-29,J,LITTLE MOVIES,,200,Jack Nicholson played a dental patient in this film that inspired a musical about a bloodthirsty flower,Little Shop of Horrors,NA
1998-01-29,J,JIMMY LOVES THAT COMPUTER,,200,"On Jimmy's monitor, this moving image that prevents burn-in is comely model Tippy Sealy",a screensaver,NA
1998-01-29,J,AMERICAN AUTHORS,,200,"As a war correspondant, this Tarzan creator witnessed the Japanese attack on Pearl Harbor",Edgar Rice Burroughs,NA
1998-01-29,J,FISH,,200,"Like some gouramis, several grunts are famous for doing this when 2 of them meet",kissing,NA
1998-01-29,J,NEW JERSEYITES,,NA,"Pair seen here--they were both born in New Jersey""All right, you take Joan and I'll take Sandra.""""Oh, Sandra sends me.""""Well then I'll take Joan!""""Joan sends me too.""""Now listen, you...  I'm going to send you!""""Sorry, you don't even appeal to me.""",Abbott & Costello,NA
1998-01-29,J,METAPHORICAL INSULTS,,200,"Abner's device perfected by Otis ""doesn't go to the top floor""",the elevator,NA
1998-01-29,J,LITTLE MOVIES,,300,"She played ""The Little Girl Who Lives Down the Lane"" before she directed ""Little Man Tate""",Jodie Foster,NA
1998-01-29,J,JIMMY LOVES THAT COMPUTER,,300,"Jimmy learned HTML, hypertext markup language, to create this, addressable at jimmyland.com",his web site,NA
1998-01-29,J,AMERICAN AUTHORS,,300,"He began his ""Goosebumps"" series with 1992's ""Welcome to Dead House""",R.L. Stine,NA
1998-01-29,J,FISH,,300,Aquarium fish include the fighting fish & this one that shares its name with the Manassa Mauler,Jack Dempsey,NA
1998-01-29,J,NEW JERSEYITES,,300,"Englewood would always ""Welcome Back"" this ex-sweathog born there February 18, 1954",John Travolta,NA
1998-01-29,J,METAPHORICAL INSULTS,,300,Mitzi is this device that doesn't emit enough luminescence,a dim bulb,NA
1998-01-29,J,LITTLE MOVIES,,400,Richard Mulligan passed muster & was cast as General Custer in this Dustin Hoffman film,Little Big Man,NA
1998-01-29,J,JIMMY LOVES THAT COMPUTER,,400,"Jimmy created one of these to catalog his coin collection, with fields including date & nation of origin",a database,NA
1998-01-29,J,AMERICAN AUTHORS,,400,"Harper Lee helped him research an article which developed into the work ""In Cold Blood""",Truman Capote,NA
1998-01-29,J,FISH,,400,This name for the rock bass sounds like it takes late-night flights,the redeye,NA
1998-01-29,J,NEW JERSEYITES,,400,Middle name of Chatham-born merchant Aaron Ward,Montgomery,NA
1998-01-29,J,METAPHORICAL INSULTS,,400,"The lights are on, but this is Skippy's problem",no one\'s home,NA
1998-01-29,J,LITTLE MOVIES,,500,"Katharine Hepburn's film ""The Little Minister"" was based on a play by this creator of Peter Pan",(Sir James) Barrie,NA
1998-01-29,J,JIMMY LOVES THAT COMPUTER,,500,"Ironically, Jimmy spent the second Sunday in May replacing this, his PC's main circuit board",a motherboard,NA
1998-01-29,J,AMERICAN AUTHORS,,500,"In 1962 this ""Cardinal Sins"" author received the Edison Award for his ""Catholic Hour"" radio broadcasts",(Andrew) Greeley,NA
1998-01-29,J,FISH,,500,Clown fish can avoid their enemies by swimming among these marine polyps with a floral name,anemones,NA
1998-01-29,J,NEW JERSEYITES,,500,"This Trenton-born Colorado explorer was killed in an 1813 assault on York, Canada; he was ""piqued""",(Zebulon) Pike,NA
1998-01-29,J,METAPHORICAL INSULTS,,500,"Biff could be thick as one, or one short of a load",a brick,NA
1998-01-29,DJ,BIG MOVIES,,200,"""Big Jake"" was the last of 5 films this big guy made with Maureen O'Hara",John Wayne,NA
1998-01-29,DJ,ARCHITECTS,,200,The Old State House Charles Bullfinch designed for this Connecticut city is now the city hall,Hartford,NA
1998-01-29,DJ,WORLD GEOGRAPHY,,200,"Bavaria, this country's southernmost state, is also its largest in area",Germany,NA
1998-01-29,DJ,SOUNDING OFF,,200,"Nickname of Edmund Gibson, who hunted owls as a youth & starred in Westerns as an adult","""Hoot""",NA
1998-01-29,DJ,I'M WARNING YOU...,,200,"He ignored the warning ""Don't go into Mr. McGregor's garden""",Peter Rabbit,NA
1998-01-29,DJ,NOW GET OUT!,,200,"She left the Philippines with her husband on Feb. 26, 1986, leaving 3,000 pairs of shoes behind",Imelda Marcos,NA
1998-01-29,DJ,BIG MOVIES,,400,"Lily Tomlin & this actress were just ""divine"" as pairs of mismatched twins in ""Big Business""",Bette Midler,NA
1998-01-29,DJ,ARCHITECTS,,400,"Two 60,000-pound statues of these graceful birds top a Disney World hotel designed by Michael Graves",swans,NA
1998-01-29,DJ,WORLD GEOGRAPHY,,400,"Asia's longest river, it's called ""China's fortune"" because of its fertile soil & economic importance",the Yangtze,NA
1998-01-29,DJ,SOUNDING OFF,,400,"A hit 1965 musical was called this ""of the Greasepaint, the Smell of the Crowd""",The Roar,NA
1998-01-29,DJ,I'M WARNING YOU...,,400,"In a hit song, Dion warned, ""Keep away from"" this title female: she ""goes out with other guys""",Runaround Sue,NA
1998-01-29,DJ,NOW GET OUT!,,400,"Chris Patten, governor of this British colony, left it on July 1, 1997 on the royal yacht Britannia",Hong Kong,NA
1998-01-29,DJ,BIG MOVIES,,NA,"Most of Kevin Costner's scenes were cut from this film, except for his opening bits as a corpse",The Big Chill,NA
1998-01-29,DJ,ARCHITECTS,,600,Philip Johnson designed the Abby Aldrich Rockefeller Sculpture Garden at this Manhattan museum,MOMA (the Museum of Modern Art),NA
1998-01-29,DJ,WORLD GEOGRAPHY,,600,This small island nation in the North Atlantic has more than 100 volcanoes,Iceland,NA
1998-01-29,DJ,SOUNDING OFF,,600,"Someone who creates high expectations & can't fulfill them is ""all"" this ""and no steak""",sizzle,NA
1998-01-29,DJ,I'M WARNING YOU...,,600,"He warned Nixon that there was a cancer growing on the presidency, & it's on tape",John Dean,NA
1998-01-29,DJ,NOW GET OUT!,,600,This country has exiled Norodam Sihanouk twice & twice crowned him king,Cambodia,NA
1998-01-29,DJ,BIG MOVIES,,800,"Her daughter Tracy Reiner appeared as a test market researcher in her film ""Big""",Penny Marshall,NA
1998-01-29,DJ,ARCHITECTS,,800,"I.M. Pei designed the 75-story Texas Commerce Tower, the tallest building in this city",Houston,NA
1998-01-29,DJ,WORLD GEOGRAPHY,,NA,763-foot Mount Royal stands in the center of this Canadian city,Montreal,NA
1998-01-29,DJ,SOUNDING OFF,,800,"An organized illegal activity, like extortion",a racket,NA
1998-01-29,DJ,I'M WARNING YOU...,,800,"After hearing dire warnings, King Saul regretted having the spirit of this prophet raised at Endor",Samuel,NA
1998-01-29,DJ,NOW GET OUT!,,800,"In 1994, 2 days after Philippe Biamby & Raoul Cedras left Haiti for exile, this president returned",(Jean-Bertrand) Aristide,NA
1998-01-29,DJ,BIG MOVIES,,1000,Sausage King Jimmy Dean played a former sheriff in this 1990 film named for his biggest hit record,Big Bad John,NA
1998-01-29,DJ,ARCHITECTS,,1000,In the 1960s John Carl Warnecke redesigned this city's Lafeyette Square to include 2 new government buildings,"Washington, D.C.",NA
1998-01-29,DJ,WORLD GEOGRAPHY,,1000,"Deep granite gorges of this river have led some to call it ""the crease in the map of Spain""",the Tagus,NA
1998-01-29,DJ,SOUNDING OFF,,1000,"Analogous to a type of light, this kind of sound contains all audible frequencies",white noise,NA
1998-01-29,DJ,I'M WARNING YOU...,,1000,"Title of a 1972 Tennessee Williams play, they're advisories put out to boat-owners in high winds",small craft warnings,NA
1998-01-29,DJ,NOW GET OUT!,,1000,"After the Mormons left this Illinois town in 1846, a group of French socialists moved in",Nauvoo,NA
1998-01-29,FJ,THE NOBEL PRIZE,,NA,All the medals have Alfred Nobel on 1 side; these 2 categories share an identical design on the reverse,Chemistry & Physics,NA
