date,round,category,comment,value,clue,response,link
1998-11-17,J,U.S. GEOGRAPHY,,100,"Over its 2,340-mile course, this river forms the boundary or part of the boundary of 9 states",Mississippi,NA
1998-11-17,J,ON THE COVER OF ROLLING STONE,,100,"He appeared alone on Rolling Stone's first cover November 9, 1967 & nude with Yoko a year later",John Lennon,NA
1998-11-17,J,DECADES,,100,Hurricane Andrew hits Florida,1990s,NA
1998-11-17,J,ENDANGERED SPECIES,,100,The endangered red variety of this animal once ranged from the Atlantic to Texas,Wolf,NA
1998-11-17,J,NEW FOOD PRODUCTS,,100,"Introduced in 1982, it used the slogan ""Just for the taste of it""",Diet Coke,NA
1998-11-17,J,PEOPLE IN HISTORY,,100,Talleyrand resigned from this emperor's service in 1807 & began intriguing against him,Napoleon,NA
1998-11-17,J,U.S. GEOGRAPHY,,200,It's the largest body of fresh water lying entirely within the USA,Lake Michigan,NA
1998-11-17,J,ON THE COVER OF ROLLING STONE,,200,"The stars of this sitcom, including Jason Alexander, hit the yellow brick road for the 1998 30th anniversary cover",Seinfeld,NA
1998-11-17,J,DECADES,,200,"""I Love Lucy"" premieres",1950s,NA
1998-11-17,J,ENDANGERED SPECIES,,200,It's the dark endangered species seen here,a black rhinoceros,http://www.j-archive.com/media/1998-11-17_J_25.jpg
1998-11-17,J,NEW FOOD PRODUCTS,,200,"A syrup named for this ""Mrs."" was introduced in 1961; a pancake mix with her name on it came out in 1982",Mrs. Butterworth,NA
1998-11-17,J,PEOPLE IN HISTORY,,200,"Her husband, Franklin, was the godson of her father, Elliott",Eleanor Roosevelt,NA
1998-11-17,J,U.S. GEOGRAPHY,,300,Colorado's Mount Elbert in the Sawatch range is this mountain system's tallest peak,Rockies,NA
1998-11-17,J,ON THE COVER OF ROLLING STONE,,300,"He should get some ""Satisfaction"" knowing he's been on the cover more times than anyone else",Mick Jagger,NA
1998-11-17,J,DECADES,,NA,Last time a man walked on the moon,1970s (1972),NA
1998-11-17,J,ENDANGERED SPECIES,,300,In 1941 there were less than 2 dozen of this type of crane in North America,Whooping crane,NA
1998-11-17,J,NEW FOOD PRODUCTS,,300,Frank Epperson created it in 1923 when he pulled lemonade frozen onto a spoon out of a glass,Popsicle,NA
1998-11-17,J,PEOPLE IN HISTORY,,300,"Drunk or sober, no one dared call this hatchet-wielding saloon smasher ""Old Hatchet-Face""",Carrie Nation,NA
1998-11-17,J,U.S. GEOGRAPHY,,400,Francisco de Ortega is credited with discovering this strait leading into San Francisco Bay,Golden Gate,NA
1998-11-17,J,ON THE COVER OF ROLLING STONE,,400,Anthony Kiedis went solo for a 1994 cover & appeared with this group on a '95 cover,Red Hot Chili Peppers,NA
1998-11-17,J,DECADES,,400,Ferdinand Marcos leaves the Philippines for the last time,1980s,NA
1998-11-17,J,ENDANGERED SPECIES,,400,This endangered species of brown bear can grow to a height of 8 feet,Grizzly bear,NA
1998-11-17,J,NEW FOOD PRODUCTS,,400,In 1993 Hershey introduced these white & milk chocolate treats as a companion to its Kisses,Hugs,NA
1998-11-17,J,PEOPLE IN HISTORY,,400,"Besides founding Pennsylvania, he found time to father more than 10 children",William Penn,NA
1998-11-17,J,U.S. GEOGRAPHY,,500,This 113-mile sand bar along Texas' Gulf Coast is the state's largest island,Padre Island,NA
1998-11-17,J,ON THE COVER OF ROLLING STONE,,500,"""Nothing Compares"" to this singer seen on covers in 1990 & '91, & with even less hair in '92",Sinead O\'Connor,NA
1998-11-17,J,DECADES,,500,Chinese Nationalist government flees to Taiwan,1940s,NA
1998-11-17,J,ENDANGERED SPECIES,,500,Use of pesticides like DDT have been a major cause of this type of falcon's decline,Peregrine falcon,NA
1998-11-17,J,NEW FOOD PRODUCTS,,500,In 1998 Frito-Lay introduced this line of olean-containing chips nationwide,WOW Chips,NA
1998-11-17,J,PEOPLE IN HISTORY,,500,"""The people made the Constitution and the people can unmake it"", said this fourth chief justice",John Marshall,NA
1998-11-17,DJ,CAMBRIDGE (THE OTHER ONE),(Alex: Not the one here!),200,This lord & poet known for his licentious behavior actually kept a pet bear at Cambridge,Lord Byron,NA
1998-11-17,DJ,BOSTON TV,,200,Everybody knows the name of this long-running sitcom inspired by Boston's Bull & Finch Pub,Cheers,NA
1998-11-17,DJ,WHAT'S THE CURRENCY?,,200,This is worth 100 pence,British pound,NA
1998-11-17,DJ,WOOD WORDS,,200,"An item in a political platform, or a bad way off a pirate ship",Plank,NA
1998-11-17,DJ,BERNSTEINS,,200,"Jodie Bernstein, consumer protection head for the FTC, helped kill this animal symbol of Reynolds Tobacco",Joe Camel,NA
1998-11-17,DJ,DR. SEUSS MEETS THE BARD,(Alex: You have to identify the play written by Dr. Seuss),200,"""To be, or not to be:  for soon there will be no more me""",Hamlet,NA
1998-11-17,DJ,CAMBRIDGE (THE OTHER ONE),(Alex: Not the one here!),400,"This 1929 graduate acted at Cambridge long before hosting ""Masterpiece Theatre""",Alistair Cooke,NA
1998-11-17,DJ,BOSTON TV,,400,"Its staff included doctors Donald Westphall, Mark Craig & Victor Ehrlich",St. Elsewhere,NA
1998-11-17,DJ,WHAT'S THE CURRENCY?,,400,This is equal to 100 pfennigs,Deutsch mark,NA
1998-11-17,DJ,WOOD WORDS,,400,"Get on the pirate ship, or a place for a company officer to sit",Board,NA
1998-11-17,DJ,BERNSTEINS,,400,In the '50s Walter Bernstein joined other Hollywood writers on this most unwanted list,Blacklist,NA
1998-11-17,DJ,DR. SEUSS MEETS THE BARD,(Alex: You have to identify the play written by Dr. Seuss),400,"""Kiss me, Kate, though you're a meanie; now go cook some spaghettini!""",Taming of the Shrew,NA
1998-11-17,DJ,CAMBRIDGE (THE OTHER ONE),(Alex: Not the one here!),600,"This lord protector studied at Sidney Sussex College, & now his head is buried there",Oliver Cromwell,NA
1998-11-17,DJ,BOSTON TV,,600,Dylan McDermott heads up a small Boston law firm on this Emmy-winning drama,The Practice,NA
1998-11-17,DJ,WHAT'S THE CURRENCY?,,600,This equals 100 sen,Japanese yen,NA
1998-11-17,DJ,WOOD WORDS,,600,"Cutting trees down, or a word that describes the Frankenstein monster's walk",Lumbering,NA
1998-11-17,DJ,BERNSTEINS,,600,Socialist Eduard Bernstein revised Karl Marx' ideas but stayed friends with this Marx pal & collaborator,Friedrich Engels,NA
1998-11-17,DJ,DR. SEUSS MEETS THE BARD,(Alex: You have to identify the play written by Dr. Seuss),600,"""My only love sprung from my only hate!  O!  Why can't I find a better date?""",Romeo And Juliet,NA
1998-11-17,DJ,CAMBRIDGE (THE OTHER ONE),(Alex: Not the one here!),NA,"Though he was an Oxford graduate, he was selected to design the library at Trinity College in the 1670s",Sir Christopher Wren,NA
1998-11-17,DJ,BOSTON TV,,800,"Richard Ruccolo, Ryan Reynolds & Traylor Howard stick together through thick & thin crust on this sitcom","Two Guys, A Girl, And A Pizza Place",NA
1998-11-17,DJ,WHAT'S THE CURRENCY?,,800,100 kopecks make up this,Russian ruble,NA
1998-11-17,DJ,WOOD WORDS,,800,"A measure of firewood, or a string you can use to bind it",cord,NA
1998-11-17,DJ,BERNSTEINS,,800,In 1988 Leonard Bernstein's 70th birthday gala was held at this music center in the Berkshires,Tanglewood,NA
1998-11-17,DJ,DR. SEUSS MEETS THE BARD,(Alex: You have to identify the play written by Dr. Seuss),800,"""Out, darned Spot!  Out, I say!  I can't make this blood go away!""",Macbeth,NA
1998-11-17,DJ,CAMBRIDGE (THE OTHER ONE),(Alex: Not the one here!),1000,In the early 1500s this Dutch humanist taught Greek at Cambridge,Erasmus,NA
1998-11-17,DJ,BOSTON TV,,1000,This Robert Urich series about a Boston detective was based on books by Robert B. Parker,Spenser: For Hire,NA
1998-11-17,DJ,WHAT'S THE CURRENCY?,,1000,This is equal to 100 centessimi,Italian lira,NA
1998-11-17,DJ,WOOD WORDS,,1000,"A long, squared-off piece of wood used in construction, or to smile ear-to-ear",Beam,NA
1998-11-17,DJ,BERNSTEINS,,1000,Henry Bernstein wrote a powerful play about this Biblical-era heroine who cut off Holofernes' head,Judith,NA
1998-11-17,DJ,DR. SEUSS MEETS THE BARD,(Alex: You have to identify the play written by Dr. Seuss),NA,"""I lov'd not wisely but too well; killed my wife, that's just not swell""",Othello,NA
1998-11-17,FJ,SPORTS & RECREATION,,NA,"Pioneered by pro hockey player Scott Olsen, it had 3 million U.S. participants in 1989 & has 30 million now",rollerblading,NA
