date,round,category,comment,value,clue,response,link
2006-05-04,J,MYTHOLOGY & ART,,200,"(Kelly of the Clue Crew plays art professor, a slide of a famous work appearing behind her.)  In Fragonard's ""The Meeting"", she steps out of Roman mythology to look down on the young lovers",Venus,http://www.j-archive.com/media/2006-05-04_J_03a.jpg
2006-05-04,J,AUTO FOCUS,,200,The Town Car from this car line was originally built as a car for Henry Ford,Lincoln,NA
2006-05-04,J,DEAR JOHN,,200,He was Tony Blair's immediate predecessor as prime minister,John Major,NA
2006-05-04,J,RHYME QUIZ,"(Alex: Each correct response will rhyme with the word ""quiz"".)",200,Belonging to him,his,NA
2006-05-04,J,SIMPSONS CHARACTERS,,200,"Among his one-liners: ""Mmm... maca-ma-damia nuts"", ""Mmm... snouts"" & ""Mmm... organized crime""",Homer Simpson,NA
2006-05-04,J,DOUGH!,,200,"Until the euro debuted there in 2002, a builder would spend guilders to buy girders in this country",the Netherlands,NA
2006-05-04,J,MYTHOLOGY & ART,,400,The Smithsonian has a semi-nude statue of George Washington based on a statue of this greatest Greek god,Zeus,NA
2006-05-04,J,AUTO FOCUS,,400,"Incorporated in 1915, it designed its cars to withstand Sweden's rough roads & cold temperatures",Volvo,NA
2006-05-04,J,DEAR JOHN,,400,"He once said, ""I don't smoke much, and I drink very little.  I guess my only bad habit is robbing banks""",John Dillinger,NA
2006-05-04,J,RHYME QUIZ,"(Alex: Each correct response will rhyme with the word ""quiz"".)",400,"Richard Burton's wife, twice",Liz,NA
2006-05-04,J,SIMPSONS CHARACTERS,,400,"In ""Today I Am a Clown"", he held his long-delayed Bar Mitzvah in a stadium & invited Mr. T to read from the Torah",Krusty the Clown,NA
2006-05-04,J,DOUGH!,,400,"When Mike Wallace asked, ""How much did you lose from AOL Time Warner?"", he said, ""$7 billion or $8 billion"", but who's counting?",Ted Turner,NA
2006-05-04,J,MYTHOLOGY & ART,,600,"(Cheryl of the Clue Crew stands with a gold statue in Peterhofm St. Petersberg, Russia.)  The statue of Perseus here at Peterhof holds the head of this Gorgon who's made to look like King Charles XII of Sweden",Medusa,http://www.j-archive.com/media/2006-05-04_J_05a.jpg
2006-05-04,J,AUTO FOCUS,,600,"An ad agency gave this car company a name standing for feline qualities like grace, elegance, power & agility",Jaguar,NA
2006-05-04,J,DEAR JOHN,,600,This man at whose mill gold was discovered in 1848 later ran for governor of California,(John) Sutter,NA
2006-05-04,J,RHYME QUIZ,"(Alex: Each correct response will rhyme with the word ""quiz"".)",600,Slang for any line of work,biz,NA
2006-05-04,J,SIMPSONS CHARACTERS,,600,"Frank Gehry once built the town a concert hall, which was sold to this man, who promptly turned it into a prison",Montgomery Burns,NA
2006-05-04,J,DOUGH!,,600,"In 1954 there was no desire for the sen & rin, smaller denominations of this currency; they were removed from circulation",yen,NA
2006-05-04,J,MYTHOLOGY & ART,,800,The Farnese statue of this mythic hero leaning on his club was found in the Baths of Caracalla,Hercules,NA
2006-05-04,J,AUTO FOCUS,,800,"Datsun, which became this company, was changed from Datson because son meant ""loss"" in Japanese",Nissan,NA
2006-05-04,J,DEAR JOHN,,800,In 1946 he gave the United Nations a gift of $8.5 million to buy land for its NYC headquarters,(John D.) Rockefeller,NA
2006-05-04,J,RHYME QUIZ,"(Alex: Each correct response will rhyme with the word ""quiz"".)",800,A woman's title & a women's magazine,Ms.,NA
2006-05-04,J,SIMPSONS CHARACTERS,,800,This Kwik-E-Mart man once thought he was a hummingbird of some kind after working 96 hours straight,Apu,NA
2006-05-04,J,DOUGH!,,800,"Playing polo may not make you a billionaire, but Polo shirts might; just ask him, No. 67 on Forbes' 2005 list",Ralph Lauren,NA
2006-05-04,J,MYTHOLOGY & ART,,NA,Bernini's famous sculpture of this Greek god & Daphne is in Rome's Borghese Gallery,Apollo,http://www.j-archive.com/media/2006-05-04_J_20a.jpg
2006-05-04,J,AUTO FOCUS,,1000,This new division of Toyota aims for Generation XA & XB,the Scion,NA
2006-05-04,J,DEAR JOHN,,1000,"This author of the novel ""Falconer"" won a 1979 Pulitzer Prize for some of his short stories",John Cheever,NA
2006-05-04,J,RHYME QUIZ,"(Alex: Each correct response will rhyme with the word ""quiz"".)",1000,"Meaning ""namely"", it's an abbreviation of the Latin for ""it is permitted to see""",viz.,NA
2006-05-04,J,SIMPSONS CHARACTERS,,1000,"This Springfield Elementary employee said, ""There's nary an animal alive that can outrun a greased Scotsman""",Willie the Groundskeeper,http://www.j-archive.com/media/2006-05-04_J_13.mp3
2006-05-04,J,DOUGH!,,1000,"Opened in 2005, the Vegas resort hotel named for this man cost $2.7 billion to build",(Steve) Wynn,NA
2006-05-04,DJ,MOST DENSELY POPULATED COUNTRIES,,400,The densest is this small country that has been mostly under one family's rule for over 700 years,Monaco,NA
2006-05-04,DJ,MUSICAL THEATRE,,400,"In ""West Side Story"" this character sings ""I Feel Pretty""",Maria,NA
2006-05-04,DJ,THAT BLANKIN' SHAKESPEARE,,400,"""Henry IV, Part II"":""Uneasy lies the head that wears a ____""",crown,NA
2006-05-04,DJ,WANNA RACE?,,400,"For an Indy car, this figure is less than 2, which is not helpful in reducing our dependence on OPEC",miles per gallon,NA
2006-05-04,DJ,REVOLUTIONARY HEROES,,400,"The first signer of the Declaration of Independence, this merchant was said to be Boston's richest man",John Hancock,NA
2006-05-04,DJ,"CROSSWORD CLUES ""V""",,400,By way of(3),via,NA
2006-05-04,DJ,MOST DENSELY POPULATED COUNTRIES,,800,"In 2003 this republic, ranked No. 2, became the first Asian country to sign a free-trade pact with the U.S.",Singapore,NA
2006-05-04,DJ,MUSICAL THEATRE,,800,"This ""Guys and Dolls"" composer also gave us ""The Most Happy Fella"", about Tony the lovestruck wine-grower",Frank Loesser,NA
2006-05-04,DJ,THAT BLANKIN' SHAKESPEARE,,800,"""The Comedy of Errors"":""When in the why and the wherefore is neither ____ nor reason?""",rhyme,NA
2006-05-04,DJ,WANNA RACE?,,800,"In a NASCAR race the white flag means this, so it's now or never",the last lap,NA
2006-05-04,DJ,REVOLUTIONARY HEROES,,800,He lost command of his own Green Mountain Boys when the group was absorbed by the Continental Army,Ethan Allen,NA
2006-05-04,DJ,"CROSSWORD CLUES ""V""",,800,"Specifically, a peeping Tom(6)",voyeur,NA
2006-05-04,DJ,MOST DENSELY POPULATED COUNTRIES,,1200,Most of the people in this third-most-densely peopled country are employees of the state,Vatican City,NA
2006-05-04,DJ,MUSICAL THEATRE,,1200,"In ""Carousel"" this amusement park barker talks to Julie Jordan about marriage & she sings ""If I Loved You""",Billy Bigelow,NA
2006-05-04,DJ,THAT BLANKIN' SHAKESPEARE,,1200,"""A Midsummer Night's Dream"":""The course of ____  ____ never did run smooth""",true love,NA
2006-05-04,DJ,WANNA RACE?,,1200,"Several of these ""bars"" that ensure drivers' safety if the car flips make up a ""cage"" of the same name",roll bars,NA
2006-05-04,DJ,REVOLUTIONARY HEROES,,1200,"In 1777 this gen. known for his ""crazy"" daring took command of the regiments known as the Pennsylvania Line","""Mad"" Anthony Wayne",NA
2006-05-04,DJ,"CROSSWORD CLUES ""V""",,1200,"Malicious or poisonous, like a snake(8)",venomous,NA
2006-05-04,DJ,MOST DENSELY POPULATED COUNTRIES,,1600,"No. 6 is this independent kingdom, the first Gulf state to allow women to vote & run for office",Bahrain,NA
2006-05-04,DJ,MUSICAL THEATRE,,1600,"Although Rodgers & Hammerstein produced it, Irving Berlin wrote the songs, including ""Anything You Can Do""",Annie Get Your Gun,NA
2006-05-04,DJ,THAT BLANKIN' SHAKESPEARE,,NA,"""Henry IV, Part I"":""The better part of valor is ____""",discretion,NA
2006-05-04,DJ,WANNA RACE?,,1600,In racing the name of this low-tech weapon means passing the leader with a burst of speed,slingshot,NA
2006-05-04,DJ,REVOLUTIONARY HEROES,,NA,"When the House of Burgesses was dissolved in 1774, this orator led delegates in meetings at the Raleigh Tavern",Patrick Henry,NA
2006-05-04,DJ,"CROSSWORD CLUES ""V""",,1600,Foxlike(7),vulpine,NA
2006-05-04,DJ,MOST DENSELY POPULATED COUNTRIES,,2000,At No. 8 is this Asian country that caused controversy in 2003 by putting its name on its passport,Taiwan,NA
2006-05-04,DJ,MUSICAL THEATRE,,2000,"In a Tim Rice musical, Frederick & Anatoly vie to be world champion of this game",chess,NA
2006-05-04,DJ,THAT BLANKIN' SHAKESPEARE,,2000,"""As You Like It"":""Well said, that was laid on with a ____""",trowel,NA
2006-05-04,DJ,WANNA RACE?,,2000,"The top tip of a triangle, or the midpoint of a turn; you brake before it, then accelerate out of it",the apex,NA
2006-05-04,DJ,REVOLUTIONARY HEROES,,2000,"Called the ""financier of the American Revolution"", he later spent 3 years in debtor's prison",Robert Morris,NA
2006-05-04,DJ,"CROSSWORD CLUES ""V""",,2000,South American camel cousin(6),vicuña,NA
2006-05-04,FJ,MEMOIRS,,NA,"Chapters in this 1937 memoir include ""A Kikuyu Chief"", ""War-Time Safari"" & ""Old Knudsen""",Out of Africa (by Isak Dinesen),NA
