date,round,category,comment,value,clue,response,link
2006-05-11,J,THE NEW YORK TIMES BUSINESS,,200,"Union Pacific, HP & this Atlanta-based beverage company voted to impose limits on executive severance packages",Coca-Cola,NA
2006-05-11,J,LOVE SONGS IN GERMAN,,200,"Sonny & Cher:""Ich Hab Dich Babe""","""I Got You Babe""",NA
2006-05-11,J,FIRST IN OUR HEARTS,,200,The first U.S. coin with the likeness of a president was this coin based on a photo taken in Mathew Brady's studio,(the Lincoln) penny,NA
2006-05-11,J,IT'S NOT ALEX TREBEK,,200,"It's not me in the photo seen here, but it is this 1972 nominee",Spiro Agnew,http://www.j-archive.com/media/2006-05-11_J_11a.jpg
2006-05-11,J,SCIENCE BRIEFS,,200,An MMR vaccine stands for these 3 things it treats,"measles, mumps, & rubella",NA
2006-05-11,J,"RATED ""R""",,200,The Haymarket Square Riot came out of a strike against a company that made these farm machines,reapers,NA
2006-05-11,J,THE NEW YORK TIMES BUSINESS,,400,"This retailer's stock went up when it merged with Kmart, but it has room to improve operationally",Sears,NA
2006-05-11,J,LOVE SONGS IN GERMAN,,400,"The Partridge Family:""Ich Denke Ich Liebe Dich""","""I Think I Love You""",NA
2006-05-11,J,FIRST IN OUR HEARTS,,400,The first of these in the U.S. was for a potash process & was signed by Washington & Jefferson,a patent,NA
2006-05-11,J,IT'S NOT ALEX TREBEK,,400,"It's not me, it's this character, who spoke if you pulled a few strings",Charlie McCarthy,http://www.j-archive.com/media/2006-05-11_J_12a.jpg
2006-05-11,J,SCIENCE BRIEFS,,400,"""K"" can stand for kelvin or for this type of energy, from the Greek for ""to move""",kinetic,NA
2006-05-11,J,"RATED ""R""",,400,"It's the practice of engaging in bootlegging or extortion, for example",racketeering,NA
2006-05-11,J,THE NEW YORK TIMES BUSINESS,,600,Wal-Mart has been compared to this early grocery chain whose name goes back to 2 oceans,A&P,NA
2006-05-11,J,LOVE SONGS IN GERMAN,,600,"The Captain & Tennille:""Liebe Halt Uns Zusammen""","""Love Will Keep Us Together""",NA
2006-05-11,J,FIRST IN OUR HEARTS,,600,The first self-sustaining nuclear chain reaction was made by this Italian-American physicist in 1942,Fermi,NA
2006-05-11,J,IT'S NOT ALEX TREBEK,,600,"Despite the uncanny resemblance in the photo seen here, it's actually this Russian born in 1870",Lenin,http://www.j-archive.com/media/2006-05-11_J_16a.jpg
2006-05-11,J,SCIENCE BRIEFS,,600,"Conceived around 1686, ""G"" is known as this man's constant",Newton,NA
2006-05-11,J,"RATED ""R""",,600,(Kelly of the Clue Crew works out on a machine in the gym.)  I'm doing exercises to strengthen this group of four shoulder muscles; damaging it could be deadly for my pitching career,the rotator cuff,http://www.j-archive.com/media/2006-05-11_J_08.jpg
2006-05-11,J,THE NEW YORK TIMES BUSINESS,,800,This oil company with record profits of $36 billion in 2005 appears to have a gradual liquidity strategy,ExxonMobil,NA
2006-05-11,J,LOVE SONGS IN GERMAN,,800,"Stevie Wonder:""Sie Sind Der Sonnenschein Meines Lebens""","""You Are The Sunshine Of My Life""",NA
2006-05-11,J,FIRST IN OUR HEARTS,,800,"The first of these cast for a woman was Roger MacBride's, going to 1972 Libertarian V.P. candidate Theodora Nathan",an Electoral College vote,NA
2006-05-11,J,IT'S NOT ALEX TREBEK,,800,"It's not me in the photo but this man, who was second in his class at West Point in 1829",Robert E. Lee,http://www.j-archive.com/media/2006-05-11_J_17a.jpg
2006-05-11,J,SCIENCE BRIEFS,,NA,This symbol for the element mercury is downright Wellsian,Hg,NA
2006-05-11,J,"RATED ""R""",,800,Sculptor Constantin Brancusi was born in this Eastern European nation,Romania,NA
2006-05-11,J,THE NEW YORK TIMES BUSINESS,,1000,"A Times writer's ""Scandalot"" featured Maurice Greenberg, who resigned as CEO of this insurance giant",AIG,NA
2006-05-11,J,LOVE SONGS IN GERMAN,,1000,"Joe Cocker:""Sie Sind So Schon""","""You Are So Beautiful""",NA
2006-05-11,J,FIRST IN OUR HEARTS,,1000,"Having no reeds, pipes or vibrating parts, this man's 1935 organ was the first of its kind",(Laurens) Hammond,NA
2006-05-11,J,IT'S NOT ALEX TREBEK,,1000,"It's not me seen here, it's this World War II-era British politician",Neville Chamberlain,http://www.j-archive.com/media/2006-05-11_J_18a.jpg
2006-05-11,J,SCIENCE BRIEFS,,1000,"The unit of magnetic flux density, abbreviated ""T"", is named for this scientist",(Nikola) Tesla,NA
2006-05-11,J,"RATED ""R""",,1000,"(Sarah of the Clue Crew reports from in front of a statue in West Point, NY.) West Point cadets struggling academically come to spin these on General Sedwig's spurs for better luck",the rowels,http://www.j-archive.com/media/2006-05-11_J_10a.jpg
2006-05-11,DJ,WORLD CAPITALS,,400,It's served by Keflavik airport,Reykjavik,NA
2006-05-11,DJ,OFF-BROADWAY,,400,"This Baldwin brother was extremely entertaining in the 2006 revival of ""Entertaining Mr. Sloane""",Alec Baldwin,NA
2006-05-11,DJ,RIDDLE ME THIS,,400,He used the strength of his mind when he proposed a riddle to the Philistines in Judges 14,Samson,NA
2006-05-11,DJ,"""T"" BIRDS",,400,"Common species of this duck include blue-winged, green-winged & cinnamon",the teal,NA
2006-05-11,DJ,AUTHORS IN THEIR YOUTH,,400,"As a child, Joseph Conrad pointed to the center of this continent on a map & said, ""I shall go there""",Africa,NA
2006-05-11,DJ,QUOTATIONS,,400,"In 1981 he quipped, ""You can tell a lot about a fellow's character by his way of eating jellybeans""",Ronald Reagan,NA
2006-05-11,DJ,WORLD CAPITALS,,800,It has a museum devoted to composer Zoltan Kodaly,Budapest,NA
2006-05-11,DJ,OFF-BROADWAY,,800,"""Red Light Winter"" centers on a love triangle that begins in the famous Red Light District of this European city",Amsterdam,NA
2006-05-11,DJ,RIDDLE ME THIS,,800,"Sphinx: What animal walks on 4 legs in the morning, 2 at noon & 3 in the evening? Oedipus: This",man,NA
2006-05-11,DJ,"""T"" BIRDS",,800,"Toco, the largest species of this colorful bird of the American tropics, may have a 7-inch bill",a toucan,NA
2006-05-11,DJ,AUTHORS IN THEIR YOUTH,,800,Poet Gregory Corso went on the beat path after meeting this poet in a Greenwich Village bar in 1950,Allen Ginsberg,NA
2006-05-11,DJ,QUOTATIONS,,800,"In his prime this athlete said, It's hard to be humble ""when you're as great as I am""",Muhammad Ali,NA
2006-05-11,DJ,WORLD CAPITALS,,1200,It's home to the Holmenkollen ski jump,Oslo,NA
2006-05-11,DJ,OFF-BROADWAY,,1200,"We'd like to ""enlighten"" you about the musical ""Sidd""; it's based on this novel",Siddhartha,NA
2006-05-11,DJ,RIDDLE ME THIS,,1200,"He created the musical riddles called the ""Enigma Variations""",(Edward) Elgar,NA
2006-05-11,DJ,"""T"" BIRDS",,1200,"One species of this bird breeds in the Arctic tundra & ""vacations"" at the other end of the globe",a tern,NA
2006-05-11,DJ,AUTHORS IN THEIR YOUTH,,1200,In his teens he worked in an assistant D.A.'s office; later his Perry Mason character made fools of D.A.s,(Erle Stanley) Gardner,NA
2006-05-11,DJ,QUOTATIONS,,NA,"Oscar Wilde called this 4-letter word ""the curse of the drinking classes""",work,NA
2006-05-11,DJ,WORLD CAPITALS,,NA,Guyanese capital named for a Hanoverian monarch,Georgetown,NA
2006-05-11,DJ,OFF-BROADWAY,,1600,"A naughty 18th c. novel originally titled ""Memoirs of a Woman of Pleasure"" inspired the 2006 musical named for her",Fanny Hill,NA
2006-05-11,DJ,RIDDLE ME THIS,,1600,"If this riddling Belgian surrealist painter, born 1898 worked for ""Jeopardy!"", he might write, ""This is not a clue""",Magritte,NA
2006-05-11,DJ,"""T"" BIRDS",,1600,Nightingales & robins belong to this family of melodious songbirds,thrushes,NA
2006-05-11,DJ,AUTHORS IN THEIR YOUTH,,1600,Her hotsy-totsy diaries trace back to one she began as an 11-year-old aboard ship in 1914,Anaïs Nin,NA
2006-05-11,DJ,QUOTATIONS,,1600,"A motto of hers was ""in politics, if you want anything said, ask a man; if you want anything done, ask a woman""",(Margaret) Thatcher,NA
2006-05-11,DJ,WORLD CAPITALS,,2000,It's on the Suriname River,Paramaribo,NA
2006-05-11,DJ,OFF-BROADWAY,,2000,In 2006 the cast of this long-running hit embarked on an exuberant & noisy campaign to clean up New York City,Stomp,http://www.j-archive.com/media/2006-05-11_DJ_26.wmv
2006-05-11,DJ,RIDDLE ME THIS,,2000,This Puccini opera turns on the solution to 3 riddles posed by the heroine,Turandot,NA
2006-05-11,DJ,"""T"" BIRDS",,2000,"In North America this term is properly applied to only 4 species that are crested, including the tufted",a titmouse,NA
2006-05-11,DJ,AUTHORS IN THEIR YOUTH,,2000,"In Penny Lane, where this ""Hellraiser"" grew up, the barber shaves another customer--then flays him alive!",Clive Barker,NA
2006-05-11,DJ,QUOTATIONS,,2000,"From Ft. Sill, Okla. he made the plea, ""Arizona is my land, my home, my father's land, to which I now ask to... return""",Geronimo,NA
2006-05-11,FJ,HISTORIC NAMES,,NA,A silent movie title includes the last name of this 18th c. statesman & favorite of Catherine the Great,Grigori Alexandrovich Potemkin,NA
