date,round,category,comment,value,clue,response,link
2006-05-15,J,NONFICTION,,200,"""Night"" is this Nobel Peace Prize winner's account of surviving Auschwitz as a teenager",Elie Wiesel,NA
2006-05-15,J,AN ENGLISH-SPORTS DICTIONARY,,200,English: sweet glaze on a cake;hockey: shooting the puck all the way down from your own end,icing,NA
2006-05-15,J,OK COMPUTER,,200,"This ""high-flying"" computer program from Adobe converts other types of documents into a PDF file",Acrobat,NA
2006-05-15,J,CHANGE THE WORLD,,200,Seen here is a gold coin depicting this Macedonian ruler who died in 323 B.C.,Alexander the Great,http://www.j-archive.com/media/2006-05-15_J_29.jpg
2006-05-15,J,BODIES OF WATER,,200,"After Lake Superior, this African lake is the largest body of fresh water in the world",Lake Victoria,NA
2006-05-15,J,A CATEGORY OF CATEGORIES,"(Alex: And finally, a little bit of everything...)",200,RHYME TIME:Roald Dahl candy man's toy trucks,Wonka\'s Tonkas,NA
2006-05-15,J,NONFICTION,,400,"Columnist Anna Quindlen wrote ""A Short Guide to"" one of these",a Happy Life,NA
2006-05-15,J,AN ENGLISH-SPORTS DICTIONARY,,400,English: a newspaper story you saved;football: blocking below the waist from behind,clipping,NA
2006-05-15,J,OK COMPUTER,,400,"(Kelly of the Clue Crew accesses a video of Sarah of the Clue Crew scuba diving on the Jeopardy! web site from her laptop.)  A synonym for ""flowing"", it's the type of video you can watch when you visit us at jeopardy.com",streaming,http://www.j-archive.com/media/2006-05-15_J_26.jpg
2006-05-15,J,CHANGE THE WORLD,,400,"For collectors & investors, this country mints a maple leaf coin in gold & silver",Canada,NA
2006-05-15,J,BODIES OF WATER,,400,"The Persian Gulf is an arm of the Arabian Sea, which is part of this ocean",the Indian Ocean,NA
2006-05-15,J,A CATEGORY OF CATEGORIES,"(Alex: And finally, a little bit of everything...)",400,"BEFORE & AFTER:Popular ""holy"" expression about work week's end joins Jason in a 1980 horror movie",Thank God it\'s Friday the 13th,NA
2006-05-15,J,NONFICTION,,600,"Hunter S. Thompson found fear and loathing ""in Las Vegas"" & ""on"" this ""Trail"" in the title of a 1973 book",the Campaign Trail,NA
2006-05-15,J,AN ENGLISH-SPORTS DICTIONARY,,600,English: a father's coming-of-age talk with his son;basketball: the opposite of zone,man-to-man,NA
2006-05-15,J,OK COMPUTER,,600,"This popular Internet service provider began as QCS, Quantum Computer Services",AOL (America Online),NA
2006-05-15,J,CHANGE THE WORLD,,600,"The Susan Constant, Godspeed & Discovery are the ships depicted on this state's quarter",Virginia,http://www.j-archive.com/media/2006-05-15_J_22a.jpg
2006-05-15,J,BODIES OF WATER,,600,In the 1770s James Cook explored this sea between Australia & New Zealand,the Tasman Sea,NA
2006-05-15,J,A CATEGORY OF CATEGORIES,"(Alex: And finally, a little bit of everything...)",600,"14-LETTER WORDS:Secondary or incidental, it often precedes ""evidence"" in law",circumstantial,NA
2006-05-15,J,NONFICTION,,800,"Grammar is hot!  This bestseller is Lynne Truss' ""Zero Tolerance Approach to Punctuation""","Eats, Shoots & Leaves",NA
2006-05-15,J,AN ENGLISH-SPORTS DICTIONARY,,800,"(Sarah of the Clue Crew reports from the slopes of Park City, Utah while a snowboarder does a stunt.)English: the sudden seizing of something as in the power type;snowboarding: a move where you hold your board",a grab,http://www.j-archive.com/media/2006-05-15_J_08.wmv
2006-05-15,J,OK COMPUTER,,800,"From the Old English for ""clasp"" & ""table"", it's where anything you ""cut"" or ""copy"" is stored until you ""paste""",a clipboard,NA
2006-05-15,J,CHANGE THE WORLD,,800,"When this king married in 1938, Egypt issued a 100-piastre gold coin to commemorate the event",King Farouk,NA
2006-05-15,J,BODIES OF WATER,,800,This longest river in Ireland nearly divides the country in two,the Shannon,NA
2006-05-15,J,A CATEGORY OF CATEGORIES,"(Alex: And finally, a little bit of everything...)",800,"CROSSWORD CLUES ""A"":Athos' ami(6)",Aramis,NA
2006-05-15,J,NONFICTION,,1000,"Augusten Burroughs put the ""fun"" in dysfunctional with his memoir called ""Running with"" these",Scissors,NA
2006-05-15,J,AN ENGLISH-SPORTS DICTIONARY,,1000,English: a small piece of candy;golf: how you put a ball back in play after knocking your shot into a lake,a drop,NA
2006-05-15,J,OK COMPUTER,,1000,"It can be a hiding place for food or treasure, or a place for memory on a computer's motherboard",a cache,NA
2006-05-15,J,CHANGE THE WORLD,,NA,Here are the 2 new coins minted by this country in 2004,Iraq,http://www.j-archive.com/media/2006-05-15_J_23.jpg
2006-05-15,J,BODIES OF WATER,,1000,"(Cheryl of the Clue Crew reports from Tervasaari.)  Tervasaari, just off Helsinki, sits in this arm of the Baltic Sea",the Gulf of Finland,http://www.j-archive.com/media/2006-05-15_J_13a.jpg
2006-05-15,J,A CATEGORY OF CATEGORIES,"(Alex: And finally, a little bit of everything...)",1000,"""TOM"" TERRIFIC:12-letter adjective that means showing no evidence of disease",asymptomatic,NA
2006-05-15,DJ,THE ANIMAL KINGDOM,,400,"Steven Jay Gould said this animal's ""thumb"" is an enlarged wrist bone that lets it strip bamboo shoots",a panda,NA
2006-05-15,DJ,CAMEO CAMERA,,400,"He got himself into ""Lifeboat"" as the before & after in newspaper ads for Reduco the Obesity Slayer",Alfred Hitchcock,NA
2006-05-15,DJ,HISTORIC AMOURS,,400,"This Louis known as ""the Well-Beloved"" lived up to his name by romancing all 5 of the Nesle sisters",Louis XV,NA
2006-05-15,DJ,GONE TOO SOON,,400,"Heard here, he was the youngest of the 3 singers who perished in a February 1959 plane crash""Para bailar la bamba /Para bailar la bamba...""",Ritchie Valens,NA
2006-05-15,DJ,BOHEMIAN RHAPSODIES,,400,"Either of the 2 composers who in 1897 based an opera on Henri Murger's novel ""Scenes de la vie de boheme""",Puccini (or Leoncavallo),NA
2006-05-15,DJ,"THE ""GOOD"", THE ""BAD"" & THE ""UGLY""",,400,"This story says ""then he rustled his feathers, curved his slender neck, and cried joyfully""","""The Ugly Duckling""",NA
2006-05-15,DJ,THE ANIMAL KINGDOM,,800,This serpent devourer was introduced into Jamaica to kill rats--didn't work; the rats simply climbed into trees,the mongoose,NA
2006-05-15,DJ,CAMEO CAMERA,,800,"In his last role filmed on U.S. soil, this man slit Jack Nicholson's nose in ""Chinatown""",Roman Polanski,NA
2006-05-15,DJ,HISTORIC AMOURS,,800,"Johann Struensee, physician to this country's King Christian VII, was executed for romancing the queen",Denmark,NA
2006-05-15,DJ,GONE TOO SOON,,NA,"Of this athlete, Pres. Clinton said, ""We were dazzled by her speed, humbled by her talent & captivated by her style""","Florence Griffith Joyner (""Flo-Jo"")",NA
2006-05-15,DJ,BOHEMIAN RHAPSODIES,,800,"With Brahms' help, this composer's ""Moravian Duets""  & ""Slavonic Dances"" brought attention to Czech music",Dvorák,NA
2006-05-15,DJ,"THE ""GOOD"", THE ""BAD"" & THE ""UGLY""",,800,"In 1933 FDR espoused this policy in which the U.S. ""respects the rights of others""",the Good Neighbor Policy,NA
2006-05-15,DJ,THE ANIMAL KINGDOM,,1200,"This animal's 3-letter name is derived from an African word for ""black"", referring to the black wildebeest",the gnu,NA
2006-05-15,DJ,CAMEO CAMERA,,1200,You'll find Jim Lovell as the captain of the Iwo Jima in this 1995 flick,Apollo 13,NA
2006-05-15,DJ,HISTORIC AMOURS,,1200,"He may have sired several of Lady Castlemaine's children; no wonder he was ""The Merry Monarch""",Charles II,NA
2006-05-15,DJ,GONE TOO SOON,,1200,"In 1995, 33-year-old Alison Hargreaves conquered Mount Everest, only to perish months later on this 2nd-highest mountain",K2,NA
2006-05-15,DJ,BOHEMIAN RHAPSODIES,,1200,"Josef Suk arranged a meditation on an old carol about this Bohemian ""King"", the Czech patron saint","Wenceslas (""Wen\'slas"" accepted)",NA
2006-05-15,DJ,"THE ""GOOD"", THE ""BAD"" & THE ""UGLY""",,1200,This national park is about 30 miles north of Wounded Knee,Badlands,NA
2006-05-15,DJ,THE ANIMAL KINGDOM,,1600,"There are African, Japanese & fat species of this rodent that may hibernate half the year",the dormouse,NA
2006-05-15,DJ,CAMEO CAMERA,,1600,"Appropriately, she is the host at the past lives pavilion in Albert Brooks' 1991 film ""Defending Your Life""",Shirley MacLaine,NA
2006-05-15,DJ,HISTORIC AMOURS,,1600,This Parisian actress born in 1844 counted Victor Hugo & the future Edward VII among her lovers,Sarah Bernhardt,NA
2006-05-15,DJ,GONE TOO SOON,,1600,"Michael Jackson's song ""Gone Too Soon"" was a tribute to this Indiana teen who died of AIDS in 1990",Ryan White,NA
2006-05-15,DJ,BOHEMIAN RHAPSODIES,,1600,"In this Smetana opera, Kecal the marriage broker tries to bribe Jenik to give up his true love",The Bartered Bride,NA
2006-05-15,DJ,"THE ""GOOD"", THE ""BAD"" & THE ""UGLY""",,NA,A mischievous sprite in English folklore also called Puck,Robin Goodfellow,NA
2006-05-15,DJ,THE ANIMAL KINGDOM,,2000,Canada has made this arctic bovine a protected species,the musk ox,NA
2006-05-15,DJ,CAMEO CAMERA,,2000,"This comic's cameo in 1985's ""Spies Like Us"" involved him playing golf in a tent & was his last movie role",Bob Hope,NA
2006-05-15,DJ,HISTORIC AMOURS,,2000,"Robert Devereux, the Earl of this, succeeded his stepfather the Earl of Leicester as Elizabeth I's ""favorite""",Essex,NA
2006-05-15,DJ,GONE TOO SOON,,2000,"(Cheryl of the Clue Crew reports from the JFK Library & Museum in Boston, MA.)  The Oval Office was a place of sorrow when President Kennedy heard of the death of this Congolese leader in early 1961",(Patrice) Lumumba,http://www.j-archive.com/media/2006-05-15_DJ_17a.jpg
2006-05-15,DJ,BOHEMIAN RHAPSODIES,,2000,"Also a Yul Brynner film, this Janacek piece came from a Gogol tale of a Cossack who revolts against the Poles",Taras Bulba,NA
2006-05-15,DJ,"THE ""GOOD"", THE ""BAD"" & THE ""UGLY""",,2000,"This hyphenated Black Forest town has hot springs that the Romans built 2,000 years ago",Baden-Baden,NA
2006-05-15,FJ,MYTHOLOGY,,NA,"The name of this monster is from the Greek for ""she-goat""",the Chimera,NA
